Subreddit_ID,Subreddit_Name,Submission_ID,Submission_CreatedDate,Submission_Title,Submission_URL,Submission_LastFetched,Submission_NumComments,Submission_Score,Submission_UpvoteRatio
2qjfk,stocks,m78mi2,2021-03-17 19:35,What did you think of Powell’s speech today?,https://www.reddit.com/r/stocks/comments/m78mi2/what_did_you_think_of_powells_speech_today/,2021-03-29 19:27,208,125,0.95
2qjfk,stocks,m78xvu,2021-03-17 19:49,Hypothetical Situation: where to place 100K in a stock market crash,https://www.reddit.com/r/stocks/comments/m78xvu/hypothetical_situation_where_to_place_100k_in_a/,2021-03-29 19:27,121,47,0.83
2qjfk,stocks,m7981z,2021-03-17 20:02,Apple Car – signs for a Coop AAPL and BMW?,https://www.reddit.com/r/stocks/comments/m7981z/apple_car_signs_for_a_coop_aapl_and_bmw/,2021-03-29 19:27,21,23,0.86
2qjfk,stocks,m79lba,2021-03-17 20:18,What to hold in the next months?,https://www.reddit.com/r/stocks/comments/m79lba/what_to_hold_in_the_next_months/,2021-03-29 19:27,30,12,0.74
2qjfk,stocks,m7a24f,2021-03-17 20:39,Taxes on short term capital gains question,https://www.reddit.com/r/stocks/comments/m7a24f/taxes_on_short_term_capital_gains_question/,2021-03-29 19:27,20,5,0.69
2qjfk,stocks,m7abg6,2021-03-17 20:50,"Here is a Market Recap for today Wednesday, March 17, 2021",https://www.reddit.com/r/stocks/comments/m7abg6/here_is_a_market_recap_for_today_wednesday_march/,2021-03-29 19:27,21,214,0.98
2qjfk,stocks,m7ac2w,2021-03-17 20:51,Want to move out of Robinhood. Not sure which to pick between Fidelity and Vanguard. Any help?,https://www.reddit.com/r/stocks/comments/m7ac2w/want_to_move_out_of_robinhood_not_sure_which_to/,2021-03-29 19:27,38,1,0.56
2qjfk,stocks,m7ac50,2021-03-17 20:51,Basic DD on Nano Dimensions and why it has major long term potential,https://www.reddit.com/r/stocks/comments/m7ac50/basic_dd_on_nano_dimensions_and_why_it_has_major/,2021-03-29 19:27,34,44,0.87
2qjfk,stocks,m7b0ta,2021-03-17 21:21,$BB 3/17/2021 - Green on St Patties Day,https://www.reddit.com/r/stocks/comments/m7b0ta/bb_3172021_green_on_st_patties_day/,2021-03-29 19:27,37,146,0.84
2qjfk,stocks,m7b4xn,2021-03-17 21:27,"Isn’t exponential consistent growth, with no exception of index funds, unsustainable?",https://www.reddit.com/r/stocks/comments/m7b4xn/isnt_exponential_consistent_growth_with_no/,2021-03-29 19:27,25,14,0.7
2qjfk,stocks,m7bsyw,2021-03-17 21:57,Toyota Motors (TM) is a buy,https://www.reddit.com/r/stocks/comments/m7bsyw/toyota_motors_tm_is_a_buy/,2021-03-29 19:27,55,25,0.74
2qjfk,stocks,m7dhpq,2021-03-17 23:18,Just increased my positions in Big Tobacco.,https://www.reddit.com/r/stocks/comments/m7dhpq/just_increased_my_positions_in_big_tobacco/,2021-03-29 19:27,45,16,0.67
2qjfk,stocks,m7dq27,2021-03-17 23:30,How did people realize ARK funds have fundamental problems only after discovering Cathie's interview about religion?,https://www.reddit.com/r/stocks/comments/m7dq27/how_did_people_realize_ark_funds_have_fundamental/,2021-03-29 19:27,43,1,0.51
2qjfk,stocks,m7e76u,2021-03-17 23:55,Now is a great opportunity to go long $TLT,https://www.reddit.com/r/stocks/comments/m7e76u/now_is_a_great_opportunity_to_go_long_tlt/,2021-03-29 19:27,114,52,0.78
2qjfk,stocks,m7e9do,2021-03-17 23:59,What happened at 2pm today to cause the market to flip?,https://www.reddit.com/r/stocks/comments/m7e9do/what_happened_at_2pm_today_to_cause_the_market_to/,2021-03-29 19:27,47,36,0.74
2qjfk,stocks,m7enz7,2021-03-18 00:20,Hydrogen stocks,https://www.reddit.com/r/stocks/comments/m7enz7/hydrogen_stocks/,2021-03-29 19:27,115,65,0.86
2qjfk,stocks,m7f4h7,2021-03-18 00:44,Hindenburg Research is about to get taken for a $RIDE,https://www.reddit.com/r/stocks/comments/m7f4h7/hindenburg_research_is_about_to_get_taken_for_a/,2021-03-29 19:27,438,460,0.74
2qjfk,stocks,m7f92f,2021-03-18 00:51,"Just an interesting fact, 120 million shares traded hands on PLUG today",https://www.reddit.com/r/stocks/comments/m7f92f/just_an_interesting_fact_120_million_shares/,2021-03-29 19:27,25,21,0.85
2qjfk,stocks,m7fhx3,2021-03-18 01:04,CAT (Caterpillar) DD?,https://www.reddit.com/r/stocks/comments/m7fhx3/cat_caterpillar_dd/,2021-03-29 19:27,25,22,0.87
2qjfk,stocks,m7ggs3,2021-03-18 01:57,Cramer on Plug Power's stock drop: 'I still long-term believe in it',https://www.reddit.com/r/stocks/comments/m7ggs3/cramer_on_plug_powers_stock_drop_i_still_longterm/,2021-03-29 19:27,47,27,0.68
2qjfk,stocks,m7h2gz,2021-03-18 02:31,Seeking advice: Looking to expand my portfolio,https://www.reddit.com/r/stocks/comments/m7h2gz/seeking_advice_looking_to_expand_my_portfolio/,2021-03-29 19:27,33,14,0.86
2qjfk,stocks,m7id8j,2021-03-18 03:47,Why you shouldn’t use Robinhood,https://www.reddit.com/r/stocks/comments/m7id8j/why_you_shouldnt_use_robinhood/,2021-03-29 19:27,1234,7333,0.91
2qjfk,stocks,m7jrbi,2021-03-18 05:14,DD: BEST VALUE THIS YEAR,https://www.reddit.com/r/stocks/comments/m7jrbi/dd_best_value_this_year/,2021-03-29 19:27,27,6,0.55
2qjfk,stocks,m7kj1b,2021-03-18 06:10,Margin vs cash,https://www.reddit.com/r/stocks/comments/m7kj1b/margin_vs_cash/,2021-03-29 19:27,31,4,0.7
2qjfk,stocks,m7kybq,2021-03-18 06:42,"The Walt Disney Company, a multi-sector play $DIS",https://www.reddit.com/r/stocks/comments/m7kybq/the_walt_disney_company_a_multisector_play_dis/,2021-03-29 19:27,27,54,0.91
2qjfk,stocks,m7lohi,2021-03-18 07:37,I sold this stock and I dont know if it was the right thing to do,https://www.reddit.com/r/stocks/comments/m7lohi/i_sold_this_stock_and_i_dont_know_if_it_was_the/,2021-03-29 19:27,31,0,0.5
2qjfk,stocks,m7luo8,2021-03-18 07:51,Has the Volks Wagen left the Station?,https://www.reddit.com/r/stocks/comments/m7luo8/has_the_volks_wagen_left_the_station/,2021-03-29 19:27,27,9,0.72
2qjfk,stocks,m7m7dt,2021-03-18 08:18,"Physical share question- brokerage says they ""don't do that""",https://www.reddit.com/r/stocks/comments/m7m7dt/physical_share_question_brokerage_says_they_dont/,2021-03-29 19:27,21,8,1.0
2qjfk,stocks,m7maov,2021-03-18 08:25,"Looks like a big institutional sell off today and friday. Guys, please do not get value trapped!",https://www.reddit.com/r/stocks/comments/m7maov/looks_like_a_big_institutional_sell_off_today_and/,2021-03-29 19:27,29,0,0.33
2qjfk,stocks,m7n04b,2021-03-18 09:20,"r/Stocks Daily Thread on Meme Stocks Thursday - Mar 18, 2021",https://www.reddit.com/r/stocks/comments/m7n04b/rstocks_daily_thread_on_meme_stocks_thursday_mar/,2021-03-29 19:27,217,27,0.91
2qjfk,stocks,m7n4pc,2021-03-18 09:30,"r/Stocks Daily Discussion & Options Trading Thursday - Mar 18, 2021",https://www.reddit.com/r/stocks/comments/m7n4pc/rstocks_daily_discussion_options_trading_thursday/,2021-03-29 19:27,1803,74,0.97
2qjfk,stocks,m7nhcb,2021-03-18 09:57,How soon would ARK have to liquidate its holdings upon investor outflow?,https://www.reddit.com/r/stocks/comments/m7nhcb/how_soon_would_ark_have_to_liquidate_its_holdings/,2021-03-29 19:27,33,0,0.41
2qjfk,stocks,m7o88w,2021-03-18 10:52,At what point you felt your portfolio started to take off?,https://www.reddit.com/r/stocks/comments/m7o88w/at_what_point_you_felt_your_portfolio_started_to/,2021-03-29 19:27,85,37,0.91
2qjfk,stocks,m7ot9m,2021-03-18 11:32,Corsair ($CRSR) lockup periods ends March 22,https://www.reddit.com/r/stocks/comments/m7ot9m/corsair_crsr_lockup_periods_ends_march_22/,2021-03-29 19:27,26,23,0.94
2qjfk,stocks,m7pbar,2021-03-18 12:04,AstraZeneca vaccine - Norwegian scientists found connection to blood clots,https://www.reddit.com/r/stocks/comments/m7pbar/astrazeneca_vaccine_norwegian_scientists_found/,2021-03-29 19:27,117,68,0.76
2qjfk,stocks,m7ppir,2021-03-18 12:27,Really surprised by all the misinformation on here.,https://www.reddit.com/r/stocks/comments/m7ppir/really_surprised_by_all_the_misinformation_on_here/,2021-03-29 19:27,509,606,0.88
2qjfk,stocks,m7ptl2,2021-03-18 12:34,"Is it just me, or does premarket seem to open lower than market open lately?",https://www.reddit.com/r/stocks/comments/m7ptl2/is_it_just_me_or_does_premarket_seem_to_open/,2021-03-29 19:27,21,4,0.65
2qjfk,stocks,m7q4jj,2021-03-18 12:51,Tilray’s (TLRY) Acquisition of Aphria (APHA) Share Exchange Rate Explanation,https://www.reddit.com/r/stocks/comments/m7q4jj/tilrays_tlry_acquisition_of_aphria_apha_share/,2021-03-29 19:27,42,25,0.82
2qjfk,stocks,m7qyyy,2021-03-18 13:37,NVIDIA - $NVDA is a great long term investment,https://www.reddit.com/r/stocks/comments/m7qyyy/nvidia_nvda_is_a_great_long_term_investment/,2021-03-29 19:27,69,99,0.83
2qjfk,stocks,m7slgz,2021-03-18 14:56,Which stocks do you feel are at a discount right now?,https://www.reddit.com/r/stocks/comments/m7slgz/which_stocks_do_you_feel_are_at_a_discount_right/,2021-03-29 19:27,49,7,0.71
2qjfk,stocks,m7tn9w,2021-03-18 15:44,Followup to the Stock Scraper Analysis from yesterday (03/17/21),https://www.reddit.com/r/stocks/comments/m7tn9w/followup_to_the_stock_scraper_analysis_from/,2021-03-29 19:27,25,61,0.96
2qjfk,stocks,m7u6yc,2021-03-18 16:08,I need some advice and opinions on my “poor” stock decisions I have made so far.,https://www.reddit.com/r/stocks/comments/m7u6yc/i_need_some_advice_and_opinions_on_my_poor_stock/,2021-03-29 19:27,41,7,0.77
2qjfk,stocks,m7uh2n,2021-03-18 16:20,"If You Had $50,000 What Would You Invest In To Make It $1,000,000?",https://www.reddit.com/r/stocks/comments/m7uh2n/if_you_had_50000_what_would_you_invest_in_to_make/,2021-03-29 19:27,141,23,0.69
2qjfk,stocks,m7uhy1,2021-03-18 16:21,VW: By far the safest EV play?,https://www.reddit.com/r/stocks/comments/m7uhy1/vw_by_far_the_safest_ev_play/,2021-03-29 19:27,76,35,0.79
2qjfk,stocks,m7uje6,2021-03-18 16:23,"If you like to play long-term, PLTR under 26 is a good steal",https://www.reddit.com/r/stocks/comments/m7uje6/if_you_like_to_play_longterm_pltr_under_26_is_a/,2021-03-29 19:27,270,187,0.69
2qjfk,stocks,m7vh8p,2021-03-18 17:03,Why the fuck are my friends being told to buy bonds. Btw their in their 20s,https://www.reddit.com/r/stocks/comments/m7vh8p/why_the_fuck_are_my_friends_being_told_to_buy/,2021-03-29 19:27,89,44,0.81
2qjfk,stocks,m7w4mr,2021-03-18 17:32,Brokerage apps besides RH and WeBull?,https://www.reddit.com/r/stocks/comments/m7w4mr/brokerage_apps_besides_rh_and_webull/,2021-03-29 19:27,31,10,0.81
2qjfk,stocks,m7xpc7,2021-03-18 18:41,Investing in pre IPO companies,https://www.reddit.com/r/stocks/comments/m7xpc7/investing_in_pre_ipo_companies/,2021-03-29 19:27,21,4,0.67
2qjfk,stocks,m7xtxu,2021-03-18 18:47,Plug power update.,https://www.reddit.com/r/stocks/comments/m7xtxu/plug_power_update/,2021-03-29 19:27,41,22,0.82
2qjfk,stocks,m7yebl,2021-03-18 19:12,Why do people always seem to be saying the market will crash soon?,https://www.reddit.com/r/stocks/comments/m7yebl/why_do_people_always_seem_to_be_saying_the_market/,2021-03-29 19:27,162,92,0.87
2qjfk,stocks,m7ylen,2021-03-18 19:22,"I’ve got to admit, ever since I started investing, my life has been a lot more exciting.",https://www.reddit.com/r/stocks/comments/m7ylen/ive_got_to_admit_ever_since_i_started_investing/,2021-03-29 19:27,243,1517,0.97
2qjfk,stocks,m7ze7r,2021-03-18 20:04,Just maxed my ROTH IRA. Now what?,https://www.reddit.com/r/stocks/comments/m7ze7r/just_maxed_my_roth_ira_now_what/,2021-03-29 19:27,42,16,0.82
2qjfk,stocks,m7zt5t,2021-03-18 20:24,Intel (INTC) Could Double with Long-Delayed GPU Entrance,https://www.reddit.com/r/stocks/comments/m7zt5t/intel_intc_could_double_with_longdelayed_gpu/,2021-03-29 19:27,20,19,0.87
2qjfk,stocks,m7zuge,2021-03-18 20:26,MP Materials is a stock everyone needs to be aware of,https://www.reddit.com/r/stocks/comments/m7zuge/mp_materials_is_a_stock_everyone_needs_to_be/,2021-03-29 19:27,59,45,0.89
2qjfk,stocks,m806na,2021-03-18 20:41,You're selling and someone else is buying - The stock market is silly,https://www.reddit.com/r/stocks/comments/m806na/youre_selling_and_someone_else_is_buying_the/,2021-03-29 19:27,231,159,0.81
2qjfk,stocks,m80afu,2021-03-18 20:46,"Here is a Market Recap for today Thursday, March 18, 2021",https://www.reddit.com/r/stocks/comments/m80afu/here_is_a_market_recap_for_today_thursday_march/,2021-03-29 19:27,35,66,0.94
2qjfk,stocks,m81a05,2021-03-18 21:31,Previous Day Premarket Movers,https://www.reddit.com/r/stocks/comments/m81a05/previous_day_premarket_movers/,2021-03-29 19:27,21,7,1.0
2qjfk,stocks,m81rlu,2021-03-18 21:55,"Where are those who were around for the 2008 ""crash"" and do you remember the recovery sentiment?",https://www.reddit.com/r/stocks/comments/m81rlu/where_are_those_who_were_around_for_the_2008/,2021-03-29 19:27,79,85,0.91
2qjfk,stocks,m8224f,2021-03-18 22:08,Anyone else seeing red today? It ain't the booze from last night,https://www.reddit.com/r/stocks/comments/m8224f/anyone_else_seeing_red_today_it_aint_the_booze/,2021-03-29 19:27,68,36,0.82
2qjfk,stocks,m825mn,2021-03-18 22:12,Oil companies are extremely undervalued and is a perfect contrarian investment.,https://www.reddit.com/r/stocks/comments/m825mn/oil_companies_are_extremely_undervalued_and_is_a/,2021-03-29 19:27,21,9,0.64
2qjfk,stocks,m83i5g,2021-03-18 23:15,Yeezy x Gap Investment Thoughts?,https://www.reddit.com/r/stocks/comments/m83i5g/yeezy_x_gap_investment_thoughts/,2021-03-29 19:27,20,0,0.36
2qjfk,stocks,m83ktq,2021-03-18 23:19,Next 3 Month,https://www.reddit.com/r/stocks/comments/m83ktq/next_3_month/,2021-03-29 19:27,30,0,0.45
2qjfk,stocks,m83v0p,2021-03-18 23:33,SKLZ - A Rising Esports Giant (DD),https://www.reddit.com/r/stocks/comments/m83v0p/sklz_a_rising_esports_giant_dd/,2021-03-29 19:27,22,32,0.81
2qjfk,stocks,m843qi,2021-03-18 23:45,What do you think of TSLA @ $610,https://www.reddit.com/r/stocks/comments/m843qi/what_do_you_think_of_tsla_610/,2021-03-29 19:27,99,22,0.83
2qjfk,stocks,m84e3r,2021-03-18 23:59,Why do REIT's always suck?,https://www.reddit.com/r/stocks/comments/m84e3r/why_do_reits_always_suck/,2021-03-29 19:27,26,0,0.5
2qjfk,stocks,m84fqx,2021-03-19 00:01,How is the 10yr treasury note tied to inflation?,https://www.reddit.com/r/stocks/comments/m84fqx/how_is_the_10yr_treasury_note_tied_to_inflation/,2021-03-29 19:27,34,29,0.85
2qjfk,stocks,m84wor,2021-03-19 00:26,What's up with PLUG?,https://www.reddit.com/r/stocks/comments/m84wor/whats_up_with_plug/,2021-03-29 19:27,32,10,0.81
2qjfk,stocks,m84zn3,2021-03-19 00:30,Why I bought Motley Fool and why I hate fool,https://www.reddit.com/r/stocks/comments/m84zn3/why_i_bought_motley_fool_and_why_i_hate_fool/,2021-03-29 19:27,27,12,0.67
2qjfk,stocks,m853xz,2021-03-19 00:36,Any tax consequences for high volune trading?,https://www.reddit.com/r/stocks/comments/m853xz/any_tax_consequences_for_high_volune_trading/,2021-03-29 19:27,31,2,0.54
2qjfk,stocks,m85lj3,2021-03-19 01:02,What to do in times when you do not find undervalued stocks?,https://www.reddit.com/r/stocks/comments/m85lj3/what_to_do_in_times_when_you_do_not_find/,2021-03-29 19:27,45,13,0.94
2qjfk,stocks,m85myr,2021-03-19 01:04,$RIDE - hindenberg report might be on to something - no real-world testing and delivery in 6 months???,https://www.reddit.com/r/stocks/comments/m85myr/ride_hindenberg_report_might_be_on_to_something/,2021-03-29 19:27,31,25,0.84
2qjfk,stocks,m85sp6,2021-03-19 01:13,List of books to read if you want to actually become knowledgeable about stocks and not stay a normie who doesn't know what they're doing,https://www.reddit.com/r/stocks/comments/m85sp6/list_of_books_to_read_if_you_want_to_actually/,2021-03-29 19:27,498,9113,0.96
2qjfk,stocks,m85w68,2021-03-19 01:18,"Keep an eye on VW, QS, and TSLA",https://www.reddit.com/r/stocks/comments/m85w68/keep_an_eye_on_vw_qs_and_tsla/,2021-03-29 19:26,81,16,0.73
2qjfk,stocks,m86feo,2021-03-19 01:47,Help me reallocate,https://www.reddit.com/r/stocks/comments/m86feo/help_me_reallocate/,2021-03-29 19:26,36,9,0.85
2qjfk,stocks,m86wds,2021-03-19 02:13,Can I make an app with stocks I think are undervalued? Is it illegal to do so?,https://www.reddit.com/r/stocks/comments/m86wds/can_i_make_an_app_with_stocks_i_think_are/,2021-03-29 19:26,30,15,0.72
2qjfk,stocks,m884j4,2021-03-19 03:23,The 10 year and its effect on markets,https://www.reddit.com/r/stocks/comments/m884j4/the_10_year_and_its_effect_on_markets/,2021-03-29 19:26,30,13,0.88
2qjfk,stocks,m89u5g,2021-03-19 05:07,How come Google/Alphabet doesn't play a large role in any of the major Tech etfs?,https://www.reddit.com/r/stocks/comments/m89u5g/how_come_googlealphabet_doesnt_play_a_large_role/,2021-03-29 19:26,28,14,0.83
2qjfk,stocks,m8d7lv,2021-03-19 09:08,The first people are starting to sell out..,https://www.reddit.com/r/stocks/comments/m8d7lv/the_first_people_are_starting_to_sell_out/,2021-03-29 19:26,151,179,0.84
2qjfk,stocks,m8ddjm,2021-03-19 09:20,"r/Stocks Daily Thread on Meme Stocks Friday - Mar 19, 2021",https://www.reddit.com/r/stocks/comments/m8ddjm/rstocks_daily_thread_on_meme_stocks_friday_mar_19/,2021-03-29 19:26,295,36,0.9
2qjfk,stocks,m8dibn,2021-03-19 09:30,"r/Stocks Daily Discussion & Fundamentals Friday Mar 19, 2021",https://www.reddit.com/r/stocks/comments/m8dibn/rstocks_daily_discussion_fundamentals_friday_mar/,2021-03-29 19:26,1671,71,0.93
2qjfk,stocks,m8fk2y,2021-03-19 11:53,Tesla Cars Banned by China’s Military on Concerns About Cameras,https://www.reddit.com/r/stocks/comments/m8fk2y/tesla_cars_banned_by_chinas_military_on_concerns/,2021-03-29 19:26,211,590,0.95
2qjfk,stocks,m8g5f8,2021-03-19 12:28,Peloton (PTON) DD and Analysis,https://www.reddit.com/r/stocks/comments/m8g5f8/peloton_pton_dd_and_analysis/,2021-03-29 19:26,82,56,0.88
2qjfk,stocks,m8ghu0,2021-03-19 12:48,SEC Pattern Day Trading Rules (Cash Accounts vs. Margin Accounts),https://www.reddit.com/r/stocks/comments/m8ghu0/sec_pattern_day_trading_rules_cash_accounts_vs/,2021-03-29 19:26,35,19,0.89
2qjfk,stocks,m8gsqs,2021-03-19 13:04,Anyone know why Vwagy is dropping so much?,https://www.reddit.com/r/stocks/comments/m8gsqs/anyone_know_why_vwagy_is_dropping_so_much/,2021-03-29 19:26,21,5,0.67
2qjfk,stocks,m8gss3,2021-03-19 13:04,FED is not extending Bank Leverage Ratio,https://www.reddit.com/r/stocks/comments/m8gss3/fed_is_not_extending_bank_leverage_ratio/,2021-03-29 19:26,42,48,0.88
2qjfk,stocks,m8i1un,2021-03-19 14:08,Can dollar cost averaging beat a bear market?,https://www.reddit.com/r/stocks/comments/m8i1un/can_dollar_cost_averaging_beat_a_bear_market/,2021-03-29 19:26,37,19,0.8
2qjfk,stocks,m8iqnl,2021-03-19 14:42,Huge potential on CLVS,https://www.reddit.com/r/stocks/comments/m8iqnl/huge_potential_on_clvs/,2021-03-29 19:26,20,34,0.82
2qjfk,stocks,m8j177,2021-03-19 14:56,Is it just me or do fears of market problems cause more downward movement than the actual problems?,https://www.reddit.com/r/stocks/comments/m8j177/is_it_just_me_or_do_fears_of_market_problems/,2021-03-29 19:26,560,3868,0.96
2qjfk,stocks,m8joi1,2021-03-19 15:26,Unbias Stock Scraper Data Analysis 03/19/21,https://www.reddit.com/r/stocks/comments/m8joi1/unbias_stock_scraper_data_analysis_031921/,2021-03-29 19:26,31,22,0.91
2qjfk,stocks,m8k0yn,2021-03-19 15:42,On RED DAYS: Take a moment and think GREEN. Mental Health is critical.,https://www.reddit.com/r/stocks/comments/m8k0yn/on_red_days_take_a_moment_and_think_green_mental/,2021-03-29 19:26,94,346,0.93
2qjfk,stocks,m8k98t,2021-03-19 15:52,Should I be concerned with wash sales the way I trade?,https://www.reddit.com/r/stocks/comments/m8k98t/should_i_be_concerned_with_wash_sales_the_way_i/,2021-03-29 19:26,21,5,0.86
2qjfk,stocks,m8lnuf,2021-03-19 16:56,S&P 500 PE ratio without Tesla,https://www.reddit.com/r/stocks/comments/m8lnuf/sp_500_pe_ratio_without_tesla/,2021-03-29 19:26,27,10,0.86
2qjfk,stocks,m8lu7n,2021-03-19 17:04,I put $500 into the market for the first time yesterday. Tell me how garbage my positions/logic are.,https://www.reddit.com/r/stocks/comments/m8lu7n/i_put_500_into_the_market_for_the_first_time/,2021-03-29 19:26,110,111,0.84
2qjfk,stocks,m8m9g2,2021-03-19 17:23,How does this make sense. If everyone knows that there is an upcoming bear market we would already be in one.,https://www.reddit.com/r/stocks/comments/m8m9g2/how_does_this_make_sense_if_everyone_knows_that/,2021-03-29 19:26,30,4,0.59
2qjfk,stocks,m8n43t,2021-03-19 18:02,Index funds and future value of investment,https://www.reddit.com/r/stocks/comments/m8n43t/index_funds_and_future_value_of_investment/,2021-03-29 19:26,55,0,0.43
2qjfk,stocks,m8ndms,2021-03-19 18:13,Why is volume so low today?,https://www.reddit.com/r/stocks/comments/m8ndms/why_is_volume_so_low_today/,2021-03-29 19:26,21,3,0.62
2qjfk,stocks,m8oic5,2021-03-19 19:06,The stock market has nothing to do with the economy.,https://www.reddit.com/r/stocks/comments/m8oic5/the_stock_market_has_nothing_to_do_with_the/,2021-03-29 19:26,21,4,0.55
2qjfk,stocks,m8pcuo,2021-03-19 19:46,Are we headed for a heavy correction?,https://www.reddit.com/r/stocks/comments/m8pcuo/are_we_headed_for_a_heavy_correction/,2021-03-29 19:26,27,2,0.53
2qjfk,stocks,m8pws8,2021-03-19 20:11,Is it foolish of me to blindly invest in a Blue-Chip as a total novice?,https://www.reddit.com/r/stocks/comments/m8pws8/is_it_foolish_of_me_to_blindly_invest_in_a/,2021-03-29 19:26,59,7,0.71
2qjfk,stocks,m8qrm1,2021-03-19 20:51,Large volume spike in last minute candle?,https://www.reddit.com/r/stocks/comments/m8qrm1/large_volume_spike_in_last_minute_candle/,2021-03-29 19:26,28,25,0.89
2qjfk,stocks,m8tj0f,2021-03-19 22:58,DD on RFP: A lumber value play poised to have its best Q earnings in a decade due to surge in lumber prices.,https://www.reddit.com/r/stocks/comments/m8tj0f/dd_on_rfp_a_lumber_value_play_poised_to_have_its/,2021-03-29 19:26,36,32,0.93
2qjfk,stocks,m8tkm8,2021-03-19 23:00,Vuzix ($VUZI) DD,https://www.reddit.com/r/stocks/comments/m8tkm8/vuzix_vuzi_dd/,2021-03-29 19:26,24,46,0.87
2qjfk,stocks,m8ukjr,2021-03-19 23:50,GAW (Warhammer) & Cineworld Group DD (X-posted from r/investing),https://www.reddit.com/r/stocks/comments/m8ukjr/gaw_warhammer_cineworld_group_dd_xposted_from/,2021-03-29 19:26,26,31,0.89
2qjfk,stocks,m8upum,2021-03-19 23:58,Are companies that short really just a Wolf?,https://www.reddit.com/r/stocks/comments/m8upum/are_companies_that_short_really_just_a_wolf/,2021-03-29 19:26,31,14,0.74
2qjfk,stocks,m8w4vk,2021-03-20 01:13,Recommendations for ETFs or mutual funds that are light on tech?,https://www.reddit.com/r/stocks/comments/m8w4vk/recommendations_for_etfs_or_mutual_funds_that_are/,2021-03-29 19:26,21,11,0.84
2qjfk,stocks,m8xdbm,2021-03-20 02:21,WSJ reports on Visa ($V) antitrust probe. Real concern or good time to buy?,https://www.reddit.com/r/stocks/comments/m8xdbm/wsj_reports_on_visa_v_antitrust_probe_real/,2021-03-29 19:26,65,48,0.97
2qjfk,stocks,m8xs17,2021-03-20 02:45,ARK: Tesla 2025 Price Target Update,https://www.reddit.com/r/stocks/comments/m8xs17/ark_tesla_2025_price_target_update/,2021-03-29 19:26,329,156,0.92
2qjfk,stocks,m8yeww,2021-03-20 03:23,"Ocasio-Cortez, Warren introduce bill to put $500 billion toward electric public transit",https://www.reddit.com/r/stocks/comments/m8yeww/ocasiocortez_warren_introduce_bill_to_put_500/,2021-03-29 19:26,282,528,0.89
2qjfk,stocks,m8zo7i,2021-03-20 04:40,Could AMZN be in 2050 what KO is to investors today,https://www.reddit.com/r/stocks/comments/m8zo7i/could_amzn_be_in_2050_what_ko_is_to_investors/,2021-03-29 19:26,26,3,0.67
2qjfk,stocks,m9150u,2021-03-20 06:16,How much cash should you have reserved to buy the dip? What do you do when you have no more to buy those dips?,https://www.reddit.com/r/stocks/comments/m9150u/how_much_cash_should_you_have_reserved_to_buy_the/,2021-03-29 19:26,60,30,0.79
2qjfk,stocks,m918qt,2021-03-20 06:24,Coinbase’s Direct Listing Pushed Back to April,https://www.reddit.com/r/stocks/comments/m918qt/coinbases_direct_listing_pushed_back_to_april/,2021-03-29 19:26,33,22,0.9
2qjfk,stocks,m91plk,2021-03-20 07:01,Best way to insulate myself from upcoming crash while maximizing gains?,https://www.reddit.com/r/stocks/comments/m91plk/best_way_to_insulate_myself_from_upcoming_crash/,2021-03-29 19:26,64,0,0.45
2qjfk,stocks,m9273m,2021-03-20 07:40,"A couple of hypotheticals about a private individual investing on a relative's behalf, without professional financial advisors or dependency",https://www.reddit.com/r/stocks/comments/m9273m/a_couple_of_hypotheticals_about_a_private/,2021-03-29 19:26,22,13,0.89
2qjfk,stocks,m93gtj,2021-03-20 09:20,"r/Stocks Daily Thread on Meme Stocks Saturday - Mar 20, 2021",https://www.reddit.com/r/stocks/comments/m93gtj/rstocks_daily_thread_on_meme_stocks_saturday_mar/,2021-03-29 19:26,91,20,0.83
2qjfk,stocks,m93hjx,2021-03-20 09:21,Degiro €2.5K “cash” limit,https://www.reddit.com/r/stocks/comments/m93hjx/degiro_25k_cash_limit/,2021-03-29 19:26,24,9,0.77
2qjfk,stocks,m94vgz,2021-03-20 11:07,Elon Musk denies Teslas used for spying,https://www.reddit.com/r/stocks/comments/m94vgz/elon_musk_denies_teslas_used_for_spying/,2021-03-29 19:26,38,42,0.81
2qjfk,stocks,m970mg,2021-03-20 13:26,"Wall Street Week Ahead for the trading week beginning March 22nd, 2021",https://www.reddit.com/r/stocks/comments/m970mg/wall_street_week_ahead_for_the_trading_week/,2021-03-29 19:26,62,214,0.94
2qjfk,stocks,m979ys,2021-03-20 13:41,EV plays (ETFs/stocks),https://www.reddit.com/r/stocks/comments/m979ys/ev_plays_etfsstocks/,2021-03-29 19:26,37,13,0.88
2qjfk,stocks,m97p0f,2021-03-20 14:05,V and MA - DOJ Probe,https://www.reddit.com/r/stocks/comments/m97p0f/v_and_ma_doj_probe/,2021-03-29 19:26,23,16,0.88
2qjfk,stocks,m98s8p,2021-03-20 15:03,POWW worth buying and holding,https://www.reddit.com/r/stocks/comments/m98s8p/poww_worth_buying_and_holding/,2021-03-29 19:26,39,14,0.74
2qjfk,stocks,m99wgz,2021-03-20 16:00,"Treasury Bonds, why should we care?",https://www.reddit.com/r/stocks/comments/m99wgz/treasury_bonds_why_should_we_care/,2021-03-29 19:26,57,67,0.9
2qjfk,stocks,m9anh7,2021-03-20 16:37,Can we talk about the volume at the close on Friday?,https://www.reddit.com/r/stocks/comments/m9anh7/can_we_talk_about_the_volume_at_the_close_on/,2021-03-29 19:26,31,23,0.77
