Subreddit_ID,Subreddit_Name,Submission_ID,Submission_CreatedDate,Submission_Title,Submission_URL,Submission_LastFetched,Submission_NumComments,Submission_Score,Submission_UpvoteRatio
2qhhq,investing,kxwxds,2021-01-15 15:37,"For those that use Fidelity: is Active Trader Pro worth the learning curve, or is it better to do your research on websites with more modern, clean UIs (ex. tradingview) ?",https://www.reddit.com/r/investing/comments/kxwxds/for_those_that_use_fidelity_is_active_trader_pro/,2021-01-20 21:12,22,68,0.88
2qhhq,investing,ky0e3m,2021-01-15 18:20,Why is Warren Buffet considered a great investor when a simple Nasdaq index fund performed better then Berkshire Hathaway?,https://www.reddit.com/r/investing/comments/ky0e3m/why_is_warren_buffet_considered_a_great_investor/,2021-01-20 21:12,100,0,0.47
2qhhq,investing,ky0qaa,2021-01-15 18:36,Making the case for Target Corp ($TGT)?,https://www.reddit.com/r/investing/comments/ky0qaa/making_the_case_for_target_corp_tgt/,2021-01-20 21:12,42,9,0.7
2qhhq,investing,ky39ww,2021-01-15 20:38,Prepping for a big pullback ahead of probable unrest?,https://www.reddit.com/r/investing/comments/ky39ww/prepping_for_a_big_pullback_ahead_of_probable/,2021-01-20 21:12,32,0,0.42
2qhhq,investing,ky3jty,2021-01-15 20:51,Jamie Dimon says JPMorgan Chase should absolutely be ‘scared s---less’ about fintech threat,https://www.reddit.com/r/investing/comments/ky3jty/jamie_dimon_says_jpmorgan_chase_should_absolutely/,2021-01-20 21:12,356,1659,0.97
2qhhq,investing,ky3uo2,2021-01-15 21:05,Buying $O on Margin,https://www.reddit.com/r/investing/comments/ky3uo2/buying_o_on_margin/,2021-01-20 21:12,25,20,0.78
2qhhq,investing,ky85bx,2021-01-16 00:44,Will the underlying holdings in the ARKX already be priced in when it launches?,https://www.reddit.com/r/investing/comments/ky85bx/will_the_underlying_holdings_in_the_arkx_already/,2021-01-20 21:12,24,28,0.84
2qhhq,investing,ky9935,2021-01-16 01:47,How has the stock market changed since the 90's?,https://www.reddit.com/r/investing/comments/ky9935/how_has_the_stock_market_changed_since_the_90s/,2021-01-20 21:12,68,37,0.88
2qhhq,investing,kyaf2l,2021-01-16 02:55,Which individual or company's advice and analysis do you take on board along with your own?,https://www.reddit.com/r/investing/comments/kyaf2l/which_individual_or_companys_advice_and_analysis/,2021-01-20 21:12,22,17,0.8
2qhhq,investing,kyb53b,2021-01-16 03:39,PayPal becomes first foreign firm in China with full ownership of payments business,https://www.reddit.com/r/investing/comments/kyb53b/paypal_becomes_first_foreign_firm_in_china_with/,2021-01-20 21:12,60,799,0.98
2qhhq,investing,kydb32,2021-01-16 05:59,What are the potential downsides for a Canadian having all of their investments in USD?,https://www.reddit.com/r/investing/comments/kydb32/what_are_the_potential_downsides_for_a_canadian/,2021-01-20 21:12,62,39,0.87
2qhhq,investing,kygb68,2021-01-16 10:00,Daily Advice Thread - All basic help or advice questions must be posted here.,https://www.reddit.com/r/investing/comments/kygb68/daily_advice_thread_all_basic_help_or_advice/,2021-01-20 21:12,192,22,0.86
2qhhq,investing,kyh729,2021-01-16 11:15,"Can we agree that if there is a crash, it would be a huge crash?",https://www.reddit.com/r/investing/comments/kyh729/can_we_agree_that_if_there_is_a_crash_it_would_be/,2021-01-20 21:12,47,0,0.3
2qhhq,investing,kyirom,2021-01-16 13:16,Will increasing corporate taxes depress equity prices in the next few years?,https://www.reddit.com/r/investing/comments/kyirom/will_increasing_corporate_taxes_depress_equity/,2021-01-20 21:12,47,35,0.82
2qhhq,investing,kyiv2c,2021-01-16 13:23,Capturing more risk premium vs. diversifying internationally,https://www.reddit.com/r/investing/comments/kyiv2c/capturing_more_risk_premium_vs_diversifying/,2021-01-20 21:12,36,57,0.87
2qhhq,investing,kykpt6,2021-01-16 15:21,"If: Interest rates increase, 10 year bond hits 1.5, etc., should we be worried?",https://www.reddit.com/r/investing/comments/kykpt6/if_interest_rates_increase_10_year_bond_hits_15/,2021-01-20 21:12,35,29,0.78
2qhhq,investing,kyl7kn,2021-01-16 15:48,Predictions on commercial real estate?,https://www.reddit.com/r/investing/comments/kyl7kn/predictions_on_commercial_real_estate/,2021-01-20 21:12,144,122,0.91
2qhhq,investing,kyo8z4,2021-01-16 18:24,Can you become successful at Options by just following what Motley Fool it Citron Research publishes?,https://www.reddit.com/r/investing/comments/kyo8z4/can_you_become_successful_at_options_by_just/,2021-01-20 21:12,43,17,0.66
2qhhq,investing,kyoizi,2021-01-16 18:39,What sector etfs are you bullish on? Thoughts on these types?,https://www.reddit.com/r/investing/comments/kyoizi/what_sector_etfs_are_you_bullish_on_thoughts_on/,2021-01-20 21:12,238,173,0.93
2qhhq,investing,kyol7q,2021-01-16 18:42,Is there a Warren Buffet for the tech sector?,https://www.reddit.com/r/investing/comments/kyol7q/is_there_a_warren_buffet_for_the_tech_sector/,2021-01-20 21:12,541,569,0.91
2qhhq,investing,kypk46,2021-01-16 19:31,Palantir Predictions - Employee Lock Expiration,https://www.reddit.com/r/investing/comments/kypk46/palantir_predictions_employee_lock_expiration/,2021-01-20 21:12,24,28,0.84
2qhhq,investing,kyqjnn,2021-01-16 20:20,What is the likelihood of AMC going bankrupt vs its stock rebounding?,https://www.reddit.com/r/investing/comments/kyqjnn/what_is_the_likelihood_of_amc_going_bankrupt_vs/,2021-01-20 21:12,28,4,0.75
2qhhq,investing,kyqyob,2021-01-16 20:42,According to the Buffett Indicator the US Stockmarket is strongly overvalued at 221%,https://www.reddit.com/r/investing/comments/kyqyob/according_to_the_buffett_indicator_the_us/,2021-01-20 21:12,482,2279,0.92
2qhhq,investing,kyuao3,2021-01-16 23:39,YOLOING my margin to buy TSLA stock/call options. Worth?,https://www.reddit.com/r/investing/comments/kyuao3/yoloing_my_margin_to_buy_tsla_stockcall_options/,2021-01-20 21:12,33,0,0.14
2qhhq,investing,kyxqun,2021-01-17 02:53,Don't roast me: I want to buy metal,https://www.reddit.com/r/investing/comments/kyxqun/dont_roast_me_i_want_to_buy_metal/,2021-01-20 21:12,26,0,0.47
2qhhq,investing,kz289p,2021-01-17 07:46,What are your thoughts on REITs?,https://www.reddit.com/r/investing/comments/kz289p/what_are_your_thoughts_on_reits/,2021-01-20 21:12,40,20,0.82
2qhhq,investing,kz3sf6,2021-01-17 10:00,Daily Advice Thread - All basic help or advice questions must be posted here.,https://www.reddit.com/r/investing/comments/kz3sf6/daily_advice_thread_all_basic_help_or_advice/,2021-01-20 21:12,127,6,0.7
2qhhq,investing,kz5o83,2021-01-17 12:33,(Opinion) Lower interest rates won't justify excessive valuations forever.,https://www.reddit.com/r/investing/comments/kz5o83/opinion_lower_interest_rates_wont_justify/,2021-01-20 21:12,132,172,0.85
2qhhq,investing,kz6fgt,2021-01-17 13:27,"Q: leveraged indices (SSO, UPRO, TQQQ...)",https://www.reddit.com/r/investing/comments/kz6fgt/q_leveraged_indices_sso_upro_tqqq/,2021-01-20 21:12,39,15,0.74
2qhhq,investing,kz6x9s,2021-01-17 14:01,ARK ETFs - A Self Fulfilling Prophecy?,https://www.reddit.com/r/investing/comments/kz6x9s/ark_etfs_a_self_fulfilling_prophecy/,2021-01-20 21:12,167,218,0.89
2qhhq,investing,kz8whc,2021-01-17 15:58,Cloudflare (NET) is currently strongly overvalued,https://www.reddit.com/r/investing/comments/kz8whc/cloudflare_net_is_currently_strongly_overvalued/,2021-01-20 21:12,38,0,0.45
2qhhq,investing,kz90uf,2021-01-17 16:04,Thoughts on $RKT feb 19 calls?,https://www.reddit.com/r/investing/comments/kz90uf/thoughts_on_rkt_feb_19_calls/,2021-01-20 21:12,33,8,0.65
2qhhq,investing,kz9chk,2021-01-17 16:21,"People Love Pointing Out “Bubbles”, but Few Are Willing to Jump in for the Ride",https://www.reddit.com/r/investing/comments/kz9chk/people_love_pointing_out_bubbles_but_few_are/,2021-01-20 21:12,311,465,0.91
2qhhq,investing,kz9sgk,2021-01-17 16:45,Anything better than VFIAX?,https://www.reddit.com/r/investing/comments/kz9sgk/anything_better_than_vfiax/,2021-01-20 21:12,20,0,0.5
2qhhq,investing,kzaymx,2021-01-17 17:44,Trying to understand the benefit of calls,https://www.reddit.com/r/investing/comments/kzaymx/trying_to_understand_the_benefit_of_calls/,2021-01-20 21:12,47,15,0.74
2qhhq,investing,kzbxgl,2021-01-17 18:33,What to look for in nano cap stocks?,https://www.reddit.com/r/investing/comments/kzbxgl/what_to_look_for_in_nano_cap_stocks/,2021-01-20 21:12,20,0,0.5
2qhhq,investing,kzcgka,2021-01-17 19:00,Callaway Golf (Ticker ELY) Analysis and Price Target after TopGolf Acquisition,https://www.reddit.com/r/investing/comments/kzcgka/callaway_golf_ticker_ely_analysis_and_price/,2021-01-20 21:12,33,48,0.9
2qhhq,investing,kzctz6,2021-01-17 19:17,"Reading Graham's ""Intelligent Investor"" chapter 4 about bonds is laughable in 2021.",https://www.reddit.com/r/investing/comments/kzctz6/reading_grahams_intelligent_investor_chapter_4/,2021-01-20 21:12,23,2,0.56
2qhhq,investing,kzdj3c,2021-01-17 19:52,ARKK and similar investments,https://www.reddit.com/r/investing/comments/kzdj3c/arkk_and_similar_investments/,2021-01-20 21:12,123,30,0.7
2qhhq,investing,kzg5tg,2021-01-17 22:03,I just Want to put $2k/month into an investment and not think about it..,https://www.reddit.com/r/investing/comments/kzg5tg/i_just_want_to_put_2kmonth_into_an_investment_and/,2021-01-20 21:12,23,0,0.45
2qhhq,investing,kzg72l,2021-01-17 22:05,would 1.9t stimulus cause inflation?,https://www.reddit.com/r/investing/comments/kzg72l/would_19t_stimulus_cause_inflation/,2021-01-20 21:12,48,25,0.74
2qhhq,investing,kzggfz,2021-01-17 22:18,Arguments for and against Gold in your Asset Allocation.,https://www.reddit.com/r/investing/comments/kzggfz/arguments_for_and_against_gold_in_your_asset/,2021-01-20 21:12,33,8,0.75
2qhhq,investing,kzi842,2021-01-17 23:53,"How should I help my mom invest 20,000-30,000?",https://www.reddit.com/r/investing/comments/kzi842/how_should_i_help_my_mom_invest_2000030000/,2021-01-20 21:12,39,5,0.6
2qhhq,investing,kzjoub,2021-01-18 01:12,ETFs,https://www.reddit.com/r/investing/comments/kzjoub/etfs/,2021-01-20 21:12,23,0,0.5
2qhhq,investing,kzl2pe,2021-01-18 02:31,Investing in empty land close (2.5 miles) to Interstate & Downtown,https://www.reddit.com/r/investing/comments/kzl2pe/investing_in_empty_land_close_25_miles_to/,2021-01-20 21:12,29,18,0.73
2qhhq,investing,kzlfuv,2021-01-18 02:51,PSTH potential powderkeg technical setup,https://www.reddit.com/r/investing/comments/kzlfuv/psth_potential_powderkeg_technical_setup/,2021-01-20 21:12,49,23,0.76
2qhhq,investing,kzlpo5,2021-01-18 03:07,"If you were supposed to make 10 percent on 250K, but in the safest manner possible, how would you invest it?",https://www.reddit.com/r/investing/comments/kzlpo5/if_you_were_supposed_to_make_10_percent_on_250k/,2021-01-20 21:12,36,0,0.37
2qhhq,investing,kzlzgg,2021-01-18 03:23,LONG TERM GOLD,https://www.reddit.com/r/investing/comments/kzlzgg/long_term_gold/,2021-01-20 21:12,26,7,0.63
2qhhq,investing,kzmtjv,2021-01-18 04:11,Can someone make a good case on why I should invest outside of the USA?,https://www.reddit.com/r/investing/comments/kzmtjv/can_someone_make_a_good_case_on_why_i_should/,2021-01-20 21:12,36,0,0.47
2qhhq,investing,kzrcff,2021-01-18 09:25,What sectors do you believe will overpreform in 2021?,https://www.reddit.com/r/investing/comments/kzrcff/what_sectors_do_you_believe_will_overpreform_in/,2021-01-20 21:12,110,24,0.84
2qhhq,investing,kzrrb9,2021-01-18 10:00,Daily Advice Thread - All basic help or advice questions must be posted here.,https://www.reddit.com/r/investing/comments/kzrrb9/daily_advice_thread_all_basic_help_or_advice/,2021-01-20 21:12,146,10,0.72
2qhhq,investing,kzuhmj,2021-01-18 13:18,Are we heading towards a true liquidity trap?,https://www.reddit.com/r/investing/comments/kzuhmj/are_we_heading_towards_a_true_liquidity_trap/,2021-01-20 21:12,85,55,0.83
2qhhq,investing,kzw1mk,2021-01-18 14:50,"Right now, the Shiller S&P ratio for the S&P 500 is 34.5 -- more than double its historic average.",https://www.reddit.com/r/investing/comments/kzw1mk/right_now_the_shiller_sp_ratio_for_the_sp_500_is/,2021-01-20 21:12,540,1214,0.9
2qhhq,investing,kzwc0q,2021-01-18 15:05,Late to the game but it’s time to sell AT&T,https://www.reddit.com/r/investing/comments/kzwc0q/late_to_the_game_but_its_time_to_sell_att/,2021-01-20 21:12,43,0,0.36
2qhhq,investing,kzwnl2,2021-01-18 15:22,Why does bitcoin bulls always mention inflation when in reality inflation is at historic lows?,https://www.reddit.com/r/investing/comments/kzwnl2/why_does_bitcoin_bulls_always_mention_inflation/,2021-01-20 21:12,54,2,0.53
2qhhq,investing,kzxt6m,2021-01-18 16:20,ARKX holdings unveiled?,https://www.reddit.com/r/investing/comments/kzxt6m/arkx_holdings_unveiled/,2021-01-20 21:12,118,276,0.91
2qhhq,investing,kzxz2o,2021-01-18 16:29,[DD] Uranium: Coiled spring or just Nuclear decay?,https://www.reddit.com/r/investing/comments/kzxz2o/dd_uranium_coiled_spring_or_just_nuclear_decay/,2021-01-20 21:12,99,412,0.92
2qhhq,investing,kzz56e,2021-01-18 17:25,Why is it assumed that Index Funds returns will always be positive/steady over the long term? What protects them?,https://www.reddit.com/r/investing/comments/kzz56e/why_is_it_assumed_that_index_funds_returns_will/,2021-01-20 21:12,94,24,0.66
2qhhq,investing,l00jdw,2021-01-18 18:31,China's Soft Power and ADR's,https://www.reddit.com/r/investing/comments/l00jdw/chinas_soft_power_and_adrs/,2021-01-20 21:12,63,50,0.73
2qhhq,investing,l00mhv,2021-01-18 18:35,"FCEL, Gas & Oil",https://www.reddit.com/r/investing/comments/l00mhv/fcel_gas_oil/,2021-01-20 21:12,35,14,0.6
2qhhq,investing,l04kdp,2021-01-18 21:42,How are index funds viable for the long term?,https://www.reddit.com/r/investing/comments/l04kdp/how_are_index_funds_viable_for_the_long_term/,2021-01-20 21:12,33,22,0.7
2qhhq,investing,l04qo6,2021-01-18 21:51,Questions about when and how to exercise options,https://www.reddit.com/r/investing/comments/l04qo6/questions_about_when_and_how_to_exercise_options/,2021-01-20 21:12,35,2,0.67
2qhhq,investing,l075vk,2021-01-18 23:53,Is VGT with VTI redundant?,https://www.reddit.com/r/investing/comments/l075vk/is_vgt_with_vti_redundant/,2021-01-20 21:12,35,65,0.84
2qhhq,investing,l0852l,2021-01-19 00:45,EV charging station installation in Condo buildings - looking for a company to invest in,https://www.reddit.com/r/investing/comments/l0852l/ev_charging_station_installation_in_condo/,2021-01-20 21:12,33,37,0.78
2qhhq,investing,l08cps,2021-01-19 00:57,Looking for thoughts about investing subscriptions such as Motley Fool.,https://www.reddit.com/r/investing/comments/l08cps/looking_for_thoughts_about_investing/,2021-01-20 21:12,20,1,0.54
2qhhq,investing,l08hjz,2021-01-19 01:04,Airline consolidations JETS ETF,https://www.reddit.com/r/investing/comments/l08hjz/airline_consolidations_jets_etf/,2021-01-20 21:12,31,28,0.77
2qhhq,investing,l0bb3x,2021-01-19 03:38,Are high P/E Ratios not actually a concern when earnings are only down temporarily?,https://www.reddit.com/r/investing/comments/l0bb3x/are_high_pe_ratios_not_actually_a_concern_when/,2021-01-20 21:12,24,38,0.81
2qhhq,investing,l0bbgg,2021-01-19 03:39,"Long term investing, why not go with UPRO instead of SPY? Since it 3x the returns...",https://www.reddit.com/r/investing/comments/l0bbgg/long_term_investing_why_not_go_with_upro_instead/,2021-01-20 21:12,88,53,0.79
2qhhq,investing,l0c298,2021-01-19 04:22,"Which is easier: (1) Making $1M from $1, or (2) Making $1B from $1M?",https://www.reddit.com/r/investing/comments/l0c298/which_is_easier_1_making_1m_from_1_or_2_making_1b/,2021-01-20 21:12,36,0,0.38
2qhhq,investing,l0cp79,2021-01-19 05:00,"If you had to pick just one of the ""mega-cap"" tech stocks to own - which do you buy?",https://www.reddit.com/r/investing/comments/l0cp79/if_you_had_to_pick_just_one_of_the_megacap_tech/,2021-01-20 21:12,301,148,0.86
2qhhq,investing,l0eafj,2021-01-19 06:44,Stocks for cannabis play?,https://www.reddit.com/r/investing/comments/l0eafj/stocks_for_cannabis_play/,2021-01-20 21:12,50,24,0.74
2qhhq,investing,l0gv7c,2021-01-19 10:00,Daily Advice Thread - All basic help or advice questions must be posted here.,https://www.reddit.com/r/investing/comments/l0gv7c/daily_advice_thread_all_basic_help_or_advice/,2021-01-20 21:12,206,13,0.89
2qhhq,investing,l0hxe5,2021-01-19 11:19,AMD: Undervalued at $90,https://www.reddit.com/r/investing/comments/l0hxe5/amd_undervalued_at_90/,2021-01-20 21:12,386,903,0.86
2qhhq,investing,l0hzrw,2021-01-19 11:23,The gaming industry and what's next.,https://www.reddit.com/r/investing/comments/l0hzrw/the_gaming_industry_and_whats_next/,2021-01-20 21:12,51,0,0.47
2qhhq,investing,l0ml8z,2021-01-19 15:55,What is wallstreetbets on about with GME?,https://www.reddit.com/r/investing/comments/l0ml8z/what_is_wallstreetbets_on_about_with_gme/,2021-01-20 21:12,54,11,0.65
2qhhq,investing,l0on6h,2021-01-19 17:31,Why Delta (DAL) is currently the best stock to invest?,https://www.reddit.com/r/investing/comments/l0on6h/why_delta_dal_is_currently_the_best_stock_to/,2021-01-20 21:12,22,0,0.42
2qhhq,investing,l0q87h,2021-01-19 18:44,YELLEN SUMMARY TODAY.,https://www.reddit.com/r/investing/comments/l0q87h/yellen_summary_today/,2021-01-20 21:12,676,1103,0.96
2qhhq,investing,l0svr8,2021-01-19 20:49,"Powerhouse Energy has an investor webinar on 21st Jan, 17:30GMT",https://www.reddit.com/r/investing/comments/l0svr8/powerhouse_energy_has_an_investor_webinar_on_21st/,2021-01-20 21:12,38,4,0.74
2qhhq,investing,l0wji5,2021-01-19 23:45,I want to learn theory. Where to learn Fundamentals? How to learn Technical Analysis?,https://www.reddit.com/r/investing/comments/l0wji5/i_want_to_learn_theory_where_to_learn/,2021-01-20 21:12,21,6,0.75
2qhhq,investing,l11qb8,2021-01-20 04:31,Yellen is considering the possibility of taxing unrealized gains.,https://www.reddit.com/r/investing/comments/l11qb8/yellen_is_considering_the_possibility_of_taxing/,2021-01-20 21:12,219,74,0.85
2qhhq,investing,l12nnp,2021-01-20 05:28,Biden may tax dividends and double the tax on long-term capital gains,https://www.reddit.com/r/investing/comments/l12nnp/biden_may_tax_dividends_and_double_the_tax_on/,2021-01-20 21:12,21,0,0.43
2qhhq,investing,l12p5v,2021-01-20 05:31,"Jack Ma Emerges for First Time Since Ant, Alibaba Crackdown. BABA (9988.HK) in Hong Kong is up 5%.",https://www.reddit.com/r/investing/comments/l12p5v/jack_ma_emerges_for_first_time_since_ant_alibaba/,2021-01-20 21:12,80,527,0.98
2th52,wallstreetbets,ky6tdu,2021-01-15 23:33,Shorts Loss Porn,https://i.redd.it/wqscexrxzkb61.jpg,2021-01-20 21:13,29,66,0.96
2th52,wallstreetbets,ky6sdk,2021-01-15 23:31,"We all need a hero, luckily GME has a Master!",https://v.redd.it/h4i0qicfzkb61,2021-01-20 21:13,24,224,0.98
2th52,wallstreetbets,ky6u6s,2021-01-15 23:34,Listen to the sound of thousands of call options exercising this weekend ($GME current open interest),https://i.redd.it/qak1afqwzkb61.png,2021-01-20 21:13,66,125,0.96
2th52,wallstreetbets,ky6u4h,2021-01-15 23:34,GME - Revenge of the Shorts,https://v.redd.it/mm9hcflbzkb61,2021-01-20 21:13,38,1146,0.98
2th52,wallstreetbets,ky6w9m,2021-01-15 23:37,Sold GME at the top - bought back today - maxed my margin. NEXT WEEK WE FLY! 🚀,https://i.redd.it/fh6rdmoo0lb61.jpg,2021-01-20 21:13,58,131,0.85
2th52,wallstreetbets,ky6ycl,2021-01-15 23:40,Found this sub last week.,https://www.reddit.com/gallery/ky6ycl,2021-01-20 21:13,81,238,0.97
2th52,wallstreetbets,ky6ztp,2021-01-15 23:42,Give me gold. My net worth depends on it.,https://www.reddit.com/r/wallstreetbets/comments/ky6ztp/give_me_gold_my_net_worth_depends_on_it/,2021-01-20 21:13,45,44,0.77
2th52,wallstreetbets,ky7c0i,2021-01-16 00:00,WSB is currently the 2nd most engaged subreddit! 🚀🚀,https://www.reddit.com/gallery/ky7c0i,2021-01-20 21:13,370,4189,0.98
2th52,wallstreetbets,ky7egx,2021-01-16 00:04,PLTR seems like an obvious bet!.. looking at a pump to $60🚀,https://www.reddit.com/r/wallstreetbets/comments/ky7egx/pltr_seems_like_an_obvious_bet_looking_at_a_pump/,2021-01-20 21:13,113,135,0.81
2th52,wallstreetbets,ky7ggk,2021-01-16 00:07,$LMT is going to 🚀 to the 🌙,https://www.reddit.com/r/wallstreetbets/comments/ky7ggk/lmt_is_going_to_to_the/,2021-01-20 21:13,21,18,0.73
2th52,wallstreetbets,ky7hdf,2021-01-16 00:08,42K YOLO on GME. Down 2.6K BUT STILL HOLDING FOR TUESDAY! 🚀💎🚀,https://www.reddit.com/gallery/ky7hdf,2021-01-20 21:13,93,247,0.95
2th52,wallstreetbets,ky7j7j,2021-01-16 00:11,I did my part. Cramer you and your $100m should jump aboard already.,https://i.redd.it/ell7oc3q6lb61.jpg,2021-01-20 21:13,31,107,0.97
2th52,wallstreetbets,ky7p4i,2021-01-16 00:20,$BB to the MOON !,https://www.baystreet.ca/techinsider/2634/Could-BlackBerry-Stock-Continue-to-Soar-in-2021,2021-01-20 21:13,99,262,0.94
2th52,wallstreetbets,ky8344,2021-01-16 00:41,Simple Jack activated,https://i.redd.it/ddp6nncyblb61.jpg,2021-01-20 21:13,45,65,0.9
2th52,wallstreetbets,ky84m6,2021-01-16 00:43,Look mom we made the news again,https://www.reddit.com/r/wallstreetbets/comments/ky84m6/look_mom_we_made_the_news_again/,2021-01-20 21:13,31,67,0.95
2th52,wallstreetbets,ky8dsx,2021-01-16 00:57,Cut my losses? And yolo into gme?,https://i.redd.it/aiikw84zelb61.jpg,2021-01-20 21:13,47,42,0.87
2th52,wallstreetbets,ky8gmo,2021-01-16 01:01,Pray for me,https://i.redd.it/yg6vfqhpflb61.jpg,2021-01-20 21:13,34,34,0.86
2th52,wallstreetbets,ky8iht,2021-01-16 01:04,Some observations on WSB and the future of trading,https://www.reddit.com/r/wallstreetbets/comments/ky8iht/some_observations_on_wsb_and_the_future_of_trading/,2021-01-20 21:13,170,710,0.98
2th52,wallstreetbets,ky8kuq,2021-01-16 01:08,GM Ride to 100+,https://www.reddit.com/r/wallstreetbets/comments/ky8kuq/gm_ride_to_100/,2021-01-20 21:13,31,25,0.75
2th52,wallstreetbets,ky8ox1,2021-01-16 01:14,Fatality for this account. Fapality for you sick fucks.,https://i.redd.it/1gmmnwszhlb61.jpg,2021-01-20 21:13,34,105,0.96
2th52,wallstreetbets,ky8qds,2021-01-16 01:17,GME 💎🙌🏿 🚀🚀🚀✅ Thanks WSB,https://i.redd.it/hpxkt41filb61.jpg,2021-01-20 21:13,36,82,0.87
2th52,wallstreetbets,ky8pwb,2021-01-16 01:16,Steel gang x WSB this past week,https://v.redd.it/fx0cmzc5hlb61,2021-01-20 21:13,20,104,0.95
2th52,wallstreetbets,ky8r2d,2021-01-16 01:18,"GME going to the moon, melvin capital gets nutted on",https://v.redd.it/0ukf5crvhlb61,2021-01-20 21:13,185,3615,0.98
2th52,wallstreetbets,ky8sb6,2021-01-16 01:20,AMRS Gains Update Pt. 3! 🤑💰Squeeze Coming!!! 🚀,https://i.redd.it/xto3js2zilb61.jpg,2021-01-20 21:13,21,24,0.78
2th52,wallstreetbets,ky8vla,2021-01-16 01:25,BB TO THE MOOOON!!! 🚀 🚀 🚀 🚀,https://v.redd.it/1dbh9k1pjlb61,2021-01-20 21:13,67,451,0.95
2th52,wallstreetbets,ky907n,2021-01-16 01:32,"$LAC going to pop Monday, lithium mine approved in Nevada close to Tesla Gigafactory",https://i.redd.it/mkrck9w8llb61.jpg,2021-01-20 21:13,29,43,0.87
2th52,wallstreetbets,ky908x,2021-01-16 01:32,“I do not” said the GME 🌈🐻,https://i.redd.it/xefty729llb61.jpg,2021-01-20 21:13,56,209,0.97
2th52,wallstreetbets,ky979r,2021-01-16 01:44,Seasonality chart indicates further selling on the way. It’s bear season for a few weeks now boys and gals. Some of you payed attention and prepared. Most of you didn’t. Keep buying those calls - I’m sure the big institutions will love selling them to you.,https://i.redd.it/l4cb6znbnlb61.jpg,2021-01-20 21:13,20,0,0.21
2th52,wallstreetbets,ky986y,2021-01-16 01:46,"(GME) I honestly didn’t see it happening so soon, I still have lots of shares though",https://i.redd.it/e59degxlnlb61.jpg,2021-01-20 21:13,24,58,0.95
2th52,wallstreetbets,ky9e75,2021-01-16 01:55,Cramer or Cathie Wood ?,https://www.reddit.com/r/wallstreetbets/comments/ky9e75/cramer_or_cathie_wood/,2021-01-20 21:13,50,46,0.87
2th52,wallstreetbets,ky9jxs,2021-01-16 02:05,GME short interest 138.32%,https://www.reddit.com/r/wallstreetbets/comments/ky9jxs/gme_short_interest_13832/,2021-01-20 21:13,96,343,0.97
2th52,wallstreetbets,ky9lw4,2021-01-16 02:08,BB YOLO🚀🚀 Selling when BB hits $90🤑,https://i.redd.it/flhsnzgkrlb61.jpg,2021-01-20 21:13,41,138,0.93
2th52,wallstreetbets,ky9m34,2021-01-16 02:08,Unusual Options Activity 101: Whale Watching Tips,https://www.reddit.com/r/wallstreetbets/comments/ky9m34/unusual_options_activity_101_whale_watching_tips/,2021-01-20 21:13,229,840,0.98
2th52,wallstreetbets,ky9mu0,2021-01-16 02:09,GME Comrades (1/15 Update) - 27 Consecutive Days on NYSE Threshold Securities List 🚀,https://i.redd.it/qbzxx755ukb61.jpg,2021-01-20 21:13,26,120,0.95
2th52,wallstreetbets,ky9mr2,2021-01-16 02:09,The King of GME 💎 ✋ Showing us his steel balls evwry now and then aka deepfuckingvalue.,https://v.redd.it/3zhtzb2krlb61,2021-01-20 21:13,25,199,0.96
2th52,wallstreetbets,ky9qbg,2021-01-16 02:15,Got smoked today. True autist,https://i.redd.it/cw0hoxytslb61.jpg,2021-01-20 21:13,45,24,0.79
2th52,wallstreetbets,ky9r1t,2021-01-16 02:16,Statements or PR from GME directors or Cohen?,https://www.reddit.com/r/wallstreetbets/comments/ky9r1t/statements_or_pr_from_gme_directors_or_cohen/,2021-01-20 21:13,20,60,0.89
2th52,wallstreetbets,ky9ri3,2021-01-16 02:17,"Doing my part, 3290 shares checking in! GME 🚀 🚀 🚀 🚀 🚀",https://www.reddit.com/gallery/ky9ri3,2021-01-20 21:13,24,247,0.96
2th52,wallstreetbets,ky9sg9,2021-01-16 02:18,LYFT TO THE MOON? 🚀 already up 30% might buy more.,https://i.redd.it/wyzrc0ngtlb61.jpg,2021-01-20 21:13,24,10,0.62
2th52,wallstreetbets,ky9wuw,2021-01-16 02:25,There's another reason we can 💎 🙌 other than our massive 🍒. [GME],https://www.reddit.com/r/wallstreetbets/comments/ky9wuw/theres_another_reason_we_can_other_than_our/,2021-01-20 21:13,210,640,0.97
2th52,wallstreetbets,kya2r2,2021-01-16 02:35,First post here... am I doing it right? I heard this is the formula for tendies,https://i.redd.it/4kyu270ewlb61.jpg,2021-01-20 21:13,27,91,0.92
