Subreddit_ID,Subreddit_Name,Submission_ID,Submission_CreatedDate,Submission_Title,Submission_URL,Submission_LastFetched,Submission_NumComments,Submission_Score,Submission_UpvoteRatio
2qjfk,stocks,mbq6r6,2021-03-23 22:08,A message to my fellow INTC holders,https://www.reddit.com/r/stocks/comments/mbq6r6/a_message_to_my_fellow_intc_holders/,2021-04-06 16:00,35,20,0.7
2qjfk,stocks,mbqtrm,2021-03-23 22:38,Intel is spending $20 billion to build two new chip plants in Arizona,https://www.reddit.com/r/stocks/comments/mbqtrm/intel_is_spending_20_billion_to_build_two_new/,2021-04-06 16:00,262,856,0.97
2qjfk,stocks,mbrx3u,2021-03-23 23:30,Intel and AMD,https://www.reddit.com/r/stocks/comments/mbrx3u/intel_and_amd/,2021-04-06 16:00,40,29,0.87
2qjfk,stocks,mbt0aw,2021-03-24 00:24,Scenario: What would you do?,https://www.reddit.com/r/stocks/comments/mbt0aw/scenario_what_would_you_do/,2021-04-06 16:00,68,21,0.9
2qjfk,stocks,mbt0cv,2021-03-24 00:24,The market will be fine,https://www.reddit.com/r/stocks/comments/mbt0cv/the_market_will_be_fine/,2021-04-06 16:00,168,261,0.9
2qjfk,stocks,mbtxv8,2021-03-24 01:13,Thoughts on AMZN,https://www.reddit.com/r/stocks/comments/mbtxv8/thoughts_on_amzn/,2021-04-06 16:00,53,28,0.77
2qjfk,stocks,mbu3j3,2021-03-24 01:21,Wash Sale Question,https://www.reddit.com/r/stocks/comments/mbu3j3/wash_sale_question/,2021-04-06 16:00,28,4,1.0
2qjfk,stocks,mbv8x5,2021-03-24 02:23,"What low, medium and high risk stock/ ETF do you think will give you the best returns over the next 5-10 years? I'll go first...",https://www.reddit.com/r/stocks/comments/mbv8x5/what_low_medium_and_high_risk_stock_etf_do_you/,2021-04-06 16:00,58,15,0.79
2qjfk,stocks,mbvi2j,2021-03-24 02:37,UUUU is the flagship US Uranium Mining Stock,https://www.reddit.com/r/stocks/comments/mbvi2j/uuuu_is_the_flagship_us_uranium_mining_stock/,2021-04-06 16:00,86,48,0.83
2qjfk,stocks,mbvjy4,2021-03-24 02:40,Do current market conditions matter to a long term value investor?,https://www.reddit.com/r/stocks/comments/mbvjy4/do_current_market_conditions_matter_to_a_long/,2021-04-06 16:00,25,6,0.76
2qjfk,stocks,mbw5zv,2021-03-24 03:13,Tip: Yahoo Finance (App) Is Awesome!,https://www.reddit.com/r/stocks/comments/mbw5zv/tip_yahoo_finance_app_is_awesome/,2021-04-06 16:00,325,1674,0.94
2qjfk,stocks,mbwyzj,2021-03-24 04:00,"MSFT stocks bought in my name by grandparents 20 years ago, have receipt but no certificate",https://www.reddit.com/r/stocks/comments/mbwyzj/msft_stocks_bought_in_my_name_by_grandparents_20/,2021-04-06 16:00,127,654,0.96
2qjfk,stocks,mbx4ux,2021-03-24 04:10,Biggest rivalry in the market?,https://www.reddit.com/r/stocks/comments/mbx4ux/biggest_rivalry_in_the_market/,2021-04-06 16:00,32,8,0.9
2qjfk,stocks,mc0vco,2021-03-24 08:36,Cargo ship blocking the Suez canal,https://www.reddit.com/r/stocks/comments/mc0vco/cargo_ship_blocking_the_suez_canal/,2021-04-06 16:00,148,504,0.95
2qjfk,stocks,mc11i8,2021-03-24 08:50,The End of Tesla’s Dominance May Be Closer Than It Appears (Bloomberg),https://www.reddit.com/r/stocks/comments/mc11i8/the_end_of_teslas_dominance_may_be_closer_than_it/,2021-04-06 16:00,485,386,0.83
2qjfk,stocks,mc1fa1,2021-03-24 09:20,"r/Stocks Daily Thread on Meme Stocks Wednesday - Mar 24, 2021",https://www.reddit.com/r/stocks/comments/mc1fa1/rstocks_daily_thread_on_meme_stocks_wednesday_mar/,2021-04-06 16:00,291,26,0.82
2qjfk,stocks,mc1k7z,2021-03-24 09:30,"r/Stocks Daily Discussion Wednesday - Mar 24, 2021",https://www.reddit.com/r/stocks/comments/mc1k7z/rstocks_daily_discussion_wednesday_mar_24_2021/,2021-04-06 16:00,2077,68,0.92
2qjfk,stocks,mc3w4g,2021-03-24 12:00,Rare earth materials ETFs,https://www.reddit.com/r/stocks/comments/mc3w4g/rare_earth_materials_etfs/,2021-04-06 16:00,29,46,0.87
2qjfk,stocks,mc4cky,2021-03-24 12:23,"In hindsight, which analyst rating app turned turned out to be right more often than not?",https://www.reddit.com/r/stocks/comments/mc4cky/in_hindsight_which_analyst_rating_app_turned/,2021-04-06 16:00,35,44,0.87
2qjfk,stocks,mc4me3,2021-03-24 12:36,Real thoughts on future of NIO,https://www.reddit.com/r/stocks/comments/mc4me3/real_thoughts_on_future_of_nio/,2021-04-06 16:00,72,58,0.88
2qjfk,stocks,mc4u3f,2021-03-24 12:47,(3/24) Wednesday's Pre-Market Stock Movers & News,https://www.reddit.com/r/stocks/comments/mc4u3f/324_wednesdays_premarket_stock_movers_news/,2021-04-06 16:00,81,920,0.96
2qjfk,stocks,mc50vn,2021-03-24 12:56,What to buy when everything you look at is higher now?,https://www.reddit.com/r/stocks/comments/mc50vn/what_to_buy_when_everything_you_look_at_is_higher/,2021-04-06 16:00,32,29,0.84
2qjfk,stocks,mc6hym,2021-03-24 14:03,what I noticed in the market,https://www.reddit.com/r/stocks/comments/mc6hym/what_i_noticed_in_the_market/,2021-04-06 16:00,60,169,0.82
2qjfk,stocks,mc6of9,2021-03-24 14:11,Best Stocks Under $50?,https://www.reddit.com/r/stocks/comments/mc6of9/best_stocks_under_50/,2021-04-06 16:00,26,8,1.0
2qjfk,stocks,mc82co,2021-03-24 15:06,Wrong cost basis after account transfer from Robinhood (RH).,https://www.reddit.com/r/stocks/comments/mc82co/wrong_cost_basis_after_account_transfer_from/,2021-04-06 16:00,22,4,0.76
2qjfk,stocks,mc8eqg,2021-03-24 15:19,How come corporations like Vanguard and Blackrock own almost every stock in the market?,https://www.reddit.com/r/stocks/comments/mc8eqg/how_come_corporations_like_vanguard_and_blackrock/,2021-04-06 16:00,24,1,0.55
2qjfk,stocks,mc8oxv,2021-03-24 15:31,Apple - a good time to invest?,https://www.reddit.com/r/stocks/comments/mc8oxv/apple_a_good_time_to_invest/,2021-04-06 16:00,59,36,0.78
2qjfk,stocks,mc8pvi,2021-03-24 15:32,Buy the dip C3 ai?,https://www.reddit.com/r/stocks/comments/mc8pvi/buy_the_dip_c3_ai/,2021-04-06 16:00,25,14,0.81
2qjfk,stocks,mc91ew,2021-03-24 15:46,Motley Fool and many other financial news sites are SEO plays.,https://www.reddit.com/r/stocks/comments/mc91ew/motley_fool_and_many_other_financial_news_sites/,2021-04-06 16:00,382,2723,0.96
2qjfk,stocks,mc9dbs,2021-03-24 16:00,Change My Mind - $MSFT is a better growth play that $AAPL,https://www.reddit.com/r/stocks/comments/mc9dbs/change_my_mind_msft_is_a_better_growth_play_that/,2021-04-06 16:00,67,66,0.93
2qjfk,stocks,mc9zb3,2021-03-24 16:26,"So I want to dabble, alloted just $100, what are my options?",https://www.reddit.com/r/stocks/comments/mc9zb3/so_i_want_to_dabble_alloted_just_100_what_are_my/,2021-04-06 16:00,24,9,0.66
2qjfk,stocks,mca83h,2021-03-24 16:37,U.S. SEC begins rollout of law aimed at delisting Chinese firms,https://www.reddit.com/r/stocks/comments/mca83h/us_sec_begins_rollout_of_law_aimed_at_delisting/,2021-04-06 16:00,413,1386,0.97
2qjfk,stocks,mcafb2,2021-03-24 16:45,Invest in ARKG?,https://www.reddit.com/r/stocks/comments/mcafb2/invest_in_arkg/,2021-04-06 16:00,35,36,0.92
2qjfk,stocks,mcbeg5,2021-03-24 17:26,What’s up with tech today?,https://www.reddit.com/r/stocks/comments/mcbeg5/whats_up_with_tech_today/,2021-04-06 16:00,169,117,0.92
2qjfk,stocks,mcbqao,2021-03-24 17:40,Which stocks are the worst to buy now?,https://www.reddit.com/r/stocks/comments/mcbqao/which_stocks_are_the_worst_to_buy_now/,2021-04-06 16:00,56,18,0.93
2qjfk,stocks,mccgu0,2021-03-24 18:10,Word of caution for TSLA,https://www.reddit.com/r/stocks/comments/mccgu0/word_of_caution_for_tsla/,2021-04-06 16:00,42,7,0.56
2qjfk,stocks,mcd871,2021-03-24 18:42,How often does doing due diligence work out?,https://www.reddit.com/r/stocks/comments/mcd871/how_often_does_doing_due_diligence_work_out/,2021-04-06 16:00,50,14,0.85
2qjfk,stocks,mce0w5,2021-03-24 19:15,Rate my current Roth IRA dividend portfolio?,https://www.reddit.com/r/stocks/comments/mce0w5/rate_my_current_roth_ira_dividend_portfolio/,2021-04-06 16:00,35,0,0.25
2qjfk,stocks,mce92f,2021-03-24 19:24,DraftKings Sportsbook (DKNG),https://www.reddit.com/r/stocks/comments/mce92f/draftkings_sportsbook_dkng/,2021-04-06 16:00,29,21,0.92
2qjfk,stocks,mceprg,2021-03-24 19:44,It's not just me right?,https://www.reddit.com/r/stocks/comments/mceprg/its_not_just_me_right/,2021-04-06 16:00,2895,6920,0.92
2qjfk,stocks,mcern4,2021-03-24 19:46,major market selloff???,https://www.reddit.com/r/stocks/comments/mcern4/major_market_selloff/,2021-04-06 16:00,120,66,0.73
2qjfk,stocks,mceygj,2021-03-24 19:54,Shorts : Why they are not illegal?,https://www.reddit.com/r/stocks/comments/mceygj/shorts_why_they_are_not_illegal/,2021-04-06 16:00,30,0,0.46
2qjfk,stocks,mcf84d,2021-03-24 20:05,Anyone know why Tech stocks have been dead lately?,https://www.reddit.com/r/stocks/comments/mcf84d/anyone_know_why_tech_stocks_have_been_dead_lately/,2021-04-06 16:00,60,14,0.77
2qjfk,stocks,mcf8ba,2021-03-24 20:05,Cruises/Airline stocks,https://www.reddit.com/r/stocks/comments/mcf8ba/cruisesairline_stocks/,2021-04-06 16:00,34,5,0.7
2qjfk,stocks,mcfim3,2021-03-24 20:17,"Here is a Market Recap for today Wednesday, March 24, 2021",https://www.reddit.com/r/stocks/comments/mcfim3/here_is_a_market_recap_for_today_wednesday_march/,2021-04-06 16:00,33,60,0.91
2qjfk,stocks,mcfldi,2021-03-24 20:20,Rotation Rotation Rotation,https://www.reddit.com/r/stocks/comments/mcfldi/rotation_rotation_rotation/,2021-04-06 16:00,34,22,0.96
2qjfk,stocks,mcg9tk,2021-03-24 20:49,Too Many Are Stressed About Today's Red Day!,https://www.reddit.com/r/stocks/comments/mcg9tk/too_many_are_stressed_about_todays_red_day/,2021-04-06 16:00,177,195,0.87
2qjfk,stocks,mcglmn,2021-03-24 21:03,Genuinely wondering if everyone here is an investor?,https://www.reddit.com/r/stocks/comments/mcglmn/genuinely_wondering_if_everyone_here_is_an/,2021-04-06 16:00,174,274,0.87
2qjfk,stocks,mchbwg,2021-03-24 21:34,Need Stimulus Check Help to Buy Dips,https://www.reddit.com/r/stocks/comments/mchbwg/need_stimulus_check_help_to_buy_dips/,2021-04-06 16:00,29,0,0.5
2qjfk,stocks,mchn5y,2021-03-24 21:48,Where is AAPL’s Bottom,https://www.reddit.com/r/stocks/comments/mchn5y/where_is_aapls_bottom/,2021-04-06 16:00,79,30,0.85
2qjfk,stocks,mchper,2021-03-24 21:51,Should I cut my losses or hold out?,https://www.reddit.com/r/stocks/comments/mchper/should_i_cut_my_losses_or_hold_out/,2021-04-06 16:00,94,34,0.82
2qjfk,stocks,mci36b,2021-03-24 22:07,Carnival Cruise Warning Part 3,https://www.reddit.com/r/stocks/comments/mci36b/carnival_cruise_warning_part_3/,2021-04-06 16:00,287,446,0.79
2qjfk,stocks,mcifey,2021-03-24 22:22,Predictions on Tesla?,https://www.reddit.com/r/stocks/comments/mcifey/predictions_on_tesla/,2021-04-06 16:00,36,2,0.75
2qjfk,stocks,mcj1im,2021-03-24 22:49,How do some stocks just literally have their price cut by half within a few weeks? I'm seeing stocks back down to their mid 2020s prices,https://www.reddit.com/r/stocks/comments/mcj1im/how_do_some_stocks_just_literally_have_their/,2021-04-06 16:00,80,90,0.93
2qjfk,stocks,mcje67,2021-03-24 23:04,"I keep hearing about dividend irrelevancy but if you invested $100k in T in 1995, you would have turned 2100 shares into 6840 shares for a..",https://www.reddit.com/r/stocks/comments/mcje67/i_keep_hearing_about_dividend_irrelevancy_but_if/,2021-04-06 16:00,75,4,0.59
2qjfk,stocks,mcjlnq,2021-03-24 23:13,Reddit is planning to go public... How will the current situation affect this?,https://www.reddit.com/r/stocks/comments/mcjlnq/reddit_is_planning_to_go_public_how_will_the/,2021-04-06 16:00,39,25,0.78
2qjfk,stocks,mcjm8z,2021-03-24 23:14,Anyone else not using limit trades at all?,https://www.reddit.com/r/stocks/comments/mcjm8z/anyone_else_not_using_limit_trades_at_all/,2021-04-06 16:00,37,19,0.81
2qjfk,stocks,mcl00u,2021-03-25 00:18,AbbVie Inc. (ABBV) Has anyone actually seen the financials of this company? FIRST DD,https://www.reddit.com/r/stocks/comments/mcl00u/abbvie_inc_abbv_has_anyone_actually_seen_the/,2021-04-06 16:00,24,25,0.81
2qjfk,stocks,mcl06w,2021-03-25 00:18,Are stocks bought and sold between individuals or the brokerage? How does the price go up and down?,https://www.reddit.com/r/stocks/comments/mcl06w/are_stocks_bought_and_sold_between_individuals_or/,2021-04-06 16:00,26,17,0.8
2qjfk,stocks,mcl65z,2021-03-25 00:26,"No Matter How Good the DD Is, Always Check The Financials",https://www.reddit.com/r/stocks/comments/mcl65z/no_matter_how_good_the_dd_is_always_check_the/,2021-04-06 16:00,24,27,0.89
2qjfk,stocks,mcl6k8,2021-03-25 00:27,What is the best online brokerage company?,https://www.reddit.com/r/stocks/comments/mcl6k8/what_is_the_best_online_brokerage_company/,2021-04-06 16:00,27,3,1.0
2qjfk,stocks,mcltvm,2021-03-25 00:58,"I am in Canada, which platform offers best fees to trade US stocks?",https://www.reddit.com/r/stocks/comments/mcltvm/i_am_in_canada_which_platform_offers_best_fees_to/,2021-04-06 16:00,25,10,0.79
2qjfk,stocks,mcm9w1,2021-03-25 01:19,Love him or hate him... Cramer/ CNBC hinted at a rotation back to tech stocks soon,https://www.reddit.com/r/stocks/comments/mcm9w1/love_him_or_hate_him_cramer_cnbc_hinted_at_a/,2021-04-06 16:00,80,51,0.77
2qjfk,stocks,mcmhyc,2021-03-25 01:31,Why do people recommend joining a paid platform for buying stocks instead of commission free brokers?,https://www.reddit.com/r/stocks/comments/mcmhyc/why_do_people_recommend_joining_a_paid_platform/,2021-04-06 16:00,23,9,0.86
2qjfk,stocks,mcn2iv,2021-03-25 01:59,Cruise line stocks?,https://www.reddit.com/r/stocks/comments/mcn2iv/cruise_line_stocks/,2021-04-06 16:00,27,2,0.56
2qjfk,stocks,mcnnqo,2021-03-25 02:29,2021 - The greatest year of Investing,https://www.reddit.com/r/stocks/comments/mcnnqo/2021_the_greatest_year_of_investing/,2021-04-06 16:00,81,138,0.84
2qjfk,stocks,mcoy9k,2021-03-25 03:35,Be careful with what you read on r/stocks,https://www.reddit.com/r/stocks/comments/mcoy9k/be_careful_with_what_you_read_on_rstocks/,2021-04-06 16:00,274,444,0.9
2qjfk,stocks,mcp1h3,2021-03-25 03:40,Value is the place to be,https://www.reddit.com/r/stocks/comments/mcp1h3/value_is_the_place_to_be/,2021-04-06 16:00,37,0,0.41
2qjfk,stocks,mcqw6j,2021-03-25 05:29,HELP! I was wondering if someone could check out my portfolio and see if I am making any mistakes or overlooking something. Details Below.,https://www.reddit.com/r/stocks/comments/mcqw6j/help_i_was_wondering_if_someone_could_check_out/,2021-04-06 16:00,24,0,0.44
2qjfk,stocks,mcttfj,2021-03-25 08:58,Is it smart to invest in the Tourism market allready?,https://www.reddit.com/r/stocks/comments/mcttfj/is_it_smart_to_invest_in_the_tourism_market/,2021-04-06 16:00,30,6,0.72
2qjfk,stocks,mcu4cq,2021-03-25 09:20,"r/Stocks Daily Thread on Meme Stocks Thursday - Mar 25, 2021",https://www.reddit.com/r/stocks/comments/mcu4cq/rstocks_daily_thread_on_meme_stocks_thursday_mar/,2021-04-06 16:00,278,46,0.93
2qjfk,stocks,mcu9cu,2021-03-25 09:30,"r/Stocks Daily Discussion & Options Trading Thursday - Mar 25, 2021",https://www.reddit.com/r/stocks/comments/mcu9cu/rstocks_daily_discussion_options_trading_thursday/,2021-04-06 16:00,1836,66,0.94
2qjfk,stocks,mcuery,2021-03-25 09:41,This market is bipolar,https://www.reddit.com/r/stocks/comments/mcuery/this_market_is_bipolar/,2021-04-06 16:00,38,19,0.69
2qjfk,stocks,mcw5i7,2021-03-25 11:35,Investment opportunities in the 3D Printed house sector,https://www.reddit.com/r/stocks/comments/mcw5i7/investment_opportunities_in_the_3d_printed_house/,2021-04-06 16:00,21,18,0.83
2qjfk,stocks,mcwe68,2021-03-25 11:49,This is not the first correction.... but online it seems that way,https://www.reddit.com/r/stocks/comments/mcwe68/this_is_not_the_first_correction_but_online_it/,2021-04-06 16:00,1049,2619,0.93
2qjfk,stocks,mcwq5a,2021-03-25 12:08,$TSM - Fundamental Analysis - Still The King vs INTEL?,https://www.reddit.com/r/stocks/comments/mcwq5a/tsm_fundamental_analysis_still_the_king_vs_intel/,2021-04-06 16:00,89,122,0.91
2qjfk,stocks,mcwtgi,2021-03-25 12:13,"Buying the dip, no money left",https://www.reddit.com/r/stocks/comments/mcwtgi/buying_the_dip_no_money_left/,2021-04-06 16:00,213,388,0.93
2qjfk,stocks,mcxmx4,2021-03-25 12:58,I thought the stimulus checks were supposed to be boosting the market...,https://www.reddit.com/r/stocks/comments/mcxmx4/i_thought_the_stimulus_checks_were_supposed_to_be/,2021-04-06 16:00,831,903,0.89
2qjfk,stocks,mcyfxa,2021-03-25 13:38,PLEASe make it STOP it hurts,https://www.reddit.com/r/stocks/comments/mcyfxa/please_make_it_stop_it_hurts/,2021-04-06 16:00,266,161,0.67
2qjfk,stocks,mcyl1b,2021-03-25 13:45,Jobless claims fall to lowest level of the pandemic,https://www.reddit.com/r/stocks/comments/mcyl1b/jobless_claims_fall_to_lowest_level_of_the/,2021-04-06 16:00,32,46,0.88
2qjfk,stocks,mcyq1o,2021-03-25 13:52,Reason for Drop After Stimulus?,https://www.reddit.com/r/stocks/comments/mcyq1o/reason_for_drop_after_stimulus/,2021-04-06 16:00,36,3,0.56
2qjfk,stocks,mczt4d,2021-03-25 14:42,$FNKO – Their Future of Margin and Revenue Expansion,https://www.reddit.com/r/stocks/comments/mczt4d/fnko_their_future_of_margin_and_revenue_expansion/,2021-04-06 16:00,76,80,0.89
2qjfk,stocks,md0fle,2021-03-25 15:09,Opinions About Teladoc (TDOC) Almost at Pre-Pandemic Levels and Why It's Dipping So Hard?,https://www.reddit.com/r/stocks/comments/md0fle/opinions_about_teladoc_tdoc_almost_at_prepandemic/,2021-04-06 16:00,33,24,0.87
2qjfk,stocks,md0jln,2021-03-25 15:14,Buying undervalued stocks in this dip,https://www.reddit.com/r/stocks/comments/md0jln/buying_undervalued_stocks_in_this_dip/,2021-04-06 16:00,64,12,0.73
2qjfk,stocks,md0o15,2021-03-25 15:20,What’s everybody buying this week on the dips?,https://www.reddit.com/r/stocks/comments/md0o15/whats_everybody_buying_this_week_on_the_dips/,2021-04-06 16:00,193,28,0.82
2qjfk,stocks,md10km,2021-03-25 15:35,Why Apple keeps dropping.,https://www.reddit.com/r/stocks/comments/md10km/why_apple_keeps_dropping/,2021-04-06 16:00,60,16,0.67
2qjfk,stocks,md1r3n,2021-03-25 16:06,Is blackberry a failing stock?,https://www.reddit.com/r/stocks/comments/md1r3n/is_blackberry_a_failing_stock/,2021-04-06 16:00,31,0,0.36
2qjfk,stocks,md20ir,2021-03-25 16:18,WMT DD best stock in my portfolio?,https://www.reddit.com/r/stocks/comments/md20ir/wmt_dd_best_stock_in_my_portfolio/,2021-04-06 16:00,24,13,1.0
2qjfk,stocks,md220z,2021-03-25 16:19,What is a good third sector (not tech or tobacco) to dump my last (for now) $500 in?,https://www.reddit.com/r/stocks/comments/md220z/what_is_a_good_third_sector_not_tech_or_tobacco/,2021-04-06 16:00,55,12,1.0
2qjfk,stocks,md2ttu,2021-03-25 16:53,I use fidelity brokerage but invest in vanguard ETF’s,https://www.reddit.com/r/stocks/comments/md2ttu/i_use_fidelity_brokerage_but_invest_in_vanguard/,2021-04-06 16:00,23,9,0.72
2qjfk,stocks,md2w0o,2021-03-25 16:56,Safest stock to invest in?,https://www.reddit.com/r/stocks/comments/md2w0o/safest_stock_to_invest_in/,2021-04-06 16:00,34,3,0.6
2qjfk,stocks,md57ak,2021-03-25 18:40,Mom left me some money,https://www.reddit.com/r/stocks/comments/md57ak/mom_left_me_some_money/,2021-04-06 16:00,527,699,0.93
2qjfk,stocks,md64aw,2021-03-25 19:21,Is Tech Toast?,https://www.reddit.com/r/stocks/comments/md64aw/is_tech_toast/,2021-04-06 16:00,28,0,0.44
2qjfk,stocks,md6n7q,2021-03-25 19:45,Why are hedge funds allowed to keep shorting without having to cover?,https://www.reddit.com/r/stocks/comments/md6n7q/why_are_hedge_funds_allowed_to_keep_shorting/,2021-04-06 16:00,159,283,0.86
2qjfk,stocks,md7dsi,2021-03-25 20:18,"Looking to invest about $150,000, need advice on what and if now is a good time",https://www.reddit.com/r/stocks/comments/md7dsi/looking_to_invest_about_150000_need_advice_on/,2021-04-06 16:00,67,10,0.68
2qjfk,stocks,md828q,2021-03-25 20:49,"Here is a Market Recap for today Thursday, March 25, 2021",https://www.reddit.com/r/stocks/comments/md828q/here_is_a_market_recap_for_today_thursday_march/,2021-04-06 16:00,21,105,0.97
2qjfk,stocks,md8gnc,2021-03-25 21:07,DKNG weekly call,https://www.reddit.com/r/stocks/comments/md8gnc/dkng_weekly_call/,2021-04-06 16:00,21,6,0.81
2qjfk,stocks,md8pur,2021-03-25 21:19,Suez Canal blocked by Ever Given,https://www.reddit.com/r/stocks/comments/md8pur/suez_canal_blocked_by_ever_given/,2021-04-06 16:00,46,33,0.79
2qjfk,stocks,md8vp9,2021-03-25 21:27,Question about finding the dividend yield,https://www.reddit.com/r/stocks/comments/md8vp9/question_about_finding_the_dividend_yield/,2021-04-06 16:00,21,7,0.89
2qjfk,stocks,md8x2m,2021-03-25 21:28,$BBW value play,https://www.reddit.com/r/stocks/comments/md8x2m/bbw_value_play/,2021-04-06 16:00,30,2,0.75
2qjfk,stocks,md96rf,2021-03-25 21:41,Price corrections and pullbacks are normal. Don't panic.,https://www.reddit.com/r/stocks/comments/md96rf/price_corrections_and_pullbacks_are_normal_dont/,2021-04-06 16:00,29,15,0.68
2qjfk,stocks,md974g,2021-03-25 21:42,"I am looking for the best dividend stock that money can buy, what website is the best to do my research?",https://www.reddit.com/r/stocks/comments/md974g/i_am_looking_for_the_best_dividend_stock_that/,2021-04-06 16:00,36,2,0.58
2qjfk,stocks,mdacxm,2021-03-25 22:37,"For diversified portfolios, how long on average do you guys spend on DD and research on individual company’s stocks prior to investing?",https://www.reddit.com/r/stocks/comments/mdacxm/for_diversified_portfolios_how_long_on_average_do/,2021-04-06 16:00,42,9,1.0
2qjfk,stocks,mdb6hj,2021-03-25 23:18,"ARKX Speculation List of Stocks, SPACS, and their Space Exploration Fund in Japan",https://www.reddit.com/r/stocks/comments/mdb6hj/arkx_speculation_list_of_stocks_spacs_and_their/,2021-04-06 16:00,40,32,0.87
2qjfk,stocks,mdbpzi,2021-03-25 23:47,"Finding the best buy (basic DD/ discussion): AMD, AMAT, NET, QCOM",https://www.reddit.com/r/stocks/comments/mdbpzi/finding_the_best_buy_basic_dd_discussion_amd_amat/,2021-04-06 16:00,21,19,0.86
2qjfk,stocks,mdca5g,2021-03-26 00:16,Have some extra money and want some advice,https://www.reddit.com/r/stocks/comments/mdca5g/have_some_extra_money_and_want_some_advice/,2021-04-06 16:00,21,2,0.62
2qjfk,stocks,mdcf0x,2021-03-26 00:24,Playboy $PLBY,https://www.reddit.com/r/stocks/comments/mdcf0x/playboy_plby/,2021-04-06 16:00,48,36,0.81
2qjfk,stocks,mdcpjo,2021-03-26 00:40,PSA: It's okay to sell at a loss,https://www.reddit.com/r/stocks/comments/mdcpjo/psa_its_okay_to_sell_at_a_loss/,2021-04-06 16:00,135,94,0.72
2qjfk,stocks,mdcxag,2021-03-26 00:52,Low risk long term,https://www.reddit.com/r/stocks/comments/mdcxag/low_risk_long_term/,2021-04-06 16:00,28,3,0.8
2qjfk,stocks,mdekqi,2021-03-26 02:23,What are your BEST strategies to avoiding emotional trading?,https://www.reddit.com/r/stocks/comments/mdekqi/what_are_your_best_strategies_to_avoiding/,2021-04-06 16:00,89,10,0.71
2qjfk,stocks,mdeq8x,2021-03-26 02:32,Bloomberg: Volkswagen as the Next Tesla is firing up stock investors,https://www.reddit.com/r/stocks/comments/mdeq8x/bloomberg_volkswagen_as_the_next_tesla_is_firing/,2021-04-06 16:00,54,17,0.7
2qjfk,stocks,mdewlq,2021-03-26 02:42,Tomorrow Stock Pick for Next Week Announcement.,https://www.reddit.com/r/stocks/comments/mdewlq/tomorrow_stock_pick_for_next_week_announcement/,2021-04-06 16:00,36,15,0.76
2qjfk,stocks,mdfswd,2021-03-26 03:33,$HGEN - short term COVID play with Phase 3 data release by end of march and 5-10x possible ROI,https://www.reddit.com/r/stocks/comments/mdfswd/hgen_short_term_covid_play_with_phase_3_data/,2021-04-06 16:00,192,150,0.95
2qjfk,stocks,mdkpjm,2021-03-26 09:20,"r/Stocks Daily Thread on Meme Stocks Friday - Mar 26, 2021",https://www.reddit.com/r/stocks/comments/mdkpjm/rstocks_daily_thread_on_meme_stocks_friday_mar_26/,2021-04-06 16:00,249,29,0.84
2qjfk,stocks,mdkurp,2021-03-26 09:30,"r/Stocks Daily Discussion & Fundamentals Friday Mar 26, 2021",https://www.reddit.com/r/stocks/comments/mdkurp/rstocks_daily_discussion_fundamentals_friday_mar/,2021-04-06 16:00,1763,69,0.96
2qjfk,stocks,mdmod0,2021-03-26 11:39,Tech for the next 2-3 years,https://www.reddit.com/r/stocks/comments/mdmod0/tech_for_the_next_23_years/,2021-04-06 16:00,137,87,0.86
2qjfk,stocks,mdn2uy,2021-03-26 12:03,"NIO and XPEV are oversold, will have a very strong bounce - BUY THE DIP!",https://www.reddit.com/r/stocks/comments/mdn2uy/nio_and_xpev_are_oversold_will_have_a_very_strong/,2021-04-06 16:00,145,34,0.61
2qjfk,stocks,mdn3nz,2021-03-26 12:04,"Tech is tanking at the moment, but it will come back up eventually. Don’t listen to the big media platforms too much!",https://www.reddit.com/r/stocks/comments/mdn3nz/tech_is_tanking_at_the_moment_but_it_will_come/,2021-04-06 16:00,929,5700,0.93
2qjfk,stocks,mdnzup,2021-03-26 12:55,"Microsoft closes $7.5 billion Bethesda acquisition, aiming to take on Sony with exclusive games",https://www.reddit.com/r/stocks/comments/mdnzup/microsoft_closes_75_billion_bethesda_acquisition/,2021-04-06 16:00,319,1757,0.98
2qjfk,stocks,mdoppt,2021-03-26 13:31,SoFi to give amateur investors early access to IPOs in break from Wall Street tradition,https://www.reddit.com/r/stocks/comments/mdoppt/sofi_to_give_amateur_investors_early_access_to/,2021-04-06 16:00,35,193,0.97
2qjfk,stocks,mdor53,2021-03-26 13:33,"Man, ARKK has been tearing me a new one.",https://www.reddit.com/r/stocks/comments/mdor53/man_arkk_has_been_tearing_me_a_new_one/,2021-04-06 16:00,55,12,0.63
2qjfk,stocks,mdorgy,2021-03-26 13:34,"Remember, it doesn't matter how much a stock goes up, what matters is how much more it goes up than the index",https://www.reddit.com/r/stocks/comments/mdorgy/remember_it_doesnt_matter_how_much_a_stock_goes/,2021-04-06 16:00,133,553,0.92
2qjfk,stocks,mdp8k9,2021-03-26 13:58,Has stock/investing addictions interfered with anyone else's love life? Or because they don't want to potential ruin their financial future?,https://www.reddit.com/r/stocks/comments/mdp8k9/has_stockinvesting_addictions_interfered_with/,2021-04-06 16:00,162,97,0.88
2qjfk,stocks,mdrf39,2021-03-26 15:41,"Rookie Mistake, left with a question.",https://www.reddit.com/r/stocks/comments/mdrf39/rookie_mistake_left_with_a_question/,2021-04-06 16:00,57,12,0.78
2qjfk,stocks,mds4bo,2021-03-26 16:12,Anyone Else Getting Bearish on Midcaps?,https://www.reddit.com/r/stocks/comments/mds4bo/anyone_else_getting_bearish_on_midcaps/,2021-04-06 16:00,25,10,0.72
