Subreddit_ID,Subreddit_Name,Submission_ID,Submission_CreatedDate,Submission_Title,Submission_URL,Submission_LastFetched,Submission_NumComments,Submission_Score,Submission_UpvoteRatio
2qhhq,investing,jze46q,2020-11-23 08:47,If you have invested in Palantir PLTR you need to know about lock-up period,https://www.reddit.com/r/investing/comments/jze46q/if_you_have_invested_in_palantir_pltr_you_need_to/,2020-11-24 21:03,53,90,0.81
2qhhq,investing,jzfu55,2020-11-23 11:18,What's the stock that BRK.B could be investing and is trying to hide?,https://www.reddit.com/r/investing/comments/jzfu55/whats_the_stock_that_brkb_could_be_investing_and/,2020-11-24 21:03,209,357,0.93
2qhhq,investing,jzg3og,2020-11-23 11:40,"Alibaba Group CEO backs China's antitrust rules, says 'timely and necessary'",https://www.reddit.com/r/investing/comments/jzg3og/alibaba_group_ceo_backs_chinas_antitrust_rules/,2020-11-24 21:03,29,143,0.91
2qhhq,investing,jzgkd6,2020-11-23 12:16,Daily Advice Thread - All basic help or advice questions must be posted here.,https://www.reddit.com/r/investing/comments/jzgkd6/daily_advice_thread_all_basic_help_or_advice/,2020-11-24 21:03,118,12,0.78
2qhhq,investing,jzhy6f,2020-11-23 13:51,Bloomberg Article: The 60/40 Portfolio Is Muzzling Critics With Another Big Year,https://www.reddit.com/r/investing/comments/jzhy6f/bloomberg_article_the_6040_portfolio_is_muzzling/,2020-11-24 21:03,47,54,0.87
2qhhq,investing,jzhwhf,2020-11-23 13:48,The Tesla Bull Case in Brief,https://www.reddit.com/r/investing/comments/jzhwhf/the_tesla_bull_case_in_brief/,2020-11-24 21:03,120,105,0.83
2qhhq,investing,jzly2f,2020-11-23 17:22,Is there a ‘right’ way to start investing?,https://www.reddit.com/r/investing/comments/jzly2f/is_there_a_right_way_to_start_investing/,2020-11-24 21:03,85,38,0.78
2qhhq,investing,jzphhf,2020-11-23 20:15,Former Fed Chair Janet Yellen reportedly Biden pick for Treasury Secretary,https://www.reddit.com/r/investing/comments/jzphhf/former_fed_chair_janet_yellen_reportedly_biden/,2020-11-24 21:03,334,1476,0.96
2qhhq,investing,jzqa1w,2020-11-23 20:55,A question we don’t see often: How to determine a good exit point?,https://www.reddit.com/r/investing/comments/jzqa1w/a_question_we_dont_see_often_how_to_determine_a/,2020-11-24 21:03,26,43,0.95
2qhhq,investing,jzqf5b,2020-11-23 21:02,"Biden picks Avril Haines, a previous consultant to Palantir, as director of national intelligence",https://www.reddit.com/r/investing/comments/jzqf5b/biden_picks_avril_haines_a_previous_consultant_to/,2020-11-24 21:03,34,59,0.88
2qhhq,investing,jzs6df,2020-11-23 22:31,I feel some stocks in this market are going crazy. Does anyone agree?,https://www.reddit.com/r/investing/comments/jzs6df/i_feel_some_stocks_in_this_market_are_going_crazy/,2020-11-24 21:03,54,38,0.88
2qhhq,investing,jztqsq,2020-11-23 23:57,Gold Vs Bitcoin,https://www.reddit.com/r/investing/comments/jztqsq/gold_vs_bitcoin/,2020-11-24 21:03,36,10,0.67
2qhhq,investing,jzvy03,2020-11-24 02:08,Attention Robinhood power users: Most day traders lose money,https://www.reddit.com/r/investing/comments/jzvy03/attention_robinhood_power_users_most_day_traders/,2020-11-24 21:03,26,44,0.8
2qhhq,investing,jzwatg,2020-11-24 02:30,"CRSR- At what point would you say ""time to sell?""",https://www.reddit.com/r/investing/comments/jzwatg/crsr_at_what_point_would_you_say_time_to_sell/,2020-11-24 21:03,22,8,0.79
2th52,wallstreetbets,jxr3go,2020-11-20 15:31,SLUTZ for UTZ,https://www.reddit.com/r/wallstreetbets/comments/jxr3go/slutz_for_utz/,2020-11-24 21:04,222,242,0.94
2th52,wallstreetbets,jxr47k,2020-11-20 15:32,Is something bad brewing in Congress?,https://www.reddit.com/r/wallstreetbets/comments/jxr47k/is_something_bad_brewing_in_congress/,2020-11-24 21:04,27,5,0.69
2th52,wallstreetbets,jxrdln,2020-11-20 15:46,Here is my application Sir. Can I stay?,https://www.reddit.com/gallery/jxrdln,2020-11-24 21:04,22,16,0.72
2th52,wallstreetbets,jxrptr,2020-11-20 16:03,Stanley Weiss is an idiot. Stupid analyst,https://i.redd.it/muk9pkgp4f061.jpg,2020-11-24 21:04,64,279,0.96
2th52,wallstreetbets,jxs9w2,2020-11-20 16:32,Guess my zoom calls exploded,https://i.redd.it/ha1yidjv9f061.jpg,2020-11-24 21:04,20,25,0.84
2th52,wallstreetbets,jxscc7,2020-11-20 16:36,For those wondering why GME is going up again.,https://www.reddit.com/r/wallstreetbets/comments/jxscc7/for_those_wondering_why_gme_is_going_up_again/,2020-11-24 21:04,120,66,0.94
2th52,wallstreetbets,jxslq5,2020-11-20 16:50,Stonks this week,https://v.redd.it/bpsamxovcf061,2020-11-24 21:04,367,17381,0.99
2th52,wallstreetbets,jxspgm,2020-11-20 16:55,"If wsb is right, I'll be a millionaire in 2 months",https://i.imgur.com/tvcDMHR.png,2020-11-24 21:04,36,47,0.86
2th52,wallstreetbets,jxsrzs,2020-11-20 16:58,Made $50k on PTON in the last 2 days! This is going to keep popping with all the lockdowns going on,https://i.redd.it/vu5yfpnief061.jpg,2020-11-24 21:04,303,552,0.89
2th52,wallstreetbets,jxss7o,2020-11-20 16:59,"First time with options, he bought weeklies",https://i.redd.it/4w9wm7mkef061.jpg,2020-11-24 21:04,20,74,0.97
2th52,wallstreetbets,jxss9a,2020-11-20 16:59,Chyna EV is not a fairytale,https://www.reddit.com/r/wallstreetbets/comments/jxss9a/chyna_ev_is_not_a_fairytale/,2020-11-24 21:04,58,19,0.74
2th52,wallstreetbets,jxt1vh,2020-11-20 17:12,Am I winning yet?,https://www.reddit.com/gallery/jxt1vh,2020-11-24 21:04,177,857,0.97
2th52,wallstreetbets,jxt7qh,2020-11-20 17:20,AYRO,https://www.reddit.com/r/wallstreetbets/comments/jxt7qh/ayro/,2020-11-24 21:04,21,19,1.0
2th52,wallstreetbets,jxt89t,2020-11-20 17:21,He found the next TSLA 5 days ago,https://www.reddit.com/r/wallstreetbets/comments/jxt89t/he_found_the_next_tsla_5_days_ago/,2020-11-24 21:04,59,352,0.99
2th52,wallstreetbets,jxtci9,2020-11-20 17:27,Turn a quarter into a dollar,https://www.reddit.com/r/wallstreetbets/comments/jxtci9/turn_a_quarter_into_a_dollar/,2020-11-24 21:04,55,26,0.61
2th52,wallstreetbets,jxtjqi,2020-11-20 17:37,Buying PLTR dip?,https://www.reddit.com/r/wallstreetbets/comments/jxtjqi/buying_pltr_dip/,2020-11-24 21:04,105,133,0.93
2th52,wallstreetbets,jxtoym,2020-11-20 17:44,"Im not a millionaire yet, what am I doing wrong??",https://i.redd.it/kzgy9sgnmf061.png,2020-11-24 21:04,21,17,0.78
2th52,wallstreetbets,jxttqd,2020-11-20 17:51,CRSR input,https://www.reddit.com/r/wallstreetbets/comments/jxttqd/crsr_input/,2020-11-24 21:04,21,10,0.92
2th52,wallstreetbets,jxtvb7,2020-11-20 17:53,$BABA ALL IN YOLO,https://www.reddit.com/r/wallstreetbets/comments/jxtvb7/baba_all_in_yolo/,2020-11-24 21:04,26,40,0.96
2th52,wallstreetbets,jxtxsm,2020-11-20 17:57,"GME - Warning to all Shorts and Gay Bears, you will not be warned again.",https://www.reddit.com/r/wallstreetbets/comments/jxtxsm/gme_warning_to_all_shorts_and_gay_bears_you_will/,2020-11-24 21:04,31,50,0.94
2th52,wallstreetbets,jxu77q,2020-11-20 18:10,Did I miss something or was this bound to happen?,https://i.redd.it/2fg5dbo9rf061.jpg,2020-11-24 21:04,44,9,0.7
2th52,wallstreetbets,jxu8lo,2020-11-20 18:12,Missed on TSLA and PLTR? CRSR new play in town!!,https://www.reddit.com/r/wallstreetbets/comments/jxu8lo/missed_on_tsla_and_pltr_crsr_new_play_in_town/,2020-11-24 21:04,28,23,0.84
2th52,wallstreetbets,jxu9y4,2020-11-20 18:14,Jack Ma - Smartest Person on Earth,https://i.redd.it/xveyus5vrf061.png,2020-11-24 21:04,320,2300,0.99
2th52,wallstreetbets,jxubi3,2020-11-20 18:16,BABA will go 🚀🚀🚀🚀🚀🚀🚀🚀🚀🚀 Nothing can stop Jack Ma boiiiiiiii ( sold ) new target 280c 11/27,https://i.redd.it/p78knr0csf061.jpg,2020-11-24 21:04,24,25,0.83
2th52,wallstreetbets,jxud6d,2020-11-20 18:18,Roblox sells $1.2bn of virtual currency as it heads for IPO,https://www.google.com/amp/s/amp.ft.com/content/177e2a01-4098-4e9b-9792-02711de46dd4,2020-11-24 21:04,97,292,0.99
2th52,wallstreetbets,jxuftt,2020-11-20 18:22,Holds for the weekend,https://www.reddit.com/r/wallstreetbets/comments/jxuftt/holds_for_the_weekend/,2020-11-24 21:04,20,12,0.84
2th52,wallstreetbets,jxugwf,2020-11-20 18:24,Is this the pullback in PLTR that everyone is looking for??,https://www.reddit.com/r/wallstreetbets/comments/jxugwf/is_this_the_pullback_in_pltr_that_everyone_is/,2020-11-24 21:04,23,8,0.72
2th52,wallstreetbets,jxusjf,2020-11-20 18:40,Tesla Model 3 crash sends scorching battery cells into a nearby house,https://www.engadget.com/tesla-model-3-crash-battery-fire-090759530.html,2020-11-24 21:04,37,30,0.83
2th52,wallstreetbets,jxv5y6,2020-11-20 19:00,AZN,https://www.reddit.com/r/wallstreetbets/comments/jxv5y6/azn/,2020-11-24 21:04,21,4,0.83
2th52,wallstreetbets,jxv7p7,2020-11-20 19:02,Buy the PLTR dip,https://www.reddit.com/r/wallstreetbets/comments/jxv7p7/buy_the_pltr_dip/,2020-11-24 21:04,89,164,0.88
2th52,wallstreetbets,jxvcky,2020-11-20 19:09,These gonna print me some tendies?? PLTR 19C 11/27 BLNK 25C 12/18,https://i.redd.it/wsj640fs1g061.jpg,2020-11-24 21:04,22,14,0.86
2th52,wallstreetbets,jxve30,2020-11-20 19:11,I hope GameStop gets what's coming to them.,https://www.reddit.com/r/wallstreetbets/comments/jxve30/i_hope_gamestop_gets_whats_coming_to_them/,2020-11-24 21:04,28,0,0.34
2th52,wallstreetbets,jxven5,2020-11-20 19:12,Webull is hot garbage,https://www.reddit.com/r/wallstreetbets/comments/jxven5/webull_is_hot_garbage/,2020-11-24 21:04,24,3,0.72
2th52,wallstreetbets,jxvffz,2020-11-20 19:13,You autist retards need to buy the TSLA dip. (Broken record I know),https://www.reddit.com/r/wallstreetbets/comments/jxvffz/you_autist_retards_need_to_buy_the_tsla_dip/,2020-11-24 21:04,20,5,0.73
2th52,wallstreetbets,jxvhjl,2020-11-20 19:17,Tell Me Why I Shouldn't Buy Puts on ZM,https://www.reddit.com/r/wallstreetbets/comments/jxvhjl/tell_me_why_i_shouldnt_buy_puts_on_zm/,2020-11-24 21:04,26,5,0.79
2th52,wallstreetbets,jxvkkf,2020-11-20 19:21,PLTR more than just Government Contracts,https://www.reddit.com/r/wallstreetbets/comments/jxvkkf/pltr_more_than_just_government_contracts/,2020-11-24 21:04,24,94,0.92
2th52,wallstreetbets,jxvqda,2020-11-20 19:30,GME Technical Analysis,https://www.reddit.com/r/wallstreetbets/comments/jxvqda/gme_technical_analysis/,2020-11-24 21:04,24,24,0.83
2th52,wallstreetbets,jxw3px,2020-11-20 19:50,$ R I O T Next Week,https://www.reddit.com/r/wallstreetbets/comments/jxw3px/r_i_o_t_next_week/,2020-11-24 21:04,23,7,0.77
2th52,wallstreetbets,jxw62x,2020-11-20 19:54,FCEL might have longer term legs,https://www.reddit.com/r/wallstreetbets/comments/jxw62x/fcel_might_have_longer_term_legs/,2020-11-24 21:04,69,42,0.86
2th52,wallstreetbets,jxw75f,2020-11-20 19:56,ACB is climbing... tons of buyers just bought a flurry of options,https://www.reddit.com/gallery/jxw75f,2020-11-24 21:04,21,6,0.75
2th52,wallstreetbets,jxwbv5,2020-11-20 20:02,So we all agree that PLTR just proved something today right?,https://www.reddit.com/r/wallstreetbets/comments/jxwbv5/so_we_all_agree_that_pltr_just_proved_something/,2020-11-24 21:04,94,125,0.87
2th52,wallstreetbets,jxwitz,2020-11-20 20:12,"US Largest Rare Earth manufacturer just went public from a Chamath SPAC (FVAC U -> MP), and they have contracts with Tesla, Apple, US DoD, etc... Earnings released Monday. $MP",https://64.media.tumblr.com/0777bbaca0412452feb2349335ac804b/tumblr_mfioq2rsQ91qmxcc6o6_r1_250.gif,2020-11-24 21:04,25,25,0.92
2th52,wallstreetbets,jxwljs,2020-11-20 20:16,Never shared this because every time I look at this chart it reminds me of the euphoria and pain. There were no withdrawals,https://www.reddit.com/gallery/jxwljs,2020-11-24 21:04,87,339,0.98
2th52,wallstreetbets,jxwtvk,2020-11-20 20:28,Move for next week PLTR,https://www.reddit.com/r/wallstreetbets/comments/jxwtvk/move_for_next_week_pltr/,2020-11-24 21:04,58,40,0.85
2th52,wallstreetbets,jxwywj,2020-11-20 20:36,Challenge for the bravest among you autists,https://www.reddit.com/r/wallstreetbets/comments/jxwywj/challenge_for_the_bravest_among_you_autists/,2020-11-24 21:04,25,107,0.97
2th52,wallstreetbets,jxx7mu,2020-11-20 20:49,For everyone who bought at a high point today $pltr,https://v.redd.it/a0b6kxokjg061,2020-11-24 21:04,23,28,0.8
2th52,wallstreetbets,jxxgz8,2020-11-20 21:03,PLTR,https://www.reddit.com/r/wallstreetbets/comments/jxxgz8/pltr/,2020-11-24 21:04,29,36,0.77
2th52,wallstreetbets,jxxhts,2020-11-20 21:05,Pltr ready to have a large retrace,https://www.reddit.com/r/wallstreetbets/comments/jxxhts/pltr_ready_to_have_a_large_retrace/,2020-11-24 21:04,38,0,0.22
2th52,wallstreetbets,jxxhvp,2020-11-20 21:05,PLTR is extremely undervalued.,https://www.reddit.com/r/wallstreetbets/comments/jxxhvp/pltr_is_extremely_undervalued/,2020-11-24 21:04,405,856,0.9
2th52,wallstreetbets,jxxiry,2020-11-20 21:06,"Weekend Discussion Thread for the Weekend of November 20, 2020",https://www.reddit.com/r/wallstreetbets/comments/jxxiry/weekend_discussion_thread_for_the_weekend_of/,2020-11-24 21:04,28269,372,0.92
2th52,wallstreetbets,jxxr8i,2020-11-20 21:19,$PLTR YOLO Month 1,https://i.redd.it/i6py6rdzog061.jpg,2020-11-24 21:04,24,64,0.97
2th52,wallstreetbets,jxxslm,2020-11-20 21:21,ALERT. ALERT. Roblox will be getting an IPO.,https://www.reddit.com/r/wallstreetbets/comments/jxxslm/alert_alert_roblox_will_be_getting_an_ipo/,2020-11-24 21:04,24,18,0.69
2th52,wallstreetbets,jxxvku,2020-11-20 21:25,Stopped being a pussy,https://i.redd.it/dln86dm4qg061.jpg,2020-11-24 21:04,57,398,0.95
2th52,wallstreetbets,jxy61s,2020-11-20 21:42,You Ain't Never Had a Friend Like Me,https://i.redd.it/nt1ipz01tg061.png,2020-11-24 21:04,26,1273,0.98
2th52,wallstreetbets,jxy84m,2020-11-20 21:45,"Elon Musk tweeting about $XPEV, looks like he’s finally met his match competing in the ev world",https://i.redd.it/y02hbl1mtg061.jpg,2020-11-24 21:04,31,47,0.91
2th52,wallstreetbets,jxy90c,2020-11-20 21:46,"Trying to ride PYPL to Tendy town, help.",https://www.reddit.com/r/wallstreetbets/comments/jxy90c/trying_to_ride_pypl_to_tendy_town_help/,2020-11-24 21:04,25,3,0.8
2th52,wallstreetbets,jxy9xv,2020-11-20 21:48,What the fuck is going on in Robinhood's login graphic?,https://imgur.com/XsyMKIc,2020-11-24 21:04,63,413,0.98
2th52,wallstreetbets,jxye2q,2020-11-20 21:54,Sold all my positions except for ev spacs...,https://www.reddit.com/r/wallstreetbets/comments/jxye2q/sold_all_my_positions_except_for_ev_spacs/,2020-11-24 21:04,21,14,0.77
2th52,wallstreetbets,jxyeb5,2020-11-20 21:55,Can't wait to try out this new way of losing money,https://i.redd.it/pgqxg8ybvg061.jpg,2020-11-24 21:04,30,82,0.97
2th52,wallstreetbets,jxyeq2,2020-11-20 21:55,The Weekly S&P 500 Bubble Chart (+TSLA),https://v.redd.it/sv666cvdug061,2020-11-24 21:04,46,399,0.99
2th52,wallstreetbets,jxykar,2020-11-20 22:04,Nano dimension (NNDM) is the next genius brands. Here is why,https://www.reddit.com/r/wallstreetbets/comments/jxykar/nano_dimension_nndm_is_the_next_genius_brands/,2020-11-24 21:04,24,12,0.93
2th52,wallstreetbets,jxz6x1,2020-11-20 22:39,Will I be able to recover from this? Fool me once shame on you.. fool me twice... shame on me 💀,https://i.redd.it/1h48iqzb3h061.jpg,2020-11-24 21:04,43,14,0.83
2th52,wallstreetbets,jxz8pt,2020-11-20 22:42,When did you start getting this right?,https://www.reddit.com/r/wallstreetbets/comments/jxz8pt/when_did_you_start_getting_this_right/,2020-11-24 21:04,38,18,0.9
2th52,wallstreetbets,jxzkzk,2020-11-20 23:02,I've decided on given up on life.,https://i.redd.it/g0442xac7h061.jpg,2020-11-24 21:04,164,220,0.91
2th52,wallstreetbets,jxzrlx,2020-11-20 23:13,"Here's my PLTR Positions, please tell me why I'm fucked!",https://www.reddit.com/r/wallstreetbets/comments/jxzrlx/heres_my_pltr_positions_please_tell_me_why_im/,2020-11-24 21:04,58,39,0.9
2th52,wallstreetbets,jy08bl,2020-11-20 23:40,Take Me to $1M,https://www.reddit.com/r/wallstreetbets/comments/jy08bl/take_me_to_1m/,2020-11-24 21:04,61,93,0.9
2th52,wallstreetbets,jy08er,2020-11-20 23:40,The market is going to blow,https://www.reddit.com/r/wallstreetbets/comments/jy08er/the_market_is_going_to_blow/,2020-11-24 21:04,90,56,0.8
2th52,wallstreetbets,jy0bq1,2020-11-20 23:46,"Tell me to not be a pussy, and not to sell these",https://i.redd.it/btkp4fb8fh061.jpg,2020-11-24 21:04,37,2,0.6
2th52,wallstreetbets,jy0cui,2020-11-20 23:48,Days like these😍😍😍,https://i.redd.it/6lub3zxkfh061.jpg,2020-11-24 21:04,35,130,0.93
2th52,wallstreetbets,jy0j4m,2020-11-20 23:58,GME,https://www.reddit.com/r/wallstreetbets/comments/jy0j4m/gme/,2020-11-24 21:04,42,58,0.98
2th52,wallstreetbets,jy0ks4,2020-11-21 00:01,WSBVoteBot Log for Nov 21 2020,https://www.reddit.com/r/wallstreetbets/comments/jy0ks4/wsbvotebot_log_for_nov_21_2020/,2020-11-24 21:04,61,3,0.81
2th52,wallstreetbets,jy0kvi,2020-11-21 00:01,WSB paying for my dogs surgical bills. All gains on PLTR calls. Thanks autist!,https://i.redd.it/gkocjftwhh061.jpg,2020-11-24 21:03,56,66,0.82
2th52,wallstreetbets,jy0st7,2020-11-21 00:14,AYRO to double digits NEXT WEEK!,https://www.reddit.com/r/wallstreetbets/comments/jy0st7/ayro_to_double_digits_next_week/,2020-11-24 21:03,93,22,0.86
2th52,wallstreetbets,jy0v6i,2020-11-21 00:18,NYC will shut down Monday after rush hour,https://www.reddit.com/r/wallstreetbets/comments/jy0v6i/nyc_will_shut_down_monday_after_rush_hour/,2020-11-24 21:03,52,42,0.92
2th52,wallstreetbets,jy0wtl,2020-11-21 00:21,"About 7 years ago, I bought PHOT at the absolute pinnacle of its existence at $42. today, it is worth like 0.11. I hold it to remind me of how amazing sounds at the time can absolutely die. are any of you holding this?",https://www.reddit.com/r/wallstreetbets/comments/jy0wtl/about_7_years_ago_i_bought_phot_at_the_absolute/,2020-11-24 21:03,30,49,0.97
2th52,wallstreetbets,jy19vb,2020-11-21 00:44,Future SPAC Trendy: GIK - LOI Expected to Drop This Week or Next 👀 👀,https://www.reddit.com/r/wallstreetbets/comments/jy19vb/future_spac_trendy_gik_loi_expected_to_drop_this/,2020-11-24 21:03,24,23,0.97
2th52,wallstreetbets,jy1cyx,2020-11-21 00:50,"Why are you autists so stuck at minor price differences, especially with PLTR",https://www.reddit.com/r/wallstreetbets/comments/jy1cyx/why_are_you_autists_so_stuck_at_minor_price/,2020-11-24 21:03,183,609,0.97
2th52,wallstreetbets,jy1j9i,2020-11-21 01:01,Robinhood Black Friday Ad Came Out,https://i.redd.it/hh7yfbwjsh061.png,2020-11-24 21:03,103,2001,0.99
2th52,wallstreetbets,jy1vi4,2020-11-21 01:23,Do you have any hobbies? Magnets.,https://www.reddit.com/r/wallstreetbets/comments/jy1vi4/do_you_have_any_hobbies_magnets/,2020-11-24 21:03,64,52,0.9
2th52,wallstreetbets,jy27nh,2020-11-21 01:45,Can you spot where i discovered options?,https://i.imgur.com/hh7hD68.jpg,2020-11-24 21:03,42,145,0.94
2th52,wallstreetbets,jy2879,2020-11-21 01:46,"It ain't much, but it's step 1 out of 30 towards paying for medical school",https://www.reddit.com/gallery/jy2879,2020-11-24 21:03,33,48,0.86
2th52,wallstreetbets,jy2snd,2020-11-21 02:23,Do any of you live (or plan to move to) more tax friendly jurisdiction?,https://www.reddit.com/r/wallstreetbets/comments/jy2snd/do_any_of_you_live_or_plan_to_move_to_more_tax/,2020-11-24 21:03,40,20,0.92
2th52,wallstreetbets,jy2txf,2020-11-21 02:25,Fuck it. I’m all in.,https://i.redd.it/vzqxwgbm7i061.jpg,2020-11-24 21:03,64,263,0.98
2th52,wallstreetbets,jy2zi7,2020-11-21 02:35,You guys think you are the MM,https://www.reddit.com/r/wallstreetbets/comments/jy2zi7/you_guys_think_you_are_the_mm/,2020-11-24 21:03,42,10,0.66
2th52,wallstreetbets,jy33ix,2020-11-21 02:43,The Most Popular Tickers on Reddit for this Week,https://i.redd.it/7cvrei7rai061.png,2020-11-24 21:03,36,52,0.98
2th52,wallstreetbets,jy3fgk,2020-11-21 03:05,Congrats to the PLTRian who FOMOed and joined ATH today,https://i.redd.it/pjk7ubrqei061.gif,2020-11-24 21:03,60,301,0.97
2th52,wallstreetbets,jy3o61,2020-11-21 03:22,What's been your all time biggest GUH moment?,https://www.reddit.com/r/wallstreetbets/comments/jy3o61/whats_been_your_all_time_biggest_guh_moment/,2020-11-24 21:03,50,14,0.9
2th52,wallstreetbets,jy3s0d,2020-11-21 03:29,PLTR Semi-Shitpost,https://www.reddit.com/r/wallstreetbets/comments/jy3s0d/pltr_semishitpost/,2020-11-24 21:03,29,73,0.89
2th52,wallstreetbets,jy3up1,2020-11-21 03:34,Dr. Michael Burry is gonna iLUMNate your portfolio with tendies.,https://www.reddit.com/r/wallstreetbets/comments/jy3up1/dr_michael_burry_is_gonna_ilumnate_your_portfolio/,2020-11-24 21:03,229,318,0.9
2th52,wallstreetbets,jy3wy5,2020-11-21 03:39,A Word Cloud of the Most Popular Tickers this Week,https://i.redd.it/lpie297nki061.png,2020-11-24 21:03,52,196,0.98
2th52,wallstreetbets,jy3zr7,2020-11-21 03:44,I've done it. 😳 😳 😳,https://www.reddit.com/r/wallstreetbets/comments/jy3zr7/ive_done_it/,2020-11-24 21:03,29,57,0.89
2th52,wallstreetbets,jy4e4r,2020-11-21 04:13,"Today my car broke down and won't jump, I lost my phone so I can't call for help, and I'm locked out of my robinhood account without sms code authentication",https://www.reddit.com/r/wallstreetbets/comments/jy4e4r/today_my_car_broke_down_and_wont_jump_i_lost_my/,2020-11-24 21:03,23,40,0.94
2th52,wallstreetbets,jy4nbb,2020-11-21 04:32,PLUG will do well next week! 💎🖕,https://www.reddit.com/r/wallstreetbets/comments/jy4nbb/plug_will_do_well_next_week/,2020-11-24 21:03,30,17,0.77
2th52,wallstreetbets,jy4pyy,2020-11-21 04:37,Each trading day consists of 420 minutes,https://www.reddit.com/r/wallstreetbets/comments/jy4pyy/each_trading_day_consists_of_420_minutes/,2020-11-24 21:03,32,22,0.75
2th52,wallstreetbets,jy4t3b,2020-11-21 04:43,Galaxy Brain AF,https://i.redd.it/2rdnnsr8wi061.png,2020-11-24 21:03,28,72,0.96
2th52,wallstreetbets,jy4vec,2020-11-21 04:48,The gay bear's guide to deciding when to invest,https://www.reddit.com/r/wallstreetbets/comments/jy4vec/the_gay_bears_guide_to_deciding_when_to_invest/,2020-11-24 21:03,32,227,0.98
2th52,wallstreetbets,jy4zif,2020-11-21 04:57,#5 ranked retard on the east coast😎👨🏻‍🚀,https://i.redd.it/25t7uo1nyi061.jpg,2020-11-24 21:03,30,51,0.91
2th52,wallstreetbets,jy54xl,2020-11-21 05:07,"Most Anticipated Earnings Releases for the week beginning November 23rd, 2020",https://i.redd.it/j3kpqy9j0j061.png,2020-11-24 21:03,58,47,0.91
2th52,wallstreetbets,jy5lml,2020-11-21 05:43,There's Going to be a Lot of New Posts Next Week...,https://i.redd.it/7d591h1v6j061.png,2020-11-24 21:03,63,261,0.99
2th52,wallstreetbets,jy5t8l,2020-11-21 06:01,SHORT TOYOTA!!!,https://v.redd.it/dwxufgik9j061,2020-11-24 21:03,27,261,0.96
2th52,wallstreetbets,jy5v4d,2020-11-21 06:05,"Sir, This is a Casino Royale (sound on)",https://v.redd.it/thpl8obe9j061,2020-11-24 21:03,31,457,0.97
2th52,wallstreetbets,jy62i3,2020-11-21 06:22,Moderna Calls,https://www.reddit.com/r/wallstreetbets/comments/jy62i3/moderna_calls/,2020-11-24 21:03,25,36,0.92
2th52,wallstreetbets,jy6ann,2020-11-21 06:41,But did you have fun though?,https://i.redd.it/ajcj0hl9hj061.jpg,2020-11-24 21:03,98,678,0.97
2th52,wallstreetbets,jy6oak,2020-11-21 07:14,Since everyone wanted me to post my All-Time. Here you go. Might as well post Today's gains and the current positions im in as well👍,https://www.reddit.com/gallery/jy6oak,2020-11-24 21:03,140,436,0.97
2th52,wallstreetbets,jy6zlb,2020-11-21 07:44,Gain and loss under 5 mins,https://i.redd.it/78kn0bzjsj061.jpg,2020-11-24 21:03,689,13215,0.97
2th52,wallstreetbets,jy8dc0,2020-11-21 10:01,"SRAC, the space company you dont know about...launched by SPACEX rockets.",https://www.reddit.com/r/wallstreetbets/comments/jy8dc0/srac_the_space_company_you_dont_know/,2020-11-24 21:03,33,41,0.87
2th52,wallstreetbets,jy8xbl,2020-11-21 10:56,Built it in 3 years and ruined it in a week by try your YOLO shit,https://i.redd.it/hkar5srpqk061.jpg,2020-11-24 21:03,229,1352,0.98
2th52,wallstreetbets,jy97ku,2020-11-21 11:22,Depressed :(,https://www.reddit.com/r/wallstreetbets/comments/jy97ku/depressed/,2020-11-24 21:03,92,130,0.91
2th52,wallstreetbets,jy9rxq,2020-11-21 12:14,About time I close these bad boys,https://i.redd.it/uq33btzl4l061.jpg,2020-11-24 21:03,36,107,0.92
2th52,wallstreetbets,jyaw7j,2020-11-21 13:40,Sell calls using leaps as collateral,https://www.reddit.com/r/wallstreetbets/comments/jyaw7j/sell_calls_using_leaps_as_collateral/,2020-11-24 21:03,95,23,0.75
2th52,wallstreetbets,jybc5a,2020-11-21 14:10,Can I get some TA on this chart please? Looking to see when to expect a rebound.,https://i.redd.it/40j31a0cpl061.jpg,2020-11-24 21:03,88,333,0.98
2th52,wallstreetbets,jybfmr,2020-11-21 14:16,Welcome PLTR to the meme team,https://v.redd.it/q63w5fmeol061,2020-11-24 21:03,407,10287,0.98
2th52,wallstreetbets,jyc2vf,2020-11-21 14:59,DD on BABA,https://www.reddit.com/r/wallstreetbets/comments/jyc2vf/dd_on_baba/,2020-11-24 21:03,27,16,0.76
2th52,wallstreetbets,jyc8bh,2020-11-21 15:08,Retard vs Autist,https://www.reddit.com/r/wallstreetbets/comments/jyc8bh/retard_vs_autist/,2020-11-24 21:03,96,360,0.94
2th52,wallstreetbets,jychpm,2020-11-21 15:24,"Wall Street Week Ahead for the trading week beginning November 23rd, 2020",https://www.reddit.com/r/wallstreetbets/comments/jychpm/wall_street_week_ahead_for_the_trading_week/,2020-11-24 21:03,41,67,0.89
2th52,wallstreetbets,jyd0ua,2020-11-21 15:56,Trying to find the next meme. Liquified Nat Gas and engines for alt energy vehicles,https://www.reddit.com/r/wallstreetbets/comments/jyd0ua/trying_to_find_the_next_meme_liquified_nat_gas/,2020-11-24 21:03,30,12,0.73
2th52,wallstreetbets,jydhn1,2020-11-21 16:23,"EV Loss Porn Here Will Be Fantastic, Get Your Popcorn Ready",https://www.reddit.com/r/wallstreetbets/comments/jydhn1/ev_loss_porn_here_will_be_fantastic_get_your/,2020-11-24 21:03,40,31,0.68
2th52,wallstreetbets,jydig1,2020-11-21 16:24,$9K -> $50K in a week. Thanks Papa,https://www.reddit.com/gallery/jydig1,2020-11-24 21:03,46,199,0.97
2th52,wallstreetbets,jydje6,2020-11-21 16:25,The Curious Case for Clean Energy,https://www.reddit.com/r/wallstreetbets/comments/jydje6/the_curious_case_for_clean_energy/,2020-11-24 21:03,32,34,0.81
2th52,wallstreetbets,jydrlk,2020-11-21 16:38,RBLX,https://www.reddit.com/r/wallstreetbets/comments/jydrlk/rblx/,2020-11-24 21:03,23,10,0.68
