Subreddit_ID,Subreddit_Name,Submission_ID,Submission_CreatedDate,Submission_Title,Submission_URL,Submission_LastFetched,Submission_NumComments,Submission_Score,Submission_UpvoteRatio
2qjfk,stocks,jshj10,2020-11-11 22:02,What are the best EV stocks to buy besides Tesla and Nio?,https://www.reddit.com/r/stocks/comments/jshj10/what_are_the_best_ev_stocks_to_buy_besides_tesla/,2020-11-24 21:03,92,29,0.82
2qjfk,stocks,jshv4r,2020-11-11 22:19,"BMW unveils electric SUV to challenge Tesla, plans U.S. launch in early 2022",https://www.reddit.com/r/stocks/comments/jshv4r/bmw_unveils_electric_suv_to_challenge_tesla_plans/,2020-11-24 21:03,102,87,0.94
2qjfk,stocks,jsibk8,2020-11-11 22:43,Day 1 Massive fail,https://www.reddit.com/r/stocks/comments/jsibk8/day_1_massive_fail/,2020-11-24 21:03,38,0,0.47
2qjfk,stocks,jsipps,2020-11-11 23:03,If you could back before COVID...,https://www.reddit.com/r/stocks/comments/jsipps/if_you_could_back_before_covid/,2020-11-24 21:03,21,0,0.27
2qjfk,stocks,jsjdxt,2020-11-11 23:40,Jim Cramer's checklist of what an investor should analyze when researching a company - From the 1990s/2000s - Using Nike as an example - Taken from my schools archive,https://www.reddit.com/r/stocks/comments/jsjdxt/jim_cramers_checklist_of_what_an_investor_should/,2020-11-24 21:03,121,1045,0.96
2qjfk,stocks,jsjnz3,2020-11-11 23:55,"Opinion: Nokia is going to skyrocket in the long-run, possibly shorter than people realize.",https://www.reddit.com/r/stocks/comments/jsjnz3/opinion_nokia_is_going_to_skyrocket_in_the/,2020-11-24 21:03,22,0,0.44
2qjfk,stocks,jsjso0,2020-11-12 00:02,What do you guys think about DKNG right now?,https://www.reddit.com/r/stocks/comments/jsjso0/what_do_you_guys_think_about_dkng_right_now/,2020-11-24 21:03,48,29,0.85
2qjfk,stocks,jskzj3,2020-11-12 01:10,Can someone help me understand stocks auto stocks Toyota?,https://www.reddit.com/r/stocks/comments/jskzj3/can_someone_help_me_understand_stocks_auto_stocks/,2020-11-24 21:03,28,12,0.81
2qjfk,stocks,jsme72,2020-11-12 02:34,What Laptop should I get for day trading?,https://www.reddit.com/r/stocks/comments/jsme72/what_laptop_should_i_get_for_day_trading/,2020-11-24 21:03,31,0,0.27
2qjfk,stocks,jsmje7,2020-11-12 02:43,Palantir Volume 11/11/2020,https://www.reddit.com/r/stocks/comments/jsmje7/palantir_volume_11112020/,2020-11-24 21:03,37,37,0.88
2qjfk,stocks,jsnh0b,2020-11-12 03:44,Is trading stocks really this simple?,https://www.reddit.com/r/stocks/comments/jsnh0b/is_trading_stocks_really_this_simple/,2020-11-24 21:03,64,18,0.64
2qjfk,stocks,jsp1ai,2020-11-12 05:30,Sony PS5 sold out online as pandemic chills real-world retailing,https://www.reddit.com/r/stocks/comments/jsp1ai/sony_ps5_sold_out_online_as_pandemic_chills/,2020-11-24 21:03,25,99,0.94
2qjfk,stocks,jsqt8f,2020-11-12 07:59,TSLA or PLTR&PLUG?,https://www.reddit.com/r/stocks/comments/jsqt8f/tsla_or_pltrplug/,2020-11-24 21:03,34,18,0.86
2qjfk,stocks,jsqwiy,2020-11-12 08:06,"r/Stocks Daily Discussion & Options Trading Thursday - Nov 12, 2020",https://www.reddit.com/r/stocks/comments/jsqwiy/rstocks_daily_discussion_options_trading_thursday/,2020-11-24 21:03,545,15,0.87
2qjfk,stocks,jssfww,2020-11-12 10:32,With a recession incoming do you think buying stocks in stable banks and/or mortgage capital firms make sense due to a greater demand in mortgage and loans due to more money being needed by certain individuals to survive,https://www.reddit.com/r/stocks/comments/jssfww/with_a_recession_incoming_do_you_think_buying/,2020-11-24 21:03,20,1,0.56
2qjfk,stocks,jssm2d,2020-11-12 10:49,"Started investing during 2020, naturally leaned towards tech stocks, but want to diversify into other sectors - what are your favourite non-tech stocks to look into?",https://www.reddit.com/r/stocks/comments/jssm2d/started_investing_during_2020_naturally_leaned/,2020-11-24 21:03,148,108,0.94
2qjfk,stocks,jssufd,2020-11-12 11:10,It’s not too late to invest in XPEV,https://www.reddit.com/r/stocks/comments/jssufd/its_not_too_late_to_invest_in_xpev/,2020-11-24 21:03,149,118,0.83
2qjfk,stocks,jst5e5,2020-11-12 11:37,Disney stock | Moderna news | Stock market news [12-11-2020],https://www.reddit.com/r/stocks/comments/jst5e5/disney_stock_moderna_news_stock_market_news/,2020-11-24 21:03,23,88,0.9
2qjfk,stocks,jsv9r6,2020-11-12 14:13,Will stocks boosted by recent Pfizer vaccine news likely go up again with Moderna?,https://www.reddit.com/r/stocks/comments/jsv9r6/will_stocks_boosted_by_recent_pfizer_vaccine_news/,2020-11-24 21:03,28,38,0.89
2qjfk,stocks,jsvnsj,2020-11-12 14:36,Solar or diversfied renewable energy stocks?,https://www.reddit.com/r/stocks/comments/jsvnsj/solar_or_diversfied_renewable_energy_stocks/,2020-11-24 21:03,189,386,0.96
2qjfk,stocks,jsvo37,2020-11-12 14:37,XPENG and Hyliion earnings calls today,https://www.reddit.com/r/stocks/comments/jsvo37/xpeng_and_hyliion_earnings_calls_today/,2020-11-24 21:03,61,34,0.9
2qjfk,stocks,jswwqh,2020-11-12 15:48,"DoorDash, Roblox, Wish and Airbnb all expected to go public before year’s end, sources say",https://www.reddit.com/r/stocks/comments/jswwqh/doordash_roblox_wish_and_airbnb_all_expected_to/,2020-11-24 21:03,362,1701,0.99
2qjfk,stocks,jsz3a4,2020-11-12 17:40,Do you buy stocks for popular products you come across in day to day life?,https://www.reddit.com/r/stocks/comments/jsz3a4/do_you_buy_stocks_for_popular_products_you_come/,2020-11-24 21:03,20,14,0.94
2qjfk,stocks,jsziul,2020-11-12 18:02,Why is my cash going down as my investments go up ?,https://www.reddit.com/r/stocks/comments/jsziul/why_is_my_cash_going_down_as_my_investments_go_up/,2020-11-24 21:03,21,3,0.67
2qjfk,stocks,jt0djj,2020-11-12 18:43,Does anyone else think there could be another crash due to potential lockdowns/covid?,https://www.reddit.com/r/stocks/comments/jt0djj/does_anyone_else_think_there_could_be_another/,2020-11-24 21:03,27,6,0.69
2qjfk,stocks,jt1xam,2020-11-12 19:59,Sell PLTR before earning or hold out?,https://www.reddit.com/r/stocks/comments/jt1xam/sell_pltr_before_earning_or_hold_out/,2020-11-24 21:03,30,28,0.91
2qjfk,stocks,jt22bl,2020-11-12 20:06,Trump administration readies crackdown on U.S. investments in Chinese firms,https://www.reddit.com/r/stocks/comments/jt22bl/trump_administration_readies_crackdown_on_us/,2020-11-24 21:03,43,47,0.96
2qjfk,stocks,jt2bmo,2020-11-12 20:19,"I did it, I cashed out",https://www.reddit.com/r/stocks/comments/jt2bmo/i_did_it_i_cashed_out/,2020-11-24 21:03,347,119,0.65
2qjfk,stocks,jt2mt8,2020-11-12 20:35,Time to make a move on Li?,https://www.reddit.com/r/stocks/comments/jt2mt8/time_to_make_a_move_on_li/,2020-11-24 21:03,35,16,0.92
2qjfk,stocks,jt3b14,2020-11-12 21:10,"Palantir Reports Revenue Growth of 52% in the Third Quarter, Raises Full-Year 2020 Guidance",https://www.reddit.com/r/stocks/comments/jt3b14/palantir_reports_revenue_growth_of_52_in_the/,2020-11-24 21:03,46,73,0.91
2qjfk,stocks,jt3dgo,2020-11-12 21:13,Disney loses 36cents per share but beats expectations,https://www.reddit.com/r/stocks/comments/jt3dgo/disney_loses_36cents_per_share_but_beats/,2020-11-24 21:03,33,50,0.94
2qjfk,stocks,jt3vn2,2020-11-12 21:39,AMC Entertainment Stock 2021,https://www.reddit.com/r/stocks/comments/jt3vn2/amc_entertainment_stock_2021/,2020-11-24 21:03,23,9,0.86
2qjfk,stocks,jt4ji1,2020-11-12 22:14,Palantir stock drops even after company reports 52% sales growth in first earnings statement,https://www.reddit.com/r/stocks/comments/jt4ji1/palantir_stock_drops_even_after_company_reports/,2020-11-24 21:03,113,334,0.97
2qjfk,stocks,jt4jwt,2020-11-12 22:15,Full-time traders.,https://www.reddit.com/r/stocks/comments/jt4jwt/fulltime_traders/,2020-11-24 21:03,65,29,0.85
2qjfk,stocks,jt6dxr,2020-11-12 23:59,"New Trump executive order prohibiting Americans from owning stock in ""Banned"" Chinese companies (list posted)",https://www.reddit.com/r/stocks/comments/jt6dxr/new_trump_executive_order_prohibiting_americans/,2020-11-24 21:03,76,60,0.89
2qjfk,stocks,jt7ctv,2020-11-13 00:57,Are we expecting a dip for LI and XPEV over the weekend?,https://www.reddit.com/r/stocks/comments/jt7ctv/are_we_expecting_a_dip_for_li_and_xpev_over_the/,2020-11-24 21:03,21,12,0.88
2qjfk,stocks,jt8b6c,2020-11-13 01:57,Why are short term gains taxes looked down upon so heavily relative to long term?,https://www.reddit.com/r/stocks/comments/jt8b6c/why_are_short_term_gains_taxes_looked_down_upon/,2020-11-24 21:03,38,17,0.88
2qjfk,stocks,jtbian,2020-11-13 05:35,Looking for fast growing stocks.,https://www.reddit.com/r/stocks/comments/jtbian/looking_for_fast_growing_stocks/,2020-11-24 21:03,40,0,0.41
2qjfk,stocks,jtdc3f,2020-11-13 08:07,"r/Stocks Daily Discussion & Fundamentals Friday Nov 13, 2020",https://www.reddit.com/r/stocks/comments/jtdc3f/rstocks_daily_discussion_fundamentals_friday_nov/,2020-11-24 21:03,778,34,0.93
2qjfk,stocks,jtdpfi,2020-11-13 08:42,"Hyliion, another Nikola or a new rival to Tesla?",https://www.reddit.com/r/stocks/comments/jtdpfi/hyliion_another_nikola_or_a_new_rival_to_tesla/,2020-11-24 21:03,46,25,0.8
2qjfk,stocks,jteoor,2020-11-13 10:18,BABA: Analysts should adjust its target prices down from $338 average to maybe $300 on China’s regulation of monopolistic practices in tech,https://www.reddit.com/r/stocks/comments/jteoor/baba_analysts_should_adjust_its_target_prices/,2020-11-24 21:03,27,10,0.66
2qjfk,stocks,jtfrqx,2020-11-13 11:59,China’s President Xi Jinping Personally Scuttled Jack Ma’s Ant IPO,https://www.reddit.com/r/stocks/comments/jtfrqx/chinas_president_xi_jinping_personally_scuttled/,2020-11-24 21:03,43,80,0.95
2qjfk,stocks,jtfrxg,2020-11-13 12:00,At what point would I need to pay tax on the money I withdraw?,https://www.reddit.com/r/stocks/comments/jtfrxg/at_what_point_would_i_need_to_pay_tax_on_the/,2020-11-24 21:03,71,79,0.94
2qjfk,stocks,jtfs5i,2020-11-13 12:00,What is the one stock in your portfolio that you expect to get the biggest return from in 3-5 years?,https://www.reddit.com/r/stocks/comments/jtfs5i/what_is_the_one_stock_in_your_portfolio_that_you/,2020-11-24 21:03,564,228,0.92
2qjfk,stocks,jtgbn7,2020-11-13 12:51,"DraftKings stock jumps after reporting third-quarter beat, surge in users",https://www.reddit.com/r/stocks/comments/jtgbn7/draftkings_stock_jumps_after_reporting/,2020-11-24 21:03,132,911,0.97
2qjfk,stocks,jthuyf,2020-11-13 15:40,My plan of investing,https://www.reddit.com/r/stocks/comments/jthuyf/my_plan_of_investing/,2020-11-24 21:03,21,1,1.0
2qjfk,stocks,jthw5v,2020-11-13 15:41,"The future of BABA, a slippery slope down? Or bargain of the week?",https://www.reddit.com/r/stocks/comments/jthw5v/the_future_of_baba_a_slippery_slope_down_or/,2020-11-24 21:03,119,65,0.95
2qjfk,stocks,jti7yw,2020-11-13 15:58,"Stop buying ACB, look at APHA",https://www.reddit.com/r/stocks/comments/jti7yw/stop_buying_acb_look_at_apha/,2020-11-24 21:03,66,142,0.91
2qjfk,stocks,jtjdis,2020-11-13 16:55,"Citron Pulls Plug On NIO, Says Valuation 'Can Never Be Justified' NIO Price Target is $25",https://www.reddit.com/r/stocks/comments/jtjdis/citron_pulls_plug_on_nio_says_valuation_can_never/,2020-11-24 21:03,245,370,0.92
2qjfk,stocks,jtjw5d,2020-11-13 17:21,Unloaded NIO at $48 and bought DKNG,https://www.reddit.com/r/stocks/comments/jtjw5d/unloaded_nio_at_48_and_bought_dkng/,2020-11-24 21:03,72,52,0.84
2qjfk,stocks,jtl900,2020-11-13 18:29,BCLI and Upcoming FDA,https://www.reddit.com/r/stocks/comments/jtl900/bcli_and_upcoming_fda/,2020-11-24 21:03,25,7,0.82
2qjfk,stocks,jtqq4g,2020-11-13 23:06,Opinion on the volatility of PTLR?,https://www.reddit.com/r/stocks/comments/jtqq4g/opinion_on_the_volatility_of_ptlr/,2020-11-24 21:03,26,10,0.81
2qjfk,stocks,jtqwmq,2020-11-13 23:16,Walmart VS Amazon. Why my money is on Walmart,https://www.reddit.com/r/stocks/comments/jtqwmq/walmart_vs_amazon_why_my_money_is_on_walmart/,2020-11-24 21:03,148,322,0.88
2qjfk,stocks,jtrewh,2020-11-13 23:44,"Pandemic or Not, Visa Remains a Growth Stock Stalking Its Biggest Rival, Cash",https://www.reddit.com/r/stocks/comments/jtrewh/pandemic_or_not_visa_remains_a_growth_stock/,2020-11-24 21:03,40,92,0.96
2qjfk,stocks,jtrvvn,2020-11-14 00:13,Google just bought a car dealership and 5 acres of land in a Seattle suburb,https://www.reddit.com/r/stocks/comments/jtrvvn/google_just_bought_a_car_dealership_and_5_acres/,2020-11-24 21:03,84,1751,0.98
2qjfk,stocks,jtrweq,2020-11-14 00:14,Do you see NIO running again next week given earnings are on Teusday?,https://www.reddit.com/r/stocks/comments/jtrweq/do_you_see_nio_running_again_next_week_given/,2020-11-24 21:03,50,7,0.69
2qjfk,stocks,jts5se,2020-11-14 00:30,"Besides Reddit, where do you get your stock advice?",https://www.reddit.com/r/stocks/comments/jts5se/besides_reddit_where_do_you_get_your_stock_advice/,2020-11-24 21:03,65,32,0.88
2qjfk,stocks,jtug83,2020-11-14 02:56,Citron’s NIO short report is fake news,https://www.reddit.com/r/stocks/comments/jtug83/citrons_nio_short_report_is_fake_news/,2020-11-24 21:03,213,276,0.89
2qjfk,stocks,jtvjo4,2020-11-14 04:11,Why everyone is mad at Andrew left,https://www.reddit.com/r/stocks/comments/jtvjo4/why_everyone_is_mad_at_andrew_left/,2020-11-24 21:03,28,11,0.73
2qjfk,stocks,jtz0s6,2020-11-14 08:48,Why are the tobacco stocks so undervalued?,https://www.reddit.com/r/stocks/comments/jtz0s6/why_are_the_tobacco_stocks_so_undervalued/,2020-11-24 21:03,25,0,0.5
2qjfk,stocks,ju070t,2020-11-14 10:49,Many of us have a momentum fetish.,https://www.reddit.com/r/stocks/comments/ju070t/many_of_us_have_a_momentum_fetish/,2020-11-24 21:03,44,14,0.57
2qjfk,stocks,ju1vb4,2020-11-14 13:23,Nvidia’s big change is about to flip back around,https://www.reddit.com/r/stocks/comments/ju1vb4/nvidias_big_change_is_about_to_flip_back_around/,2020-11-24 21:03,40,36,0.97
2qjfk,stocks,ju3a38,2020-11-14 15:06,The fear of averaging up,https://www.reddit.com/r/stocks/comments/ju3a38/the_fear_of_averaging_up/,2020-11-24 21:03,65,22,0.9
2qjfk,stocks,ju4zae,2020-11-14 16:51,Looking back at r/stocks predictions regarding Hyliion (HYLN),https://www.reddit.com/r/stocks/comments/ju4zae/looking_back_at_rstocks_predictions_regarding/,2020-11-24 21:03,34,17,0.78
2qjfk,stocks,ju53m6,2020-11-14 16:58,Can anyone explain SQQQ to me?,https://www.reddit.com/r/stocks/comments/ju53m6/can_anyone_explain_sqqq_to_me/,2020-11-24 21:03,20,2,0.63
2qjfk,stocks,ju57s3,2020-11-14 17:05,"Wall Street Week Ahead for the trading week beginning November 16th, 2020",https://www.reddit.com/r/stocks/comments/ju57s3/wall_street_week_ahead_for_the_trading_week/,2020-11-24 21:03,33,100,0.98
2qjfk,stocks,ju663r,2020-11-14 18:02,"I know this sounds stupid, but Apple is a good long-term investment. Right?",https://www.reddit.com/r/stocks/comments/ju663r/i_know_this_sounds_stupid_but_apple_is_a_good/,2020-11-24 21:03,99,62,0.79
2qjfk,stocks,ju6y7q,2020-11-14 18:47,Costco selling $17.5K private jet membership that lasts 1 year,https://www.reddit.com/r/stocks/comments/ju6y7q/costco_selling_175k_private_jet_membership_that/,2020-11-24 21:03,365,3702,0.97
2qjfk,stocks,ju9844,2020-11-14 21:00,$RKT new financial partner,https://www.reddit.com/r/stocks/comments/ju9844/rkt_new_financial_partner/,2020-11-24 21:03,22,8,0.9
2qjfk,stocks,jub2kb,2020-11-14 22:53,Would you consider AAPL a good growth stock? What are your top 5 growth stocks?,https://www.reddit.com/r/stocks/comments/jub2kb/would_you_consider_aapl_a_good_growth_stock_what/,2020-11-24 21:03,70,32,0.85
2qjfk,stocks,juc1ii,2020-11-14 23:55,"What’s everyone’s opinion on Palantir reporting to the public, government spending on their software. Especially in such a controversial field like data mining. Do you think it will have a negative impact on the company or stock? Public backlash or sort. Thank you.",https://www.reddit.com/r/stocks/comments/juc1ii/whats_everyones_opinion_on_palantir_reporting_to/,2020-11-24 21:03,22,0,0.5
2qjfk,stocks,jud0hl,2020-11-15 00:58,UK to ban sale of new petrol and diesel cars from 2030: FT,https://www.reddit.com/r/stocks/comments/jud0hl/uk_to_ban_sale_of_new_petrol_and_diesel_cars_from/,2020-11-24 21:03,30,46,0.98
2qjfk,stocks,judbat,2020-11-15 01:17,Can I use my parents account for stocks,https://www.reddit.com/r/stocks/comments/judbat/can_i_use_my_parents_account_for_stocks/,2020-11-24 21:03,20,0,0.45
2qjfk,stocks,juduli,2020-11-15 01:54,"Besides TSLA and NIO, what other stocks do you recommend in the EV sector? Would you say now is a good time to jump into the aforementioned 2 stocks?",https://www.reddit.com/r/stocks/comments/juduli/besides_tsla_and_nio_what_other_stocks_do_you/,2020-11-24 21:03,45,3,0.67
2qjfk,stocks,juepyc,2020-11-15 02:53,Looking for growth outside US tech,https://www.reddit.com/r/stocks/comments/juepyc/looking_for_growth_outside_us_tech/,2020-11-24 21:03,85,23,0.97
2qjfk,stocks,juiqb6,2020-11-15 08:26,Help with how to get to know the China Market?,https://www.reddit.com/r/stocks/comments/juiqb6/help_with_how_to_get_to_know_the_china_market/,2020-11-24 21:03,30,9,0.75
2qjfk,stocks,juj33r,2020-11-15 09:03,Who are the most popular/best YouTube stock reviewers?,https://www.reddit.com/r/stocks/comments/juj33r/who_are_the_most_popularbest_youtube_stock/,2020-11-24 21:03,137,86,0.84
2qjfk,stocks,jukzrn,2020-11-15 12:14,Palantir Limited?,https://www.reddit.com/r/stocks/comments/jukzrn/palantir_limited/,2020-11-24 21:03,22,0,0.39
2qjfk,stocks,jul0j1,2020-11-15 12:16,TDOC: the future of Healthcare?,https://www.reddit.com/r/stocks/comments/jul0j1/tdoc_the_future_of_healthcare/,2020-11-24 21:03,48,37,0.9
2qjfk,stocks,jum6ln,2020-11-15 13:53,likely reaction to a second lockdown in the US,https://www.reddit.com/r/stocks/comments/jum6ln/likely_reaction_to_a_second_lockdown_in_the_us/,2020-11-24 21:03,110,24,0.71
2qjfk,stocks,jumgtz,2020-11-15 14:13,"Largest U.S. Pension Bought Up EV Stocks Nikola and NIO, and Zoom",https://www.reddit.com/r/stocks/comments/jumgtz/largest_us_pension_bought_up_ev_stocks_nikola_and/,2020-11-24 21:03,258,893,0.96
2qjfk,stocks,juqw8d,2020-11-15 18:41,DiVErsItY,https://www.reddit.com/r/stocks/comments/juqw8d/diversity/,2020-11-24 21:03,31,10,0.68
2qjfk,stocks,jurep7,2020-11-15 19:10,Boomer stock to tech stock to Moon,https://www.reddit.com/r/stocks/comments/jurep7/boomer_stock_to_tech_stock_to_moon/,2020-11-24 21:03,23,12,0.77
2qjfk,stocks,jurrx5,2020-11-15 19:31,"PayPal, Square, or Palantir",https://www.reddit.com/r/stocks/comments/jurrx5/paypal_square_or_palantir/,2020-11-24 21:03,140,127,0.89
2qjfk,stocks,juskpq,2020-11-15 20:14,Pfizer vs Moderna?,https://www.reddit.com/r/stocks/comments/juskpq/pfizer_vs_moderna/,2020-11-24 21:03,25,17,0.92
2qjfk,stocks,juspqu,2020-11-15 20:22,If all you’re looking for growth stocks then here you go,https://www.reddit.com/r/stocks/comments/juspqu/if_all_youre_looking_for_growth_stocks_then_here/,2020-11-24 21:03,627,1979,0.92
2qjfk,stocks,jutoa3,2020-11-15 21:14,Favorite stock market podcast?,https://www.reddit.com/r/stocks/comments/jutoa3/favorite_stock_market_podcast/,2020-11-24 21:03,45,67,0.99
2qjfk,stocks,jutytn,2020-11-15 21:30,Any good small-cap/mid-cap picks for 2021 and beyond?,https://www.reddit.com/r/stocks/comments/jutytn/any_good_smallcapmidcap_picks_for_2021_and_beyond/,2020-11-24 21:03,25,16,0.9
2qjfk,stocks,juu56t,2020-11-15 21:40,"UK to ban ICE-cars by 2030, 5 years earlier than previous planned 2035.",https://www.reddit.com/r/stocks/comments/juu56t/uk_to_ban_icecars_by_2030_5_years_earlier_than/,2020-11-24 21:03,49,85,0.95
2qjfk,stocks,juwbcj,2020-11-15 23:50,WHATS HAPPENING WITH NIO?,https://www.reddit.com/r/stocks/comments/juwbcj/whats_happening_with_nio/,2020-11-24 21:03,142,49,0.77
2qjfk,stocks,juwqcv,2020-11-16 00:16,Stock market is near all time highs,https://www.reddit.com/r/stocks/comments/juwqcv/stock_market_is_near_all_time_highs/,2020-11-24 21:03,50,0,0.5
2qjfk,stocks,jv0h71,2020-11-16 04:26,Advice on how to minimize my losses on a shitty trading decision,https://www.reddit.com/r/stocks/comments/jv0h71/advice_on_how_to_minimize_my_losses_on_a_shitty/,2020-11-24 21:03,23,5,0.74
2qjfk,stocks,jv14ag,2020-11-16 05:13,Exit Points for NIO and PLTR?,https://www.reddit.com/r/stocks/comments/jv14ag/exit_points_for_nio_and_pltr/,2020-11-24 21:03,30,13,0.81
2qjfk,stocks,jv1hah,2020-11-16 05:41,AMD vs. NVIDIA?,https://www.reddit.com/r/stocks/comments/jv1hah/amd_vs_nvidia/,2020-11-24 21:03,34,17,0.96
2qjfk,stocks,jv1zri,2020-11-16 06:23,Has anyone actually looked into BABA financials? They dont make any sense to me,https://www.reddit.com/r/stocks/comments/jv1zri/has_anyone_actually_looked_into_baba_financials/,2020-11-24 21:03,21,19,0.77
2qjfk,stocks,jv2j78,2020-11-16 07:10,"Softbank exits stake in 24 companies, exits AMZN, GOOG, TSLA",https://www.reddit.com/r/stocks/comments/jv2j78/softbank_exits_stake_in_24_companies_exits_amzn/,2020-11-24 21:03,22,32,0.91
2qjfk,stocks,jv36al,2020-11-16 08:09,"r/Stocks Daily Discussion Monday - Nov 16, 2020",https://www.reddit.com/r/stocks/comments/jv36al/rstocks_daily_discussion_monday_nov_16_2020/,2020-11-24 21:03,518,19,0.86
2qjfk,stocks,jv3oua,2020-11-16 08:59,Why are Pfizer stocks not going to the moon?,https://www.reddit.com/r/stocks/comments/jv3oua/why_are_pfizer_stocks_not_going_to_the_moon/,2020-11-24 21:03,25,2,0.58
2qjfk,stocks,jv4jfq,2020-11-16 10:21,is it to late to get on the pltr train?,https://www.reddit.com/r/stocks/comments/jv4jfq/is_it_to_late_to_get_on_the_pltr_train/,2020-11-24 21:03,21,14,0.86
2qjfk,stocks,jv4w9q,2020-11-16 10:56,Brexit and UK stocks,https://www.reddit.com/r/stocks/comments/jv4w9q/brexit_and_uk_stocks/,2020-11-24 21:03,22,4,0.83
2qjfk,stocks,jv5pgq,2020-11-16 12:08,Moderna: Covid vaccine shows nearly 95% protection,https://www.reddit.com/r/stocks/comments/jv5pgq/moderna_covid_vaccine_shows_nearly_95_protection/,2020-11-24 21:03,216,1909,0.97
2qjfk,stocks,jv5tnl,2020-11-16 12:18,SPCE taking a big hit,https://www.reddit.com/r/stocks/comments/jv5tnl/spce_taking_a_big_hit/,2020-11-24 21:03,31,4,0.71
2qjfk,stocks,jv7ss1,2020-11-16 14:38,What is the future of Palantir?,https://www.reddit.com/r/stocks/comments/jv7ss1/what_is_the_future_of_palantir/,2020-11-24 21:03,125,79,0.9
2qjfk,stocks,jv8mo8,2020-11-16 15:27,NIO Predictions,https://www.reddit.com/r/stocks/comments/jv8mo8/nio_predictions/,2020-11-24 21:03,88,22,0.74
2qjfk,stocks,jv8zo7,2020-11-16 15:48,When do you sell your stocks for profit?,https://www.reddit.com/r/stocks/comments/jv8zo7/when_do_you_sell_your_stocks_for_profit/,2020-11-24 21:03,42,18,0.8
2qjfk,stocks,jvabnr,2020-11-16 16:59,"The President has decreed that Americans must divest themselves of any holdings in 31 Chinese companies, by Nov 11 2021",https://www.reddit.com/r/stocks/comments/jvabnr/the_president_has_decreed_that_americans_must/,2020-11-24 21:03,26,11,0.76
2qjfk,stocks,jvat4j,2020-11-16 17:24,"The DOW is going to be 30,000 by the time Donald Trump leaves office. Love him or hate him, that's pretty remarkable",https://www.reddit.com/r/stocks/comments/jvat4j/the_dow_is_going_to_be_30000_by_the_time_donald/,2020-11-24 21:03,53,0,0.39
2qjfk,stocks,jvaxiw,2020-11-16 17:30,Is Peloton donezo?,https://www.reddit.com/r/stocks/comments/jvaxiw/is_peloton_donezo/,2020-11-24 21:03,23,0,0.5
2qjfk,stocks,jvb2da,2020-11-16 17:37,BABA... how low will it go?,https://www.reddit.com/r/stocks/comments/jvb2da/baba_how_low_will_it_go/,2020-11-24 21:03,58,23,0.85
2qjfk,stocks,jvcd9p,2020-11-16 18:44,Growth Stocks,https://www.reddit.com/r/stocks/comments/jvcd9p/growth_stocks/,2020-11-24 21:03,21,13,0.79
2qjfk,stocks,jvcnrk,2020-11-16 18:59,Just bought me some PTON,https://www.reddit.com/r/stocks/comments/jvcnrk/just_bought_me_some_pton/,2020-11-24 21:03,45,19,0.83
2qjfk,stocks,jvczac,2020-11-16 19:14,"CBAT is up 58% today , 171% in last 5 days",https://www.reddit.com/r/stocks/comments/jvczac/cbat_is_up_58_today_171_in_last_5_days/,2020-11-24 21:03,45,9,0.77
2qjfk,stocks,jve4u1,2020-11-16 20:13,I'm about to get rid of all my MSFT stocks,https://www.reddit.com/r/stocks/comments/jve4u1/im_about_to_get_rid_of_all_my_msft_stocks/,2020-11-24 21:03,25,0,0.31
2qjfk,stocks,jvelxc,2020-11-16 20:37,Thought on MindMed (MMED)?,https://www.reddit.com/r/stocks/comments/jvelxc/thought_on_mindmed_mmed/,2020-11-24 21:03,36,46,0.95
2qjfk,stocks,jvg35a,2020-11-16 21:53,Are people sleeping on Home Depot?,https://www.reddit.com/r/stocks/comments/jvg35a/are_people_sleeping_on_home_depot/,2020-11-24 21:03,24,15,0.82
2qjfk,stocks,jvgdu6,2020-11-16 22:09,DraftKings (DKNG) gets a price target of $100 from Loop Capital,https://www.reddit.com/r/stocks/comments/jvgdu6/draftkings_dkng_gets_a_price_target_of_100_from/,2020-11-24 21:03,22,46,0.91
2qjfk,stocks,jvgkwc,2020-11-16 22:20,What's your investment philosophy?,https://www.reddit.com/r/stocks/comments/jvgkwc/whats_your_investment_philosophy/,2020-11-24 21:03,23,3,0.67
2qjfk,stocks,jvgnor,2020-11-16 22:23,S&P Global announced that Tesla will join the S&P 500. TSLA rockets 10% after announcement,https://www.reddit.com/r/stocks/comments/jvgnor/sp_global_announced_that_tesla_will_join_the_sp/,2020-11-24 21:03,550,3413,0.95
2qjfk,stocks,jvh18k,2020-11-16 22:43,Costco announces a special dividend of 10$ a share,https://www.reddit.com/r/stocks/comments/jvh18k/costco_announces_a_special_dividend_of_10_a_share/,2020-11-24 21:03,47,107,0.99
2qjfk,stocks,jvhw7h,2020-11-16 23:32,"EV stock upgrades 11/16/2020: $LI, $XPEV dramatically boosted to new target prices ($LI to $45.60, $XPEV to $57.71) by Citigroup",https://www.reddit.com/r/stocks/comments/jvhw7h/ev_stock_upgrades_11162020_li_xpev_dramatically/,2020-11-24 21:03,22,28,0.9
2qjfk,stocks,jvioxs,2020-11-17 00:19,"Dividend Portfolio (Tales of the ""Dividend guy"")",https://www.reddit.com/r/stocks/comments/jvioxs/dividend_portfolio_tales_of_the_dividend_guy/,2020-11-24 21:03,29,10,1.0
2qjfk,stocks,jvje9f,2020-11-17 01:03,"Airbnb files to go public, turned a profit last quarter",https://www.reddit.com/r/stocks/comments/jvje9f/airbnb_files_to_go_public_turned_a_profit_last/,2020-11-24 21:03,31,43,0.9
