Subreddit_ID,Subreddit_Name,Submission_ID,Submission_CreatedDate,Submission_Title,Submission_URL,Submission_LastFetched,Submission_NumComments,Submission_Score,Submission_UpvoteRatio
2th52,wallstreetbets,k53k0w,2020-12-02 05:56,Michael Burry shorting the shit outta TSLA and making it public on twitter. Grab the 🍿 and make your bets,https://i.redd.it/ffbiojibrp261.jpg,2020-12-05 15:01,398,933,0.97
2th52,wallstreetbets,k5451y,2020-12-02 06:38,Anyone else play ZM earnings?,https://i.redd.it/jqwnwgisyp261.jpg,2020-12-05 15:01,36,45,0.92
2th52,wallstreetbets,k5464b,2020-12-02 06:41,From the Scientist who posted the NVAX DD: Updates about recent COVID Vaccine news and today's price action for $NVAX & $MRNA,https://www.reddit.com/r/wallstreetbets/comments/k5464b/from_the_scientist_who_posted_the_nvax_dd_updates/,2020-12-05 15:01,43,82,0.94
2th52,wallstreetbets,k5464e,2020-12-02 06:41,PTON - Growth through and after COVID,https://www.reddit.com/r/wallstreetbets/comments/k5464e/pton_growth_through_and_after_covid/,2020-12-05 15:01,21,13,0.75
2th52,wallstreetbets,k54b3q,2020-12-02 06:51,Does the government like Palantir back?,https://www.reddit.com/r/wallstreetbets/comments/k54b3q/does_the_government_like_palantir_back/,2020-12-05 15:01,43,44,0.84
2th52,wallstreetbets,k54kfm,2020-12-02 07:12,UK approves Pfizer/BioNTech Covid vaccine for mass roll out and could start within days,https://www.bbc.com/news/health-55145696,2020-12-05 15:01,82,330,0.96
2th52,wallstreetbets,k54us4,2020-12-02 07:34,How To Trade Like A Pro!,https://i.redd.it/6ysr748b8q261.png,2020-12-05 15:01,395,13069,0.98
2th52,wallstreetbets,k54xcw,2020-12-02 07:40,Holding until the god dam wheels fall off.,https://i.redd.it/5wcn345r9q261.jpg,2020-12-05 15:01,87,219,0.95
2th52,wallstreetbets,k54yy3,2020-12-02 07:43,"JPMorgan published the article that said Nikola’s 25% dive is a good buying opportunity, let’s look at that claim",https://www.reddit.com/r/wallstreetbets/comments/k54yy3/jpmorgan_published_the_article_that_said_nikolas/,2020-12-05 15:01,30,45,0.91
2th52,wallstreetbets,k56n9f,2020-12-02 10:08,PLTR DD In-depth Analysis,https://v.redd.it/uj124v6vzq261,2020-12-05 15:01,336,4128,0.96
2th52,wallstreetbets,k56osd,2020-12-02 10:12,Am i retarded?,https://i.redd.it/3ac7phbx0r261.jpg,2020-12-05 15:01,32,170,0.95
2th52,wallstreetbets,k57d6a,2020-12-02 11:10,"Daily Discussion Thread for December 02, 2020",https://www.reddit.com/r/wallstreetbets/comments/k57d6a/daily_discussion_thread_for_december_02_2020/,2020-12-05 15:01,28332,378,0.93
2th52,wallstreetbets,k57ha3,2020-12-02 11:20,"[PLTR] Morgan Stanley analyst Keith Weiss upgrades price target, downgrades rating",https://www.reddit.com/r/wallstreetbets/comments/k57ha3/pltr_morgan_stanley_analyst_keith_weiss_upgrades/,2020-12-05 15:01,26,33,0.82
2th52,wallstreetbets,k57nob,2020-12-02 11:35,CRWD will kill it,https://www.reddit.com/r/wallstreetbets/comments/k57nob/crwd_will_kill_it/,2020-12-05 15:01,34,12,0.87
2th52,wallstreetbets,k58a9d,2020-12-02 12:24,Privacy Group CONFIRMS PALANTIR already has multiple contracts with UK gov,https://www.reddit.com/r/wallstreetbets/comments/k58a9d/privacy_group_confirms_palantir_already_has/,2020-12-05 15:01,49,325,0.92
2th52,wallstreetbets,k58igt,2020-12-02 12:41,GME PT Upgrade,https://imgur.com/fludqTn,2020-12-05 15:01,73,490,0.97
2th52,wallstreetbets,k58rn3,2020-12-02 12:59,12/1 SPY RECAP and 12/2 Possibilities or Let SPY Help You Kick Your Wife's BF Out the House,https://www.reddit.com/r/wallstreetbets/comments/k58rn3/121_spy_recap_and_122_possibilities_or_let_spy/,2020-12-05 15:01,46,20,0.84
2th52,wallstreetbets,k593an,2020-12-02 13:21,Roblox - A first look into valuation before the IPO,https://www.reddit.com/r/wallstreetbets/comments/k593an/roblox_a_first_look_into_valuation_before_the_ipo/,2020-12-05 15:01,226,289,0.69
2th52,wallstreetbets,k596h4,2020-12-02 13:27,$BB on the open (and long),https://www.reddit.com/r/wallstreetbets/comments/k596h4/bb_on_the_open_and_long/,2020-12-05 15:01,62,100,0.95
2th52,wallstreetbets,k59ldj,2020-12-02 13:53,I’m from the future.... if $PLTR doesn’t close above the green line by the end of the day then it will be heading down to $17.99 next.,https://i.redd.it/0hq5hpea4s261.jpg,2020-12-05 15:01,45,30,0.69
2th52,wallstreetbets,k59u2g,2020-12-02 14:07,Telsey Advisory Group Raises GME price target from $10 to $19,https://newsfilter.io/a/1c45f54b3f3c0d48c77f9f1078bc5c4f,2020-12-05 15:01,152,704,0.98
2th52,wallstreetbets,k5aboe,2020-12-02 14:36,"It was a calculated risk, but man, am I bad at math.",https://i.redd.it/47ke8bi0cs261.jpg,2020-12-05 15:01,1020,11860,0.95
2th52,wallstreetbets,k5ack0,2020-12-02 14:37,You guys lied to me...,https://www.reddit.com/gallery/k5ack0,2020-12-05 15:01,47,166,0.92
2th52,wallstreetbets,k5acx9,2020-12-02 14:38,Never quit!! Got some $48 NIO calls worth $28 lmaoo,https://i.redd.it/brcecwldcs261.jpg,2020-12-05 15:01,70,285,0.96
2th52,wallstreetbets,k5aoi3,2020-12-02 14:56,PLTR has hit the dip,https://www.reddit.com/r/wallstreetbets/comments/k5aoi3/pltr_has_hit_the_dip/,2020-12-05 15:01,369,841,0.93
2th52,wallstreetbets,k5aou3,2020-12-02 14:56,"Attempting to gain back losses from NIO and PLTR, who's with me?",https://i.redd.it/3zav3edofs261.jpg,2020-12-05 15:01,45,34,0.86
2th52,wallstreetbets,k5awn8,2020-12-02 15:08,Holding GME Is like dating the fat girl.,https://www.reddit.com/r/wallstreetbets/comments/k5awn8/holding_gme_is_like_dating_the_fat_girl/,2020-12-05 15:01,340,3042,0.95
2th52,wallstreetbets,k5axun,2020-12-02 15:10,Tesla for dummies and 5 year olds.,https://www.reddit.com/r/wallstreetbets/comments/k5axun/tesla_for_dummies_and_5_year_olds/,2020-12-05 15:01,28,68,0.92
2th52,wallstreetbets,k5ayde,2020-12-02 15:11,"Why ARNT we talking about PFE ""Pfizer"" to TENDIE TOWN",https://www.reddit.com/r/wallstreetbets/comments/k5ayde/why_arnt_we_talking_about_pfe_pfizer_to_tendie/,2020-12-05 15:01,57,29,0.81
2th52,wallstreetbets,k5ayoe,2020-12-02 15:11,Hold The Line!,https://www.youtube.com/watch?v=FZWrGI2hA9Q&feature=share,2020-12-05 15:01,28,164,0.96
2th52,wallstreetbets,k5b0ot,2020-12-02 15:14,"$RKT Looking good. Inverse Head and Shoulders formation with lots of consolidation over the past 3 months. This is your time to buy, it is only up from here",https://www.reddit.com/r/wallstreetbets/comments/k5b0ot/rkt_looking_good_inverse_head_and_shoulders/,2020-12-05 15:01,33,10,0.71
2th52,wallstreetbets,k5b2tf,2020-12-02 15:17,"My life savings, man.",https://i.redd.it/5e397dpfjs261.jpg,2020-12-05 15:01,193,479,0.77
2th52,wallstreetbets,k5b31u,2020-12-02 15:18,I lost my tuition money on WORK calls 😞,https://www.reddit.com/r/wallstreetbets/comments/k5b31u/i_lost_my_tuition_money_on_work_calls/,2020-12-05 15:01,91,38,0.81
2th52,wallstreetbets,k5bapc,2020-12-02 15:29,Who’s still holding? Is PLTR a dead stock now?,https://i.redd.it/6gaau5pils261.jpg,2020-12-05 15:01,116,34,0.71
2th52,wallstreetbets,k5bbd6,2020-12-02 15:30,BB IS MY BABY,https://i.redd.it/8ttfvhrels261.png,2020-12-05 15:01,72,440,0.95
2th52,wallstreetbets,k5bbnx,2020-12-02 15:31,Thank you WSB. Lost almost everything I had for buying a home next year. Looks like I’m gonna keep loving with my mom for a while.,https://i.redd.it/elfqc7yrls261.jpg,2020-12-05 15:01,337,567,0.94
2th52,wallstreetbets,k5bbvo,2020-12-02 15:31,missed my chance to pull out at +$33k now i am here. don't know what to do...,https://i.redd.it/qi9zsokmls261.png,2020-12-05 15:01,112,326,0.96
2th52,wallstreetbets,k5bgpn,2020-12-02 15:38,$50k YOLO on the Walmart of the Seas,https://www.reddit.com/r/wallstreetbets/comments/k5bgpn/50k_yolo_on_the_walmart_of_the_seas/,2020-12-05 15:01,20,15,0.81
2th52,wallstreetbets,k5bko6,2020-12-02 15:43,Thanks PLTR! Am I a true retard now?,https://i.redd.it/q20dfxp1os261.jpg,2020-12-05 15:01,111,473,0.94
2th52,wallstreetbets,k5bnqj,2020-12-02 15:47,Time to fight all 8 gym leaders again,https://i.redd.it/k1o9u02sos261.jpg,2020-12-05 15:01,57,343,0.97
2th52,wallstreetbets,k5bt4e,2020-12-02 15:55,"CRSR, PRPL and PLTR - THETA GANG",https://www.reddit.com/r/wallstreetbets/comments/k5bt4e/crsr_prpl_and_pltr_theta_gang/,2020-12-05 15:01,95,87,0.91
2th52,wallstreetbets,k5btj7,2020-12-02 15:55,"Truly a Momentus opportunity, dont let this one 🚀 by you",https://www.reddit.com/r/wallstreetbets/comments/k5btj7/truly_a_momentus_opportunity_dont_let_this_one_by/,2020-12-05 15:01,91,109,0.89
2th52,wallstreetbets,k5c1ku,2020-12-02 16:06,Survey: How many shares of GME does WSB own?,https://docs.google.com/forms/d/1XP6ylAiNyBwPKGFDhxq5zg6pLzIxjjvD4ZpC8bZdn9c/edit,2020-12-05 15:01,96,117,0.87
2th52,wallstreetbets,k5c5qr,2020-12-02 16:12,Gonna sell covered calls until this shit 🚀🚀,https://i.redd.it/663ojl96ts261.jpg,2020-12-05 15:01,40,42,0.95
2th52,wallstreetbets,k5ceiv,2020-12-02 16:24,PLTR and GME this week hoping that AMD saves me,https://i.redd.it/hgy6s7vavs261.jpg,2020-12-05 15:01,43,179,0.95
2th52,wallstreetbets,k5cgco,2020-12-02 16:26,You think I give a fuck?,https://www.reddit.com/r/wallstreetbets/comments/k5cgco/you_think_i_give_a_fuck/,2020-12-05 15:01,349,1474,0.9
2th52,wallstreetbets,k5cjlj,2020-12-02 16:31,I think I'm done for a year,https://i.redd.it/uhhgpmnhws261.jpg,2020-12-05 15:01,25,32,0.92
2th52,wallstreetbets,k5cm36,2020-12-02 16:34,PLTR: Tagging the major fib can't be ignored,https://www.reddit.com/r/wallstreetbets/comments/k5cm36/pltr_tagging_the_major_fib_cant_be_ignored/,2020-12-05 15:01,45,14,0.71
2th52,wallstreetbets,k5cmeb,2020-12-02 16:34,Copper is the new gold,https://www.reddit.com/r/wallstreetbets/comments/k5cmeb/copper_is_the_new_gold/,2020-12-05 15:01,39,21,0.92
2th52,wallstreetbets,k5cp3k,2020-12-02 16:38,Stripe Article - PSTH speculation,https://www.reddit.com/r/wallstreetbets/comments/k5cp3k/stripe_article_psth_speculation/,2020-12-05 15:01,142,76,0.96
2th52,wallstreetbets,k5cq39,2020-12-02 16:39,Elon Musk warns employees Tesla's stock could 'get crushed like a soufflé under a sledgehammer',https://www.reddit.com/r/wallstreetbets/comments/k5cq39/elon_musk_warns_employees_teslas_stock_could_get/,2020-12-05 15:01,65,76,0.87
2th52,wallstreetbets,k5ctdj,2020-12-02 16:44,My coworker must be in this sub...RIP,https://www.reddit.com/gallery/k5ctdj,2020-12-05 15:01,1160,32416,0.94
2th52,wallstreetbets,k5cz1t,2020-12-02 16:51,"SNOWflake's business explained, no jargon",https://www.reddit.com/r/wallstreetbets/comments/k5cz1t/snowflakes_business_explained_no_jargon/,2020-12-05 15:01,32,15,0.83
2th52,wallstreetbets,k5d06x,2020-12-02 16:52,EASY MONEY MY FRIENDS 💰,https://i.redd.it/good5v8d0t261.jpg,2020-12-05 15:01,25,7,0.65
2th52,wallstreetbets,k5d1yj,2020-12-02 16:55,Just need PLTR to go +100% by Friday and I'll be saved,https://i.redd.it/515u3v3s0t261.jpg,2020-12-05 15:01,30,230,0.96
2th52,wallstreetbets,k5d3az,2020-12-02 16:56,Message from God: NOK tendies await you,https://www.reddit.com/r/wallstreetbets/comments/k5d3az/message_from_god_nok_tendies_await_you/,2020-12-05 15:01,26,4,0.58
2th52,wallstreetbets,k5d4ty,2020-12-02 16:59,Still holding.. Added more on the dip before today’s dip 😂 Will I be okay?,https://i.redd.it/sed8nfrg1t261.jpg,2020-12-05 15:01,22,12,0.72
2th52,wallstreetbets,k5d8du,2020-12-02 17:03,Just tell me now I’m fucked. Go ahead,https://i.redd.it/wfc43zg82t261.jpg,2020-12-05 15:01,37,25,0.82
2th52,wallstreetbets,k5da0z,2020-12-02 17:05,Note to self: no more repping stonks at thanksgiving,https://i.redd.it/9f9g6trl2t261.jpg,2020-12-05 15:01,660,7998,0.98
2th52,wallstreetbets,k5dgu8,2020-12-02 17:14,SPR for the win again! 173k day so far 😍,https://i.redd.it/0ay6ccy74t261.jpg,2020-12-05 15:01,21,49,0.95
2th52,wallstreetbets,k5djut,2020-12-02 17:18,Never doubted NIO for a second. That beautiful bounce @ 38 had my pipi so hard,https://i.redd.it/rjm9p7ux4t261.jpg,2020-12-05 15:01,23,82,0.91
2th52,wallstreetbets,k5dsvh,2020-12-02 17:30,Wonder what my Taxes will be boys 🤔,https://i.redd.it/338kok027t261.jpg,2020-12-05 15:01,31,21,0.88
2th52,wallstreetbets,k5dtg2,2020-12-02 17:31,Thank god NIO popped,https://i.redd.it/mw7ef3x67t261.jpg,2020-12-05 15:01,22,15,0.76
2th52,wallstreetbets,k5dv6k,2020-12-02 17:33,"Salesforce (CRM), a great time to buy",https://www.reddit.com/r/wallstreetbets/comments/k5dv6k/salesforce_crm_a_great_time_to_buy/,2020-12-05 15:01,26,26,0.93
2th52,wallstreetbets,k5e3p3,2020-12-02 17:44,A part of me is starting to dread the GME squeeze.,https://www.reddit.com/r/wallstreetbets/comments/k5e3p3/a_part_of_me_is_starting_to_dread_the_gme_squeeze/,2020-12-05 15:01,99,134,0.95
2th52,wallstreetbets,k5e8lq,2020-12-02 17:50,Tried posting last night my prediction of PLTR compared to DKNG,https://i.redd.it/nlcy7y1iat261.png,2020-12-05 15:01,47,27,0.76
2th52,wallstreetbets,k5eaf1,2020-12-02 17:52,To all you clueless degenerates,https://www.reddit.com/r/wallstreetbets/comments/k5eaf1/to_all_you_clueless_degenerates/,2020-12-05 15:01,133,966,0.97
2th52,wallstreetbets,k5eajm,2020-12-02 17:52,"PLTR riding that 30min oversold RSI, buy that shit up boys!!! 🚀🚀🚀",https://i.redd.it/823gkmq2bt261.jpg,2020-12-05 15:01,30,19,0.76
2th52,wallstreetbets,k5ecdj,2020-12-02 17:55,This is what I come here for,https://i.redd.it/fkgudqbgbt261.jpg,2020-12-05 15:01,76,3196,0.99
2th52,wallstreetbets,k5eddq,2020-12-02 17:56,PLTR GANG FOR LIFE!!,https://ibb.co/61RSkkq,2020-12-05 15:01,25,67,0.93
2th52,wallstreetbets,k5ehrk,2020-12-02 18:01,PLTR Loss Porn Thread,https://www.reddit.com/r/wallstreetbets/comments/k5ehrk/pltr_loss_porn_thread/,2020-12-05 15:01,200,132,0.93
2th52,wallstreetbets,k5ekwg,2020-12-02 18:05,Analysis of a mistake?,https://www.reddit.com/r/wallstreetbets/comments/k5ekwg/analysis_of_a_mistake/,2020-12-05 15:01,42,0,0.5
2th52,wallstreetbets,k5epe1,2020-12-02 18:11,NKLA better tank tomorrow after this bump.,https://i.redd.it/wctqejddet261.png,2020-12-05 15:01,20,17,0.88
2th52,wallstreetbets,k5exv7,2020-12-02 18:22,I suck,https://i.redd.it/ni2cehtcgt261.jpg,2020-12-05 15:01,50,112,0.94
2th52,wallstreetbets,k5f2pw,2020-12-02 18:28,Palantir’s stock pummeled after Morgan Stanley recommends selling,https://www.marketwatch.com/story/palantirs-stock-pummeled-after-morgan-stanley-recommends-selling-11606923579,2020-12-05 15:01,34,69,0.94
2th52,wallstreetbets,k5f5u0,2020-12-02 18:32,PSTH - Retard Opinion,https://www.reddit.com/r/wallstreetbets/comments/k5f5u0/psth_retard_opinion/,2020-12-05 15:01,21,4,0.64
2th52,wallstreetbets,k5f7ev,2020-12-02 18:34,Yesterday i sold nio to buy crsr,https://www.reddit.com/r/wallstreetbets/comments/k5f7ev/yesterday_i_sold_nio_to_buy_crsr/,2020-12-05 15:01,45,115,0.95
2th52,wallstreetbets,k5f8hh,2020-12-02 18:36,"If it's bleeding, it must still be alive",https://i.redd.it/oll4goptit261.jpg,2020-12-05 15:01,38,164,0.95
2th52,wallstreetbets,k5fas8,2020-12-02 18:39,Buy the dip on BLNK. Been rocked the last few days. Biden’s team is going to pump up EV infrastructure. $30c 12/18.,https://www.reddit.com/r/wallstreetbets/comments/k5fas8/buy_the_dip_on_blnk_been_rocked_the_last_few_days/,2020-12-05 15:01,31,5,0.67
2th52,wallstreetbets,k5fdgw,2020-12-02 18:42,So you bought NIO and PLTR calls....what to do now.,https://www.reddit.com/r/wallstreetbets/comments/k5fdgw/so_you_bought_nio_and_pltr_callswhat_to_do_now/,2020-12-05 15:01,35,86,0.8
2th52,wallstreetbets,k5fgr1,2020-12-02 18:47,19 Years Old. Everything I have. Am I doing this right?,https://i.redd.it/9b2rorqrkt261.jpg,2020-12-05 15:01,34,8,0.6
2th52,wallstreetbets,k5fhj9,2020-12-02 18:48,Why GME earnings has me worried,https://www.reddit.com/r/wallstreetbets/comments/k5fhj9/why_gme_earnings_has_me_worried/,2020-12-05 15:01,46,39,0.81
2th52,wallstreetbets,k5fj7d,2020-12-02 18:50,I see your RH dic pics and here's my not so flaccid year !,https://i.redd.it/4xfru4y1lt261.jpg,2020-12-05 15:01,49,322,0.94
2th52,wallstreetbets,k5fjld,2020-12-02 18:50,"Rolls Royce down 50% today, cant find any news source covering this.",https://www.reddit.com/r/wallstreetbets/comments/k5fjld/rolls_royce_down_50_today_cant_find_any_news/,2020-12-05 15:01,76,25,0.85
2th52,wallstreetbets,k5fzdj,2020-12-02 19:11,Im going homeless this is not a joke 🚀🚀,https://i.redd.it/lrj2icj1pt261.jpg,2020-12-05 15:01,329,1076,0.96
2th52,wallstreetbets,k5g26k,2020-12-02 19:14,Can PFE touch $50?,https://www.reddit.com/r/wallstreetbets/comments/k5g26k/can_pfe_touch_50/,2020-12-05 15:01,22,7,0.77
2th52,wallstreetbets,k5g5d0,2020-12-02 19:18,From today- Stripe co-founder John Collison says no IPO or banking planned. Sorry $PSTH gang,https://www.independent.ie/business/stripe-co-founder-john-collisonis-bullishon-post-brexit-uk-andsays-no-ipo-or-banking-planned-39818524.html,2020-12-05 15:01,35,8,0.67
2th52,wallstreetbets,k5g5jg,2020-12-02 19:19,"PLTR short term call holders are such an easy targets, it’s not even funny anymore",https://i.redd.it/958i2lwfqt261.png,2020-12-05 15:01,45,20,0.78
2th52,wallstreetbets,k5gacq,2020-12-02 19:25,Phuk me,https://i.redd.it/pfebjkakrt261.jpg,2020-12-05 15:01,38,28,0.9
2th52,wallstreetbets,k5gbh6,2020-12-02 19:26,"Trying to make the best out of a bad situation, have I goofed up?",https://i.redd.it/qyjyrc8qrt261.png,2020-12-05 15:01,21,4,0.7
2th52,wallstreetbets,k5gbw6,2020-12-02 19:27,Common Themes of People Who Actually Make Money Here,https://www.reddit.com/r/wallstreetbets/comments/k5gbw6/common_themes_of_people_who_actually_make_money/,2020-12-05 15:01,130,463,0.97
2th52,wallstreetbets,k5gg38,2020-12-02 19:32,You have to know when to pull out (even if you never do),https://www.reddit.com/r/wallstreetbets/comments/k5gg38/you_have_to_know_when_to_pull_out_even_if_you/,2020-12-05 15:01,97,346,0.96
2th52,wallstreetbets,k5gl25,2020-12-02 19:39,PLTR downgrade,https://www.reddit.com/r/wallstreetbets/comments/k5gl25/pltr_downgrade/,2020-12-05 15:01,27,19,0.83
2th52,wallstreetbets,k5glb2,2020-12-02 19:39,PLTR mooned at 2:17 PM EST because of me,https://www.reddit.com/r/wallstreetbets/comments/k5glb2/pltr_mooned_at_217_pm_est_because_of_me/,2020-12-05 15:01,62,140,0.88
2th52,wallstreetbets,k5gmhh,2020-12-02 19:40,iBorrowDesk shows few PLTR shares available for shorting,https://www.reddit.com/r/wallstreetbets/comments/k5gmhh/iborrowdesk_shows_few_pltr_shares_available_for/,2020-12-05 15:01,21,44,0.87
2th52,wallstreetbets,k5gqkm,2020-12-02 19:46,Large orders in GME.. Retards know what is about to happen 📈🆙,https://i.redd.it/1y80dgeavt261.jpg,2020-12-05 15:01,21,47,0.89
2th52,wallstreetbets,k5gxdq,2020-12-02 19:55,This Ones for WSB Just Leased in The Old Stratton Oakmont Building,https://www.reddit.com/gallery/k5gxdq,2020-12-05 15:01,160,823,0.98
2th52,wallstreetbets,k5h08r,2020-12-02 19:58,A single tweet is enough to axe down PLTR?,https://www.reddit.com/r/wallstreetbets/comments/k5h08r/a_single_tweet_is_enough_to_axe_down_pltr/,2020-12-05 15:01,162,247,0.91
2th52,wallstreetbets,k5h0fc,2020-12-02 19:59,PSA: GME short interest and share price,https://www.reddit.com/r/wallstreetbets/comments/k5h0fc/psa_gme_short_interest_and_share_price/,2020-12-05 15:01,61,72,0.95
2th52,wallstreetbets,k5hmg6,2020-12-02 20:28,"Hope You Bought The Dip. Your Friend, Elon.",https://i.redd.it/xuo4gr8q2u261.jpg,2020-12-05 15:01,42,361,0.96
2th52,wallstreetbets,k5i11d,2020-12-02 20:47,"Bill Spacman, the Money Guy",https://www.reddit.com/r/wallstreetbets/comments/k5i11d/bill_spacman_the_money_guy/,2020-12-05 15:01,64,59,0.95
2th52,wallstreetbets,k5i2gs,2020-12-02 20:49,Let’s Make Up Losses With Terrible Stocks,https://www.reddit.com/r/wallstreetbets/comments/k5i2gs/lets_make_up_losses_with_terrible_stocks/,2020-12-05 15:01,24,12,0.93
2th52,wallstreetbets,k5ib89,2020-12-02 21:00,CRSR fell 14% today. The reason? Some 🌈🧸 boomer analyst thinks that if a video game doesn't perform well people will buy less accessories and downgraded the stock.,https://www.reddit.com/gallery/k5ib89,2020-12-05 15:01,44,53,0.94
2th52,wallstreetbets,k5icdk,2020-12-02 21:02,Catch these IPO openings 🚀,https://www.reddit.com/r/wallstreetbets/comments/k5icdk/catch_these_ipo_openings/,2020-12-05 15:01,31,18,0.75
2th52,wallstreetbets,k5icky,2020-12-02 21:02,$AAPL ALL IN YOLO TRADE #8,https://i.redd.it/wvly8l2x8u261.jpg,2020-12-05 15:01,57,78,0.92
2th52,wallstreetbets,k5ier4,2020-12-02 21:05,GME : 2 Bulls 1 Cup,https://www.reddit.com/r/wallstreetbets/comments/k5ier4/gme_2_bulls_1_cup/,2020-12-05 15:01,40,80,0.9
2th52,wallstreetbets,k5ifwd,2020-12-02 21:06,"What Are Your Moves Tomorrow, December 03, 2020",https://www.reddit.com/r/wallstreetbets/comments/k5ifwd/what_are_your_moves_tomorrow_december_03_2020/,2020-12-05 15:01,22219,372,0.92
2th52,wallstreetbets,k5ih1q,2020-12-02 21:08,Question for people who were trading stocks before 2020,https://www.reddit.com/r/wallstreetbets/comments/k5ih1q/question_for_people_who_were_trading_stocks/,2020-12-05 15:01,22,5,0.78
2th52,wallstreetbets,k5iiht,2020-12-02 21:10,Dish hopefully loses 160+ channels tonight.,https://www.reddit.com/r/wallstreetbets/comments/k5iiht/dish_hopefully_loses_160_channels_tonight/,2020-12-05 15:01,25,11,0.77
2th52,wallstreetbets,k5indi,2020-12-02 21:17,Was today the worst trading day in WSB history?,https://www.reddit.com/r/wallstreetbets/comments/k5indi/was_today_the_worst_trading_day_in_wsb_history/,2020-12-05 15:01,55,66,0.85
2th52,wallstreetbets,k5ip15,2020-12-02 21:19,I track the day’s highest returning options. Here’s what you missed out on (12/2),https://i.redd.it/35mawf1zbu261.jpg,2020-12-05 15:01,204,1599,0.98
2th52,wallstreetbets,k5ipsp,2020-12-02 21:20,At least gravity will be on my side this time,https://i.redd.it/pn9dxno5cu261.jpg,2020-12-05 15:01,25,333,0.98
2th52,wallstreetbets,k5iq5v,2020-12-02 21:21,Shorting peloton you autist. It is time... and it is the way.,https://www.reddit.com/r/wallstreetbets/comments/k5iq5v/shorting_peloton_you_autist_it_is_time_and_it_is/,2020-12-05 15:01,33,6,0.6
2th52,wallstreetbets,k5ir3e,2020-12-02 21:22,🚀📈Walmart Is The Future📈🚀,https://www.reddit.com/r/wallstreetbets/comments/k5ir3e/walmart_is_the_future/,2020-12-05 15:01,53,71,0.81
2th52,wallstreetbets,k5iw15,2020-12-02 21:29,Bullish Abandoned Baby on PLTR,https://www.reddit.com/r/wallstreetbets/comments/k5iw15/bullish_abandoned_baby_on_pltr/,2020-12-05 15:01,58,45,0.89
2th52,wallstreetbets,k5izgz,2020-12-02 21:34,Gay bears against JMIA must unite,https://www.reddit.com/r/wallstreetbets/comments/k5izgz/gay_bears_against_jmia_must_unite/,2020-12-05 15:01,25,3,0.64
2th52,wallstreetbets,k5jhy3,2020-12-02 21:59,The Bill that Just Passed: S. 945 Holding Foreign Companies Accountable Act,https://www.reddit.com/r/wallstreetbets/comments/k5jhy3/the_bill_that_just_passed_s_945_holding_foreign/,2020-12-05 15:01,24,27,0.88
2th52,wallstreetbets,k5jjj1,2020-12-02 22:01,House Approves Bill Restricting Chinese Listing,https://www.google.com/amp/s/uk.finance.yahoo.com/amphtml/news/house-set-vote-restricting-chinese-194431578.html,2020-12-05 15:01,43,40,0.91
2th52,wallstreetbets,k5jm0v,2020-12-02 22:05,How would you rate Interactive Brokers? I need some feedbacks before I move to IB,https://www.reddit.com/r/wallstreetbets/comments/k5jm0v/how_would_you_rate_interactive_brokers_i_need/,2020-12-05 15:01,21,4,0.65
2th52,wallstreetbets,k5jo87,2020-12-02 22:08,Apple and Tesla are among Morgan Stanley’s top ‘secular growth’ ideas for 2021,https://www.cnbc.com/2020/12/02/apple-and-tesla-are-among-morgan-stanleys-top-secular-growth-ideas-for-2021.html,2020-12-05 15:01,22,25,0.84
2th52,wallstreetbets,k5jq02,2020-12-02 22:11,Pretty sure BB just bottomed out at $7.00,https://www.reddit.com/r/wallstreetbets/comments/k5jq02/pretty_sure_bb_just_bottomed_out_at_700/,2020-12-05 15:01,41,42,0.92
2th52,wallstreetbets,k5jum8,2020-12-02 22:17,"It ain't much, but it's honest work",https://imgur.com/3RD1UzT.jpg,2020-12-05 15:01,24,56,0.88
2th52,wallstreetbets,k5jur7,2020-12-02 22:17,18 years old and just completed 1k to 10k in a month. Slowly becoming more retarded,https://i.redd.it/rv29iy4bmu261.jpg,2020-12-05 15:01,223,1208,0.95
2th52,wallstreetbets,k5kb4u,2020-12-02 22:41,OZON - POPPING TO NEW HIGHS! AMAZON OF RUSSIA! TO THE MOON!!!!!,https://www.reddit.com/r/wallstreetbets/comments/k5kb4u/ozon_popping_to_new_highs_amazon_of_russia_to_the/,2020-12-05 15:01,23,9,0.71
2th52,wallstreetbets,k5khna,2020-12-02 22:50,I shoulda told him to just buy SPY,https://i.redd.it/df7kr7a1su261.jpg,2020-12-05 15:01,572,4491,0.98
2th52,wallstreetbets,k5khz4,2020-12-02 22:51,Almost lost all my grandma’s will money on NIO calls this morning but somehow managed to come back (12/4),https://www.reddit.com/gallery/k5khz4,2020-12-05 15:01,22,30,0.76
2th52,wallstreetbets,k5knns,2020-12-02 22:59,Ford v Tesla,https://www.reddit.com/r/wallstreetbets/comments/k5knns/ford_v_tesla/,2020-12-05 15:01,41,8,0.71
2th52,wallstreetbets,k5kqaw,2020-12-02 23:03,I just want to say thanks to the guy who posted the DD about ZI the other day,https://www.reddit.com/r/wallstreetbets/comments/k5kqaw/i_just_want_to_say_thanks_to_the_guy_who_posted/,2020-12-05 15:01,24,28,0.88
2th52,wallstreetbets,k5kuf5,2020-12-02 23:09,PLTR TECHNICAL PERSPECTIVE,https://i.redd.it/94gz62lfvu261.png,2020-12-05 15:01,50,49,0.83
2th52,wallstreetbets,k5kw69,2020-12-02 23:12,Im dead inside,https://i.redd.it/5nllrfp0wu261.jpg,2020-12-05 15:01,31,21,0.73
2th52,wallstreetbets,k5kxs3,2020-12-02 23:14,Michael Burry asking for the end of our bull market.,https://i.redd.it/s0euqn3bwu261.png,2020-12-05 15:01,230,338,0.98
2th52,wallstreetbets,k5kzhn,2020-12-02 23:17,What you need to know about the HFCA act passed by the House today.,https://www.reddit.com/r/wallstreetbets/comments/k5kzhn/what_you_need_to_know_about_the_hfca_act_passed/,2020-12-05 15:01,22,21,0.82
