Subreddit_ID,Subreddit_Name,Submission_ID,Submission_CreatedDate,Submission_Title,Submission_URL,Submission_LastFetched,Submission_NumComments,Submission_Score,Submission_UpvoteRatio
2qjfk,stocks,lo5j1x,2021-02-20 11:46,Red days are a friendly reminder,https://www.reddit.com/r/stocks/comments/lo5j1x/red_days_are_a_friendly_reminder/,2021-02-28 18:01,468,4012,0.94
2qjfk,stocks,lo5y30,2021-02-20 12:13,S&P success stories?,https://www.reddit.com/r/stocks/comments/lo5y30/sp_success_stories/,2021-02-28 18:01,44,3,0.59
2qjfk,stocks,lo71pt,2021-02-20 13:23,Shopify vs Amazon,https://www.reddit.com/r/stocks/comments/lo71pt/shopify_vs_amazon/,2021-02-28 18:01,28,3,0.56
2qjfk,stocks,lo7rq7,2021-02-20 14:04,Redditors with investing as sole or main source of income,https://www.reddit.com/r/stocks/comments/lo7rq7/redditors_with_investing_as_sole_or_main_source/,2021-02-28 18:01,144,115,0.91
2qjfk,stocks,lo7u8y,2021-02-20 14:08,Poverty Stocks,https://www.reddit.com/r/stocks/comments/lo7u8y/poverty_stocks/,2021-02-28 18:01,57,15,0.67
2qjfk,stocks,lo8hzl,2021-02-20 14:43,PLTR stock investors please do not over optimistic about 1 single stock,https://www.reddit.com/r/stocks/comments/lo8hzl/pltr_stock_investors_please_do_not_over/,2021-02-28 18:01,145,40,0.65
2qjfk,stocks,lo8ntl,2021-02-20 14:52,How to deal with emotions?,https://www.reddit.com/r/stocks/comments/lo8ntl/how_to_deal_with_emotions/,2021-02-28 18:01,36,7,0.71
2qjfk,stocks,lo8ye1,2021-02-20 15:07,ARK ETF fees,https://www.reddit.com/r/stocks/comments/lo8ye1/ark_etf_fees/,2021-02-28 18:01,31,27,0.89
2qjfk,stocks,loa4fw,2021-02-20 16:03,"Do you expect higher-risk ETFs like QQQ, ICLN, ARKK, and ARKG to recover from crashes and undergo long-term growth over 10 years?",https://www.reddit.com/r/stocks/comments/loa4fw/do_you_expect_higherrisk_etfs_like_qqq_icln_arkk/,2021-02-28 18:01,40,37,0.89
2qjfk,stocks,loawht,2021-02-20 16:40,PLTR still a good buy until Wed 2/24?,https://www.reddit.com/r/stocks/comments/loawht/pltr_still_a_good_buy_until_wed_224/,2021-02-28 18:01,71,45,0.81
2qjfk,stocks,lob3m5,2021-02-20 16:50,$CRWD vs $BB,https://www.reddit.com/r/stocks/comments/lob3m5/crwd_vs_bb/,2021-02-28 18:01,60,68,0.86
2qjfk,stocks,lobfjy,2021-02-20 17:04,"This is why you pay attention to Red Days (because it's healthy to notice when market rotations occur) (Heat map of Friday, 02/19)",https://www.reddit.com/r/stocks/comments/lobfjy/this_is_why_you_pay_attention_to_red_days_because/,2021-02-28 18:01,151,647,0.93
2qjfk,stocks,lobjqz,2021-02-20 17:10,Tabaco stocks for long term investing?,https://www.reddit.com/r/stocks/comments/lobjqz/tabaco_stocks_for_long_term_investing/,2021-02-28 18:01,33,1,0.53
2qjfk,stocks,loblud,2021-02-20 17:12,Vistra Corp (VST): Texas Utility that took Winterization Seriously,https://www.reddit.com/r/stocks/comments/loblud/vistra_corp_vst_texas_utility_that_took/,2021-02-28 18:01,49,49,0.94
2qjfk,stocks,lod2my,2021-02-20 18:18,Is it more likely for SPY to go down 3% in a week or up 3% in a week?,https://www.reddit.com/r/stocks/comments/lod2my/is_it_more_likely_for_spy_to_go_down_3_in_a_week/,2021-02-28 18:01,35,0,0.4
2qjfk,stocks,lodaja,2021-02-20 18:28,Which stock are you personally attached the most?,https://www.reddit.com/r/stocks/comments/lodaja/which_stock_are_you_personally_attached_the_most/,2021-02-28 18:01,345,127,0.91
2qjfk,stocks,lodfj0,2021-02-20 18:34,Long Term Value Energy Stocks?,https://www.reddit.com/r/stocks/comments/lodfj0/long_term_value_energy_stocks/,2021-02-28 18:01,24,10,0.82
2qjfk,stocks,lodr90,2021-02-20 18:49,How would you try to recover a portfolio of bad choices?,https://www.reddit.com/r/stocks/comments/lodr90/how_would_you_try_to_recover_a_portfolio_of_bad/,2021-02-28 18:01,44,13,0.66
2qjfk,stocks,lodwr1,2021-02-20 18:55,PLTR long term investment,https://www.reddit.com/r/stocks/comments/lodwr1/pltr_long_term_investment/,2021-02-28 18:01,82,32,0.74
2qjfk,stocks,loen1n,2021-02-20 19:28,High earning monthly/quarterly Dividend stocks.,https://www.reddit.com/r/stocks/comments/loen1n/high_earning_monthlyquarterly_dividend_stocks/,2021-02-28 18:01,55,22,0.91
2qjfk,stocks,loffqz,2021-02-20 20:05,A bug in Schwab caused my retirement account to go naked short GME.,https://www.reddit.com/r/stocks/comments/loffqz/a_bug_in_schwab_caused_my_retirement_account_to/,2021-02-28 18:01,429,2395,0.95
2qjfk,stocks,logla3,2021-02-20 21:00,Which automaker will be the MSFT of EV?,https://www.reddit.com/r/stocks/comments/logla3/which_automaker_will_be_the_msft_of_ev/,2021-02-28 18:01,82,24,0.78
2qjfk,stocks,lohof2,2021-02-20 21:54,What is your #1 favorite stock and best pick for the future?,https://www.reddit.com/r/stocks/comments/lohof2/what_is_your_1_favorite_stock_and_best_pick_for/,2021-02-28 18:01,677,253,0.89
2qjfk,stocks,loiynf,2021-02-20 22:58,"LEAPS: AAPL, AMD, PINS, SQ, PYPL, ETSY",https://www.reddit.com/r/stocks/comments/loiynf/leaps_aapl_amd_pins_sq_pypl_etsy/,2021-02-28 18:01,29,7,0.75
2qjfk,stocks,lojarx,2021-02-20 23:13,American Airlines Incident,https://www.reddit.com/r/stocks/comments/lojarx/american_airlines_incident/,2021-02-28 18:01,55,8,0.69
2qjfk,stocks,lojofg,2021-02-20 23:32,PLTR options,https://www.reddit.com/r/stocks/comments/lojofg/pltr_options/,2021-02-28 18:01,42,1,0.52
2qjfk,stocks,lokck6,2021-02-21 00:07,Not a get rich quick scheme,https://www.reddit.com/r/stocks/comments/lokck6/not_a_get_rich_quick_scheme/,2021-02-28 18:01,36,36,0.79
2qjfk,stocks,loknhw,2021-02-21 00:23,What company will have the largest cap in 5 years?,https://www.reddit.com/r/stocks/comments/loknhw/what_company_will_have_the_largest_cap_in_5_years/,2021-02-28 18:01,61,2,0.55
2qjfk,stocks,lokzh0,2021-02-21 00:41,Investing my student Loans,https://www.reddit.com/r/stocks/comments/lokzh0/investing_my_student_loans/,2021-02-28 18:01,54,0,0.38
2qjfk,stocks,lol05g,2021-02-21 00:42,MAJOR Silicon shortage...is there a play here?,https://www.reddit.com/r/stocks/comments/lol05g/major_silicon_shortageis_there_a_play_here/,2021-02-28 18:01,331,535,0.96
2qjfk,stocks,loll2n,2021-02-21 01:13,Should I quit my job and try to live off trading?,https://www.reddit.com/r/stocks/comments/loll2n/should_i_quit_my_job_and_try_to_live_off_trading/,2021-02-28 18:01,170,24,0.61
2qjfk,stocks,lomglv,2021-02-21 02:02,An Essay on Pinterest,https://www.reddit.com/r/stocks/comments/lomglv/an_essay_on_pinterest/,2021-02-28 18:01,21,24,0.83
2qjfk,stocks,loml90,2021-02-21 02:10,Getting started with ETFs - how would you allocate $2000 using the following list?,https://www.reddit.com/r/stocks/comments/loml90/getting_started_with_etfs_how_would_you_allocate/,2021-02-28 18:01,214,183,0.92
2qjfk,stocks,lonpsz,2021-02-21 03:15,Buy the Dip!!!!!!!,https://www.reddit.com/r/stocks/comments/lonpsz/buy_the_dip/,2021-02-28 18:01,604,1270,0.9
2qjfk,stocks,lonw7c,2021-02-21 03:26,VR companies - VUZI?,https://www.reddit.com/r/stocks/comments/lonw7c/vr_companies_vuzi/,2021-02-28 18:01,21,19,0.92
2qjfk,stocks,looqmv,2021-02-21 04:15,How much available cash should I have not invested? (Rough percentage),https://www.reddit.com/r/stocks/comments/looqmv/how_much_available_cash_should_i_have_not/,2021-02-28 18:01,20,19,0.82
2qjfk,stocks,loose3,2021-02-21 04:18,Is anybody else getting tired of people calling shares *stocks* ? Is it a warning sign?,https://www.reddit.com/r/stocks/comments/loose3/is_anybody_else_getting_tired_of_people_calling/,2021-02-28 18:01,29,0,0.4
2qjfk,stocks,loozhj,2021-02-21 04:30,Should I take profits if the stock jumps 20% right after I buy?,https://www.reddit.com/r/stocks/comments/loozhj/should_i_take_profits_if_the_stock_jumps_20_right/,2021-02-28 18:01,159,208,0.88
2qjfk,stocks,lopzjp,2021-02-21 05:31,What are your long term plays for the rise of AI,https://www.reddit.com/r/stocks/comments/lopzjp/what_are_your_long_term_plays_for_the_rise_of_ai/,2021-02-28 18:01,99,60,0.91
2qjfk,stocks,loqzqc,2021-02-21 06:35,Post COVID stocks,https://www.reddit.com/r/stocks/comments/loqzqc/post_covid_stocks/,2021-02-28 18:01,138,62,0.88
2qjfk,stocks,lorqwg,2021-02-21 07:26,Capital gains tax,https://www.reddit.com/r/stocks/comments/lorqwg/capital_gains_tax/,2021-02-28 18:01,32,7,0.78
2qjfk,stocks,loss4e,2021-02-21 08:36,How do you calculate possible profits when trading options. Is there an equation used to calculate this?,https://www.reddit.com/r/stocks/comments/loss4e/how_do_you_calculate_possible_profits_when/,2021-02-28 18:01,33,7,0.74
2qjfk,stocks,lou1ic,2021-02-21 10:03,Etoro CopyPortfolio fell quite hard and i'm getting cold feet. What should i do?,https://www.reddit.com/r/stocks/comments/lou1ic/etoro_copyportfolio_fell_quite_hard_and_im/,2021-02-28 18:01,20,2,0.58
2qjfk,stocks,lov9mw,2021-02-21 11:29,Fed debt and market cycles,https://www.reddit.com/r/stocks/comments/lov9mw/fed_debt_and_market_cycles/,2021-02-28 18:01,28,14,0.86
2qjfk,stocks,low4ch,2021-02-21 12:27,"Wall Street Week Ahead for the trading week beginning February 22nd, 2021",https://www.reddit.com/r/stocks/comments/low4ch/wall_street_week_ahead_for_the_trading_week/,2021-02-28 18:01,365,4301,0.98
2qjfk,stocks,lowax1,2021-02-21 12:40,What stocks similar to Cloudflare and Shopify are you looking at?,https://www.reddit.com/r/stocks/comments/lowax1/what_stocks_similar_to_cloudflare_and_shopify_are/,2021-02-28 18:01,42,33,0.86
2qjfk,stocks,lowx3o,2021-02-21 13:18,Anyone have directly competing stocks? IE: having both traditional oil stock and clean energy?,https://www.reddit.com/r/stocks/comments/lowx3o/anyone_have_directly_competing_stocks_ie_having/,2021-02-28 18:01,33,3,0.64
2qjfk,stocks,loy1qg,2021-02-21 14:23,Many of you new investors have to reevaluate what online stock forums are for.,https://www.reddit.com/r/stocks/comments/loy1qg/many_of_you_new_investors_have_to_reevaluate_what/,2021-02-28 18:01,224,1051,0.92
2qjfk,stocks,loygiq,2021-02-21 14:45,Why I just went long on Big Tobacco.,https://www.reddit.com/r/stocks/comments/loygiq/why_i_just_went_long_on_big_tobacco/,2021-02-28 18:01,63,3,0.54
2qjfk,stocks,loyi4p,2021-02-21 14:48,How many stocks did you buy without DD?,https://www.reddit.com/r/stocks/comments/loyi4p/how_many_stocks_did_you_buy_without_dd/,2021-02-28 18:01,131,71,0.87
2qjfk,stocks,lozdwx,2021-02-21 15:32,Boeing/United Airlines DD for 2/22,https://www.reddit.com/r/stocks/comments/lozdwx/boeingunited_airlines_dd_for_222/,2021-02-28 18:01,44,15,0.76
2qjfk,stocks,lozwjh,2021-02-21 15:56,Question about risk of debt and trading stocks.,https://www.reddit.com/r/stocks/comments/lozwjh/question_about_risk_of_debt_and_trading_stocks/,2021-02-28 18:01,21,8,0.76
2qjfk,stocks,lozzwq,2021-02-21 16:01,"Hypothetically, how does one transfer a large amount of money out of their brokerage to a bank account?",https://www.reddit.com/r/stocks/comments/lozzwq/hypothetically_how_does_one_transfer_a_large/,2021-02-28 18:01,58,52,0.88
2qjfk,stocks,lp0ajx,2021-02-21 16:14,An ongoing yet unknown crisis - Helium,https://www.reddit.com/r/stocks/comments/lp0ajx/an_ongoing_yet_unknown_crisis_helium/,2021-02-28 18:01,40,39,0.9
2qjfk,stocks,lp0pvq,2021-02-21 16:33,What are the incentives in keeping a stock from its all time low price after securing a long term capital tax rate?,https://www.reddit.com/r/stocks/comments/lp0pvq/what_are_the_incentives_in_keeping_a_stock_from/,2021-02-28 18:01,31,2,0.63
2qjfk,stocks,lp1v3h,2021-02-21 17:25,Educational books in regards to stocks and trading,https://www.reddit.com/r/stocks/comments/lp1v3h/educational_books_in_regards_to_stocks_and_trading/,2021-02-28 18:01,25,12,0.79
2qjfk,stocks,lp2b1r,2021-02-21 17:45,"Fastly ($FSLY) - My options play, my DD and why I am not phased by the lawsuit",https://www.reddit.com/r/stocks/comments/lp2b1r/fastly_fsly_my_options_play_my_dd_and_why_i_am/,2021-02-28 18:01,36,16,0.78
2qjfk,stocks,lp2gmb,2021-02-21 17:52,What's going on with big tech lately?,https://www.reddit.com/r/stocks/comments/lp2gmb/whats_going_on_with_big_tech_lately/,2021-02-28 18:01,27,8,0.7
2qjfk,stocks,lp3dgq,2021-02-21 18:34,"Why I’m bullish on Airlines, Oil, and Cruise-lines",https://www.reddit.com/r/stocks/comments/lp3dgq/why_im_bullish_on_airlines_oil_and_cruiselines/,2021-02-28 18:01,208,117,0.79
2qjfk,stocks,lp4920,2021-02-21 19:15,"Off the grid for next two months, what ETFs should I invest in for maximum growth before leaving?",https://www.reddit.com/r/stocks/comments/lp4920/off_the_grid_for_next_two_months_what_etfs_should/,2021-02-28 18:01,56,16,0.74
2qjfk,stocks,lp4phv,2021-02-21 19:37,Are we in a bubble?,https://www.reddit.com/r/stocks/comments/lp4phv/are_we_in_a_bubble/,2021-02-28 18:01,50,4,0.54
2qjfk,stocks,lp5a8n,2021-02-21 20:03,Why is nobody asking the hard questions for not the broker but the clearing houses.....,https://www.reddit.com/r/stocks/comments/lp5a8n/why_is_nobody_asking_the_hard_questions_for_not/,2021-02-28 18:01,22,27,0.81
2qjfk,stocks,lp5jw5,2021-02-21 20:15,Fidelity phone wait times,https://www.reddit.com/r/stocks/comments/lp5jw5/fidelity_phone_wait_times/,2021-02-28 18:01,20,16,0.91
2qjfk,stocks,lp5tew,2021-02-21 20:27,$ABEV - Safe Intermediate-Term Macro Play | 60-100% Upside Potential | Extensive DD and Macro Explanations!,https://www.reddit.com/r/stocks/comments/lp5tew/abev_safe_intermediateterm_macro_play_60100/,2021-02-28 18:01,38,124,0.97
2qjfk,stocks,lp5toa,2021-02-21 20:27,Dividend Stocks/ETS worth it with just a few shares?,https://www.reddit.com/r/stocks/comments/lp5toa/dividend_stocksets_worth_it_with_just_a_few_shares/,2021-02-28 18:01,23,16,0.91
2qjfk,stocks,lp632i,2021-02-21 20:39,Looking for high dividends,https://www.reddit.com/r/stocks/comments/lp632i/looking_for_high_dividends/,2021-02-28 18:01,65,21,0.81
2qjfk,stocks,lp82uv,2021-02-21 22:15,Whats the reason for the lack of growth outside the US?,https://www.reddit.com/r/stocks/comments/lp82uv/whats_the_reason_for_the_lack_of_growth_outside/,2021-02-28 18:01,36,32,0.87
2qjfk,stocks,lp8nfg,2021-02-21 22:43,Best way to get started?,https://www.reddit.com/r/stocks/comments/lp8nfg/best_way_to_get_started/,2021-02-28 18:01,34,12,0.75
2qjfk,stocks,lp90k6,2021-02-21 23:01,Finding Stocks,https://www.reddit.com/r/stocks/comments/lp90k6/finding_stocks/,2021-02-28 18:01,36,19,0.8
2qjfk,stocks,lp91wj,2021-02-21 23:03,Why does investing in stocks seem relatively unheard of in the UK compared to the USA?,https://www.reddit.com/r/stocks/comments/lp91wj/why_does_investing_in_stocks_seem_relatively/,2021-02-28 18:01,1037,3295,0.97
2qjfk,stocks,lp971y,2021-02-21 23:10,Too late for SQ?,https://www.reddit.com/r/stocks/comments/lp971y/too_late_for_sq/,2021-02-28 18:01,75,74,0.88
2qjfk,stocks,lp9fq6,2021-02-21 23:23,What % of cash is your portfolio?,https://www.reddit.com/r/stocks/comments/lp9fq6/what_of_cash_is_your_portfolio/,2021-02-28 18:01,89,21,0.8
2qjfk,stocks,lp9fwa,2021-02-21 23:23,Rolls Royce - Followup + Original Analysis,https://www.reddit.com/r/stocks/comments/lp9fwa/rolls_royce_followup_original_analysis/,2021-02-28 18:01,55,23,0.76
2qjfk,stocks,lp9ps8,2021-02-21 23:37,"Do you have to pay taxes on re-invested, and subsequently lost gains?",https://www.reddit.com/r/stocks/comments/lp9ps8/do_you_have_to_pay_taxes_on_reinvested_and/,2021-02-28 18:01,27,12,0.72
2qjfk,stocks,lp9sye,2021-02-21 23:41,Predicting a stock market crash - A self-fulfilling prophecy?,https://www.reddit.com/r/stocks/comments/lp9sye/predicting_a_stock_market_crash_a_selffulfilling/,2021-02-28 18:01,56,18,0.7
2qjfk,stocks,lpal5o,2021-02-22 00:22,"Costco to begin offering COVID vaccines in the Bay Area, California",https://www.reddit.com/r/stocks/comments/lpal5o/costco_to_begin_offering_covid_vaccines_in_the/,2021-02-28 18:01,90,973,0.95
2qjfk,stocks,lpal75,2021-02-22 00:22,Ko bearish after racist training?,https://www.reddit.com/r/stocks/comments/lpal75/ko_bearish_after_racist_training/,2021-02-28 18:01,39,10,0.62
2qjfk,stocks,lpam49,2021-02-22 00:23,$UAL takes 24 Boeing 777s out of service,https://www.reddit.com/r/stocks/comments/lpam49/ual_takes_24_boeing_777s_out_of_service/,2021-02-28 18:01,28,58,0.92
2qjfk,stocks,lpawk0,2021-02-22 00:39,Is there a good ETF for a 2-3 year hold?,https://www.reddit.com/r/stocks/comments/lpawk0/is_there_a_good_etf_for_a_23_year_hold/,2021-02-28 18:01,58,22,0.8
2qjfk,stocks,lpb342,2021-02-22 00:48,How will the 1.9 trillion dollar stimulus affect the nsdq100?,https://www.reddit.com/r/stocks/comments/lpb342/how_will_the_19_trillion_dollar_stimulus_affect/,2021-02-28 18:01,77,119,0.93
2qjfk,stocks,lpbit2,2021-02-22 01:12,Blackberry Ivy + AWS: Deepdive,https://www.reddit.com/r/stocks/comments/lpbit2/blackberry_ivy_aws_deepdive/,2021-02-28 18:01,131,562,0.94
2qjfk,stocks,lpbr91,2021-02-22 01:25,Not sure if this is the right subreddit to ask but as a 16 year old who just got into stocks and am lost could I get some advice?,https://www.reddit.com/r/stocks/comments/lpbr91/not_sure_if_this_is_the_right_subreddit_to_ask/,2021-02-28 18:01,63,18,0.62
2qjfk,stocks,lpc46t,2021-02-22 01:44,"Like $SQ and $GS, what companies are building simplicity in other industries?",https://www.reddit.com/r/stocks/comments/lpc46t/like_sq_and_gs_what_companies_are_building/,2021-02-28 18:01,20,35,0.86
2qjfk,stocks,lpdeem,2021-02-22 02:55,Understanding Fintech: An Essay on my Investment in Square,https://www.reddit.com/r/stocks/comments/lpdeem/understanding_fintech_an_essay_on_my_investment/,2021-02-28 18:01,25,122,0.92
2qjfk,stocks,lpem88,2021-02-22 04:03,We may be looking at a bearish week for Apple,https://www.reddit.com/r/stocks/comments/lpem88/we_may_be_looking_at_a_bearish_week_for_apple/,2021-02-28 18:01,135,185,0.86
2qjfk,stocks,lpeox2,2021-02-22 04:07,"Copper hits 9 year high, passes $9000.",https://www.reddit.com/r/stocks/comments/lpeox2/copper_hits_9_year_high_passes_9000/,2021-02-28 18:01,177,487,0.93
2qjfk,stocks,lpgqvk,2021-02-22 06:09,What do you do when you expect a crash or correction?,https://www.reddit.com/r/stocks/comments/lpgqvk/what_do_you_do_when_you_expect_a_crash_or/,2021-02-28 18:01,29,25,0.74
2qjfk,stocks,lph23h,2021-02-22 06:27,Michael Burry is wrong,https://www.reddit.com/r/stocks/comments/lph23h/michael_burry_is_wrong/,2021-02-28 18:01,32,24,0.62
2qjfk,stocks,lpihiv,2021-02-22 07:55,Fear of inflation overhyped and baseless.,https://www.reddit.com/r/stocks/comments/lpihiv/fear_of_inflation_overhyped_and_baseless/,2021-02-28 18:01,32,26,0.7
2qjfk,stocks,lpjbeu,2021-02-22 08:48,"Michael Burry - ""the market is dancing on a knife's edge""",https://www.reddit.com/r/stocks/comments/lpjbeu/michael_burry_the_market_is_dancing_on_a_knifes/,2021-02-28 18:01,73,57,0.79
2qjfk,stocks,lpjrv0,2021-02-22 09:18,What do you think is the markets most objectively overvalued stock.,https://www.reddit.com/r/stocks/comments/lpjrv0/what_do_you_think_is_the_markets_most_objectively/,2021-02-28 18:01,72,26,0.95
2qjfk,stocks,lpkf7n,2021-02-22 10:02,Do you plan to buy anything today?,https://www.reddit.com/r/stocks/comments/lpkf7n/do_you_plan_to_buy_anything_today/,2021-02-28 18:01,206,56,0.87
2qjfk,stocks,lpm13n,2021-02-22 11:40,Roblox expects shares to begin trading on NYSE March 10,https://www.reddit.com/r/stocks/comments/lpm13n/roblox_expects_shares_to_begin_trading_on_nyse/,2021-02-28 18:01,1496,8719,0.95
2qjfk,stocks,lpmd3i,2021-02-22 12:00,"r/Stocks Daily Discussion Monday - Feb 22, 2021",https://www.reddit.com/r/stocks/comments/lpmd3i/rstocks_daily_discussion_monday_feb_22_2021/,2021-02-28 18:01,2045,90,0.94
2qjfk,stocks,lpn42s,2021-02-22 12:42,Do you think there is a bubble? Mini-DD inside,https://www.reddit.com/r/stocks/comments/lpn42s/do_you_think_there_is_a_bubble_minidd_inside/,2021-02-28 18:01,21,4,0.58
2qjfk,stocks,lpni8h,2021-02-22 13:03,An inverted Yield curve has predicted the last seven Recessions. Guess where we're at right now,https://www.reddit.com/r/stocks/comments/lpni8h/an_inverted_yield_curve_has_predicted_the_last/,2021-02-28 18:01,24,3,0.54
2qjfk,stocks,lpph85,2021-02-22 14:37,ICLN/INRG - buy/hold/sell?,https://www.reddit.com/r/stocks/comments/lpph85/iclninrg_buyholdsell/,2021-02-28 18:01,28,25,0.96
2qjfk,stocks,lpq8vo,2021-02-22 15:08,How do you guys find you're stocks to day trade or swing trade?,https://www.reddit.com/r/stocks/comments/lpq8vo/how_do_you_guys_find_youre_stocks_to_day_trade_or/,2021-02-28 18:01,23,49,0.85
2qjfk,stocks,lpqe3r,2021-02-22 15:13,Apple reclaims global smartphone lead ahead of Samsung for first time since 2016,https://www.reddit.com/r/stocks/comments/lpqe3r/apple_reclaims_global_smartphone_lead_ahead_of/,2021-02-28 18:01,81,376,0.96
2qjfk,stocks,lpqrfh,2021-02-22 15:25,How much cash we holding?,https://www.reddit.com/r/stocks/comments/lpqrfh/how_much_cash_we_holding/,2021-02-28 18:01,180,70,0.92
2qjfk,stocks,lprey2,2021-02-22 15:43,Wanted some advice on ARKG,https://www.reddit.com/r/stocks/comments/lprey2/wanted_some_advice_on_arkg/,2021-02-28 18:01,22,1,0.54
2qjfk,stocks,lpst2l,2021-02-22 16:32,I'm down 15% in the last week! What should I do?,https://www.reddit.com/r/stocks/comments/lpst2l/im_down_15_in_the_last_week_what_should_i_do/,2021-02-28 18:01,94,8,0.58
2qjfk,stocks,lpta7a,2021-02-22 16:50,All I Ever See Is Red,https://www.reddit.com/r/stocks/comments/lpta7a/all_i_ever_see_is_red/,2021-02-28 18:01,50,8,0.68
2qjfk,stocks,lptcdm,2021-02-22 16:53,Light DD on potential multi baggers and discussion (under $10B market cap),https://www.reddit.com/r/stocks/comments/lptcdm/light_dd_on_potential_multi_baggers_and/,2021-02-28 18:01,30,33,0.91
2qjfk,stocks,lpuaqj,2021-02-22 17:28,Any theories on why solar/clean energy stocks have been dropping the last couple weeks?,https://www.reddit.com/r/stocks/comments/lpuaqj/any_theories_on_why_solarclean_energy_stocks_have/,2021-02-28 18:01,36,5,0.65
2qjfk,stocks,lpvd8p,2021-02-22 18:09,Is there a issue with my way of thinking?,https://www.reddit.com/r/stocks/comments/lpvd8p/is_there_a_issue_with_my_way_of_thinking/,2021-02-28 18:01,20,3,0.62
2qjfk,stocks,lpw9yp,2021-02-22 18:44,Marijuana companies to invest in?,https://www.reddit.com/r/stocks/comments/lpw9yp/marijuana_companies_to_invest_in/,2021-02-28 18:01,45,15,0.8
2qjfk,stocks,lpwn42,2021-02-22 18:58,"Apart from emergency funds, how much money do you not invest?",https://www.reddit.com/r/stocks/comments/lpwn42/apart_from_emergency_funds_how_much_money_do_you/,2021-02-28 18:01,25,6,0.76
2qjfk,stocks,lpx7z0,2021-02-22 19:20,"With a huge influx of new retail investors, are there websites, apps, and tools you swear by that's easy for inexperienced investors?",https://www.reddit.com/r/stocks/comments/lpx7z0/with_a_huge_influx_of_new_retail_investors_are/,2021-02-28 18:01,21,19,0.95
2qjfk,stocks,lpxjmp,2021-02-22 19:33,PLTR: just a hype stock or is there actually something there long term?,https://www.reddit.com/r/stocks/comments/lpxjmp/pltr_just_a_hype_stock_or_is_there_actually/,2021-02-28 18:01,58,22,0.77
2qjfk,stocks,lpxxvi,2021-02-22 19:48,The market is bound to bounce back.,https://www.reddit.com/r/stocks/comments/lpxxvi/the_market_is_bound_to_bounce_back/,2021-02-28 18:01,452,701,0.87
2qjfk,stocks,lpyukn,2021-02-22 20:24,Has the Tesla bubble popped?,https://www.reddit.com/r/stocks/comments/lpyukn/has_the_tesla_bubble_popped/,2021-02-28 18:01,225,103,0.77
2qjfk,stocks,lpz4xo,2021-02-22 20:36,The whole GME/AMC trend completely derailed my plans and strategy.,https://www.reddit.com/r/stocks/comments/lpz4xo/the_whole_gmeamc_trend_completely_derailed_my/,2021-02-28 18:01,580,1071,0.88
2qjfk,stocks,lpz54d,2021-02-22 20:36,Average down on shares or buy other stocks?,https://www.reddit.com/r/stocks/comments/lpz54d/average_down_on_shares_or_buy_other_stocks/,2021-02-28 18:01,22,19,0.85
2qjfk,stocks,lpzt0b,2021-02-22 21:02,Post Covid Stocks - who are you tossing money into that will bounce back?,https://www.reddit.com/r/stocks/comments/lpzt0b/post_covid_stocks_who_are_you_tossing_money_into/,2021-02-28 18:01,89,52,0.89
2qjfk,stocks,lq0slw,2021-02-22 21:42,"Here is a Market Recap for today Monday, February 22, 2021. Please enjoy!",https://www.reddit.com/r/stocks/comments/lq0slw/here_is_a_market_recap_for_today_monday_february/,2021-02-28 18:01,43,181,0.96
2qjfk,stocks,lq1j24,2021-02-22 22:12,XPENG set to run?,https://www.reddit.com/r/stocks/comments/lq1j24/xpeng_set_to_run/,2021-02-28 18:01,35,47,0.88
2qjfk,stocks,lq1rsj,2021-02-22 22:23,"Why I'm skeptical of the advice that ""you should just stick to index funds"".",https://www.reddit.com/r/stocks/comments/lq1rsj/why_im_skeptical_of_the_advice_that_you_should/,2021-02-28 18:01,27,12,0.69
2qjfk,stocks,lq258z,2021-02-22 22:40,Recovery Plays,https://www.reddit.com/r/stocks/comments/lq258z/recovery_plays/,2021-02-28 18:01,39,12,0.88
2qjfk,stocks,lq295d,2021-02-22 22:44,So fidelity just executed a limit order that I never placed. And then of course I can't actually get a hold of anyone.,https://www.reddit.com/r/stocks/comments/lq295d/so_fidelity_just_executed_a_limit_order_that_i/,2021-02-28 18:01,38,23,0.82
2qjfk,stocks,lq3oju,2021-02-22 23:50,Can someone explain when stocks go up after earnings reports?,https://www.reddit.com/r/stocks/comments/lq3oju/can_someone_explain_when_stocks_go_up_after/,2021-02-28 18:01,29,2,0.6
2qjfk,stocks,lq4462,2021-02-23 00:10,For much further will ICLN continue to decline?,https://www.reddit.com/r/stocks/comments/lq4462/for_much_further_will_icln_continue_to_decline/,2021-02-28 18:01,97,64,0.85
2qjfk,stocks,lq4ckx,2021-02-23 00:22,Thoughts on $TSLA,https://www.reddit.com/r/stocks/comments/lq4ckx/thoughts_on_tsla/,2021-02-28 18:01,124,68,0.91
2qjfk,stocks,lq5u9s,2021-02-23 01:36,Cathie Wood’s ARKInvest added 273k shares of $TSLA today and bunch of others,https://www.reddit.com/r/stocks/comments/lq5u9s/cathie_woods_arkinvest_added_273k_shares_of_tsla/,2021-02-28 18:01,424,731,0.96
2qjfk,stocks,lq5v2m,2021-02-23 01:37,Bull/Bear cases for these stocks?,https://www.reddit.com/r/stocks/comments/lq5v2m/bullbear_cases_for_these_stocks/,2021-02-28 18:01,34,16,0.87
