Subreddit_ID,Subreddit_Name,Submission_ID,Submission_CreatedDate,Submission_Title,Submission_URL,Submission_LastFetched,Submission_NumComments,Submission_Score,Submission_UpvoteRatio
2th52,wallstreetbets,lsh9vf,2021-02-25 21:22,$GME priveous behaviour is IDENTICAL to what is going on now.,https://www.reddit.com/r/wallstreetbets/comments/lsh9vf/gme_priveous_behaviour_is_identical_to_what_is/,2021-02-28 18:01,2815,34711,0.95
2th52,wallstreetbets,lshit3,2021-02-25 21:34,What Ryan Cohen's tweet REALLY means,https://www.reddit.com/r/wallstreetbets/comments/lshit3/what_ryan_cohens_tweet_really_means/,2021-02-28 18:01,59,122,0.94
2th52,wallstreetbets,lshmag,2021-02-25 21:38,I put all my student loan in PLTR as you guys said at $29.3. What should I do next???,https://i.redd.it/3984b9jt0pj61.jpg,2021-02-28 18:01,193,33,0.56
2th52,wallstreetbets,lshoj3,2021-02-25 21:41,Cramer finally understands us - GME 🚀🚀🚀💎,https://v.redd.it/snic663r0pj61,2021-02-28 18:01,77,1390,0.97
2th52,wallstreetbets,lshp8y,2021-02-25 21:42,New Here : Suspicious of Institutional Buying Surge in GME Stock,https://www.reddit.com/r/wallstreetbets/comments/lshp8y/new_here_suspicious_of_institutional_buying_surge/,2021-02-28 18:01,103,123,0.79
2th52,wallstreetbets,lshq22,2021-02-25 21:43,Energy Squeeze Play - Oil Price Crash Anniversary,https://www.reddit.com/r/wallstreetbets/comments/lshq22/energy_squeeze_play_oil_price_crash_anniversary/,2021-02-28 18:01,41,23,0.66
2th52,wallstreetbets,lshrx1,2021-02-25 21:45,SEC Reduces Trading Fees,https://i.imgur.com/NURHBNA.jpg,2021-02-28 18:01,46,57,0.86
2th52,wallstreetbets,lshti4,2021-02-25 21:47,I didn’t hear no bell 🛎 🦍💎,https://i.redd.it/vw6kzkae2pj61.jpg,2021-02-28 18:01,41,545,0.97
2th52,wallstreetbets,lsi1wb,2021-02-25 21:58,"RKT LETS GO, Q4 came and WE CRUSHED IT short float is 38% and rising cus they are trying to keep it down. Dividends are coming 9th of march $1.1 per share🚀🚀",https://ir.rocketcompanies.com/news-and-events/press-releases/press-release-details/2021/Rocket-Companies-Experiences-Explosive-Growth-Revenue-Increases-144-year-over-year-to-4.7-Billion-in-Fourth-Quarter-Company-Announces-Special-Dividend-of-1.11-per-Class-A-Share-of-Common-Stock/default.aspx,2021-02-28 18:01,185,529,0.92
2th52,wallstreetbets,lsi344,2021-02-25 21:59,Who ever bought my $100 call... enjoy the gains. I know I am.,https://i.redd.it/mu9kpfuj4pj61.jpg,2021-02-28 18:01,29,64,0.85
2th52,wallstreetbets,lsi7kh,2021-02-25 22:04,"67k Worth of VIX calls and SPX puts expiring in March/April, this bubble will crack",https://i.redd.it/mbe73tif5pj61.jpg,2021-02-28 18:01,50,46,0.8
2th52,wallstreetbets,lsi8q8,2021-02-25 22:06,Observations from Jan. 22-29 GME chart vs. Feb 24-25,https://www.reddit.com/r/wallstreetbets/comments/lsi8q8/observations_from_jan_2229_gme_chart_vs_feb_2425/,2021-02-28 18:01,25,195,0.96
2th52,wallstreetbets,lsiea1,2021-02-25 22:13,"didn’t sell, did I do good?",https://i.redd.it/gs20rjpy6pj61.jpg,2021-02-28 18:01,22,104,0.89
2th52,wallstreetbets,lsidv3,2021-02-25 22:12,The Wallet (2020) Tim Dillon,https://v.redd.it/d47617mt6pj61,2021-02-28 18:01,52,747,0.98
2th52,wallstreetbets,lsifnv,2021-02-25 22:14,10k yolo on Tesla Papa musk please feed my family 🤲💎🥺💎,https://i.redd.it/6mncssw97pj61.jpg,2021-02-28 18:01,41,59,0.84
2th52,wallstreetbets,lsij89,2021-02-25 22:19,"Just a little advice from a Billionaire... “if you still believe in the reason you bought the stock, and that hasn’t changed, why sell?”",https://i.redd.it/packujo28pj61.jpg,2021-02-28 18:01,1876,52598,0.92
2th52,wallstreetbets,lsijw6,2021-02-25 22:20,Can I please be an extra in the movie? DIAMOND HANDS 💎🙌🏼,https://i.redd.it/ng9y8t088pj61.jpg,2021-02-28 18:01,91,1156,0.97
2th52,wallstreetbets,lsip3h,2021-02-25 22:26,All the numbers are starting to align,https://i.redd.it/hv4776ae9pj61.jpg,2021-02-28 18:01,21,585,0.97
2th52,wallstreetbets,lsis6p,2021-02-25 22:30,"$300 -> $16.5k IN 24 FUCKING HOURS, FLOW ME THE MONEY",https://i.redd.it/nqg93iyp9pj61.png,2021-02-28 18:01,85,418,0.97
2th52,wallstreetbets,lsirsi,2021-02-25 22:30,Tomorrow we will make history together.🚀,https://v.redd.it/nc8wkz7y9pj61,2021-02-28 18:01,50,453,0.96
2th52,wallstreetbets,lsiw35,2021-02-25 22:35,That didn't go exactly as I had planned,https://i.redd.it/2syb786zapj61.png,2021-02-28 18:01,183,527,0.97
2th52,wallstreetbets,lsiwsi,2021-02-25 22:36,"Rocket Companies ($RKT), who owns Rocket Mortgage, is a slam dunk",https://www.reddit.com/r/wallstreetbets/comments/lsiwsi/rocket_companies_rkt_who_owns_rocket_mortgage_is/,2021-02-28 18:01,79,193,0.85
2th52,wallstreetbets,lsiy4p,2021-02-25 22:38,Did I do it right by not selling when I was up $8k? 💎✋🏽💎✋🏽🚀🚀🚀,https://i.redd.it/f3vg8ttfbpj61.jpg,2021-02-28 18:01,89,669,0.96
2th52,wallstreetbets,lsj29c,2021-02-25 22:43,"A M C YOLO Update — Feb 25, 2021",https://i.redd.it/dcq98dqccpj61.jpg,2021-02-28 18:01,57,109,0.95
2th52,wallstreetbets,lsja1w,2021-02-25 22:53,"Holding strong until $2,000/share, then we’ll see... 😎🚀🌙💎🙌 $GME",https://i.redd.it/jx0czx56epj61.jpg,2021-02-28 18:01,24,63,0.85
2th52,wallstreetbets,lsja3r,2021-02-25 22:53,"Yah, yah...you hate the news...but this is a genuinely good video that explains what is ACTUALLY happening with volatility in the market...and $GME",https://twitter.com/OptionsAction/status/1365067997694590979?s=20,2021-02-28 18:01,75,185,0.92
2th52,wallstreetbets,lsjb5u,2021-02-25 22:54,Not sure if I need to eat more crayons to grasp these technicals... Am I doing this right?,https://i.redd.it/xsyf6v95epj61.png,2021-02-28 18:01,47,318,0.95
2th52,wallstreetbets,lsjbds,2021-02-25 22:54,"Let's go guys 🚀🤑 hold it, tomorrow going to be fun.",https://i.redd.it/rf7e9lagepj61.jpg,2021-02-28 18:01,40,313,0.96
2th52,wallstreetbets,lsjckv,2021-02-25 22:56,When MSM finds out what FD's stand for,https://i.redd.it/xqrce8vqepj61.gif,2021-02-28 18:01,163,960,0.98
2th52,wallstreetbets,lsjgw9,2021-02-25 23:01,Been averaging down this whole day. I’m coming out on top. The rebound will come soon!! Let’s go PLTR 🙌🏻,https://i.redd.it/sgmxx7onfpj61.jpg,2021-02-28 18:01,21,52,0.86
2th52,wallstreetbets,lsjhu6,2021-02-25 23:03,🚀Vistra Energy - DD for earnings tomorrow. $5.19 Billion dollar surprise from Texas Snowpocalypse?🚀,https://www.reddit.com/r/wallstreetbets/comments/lsjhu6/vistra_energy_dd_for_earnings_tomorrow_519/,2021-02-28 18:01,24,17,0.72
2th52,wallstreetbets,lsjiax,2021-02-25 23:03,Some Short GME DD,https://www.reddit.com/r/wallstreetbets/comments/lsjiax/some_short_gme_dd/,2021-02-28 18:01,42,167,0.93
2th52,wallstreetbets,lsjiby,2021-02-25 23:03,Short story of today’s market action... it’s fine... I’m fine... everything is fine... 🚀🌛,https://i.redd.it/q1ir22pzfpj61.jpg,2021-02-28 18:01,77,3525,0.98
2th52,wallstreetbets,lsjl5m,2021-02-25 23:07,I caught $GME and $AMC after hours!!!!,https://www.reddit.com/r/wallstreetbets/comments/lsjl5m/i_caught_gme_and_amc_after_hours/,2021-02-28 18:01,59,118,0.94
2th52,wallstreetbets,lsjmws,2021-02-25 23:09,Haha I can’t possibly be a retarded ape who happened to always buy near the peak right...,https://i.redd.it/6spuqtpzgpj61.jpg,2021-02-28 18:01,38,64,0.94
2th52,wallstreetbets,lsjpof,2021-02-25 23:12,Expectations for Tomorrow,https://www.reddit.com/r/wallstreetbets/comments/lsjpof/expectations_for_tomorrow/,2021-02-28 18:01,547,4517,0.98
2th52,wallstreetbets,lsjqai,2021-02-25 23:13,I’m so use to holding that this shit doesn’t even phase me anymore.,https://i.redd.it/ygcrlmdrhpj61.jpg,2021-02-28 18:01,33,446,0.97
2th52,wallstreetbets,lsjt8r,2021-02-25 23:17,You might not know your ABC's but do you know your GME? Possible exit strategies for the next squeeze,https://www.reddit.com/r/wallstreetbets/comments/lsjt8r/you_might_not_know_your_abcs_but_do_you_know_your/,2021-02-28 18:01,37,31,0.72
2th52,wallstreetbets,lsjvie,2021-02-25 23:20,Matrix style. Dodged a million bullets today. Account balance went to -140k from naked gme calls this morning and back to 120k now. Added Long AMC verticals! 🚀🚀🚀🚀🚀,https://i.redd.it/rimm3huzipj61.jpg,2021-02-28 18:01,25,97,0.95
2th52,wallstreetbets,lsjx1t,2021-02-25 23:22,KEEP YOUR EYES ON THE PRIZE,https://v.redd.it/u28cht4oipj61,2021-02-28 18:01,46,114,0.87
2th52,wallstreetbets,lsk17x,2021-02-25 23:27,Yolo on Pure options 1TDE. If GME IS $500 on 2-26 I will put the WSB logo on ice cream cups packaging I mass manufacture (can someone give me some advice on the IP?),https://i.redd.it/r9nyb34ckpj61.jpg,2021-02-28 18:01,25,39,0.93
2th52,wallstreetbets,lsk22c,2021-02-25 23:29,TD Ameritrade GME trade restrictions,https://www.reddit.com/r/wallstreetbets/comments/lsk22c/td_ameritrade_gme_trade_restrictions/,2021-02-28 18:01,48,31,0.83
2th52,wallstreetbets,lsk5kj,2021-02-25 23:33,"Ryan Cohen's mysterious tweet decoded, how it relates to Wednesday afternoon's GME spike, and why you apes must hold through the weekend",https://www.reddit.com/r/wallstreetbets/comments/lsk5kj/ryan_cohens_mysterious_tweet_decoded_how_it/,2021-02-28 18:01,115,190,0.85
2th52,wallstreetbets,lsk95b,2021-02-25 23:38,"GOD IS GOOD...but Ryan Cohen might just be better. I’m now free of student debt and have money for a down payment on a house, all thanks to a motherfucking ice cream cone 🍦🐸🥜",https://www.reddit.com/gallery/lsk95b,2021-02-28 18:01,26,75,0.84
2th52,wallstreetbets,lsk9ak,2021-02-25 23:38,The difference between yesterday and today on GME? The call/put ratio,https://www.reddit.com/r/wallstreetbets/comments/lsk9ak/the_difference_between_yesterday_and_today_on_gme/,2021-02-28 18:01,213,763,0.95
2th52,wallstreetbets,lska54,2021-02-25 23:39,Rocket (rkt) 🚀,https://i.redd.it/jhfaw8jgmpj61.jpg,2021-02-28 18:01,39,91,0.88
2th52,wallstreetbets,lskaxp,2021-02-25 23:40,WALLSTREETBETS VS WALLSTREET: SHORT SQUEEZE ROUND 2,https://v.redd.it/dfsi8zdjmpj61,2021-02-28 18:01,506,27424,0.98
2th52,wallstreetbets,lskekv,2021-02-25 23:45,Alright GME is up big time woo. Oh wait...F,https://i.redd.it/xnw5dwzgnpj61.png,2021-02-28 18:01,20,37,0.75
2th52,wallstreetbets,lskgzv,2021-02-25 23:49,GME go brrrr again!,https://i.redd.it/g9bkcszznpj61.gif,2021-02-28 18:01,22,357,0.97
2th52,wallstreetbets,lskl0w,2021-02-25 23:54,"February 25th Had The Largest Single Day of Net Short Positions - Minimum +9 Million, Likely +15-20 Million",https://www.reddit.com/r/wallstreetbets/comments/lskl0w/february_25th_had_the_largest_single_day_of_net/,2021-02-28 18:01,23,171,0.97
2th52,wallstreetbets,lskqbi,2021-02-26 00:01,GME SEASON 2: DIAMOND HANDS REGIMENT. HOLDING FOR HUMANITY'S FUTURE,https://v.redd.it/fnlaf2inppj61,2021-02-28 18:01,32,374,0.96
2th52,wallstreetbets,lskstx,2021-02-26 00:04,TSNP -> TSNPD (new CUSIP # = forced short cover) + r/s (4:1 = 75% less shares for covering w/!),https://www.reddit.com/r/wallstreetbets/comments/lskstx/tsnp_tsnpd_new_cusip_forced_short_cover_rs_41_75/,2021-02-28 18:01,58,44,0.82
2th52,wallstreetbets,lskt27,2021-02-26 00:05,My portfolio in the last 2 weeks - RIP,https://v.redd.it/fn90gd8tqpj61,2021-02-28 18:01,27,607,0.97
2th52,wallstreetbets,lskuhy,2021-02-26 00:06,"EXCLUSIVE: U.S. carries out airstrike against Iranian-backed militia target in Syria, officials say. Buy your defense stocks now boys and girls.",https://i.redd.it/zzx4a5f6rpj61.png,2021-02-28 18:01,65,0,0.47
2th52,wallstreetbets,lskwls,2021-02-26 00:09,What I've learned after being on r/WSB for a month,https://www.reddit.com/r/wallstreetbets/comments/lskwls/what_ive_learned_after_being_on_rwsb_for_a_month/,2021-02-28 18:01,35,113,0.8
2th52,wallstreetbets,lskwny,2021-02-26 00:09,Ok I might be a little retarded.,https://i.redd.it/4qctcxttrpj61.jpg,2021-02-28 18:01,882,18425,0.96
2th52,wallstreetbets,lskvun,2021-02-26 00:08,DFV & Jim Cramer Met Today to Discuss GameStop,https://v.redd.it/j4sj910qhpj61,2021-02-28 18:01,33,201,0.94
2th52,wallstreetbets,lsl01w,2021-02-26 00:14,I Will (still) Own This Company Update - Feb 25,https://i.redd.it/zbz4wlb9spj61.jpg,2021-02-28 18:01,40,172,0.97
2th52,wallstreetbets,lsl1jn,2021-02-26 00:16,"Those of you here from CNBC, hedge funds, or the rest of reddit- here’s a quick guide to some of our more obscure terminology",https://www.reddit.com/r/wallstreetbets/comments/lsl1jn/those_of_you_here_from_cnbc_hedge_funds_or_the/,2021-02-28 18:01,41,354,0.96
2th52,wallstreetbets,lsl23u,2021-02-26 00:17,STOP PANICKING! THE $GME SHORT SQUEEZE WILL HAPPEN!,https://www.reddit.com/r/wallstreetbets/comments/lsl23u/stop_panicking_the_gme_short_squeeze_will_happen/,2021-02-28 18:01,89,644,0.95
2th52,wallstreetbets,lsl2k2,2021-02-26 00:17,$300 to 6.5k in 2 days,https://www.reddit.com/gallery/lsl2k2,2021-02-28 18:01,27,43,0.85
2th52,wallstreetbets,lsl3tq,2021-02-26 00:19,Let's do this for Alex! AMC and GME to the moon!,https://i.redd.it/w1lta2abtpj61.png,2021-02-28 18:01,1220,39296,0.93
2th52,wallstreetbets,lsl665,2021-02-26 00:22,GEE EM EE Short volume is fucking absurd.,https://www.reddit.com/r/wallstreetbets/comments/lsl665/gee_em_ee_short_volume_is_fucking_absurd/,2021-02-28 18:01,201,2072,0.98
2th52,wallstreetbets,lsl6d0,2021-02-26 00:23,Both GME Squeezes side by side,https://i.redd.it/3iqg0ud0upj61.jpg,2021-02-28 18:01,60,94,0.87
2th52,wallstreetbets,lsl7p1,2021-02-26 00:25,Someone messeged me asking for a screenshot of my shares lol there you go!! ALL IN SPCE!!!!!,https://i.redd.it/oh9p71miupj61.jpg,2021-02-28 18:01,24,45,0.92
2th52,wallstreetbets,lsl8wd,2021-02-26 00:26,"Buy, buy, buy! 🚀🚀🚀🚀",https://i.redd.it/j8g3ouvtupj61.jpg,2021-02-28 18:01,122,1288,0.96
2th52,wallstreetbets,lslau3,2021-02-26 00:29,I believe $INTC (Intel) will be the greatest value play in this year. Fair value should be $200 per share.,https://www.reddit.com/r/wallstreetbets/comments/lslau3/i_believe_intc_intel_will_be_the_greatest_value/,2021-02-28 18:01,72,27,0.69
2th52,wallstreetbets,lslb8s,2021-02-26 00:30,Dear Sleazy Shorts ...,https://www.reddit.com/r/wallstreetbets/comments/lslb8s/dear_sleazy_shorts/,2021-02-28 18:01,21,294,0.95
2th52,wallstreetbets,lslcd4,2021-02-26 00:31,When you see GME green you know it's gonna take you to the moon 🚀🌑💎🙌,https://v.redd.it/9uc3zqgpkpj61,2021-02-28 18:01,154,5664,0.98
2th52,wallstreetbets,lsldnr,2021-02-26 00:33,Possible upcoming PLTR catalyst.,https://www.reddit.com/r/wallstreetbets/comments/lsldnr/possible_upcoming_pltr_catalyst/,2021-02-28 18:01,43,111,0.95
2th52,wallstreetbets,lslejs,2021-02-26 00:34,Exercise your Friday calls soon or Robinhood will close out your calls! Just received the email from RH,https://i.redd.it/crcm16hawpj61.jpg,2021-02-28 18:01,172,565,0.97
2th52,wallstreetbets,lslmfh,2021-02-26 00:46,Need help with Robinhood BS options close outs!!,https://www.reddit.com/r/wallstreetbets/comments/lslmfh/need_help_with_robinhood_bs_options_close_outs/,2021-02-28 18:01,45,19,0.84
2th52,wallstreetbets,lslmzx,2021-02-26 00:47,"“Tesla’s biggest bear” Hedge Fund Manager Chanos lobbying Democrats to protect shorting, prevent T+0/1",https://www.foxbusiness.com/business-leaders/short-sellers-lobby-white-house-robinhood-gamestop.amp,2021-02-28 18:01,33,40,0.87
2th52,wallstreetbets,lslr7k,2021-02-26 00:53,From $570 to $11k. It’s not much but it’s honest work.,https://i.redd.it/e15mgabjzpj61.jpg,2021-02-28 18:01,49,311,0.96
2th52,wallstreetbets,lslqqy,2021-02-26 00:52,Robinhood new marketing plan,https://v.redd.it/0ubjqlu8zpj61,2021-02-28 18:01,41,1313,0.98
2th52,wallstreetbets,lslvrg,2021-02-26 00:59,"proof of holding 7000 shares AMC, I am not fucking selling. AMC to the fucking moon.🚀🚀🚀",https://i.redd.it/i1prg5ln0qj61.jpg,2021-02-28 18:01,72,218,0.91
2th52,wallstreetbets,lslw6i,2021-02-26 01:00,i like this stock so much that this is going to replace the framed picture of my wife and her boyfriend on my desk,https://www.reddit.com/gallery/lslw6i,2021-02-28 18:01,106,3680,0.98
2th52,wallstreetbets,lslw6t,2021-02-26 01:00,$RKT will make the shorts give you their 🍌,https://www.reddit.com/r/wallstreetbets/comments/lslw6t/rkt_will_make_the_shorts_give_you_their/,2021-02-28 18:01,92,260,0.86
2th52,wallstreetbets,lsm0iz,2021-02-26 01:05,THE NEXT SHORT SQUEEZE 🚀,https://www.reddit.com/r/wallstreetbets/comments/lsm0iz/the_next_short_squeeze/,2021-02-28 18:01,136,238,0.69
2th52,wallstreetbets,lsm7ao,2021-02-26 01:15,"🚀🌑 sold at $9,500. Needed the rest of the down payment for my house in my acct. Paid $96 for the call",https://i.redd.it/5lk8c3dj3qj61.jpg,2021-02-28 18:01,60,225,0.89
2th52,wallstreetbets,lsmeyz,2021-02-26 01:27,GME HIGH OF $403 TODAY ACCORDING TO NASDAQ,https://ibb.co/wCgC8rF,2021-02-28 18:01,919,8187,0.97
2th52,wallstreetbets,lsmg6d,2021-02-26 01:28,"For those who need a break from 🚀 and 🦍, and are looking to better understand the situation around Gamestop.",https://www.reddit.com/r/wallstreetbets/comments/lsmg6d/for_those_who_need_a_break_from_and_and_are/,2021-02-28 18:01,29,76,0.86
2th52,wallstreetbets,lsmgzg,2021-02-26 01:30,"My own ""If GME hits.."" promise that I hope I fulfill. APES ENSURE I'M HELD ACCOUNTABLE",https://www.reddit.com/r/wallstreetbets/comments/lsmgzg/my_own_if_gme_hits_promise_that_i_hope_i_fulfill/,2021-02-28 18:01,62,395,0.94
2th52,wallstreetbets,lsmg00,2021-02-26 01:28,Dedicate Your Heart,https://v.redd.it/toshmohp5qj61,2021-02-28 18:01,26,75,0.94
2th52,wallstreetbets,lsmiq2,2021-02-26 01:32,Lol jus gonna let them expire worthless tom I decided I guess,https://i.redd.it/h7lx8jjk6qj61.jpg,2021-02-28 18:01,169,38,0.9
2th52,wallstreetbets,lsmmjk,2021-02-26 01:38,Still holding strong boys,https://i.redd.it/ll5qbswj7qj61.jpg,2021-02-28 18:01,36,72,0.9
2th52,wallstreetbets,lsml3c,2021-02-26 01:36,made this a few weeks ago when everyone was in the dumps. it's a little long but then again so is our GME position.,https://v.redd.it/0aephxjuvpj61,2021-02-28 18:01,278,7190,0.98
2th52,wallstreetbets,lsmo0g,2021-02-26 01:40,BAC Inverses GME During Squeezes,https://www.reddit.com/r/wallstreetbets/comments/lsmo0g/bac_inverses_gme_during_squeezes/,2021-02-28 18:01,22,26,0.73
2th52,wallstreetbets,lsmq9e,2021-02-26 01:43,TL;DR Just some thinking about GME - Shitpost,https://www.reddit.com/r/wallstreetbets/comments/lsmq9e/tldr_just_some_thinking_about_gme_shitpost/,2021-02-28 18:01,26,54,0.89
2th52,wallstreetbets,lsmrvq,2021-02-26 01:46,This looks promising.,https://i.redd.it/azwgrr509qj61.jpg,2021-02-28 18:01,106,396,0.91
2th52,wallstreetbets,lsn2ty,2021-02-26 02:02,They are trying to Margin Call Us.,https://www.reddit.com/r/wallstreetbets/comments/lsn2ty/they_are_trying_to_margin_call_us/,2021-02-28 18:01,161,32,0.63
2th52,wallstreetbets,lsn4n1,2021-02-26 02:05,"The moon is out tonight, there is no way that’s a coincidence",https://www.reddit.com/r/wallstreetbets/comments/lsn4n1/the_moon_is_out_tonight_there_is_no_way_thats_a/,2021-02-28 18:01,33,333,0.96
2th52,wallstreetbets,lsn7ke,2021-02-26 02:09,FINRA data now shows over 58 million GME stocks are shorted - ~107% of Float & 84% of Total. This is up from 37% yesterday! 💎🙌💎🚀🚀🚀,https://www.reddit.com/r/wallstreetbets/comments/lsn7ke/finra_data_now_shows_over_58_million_gme_stocks/,2021-02-28 18:01,321,4976,0.98
2th52,wallstreetbets,lsn7lu,2021-02-26 02:09,"Ape-Tards, what the heck do we do when we win?!",https://www.reddit.com/r/wallstreetbets/comments/lsn7lu/apetards_what_the_heck_do_we_do_when_we_win/,2021-02-28 18:01,43,26,0.73
2th52,wallstreetbets,lsnb6j,2021-02-26 02:14,"Felt like a king this morning, now I feel like an autist.",https://www.reddit.com/gallery/lsnb6j,2021-02-28 18:01,33,76,0.93
2th52,wallstreetbets,lsncvs,2021-02-26 02:17,Scotts Miracle-Gro ($SMG) - A Play on Cannabis [Hawthorne Gardening],https://www.reddit.com/r/wallstreetbets/comments/lsncvs/scotts_miraclegro_smg_a_play_on_cannabis/,2021-02-28 18:01,25,15,0.76
2th52,wallstreetbets,lsnd80,2021-02-26 02:17,Why I like GoPro (GPRO),https://www.reddit.com/r/wallstreetbets/comments/lsnd80/why_i_like_gopro_gpro/,2021-02-28 18:01,32,2,0.52
2th52,wallstreetbets,lsnhxq,2021-02-26 02:24,"Feb 25 in Review - Red Wedding, except...🩸🦍",https://v.redd.it/oebewby2fqj61,2021-02-28 18:01,38,677,0.98
2th52,wallstreetbets,lsnlqb,2021-02-26 02:30,Purchased these bad boys at market open 🌈🐻,https://i.redd.it/ca4qunowgqj61.jpg,2021-02-28 18:01,27,58,0.85
2th52,wallstreetbets,lsnow5,2021-02-26 02:35,"I’ve never made money in the stock market. Lost every time like a true retarded ape. I bought two days ago, thought about selling at today’s peak twice, but I AINT NO PAPER HANDED BITCH. Get to a $420.69 share, and I will get Diamonds tattooed on my nips.",https://i.redd.it/cyiziiushqj61.jpg,2021-02-28 18:01,55,161,0.92
2th52,wallstreetbets,lsnrvh,2021-02-26 02:39,20 bucks into almost 4000 in less than 24 hours. Now I’m holding 500-800 calls with all of my profits. 😎,https://www.reddit.com/gallery/lsnrvh,2021-02-28 18:01,38,64,0.91
2th52,wallstreetbets,lsntx6,2021-02-26 02:41,Anyone know why my port is moving after AH.I don’t have shiny internet coins,https://v.redd.it/5o4a6aspiqj61,2021-02-28 18:01,36,14,0.67
2th52,wallstreetbets,lsnxkm,2021-02-26 02:46,The Fed is the real bear that's causing GME not going to moon (as well as other stonks),https://www.reddit.com/r/wallstreetbets/comments/lsnxkm/the_fed_is_the_real_bear_thats_causing_gme_not/,2021-02-28 18:01,41,40,0.77
2th52,wallstreetbets,lsnyeb,2021-02-26 02:47,🥜,https://v.redd.it/ym0jasztjqj61,2021-02-28 18:01,45,830,0.97
2th52,wallstreetbets,lso9ix,2021-02-26 03:00,Fuck trying to day trade GME stock. Lol. Guess I do better being a super duper gay ass bear.,https://i.redd.it/ulpfybl8mqj61.jpg,2021-02-28 18:01,65,9,0.55
2th52,wallstreetbets,lsod7z,2021-02-26 03:05,Gonna turn worthless tmrw Lost this $1000 in 3mins,https://i.redd.it/biw6uu45nqj61.jpg,2021-02-28 18:01,52,34,0.77
2th52,wallstreetbets,lsoeqx,2021-02-26 03:07,🚀💥,https://i.redd.it/q9azkg3inqj61.jpg,2021-02-28 18:01,23,34,0.86
2th52,wallstreetbets,lsoebu,2021-02-26 03:06,THE COMEBACK HAS COMMENCED!!! 💎💎💎,https://v.redd.it/3vd9x6r9nqj61,2021-02-28 18:01,31,170,0.95
2th52,wallstreetbets,lsol76,2021-02-26 03:16,Finally an Honest Investigative News Report - “The GameStop Mess Exposes the Naked Short Selling Scam”,https://prospect.org/power/gamestop-mess-exposes-the-naked-short-selling-scam/,2021-02-28 18:01,1399,56327,0.94
2th52,wallstreetbets,lsomm7,2021-02-26 03:18,Squazozzle update 2/25: Citadelvin tried to scare me 😳,https://i.redd.it/r5o6dv1kpqj61.jpg,2021-02-28 18:01,131,2912,0.98
2th52,wallstreetbets,lsop90,2021-02-26 03:22,Another hypothesis on GME mid-week spike and major stock price drops,https://www.reddit.com/r/wallstreetbets/comments/lsop90/another_hypothesis_on_gme_midweek_spike_and_major/,2021-02-28 18:01,38,64,0.72
2th52,wallstreetbets,lsour5,2021-02-26 03:30,I was too weak to hold and I’ll take the heat for it. 🥵,https://i.redd.it/m5ui4aforqj61.jpg,2021-02-28 18:01,36,0,0.42
2th52,wallstreetbets,lsow0a,2021-02-26 03:32,"Feb is almost over, and then we moon for the next 2 months.",https://www.reddit.com/r/wallstreetbets/comments/lsow0a/feb_is_almost_over_and_then_we_moon_for_the_next/,2021-02-28 18:01,30,55,0.86
2th52,wallstreetbets,lsp0gg,2021-02-26 03:39,If you don’t exercise your call contracts...,https://www.reddit.com/r/wallstreetbets/comments/lsp0gg/if_you_dont_exercise_your_call_contracts/,2021-02-28 18:01,66,54,0.66
2th52,wallstreetbets,lsp8e0,2021-02-26 03:52,Could This Be the True SI% of GME?,https://www.reddit.com/r/wallstreetbets/comments/lsp8e0/could_this_be_the_true_si_of_gme/,2021-02-28 18:01,42,60,0.81
2th52,wallstreetbets,lsp8qs,2021-02-26 03:52,🌈🐻 gain from today (next big play long RKT 🚀),https://i.redd.it/udmgiuzkvqj61.jpg,2021-02-28 18:01,49,132,0.92
2th52,wallstreetbets,lspakp,2021-02-26 03:55,So... I happened to check on the USD/CNH conversion.,https://www.reddit.com/gallery/lspakp,2021-02-28 18:01,30,34,0.87
2th52,wallstreetbets,lspbb5,2021-02-26 03:56,GME DD: Analysis of options expiry on 2/26 and potential for gamma and short squeezes,https://www.reddit.com/r/wallstreetbets/comments/lspbb5/gme_dd_analysis_of_options_expiry_on_226_and/,2021-02-28 18:01,59,132,0.89
2th52,wallstreetbets,lspc8a,2021-02-26 03:58,buying a new car with my gains from GME and NOK 🔥🔥🔥,https://i.redd.it/ilm7zeikwqj61.jpg,2021-02-28 18:01,32,112,0.87
2th52,wallstreetbets,lspfmm,2021-02-26 04:03,"Due to a shortage of competent analysts, Yahoo Finance has started quoting our ape grunts 🚀",https://i.redd.it/xaao6aq9xqj61.png,2021-02-28 18:01,40,446,0.97
2th52,wallstreetbets,lsptce,2021-02-26 04:25,Unpaid Bets- An Update,https://www.reddit.com/r/wallstreetbets/comments/lsptce/unpaid_bets_an_update/,2021-02-28 18:01,156,471,0.97
2th52,wallstreetbets,lspv8t,2021-02-26 04:29,Tomorrow will be a big day! 🚀,https://i.redd.it/qy4piuc32rj61.jpg,2021-02-28 18:01,32,125,0.95
2th52,wallstreetbets,lsq0pe,2021-02-26 04:38,$15 on Wednesday morning on a whim sold for $4000 on Thursday morning. Did I paper my hands at the last minute? 🥺,https://i.redd.it/hzyf2sar3rj61.jpg,2021-02-28 18:01,67,67,0.82
2th52,wallstreetbets,lsqdlz,2021-02-26 05:00,GME Daily Short Volume 💎🙌📈,https://www.reddit.com/r/wallstreetbets/comments/lsqdlz/gme_daily_short_volume/,2021-02-28 18:01,77,318,0.97
2th52,wallstreetbets,lsqen0,2021-02-26 05:02,Next Congressional Hearing on GameStop Scheduled for 03/17/2021,https://financialservices.house.gov/news/documentsingle.aspx?DocumentID=407261,2021-02-28 18:01,59,208,0.97
2th52,wallstreetbets,lsqjne,2021-02-26 05:10,Possible Correlation?,https://www.reddit.com/r/wallstreetbets/comments/lsqjne/possible_correlation/,2021-02-28 18:01,39,47,0.88
2th52,wallstreetbets,lsqlri,2021-02-26 05:14,I am seated on the AMC rocket awaiting take off to the moon 🚀🚀🚀🌕💎🙌,https://i.redd.it/oltiuvk6arj61.jpg,2021-02-28 18:01,42,134,0.85
