Subreddit_ID,Subreddit_Name,Submission_ID,Submission_CreatedDate,Submission_Title,Submission_URL,Submission_LastFetched,Submission_NumComments,Submission_Score,Submission_UpvoteRatio
2qjfk,stocks,kdvolq,2020-12-15 22:05,PLTR,https://www.reddit.com/r/stocks/comments/kdvolq/pltr/,2020-12-25 20:51,56,0,0.31
2qjfk,stocks,kdvshi,2020-12-15 22:11,APHA skyrockets 20% AH after news of blockbuster merger with Tilray,https://www.reddit.com/r/stocks/comments/kdvshi/apha_skyrockets_20_ah_after_news_of_blockbuster/,2020-12-25 20:51,59,100,0.96
2qjfk,stocks,kdwc37,2020-12-15 22:41,Your fav CEO?,https://www.reddit.com/r/stocks/comments/kdwc37/your_fav_ceo/,2020-12-25 20:51,32,3,0.81
2qjfk,stocks,kdwgq8,2020-12-15 22:48,DASH & ABNB. Will traders eventually pile in or dismiss them as a dud?,https://www.reddit.com/r/stocks/comments/kdwgq8/dash_abnb_will_traders_eventually_pile_in_or/,2020-12-25 20:51,23,6,0.67
2qjfk,stocks,kdwwdt,2020-12-15 23:11,Is Disney worth buying at the current price or is it worth waiting for a drop?,https://www.reddit.com/r/stocks/comments/kdwwdt/is_disney_worth_buying_at_the_current_price_or_is/,2020-12-25 20:51,29,14,0.77
2qjfk,stocks,kdykts,2020-12-16 00:45,"SQ, AMD, NVDA room for growth in the future?",https://www.reddit.com/r/stocks/comments/kdykts/sq_amd_nvda_room_for_growth_in_the_future/,2020-12-25 20:51,54,36,0.92
2qjfk,stocks,kdzk23,2020-12-16 01:43,$TAN now the time to get in?,https://www.reddit.com/r/stocks/comments/kdzk23/tan_now_the_time_to_get_in/,2020-12-25 20:51,48,28,0.88
2qjfk,stocks,kdzmro,2020-12-16 01:47,Looking to increase Biotech Holdings,https://www.reddit.com/r/stocks/comments/kdzmro/looking_to_increase_biotech_holdings/,2020-12-25 20:51,31,20,0.93
2qjfk,stocks,ke0fqk,2020-12-16 02:34,Question about ARK ETFs,https://www.reddit.com/r/stocks/comments/ke0fqk/question_about_ark_etfs/,2020-12-25 20:51,48,27,0.89
2qjfk,stocks,ke0mcd,2020-12-16 02:45,Thoughts on my ROTH IRA portfolio?,https://www.reddit.com/r/stocks/comments/ke0mcd/thoughts_on_my_roth_ira_portfolio/,2020-12-25 20:51,31,17,0.88
2qjfk,stocks,ke0t4o,2020-12-16 02:56,"Semiconductors, where are you putting your money for the next 3-5 years?",https://www.reddit.com/r/stocks/comments/ke0t4o/semiconductors_where_are_you_putting_your_money/,2020-12-25 20:51,48,16,0.94
2qjfk,stocks,ke1vc2,2020-12-16 04:02,My mom is asking me for investing advice,https://www.reddit.com/r/stocks/comments/ke1vc2/my_mom_is_asking_me_for_investing_advice/,2020-12-25 20:51,29,12,0.89
2qjfk,stocks,ke2goj,2020-12-16 04:41,"Corsair, Logitech, or...?",https://www.reddit.com/r/stocks/comments/ke2goj/corsair_logitech_or/,2020-12-25 20:51,62,56,0.93
2qjfk,stocks,ke4prq,2020-12-16 07:26,IMO An undervalued component of GME is their website,https://www.reddit.com/r/stocks/comments/ke4prq/imo_an_undervalued_component_of_gme_is_their/,2020-12-25 20:51,39,28,0.79
2qjfk,stocks,ke57g3,2020-12-16 08:06,"r/Stocks Daily Discussion Wednesday - Dec 16, 2020",https://www.reddit.com/r/stocks/comments/ke57g3/rstocks_daily_discussion_wednesday_dec_16_2020/,2020-12-25 20:51,518,24,0.96
2qjfk,stocks,ke802g,2020-12-16 12:05,Is Toyota (TM) a good stock to buy and hold?,https://www.reddit.com/r/stocks/comments/ke802g/is_toyota_tm_a_good_stock_to_buy_and_hold/,2020-12-25 20:51,65,35,0.83
2qjfk,stocks,ke89p0,2020-12-16 12:25,Xpeng delivers first EVs to Norway!,https://www.reddit.com/r/stocks/comments/ke89p0/xpeng_delivers_first_evs_to_norway/,2020-12-25 20:51,57,227,0.94
2qjfk,stocks,ke94ln,2020-12-16 13:25,Should I sell $ACB?,https://www.reddit.com/r/stocks/comments/ke94ln/should_i_sell_acb/,2020-12-25 20:51,35,6,0.67
2qjfk,stocks,ke9cw9,2020-12-16 13:40,Stock Market News Today | APHA & TLRY Merge | APPLE Rises | Stimulus & FED Meeting Today [12-16],https://www.reddit.com/r/stocks/comments/ke9cw9/stock_market_news_today_apha_tlry_merge_apple/,2020-12-25 20:51,79,465,0.96
2qjfk,stocks,ke9m0u,2020-12-16 13:56,What stock would you recommend to your grandmother that is safe but could go up 10X?,https://www.reddit.com/r/stocks/comments/ke9m0u/what_stock_would_you_recommend_to_your/,2020-12-25 20:51,35,0,0.33
2qjfk,stocks,ke9vze,2020-12-16 14:12,Reading about the dot-com bubble...it seems exactly like it is now but worse,https://www.reddit.com/r/stocks/comments/ke9vze/reading_about_the_dotcom_bubbleit_seems_exactly/,2020-12-25 20:51,84,11,0.63
2qjfk,stocks,ke9wb7,2020-12-16 14:12,Explain please,https://www.reddit.com/r/stocks/comments/ke9wb7/explain_please/,2020-12-25 20:51,24,8,0.7
2qjfk,stocks,kea5g3,2020-12-16 14:27,"SE, CRM, SPCE, BABA - All good buys right now?",https://www.reddit.com/r/stocks/comments/kea5g3/se_crm_spce_baba_all_good_buys_right_now/,2020-12-25 20:51,116,57,0.84
2qjfk,stocks,kea5og,2020-12-16 14:28,How to invest someone in the middle of this bull run?,https://www.reddit.com/r/stocks/comments/kea5og/how_to_invest_someone_in_the_middle_of_this_bull/,2020-12-25 20:51,24,6,0.76
2qjfk,stocks,keb8hl,2020-12-16 15:29,Biden Cabinet Picks,https://www.reddit.com/r/stocks/comments/keb8hl/biden_cabinet_picks/,2020-12-25 20:51,100,34,0.78
2qjfk,stocks,kebhaq,2020-12-16 15:42,How will $TSLA be affected by joining the S&P 500?,https://www.reddit.com/r/stocks/comments/kebhaq/how_will_tsla_be_affected_by_joining_the_sp_500/,2020-12-25 20:51,85,87,0.83
2qjfk,stocks,kebrcr,2020-12-16 15:58,Pfizer (PFE) always down,https://www.reddit.com/r/stocks/comments/kebrcr/pfizer_pfe_always_down/,2020-12-25 20:51,39,10,0.76
2qjfk,stocks,kebukw,2020-12-16 16:02,Could airline stocks rebound?,https://www.reddit.com/r/stocks/comments/kebukw/could_airline_stocks_rebound/,2020-12-25 20:51,20,2,0.67
2qjfk,stocks,kecpag,2020-12-16 16:45,"Amazon and two other Nasdaq 100 stocks to watch ahead of index rebalancing, traders say",https://www.reddit.com/r/stocks/comments/kecpag/amazon_and_two_other_nasdaq_100_stocks_to_watch/,2020-12-25 20:51,47,121,0.95
2qjfk,stocks,kecwfn,2020-12-16 16:55,"Massachusetts regulators file complaint against Robinhood, alleging manipulation of customers",https://www.reddit.com/r/stocks/comments/kecwfn/massachusetts_regulators_file_complaint_against/,2020-12-25 20:51,32,47,0.93
2qjfk,stocks,kedfs7,2020-12-16 17:22,Wish just became public. what are your thoughts?,https://www.reddit.com/r/stocks/comments/kedfs7/wish_just_became_public_what_are_your_thoughts/,2020-12-25 20:51,22,5,0.78
2qjfk,stocks,keexwg,2020-12-16 18:37,Why is vaccine stock falling?,https://www.reddit.com/r/stocks/comments/keexwg/why_is_vaccine_stock_falling/,2020-12-25 20:51,28,0,0.29
2qjfk,stocks,kefg6t,2020-12-16 19:02,Where do I start if i want to learn about stocks?,https://www.reddit.com/r/stocks/comments/kefg6t/where_do_i_start_if_i_want_to_learn_about_stocks/,2020-12-25 20:51,30,22,0.82
2qjfk,stocks,kefneu,2020-12-16 19:12,New PLTR Contract?,https://www.reddit.com/r/stocks/comments/kefneu/new_pltr_contract/,2020-12-25 20:51,237,342,0.94
2qjfk,stocks,kegj8j,2020-12-16 19:56,Small - Mid Cap Growth Stocks,https://www.reddit.com/r/stocks/comments/kegj8j/small_mid_cap_growth_stocks/,2020-12-25 20:51,25,13,0.85
2qjfk,stocks,kegzi0,2020-12-16 20:17,Zoom,https://www.reddit.com/r/stocks/comments/kegzi0/zoom/,2020-12-25 20:51,26,0,0.5
2qjfk,stocks,kehbpi,2020-12-16 20:34,"I draw with crayons so you don't have to. Update: $1,500 profit this week already, account hit $90k.",https://www.reddit.com/r/stocks/comments/kehbpi/i_draw_with_crayons_so_you_dont_have_to_update/,2020-12-25 20:51,20,66,0.88
2qjfk,stocks,kehrkg,2020-12-16 20:56,My 8 investing guidelines.,https://www.reddit.com/r/stocks/comments/kehrkg/my_8_investing_guidelines/,2020-12-25 20:51,313,3737,0.96
2qjfk,stocks,keick0,2020-12-16 21:24,My experiences of day trading/investing for my first 3 months.,https://www.reddit.com/r/stocks/comments/keick0/my_experiences_of_day_tradinginvesting_for_my/,2020-12-25 20:51,26,1,0.54
2qjfk,stocks,kel0j7,2020-12-16 23:37,SQ: Buy now or wait for a pullback?,https://www.reddit.com/r/stocks/comments/kel0j7/sq_buy_now_or_wait_for_a_pullback/,2020-12-25 20:51,24,0,0.5
2qjfk,stocks,kelode,2020-12-17 00:11,Are stocks becoming more valuable because the US dollar is losing value?,https://www.reddit.com/r/stocks/comments/kelode/are_stocks_becoming_more_valuable_because_the_us/,2020-12-25 20:51,68,100,0.96
2qjfk,stocks,kemlvb,2020-12-17 01:03,Opinions on Plug Power and it’s potential growth.,https://www.reddit.com/r/stocks/comments/kemlvb/opinions_on_plug_power_and_its_potential_growth/,2020-12-25 20:51,22,10,0.82
2qjfk,stocks,kenwkv,2020-12-17 02:12,An ode to NVDA,https://www.reddit.com/r/stocks/comments/kenwkv/an_ode_to_nvda/,2020-12-25 20:51,29,22,0.82
2qjfk,stocks,keoo1z,2020-12-17 02:53,Why do people bother with bonds?,https://www.reddit.com/r/stocks/comments/keoo1z/why_do_people_bother_with_bonds/,2020-12-25 20:51,50,17,0.72
2qjfk,stocks,keqfro,2020-12-17 04:37,What happen to AMC stock of it goes bankrupt?,https://www.reddit.com/r/stocks/comments/keqfro/what_happen_to_amc_stock_of_it_goes_bankrupt/,2020-12-25 20:51,45,16,0.88
2qjfk,stocks,ket836,2020-12-17 07:56,How to spot market correction?,https://www.reddit.com/r/stocks/comments/ket836/how_to_spot_market_correction/,2020-12-25 20:51,27,8,0.8
2qjfk,stocks,ketcre,2020-12-17 08:06,"r/Stocks Daily Discussion & Options Trading Thursday - Dec 17, 2020",https://www.reddit.com/r/stocks/comments/ketcre/rstocks_daily_discussion_options_trading_thursday/,2020-12-25 20:51,404,20,1.0
2qjfk,stocks,keus0g,2020-12-17 10:06,You have $10000 to invest in one stock to hold for a couple months? What stock do you choose?,https://www.reddit.com/r/stocks/comments/keus0g/you_have_10000_to_invest_in_one_stock_to_hold_for/,2020-12-25 20:51,100,17,0.73
2qjfk,stocks,kevvjr,2020-12-17 11:36,Buy the dip!!,https://www.reddit.com/r/stocks/comments/kevvjr/buy_the_dip/,2020-12-25 20:51,22,11,0.74
2qjfk,stocks,kexnd7,2020-12-17 13:41,2021 stock picks,https://www.reddit.com/r/stocks/comments/kexnd7/2021_stock_picks/,2020-12-25 20:51,301,183,0.96
2qjfk,stocks,kexqwg,2020-12-17 13:48,How did you learn the stock market?,https://www.reddit.com/r/stocks/comments/kexqwg/how_did_you_learn_the_stock_market/,2020-12-25 20:51,64,16,0.83
2qjfk,stocks,key4hc,2020-12-17 14:10,CLF vs MT,https://www.reddit.com/r/stocks/comments/key4hc/clf_vs_mt/,2020-12-25 20:51,42,16,0.88
2qjfk,stocks,keya27,2020-12-17 14:20,Elon Musk's Boring Company buys industrial site near Tesla's under-construction Texas factory,https://www.reddit.com/r/stocks/comments/keya27/elon_musks_boring_company_buys_industrial_site/,2020-12-25 20:51,210,1384,0.97
2qjfk,stocks,keyj5a,2020-12-17 14:35,Best etfs and mutual funds to get into?,https://www.reddit.com/r/stocks/comments/keyj5a/best_etfs_and_mutual_funds_to_get_into/,2020-12-25 20:51,27,8,0.76
2qjfk,stocks,kezs26,2020-12-17 15:45,Volkswagen (VW) loses top EU court case in diesel scandal,https://www.reddit.com/r/stocks/comments/kezs26/volkswagen_vw_loses_top_eu_court_case_in_diesel/,2020-12-25 20:51,32,27,0.85
2qjfk,stocks,kf12bb,2020-12-17 16:50,"Forbes’ picks for 2021, and which ones we should pick",https://www.reddit.com/r/stocks/comments/kf12bb/forbes_picks_for_2021_and_which_ones_we_should/,2020-12-25 20:51,73,76,0.94
2qjfk,stocks,kf1exy,2020-12-17 17:07,Anybody feeling the FOMO in this stupidly insane BULL run we're experiencing right now?,https://www.reddit.com/r/stocks/comments/kf1exy/anybody_feeling_the_fomo_in_this_stupidly_insane/,2020-12-25 20:51,72,47,0.9
2qjfk,stocks,kf2cn1,2020-12-17 17:53,ARKG ETF - most potential,https://www.reddit.com/r/stocks/comments/kf2cn1/arkg_etf_most_potential/,2020-12-25 20:51,38,29,0.94
2qjfk,stocks,kf4kpi,2020-12-17 19:41,What’s the current meme stock?,https://www.reddit.com/r/stocks/comments/kf4kpi/whats_the_current_meme_stock/,2020-12-25 20:51,73,10,0.71
2qjfk,stocks,kf4pqf,2020-12-17 19:48,Tips from the last year - Up 340%,https://www.reddit.com/r/stocks/comments/kf4pqf/tips_from_the_last_year_up_340/,2020-12-25 20:51,20,0,0.48
2qjfk,stocks,kf4zit,2020-12-17 20:01,$TSLA - tomorrow is the last day before S&P 500,https://www.reddit.com/r/stocks/comments/kf4zit/tsla_tomorrow_is_the_last_day_before_sp_500/,2020-12-25 20:51,59,42,0.84
2qjfk,stocks,kf5bb8,2020-12-17 20:18,Is NIO a buy? Looking for some diversification portfolio,https://www.reddit.com/r/stocks/comments/kf5bb8/is_nio_a_buy_looking_for_some_diversification/,2020-12-25 20:51,38,11,0.73
2qjfk,stocks,kf6k4x,2020-12-17 21:20,"Palantir Technologies Reports Will Hold Inaugural Live Demo Day On Tuesday, Jan. 26, 2021 To 4:30 p.m. EST",https://www.reddit.com/r/stocks/comments/kf6k4x/palantir_technologies_reports_will_hold_inaugural/,2020-12-25 20:51,81,314,0.96
2qjfk,stocks,kf6qnd,2020-12-17 21:29,I just sold Tesla (TSLA),https://www.reddit.com/r/stocks/comments/kf6qnd/i_just_sold_tesla_tsla/,2020-12-25 20:51,239,116,0.82
2qjfk,stocks,kf6tjk,2020-12-17 21:34,Understanding The Market Requires You To Understand Market Psychology,https://www.reddit.com/r/stocks/comments/kf6tjk/understanding_the_market_requires_you_to/,2020-12-25 20:51,24,207,0.96
2qjfk,stocks,kf6wvm,2020-12-17 21:38,what do you think of PLTR - Palantir. It's a bubble or not?,https://www.reddit.com/r/stocks/comments/kf6wvm/what_do_you_think_of_pltr_palantir_its_a_bubble/,2020-12-25 20:51,71,29,0.74
2qjfk,stocks,kf7zxl,2020-12-17 22:35,DoorDash Slips After Citron Calls IPO ‘Most Ridiculous’ of 2020,https://www.reddit.com/r/stocks/comments/kf7zxl/doordash_slips_after_citron_calls_ipo_most/,2020-12-25 20:51,34,55,0.96
2qjfk,stocks,kf896c,2020-12-17 22:48,Any growth stocks which have been dipping recently that you think is a good entry point ?,https://www.reddit.com/r/stocks/comments/kf896c/any_growth_stocks_which_have_been_dipping/,2020-12-25 20:51,46,8,0.73
2qjfk,stocks,kf8pt8,2020-12-17 23:13,Why is telsa a bubble?,https://www.reddit.com/r/stocks/comments/kf8pt8/why_is_telsa_a_bubble/,2020-12-25 20:51,63,8,0.71
2qjfk,stocks,kf95rb,2020-12-17 23:37,Breakthrough in EV Battery Technology.,https://www.reddit.com/r/stocks/comments/kf95rb/breakthrough_in_ev_battery_technology/,2020-12-25 20:51,20,2,0.75
2qjfk,stocks,kf9zuv,2020-12-18 00:23,I wasted all my money until I started buying stocks.,https://www.reddit.com/r/stocks/comments/kf9zuv/i_wasted_all_my_money_until_i_started_buying/,2020-12-25 20:51,864,4697,0.93
2qjfk,stocks,kfa9wr,2020-12-18 00:39,Tesla Stock Jumps On Credit Rating Bump Ahead Of S&P 500 Inclusion,https://www.reddit.com/r/stocks/comments/kfa9wr/tesla_stock_jumps_on_credit_rating_bump_ahead_of/,2020-12-25 20:51,21,21,0.88
2qjfk,stocks,kfai41,2020-12-18 00:52,enough with the long paragraphs here's the stocks,https://www.reddit.com/r/stocks/comments/kfai41/enough_with_the_long_paragraphs_heres_the_stocks/,2020-12-25 20:51,28,10,0.71
2qjfk,stocks,kfcsxy,2020-12-18 03:10,How do you get over having sold early and missing out on massive future profits?,https://www.reddit.com/r/stocks/comments/kfcsxy/how_do_you_get_over_having_sold_early_and_missing/,2020-12-25 20:51,33,1,0.53
2qjfk,stocks,kfh2ly,2020-12-18 08:07,"r/Stocks Daily Discussion & Fundamentals Friday Dec 18, 2020",https://www.reddit.com/r/stocks/comments/kfh2ly/rstocks_daily_discussion_fundamentals_friday_dec/,2020-12-25 20:51,634,33,0.93
2qjfk,stocks,kfhhq2,2020-12-18 08:44,How to play TSLA today,https://www.reddit.com/r/stocks/comments/kfhhq2/how_to_play_tsla_today/,2020-12-25 20:51,65,22,0.75
2qjfk,stocks,kfigxl,2020-12-18 10:05,Am I too late for apple?,https://www.reddit.com/r/stocks/comments/kfigxl/am_i_too_late_for_apple/,2020-12-25 20:51,20,6,0.76
2qjfk,stocks,kfj95r,2020-12-18 11:12,Norwegian air is FFFFLLLYYING CRAZY!!,https://www.reddit.com/r/stocks/comments/kfj95r/norwegian_air_is_fffflllyying_crazy/,2020-12-25 20:51,27,0,0.35
2qjfk,stocks,kfk2fe,2020-12-18 12:17,Cyberpunk:2077 Dropped From Playstation Online Store and Refunds Delivered,https://www.reddit.com/r/stocks/comments/kfk2fe/cyberpunk2077_dropped_from_playstation_online/,2020-12-25 20:51,120,168,0.93
2qjfk,stocks,kfk9qw,2020-12-18 12:30,Growth Stocks,https://www.reddit.com/r/stocks/comments/kfk9qw/growth_stocks/,2020-12-25 20:51,171,71,0.87
2qjfk,stocks,kfkq04,2020-12-18 13:01,I do not have any ETFs In my portfolio. What good ETFs do you recommend?,https://www.reddit.com/r/stocks/comments/kfkq04/i_do_not_have_any_etfs_in_my_portfolio_what_good/,2020-12-25 20:51,93,29,0.92
2qjfk,stocks,kfm1yi,2020-12-18 14:26,What are your biggest disappointing performers?,https://www.reddit.com/r/stocks/comments/kfm1yi/what_are_your_biggest_disappointing_performers/,2020-12-25 20:51,23,0,0.5
2qjfk,stocks,kfm9fh,2020-12-18 14:38,Hold on to Tesla for dear life,https://www.reddit.com/r/stocks/comments/kfm9fh/hold_on_to_tesla_for_dear_life/,2020-12-25 20:51,32,0,0.36
2qjfk,stocks,kfmlvf,2020-12-18 14:58,FUBOTV Stock - signs of an irrational bull market #FUBOTV #FUBO,https://www.reddit.com/r/stocks/comments/kfmlvf/fubotv_stock_signs_of_an_irrational_bull_market/,2020-12-25 20:51,27,4,0.75
2qjfk,stocks,kfnd3d,2020-12-18 15:39,Cathie Wood to Retain Control Over ARK,https://www.reddit.com/r/stocks/comments/kfnd3d/cathie_wood_to_retain_control_over_ark/,2020-12-25 20:51,194,1291,0.97
2qjfk,stocks,kfoe3x,2020-12-18 16:32,"Is now a good time to put money in ETFs like VOO or VTI? I am 32, I have $20k in a 401k, $6500 in a Roth IRA and $60k in a regular savings account (stupid I know). Want to save for down payment for house.",https://www.reddit.com/r/stocks/comments/kfoe3x/is_now_a_good_time_to_put_money_in_etfs_like_voo/,2020-12-25 20:51,22,22,0.86
2qjfk,stocks,kfog6s,2020-12-18 16:35,What’s your 4 can’t miss stocks for 20yr timeline?,https://www.reddit.com/r/stocks/comments/kfog6s/whats_your_4_cant_miss_stocks_for_20yr_timeline/,2020-12-25 20:51,155,91,0.9
2qjfk,stocks,kfoiug,2020-12-18 16:39,Anyone having issues with e*Trade and their NWARF stock?,https://www.reddit.com/r/stocks/comments/kfoiug/anyone_having_issues_with_etrade_and_their_nwarf/,2020-12-25 20:51,24,4,0.67
2qjfk,stocks,kfp4lh,2020-12-18 17:10,One of the worst feeling about stocks,https://www.reddit.com/r/stocks/comments/kfp4lh/one_of_the_worst_feeling_about_stocks/,2020-12-25 20:51,250,695,0.95
2qjfk,stocks,kfprkf,2020-12-18 17:42,What are everyone’s thoughts on Chewy? Hit $100 today!,https://www.reddit.com/r/stocks/comments/kfprkf/what_are_everyones_thoughts_on_chewy_hit_100_today/,2020-12-25 20:51,25,8,1.0
2qjfk,stocks,kfq891,2020-12-18 18:05,"Started trading this year. No job, took $6,000 of my college loan refund, made $35,000 profit and possibly more. Not sure what to do with the tax situation. Help?",https://www.reddit.com/r/stocks/comments/kfq891/started_trading_this_year_no_job_took_6000_of_my/,2020-12-25 20:51,96,58,0.81
2qjfk,stocks,kfqf16,2020-12-18 18:15,How much of your portfolio is in shares vs options?,https://www.reddit.com/r/stocks/comments/kfqf16/how_much_of_your_portfolio_is_in_shares_vs_options/,2020-12-25 20:51,31,2,1.0
2qjfk,stocks,kfqf3e,2020-12-18 18:15,Is NIO a good investment?,https://www.reddit.com/r/stocks/comments/kfqf3e/is_nio_a_good_investment/,2020-12-25 20:51,167,10,0.69
2qjfk,stocks,kfrjo1,2020-12-18 19:12,Should I give up and just give all my money to ARKW?,https://www.reddit.com/r/stocks/comments/kfrjo1/should_i_give_up_and_just_give_all_my_money_to/,2020-12-25 20:51,52,33,0.89
2qjfk,stocks,kfrt6z,2020-12-18 19:27,"I said it: no idea how the stock market works. Tesla sold 400,000 cars up 700%, Pfizer has the globe literally as a customer but they are only up by 12%",https://www.reddit.com/r/stocks/comments/kfrt6z/i_said_it_no_idea_how_the_stock_market_works/,2020-12-25 20:51,668,2898,0.93
2qjfk,stocks,kfrty9,2020-12-18 19:28,People asking why $MT and $VALE are the next 🚀🚀🚀🚀 This is why.,https://www.reddit.com/r/stocks/comments/kfrty9/people_asking_why_mt_and_vale_are_the_next_this/,2020-12-25 20:51,24,8,0.7
2qjfk,stocks,kfs3uv,2020-12-18 19:42,AMPIO (AMPE),https://www.reddit.com/r/stocks/comments/kfs3uv/ampio_ampe/,2020-12-25 20:51,29,17,0.88
2qjfk,stocks,kfstkq,2020-12-18 20:20,Oil tanker stocks for 2021 big news?,https://www.reddit.com/r/stocks/comments/kfstkq/oil_tanker_stocks_for_2021_big_news/,2020-12-25 20:51,23,6,0.87
2qjfk,stocks,kft0c1,2020-12-18 20:30,Please help me understand how Tesla is included in S&P.,https://www.reddit.com/r/stocks/comments/kft0c1/please_help_me_understand_how_tesla_is_included/,2020-12-25 20:51,68,8,0.64
2qjfk,stocks,kfu0ka,2020-12-18 21:24,Steady growth stocks under 100$?,https://www.reddit.com/r/stocks/comments/kfu0ka/steady_growth_stocks_under_100/,2020-12-25 20:51,25,1,0.6
2qjfk,stocks,kfu116,2020-12-18 21:25,Gravity defying market? Why? How?,https://www.reddit.com/r/stocks/comments/kfu116/gravity_defying_market_why_how/,2020-12-25 20:51,28,1,0.67
2qjfk,stocks,kfu7o0,2020-12-18 21:35,Intel falls on report Microsoft plans to design own chips for PCs and servers,https://www.reddit.com/r/stocks/comments/kfu7o0/intel_falls_on_report_microsoft_plans_to_design/,2020-12-25 20:51,112,234,0.97
2qjfk,stocks,kfud7d,2020-12-18 21:43,Best Canadian Weed ETFs?,https://www.reddit.com/r/stocks/comments/kfud7d/best_canadian_weed_etfs/,2020-12-25 20:51,21,1,0.67
2qjfk,stocks,kfv334,2020-12-18 22:21,"With the latest government hack news, and SolarWinds software Orion being the culprit, is this a huge opportunity for PLTR?",https://www.reddit.com/r/stocks/comments/kfv334/with_the_latest_government_hack_news_and/,2020-12-25 20:51,27,34,0.8
2qjfk,stocks,kfvewz,2020-12-18 22:37,What are your top stock picks for 2021?,https://www.reddit.com/r/stocks/comments/kfvewz/what_are_your_top_stock_picks_for_2021/,2020-12-25 20:51,24,14,0.82
2qjfk,stocks,kfvgx6,2020-12-18 22:40,Long Term stocks,https://www.reddit.com/r/stocks/comments/kfvgx6/long_term_stocks/,2020-12-25 20:51,25,5,0.74
2qjfk,stocks,kfvmt2,2020-12-18 22:48,"PLTR downgraded by Credit Suisse, what do you think?",https://www.reddit.com/r/stocks/comments/kfvmt2/pltr_downgraded_by_credit_suisse_what_do_you_think/,2020-12-25 20:51,99,40,0.87
2qjfk,stocks,kfvw8z,2020-12-18 23:02,Is there a way to see individual performances within a mutual fund?,https://www.reddit.com/r/stocks/comments/kfvw8z/is_there_a_way_to_see_individual_performances/,2020-12-25 20:51,22,8,0.9
2qjfk,stocks,kfy9im,2020-12-19 01:19,Fidelity Disruptive Funds - ARK for Boomers,https://www.reddit.com/r/stocks/comments/kfy9im/fidelity_disruptive_funds_ark_for_boomers/,2020-12-25 20:51,32,35,0.92
2qjfk,stocks,kg1j5w,2020-12-19 04:52,Expected Tesla share's price,https://www.reddit.com/r/stocks/comments/kg1j5w/expected_tesla_shares_price/,2020-12-25 20:51,33,2,0.63
2qjfk,stocks,kg1liy,2020-12-19 04:57,Cyber security stocks,https://www.reddit.com/r/stocks/comments/kg1liy/cyber_security_stocks/,2020-12-25 20:51,61,33,0.88
2qjfk,stocks,kg1zmg,2020-12-19 05:25,If I had $800 a month to invest for 5 years,https://www.reddit.com/r/stocks/comments/kg1zmg/if_i_had_800_a_month_to_invest_for_5_years/,2020-12-25 20:51,21,16,0.86
2qjfk,stocks,kg3okz,2020-12-19 07:44,What sectors will you be investing in in 2021?,https://www.reddit.com/r/stocks/comments/kg3okz/what_sectors_will_you_be_investing_in_in_2021/,2020-12-25 20:51,171,52,0.87
2qjfk,stocks,kg5x44,2020-12-19 11:03,Cathie Wood thinks that the Genomics sector can outperform Tesla going forward,https://www.reddit.com/r/stocks/comments/kg5x44/cathie_wood_thinks_that_the_genomics_sector_can/,2020-12-25 20:51,406,1280,0.97
2qjfk,stocks,kg6jpu,2020-12-19 11:58,CD Project Red stocks nowadays,https://www.reddit.com/r/stocks/comments/kg6jpu/cd_project_red_stocks_nowadays/,2020-12-25 20:51,21,6,0.75
2qjfk,stocks,kg8hu0,2020-12-19 14:21,Looking for great podcasts regarding stocks & companies worth tracking,https://www.reddit.com/r/stocks/comments/kg8hu0/looking_for_great_podcasts_regarding_stocks/,2020-12-25 20:51,33,52,0.93
2qjfk,stocks,kg9c5m,2020-12-19 15:09,Elon Musk Has Made Millionaires Out of His Most Loyal Fans,https://www.reddit.com/r/stocks/comments/kg9c5m/elon_musk_has_made_millionaires_out_of_his_most/,2020-12-25 20:51,280,1503,0.92
2qjfk,stocks,kgaen8,2020-12-19 16:06,Graduation gift of 10k Exxon stock,https://www.reddit.com/r/stocks/comments/kgaen8/graduation_gift_of_10k_exxon_stock/,2020-12-25 20:51,198,89,0.9
2qjfk,stocks,kgayy3,2020-12-19 16:34,What is a good place to learn about the stock market?,https://www.reddit.com/r/stocks/comments/kgayy3/what_is_a_good_place_to_learn_about_the_stock/,2020-12-25 20:51,49,29,0.82
2qjfk,stocks,kgcmsn,2020-12-19 17:58,"I'm going to take a big position in Nintendo next week, is there a bear case?",https://www.reddit.com/r/stocks/comments/kgcmsn/im_going_to_take_a_big_position_in_nintendo_next/,2020-12-25 20:51,27,4,0.7
2qjfk,stocks,kgd1xh,2020-12-19 18:21,Which acronym will replace the „FAANG“ in the next decade?,https://www.reddit.com/r/stocks/comments/kgd1xh/which_acronym_will_replace_the_faang_in_the_next/,2020-12-25 20:51,79,14,0.66
2qjfk,stocks,kgd8ia,2020-12-19 18:29,Promising ETF’s with great growth potential,https://www.reddit.com/r/stocks/comments/kgd8ia/promising_etfs_with_great_growth_potential/,2020-12-25 20:51,70,48,0.94
2qjfk,stocks,kgdpoe,2020-12-19 18:50,What’re the downsides to covered calls?,https://www.reddit.com/r/stocks/comments/kgdpoe/whatre_the_downsides_to_covered_calls/,2020-12-25 20:51,23,4,0.67
2qjfk,stocks,kgdy6m,2020-12-19 19:03,Can someone sell me on future fundamentals that SQ is a buy?,https://www.reddit.com/r/stocks/comments/kgdy6m/can_someone_sell_me_on_future_fundamentals_that/,2020-12-25 20:51,24,16,0.8
2qjfk,stocks,kge67s,2020-12-19 19:14,Lab-grown meat companies?,https://www.reddit.com/r/stocks/comments/kge67s/labgrown_meat_companies/,2020-12-25 20:51,55,8,0.79
2qjfk,stocks,kgf8t3,2020-12-19 20:08,Good long term dividend stocks that I can get into?,https://www.reddit.com/r/stocks/comments/kgf8t3/good_long_term_dividend_stocks_that_i_can_get_into/,2020-12-25 20:51,21,8,0.85
