Subreddit_ID,Subreddit_Name,Submission_ID,Submission_CreatedDate,Submission_Title,Submission_URL,Submission_LastFetched,Submission_NumComments,Submission_Score,Submission_UpvoteRatio
2qhhq,investing,ld9olc,2021-02-05 15:35,Opinion on Altria - $MO Big Tobacco and Marijuana,https://www.reddit.com/r/investing/comments/ld9olc/opinion_on_altria_mo_big_tobacco_and_marijuana/,2021-02-28 18:01,36,23,0.78
2qhhq,investing,ldamut,2021-02-05 16:19,Women's health investments.,https://www.reddit.com/r/investing/comments/ldamut/womens_health_investments/,2021-02-28 18:01,25,23,0.7
2qhhq,investing,ldayun,2021-02-05 16:34,If I'm running a movie ETF...,https://www.reddit.com/r/investing/comments/ldayun/if_im_running_a_movie_etf/,2021-02-28 18:01,58,79,0.88
2qhhq,investing,ldc727,2021-02-05 17:25,Upcoming IPOs Roblox and Coinbase.,https://www.reddit.com/r/investing/comments/ldc727/upcoming_ipos_roblox_and_coinbase/,2021-02-28 18:01,51,28,0.92
2qhhq,investing,ldcb85,2021-02-05 17:30,Holding Thousands in Cash and the Value of Timing,https://www.reddit.com/r/investing/comments/ldcb85/holding_thousands_in_cash_and_the_value_of_timing/,2021-02-28 18:01,270,215,0.88
2qhhq,investing,ldcdr7,2021-02-05 17:33,Container Ship Boom: Update - Rates Surging Higher,https://www.reddit.com/r/investing/comments/ldcdr7/container_ship_boom_update_rates_surging_higher/,2021-02-28 18:01,53,56,0.93
2qhhq,investing,lddbim,2021-02-05 18:12,Automakers going all-in on EVs,https://www.reddit.com/r/investing/comments/lddbim/automakers_going_allin_on_evs/,2021-02-28 18:01,46,24,0.87
2qhhq,investing,ldf4wu,2021-02-05 19:30,Why I'm BANKING on Wells Fargo,https://www.reddit.com/r/investing/comments/ldf4wu/why_im_banking_on_wells_fargo/,2021-02-28 18:01,42,14,0.65
2qhhq,investing,ldfs05,2021-02-05 19:58,Future of AMC after Corona.,https://www.reddit.com/r/investing/comments/ldfs05/future_of_amc_after_corona/,2021-02-28 18:01,141,63,0.81
2qhhq,investing,ldfs3k,2021-02-05 19:58,% of portfolio towards riskier investments,https://www.reddit.com/r/investing/comments/ldfs3k/of_portfolio_towards_riskier_investments/,2021-02-28 18:01,36,14,0.86
2qhhq,investing,ldfucs,2021-02-05 20:01,Lucid motor initial market capitalization and CCIV stock price,https://www.reddit.com/r/investing/comments/ldfucs/lucid_motor_initial_market_capitalization_and/,2021-02-28 18:01,34,13,0.75
2qhhq,investing,ldfz1w,2021-02-05 20:06,$POWW ammo company with uptrend potential. And worth to take a look,https://www.reddit.com/r/investing/comments/ldfz1w/poww_ammo_company_with_uptrend_potential_and/,2021-02-28 18:01,190,164,0.82
2qhhq,investing,ldg8h9,2021-02-05 20:18,Stocks I hope will go up as things slowly reopen back to normal.,https://www.reddit.com/r/investing/comments/ldg8h9/stocks_i_hope_will_go_up_as_things_slowly_reopen/,2021-02-28 18:01,56,19,0.69
2qhhq,investing,ldggnz,2021-02-05 20:29,"Where to purchase ETFs (Europe, Degiro and IB not available choices)",https://www.reddit.com/r/investing/comments/ldggnz/where_to_purchase_etfs_europe_degiro_and_ib_not/,2021-02-28 18:01,22,6,0.62
2qhhq,investing,ldhqp9,2021-02-05 21:26,Bear Market stocks for a bull,https://www.reddit.com/r/investing/comments/ldhqp9/bear_market_stocks_for_a_bull/,2021-02-28 18:01,21,0,0.33
2qhhq,investing,ldjnch,2021-02-05 22:55,TTCF as a investment for your portfolio,https://www.reddit.com/r/investing/comments/ldjnch/ttcf_as_a_investment_for_your_portfolio/,2021-02-28 18:01,27,34,0.81
2qhhq,investing,ldlhym,2021-02-06 00:25,FVRR: A Diamond in the Rough in plain sight,https://www.reddit.com/r/investing/comments/ldlhym/fvrr_a_diamond_in_the_rough_in_plain_sight/,2021-02-28 18:01,21,2,0.54
2qhhq,investing,ldlk4v,2021-02-06 00:28,Churchill Capital Opened a new stock CCV BIG NEWS FOR CCIV,https://www.reddit.com/r/investing/comments/ldlk4v/churchill_capital_opened_a_new_stock_ccv_big_news/,2021-02-28 18:01,88,152,0.8
2qhhq,investing,ldm3ne,2021-02-06 00:56,Westport Fuel Systems (WPRT),https://www.reddit.com/r/investing/comments/ldm3ne/westport_fuel_systems_wprt/,2021-02-28 18:01,33,42,0.95
2qhhq,investing,ldmwx0,2021-02-06 01:39,Stocks relating to diabetes technology,https://www.reddit.com/r/investing/comments/ldmwx0/stocks_relating_to_diabetes_technology/,2021-02-28 18:01,58,80,0.93
2qhhq,investing,ldpnmo,2021-02-06 04:16,Investing opportunities in seaweed,https://www.reddit.com/r/investing/comments/ldpnmo/investing_opportunities_in_seaweed/,2021-02-28 18:01,168,743,0.96
2qhhq,investing,ldr61e,2021-02-06 05:55,Why I think PBF Energy is undervalued,https://www.reddit.com/r/investing/comments/ldr61e/why_i_think_pbf_energy_is_undervalued/,2021-02-28 18:01,26,27,0.89
2qhhq,investing,ldrsgq,2021-02-06 06:40,"A story about the Dot Com bubble, some profit taking, exit strategies and money vs capital",https://www.reddit.com/r/investing/comments/ldrsgq/a_story_about_the_dot_com_bubble_some_profit/,2021-02-28 18:01,869,4357,0.95
2qhhq,investing,ldsmr4,2021-02-06 07:44,What do you think about my new strategy what are some flaws,https://www.reddit.com/r/investing/comments/ldsmr4/what_do_you_think_about_my_new_strategy_what_are/,2021-02-28 18:01,34,4,0.65
2qhhq,investing,ldtsod,2021-02-06 09:19,Using SEC Forms to pick stocks,https://www.reddit.com/r/investing/comments/ldtsod/using_sec_forms_to_pick_stocks/,2021-02-28 18:01,26,27,0.83
2qhhq,investing,ldzb68,2021-02-06 15:05,"GME, Mob Mentality, and the irresponsibility of Reddit hype.",https://www.reddit.com/r/investing/comments/ldzb68/gme_mob_mentality_and_the_irresponsibility_of/,2021-02-28 18:01,625,525,0.64
2qhhq,investing,le09xr,2021-02-06 15:55,Why you should put BEAM on your watchlist,https://www.reddit.com/r/investing/comments/le09xr/why_you_should_put_beam_on_your_watchlist/,2021-02-28 18:01,76,97,0.86
2qhhq,investing,le0gav,2021-02-06 16:03,Investing in antidepression/therapy,https://www.reddit.com/r/investing/comments/le0gav/investing_in_antidepressiontherapy/,2021-02-28 18:01,92,65,0.86
2qhhq,investing,le1vc6,2021-02-06 17:11,"Canadian REITs: Niche, but poised for growth and paying dividends",https://www.reddit.com/r/investing/comments/le1vc6/canadian_reits_niche_but_poised_for_growth_and/,2021-02-28 18:01,39,49,0.86
2qhhq,investing,le29pp,2021-02-06 17:30,Canadian National (CN) Rail,https://www.reddit.com/r/investing/comments/le29pp/canadian_national_cn_rail/,2021-02-28 18:01,20,26,0.83
2qhhq,investing,le49uk,2021-02-06 19:04,High After New High - GRWG Still Going Up,https://www.reddit.com/r/investing/comments/le49uk/high_after_new_high_grwg_still_going_up/,2021-02-28 18:01,24,16,0.77
2qhhq,investing,le4zlk,2021-02-06 19:38,$TSMC - a newbe sort of DD,https://www.reddit.com/r/investing/comments/le4zlk/tsmc_a_newbe_sort_of_dd/,2021-02-28 18:01,88,98,0.91
2qhhq,investing,le5cth,2021-02-06 19:55,Best long term investment in the world is in water (desalination business),https://www.reddit.com/r/investing/comments/le5cth/best_long_term_investment_in_the_world_is_in/,2021-02-28 18:01,280,397,0.77
2qhhq,investing,le5uco,2021-02-06 20:18,Nasdaq vs S&P 500 Next Decade,https://www.reddit.com/r/investing/comments/le5uco/nasdaq_vs_sp_500_next_decade/,2021-02-28 18:01,122,78,0.88
2qhhq,investing,le74dy,2021-02-06 21:20,Stock tracker and analysis spreadsheet,https://www.reddit.com/r/investing/comments/le74dy/stock_tracker_and_analysis_spreadsheet/,2021-02-28 18:01,333,3637,0.98
2qhhq,investing,le8f3e,2021-02-06 22:23,Amazon orders 700 trucks that run on natural gas - Good news for RDS?,https://www.reddit.com/r/investing/comments/le8f3e/amazon_orders_700_trucks_that_run_on_natural_gas/,2021-02-28 18:01,52,149,0.9
2qhhq,investing,le8ium,2021-02-06 22:28,Struggling to jump the first hurdle as a UK trader.,https://www.reddit.com/r/investing/comments/le8ium/struggling_to_jump_the_first_hurdle_as_a_uk_trader/,2021-02-28 18:01,26,15,0.8
2qhhq,investing,le90rz,2021-02-06 22:53,A bullish case for Regeneron Pharmaceuticals (REGN),https://www.reddit.com/r/investing/comments/le90rz/a_bullish_case_for_regeneron_pharmaceuticals_regn/,2021-02-28 18:01,21,31,0.77
2qhhq,investing,lebev8,2021-02-07 00:53,Very confused about a stock,https://www.reddit.com/r/investing/comments/lebev8/very_confused_about_a_stock/,2021-02-28 18:01,40,22,0.72
2qhhq,investing,lebis8,2021-02-07 00:59,I am so bored of hearing your DD in some random stock,https://www.reddit.com/r/investing/comments/lebis8/i_am_so_bored_of_hearing_your_dd_in_some_random/,2021-02-28 18:01,29,0,0.23
2qhhq,investing,lebome,2021-02-07 01:07,KDOZ INC. $KDOZF The world’s fastest-growing content discovery and recommendation platform,https://www.reddit.com/r/investing/comments/lebome/kdoz_inc_kdozf_the_worlds_fastestgrowing_content/,2021-02-28 18:01,28,38,0.81
2qhhq,investing,lecak9,2021-02-07 01:39,"$TSM I am bullish on this long-term, but interested to hear some bear cases",https://www.reddit.com/r/investing/comments/lecak9/tsm_i_am_bullish_on_this_longterm_but_interested/,2021-02-28 18:01,83,43,0.87
2qhhq,investing,lecgvu,2021-02-07 01:48,Impact of 401K retirement plans on stock market,https://www.reddit.com/r/investing/comments/lecgvu/impact_of_401k_retirement_plans_on_stock_market/,2021-02-28 18:01,40,26,0.81
2qhhq,investing,lecsiz,2021-02-07 02:05,Why I'm confident LMND is going to be a 10-100x investment in the long term,https://www.reddit.com/r/investing/comments/lecsiz/why_im_confident_lmnd_is_going_to_be_a_10100x/,2021-02-28 18:01,42,4,0.53
2qhhq,investing,ledxnw,2021-02-07 03:08,Shorting Bonds/Long Commodities as a deficit hedge,https://www.reddit.com/r/investing/comments/ledxnw/shorting_bondslong_commodities_as_a_deficit_hedge/,2021-02-28 18:01,24,11,0.79
2qhhq,investing,lehaip,2021-02-07 06:41,Interest in 3d printed buildings construction,https://www.reddit.com/r/investing/comments/lehaip/interest_in_3d_printed_buildings_construction/,2021-02-28 18:01,45,43,0.84
2qhhq,investing,leju1l,2021-02-07 10:10,Gamestop Big Picture: The Bigger Picture,https://www.reddit.com/r/investing/comments/leju1l/gamestop_big_picture_the_bigger_picture/,2021-02-28 18:01,192,960,0.93
2qhhq,investing,lemjox,2021-02-07 13:35,Those interested in EV vehicles this one is a winner. TTM Over 10 billion $ in revenue last qtr. Yes Quarter. Owner of land rover and jaguar. They are just getting started with EV. Sold around 5K EV cars. Small portion of revenue but a huge focus area. TTM is like GM of India but part of a larger,https://www.reddit.com/r/investing/comments/lemjox/those_interested_in_ev_vehicles_this_one_is_a/,2021-02-28 18:01,44,0,0.23
2qhhq,investing,lemr72,2021-02-07 13:47,G1 Therapeutics (GTHX) - A layman’s explanation,https://www.reddit.com/r/investing/comments/lemr72/g1_therapeutics_gthx_a_laymans_explanation/,2021-02-28 18:01,78,114,0.92
2qhhq,investing,leo0ok,2021-02-07 15:00,For those who are buying company stocks to avoid ETF fees in ARK,https://www.reddit.com/r/investing/comments/leo0ok/for_those_who_are_buying_company_stocks_to_avoid/,2021-02-28 18:01,491,1335,0.91
2qhhq,investing,leqkpb,2021-02-07 17:10,Companies with low PE & high PB ratio,https://www.reddit.com/r/investing/comments/leqkpb/companies_with_low_pe_high_pb_ratio/,2021-02-28 18:01,37,72,0.89
2qhhq,investing,lesa8e,2021-02-07 18:32,"GOEV, and an Amateur's shot at Technical Analysis",https://www.reddit.com/r/investing/comments/lesa8e/goev_and_an_amateurs_shot_at_technical_analysis/,2021-02-28 18:01,58,112,0.87
2qhhq,investing,lethml,2021-02-07 19:28,Buffet Indicator and Trading Volume,https://www.reddit.com/r/investing/comments/lethml/buffet_indicator_and_trading_volume/,2021-02-28 18:01,116,128,0.93
2qhhq,investing,leurm4,2021-02-07 20:28,"Opinions on these Stocks: RYCEY, SNDL, CLNE",https://www.reddit.com/r/investing/comments/leurm4/opinions_on_these_stocks_rycey_sndl_clne/,2021-02-28 18:01,38,43,0.83
2qhhq,investing,leut3k,2021-02-07 20:30,Ocugen hype and valuation,https://www.reddit.com/r/investing/comments/leut3k/ocugen_hype_and_valuation/,2021-02-28 18:01,21,22,0.82
2qhhq,investing,lew9sg,2021-02-07 21:40,A Correction is a Matter of Time. Invest in Defensive and Dividend-Paying Companies,https://www.reddit.com/r/investing/comments/lew9sg/a_correction_is_a_matter_of_time_invest_in/,2021-02-28 18:01,66,3,0.53
2qhhq,investing,lexe9r,2021-02-07 22:32,How do you guys make decisions on when to exit a trade.,https://www.reddit.com/r/investing/comments/lexe9r/how_do_you_guys_make_decisions_on_when_to_exit_a/,2021-02-28 18:01,102,98,0.93
2qhhq,investing,lf02ot,2021-02-08 00:49,"Crude oil prices at highest level since pre-pandemic, BP in my opinion is the most oversold and undervalued play.",https://www.reddit.com/r/investing/comments/lf02ot/crude_oil_prices_at_highest_level_since/,2021-02-28 18:01,116,80,0.85
2qhhq,investing,lf0qz5,2021-02-08 01:25,Hyundai now says it’s not in talks with Apple to develop autonomous electric car,https://www.reddit.com/r/investing/comments/lf0qz5/hyundai_now_says_its_not_in_talks_with_apple_to/,2021-02-28 18:01,393,2332,0.98
2qhhq,investing,lf1b2q,2021-02-08 01:56,SUMO eats the market (DD),https://www.reddit.com/r/investing/comments/lf1b2q/sumo_eats_the_market_dd/,2021-02-28 18:01,117,943,0.87
2qhhq,investing,lf2q28,2021-02-08 03:19,Investing with Life Insurance,https://www.reddit.com/r/investing/comments/lf2q28/investing_with_life_insurance/,2021-02-28 18:01,33,5,0.62
2qhhq,investing,lf2v45,2021-02-08 03:26,Gold can continue its victorious march to $ 2.5-3 thousand per ounce in 2021-2022,https://www.reddit.com/r/investing/comments/lf2v45/gold_can_continue_its_victorious_march_to_253/,2021-02-28 18:01,55,15,0.69
2qhhq,investing,lf6vq1,2021-02-08 07:42,The bear case for KemPharm (KMPH),https://www.reddit.com/r/investing/comments/lf6vq1/the_bear_case_for_kempharm_kmph/,2021-02-28 18:01,78,31,0.86
2qhhq,investing,lfc0fa,2021-02-08 13:41,"Tired of hearing about all these meme stocks? I handpicked the most popular posts, tickers, and DD from the last week. Here are the results!",https://www.reddit.com/r/investing/comments/lfc0fa/tired_of_hearing_about_all_these_meme_stocks_i/,2021-02-28 18:01,53,384,0.95
2qhhq,investing,lfccpo,2021-02-08 14:00,Microstrategy CEO Michael Saylor and others are using their influence to spread lies about Bitcoin at the expense of other CEOs and retail buyers. The distinction between consensus based supply and truly fixed supply is where the fraud happens.,https://www.reddit.com/r/investing/comments/lfccpo/microstrategy_ceo_michael_saylor_and_others_are/,2021-02-28 18:01,22,0,0.34
2qhhq,investing,lfdxtn,2021-02-08 15:17,An excellent OPY-rtunity in a small cap finance company,https://www.reddit.com/r/investing/comments/lfdxtn/an_excellent_opyrtunity_in_a_small_cap_finance/,2021-02-28 18:01,26,70,0.95
2qhhq,investing,lfdzjx,2021-02-08 15:20,Best broker to transfer Roth IRA,https://www.reddit.com/r/investing/comments/lfdzjx/best_broker_to_transfer_roth_ira/,2021-02-28 18:01,21,10,0.86
2qhhq,investing,lfebxh,2021-02-08 15:36,COCA-COLA CO (KO) Seasonal Investing,https://www.reddit.com/r/investing/comments/lfebxh/cocacola_co_ko_seasonal_investing/,2021-02-28 18:01,23,63,0.87
2qhhq,investing,lfgvpd,2021-02-08 17:29,"SNPR, or Volt, is a new SPAC to be considered given the EV Battery Tech and what the SPAC has done previously",https://www.reddit.com/r/investing/comments/lfgvpd/snpr_or_volt_is_a_new_spac_to_be_considered_given/,2021-02-28 18:01,23,41,0.91
2qhhq,investing,lfh46w,2021-02-08 17:40,"$KMPH - KemPharm, Pharmaceutical Company",https://www.reddit.com/r/investing/comments/lfh46w/kmph_kempharm_pharmaceutical_company/,2021-02-28 18:01,23,25,0.85
2qhhq,investing,lfhey8,2021-02-08 17:53,Not sure what to do with my savings while I save for a house,https://www.reddit.com/r/investing/comments/lfhey8/not_sure_what_to_do_with_my_savings_while_i_save/,2021-02-28 18:01,161,108,0.94
2qhhq,investing,lfi3bw,2021-02-08 18:22,"After space exploration, Elon Musk goes after the next Big Bang",https://www.reddit.com/r/investing/comments/lfi3bw/after_space_exploration_elon_musk_goes_after_the/,2021-02-28 18:01,36,0,0.48
2qhhq,investing,lfi4a6,2021-02-08 18:23,Why I'm Bullish on AIM ImmunoTech Inc. ($AIM),https://www.reddit.com/r/investing/comments/lfi4a6/why_im_bullish_on_aim_immunotech_inc_aim/,2021-02-28 18:01,47,81,0.93
2qhhq,investing,lficg5,2021-02-08 18:33,CTRM-Castor Maritime decent potential for growth,https://www.reddit.com/r/investing/comments/lficg5/ctrmcastor_maritime_decent_potential_for_growth/,2021-02-28 18:01,20,45,0.93
2qhhq,investing,lfjmcg,2021-02-08 19:29,$RIOT looks appealing but be careful,https://www.reddit.com/r/investing/comments/lfjmcg/riot_looks_appealing_but_be_careful/,2021-02-28 18:01,73,88,0.91
2qhhq,investing,lfkprx,2021-02-08 20:16,"Objective speculation/ getting past ""the missed train""",https://www.reddit.com/r/investing/comments/lfkprx/objective_speculation_getting_past_the_missed/,2021-02-28 18:01,25,27,0.84
2qhhq,investing,lfks2d,2021-02-08 20:19,$ZOM Speculation Could Be Favorable,https://www.reddit.com/r/investing/comments/lfks2d/zom_speculation_could_be_favorable/,2021-02-28 18:01,23,50,0.9
2qhhq,investing,lfl4ba,2021-02-08 20:34,I have been investing in a fidelity mutual fund. Now I've been doing some research and I'm beginning to think I need to invest in etfs,https://www.reddit.com/r/investing/comments/lfl4ba/i_have_been_investing_in_a_fidelity_mutual_fund/,2021-02-28 18:01,23,14,0.78
2qhhq,investing,lflcd1,2021-02-08 20:44,LMND - Legit or a Future Failure,https://www.reddit.com/r/investing/comments/lflcd1/lmnd_legit_or_a_future_failure/,2021-02-28 18:01,20,5,0.7
2qhhq,investing,lflt0m,2021-02-08 21:04,Landos Biopharma - LABP - New IPO,https://www.reddit.com/r/investing/comments/lflt0m/landos_biopharma_labp_new_ipo/,2021-02-28 18:01,24,18,0.87
2qhhq,investing,lfmmmi,2021-02-08 21:40,"Creating Multigenerational Wealth The ""Easy Way"".",https://www.reddit.com/r/investing/comments/lfmmmi/creating_multigenerational_wealth_the_easy_way/,2021-02-28 18:01,40,0,0.35
2qhhq,investing,lfmqfs,2021-02-08 21:44,Potential stocks for long term/dividend play,https://www.reddit.com/r/investing/comments/lfmqfs/potential_stocks_for_long_termdividend_play/,2021-02-28 18:01,27,7,0.71
2qhhq,investing,lfn127,2021-02-08 21:58,Electronic Arts to buy Glu Mobile,https://www.reddit.com/r/investing/comments/lfn127/electronic_arts_to_buy_glu_mobile/,2021-02-28 18:01,48,24,0.77
2qhhq,investing,lfnixq,2021-02-08 22:20,SND - Highly Undervalued & Profitable,https://www.reddit.com/r/investing/comments/lfnixq/snd_highly_undervalued_profitable/,2021-02-28 18:01,38,21,0.67
2qhhq,investing,lfpegp,2021-02-08 23:50,My 401K has terrible investment options,https://www.reddit.com/r/investing/comments/lfpegp/my_401k_has_terrible_investment_options/,2021-02-28 18:01,32,9,0.75
2qhhq,investing,lfq8yv,2021-02-09 00:33,Investing lessons for my daughter,https://www.reddit.com/r/investing/comments/lfq8yv/investing_lessons_for_my_daughter/,2021-02-28 18:01,24,18,0.84
2qhhq,investing,lfred3,2021-02-09 01:33,Trying to invest in the Nasdaq via a mutual fund (not an ETF). Here's a breakdown of the ways to do this and how hard it is. Any input would be appreciated.,https://www.reddit.com/r/investing/comments/lfred3/trying_to_invest_in_the_nasdaq_via_a_mutual_fund/,2021-02-28 18:01,25,14,0.81
2qhhq,investing,lfrutn,2021-02-09 01:58,"Look at These today: ZOM, ADAG (IPO), GNW, and GNUS...",https://www.reddit.com/r/investing/comments/lfrutn/look_at_these_today_zom_adag_ipo_gnw_and_gnus/,2021-02-28 18:01,30,22,0.77
2qhhq,investing,lfrwbu,2021-02-09 02:00,21 Years Old - 35K to 126K EOY MISSION,https://www.reddit.com/r/investing/comments/lfrwbu/21_years_old_35k_to_126k_eoy_mission/,2021-02-28 18:01,143,0,0.47
2qhhq,investing,lftfuw,2021-02-09 03:24,$VXRT is a vaccine play that might be worth the risk,https://www.reddit.com/r/investing/comments/lftfuw/vxrt_is_a_vaccine_play_that_might_be_worth_the/,2021-02-28 18:01,34,67,0.89
2qhhq,investing,lfuq5m,2021-02-09 04:38,Keeping cash for buying opportunities during market downturns,https://www.reddit.com/r/investing/comments/lfuq5m/keeping_cash_for_buying_opportunities_during/,2021-02-28 18:01,218,229,0.95
2qhhq,investing,lfv01v,2021-02-09 04:55,Microsoft $MSFT stock looking bullish and may have a possible surprise announcement soon!,https://www.reddit.com/r/investing/comments/lfv01v/microsoft_msft_stock_looking_bullish_and_may_have/,2021-02-28 18:01,139,113,0.64
2qhhq,investing,lfygo8,2021-02-09 08:58,Here's why I think $CRSR does not already have the earnings surprise priced in,https://www.reddit.com/r/investing/comments/lfygo8/heres_why_i_think_crsr_does_not_already_have_the/,2021-02-28 18:01,63,72,0.84
2qhhq,investing,lg297f,2021-02-09 12:23,Second Quarter Results: 6 months into the /r/investing underrated stock survey and the average return was 72% (37% as a portfolio),https://www.reddit.com/r/investing/comments/lg297f/second_quarter_results_6_months_into_the/,2021-02-28 18:01,307,719,0.97
2qhhq,investing,lg3iqq,2021-02-09 13:39,Tesla’s made more money in FCF rather than OCF?,https://www.reddit.com/r/investing/comments/lg3iqq/teslas_made_more_money_in_fcf_rather_than_ocf/,2021-02-28 18:01,24,8,0.69
2qhhq,investing,lg82wa,2021-02-09 17:13,After spending the weekend looking at marijuana stocks I've picked my top dog: Cresco Labs CRLBF,https://www.reddit.com/r/investing/comments/lg82wa/after_spending_the_weekend_looking_at_marijuana/,2021-02-28 18:01,1081,3365,0.95
2qhhq,investing,lga697,2021-02-09 18:42,"PRNT, 3D Printing Could Be The Best Industry To Invest In For The Decade",https://www.reddit.com/r/investing/comments/lga697/prnt_3d_printing_could_be_the_best_industry_to/,2021-02-28 18:01,92,57,0.85
2qhhq,investing,lgae53,2021-02-09 18:52,$APHA to $TLRY Conversion,https://www.reddit.com/r/investing/comments/lgae53/apha_to_tlry_conversion/,2021-02-28 18:01,152,199,0.91
2qhhq,investing,lgb3z3,2021-02-09 19:22,Instead of investing in EV companies... Investing in commodities needed to produce EV,https://www.reddit.com/r/investing/comments/lgb3z3/instead_of_investing_in_ev_companies_investing_in/,2021-02-28 18:01,124,193,0.94
2qhhq,investing,lgbz3u,2021-02-09 19:59,I believe we are in a bubble [I need to vent...],https://www.reddit.com/r/investing/comments/lgbz3u/i_believe_we_are_in_a_bubble_i_need_to_vent/,2021-02-28 18:01,561,262,0.81
2qhhq,investing,lgc3k9,2021-02-09 20:04,Sell or Hold Cannabis Stocks,https://www.reddit.com/r/investing/comments/lgc3k9/sell_or_hold_cannabis_stocks/,2021-02-28 18:01,111,57,0.82
2qhhq,investing,lgeo3w,2021-02-09 22:01,"Artificial intelligence meets agriculture, IPO",https://www.reddit.com/r/investing/comments/lgeo3w/artificial_intelligence_meets_agriculture_ipo/,2021-02-28 18:01,44,89,0.95
2qhhq,investing,lgh9gz,2021-02-10 00:08,Riot blockchain / Bitcoin,https://www.reddit.com/r/investing/comments/lgh9gz/riot_blockchain_bitcoin/,2021-02-28 18:01,23,4,0.55
2qhhq,investing,lghb3w,2021-02-10 00:10,I watch Motley Fools new program offering video today,https://www.reddit.com/r/investing/comments/lghb3w/i_watch_motley_fools_new_program_offering_video/,2021-02-28 18:01,328,399,0.93
2qhhq,investing,lghe8k,2021-02-10 00:15,Long Term Investment Thoughts,https://www.reddit.com/r/investing/comments/lghe8k/long_term_investment_thoughts/,2021-02-28 18:01,34,13,0.7
2qhhq,investing,lghmvv,2021-02-10 00:28,Consider A Globally-Diversified Leveraged Portfolio,https://www.reddit.com/r/investing/comments/lghmvv/consider_a_globallydiversified_leveraged_portfolio/,2021-02-28 18:01,32,18,0.86
2qhhq,investing,lgicp9,2021-02-10 01:06,Debate between Husband and Wife on Investment strategy and philosophy.,https://www.reddit.com/r/investing/comments/lgicp9/debate_between_husband_and_wife_on_investment/,2021-02-28 18:01,41,0,0.44
2qhhq,investing,lgidy7,2021-02-10 01:08,Bumble set for IPO at $38-$40; projected to start trading Thursday,https://www.reddit.com/r/investing/comments/lgidy7/bumble_set_for_ipo_at_3840_projected_to_start/,2021-02-28 18:01,108,42,0.72
2qhhq,investing,lgl1r4,2021-02-10 03:38,Selling Puts to Generate Yield in this Bubbly Market. Talk me out of it!,https://www.reddit.com/r/investing/comments/lgl1r4/selling_puts_to_generate_yield_in_this_bubbly/,2021-02-28 18:01,62,37,0.91
2qhhq,investing,lglskh,2021-02-10 04:22,Collection of Finviz screeners,https://www.reddit.com/r/investing/comments/lglskh/collection_of_finviz_screeners/,2021-02-28 18:01,210,2772,0.99
2qhhq,investing,lgme6f,2021-02-10 05:01,"Out of all the ""bubbles"" that are forming right now, which ones would you buy the most if it popped> (EV, marijuana, fintech, crypto, etc...)",https://www.reddit.com/r/investing/comments/lgme6f/out_of_all_the_bubbles_that_are_forming_right_now/,2021-02-28 18:01,405,205,0.91
2qhhq,investing,lgmr8x,2021-02-10 05:23,Corsair Gaming Reports Fourth Quarter and Full Year 2020 Financial Results,https://www.reddit.com/r/investing/comments/lgmr8x/corsair_gaming_reports_fourth_quarter_and_full/,2021-02-28 18:01,26,57,0.88
2qhhq,investing,lgqjga,2021-02-10 10:00,Why I believe $OPRA is overseen by investors,https://www.reddit.com/r/investing/comments/lgqjga/why_i_believe_opra_is_overseen_by_investors/,2021-02-28 18:01,31,13,0.62
2qhhq,investing,lgu4bx,2021-02-10 13:56,"Nasdaq, NYSE Sue SEC over planned overhaul of public data feeds",https://www.reddit.com/r/investing/comments/lgu4bx/nasdaq_nyse_sue_sec_over_planned_overhaul_of/,2021-02-28 18:01,330,4175,0.99
2qhhq,investing,lgv4u5,2021-02-10 14:47,AMZN emerging businesses potential vs retail/AWS,https://www.reddit.com/r/investing/comments/lgv4u5/amzn_emerging_businesses_potential_vs_retailaws/,2021-02-28 18:01,27,31,0.92
2qhhq,investing,lgwl98,2021-02-10 15:54,DD research advice for newcomers,https://www.reddit.com/r/investing/comments/lgwl98/dd_research_advice_for_newcomers/,2021-02-28 18:01,36,109,0.95
2qhhq,investing,lgy36z,2021-02-10 17:01,How Do You Prepare to Buy a Dip,https://www.reddit.com/r/investing/comments/lgy36z/how_do_you_prepare_to_buy_a_dip/,2021-02-28 18:01,82,46,0.89
