Subreddit_ID,Subreddit_Name,Submission_ID,Submission_CreatedDate,Submission_Title,Submission_URL,Submission_LastFetched,Submission_NumComments,Submission_Score,Submission_UpvoteRatio
2qjfk,stocks,k1g6fy,2020-11-26 14:32,Can someone explain to me what’s happening to PLTR???,https://www.reddit.com/r/stocks/comments/k1g6fy/can_someone_explain_to_me_whats_happening_to_pltr/,2020-12-05 15:01,51,0,0.5
2qjfk,stocks,k1gaop,2020-11-26 14:39,Tesla has surged past $525 billion in market value and could soon overtake Warren Buffett's Berkshire Hathaway. Here's why that's astounding,https://www.reddit.com/r/stocks/comments/k1gaop/tesla_has_surged_past_525_billion_in_market_value/,2020-12-05 15:01,910,5090,0.94
2qjfk,stocks,k1gcve,2020-11-26 14:43,"A case for Oil, a forgotten stock option?",https://www.reddit.com/r/stocks/comments/k1gcve/a_case_for_oil_a_forgotten_stock_option/,2020-12-05 15:01,74,35,0.85
2qjfk,stocks,k1inus,2020-11-26 16:52,Why did zoom stock have all that relevance?,https://www.reddit.com/r/stocks/comments/k1inus/why_did_zoom_stock_have_all_that_relevance/,2020-12-05 15:01,22,2,0.56
2qjfk,stocks,k1iowv,2020-11-26 16:53,“Safe” stocks to balance a growth portfolio,https://www.reddit.com/r/stocks/comments/k1iowv/safe_stocks_to_balance_a_growth_portfolio/,2020-12-05 15:01,42,14,0.86
2qjfk,stocks,k1irut,2020-11-26 16:58,Stocks to Avoid,https://www.reddit.com/r/stocks/comments/k1irut/stocks_to_avoid/,2020-12-05 15:01,33,2,0.6
2qjfk,stocks,k1iuxy,2020-11-26 17:02,The line between FOMO and being rational?,https://www.reddit.com/r/stocks/comments/k1iuxy/the_line_between_fomo_and_being_rational/,2020-12-05 15:01,50,12,0.81
2qjfk,stocks,k1jbz2,2020-11-26 17:25,Harry Dent: Stocks to crash 40% by April and won't rebound for decades... who calls BS?,https://www.reddit.com/r/stocks/comments/k1jbz2/harry_dent_stocks_to_crash_40_by_april_and_wont/,2020-12-05 15:01,106,54,0.81
2qjfk,stocks,k1jdif,2020-11-26 17:27,Opinion: Tesla joining the S&P 500 is so that large institutional investors can cash out while leaving the bag with the American public in their 401ks.,https://www.reddit.com/r/stocks/comments/k1jdif/opinion_tesla_joining_the_sp_500_is_so_that_large/,2020-12-05 15:01,24,9,0.67
2qjfk,stocks,k1lc40,2020-11-26 19:09,Does AAL seem promising ?,https://www.reddit.com/r/stocks/comments/k1lc40/does_aal_seem_promising/,2020-12-05 15:01,22,1,0.99
2qjfk,stocks,k1mc3a,2020-11-26 20:05,ENPH,https://www.reddit.com/r/stocks/comments/k1mc3a/enph/,2020-12-05 15:01,38,6,0.72
2qjfk,stocks,k1oque,2020-11-26 22:23,Stocks you’d gift your girlfriend/wife,https://www.reddit.com/r/stocks/comments/k1oque/stocks_youd_gift_your_girlfriendwife/,2020-12-05 15:01,42,3,0.72
2qjfk,stocks,k1p6i5,2020-11-26 22:48,PLTR hype,https://www.reddit.com/r/stocks/comments/k1p6i5/pltr_hype/,2020-12-05 15:01,126,139,0.95
2qjfk,stocks,k1p9ci,2020-11-26 22:53,What exactly TESLA being added to SP500 means,https://www.reddit.com/r/stocks/comments/k1p9ci/what_exactly_tesla_being_added_to_sp500_means/,2020-12-05 15:01,22,28,0.9
2qjfk,stocks,k1pbij,2020-11-26 22:56,Is over diversification bad? Are less stocks more profitable? Starting a new portfolio,https://www.reddit.com/r/stocks/comments/k1pbij/is_over_diversification_bad_are_less_stocks_more/,2020-12-05 15:01,20,5,0.78
2qjfk,stocks,k1qfl5,2020-11-27 00:04,Please help!!,https://www.reddit.com/r/stocks/comments/k1qfl5/please_help/,2020-12-05 15:01,24,1,0.57
2qjfk,stocks,k1qpgc,2020-11-27 00:21,ARM VS INTEL which stock to buy?,https://www.reddit.com/r/stocks/comments/k1qpgc/arm_vs_intel_which_stock_to_buy/,2020-12-05 15:01,42,14,0.77
2qjfk,stocks,k1qsti,2020-11-27 00:27,Trying to learn about calls and puts. Any links you can recommend for the ELI5 or layman’s terms explanation of calls?,https://www.reddit.com/r/stocks/comments/k1qsti/trying_to_learn_about_calls_and_puts_any_links/,2020-12-05 15:01,21,32,0.89
2qjfk,stocks,k1rkmq,2020-11-27 01:17,BlackRock Inc. Invests $278.34 Million more in Palantir Technologies Inc. (NYSE:PLTR),https://www.reddit.com/r/stocks/comments/k1rkmq/blackrock_inc_invests_27834_million_more_in/,2020-12-05 15:01,56,227,0.94
2qjfk,stocks,k1s3ua,2020-11-27 01:54,What Short Term Stocks Are on the Radar?,https://www.reddit.com/r/stocks/comments/k1s3ua/what_short_term_stocks_are_on_the_radar/,2020-12-05 15:01,22,2,0.6
2qjfk,stocks,k1wwbb,2020-11-27 07:47,XPEV price target from CNN money,https://www.reddit.com/r/stocks/comments/k1wwbb/xpev_price_target_from_cnn_money/,2020-12-05 15:01,29,10,0.68
2qjfk,stocks,k1x5mf,2020-11-27 08:07,"r/Stocks Daily Discussion & Fundamentals Friday Nov 27, 2020",https://www.reddit.com/r/stocks/comments/k1x5mf/rstocks_daily_discussion_fundamentals_friday_nov/,2020-12-05 15:01,729,35,0.93
2qjfk,stocks,k1y5xc,2020-11-27 09:34,When does Vanguard / Blackrock/ETFs HAVE to have TESLA stocks by?,https://www.reddit.com/r/stocks/comments/k1y5xc/when_does_vanguard_blackrocketfs_have_to_have/,2020-12-05 15:01,20,2,0.63
2qjfk,stocks,k1zm45,2020-11-27 11:36,Best trading platform,https://www.reddit.com/r/stocks/comments/k1zm45/best_trading_platform/,2020-12-05 15:01,27,13,0.82
2qjfk,stocks,k20xcz,2020-11-27 13:17,Ben Graham laid it out,https://www.reddit.com/r/stocks/comments/k20xcz/ben_graham_laid_it_out/,2020-12-05 15:01,30,22,0.78
2qjfk,stocks,k21qbk,2020-11-27 14:09,Newer investors: Be careful about chasing hype. Come up with a plan.,https://www.reddit.com/r/stocks/comments/k21qbk/newer_investors_be_careful_about_chasing_hype/,2020-12-05 15:01,404,1312,0.92
2qjfk,stocks,k2221v,2020-11-27 14:28,"TSLA, the most valuable car company in the world due to its Reddit meme stock pump success, is recalling Model X & Model Y SUV's on safety concerns (steering control can fall apart)",https://www.reddit.com/r/stocks/comments/k2221v/tsla_the_most_valuable_car_company_in_the_world/,2020-12-05 15:01,27,0,0.5
2qjfk,stocks,k22fh7,2020-11-27 14:49,Should I exercise my option?,https://www.reddit.com/r/stocks/comments/k22fh7/should_i_exercise_my_option/,2020-12-05 15:01,22,10,0.92
2qjfk,stocks,k22vha,2020-11-27 15:13,Tesla flips Berkshire Hathaway by market cap,https://www.reddit.com/r/stocks/comments/k22vha/tesla_flips_berkshire_hathaway_by_market_cap/,2020-12-05 15:01,191,234,0.97
2qjfk,stocks,k22y2i,2020-11-27 15:17,How do you cope with mistakes?,https://www.reddit.com/r/stocks/comments/k22y2i/how_do_you_cope_with_mistakes/,2020-12-05 15:01,27,6,0.8
2qjfk,stocks,k238e5,2020-11-27 15:32,Investing in NIO?,https://www.reddit.com/r/stocks/comments/k238e5/investing_in_nio/,2020-12-05 15:01,38,5,0.7
2qjfk,stocks,k238j8,2020-11-27 15:33,CRSR tanking guess I’m holding for a while,https://www.reddit.com/r/stocks/comments/k238j8/crsr_tanking_guess_im_holding_for_a_while/,2020-12-05 15:01,46,16,0.95
2qjfk,stocks,k23fb6,2020-11-27 15:43,Any stories of how you sold too early?,https://www.reddit.com/r/stocks/comments/k23fb6/any_stories_of_how_you_sold_too_early/,2020-12-05 15:01,111,26,0.95
2qjfk,stocks,k23kly,2020-11-27 15:50,"You all are obsessed with $PLTR lockup, but do you know $ZI lockup will end on Monday?",https://www.reddit.com/r/stocks/comments/k23kly/you_all_are_obsessed_with_pltr_lockup_but_do_you/,2020-12-05 15:01,98,224,0.94
2qjfk,stocks,k23w44,2020-11-27 16:07,I’m treading carefully,https://www.reddit.com/r/stocks/comments/k23w44/im_treading_carefully/,2020-12-05 15:01,47,21,0.83
2qjfk,stocks,k23ywe,2020-11-27 16:11,QuantumScape (QS) is it a buy?,https://www.reddit.com/r/stocks/comments/k23ywe/quantumscape_qs_is_it_a_buy/,2020-12-05 15:01,45,28,0.88
2qjfk,stocks,k23z2c,2020-11-27 16:11,One of Square's ($SQ) best perk no one is talking about: their cash-app card,https://www.reddit.com/r/stocks/comments/k23z2c/one_of_squares_sq_best_perk_no_one_is_talking/,2020-12-05 15:01,23,47,0.92
2qjfk,stocks,k24h23,2020-11-27 16:37,Long term Clean Energy stock recommendations?,https://www.reddit.com/r/stocks/comments/k24h23/long_term_clean_energy_stock_recommendations/,2020-12-05 15:01,28,7,0.78
2qjfk,stocks,k24iiv,2020-11-27 16:39,Citron shorting Palantir,https://www.reddit.com/r/stocks/comments/k24iiv/citron_shorting_palantir/,2020-12-05 15:01,442,839,0.86
2qjfk,stocks,k24v55,2020-11-27 16:58,New Meme Stocks: MGNI and QS,https://www.reddit.com/r/stocks/comments/k24v55/new_meme_stocks_mgni_and_qs/,2020-12-05 15:01,77,96,0.88
2qjfk,stocks,k26e79,2020-11-27 18:14,Is that all for Palantir?,https://www.reddit.com/r/stocks/comments/k26e79/is_that_all_for_palantir/,2020-12-05 15:01,35,9,0.64
2qjfk,stocks,k26uxv,2020-11-27 18:37,ABNB IPO predictions?,https://www.reddit.com/r/stocks/comments/k26uxv/abnb_ipo_predictions/,2020-12-05 15:01,20,12,0.88
2qjfk,stocks,k280u3,2020-11-27 19:37,Apple due for a run?,https://www.reddit.com/r/stocks/comments/k280u3/apple_due_for_a_run/,2020-12-05 15:01,25,17,0.75
2qjfk,stocks,k286yz,2020-11-27 19:46,Roblox IPO: 5 things to know about the tween-centric gaming platform,https://www.reddit.com/r/stocks/comments/k286yz/roblox_ipo_5_things_to_know_about_the/,2020-12-05 15:01,58,78,0.89
2qjfk,stocks,k28nfp,2020-11-27 20:10,reddit hype,https://www.reddit.com/r/stocks/comments/k28nfp/reddit_hype/,2020-12-05 15:01,30,13,0.93
2qjfk,stocks,k28thf,2020-11-27 20:18,Should I buy CRSR (Corsair gaming),https://www.reddit.com/r/stocks/comments/k28thf/should_i_buy_crsr_corsair_gaming/,2020-12-05 15:01,23,15,0.89
2qjfk,stocks,k28vx8,2020-11-27 20:22,What do do with apple?,https://www.reddit.com/r/stocks/comments/k28vx8/what_do_do_with_apple/,2020-12-05 15:01,35,4,0.67
2qjfk,stocks,k28xia,2020-11-27 20:24,Traders beware scam on r/stocks Aaron Maxwell,https://www.reddit.com/r/stocks/comments/k28xia/traders_beware_scam_on_rstocks_aaron_maxwell/,2020-12-05 15:01,140,1409,0.98
2qjfk,stocks,k29ij1,2020-11-27 20:57,Help investigate Citron,https://www.reddit.com/r/stocks/comments/k29ij1/help_investigate_citron/,2020-12-05 15:01,42,7,0.53
2qjfk,stocks,k29lwb,2020-11-27 21:02,How to deal with FOMO and lack of funds,https://www.reddit.com/r/stocks/comments/k29lwb/how_to_deal_with_fomo_and_lack_of_funds/,2020-12-05 15:01,20,2,0.67
2qjfk,stocks,k2afox,2020-11-27 21:48,Can someone explain to me the hype around CloudFlare (NET)?,https://www.reddit.com/r/stocks/comments/k2afox/can_someone_explain_to_me_the_hype_around/,2020-12-05 15:01,35,33,0.81
2qjfk,stocks,k2ajp4,2020-11-27 21:55,How to trade with small sums of cash?,https://www.reddit.com/r/stocks/comments/k2ajp4/how_to_trade_with_small_sums_of_cash/,2020-12-05 15:01,32,9,0.81
2qjfk,stocks,k2becv,2020-11-27 22:44,Joe Biden's administration could end up developing major passenger rail infrastructure. Which companies should we anticipate to benefit from such policy?,https://www.reddit.com/r/stocks/comments/k2becv/joe_bidens_administration_could_end_up_developing/,2020-12-05 15:01,21,4,0.63
2qjfk,stocks,k2blkg,2020-11-27 22:55,Do I buy more PLTR,https://www.reddit.com/r/stocks/comments/k2blkg/do_i_buy_more_pltr/,2020-12-05 15:01,37,10,0.61
2qjfk,stocks,k2dh1x,2020-11-28 00:45,Starting Cannabis ETF position,https://www.reddit.com/r/stocks/comments/k2dh1x/starting_cannabis_etf_position/,2020-12-05 15:01,23,6,0.87
2qjfk,stocks,k2eqzw,2020-11-28 02:03,Why Virgin Galactic SPCE recent rise is only the beginning,https://www.reddit.com/r/stocks/comments/k2eqzw/why_virgin_galactic_spce_recent_rise_is_only_the/,2020-12-05 15:01,74,34,0.8
2qjfk,stocks,k2fodt,2020-11-28 02:57,Curve Ball: Name BORING stocks,https://www.reddit.com/r/stocks/comments/k2fodt/curve_ball_name_boring_stocks/,2020-12-05 15:01,120,48,0.95
2qjfk,stocks,k2gx5e,2020-11-28 04:14,What will happen when TSLA joins the S&P?,https://www.reddit.com/r/stocks/comments/k2gx5e/what_will_happen_when_tsla_joins_the_sp/,2020-12-05 15:01,89,33,0.84
2qjfk,stocks,k2imgk,2020-11-28 06:11,Would you rather hold equity or make options plays?,https://www.reddit.com/r/stocks/comments/k2imgk/would_you_rather_hold_equity_or_make_options_plays/,2020-12-05 15:01,24,2,0.75
2qjfk,stocks,k2l41a,2020-11-28 09:52,Palantir explained,https://www.reddit.com/r/stocks/comments/k2l41a/palantir_explained/,2020-12-05 15:01,267,788,0.94
2qjfk,stocks,k2luwc,2020-11-28 11:02,$NNOX disruptive technology,https://www.reddit.com/r/stocks/comments/k2luwc/nnox_disruptive_technology/,2020-12-05 15:01,45,6,0.64
2qjfk,stocks,k2mij3,2020-11-28 11:59,House of Representatives to Vote on Delisting Chinese Stocks Over Audit Concerns,https://www.reddit.com/r/stocks/comments/k2mij3/house_of_representatives_to_vote_on_delisting/,2020-12-05 15:01,91,217,0.95
2qjfk,stocks,k2np8x,2020-11-28 13:32,Additional DD on Tattooed Chef,https://www.reddit.com/r/stocks/comments/k2np8x/additional_dd_on_tattooed_chef/,2020-12-05 15:01,25,61,0.86
2qjfk,stocks,k2o7ti,2020-11-28 14:07,Looking at copper stocks that have potential... But need help!,https://www.reddit.com/r/stocks/comments/k2o7ti/looking_at_copper_stocks_that_have_potential_but/,2020-12-05 15:01,21,4,0.76
2qjfk,stocks,k2pigi,2020-11-28 15:29,"Wall Street Week Ahead for the trading week beginning November 30th, 2020",https://www.reddit.com/r/stocks/comments/k2pigi/wall_street_week_ahead_for_the_trading_week/,2020-12-05 15:01,138,1096,0.98
2qjfk,stocks,k2tvj9,2020-11-28 19:27,I am thinking about starting to do Option Trading.. How many people are successful in doing this?,https://www.reddit.com/r/stocks/comments/k2tvj9/i_am_thinking_about_starting_to_do_option_trading/,2020-12-05 15:01,25,0,0.33
2qjfk,stocks,k2u4g7,2020-11-28 19:40,Crystal Ball: Young Investor Looking For New PLTR and NIO,https://www.reddit.com/r/stocks/comments/k2u4g7/crystal_ball_young_investor_looking_for_new_pltr/,2020-12-05 15:01,62,11,0.63
2qjfk,stocks,k2umpo,2020-11-28 20:08,Best process to minimize capital gains taxes?,https://www.reddit.com/r/stocks/comments/k2umpo/best_process_to_minimize_capital_gains_taxes/,2020-12-05 15:01,40,40,0.89
2qjfk,stocks,k2ux2f,2020-11-28 20:24,Which Travel Related Stocks Would You Recommend Buying?,https://www.reddit.com/r/stocks/comments/k2ux2f/which_travel_related_stocks_would_you_recommend/,2020-12-05 15:01,20,0,0.5
2qjfk,stocks,k2vp51,2020-11-28 21:07,Is the TSLA bubble going to burst?,https://www.reddit.com/r/stocks/comments/k2vp51/is_the_tsla_bubble_going_to_burst/,2020-12-05 15:01,43,3,0.56
2qjfk,stocks,k2w14r,2020-11-28 21:25,Preparing for Tesla's inclusion into the S&P 500,https://www.reddit.com/r/stocks/comments/k2w14r/preparing_for_teslas_inclusion_into_the_sp_500/,2020-12-05 15:01,130,505,0.96
2qjfk,stocks,k2wgax,2020-11-28 21:49,XPEV - First cars delivered to Norwegian customers 14th December. Sales ahead of NIO in China.,https://www.reddit.com/r/stocks/comments/k2wgax/xpev_first_cars_delivered_to_norwegian_customers/,2020-12-05 15:01,29,57,0.87
2qjfk,stocks,k2wtmi,2020-11-28 22:10,"For those of you bullish on TSLA, are you worried about Volkswagen, GM, Hyundai going all-in on EVs in 2021?",https://www.reddit.com/r/stocks/comments/k2wtmi/for_those_of_you_bullish_on_tsla_are_you_worried/,2020-12-05 15:01,254,27,0.75
2qjfk,stocks,k2xv25,2020-11-28 23:09,$100k....What 5-7 stocks or more do you recommend today for a fresh start. Medium risk and mostly hands off daily approach. Fine with making adjustments but I can't have trading take over my daily life 😂. Do I invest this week or dip my toes in slowly given how everything went up this month. Thanks,https://www.reddit.com/r/stocks/comments/k2xv25/100kwhat_57_stocks_or_more_do_you_recommend_today/,2020-12-05 15:01,89,16,0.7
2qjfk,stocks,k2xxcx,2020-11-28 23:13,"Tesla.... So, this thing is going to dip soon so I can get in, right?.....right?......Please?",https://www.reddit.com/r/stocks/comments/k2xxcx/tesla_so_this_thing_is_going_to_dip_soon_so_i_can/,2020-12-05 15:01,25,0,0.5
2qjfk,stocks,k2yyef,2020-11-29 00:13,"What does it mean for BABA, JD and PDD holders?",https://www.reddit.com/r/stocks/comments/k2yyef/what_does_it_mean_for_baba_jd_and_pdd_holders/,2020-12-05 15:01,21,15,0.74
2qjfk,stocks,k2zdd7,2020-11-29 00:38,The top 15 most mentioned stocks of 2020 on Reddit.,https://www.reddit.com/r/stocks/comments/k2zdd7/the_top_15_most_mentioned_stocks_of_2020_on_reddit/,2020-12-05 15:01,36,32,0.65
2qjfk,stocks,k2zkwc,2020-11-29 00:49,What was it like being a Tesla stock investor in the early years (2010-2014)?,https://www.reddit.com/r/stocks/comments/k2zkwc/what_was_it_like_being_a_tesla_stock_investor_in/,2020-12-05 15:01,21,7,0.66
2qjfk,stocks,k301nx,2020-11-29 01:17,Safe short term money storage.,https://www.reddit.com/r/stocks/comments/k301nx/safe_short_term_money_storage/,2020-12-05 15:01,35,1,0.57
2qjfk,stocks,k3058a,2020-11-29 01:23,Just turned 23 and have FOMO about not investing in the market sooner. Please make me feel better?,https://www.reddit.com/r/stocks/comments/k3058a/just_turned_23_and_have_fomo_about_not_investing/,2020-12-05 15:01,24,0,0.29
2qjfk,stocks,k30xee,2020-11-29 02:11,High-Growth Stocks or Dividend Stocks?,https://www.reddit.com/r/stocks/comments/k30xee/highgrowth_stocks_or_dividend_stocks/,2020-12-05 15:01,31,9,0.75
2qjfk,stocks,k31a57,2020-11-29 02:33,Do I have to own any shares in order to sell to close??,https://www.reddit.com/r/stocks/comments/k31a57/do_i_have_to_own_any_shares_in_order_to_sell_to/,2020-12-05 15:01,28,0,0.5
2qjfk,stocks,k320zl,2020-11-29 03:23,"Can a cataclysmic event wipe out your principal, even with stop orders?",https://www.reddit.com/r/stocks/comments/k320zl/can_a_cataclysmic_event_wipe_out_your_principal/,2020-12-05 15:01,32,2,0.58
2qjfk,stocks,k32f9t,2020-11-29 03:49,What do people use to get their stock news most efficiently?,https://www.reddit.com/r/stocks/comments/k32f9t/what_do_people_use_to_get_their_stock_news_most/,2020-12-05 15:01,55,52,0.9
2qjfk,stocks,k32k9v,2020-11-29 03:58,Best stocks to invest for setting it and leaving,https://www.reddit.com/r/stocks/comments/k32k9v/best_stocks_to_invest_for_setting_it_and_leaving/,2020-12-05 15:01,33,1,0.67
2qjfk,stocks,k336ld,2020-11-29 04:41,Any stocks that you guys believe are at a good price point to get into this coming monday?,https://www.reddit.com/r/stocks/comments/k336ld/any_stocks_that_you_guys_believe_are_at_a_good/,2020-12-05 15:01,65,8,0.63
2qjfk,stocks,k33njt,2020-11-29 05:14,Will there be any sort of delayed rebound effect from the pandemic at all?,https://www.reddit.com/r/stocks/comments/k33njt/will_there_be_any_sort_of_delayed_rebound_effect/,2020-12-05 15:01,22,8,0.69
2qjfk,stocks,k37kel,2020-11-29 10:55,Why SHOULDN'T I buy PLTR stock??,https://www.reddit.com/r/stocks/comments/k37kel/why_shouldnt_i_buy_pltr_stock/,2020-12-05 15:01,233,134,0.88
2qjfk,stocks,k38gjh,2020-11-29 12:15,Could you please explain the GME situation ?,https://www.reddit.com/r/stocks/comments/k38gjh/could_you_please_explain_the_gme_situation/,2020-12-05 15:01,51,46,0.9
2qjfk,stocks,k38gs3,2020-11-29 12:16,The ACTUAL 15 most mentioned stocks on reddit,https://www.reddit.com/r/stocks/comments/k38gs3/the_actual_15_most_mentioned_stocks_on_reddit/,2020-12-05 15:01,434,1761,0.97
2qjfk,stocks,k38qi7,2020-11-29 12:39,3k to invest in stocks. Ideas? Help please,https://www.reddit.com/r/stocks/comments/k38qi7/3k_to_invest_in_stocks_ideas_help_please/,2020-12-05 15:01,41,2,0.56
2qjfk,stocks,k3921q,2020-11-29 13:04,Stock market high,https://www.reddit.com/r/stocks/comments/k3921q/stock_market_high/,2020-12-05 15:01,26,0,0.5
2qjfk,stocks,k3bg2h,2020-11-29 15:44,The ultimatum with meme stocks,https://www.reddit.com/r/stocks/comments/k3bg2h/the_ultimatum_with_meme_stocks/,2020-12-05 15:01,69,29,0.77
2qjfk,stocks,k3c2nq,2020-11-29 16:20,Growth stocks?,https://www.reddit.com/r/stocks/comments/k3c2nq/growth_stocks/,2020-12-05 15:01,32,5,0.86
2qjfk,stocks,k3cjzb,2020-11-29 16:47,Does anything matter anymore?,https://www.reddit.com/r/stocks/comments/k3cjzb/does_anything_matter_anymore/,2020-12-05 15:01,260,227,0.91
2qjfk,stocks,k3d2gz,2020-11-29 17:15,bad time to get into stocks?,https://www.reddit.com/r/stocks/comments/k3d2gz/bad_time_to_get_into_stocks/,2020-12-05 15:01,20,2,0.57
2qjfk,stocks,k3d7c9,2020-11-29 17:22,How do you find stocks with building momentum?,https://www.reddit.com/r/stocks/comments/k3d7c9/how_do_you_find_stocks_with_building_momentum/,2020-12-05 15:01,20,4,0.6
2qjfk,stocks,k3dc5r,2020-11-29 17:29,China's 2021 new energy vehicle subsidies soar 234% to RMB 37.58 billion ($5 Billion)year on year,https://www.reddit.com/r/stocks/comments/k3dc5r/chinas_2021_new_energy_vehicle_subsidies_soar_234/,2020-12-05 15:01,27,86,0.95
2qjfk,stocks,k3gcfj,2020-11-29 20:12,Creating dividend by selling shares?,https://www.reddit.com/r/stocks/comments/k3gcfj/creating_dividend_by_selling_shares/,2020-12-05 15:01,34,3,0.64
2qjfk,stocks,k3ghzm,2020-11-29 20:21,is anyone else kinda startled that their portfolio is doing so well in such a short amount of time?,https://www.reddit.com/r/stocks/comments/k3ghzm/is_anyone_else_kinda_startled_that_their/,2020-12-05 15:01,165,247,0.92
2qjfk,stocks,k3gqjx,2020-11-29 20:35,"It’s almost been 12 months since i first started investing and my rate of return is 27%, how am I doing?",https://www.reddit.com/r/stocks/comments/k3gqjx/its_almost_been_12_months_since_i_first_started/,2020-12-05 15:01,37,0,0.47
2qjfk,stocks,k3h7va,2020-11-29 21:00,Why and how is NIO still considered a buy?,https://www.reddit.com/r/stocks/comments/k3h7va/why_and_how_is_nio_still_considered_a_buy/,2020-12-05 15:01,31,6,0.64
2qjfk,stocks,k3hndq,2020-11-29 21:23,401K plan is total crap,https://www.reddit.com/r/stocks/comments/k3hndq/401k_plan_is_total_crap/,2020-12-05 15:01,36,0,0.29
2qjfk,stocks,k3hnm7,2020-11-29 21:24,Is it legal for me (15 years old) to control my dad’s stock account?,https://www.reddit.com/r/stocks/comments/k3hnm7/is_it_legal_for_me_15_years_old_to_control_my/,2020-12-05 15:01,33,9,0.59
2qjfk,stocks,k3hz3u,2020-11-29 21:41,Recent news regarding PALANTIR:,https://www.reddit.com/r/stocks/comments/k3hz3u/recent_news_regarding_palantir/,2020-12-05 15:01,286,538,0.92
2qjfk,stocks,k3id8m,2020-11-29 22:02,"How are people who have advisors via Fidelity, Vanguard etc doing? vs people who manage their own portfolios here?",https://www.reddit.com/r/stocks/comments/k3id8m/how_are_people_who_have_advisors_via_fidelity/,2020-12-05 15:01,23,10,0.82
2qjfk,stocks,k3jnhu,2020-11-29 23:13,How does everyone feel about ARK funds?,https://www.reddit.com/r/stocks/comments/k3jnhu/how_does_everyone_feel_about_ark_funds/,2020-12-05 15:01,35,29,0.84
2qjfk,stocks,k3k40d,2020-11-29 23:39,"I draw with crayons so you don't have to. Last week I closed up $2,250 or 2.8%. Here's what's on the watchlist this week: CRM, TDOC, PTON, FSLY, PRPL, GME, RKT, GPS",https://www.reddit.com/r/stocks/comments/k3k40d/i_draw_with_crayons_so_you_dont_have_to_last_week/,2020-12-05 15:01,34,65,0.84
2qjfk,stocks,k3kavl,2020-11-29 23:51,"There are hundreds of weed stocks, what's the best ticker(s) to go with?",https://www.reddit.com/r/stocks/comments/k3kavl/there_are_hundreds_of_weed_stocks_whats_the_best/,2020-12-05 15:01,41,18,0.83
2qjfk,stocks,k3kfpn,2020-11-29 23:59,Monday Morning Moves,https://www.reddit.com/r/stocks/comments/k3kfpn/monday_morning_moves/,2020-12-05 15:01,62,38,0.88
2qjfk,stocks,k3lgu7,2020-11-30 01:00,Help me understand why someone would embrace or want to be a “bear”,https://www.reddit.com/r/stocks/comments/k3lgu7/help_me_understand_why_someone_would_embrace_or/,2020-12-05 15:01,23,1,0.54
2qjfk,stocks,k3mmic,2020-11-30 02:09,"Psychedelic stocks new green rush? MMED, CBYN, CMPS?",https://www.reddit.com/r/stocks/comments/k3mmic/psychedelic_stocks_new_green_rush_mmed_cbyn_cmps/,2020-12-05 15:01,64,107,0.94
2qjfk,stocks,k3okkw,2020-11-30 04:16,Pros and cons of investing in 5 upcoming tech IPOs from Airbnb to Roblox,https://www.reddit.com/r/stocks/comments/k3okkw/pros_and_cons_of_investing_in_5_upcoming_tech/,2020-12-05 15:01,381,1755,0.96
2qjfk,stocks,k3ps2l,2020-11-30 05:40,Limit Order GME,https://www.reddit.com/r/stocks/comments/k3ps2l/limit_order_gme/,2020-12-05 15:01,33,11,0.77
2qjfk,stocks,k3rpvj,2020-11-30 08:09,"r/Stocks Daily Discussion Monday - Nov 30, 2020",https://www.reddit.com/r/stocks/comments/k3rpvj/rstocks_daily_discussion_monday_nov_30_2020/,2020-12-05 15:01,628,31,0.92
2qjfk,stocks,k3vxmf,2020-11-30 13:38,Nikola signs new agreement with GM,https://www.reddit.com/r/stocks/comments/k3vxmf/nikola_signs_new_agreement_with_gm/,2020-12-05 15:01,47,60,0.85
2qjfk,stocks,k3wytt,2020-11-30 14:40,Why are people into GME?,https://www.reddit.com/r/stocks/comments/k3wytt/why_are_people_into_gme/,2020-12-05 15:01,104,37,0.79
2qjfk,stocks,k3x2tt,2020-11-30 14:45,Who forgot about CRSR,https://www.reddit.com/r/stocks/comments/k3x2tt/who_forgot_about_crsr/,2020-12-05 15:01,147,230,0.89
2qjfk,stocks,k3xb90,2020-11-30 14:58,Jumia and it’s long term potential,https://www.reddit.com/r/stocks/comments/k3xb90/jumia_and_its_long_term_potential/,2020-12-05 15:01,20,22,0.87
2qjfk,stocks,k3xd2y,2020-11-30 15:01,Palantir Adds $17 Billion in Value in Best Week Since Debut,https://www.reddit.com/r/stocks/comments/k3xd2y/palantir_adds_17_billion_in_value_in_best_week/,2020-12-05 15:01,191,916,0.94
2qjfk,stocks,k3xr2f,2020-11-30 15:21,MRNA question,https://www.reddit.com/r/stocks/comments/k3xr2f/mrna_question/,2020-12-05 15:01,24,14,0.76
2qjfk,stocks,k3xsmo,2020-11-30 15:23,CRSP The Future of Health Care?,https://www.reddit.com/r/stocks/comments/k3xsmo/crsp_the_future_of_health_care/,2020-12-05 15:01,24,22,0.96
2qjfk,stocks,k3ygnv,2020-11-30 15:56,MGNI - Buy the dip! DD inside,https://www.reddit.com/r/stocks/comments/k3ygnv/mgni_buy_the_dip_dd_inside/,2020-12-05 15:01,24,28,0.87
2qjfk,stocks,k3zana,2020-11-30 16:36,$BABA and those in the same boat,https://www.reddit.com/r/stocks/comments/k3zana/baba_and_those_in_the_same_boat/,2020-12-05 15:01,74,29,0.8
2qjfk,stocks,k3zh7x,2020-11-30 16:44,Thoughts on Virgin Galactic Holdings ($SPCE)?,https://www.reddit.com/r/stocks/comments/k3zh7x/thoughts_on_virgin_galactic_holdings_spce/,2020-12-05 15:01,40,41,0.87
