Subreddit_ID,Subreddit_Name,Submission_ID,Submission_CreatedDate,Submission_Title,Submission_URL,Submission_LastFetched,Submission_NumComments,Submission_Score,Submission_UpvoteRatio
2th52,wallstreetbets,ki3n9s,2020-12-22 11:33,WE’RE GOING TO THE MOON BOYS,https://i.redd.it/ykzf1ouj5q661.jpg,2020-12-25 20:52,401,1338,0.97
2th52,wallstreetbets,ki3z6j,2020-12-22 11:58,Try Not To Laugh challenge brought to by The Motley Fool,https://i.redd.it/t78tjuf5aq661.jpg,2020-12-25 20:52,155,574,0.97
2th52,wallstreetbets,ki488k,2020-12-22 12:13,"Trying to turn my r/investing brother autistic and realizing I truly am the crackhead autist uncle who “just needs one more 20,000 dollar loan” for his next venture",https://i.redd.it/9z4e5t9ucq661.jpg,2020-12-25 20:52,166,1096,0.97
2th52,wallstreetbets,ki4j2v,2020-12-22 12:34,Steady 1 month climb to Christmas. Hopefully continues into 2021.,https://i.redd.it/pk4z7z2kgq661.jpg,2020-12-25 20:52,33,47,0.9
2th52,wallstreetbets,ki4k1s,2020-12-22 12:36,$PLTR 🚀 It's been a wild ride.,https://v.redd.it/eiaswvicgq661,2020-12-25 20:52,497,15540,0.94
2th52,wallstreetbets,ki4zf9,2020-12-22 13:05,While everyone's talking about steel... [PART 2],https://www.reddit.com/r/wallstreetbets/comments/ki4zf9/while_everyones_talking_about_steel_part_2/,2020-12-25 20:52,26,22,0.8
2th52,wallstreetbets,ki62jj,2020-12-22 14:13,Desktop Metal $DM is the moonshot multi bagger,https://www.reddit.com/r/wallstreetbets/comments/ki62jj/desktop_metal_dm_is_the_moonshot_multi_bagger/,2020-12-25 20:52,55,29,0.89
2th52,wallstreetbets,ki682d,2020-12-22 14:21,It be like that these days,https://i.redd.it/j80jom8nzq661.jpg,2020-12-25 20:52,78,1349,0.97
2th52,wallstreetbets,ki6cv3,2020-12-22 14:29,I’m not laughing at you I’m laughing with you 🐻s.,https://v.redd.it/qrfzrvxgcp661,2020-12-25 20:52,63,3357,0.98
2th52,wallstreetbets,ki6jfu,2020-12-22 14:39,QS ISNT FUCKING DONE YET HOP IN,https://i.redd.it/8mulgz2t2r661.jpg,2020-12-25 20:52,60,89,0.96
2th52,wallstreetbets,ki6q70,2020-12-22 14:49,doing my part. yolo my $200k on GME stock today... expect great things after Christmas. 🚀🚀🚀🚀🚀,https://i.redd.it/py19r3cg4r661.png,2020-12-25 20:52,114,638,0.98
2th52,wallstreetbets,ki6skz,2020-12-22 14:53,"$NET Cloudflare will be the nextgen cloud hosting serverless winner, with Jamstack and the secret biggest 2020 product release",https://www.reddit.com/r/wallstreetbets/comments/ki6skz/net_cloudflare_will_be_the_nextgen_cloud_hosting/,2020-12-25 20:52,26,51,0.97
2th52,wallstreetbets,ki6u5j,2020-12-22 14:56,"For my next trick, I will make $15,000.....disappear, thanks Elon",https://www.reddit.com/r/wallstreetbets/comments/ki6u5j/for_my_next_trick_i_will_make_15000disappear/,2020-12-25 20:52,24,34,0.84
2th52,wallstreetbets,ki6vef,2020-12-22 14:58,The squeeze is on (GME),https://i.redd.it/2vxtu4a46r661.jpg,2020-12-25 20:52,45,337,0.97
2th52,wallstreetbets,ki6xf6,2020-12-22 15:01,GME search trends,https://www.reddit.com/r/wallstreetbets/comments/ki6xf6/gme_search_trends/,2020-12-25 20:52,46,265,0.98
2th52,wallstreetbets,ki70tj,2020-12-22 15:05,A Gamestop story...,https://v.redd.it/izfr8oq27r661,2020-12-25 20:52,31,603,0.98
2th52,wallstreetbets,ki7254,2020-12-22 15:07,"GME GANG CHECKING IN , WE SHALL WIN THIS WAR BROTHERS",https://v.redd.it/jch2hgxo7r661,2020-12-25 20:52,39,577,0.98
2th52,wallstreetbets,ki74lc,2020-12-22 15:11,AI is the next PLTR,https://www.reddit.com/r/wallstreetbets/comments/ki74lc/ai_is_the_next_pltr/,2020-12-25 20:52,24,7,0.58
2th52,wallstreetbets,ki78ni,2020-12-22 15:17,"[GME] Finally, we have returned",https://v.redd.it/2utle7vc9r661,2020-12-25 20:52,44,646,0.98
2th52,wallstreetbets,ki7b9s,2020-12-22 15:21,The most underrated meme stock of 2020 $BLNK. For all the young autistic kids out there these are what we call shares (not options),https://i.redd.it/c7wvuimaar661.jpg,2020-12-25 20:52,20,17,0.77
2th52,wallstreetbets,ki7gwq,2020-12-22 15:30,Stimmy Gang WYA,https://i.redd.it/vkr826jtbr661.jpg,2020-12-25 20:52,369,56766,0.93
2th52,wallstreetbets,ki7kxf,2020-12-22 15:36,Lost big on tanger gang so I had to play it safe with shares.,https://i.redd.it/1is2m6awcr661.jpg,2020-12-25 20:52,21,146,0.97
2th52,wallstreetbets,ki7l3s,2020-12-22 15:36,The fire 🔥 breathing Bollinger 📉 dragon 🐉😱 is speaking 🗣️ to us and we should take head 📝📝 $TSLA 🚀💥,https://i.redd.it/lofl0kzsar661.png,2020-12-25 20:52,100,1696,0.98
2th52,wallstreetbets,ki7m60,2020-12-22 15:37,GME to the moon!,https://i.redd.it/7o1i9yp7dr661.jpg,2020-12-25 20:52,34,238,0.96
2th52,wallstreetbets,ki824x,2020-12-22 16:01,Buy this GME dip!! $20 EOD not EOY!!🚀🚀,https://i.redd.it/qna7y95hhr661.jpg,2020-12-25 20:52,44,154,0.97
2th52,wallstreetbets,ki82ni,2020-12-22 16:02,Shorting gold at the butchers,https://i.redd.it/g6hoxbmhhr661.png,2020-12-25 20:52,57,989,0.98
2th52,wallstreetbets,ki86hc,2020-12-22 16:07,UTZ SLUTZ - My Wife thanks you,https://www.reddit.com/r/wallstreetbets/comments/ki86hc/utz_slutz_my_wife_thanks_you/,2020-12-25 20:52,29,34,0.93
2th52,wallstreetbets,ki8jk3,2020-12-22 16:27,"I built a ""AI"" bot that learned how to speak like a true Autist. I trained it on all of the comments in recent top PLTR posts and the results are pretty hilarious. Check it out.",https://www.reddit.com/r/wallstreetbets/comments/ki8jk3/i_built_a_ai_bot_that_learned_how_to_speak_like_a/,2020-12-25 20:52,23,94,0.98
2th52,wallstreetbets,ki8y6q,2020-12-22 16:47,"GME Gang, let's fill those gaps! Blue range break out! Can't stop, won't stop, Gamestop!",https://i.redd.it/b87nm3f5pr661.jpg,2020-12-25 20:52,46,195,0.96
2th52,wallstreetbets,ki8zg8,2020-12-22 16:48,CIIC arbitrage opportunity update + vote date announced,https://www.reddit.com/r/wallstreetbets/comments/ki8zg8/ciic_arbitrage_opportunity_update_vote_date/,2020-12-25 20:52,28,4,0.65
2th52,wallstreetbets,ki92o0,2020-12-22 16:53,NIO and PLTR dips 🚀 - get em while they’re hot,https://www.reddit.com/r/wallstreetbets/comments/ki92o0/nio_and_pltr_dips_get_em_while_theyre_hot/,2020-12-25 20:52,21,49,0.92
2th52,wallstreetbets,ki94f2,2020-12-22 16:55,"Gamestop loot, lets gooooo",https://www.reddit.com/r/wallstreetbets/comments/ki94f2/gamestop_loot_lets_gooooo/,2020-12-25 20:52,27,53,0.89
2th52,wallstreetbets,ki997x,2020-12-22 17:02,"Question - Order Books on GME, Would 1.5m Order Bump Price to $26?",https://i.redd.it/zud5c0w8sr661.jpg,2020-12-25 20:52,26,41,0.91
2th52,wallstreetbets,ki99rp,2020-12-22 17:02,Why a $150 price target for GME is realistic,https://www.reddit.com/r/wallstreetbets/comments/ki99rp/why_a_150_price_target_for_gme_is_realistic/,2020-12-25 20:52,328,1194,0.94
2th52,wallstreetbets,ki9axc,2020-12-22 17:04,Someone got paid to write this article. An adult went to college to write this... Will Palantir's Stock Reach $50 By 2022?,https://www.benzinga.com/node/18887105,2020-12-25 20:52,22,66,0.91
2th52,wallstreetbets,ki9jp4,2020-12-22 17:16,Why Gamestop earnings makes sense and this dip is the perfect time to buy. crosspost from my sub /r/GME_Stock,https://www.reddit.com/r/wallstreetbets/comments/ki9jp4/why_gamestop_earnings_makes_sense_and_this_dip_is/,2020-12-25 20:52,22,55,0.81
2th52,wallstreetbets,ki9n5n,2020-12-22 17:21,We know nothing but gain everything,https://www.reddit.com/gallery/ki9n5n,2020-12-25 20:52,273,4922,0.99
2th52,wallstreetbets,ki9qvj,2020-12-22 17:26,"$LUMN - future of tech play with 10% dividend, large moat, Burry ownership",https://www.reddit.com/r/wallstreetbets/comments/ki9qvj/lumn_future_of_tech_play_with_10_dividend_large/,2020-12-25 20:52,28,33,0.88
2th52,wallstreetbets,ki9u4a,2020-12-22 17:30,PLTR - Technical Analysis from a Professional Investor - Update 12/22,https://www.reddit.com/r/wallstreetbets/comments/ki9u4a/pltr_technical_analysis_from_a_professional/,2020-12-25 20:52,288,629,0.96
2th52,wallstreetbets,ki9xe6,2020-12-22 17:35,CFII - Ride the merger up - possible deal with Tesla?!,https://www.reddit.com/r/wallstreetbets/comments/ki9xe6/cfii_ride_the_merger_up_possible_deal_with_tesla/,2020-12-25 20:52,22,31,0.82
2th52,wallstreetbets,ki9zme,2020-12-22 17:38,***GME*** Forget the moon; Mars is in line!,https://www.marketwatch.com/story/videogames-are-a-bigger-industry-than-sports-and-movies-combined-thanks-to-the-pandemic-11608654990,2020-12-25 20:52,27,119,0.95
2th52,wallstreetbets,ki9zuz,2020-12-22 17:38,Ford EV F-150 video (🚀F🚀),https://www.facebook.com/ford/videos/our-evs-dont-hibernate-ford/387002972366960/,2020-12-25 20:52,20,7,0.71
2th52,wallstreetbets,kia6qu,2020-12-22 17:47,Spreading my good fortune to you all today,https://i.redd.it/w2jwg0if0s661.jpg,2020-12-25 20:52,24,701,0.99
2th52,wallstreetbets,kia8ok,2020-12-22 17:50,Retard Boomer looses $300k on Fitbit options and tries to blame Robinhood for fraud,https://www.bloomberg.com/news/articles/2020-12-22/robinhood-user-says-300-000-restored-from-hack-then-taken-back,2020-12-25 20:52,182,1076,0.97
2th52,wallstreetbets,kiaapa,2020-12-22 17:53,$PLTR and $TSLA calls 😭,https://i.redd.it/ukumjvbd1s661.jpg,2020-12-25 20:52,69,2228,0.98
2th52,wallstreetbets,kiapso,2020-12-22 18:13,Finally made it as a certified retard. Wife wanted new iPhone and I told her if APPL goes up by Christmas I’ll get one. Woke her up with a “HOLY SHIT!” This morning then sold and put half gains in TSLA calls,https://i.redd.it/r9f5d7qw4s661.jpg,2020-12-25 20:52,21,132,0.95
2th52,wallstreetbets,kiav3r,2020-12-22 18:20,Put some RESPECT on our name❗️,https://i.redd.it/sttvl7y96s661.jpg,2020-12-25 20:52,25,178,0.95
2th52,wallstreetbets,kib0mo,2020-12-22 18:28,"Ark is buying Alibaba yesterday!! 66,000 share with $17M in one day. Is it the time to buy Alibaba now? And Jack Ma is offered to give Chinese regulators parts Ant group!!",https://www.reddit.com/gallery/kib0mo,2020-12-25 20:52,26,46,0.92
2th52,wallstreetbets,kib0ww,2020-12-22 18:29,Bought Friday morning. Thanks to all the people who posted about FUBO 🚀🚀🚀,https://i.redd.it/5tneqddr7s661.jpg,2020-12-25 20:52,30,57,0.95
2th52,wallstreetbets,kib6a8,2020-12-22 18:36,It's not much but it's [not] honest work...,https://i.redd.it/vxydf2q29s661.jpg,2020-12-25 20:52,24,53,0.83
2th52,wallstreetbets,kibjcu,2020-12-22 18:55,Canoo ticker being advertised in Times Square. Cant go tits up. $GO⚡️EV,https://i.redd.it/dsrimpkics661.jpg,2020-12-25 20:52,67,155,0.96
2th52,wallstreetbets,kibjkc,2020-12-22 18:56,$BB Insider trading — Unusual options activity on weekly 7.5c’s — checks all the boxes for an insider trading on news leak coming this week!!!,https://www.reddit.com/r/wallstreetbets/comments/kibjkc/bb_insider_trading_unusual_options_activity_on/,2020-12-25 20:52,339,416,0.96
2th52,wallstreetbets,kibkz8,2020-12-22 18:58,All the big funds shorting $GME watching it consolidate at a 52-week high,https://v.redd.it/qv54m7cucs661,2020-12-25 20:52,26,278,0.97
2th52,wallstreetbets,kibm4g,2020-12-22 18:59,Opendoor DD (OPEN),https://www.reddit.com/r/wallstreetbets/comments/kibm4g/opendoor_dd_open/,2020-12-25 20:52,31,20,0.83
2th52,wallstreetbets,kibq8b,2020-12-22 19:04,"TD Ameritrade's ""Auto Trader"" Glitch Cost me Thousands",https://www.reddit.com/r/wallstreetbets/comments/kibq8b/td_ameritrades_auto_trader_glitch_cost_me/,2020-12-25 20:52,24,11,0.79
2th52,wallstreetbets,kibrtj,2020-12-22 19:07,"Long time lurker, first time gain poster. Started a RH account for WSB ~10 days ago, first one wasn't free but I'm a quick learner.",https://www.reddit.com/gallery/kibrtj,2020-12-25 20:52,27,22,0.8
2th52,wallstreetbets,kichk0,2020-12-22 19:44,CHGG DD,https://www.reddit.com/r/wallstreetbets/comments/kichk0/chgg_dd/,2020-12-25 20:52,21,22,0.78
2th52,wallstreetbets,kicipr,2020-12-22 19:46,How to spot an explosive breakout,https://www.reddit.com/r/wallstreetbets/comments/kicipr/how_to_spot_an_explosive_breakout/,2020-12-25 20:52,50,58,0.86
2th52,wallstreetbets,kicl7r,2020-12-22 19:49,Welcome to story time,https://i.redd.it/bpinp0q5ms661.jpg,2020-12-25 20:52,169,12044,0.98
2th52,wallstreetbets,kiclgr,2020-12-22 19:50,"I will die bag holding PFE calls before I die of Covid, lost all my gains from this year plus 4k of my initial investment if they expire worthless. Any chance PFE going back up?",https://i.redd.it/y0r7t788ms661.jpg,2020-12-25 20:52,44,11,0.76
2th52,wallstreetbets,kicput,2020-12-22 19:56,Me and the $GME gang come March 25,https://i.redd.it/lsbatwdcns661.jpg,2020-12-25 20:52,43,482,0.98
2th52,wallstreetbets,kictn6,2020-12-22 20:01,First hundred bagger on my cake day!,https://i.redd.it/y5lzkr1aos661.jpg,2020-12-25 20:52,39,288,0.97
2th52,wallstreetbets,kid5g4,2020-12-22 20:18,Daddy Cohen blessed me with 11k profit while I was dreaming in Tendy land 🌈 🌈 up 33% this month - started trading around thanksgiving,https://i.redd.it/uf6lrcu7rs661.jpg,2020-12-25 20:52,32,129,0.96
2th52,wallstreetbets,kidbbr,2020-12-22 20:26,"It's one thing for all those big company's job listings to mention PLTR signaling there's upcoming partnerships, but my slow ass missed the even better news around that...",https://www.reddit.com/r/wallstreetbets/comments/kidbbr/its_one_thing_for_all_those_big_companys_job/,2020-12-25 20:52,36,91,0.98
2th52,wallstreetbets,kidbsm,2020-12-22 20:26,What's the plan with GOEV (CANOO) ?,https://www.reddit.com/r/wallstreetbets/comments/kidbsm/whats_the_plan_with_goev_canoo/,2020-12-25 20:52,45,53,0.92
2th52,wallstreetbets,kidiv0,2020-12-22 20:36,AAPL EV is good for Tesla,https://www.reddit.com/r/wallstreetbets/comments/kidiv0/aapl_ev_is_good_for_tesla/,2020-12-25 20:52,27,15,0.73
2th52,wallstreetbets,kidlxf,2020-12-22 20:41,I Wonder What She's Getting?!,https://i.redd.it/vuyx097cvs661.jpg,2020-12-25 20:52,30,16,0.82
2th52,wallstreetbets,kidnmf,2020-12-22 20:43,Celebrating ARKG’s run,https://i.redd.it/sd59d2qrvs661.jpg,2020-12-25 20:52,32,182,0.91
2th52,wallstreetbets,kiduo6,2020-12-22 20:53,Take your money and get out!,https://www.reddit.com/r/wallstreetbets/comments/kiduo6/take_your_money_and_get_out/,2020-12-25 20:52,62,0,0.37
2th52,wallstreetbets,kidz5v,2020-12-22 21:00,"What Are Your Moves Tomorrow, December 23, 2020",https://www.reddit.com/r/wallstreetbets/comments/kidz5v/what_are_your_moves_tomorrow_december_23_2020/,2020-12-25 20:52,24771,419,0.94
2th52,wallstreetbets,kie0qo,2020-12-22 21:02,CD Projekt RED:OTGLY - A No Brainer,https://www.reddit.com/r/wallstreetbets/comments/kie0qo/cd_projekt_redotgly_a_no_brainer/,2020-12-25 20:52,34,13,0.74
2th52,wallstreetbets,kie0vf,2020-12-22 21:02,NO BID ON 1/10 OFF CURRENT VALUTION —WE FOUND ANOTHER TSLA 🌈🐻 —GOOD LUCK WITH ICARS 🤡🤡,https://i.redd.it/jhjzkmb5zs661.jpg,2020-12-25 20:52,155,637,0.97
2th52,wallstreetbets,kie109,2020-12-22 21:02,We’re with you BB insider trading guy,https://thefly.com/landingPageNews.php?id=3217414&headline=BB-BlackBerry-call-volume-above-normal-and-directionally-bullish,2020-12-25 20:52,37,59,0.98
2th52,wallstreetbets,kie184,2020-12-22 21:03,Seems about right,https://i.redd.it/bzr63fc8zs661.jpg,2020-12-25 20:52,116,3061,0.99
2th52,wallstreetbets,kie1dk,2020-12-22 21:03,GME YOLO update — Dec 22 2020,https://i.redd.it/25f04qy3zs661.png,2020-12-25 20:52,804,9358,0.96
2th52,wallstreetbets,kie6kp,2020-12-22 21:10,Some math for you retards,https://i.redd.it/p2eascvk0t661.jpg,2020-12-25 20:52,20,76,0.96
2th52,wallstreetbets,kie7rt,2020-12-22 21:12,Finally cashed out my jmia sbe and Nio,https://www.reddit.com/r/wallstreetbets/comments/kie7rt/finally_cashed_out_my_jmia_sbe_and_nio/,2020-12-25 20:52,30,9,0.8
2th52,wallstreetbets,kie9yn,2020-12-22 21:15,Me getting 2% in TSLA today while GME gets 25%,https://i.redd.it/rjz20nke1t661.gif,2020-12-25 20:52,160,4262,0.99
2th52,wallstreetbets,kiealo,2020-12-22 21:16,"""Don't BLNK"" Bogdanoff said laughingly, as I watched him rail my wife....He Hold?",https://i.redd.it/5vmrfhta1t661.jpg,2020-12-25 20:52,21,34,0.88
2th52,wallstreetbets,kiecvl,2020-12-22 21:19,"Be honest guys, how fucked am I??? I tried being a 🌈🐻 against $DASH - DASH PUTS TAP IN GIVE ME SOME CONFIRMATION BIAS",https://i.redd.it/iw15rzr82t661.jpg,2020-12-25 20:52,54,6,0.72
2th52,wallstreetbets,kiecy9,2020-12-22 21:20,GME autists. Please DO NOT let the SHORTS Manipulate you like this again.,https://www.reddit.com/r/wallstreetbets/comments/kiecy9/gme_autists_please_do_not_let_the_shorts/,2020-12-25 20:52,386,3112,0.97
2th52,wallstreetbets,kieet3,2020-12-22 21:22,$QS beargang YOLO - short naked calls,https://i.redd.it/vyekmglq2t661.png,2020-12-25 20:52,20,9,0.74
2th52,wallstreetbets,kiehp4,2020-12-22 21:26,My portfolio went green today! Thanks GME!,https://v.redd.it/i9ycp58b3t661,2020-12-25 20:52,26,109,0.93
2th52,wallstreetbets,kiei8i,2020-12-22 21:27,Is this completely retarded? My inexperienced hunch is telling me Amazon is due for a run up until their upcoming ER,https://i.redd.it/j7s1rtv73t661.png,2020-12-25 20:52,21,12,0.78
2th52,wallstreetbets,kiek42,2020-12-22 21:30,WSB is getting less retarded and more successful,https://www.reddit.com/r/wallstreetbets/comments/kiek42/wsb_is_getting_less_retarded_and_more_successful/,2020-12-25 20:52,354,1861,0.96
2th52,wallstreetbets,kiekkt,2020-12-22 21:31,COVAXIN. Covid Vaccine Pt.2,https://www.reddit.com/r/wallstreetbets/comments/kiekkt/covaxin_covid_vaccine_pt2/,2020-12-25 20:52,21,9,0.74
2th52,wallstreetbets,kieo1r,2020-12-22 21:36,Don’t show a Tinder girl you’re a degenerate far too soon. They’ll stop responding.,https://i.redd.it/e981yzb55t661.jpg,2020-12-25 20:52,55,303,0.9
2th52,wallstreetbets,kieody,2020-12-22 21:36,CALLING OUT WSB & RYAN COHEN 🚀,https://www.reddit.com/r/wallstreetbets/comments/kieody/calling_out_wsb_ryan_cohen/,2020-12-25 20:52,123,494,0.96
2th52,wallstreetbets,kieqaz,2020-12-22 21:39,MGNI,https://www.reddit.com/r/wallstreetbets/comments/kieqaz/mgni/,2020-12-25 20:52,40,35,0.86
2th52,wallstreetbets,kiew4m,2020-12-22 21:47,I wrote a script that tracks the day’s highest returning options. Here’s what you missed out on (12/22),https://i.redd.it/ba7gyef77t661.jpg,2020-12-25 20:52,65,331,0.98
2th52,wallstreetbets,kiewq6,2020-12-22 21:48,Guess I’ll do it again,https://i.redd.it/r04lcg3d7t661.jpg,2020-12-25 20:52,73,2671,0.99
2th52,wallstreetbets,kif9d5,2020-12-22 22:06,GME 🚀🚀🚀,https://v.redd.it/q2uzkav4at661,2020-12-25 20:52,261,3741,0.98
2th52,wallstreetbets,kifc8q,2020-12-22 22:10,AMC - A dead Phoenix.,https://www.reddit.com/r/wallstreetbets/comments/kifc8q/amc_a_dead_phoenix/,2020-12-25 20:52,38,6,0.62
2th52,wallstreetbets,kifeec,2020-12-22 22:13,"I'm still paying down debt, but thanks to you softbrains I can share the love",https://i.redd.it/qavrlgxubt661.png,2020-12-25 20:52,31,104,0.89
2th52,wallstreetbets,kifnw8,2020-12-22 22:27,First time getting a 5 figure profit off options thank you ICLN,https://www.reddit.com/gallery/kifnw8,2020-12-25 20:52,28,57,0.93
2th52,wallstreetbets,kifsjn,2020-12-22 22:33,Papa Karl just refueling. Still way in green diamond 💎 🖐,https://i.redd.it/70cksh3gft661.jpg,2020-12-25 20:52,20,20,0.79
2th52,wallstreetbets,kify50,2020-12-22 22:42,"22,000% + returns LOL Uber synthetic shares",https://i.redd.it/pxta0rhxgt661.jpg,2020-12-25 20:52,24,36,0.89
2th52,wallstreetbets,kig5wd,2020-12-22 22:53,M i c r o v i s i o n,https://www.reddit.com/r/wallstreetbets/comments/kig5wd/m_i_c_r_o_v_i_s_i_o_n/,2020-12-25 20:52,78,35,0.79
2th52,wallstreetbets,kigb36,2020-12-22 23:00,It's just about time - ARCELORMITTAL - STEEL GANG 🚀🚀🚀,https://www.reddit.com/r/wallstreetbets/comments/kigb36/its_just_about_time_arcelormittal_steel_gang/,2020-12-25 20:52,145,158,0.89
2th52,wallstreetbets,kigbh0,2020-12-22 23:01,u/DeepFuckingValue after GME squeezes to the moon 🚀🚀🚀,https://v.redd.it/b7wyqixbkt661,2020-12-25 20:52,130,1793,0.99
2th52,wallstreetbets,kiglfi,2020-12-22 23:15,GME to da moon 🚀🚀🚀🚀🚀 🚀🚀🚀🚀🚀🚀🚀🚀🚀🚀🚀🚀🚀🚀🚀🚀🚀,https://v.redd.it/hsh7f2comt661,2020-12-25 20:52,33,295,0.96
2th52,wallstreetbets,kigoz3,2020-12-22 23:20,We’re gonna give Cramer a heart attack 😂,https://www.reddit.com/r/wallstreetbets/comments/kigoz3/were_gonna_give_cramer_a_heart_attack/,2020-12-25 20:52,100,243,0.96
2th52,wallstreetbets,kihdjt,2020-12-22 23:56,Green energy? Green tendies,https://i.redd.it/miv21669ut661.jpg,2020-12-25 20:52,27,90,0.96
2th52,wallstreetbets,kiht0p,2020-12-23 00:20,GME blasting off. I'm not selling!,https://i.redd.it/k0bg8mheyt661.png,2020-12-25 20:52,26,206,0.98
2th52,wallstreetbets,kii3sa,2020-12-23 00:36,Missed the EV boom? 🚀Lithium start-ups🚀 could be the next tidal wave.,https://www.reddit.com/r/wallstreetbets/comments/kii3sa/missed_the_ev_boom_lithium_startups_could_be_the/,2020-12-25 20:52,30,62,0.86
2th52,wallstreetbets,kii6tr,2020-12-23 00:40,Trump threatens to veto the latest bill if it's not amended and increase $600 to $2000 per person. But the bill is veto-proof?!,https://twitter.com/realDonaldTrump/status/1341537886315950080?s=20,2020-12-25 20:52,189,315,0.96
2th52,wallstreetbets,kiie0f,2020-12-23 00:52,Trump posts video saying he wants a new bill,https://www.reddit.com/r/wallstreetbets/comments/kiie0f/trump_posts_video_saying_he_wants_a_new_bill/,2020-12-25 20:52,125,126,0.96
2th52,wallstreetbets,kiifmr,2020-12-23 00:54,The GME short squeeze OTM options play fit for WSB,https://www.reddit.com/r/wallstreetbets/comments/kiifmr/the_gme_short_squeeze_otm_options_play_fit_for_wsb/,2020-12-25 20:52,29,55,0.91
2th52,wallstreetbets,kiiisw,2020-12-23 00:59,"Update on my $THC🐝 position, up around $113k currently, holding till we go to the moon.",https://i.redd.it/fdrkqnrf5u661.jpg,2020-12-25 20:52,30,81,0.92
2th52,wallstreetbets,kiil08,2020-12-23 01:02,Heard I belong here.,https://i.redd.it/7p7soyg06u661.jpg,2020-12-25 20:52,22,61,0.86
2th52,wallstreetbets,kiimxa,2020-12-23 01:05,Dude 100% won't admit he lost 300k on options,https://www.bloomberg.com/news/articles/2020-12-22/robinhood-user-says-300-000-restored-from-hack-then-taken-back?srnd=premium,2020-12-25 20:52,31,144,0.95
2th52,wallstreetbets,kiio6e,2020-12-23 01:07,The Big Gain | The Story of Tesla's Parabolic Move,https://v.redd.it/qpwdtey16u661,2020-12-25 20:52,304,4320,0.98
2th52,wallstreetbets,kiivwf,2020-12-23 01:19,3K —> 65K 🔥🔥🔥 Why do you guys pretend like this is hard?,https://i.redd.it/0mq4hyv09u661.jpg,2020-12-25 20:52,77,62,0.78
2th52,wallstreetbets,kijb0r,2020-12-23 01:43,He’s not signing the stimmy bill. Fire sale tomorrow morning.,https://twitter.com/realdonaldtrump/status/1341537886315950080?s=21,2020-12-25 20:52,344,761,0.95
2th52,wallstreetbets,kijgfs,2020-12-23 01:52,Why JOE won't slow-- how this stock is primed to double in 2021,https://www.reddit.com/r/wallstreetbets/comments/kijgfs/why_joe_wont_slow_how_this_stock_is_primed_to/,2020-12-25 20:52,40,18,0.83
2th52,wallstreetbets,kijjq9,2020-12-23 01:57,Paysafe Partners with Amelco $BTF🚀🚀,https://www.reddit.com/r/wallstreetbets/comments/kijjq9/paysafe_partners_with_amelco_btf/,2020-12-25 20:52,25,26,0.85
2th52,wallstreetbets,kijjwi,2020-12-23 01:57,The world's smallest stimmy check,https://v.redd.it/0hxp85pjfu661,2020-12-25 20:52,21,434,0.97
2th52,wallstreetbets,kijtke,2020-12-23 02:12,Warning: This is the time Hedge Funds try to Manipulate the market,https://www.reddit.com/r/wallstreetbets/comments/kijtke/warning_this_is_the_time_hedge_funds_try_to/,2020-12-25 20:52,809,12732,0.95
2th52,wallstreetbets,kijtra,2020-12-23 02:12,PELOSI SAVES AUTISTS FDs,https://postimg.cc/gxp3t6KF,2020-12-25 20:52,69,33,0.76
2th52,wallstreetbets,kijzla,2020-12-23 02:22,Ark Invest holdings on Opendoor Technologies (OPEN) Check that #24 🚀🚀🚀🚀🚀,https://i.redd.it/40wl6xh7ku661.jpg,2020-12-25 20:52,48,71,0.91
2th52,wallstreetbets,kik9sf,2020-12-23 02:39,13k to 130k. Up 843% this month. Microvision shares & calls. Averaging up every dip until buyout. NEW MEME STOCK 🚨🛸🛸🛸🛸,https://v.redd.it/6oyyg01xmu661,2020-12-25 20:52,149,721,0.96
2th52,wallstreetbets,kiki62,2020-12-23 02:53,Of course Wal-Mart gets sued 1 hour after I buy calls 🙃 bye bye money,https://i.redd.it/n0t0uctrpu661.jpg,2020-12-25 20:52,39,114,0.89
2th52,wallstreetbets,kikkv2,2020-12-23 02:58,"SWI - Solarwinds Option Calls, What hack?",https://www.reddit.com/r/wallstreetbets/comments/kikkv2/swi_solarwinds_option_calls_what_hack/,2020-12-25 20:52,21,0,0.25
2th52,wallstreetbets,kikzbj,2020-12-23 03:21,We demand $2k for risky options trading,https://v.redd.it/87t8ptcquu661,2020-12-25 20:52,54,2520,0.98
2th52,wallstreetbets,kil483,2020-12-23 03:29,FUBO is an absolute monster and MGNI was picked to be next today,https://www.reddit.com/r/wallstreetbets/comments/kil483/fubo_is_an_absolute_monster_and_mgni_was_picked/,2020-12-25 20:52,34,47,0.9
2th52,wallstreetbets,kil4wu,2020-12-23 03:31,GME short squeeze is a myth that assumes massive incompetence from people that actually know what they are doing.,https://www.reddit.com/r/wallstreetbets/comments/kil4wu/gme_short_squeeze_is_a_myth_that_assumes_massive/,2020-12-25 20:52,435,0,0.4
2th52,wallstreetbets,kil8r9,2020-12-23 03:37,U.S. approves NYSE listing plan to cut out Wall Street middlemen,https://www.reuters.com/article/us-usa-sec-nyse/u-s-approves-nyse-listing-plan-to-cut-out-wall-street-middlemen-idUSKBN28W2D4,2020-12-25 20:52,66,210,0.99
2th52,wallstreetbets,kilbbv,2020-12-23 03:41,GME DD Fresh Perspectives Only Pt.1,https://www.reddit.com/r/wallstreetbets/comments/kilbbv/gme_dd_fresh_perspectives_only_pt1/,2020-12-25 20:52,85,246,0.97
2th52,wallstreetbets,kilii2,2020-12-23 03:53,Computer Vision vs Lidar ($AMBA),https://www.reddit.com/r/wallstreetbets/comments/kilii2/computer_vision_vs_lidar_amba/,2020-12-25 20:52,23,13,0.75
2th52,wallstreetbets,kilkuw,2020-12-23 03:57,Give me another company Thiel I NEED IT 💰💰,https://i.redd.it/i6hbonu81v661.jpg,2020-12-25 20:52,32,143,0.95
2th52,wallstreetbets,kilurm,2020-12-23 04:14,Stimulus in Limbo,https://v.redd.it/hbe8le464v661,2020-12-25 20:52,27,50,0.81
