Subreddit_ID,Subreddit_Name,Submission_ID,Submission_CreatedDate,Submission_Title,Submission_URL,Submission_LastFetched,Submission_NumComments,Submission_Score,Submission_UpvoteRatio
2qhhq,investing,jw0s0v,2020-11-17 20:30,"Berkshire Hathaways 13-F Filings, Slashes Wells Fargo holdings, Exits Costco entirely, 95% reduction in JPM position",https://www.reddit.com/r/investing/comments/jw0s0v/berkshire_hathaways_13f_filings_slashes_wells/,2020-12-05 15:01,161,440,0.97
2qhhq,investing,jw64lb,2020-11-18 01:17,Cracks in MSFT Azure vs. Amazon AWS a concern?,https://www.reddit.com/r/investing/comments/jw64lb/cracks_in_msft_azure_vs_amazon_aws_a_concern/,2020-12-05 15:01,39,35,0.78
2qhhq,investing,jw770b,2020-11-18 02:21,How to get more leverage(financing) in the stock market?,https://www.reddit.com/r/investing/comments/jw770b/how_to_get_more_leveragefinancing_in_the_stock/,2020-12-05 15:01,20,0,0.5
2qhhq,investing,jw7zvr,2020-11-18 03:11,Walmart earnings top expectations as customers’ new shopping habits send e-commerce sales soaring 79%,https://www.reddit.com/r/investing/comments/jw7zvr/walmart_earnings_top_expectations_as_customers/,2020-12-05 15:01,49,923,0.98
2qhhq,investing,jwb5ed,2020-11-18 07:00,"As a new investor, am I being too hopeful in mmj stock? Aurora up 69.65% Corp Cannibas Etfs up 18%",https://www.reddit.com/r/investing/comments/jwb5ed/as_a_new_investor_am_i_being_too_hopeful_in_mmj/,2020-12-05 15:01,23,3,0.58
2qhhq,investing,jwbgj5,2020-11-18 07:27,New investor = addicted and going reckless,https://www.reddit.com/r/investing/comments/jwbgj5/new_investor_addicted_and_going_reckless/,2020-12-05 15:01,34,9,0.61
2qhhq,investing,jweorp,2020-11-18 12:11,Daily Advice Thread - All basic help or advice questions must be posted here.,https://www.reddit.com/r/investing/comments/jweorp/daily_advice_thread_all_basic_help_or_advice/,2020-12-05 15:01,93,24,0.93
2qhhq,investing,jwep3u,2020-11-18 12:12,The AMC question,https://www.reddit.com/r/investing/comments/jwep3u/the_amc_question/,2020-12-05 15:01,44,22,0.77
2qhhq,investing,jwg4y9,2020-11-18 13:52,FOMO and Palantir (PLTR),https://www.reddit.com/r/investing/comments/jwg4y9/fomo_and_palantir_pltr/,2020-12-05 15:01,62,19,0.66
2qhhq,investing,jwi703,2020-11-18 15:51,Target Crammed a Year’s Worth of Growth Into a Quarter,https://www.reddit.com/r/investing/comments/jwi703/target_crammed_a_years_worth_of_growth_into_a/,2020-12-05 15:01,161,1594,0.98
2qhhq,investing,jwkd5k,2020-11-18 17:43,PLTR lock-up period is confusing,https://www.reddit.com/r/investing/comments/jwkd5k/pltr_lockup_period_is_confusing/,2020-12-05 15:01,22,30,0.89
2qhhq,investing,jwl3qj,2020-11-18 18:20,"Google will let users open bank accounts, pay friends and manage budgets through a new version of its app rolling out today",https://www.reddit.com/r/investing/comments/jwl3qj/google_will_let_users_open_bank_accounts_pay/,2020-12-05 15:01,85,93,0.93
2qhhq,investing,jwljms,2020-11-18 18:42,What are your “dark horse” investing picks?,https://www.reddit.com/r/investing/comments/jwljms/what_are_your_dark_horse_investing_picks/,2020-12-05 15:01,182,58,0.86
2qhhq,investing,jwn3g6,2020-11-18 19:58,Muddy Waters: Baidu's recent purchase Joyy is a FRAUD,https://www.reddit.com/r/investing/comments/jwn3g6/muddy_waters_baidus_recent_purchase_joyy_is_a/,2020-12-05 15:01,29,39,0.8
2qhhq,investing,jwpbv5,2020-11-18 21:52,"Nvidia reports Q3 beats with record Gaming, Data Center sales and upside forecast",https://www.reddit.com/r/investing/comments/jwpbv5/nvidia_reports_q3_beats_with_record_gaming_data/,2020-12-05 15:01,20,78,0.93
2qhhq,investing,jwqcc3,2020-11-18 22:46,Alternative Investment in Guns,https://www.reddit.com/r/investing/comments/jwqcc3/alternative_investment_in_guns/,2020-12-05 15:01,23,0,0.35
2qhhq,investing,jwv68n,2020-11-19 03:32,Does it make sense to leverage your portfolio with rates so low?,https://www.reddit.com/r/investing/comments/jwv68n/does_it_make_sense_to_leverage_your_portfolio/,2020-12-05 15:01,105,20,0.82
2qhhq,investing,jwxabc,2020-11-19 05:57,Cathie Woods buying up crypto exchange/bank Silvergate Capital,https://www.reddit.com/r/investing/comments/jwxabc/cathie_woods_buying_up_crypto_exchangebank/,2020-12-05 15:01,67,106,0.91
2qhhq,investing,jx1hai,2020-11-19 12:02,Finally Profitable Enough That My Portfolio Has Paid For Itself And I'm Only Trading With Profits,https://www.reddit.com/r/investing/comments/jx1hai/finally_profitable_enough_that_my_portfolio_has/,2020-12-05 15:01,32,0,0.32
2qhhq,investing,jx1kgc,2020-11-19 12:09,Daily Advice Thread - All basic help or advice questions must be posted here.,https://www.reddit.com/r/investing/comments/jx1kgc/daily_advice_thread_all_basic_help_or_advice/,2020-12-05 15:01,180,13,0.82
2qhhq,investing,jx3k9d,2020-11-19 14:24,Billionaire Salinas Has 10% of ‘Liquid Portfolio’ in Bitcoin,https://www.reddit.com/r/investing/comments/jx3k9d/billionaire_salinas_has_10_of_liquid_portfolio_in/,2020-12-05 15:01,475,744,0.9
2qhhq,investing,jx3o3f,2020-11-19 14:30,The Stock That is Most Exciting To You,https://www.reddit.com/r/investing/comments/jx3o3f/the_stock_that_is_most_exciting_to_you/,2020-12-05 15:01,36,2,0.57
2qhhq,investing,jx7306,2020-11-19 17:32,Investing in the Oil and Gas Industry,https://www.reddit.com/r/investing/comments/jx7306/investing_in_the_oil_and_gas_industry/,2020-12-05 15:01,49,9,0.67
2qhhq,investing,jx7t8u,2020-11-19 18:08,"Cathie Wood Might Lose Control of ARK, the Company She Founded",https://www.reddit.com/r/investing/comments/jx7t8u/cathie_wood_might_lose_control_of_ark_the_company/,2020-12-05 15:01,48,118,0.91
2qhhq,investing,jx88u1,2020-11-19 18:30,GMs new EV Battery's cut cost and increase range,https://www.reddit.com/r/investing/comments/jx88u1/gms_new_ev_batterys_cut_cost_and_increase_range/,2020-12-05 15:01,40,62,0.9
2qhhq,investing,jxa952,2020-11-19 20:12,Crypto mining and investment tools,https://www.reddit.com/r/investing/comments/jxa952/crypto_mining_and_investment_tools/,2020-12-05 15:01,34,0,0.36
2qhhq,investing,jxcwgs,2020-11-19 22:33,Mnuchin Declines to Extend Several Fed Emergency Lending Programs,https://www.reddit.com/r/investing/comments/jxcwgs/mnuchin_declines_to_extend_several_fed_emergency/,2020-12-05 15:01,238,1213,0.98
2qhhq,investing,jxdep9,2020-11-19 23:01,Roblox S1,https://www.reddit.com/r/investing/comments/jxdep9/roblox_s1/,2020-12-05 15:01,80,73,0.88
2qhhq,investing,jxfd25,2020-11-20 01:00,What's cheap at the moment?,https://www.reddit.com/r/investing/comments/jxfd25/whats_cheap_at_the_moment/,2020-12-05 15:01,192,25,0.84
2qhhq,investing,jxgiee,2020-11-20 02:12,IBM (NYSE: IBM) - An In-depth Stock Analysis,https://www.reddit.com/r/investing/comments/jxgiee/ibm_nyse_ibm_an_indepth_stock_analysis/,2020-12-05 15:01,40,45,0.84
2qhhq,investing,jxh274,2020-11-20 02:48,Investing in the upcoming Vertical Farming Revolution with AppHarvest IPO - Yahoo article,https://www.reddit.com/r/investing/comments/jxh274/investing_in_the_upcoming_vertical_farming/,2020-12-05 15:01,20,46,0.89
2qhhq,investing,jxktcm,2020-11-20 07:31,SuCoAsMa - the perfect hedge investment?,https://www.reddit.com/r/investing/comments/jxktcm/sucoasma_the_perfect_hedge_investment/,2020-12-05 15:01,29,1,0.55
2qhhq,investing,jxla8z,2020-11-20 08:14,Index fund vs Individual stocks,https://www.reddit.com/r/investing/comments/jxla8z/index_fund_vs_individual_stocks/,2020-12-05 15:01,126,33,0.73
2qhhq,investing,jxn36s,2020-11-20 11:01,Writing naked put options question.,https://www.reddit.com/r/investing/comments/jxn36s/writing_naked_put_options_question/,2020-12-05 15:01,22,4,0.67
2qhhq,investing,jxny4c,2020-11-20 12:12,Daily Advice Thread - All basic help or advice questions must be posted here.,https://www.reddit.com/r/investing/comments/jxny4c/daily_advice_thread_all_basic_help_or_advice/,2020-12-05 15:01,102,8,0.84
2qhhq,investing,jxpxpi,2020-11-20 14:26,Thoughts on SBE,https://www.reddit.com/r/investing/comments/jxpxpi/thoughts_on_sbe/,2020-12-05 15:01,35,7,0.77
2qhhq,investing,jxq4fr,2020-11-20 14:37,Roblox IPO is a great way to teach your kids about the stock market,https://www.reddit.com/r/investing/comments/jxq4fr/roblox_ipo_is_a_great_way_to_teach_your_kids/,2020-12-05 15:01,264,1566,0.93
2qhhq,investing,jxqs42,2020-11-20 15:14,What is your favorite stock for growth in the next three months?,https://www.reddit.com/r/investing/comments/jxqs42/what_is_your_favorite_stock_for_growth_in_the/,2020-12-05 15:01,40,6,0.61
2qhhq,investing,jxquok,2020-11-20 15:18,Why isn't RKT going up despite hot housing market?,https://www.reddit.com/r/investing/comments/jxquok/why_isnt_rkt_going_up_despite_hot_housing_market/,2020-12-05 15:01,41,26,0.78
2qhhq,investing,jxryz3,2020-11-20 16:17,WSJ: A Stock Market Bubble? It’s More Like a Fire,https://www.reddit.com/r/investing/comments/jxryz3/wsj_a_stock_market_bubble_its_more_like_a_fire/,2020-12-05 15:01,140,277,0.92
2qhhq,investing,jxttna,2020-11-20 17:51,Does this look like insider trading to you?,https://www.reddit.com/r/investing/comments/jxttna/does_this_look_like_insider_trading_to_you/,2020-12-05 15:01,37,16,0.72
2qhhq,investing,jxul3a,2020-11-20 18:30,World's largest asset manager BlackRock ($8tn AUM) thinks Bitcoin will replace gold!,https://www.reddit.com/r/investing/comments/jxul3a/worlds_largest_asset_manager_blackrock_8tn_aum/,2020-12-05 15:01,73,15,0.59
2qhhq,investing,jxvd61,2020-11-20 19:10,Corsair (CRSR) is up almost 200% since it IPO'd two months ago,https://www.reddit.com/r/investing/comments/jxvd61/corsair_crsr_is_up_almost_200_since_it_ipod_two/,2020-12-05 15:01,112,258,0.95
2qhhq,investing,jxw3s1,2020-11-20 19:51,"I can’t, for the life of me, Figure out why RKT hasn’t moved higher",https://www.reddit.com/r/investing/comments/jxw3s1/i_cant_for_the_life_of_me_figure_out_why_rkt/,2020-12-05 15:01,26,18,0.73
2qhhq,investing,jxyeb1,2020-11-20 21:55,Stocks are not that crazy. Here's why.,https://www.reddit.com/r/investing/comments/jxyeb1/stocks_are_not_that_crazy_heres_why/,2020-12-05 15:01,40,41,0.75
2qhhq,investing,jxyoq8,2020-11-20 22:11,PLTR is a good short term and long term play!,https://www.reddit.com/r/investing/comments/jxyoq8/pltr_is_a_good_short_term_and_long_term_play/,2020-12-05 15:01,31,9,0.62
2qhhq,investing,jy7cbo,2020-11-21 08:19,Palantir Security,https://www.reddit.com/r/investing/comments/jy7cbo/palantir_security/,2020-12-05 15:01,286,266,0.85
2qhhq,investing,jy8rq8,2020-11-21 10:40,Dropbox getting more popular. Opinions?,https://www.reddit.com/r/investing/comments/jy8rq8/dropbox_getting_more_popular_opinions/,2020-12-05 15:01,48,14,0.75
2qhhq,investing,jy9q9u,2020-11-21 12:10,Daily Advice Thread - All basic help or advice questions must be posted here.,https://www.reddit.com/r/investing/comments/jy9q9u/daily_advice_thread_all_basic_help_or_advice/,2020-12-05 15:01,100,20,0.87
2qhhq,investing,jya7es,2020-11-21 12:50,"Can Tesla Solar Roof hurt other utilities companies (NEE, DUK)",https://www.reddit.com/r/investing/comments/jya7es/can_tesla_solar_roof_hurt_other_utilities/,2020-12-05 15:01,23,3,0.62
2qhhq,investing,jybwsv,2020-11-21 14:48,XPEV and Chinese EV market thoughts?,https://www.reddit.com/r/investing/comments/jybwsv/xpev_and_chinese_ev_market_thoughts/,2020-12-05 15:01,43,4,0.59
2qhhq,investing,jyeh16,2020-11-21 17:17,Johnson & Johnson (NYSE: JNJ) - An in-depth Stock Analysis,https://www.reddit.com/r/investing/comments/jyeh16/johnson_johnson_nyse_jnj_an_indepth_stock_analysis/,2020-12-05 15:01,119,1018,0.97
2qhhq,investing,jyhnzw,2020-11-21 20:12,Future of Health & Fitness,https://www.reddit.com/r/investing/comments/jyhnzw/future_of_health_fitness/,2020-12-05 15:01,36,11,0.75
2qhhq,investing,jyi5en,2020-11-21 20:41,Long-term treasury bond yields and the Fed funds rate,https://www.reddit.com/r/investing/comments/jyi5en/longterm_treasury_bond_yields_and_the_fed_funds/,2020-12-05 15:01,24,14,0.78
2qhhq,investing,jypqhd,2020-11-22 04:43,"Will Afterpay, Klarna, Affirm become big enough to disrupt the credit card industry, payment processors, and card networks?",https://www.reddit.com/r/investing/comments/jypqhd/will_afterpay_klarna_affirm_become_big_enough_to/,2020-12-05 15:01,65,89,0.89
2qhhq,investing,jyuc6r,2020-11-22 11:40,Stocks vs. Real Estate,https://www.reddit.com/r/investing/comments/jyuc6r/stocks_vs_real_estate/,2020-12-05 15:01,276,336,0.93
2qhhq,investing,jyupch,2020-11-22 12:11,Daily Advice Thread - All basic help or advice questions must be posted here.,https://www.reddit.com/r/investing/comments/jyupch/daily_advice_thread_all_basic_help_or_advice/,2020-12-05 15:01,106,8,0.73
2qhhq,investing,jyxfkr,2020-11-22 15:29,"When Robinhood users pile into a stock , the average daily return is 14%. But this is followed by a reversal of nearly 5% over the subsequent month",https://www.reddit.com/r/investing/comments/jyxfkr/when_robinhood_users_pile_into_a_stock_the/,2020-12-05 15:01,380,2296,0.98
2qhhq,investing,jyz41n,2020-11-22 17:07,Surging debt during the pandemic is creating dangers for investors and developed countries,https://www.reddit.com/r/investing/comments/jyz41n/surging_debt_during_the_pandemic_is_creating/,2020-12-05 15:01,25,17,0.83
2qhhq,investing,jz1zle,2020-11-22 19:43,How do developing countries manage to pay high interest rate on their foreign currency debt?,https://www.reddit.com/r/investing/comments/jz1zle/how_do_developing_countries_manage_to_pay_high/,2020-12-05 15:01,22,16,0.87
2qhhq,investing,jz4a6r,2020-11-22 21:46,Are there any rules behind stock offerings? It seems like a company could really take advantage of public investors by constantly diluting their ownership,https://www.reddit.com/r/investing/comments/jz4a6r/are_there_any_rules_behind_stock_offerings_it/,2020-12-05 15:01,25,2,0.58
2qhhq,investing,jzczw2,2020-11-23 07:11,AstraZeneca vaccine meets efficacy endpoint,https://www.reddit.com/r/investing/comments/jzczw2/astrazeneca_vaccine_meets_efficacy_endpoint/,2020-12-05 15:01,116,648,0.96
2qhhq,investing,jze46q,2020-11-23 08:47,If you have invested in Palantir PLTR you need to know about lock-up period,https://www.reddit.com/r/investing/comments/jze46q/if_you_have_invested_in_palantir_pltr_you_need_to/,2020-12-05 15:01,59,90,0.81
2qhhq,investing,jzfu55,2020-11-23 11:18,What's the stock that BRK.B could be investing and is trying to hide?,https://www.reddit.com/r/investing/comments/jzfu55/whats_the_stock_that_brkb_could_be_investing_and/,2020-12-05 15:01,222,378,0.93
2qhhq,investing,jzg3og,2020-11-23 11:40,"Alibaba Group CEO backs China's antitrust rules, says 'timely and necessary'",https://www.reddit.com/r/investing/comments/jzg3og/alibaba_group_ceo_backs_chinas_antitrust_rules/,2020-12-05 15:01,31,146,0.9
2qhhq,investing,jzgkd6,2020-11-23 12:16,Daily Advice Thread - All basic help or advice questions must be posted here.,https://www.reddit.com/r/investing/comments/jzgkd6/daily_advice_thread_all_basic_help_or_advice/,2020-12-05 15:01,126,12,0.76
2qhhq,investing,jzhy6f,2020-11-23 13:51,Bloomberg Article: The 60/40 Portfolio Is Muzzling Critics With Another Big Year,https://www.reddit.com/r/investing/comments/jzhy6f/bloomberg_article_the_6040_portfolio_is_muzzling/,2020-12-05 15:01,48,58,0.88
2qhhq,investing,jzhwhf,2020-11-23 13:48,The Tesla Bull Case in Brief,https://www.reddit.com/r/investing/comments/jzhwhf/the_tesla_bull_case_in_brief/,2020-12-05 15:01,135,114,0.82
2qhhq,investing,jzjy9v,2020-11-23 15:44,CRSR 90 RSI,https://www.reddit.com/r/investing/comments/jzjy9v/crsr_90_rsi/,2020-12-05 15:01,25,11,0.74
2qhhq,investing,jzly2f,2020-11-23 17:22,Is there a ‘right’ way to start investing?,https://www.reddit.com/r/investing/comments/jzly2f/is_there_a_right_way_to_start_investing/,2020-12-05 15:01,92,50,0.81
2qhhq,investing,jzphhf,2020-11-23 20:15,Former Fed Chair Janet Yellen reportedly Biden pick for Treasury Secretary,https://www.reddit.com/r/investing/comments/jzphhf/former_fed_chair_janet_yellen_reportedly_biden/,2020-12-05 15:01,400,1730,0.95
2qhhq,investing,jzqa1w,2020-11-23 20:55,A question we don’t see often: How to determine a good exit point?,https://www.reddit.com/r/investing/comments/jzqa1w/a_question_we_dont_see_often_how_to_determine_a/,2020-12-05 15:01,29,63,0.9
2qhhq,investing,jzs6df,2020-11-23 22:31,I feel some stocks in this market are going crazy. Does anyone agree?,https://www.reddit.com/r/investing/comments/jzs6df/i_feel_some_stocks_in_this_market_are_going_crazy/,2020-12-05 15:01,112,71,0.84
2qhhq,investing,jztqsq,2020-11-23 23:57,Gold Vs Bitcoin,https://www.reddit.com/r/investing/comments/jztqsq/gold_vs_bitcoin/,2020-12-05 15:01,151,16,0.65
2qhhq,investing,jztu9k,2020-11-24 00:03,Is this market of exploding stocks (EVs) the norm? Asking from a newbie perspective,https://www.reddit.com/r/investing/comments/jztu9k/is_this_market_of_exploding_stocks_evs_the_norm/,2020-12-05 15:01,22,1,0.54
2qhhq,investing,jzvy03,2020-11-24 02:08,Attention Robinhood power users: Most day traders lose money,https://www.reddit.com/r/investing/comments/jzvy03/attention_robinhood_power_users_most_day_traders/,2020-12-05 15:01,97,188,0.84
2qhhq,investing,jzwatg,2020-11-24 02:30,"CRSR- At what point would you say ""time to sell?""",https://www.reddit.com/r/investing/comments/jzwatg/crsr_at_what_point_would_you_say_time_to_sell/,2020-12-05 15:01,29,18,0.82
2qhhq,investing,k002id,2020-11-24 06:52,Situation of gold. Bulk or more bear?,https://www.reddit.com/r/investing/comments/k002id/situation_of_gold_bulk_or_more_bear/,2020-12-05 15:01,26,8,0.7
2qhhq,investing,k03uph,2020-11-24 12:10,Daily Advice Thread - All basic help or advice questions must be posted here.,https://www.reddit.com/r/investing/comments/k03uph/daily_advice_thread_all_basic_help_or_advice/,2020-12-05 15:01,169,15,0.9
2qhhq,investing,k07xcl,2020-11-24 16:14,"Apple itself, where do you see it in 10 years?",https://www.reddit.com/r/investing/comments/k07xcl/apple_itself_where_do_you_see_it_in_10_years/,2020-12-05 15:01,52,8,0.62
2qhhq,investing,k089w6,2020-11-24 16:31,Oil prices hit highest level since March on vaccine hopes,https://www.reddit.com/r/investing/comments/k089w6/oil_prices_hit_highest_level_since_march_on/,2020-12-05 15:01,34,39,0.86
2qhhq,investing,k08gnz,2020-11-24 16:40,"Dow Crosses 30,000 mark-first time ever",https://www.reddit.com/r/investing/comments/k08gnz/dow_crosses_30000_markfirst_time_ever/,2020-12-05 15:01,703,1941,0.97
2qhhq,investing,k0a4gj,2020-11-24 18:02,Tesla up 24% since last week and up 30% from the previous month,https://www.reddit.com/r/investing/comments/k0a4gj/tesla_up_24_since_last_week_and_up_30_from_the/,2020-12-05 15:01,351,226,0.95
2qhhq,investing,k0azmy,2020-11-24 18:45,"Dicks (DKS) is really low, good opportunity to buy",https://www.reddit.com/r/investing/comments/k0azmy/dicks_dks_is_really_low_good_opportunity_to_buy/,2020-12-05 15:01,22,0,0.38
2qhhq,investing,k0brmw,2020-11-24 19:22,Stock picking does work,https://www.reddit.com/r/investing/comments/k0brmw/stock_picking_does_work/,2020-12-05 15:01,25,0,0.35
2qhhq,investing,k0c2le,2020-11-24 19:37,Why aren't there US-state specific ETFs?,https://www.reddit.com/r/investing/comments/k0c2le/why_arent_there_usstate_specific_etfs/,2020-12-05 15:01,22,13,0.76
2qhhq,investing,k0ckwx,2020-11-24 20:02,Square and PayPal may be the new whales in the crypto market as clients flock to buy bitcoin,https://www.reddit.com/r/investing/comments/k0ckwx/square_and_paypal_may_be_the_new_whales_in_the/,2020-12-05 15:01,87,149,0.92
2qhhq,investing,k0dcje,2020-11-24 20:43,Opinion - Biotech is going to skyrocket in upcoming years.,https://www.reddit.com/r/investing/comments/k0dcje/opinion_biotech_is_going_to_skyrocket_in_upcoming/,2020-12-05 15:01,21,15,0.83
2qhhq,investing,k0dcz3,2020-11-24 20:43,"CMV: The technology sector is not overvalued - the tech industry is revolutionizing society, investing included.",https://www.reddit.com/r/investing/comments/k0dcz3/cmv_the_technology_sector_is_not_overvalued_the/,2020-12-05 15:01,27,19,0.75
2qhhq,investing,k0eciu,2020-11-24 21:35,"With Bitcoin up 50% on 1-month chart, its market cap is now at an all-time high.",https://www.reddit.com/r/investing/comments/k0eciu/with_bitcoin_up_50_on_1month_chart_its_market_cap/,2020-12-05 15:01,70,47,0.75
2qhhq,investing,k0ficn,2020-11-24 22:38,How do we feel about Shopify?,https://www.reddit.com/r/investing/comments/k0ficn/how_do_we_feel_about_shopify/,2020-12-05 15:01,29,26,0.77
2qhhq,investing,k0guph,2020-11-24 23:56,Value stocks that haven't rallied yet?,https://www.reddit.com/r/investing/comments/k0guph/value_stocks_that_havent_rallied_yet/,2020-12-05 15:01,73,22,0.78
2qhhq,investing,k0gys8,2020-11-25 00:03,ABNB (Airbnb) IPO. is it a buy?,https://www.reddit.com/r/investing/comments/k0gys8/abnb_airbnb_ipo_is_it_a_buy/,2020-12-05 15:01,84,44,0.79
2qhhq,investing,k0jkp7,2020-11-25 02:45,What do you guys think about Bitcoin?,https://www.reddit.com/r/investing/comments/k0jkp7/what_do_you_guys_think_about_bitcoin/,2020-12-05 15:01,339,37,0.65
2qhhq,investing,k0l7ox,2020-11-25 04:33,Could a stop loss have saved you from luckin coffee?,https://www.reddit.com/r/investing/comments/k0l7ox/could_a_stop_loss_have_saved_you_from_luckin/,2020-12-05 15:01,23,0,0.33
2qhhq,investing,k0ooxn,2020-11-25 08:57,What are your thoughts on Nissan?,https://www.reddit.com/r/investing/comments/k0ooxn/what_are_your_thoughts_on_nissan/,2020-12-05 15:01,69,22,0.73
2qhhq,investing,k0qn1k,2020-11-25 11:37,"Uber, Lyft, Doordash Can Pay Gig Workers Up To 15% Compensation in Stock Under New SEC proposal",https://www.reddit.com/r/investing/comments/k0qn1k/uber_lyft_doordash_can_pay_gig_workers_up_to_15/,2020-12-05 15:01,362,1148,0.97
2qhhq,investing,k0r2x0,2020-11-25 12:11,Daily Advice Thread - All basic help or advice questions must be posted here.,https://www.reddit.com/r/investing/comments/k0r2x0/daily_advice_thread_all_basic_help_or_advice/,2020-12-05 15:01,139,12,0.81
2qhhq,investing,k0rncx,2020-11-25 12:53,Cloudflare Insider sales - What does it mean?,https://www.reddit.com/r/investing/comments/k0rncx/cloudflare_insider_sales_what_does_it_mean/,2020-12-05 15:01,30,23,0.82
2qhhq,investing,k0skoz,2020-11-25 13:55,"Jobless claims: Another 778,000 workers filed for unemployment",https://www.reddit.com/r/investing/comments/k0skoz/jobless_claims_another_778000_workers_filed_for/,2020-12-05 15:01,51,66,0.93
2qhhq,investing,k0sqty,2020-11-25 14:05,Does Palantir have a scaling issue going forward?,https://www.reddit.com/r/investing/comments/k0sqty/does_palantir_have_a_scaling_issue_going_forward/,2020-12-05 15:01,97,82,0.82
2qhhq,investing,k0v9ev,2020-11-25 16:27,Crypto plays,https://www.reddit.com/r/investing/comments/k0v9ev/crypto_plays/,2020-12-05 15:01,61,14,0.72
2qhhq,investing,k0vy12,2020-11-25 17:01,Slack Technologies (WORK) reportedly has been in talks to get acquired by Salesforce (CRM),https://www.reddit.com/r/investing/comments/k0vy12/slack_technologies_work_reportedly_has_been_in/,2020-12-05 15:01,157,404,0.97
2qhhq,investing,k0wett,2020-11-25 17:24,APXT: Merging with AvePoint,https://www.reddit.com/r/investing/comments/k0wett/apxt_merging_with_avepoint/,2020-12-05 15:01,25,68,0.91
2qhhq,investing,k0wtau,2020-11-25 17:43,Tesla's vehicle deliveries and recalls (DD),https://www.reddit.com/r/investing/comments/k0wtau/teslas_vehicle_deliveries_and_recalls_dd/,2020-12-05 15:01,40,22,0.73
2qhhq,investing,k11l0f,2020-11-25 21:41,Is there a way to easily and affordably DCA into Bitcoin?,https://www.reddit.com/r/investing/comments/k11l0f/is_there_a_way_to_easily_and_affordably_dca_into/,2020-12-05 15:01,63,3,0.62
2qhhq,investing,k12e0q,2020-11-25 22:22,No one interested in oil companies anymore?,https://www.reddit.com/r/investing/comments/k12e0q/no_one_interested_in_oil_companies_anymore/,2020-12-05 15:01,35,0,0.4
2qhhq,investing,k14izc,2020-11-26 00:20,S&P 500 index has more risk than ever thanks to TSLA inclusion,https://www.reddit.com/r/investing/comments/k14izc/sp_500_index_has_more_risk_than_ever_thanks_to/,2020-12-05 15:01,75,0,0.48
2qhhq,investing,k14lm3,2020-11-26 00:24,BEWARE..Greed is at all time high!,https://www.reddit.com/r/investing/comments/k14lm3/bewaregreed_is_at_all_time_high/,2020-12-05 15:01,35,16,0.65
2qhhq,investing,k16zj0,2020-11-26 02:57,I really want to buy PLTR. But would like to have better clarity on why the company is seemed controversial in the eyes of some? Is it at risk of lower ESG ratings? Or being excluded from popular ETFs.,https://www.reddit.com/r/investing/comments/k16zj0/i_really_want_to_buy_pltr_but_would_like_to_have/,2020-12-05 15:01,67,4,0.56
2qhhq,investing,k17akp,2020-11-26 03:18,202.56M shares traded hands on PLTR today,https://www.reddit.com/r/investing/comments/k17akp/20256m_shares_traded_hands_on_pltr_today/,2020-12-05 15:01,503,1411,0.96
2qhhq,investing,k19efy,2020-11-26 05:42,WHY to exit a position vs. WHEN to exit a position.,https://www.reddit.com/r/investing/comments/k19efy/why_to_exit_a_position_vs_when_to_exit_a_position/,2020-12-05 15:01,33,30,0.76
2qhhq,investing,k1ar59,2020-11-26 07:24,"I just went all in on THCB, and you should too",https://www.reddit.com/r/investing/comments/k1ar59/i_just_went_all_in_on_thcb_and_you_should_too/,2020-12-05 15:01,69,74,0.73
2qhhq,investing,k1chqh,2020-11-26 09:50,"Question from a rookie, what do you guys think will happen to Tesla next month?",https://www.reddit.com/r/investing/comments/k1chqh/question_from_a_rookie_what_do_you_guys_think/,2020-12-05 15:01,30,0,0.43
2qhhq,investing,k1e64o,2020-11-26 12:09,Daily Advice Thread - All basic help or advice questions must be posted here.,https://www.reddit.com/r/investing/comments/k1e64o/daily_advice_thread_all_basic_help_or_advice/,2020-12-05 15:01,114,7,0.79
2qhhq,investing,k1ecma,2020-11-26 12:23,Wall Street Dealers in Hedging Frenzy Get Blamed for Volatility,https://www.reddit.com/r/investing/comments/k1ecma/wall_street_dealers_in_hedging_frenzy_get_blamed/,2020-12-05 15:01,20,42,0.88
