Subreddit_ID,Subreddit_Name,Submission_ID,Submission_CreatedDate,Submission_Title,Submission_URL,Submission_LastFetched,Submission_NumComments,Submission_Score,Submission_UpvoteRatio
2qjfk,stocks,kvv36k,2021-01-12 16:36,ICLN - Love it or hate it?,https://www.reddit.com/r/stocks/comments/kvv36k/icln_love_it_or_hate_it/,2021-01-20 21:12,64,58,0.88
2qjfk,stocks,kvvi7b,2021-01-12 16:57,Is DraftKings a good investment for the next 1-3 years? I really believe it will take off once the sports return.,https://www.reddit.com/r/stocks/comments/kvvi7b/is_draftkings_a_good_investment_for_the_next_13/,2021-01-20 21:12,78,67,0.87
2qjfk,stocks,kvvxv2,2021-01-12 17:17,AMZN,https://www.reddit.com/r/stocks/comments/kvvxv2/amzn/,2021-01-20 21:12,20,5,0.73
2qjfk,stocks,kvw06f,2021-01-12 17:20,Buy APPLE at the current DIP?,https://www.reddit.com/r/stocks/comments/kvw06f/buy_apple_at_the_current_dip/,2021-01-20 21:12,123,89,0.85
2qjfk,stocks,kvwi9r,2021-01-12 17:44,I legitimately need some advice with TSLA,https://www.reddit.com/r/stocks/comments/kvwi9r/i_legitimately_need_some_advice_with_tsla/,2021-01-20 21:12,37,5,0.73
2qjfk,stocks,kvwpwy,2021-01-12 17:54,NIO long term investment viability,https://www.reddit.com/r/stocks/comments/kvwpwy/nio_long_term_investment_viability/,2021-01-20 21:12,51,39,0.91
2qjfk,stocks,kvwrs2,2021-01-12 17:57,Thoughts on Starbucks SBUX,https://www.reddit.com/r/stocks/comments/kvwrs2/thoughts_on_starbucks_sbux/,2021-01-20 21:12,21,3,1.0
2qjfk,stocks,kvx6b2,2021-01-12 18:16,PTON value is out of this world...,https://www.reddit.com/r/stocks/comments/kvx6b2/pton_value_is_out_of_this_world/,2021-01-20 21:12,46,16,0.75
2qjfk,stocks,kvxseg,2021-01-12 18:44,Is it too late to invest in Tesla?,https://www.reddit.com/r/stocks/comments/kvxseg/is_it_too_late_to_invest_in_tesla/,2021-01-20 21:12,27,0,0.4
2qjfk,stocks,kvxvgw,2021-01-12 18:49,"Please do something about these ""Recommend me stocks"" posts being submitted everyday.",https://www.reddit.com/r/stocks/comments/kvxvgw/please_do_something_about_these_recommend_me/,2021-01-20 21:12,455,3443,0.91
2qjfk,stocks,kvy8jd,2021-01-12 19:06,DOORDASH? WHAT THE ACTUAL F?,https://www.reddit.com/r/stocks/comments/kvy8jd/doordash_what_the_actual_f/,2021-01-20 21:12,47,20,0.83
2qjfk,stocks,kvyh8l,2021-01-12 19:17,Next renewable energy stock to explode?,https://www.reddit.com/r/stocks/comments/kvyh8l/next_renewable_energy_stock_to_explode/,2021-01-20 21:12,31,9,0.81
2qjfk,stocks,kw18b4,2021-01-12 21:31,"Biolase (BOIL) Cheap stock blowing up, anyone else heard of it?",https://www.reddit.com/r/stocks/comments/kw18b4/biolase_boil_cheap_stock_blowing_up_anyone_else/,2021-01-20 21:12,22,9,0.81
2qjfk,stocks,kw1oyc,2021-01-12 21:53,I love the stock market.,https://www.reddit.com/r/stocks/comments/kw1oyc/i_love_the_stock_market/,2021-01-20 21:12,177,357,0.9
2qjfk,stocks,kw27pt,2021-01-12 22:18,MSFT stuck at resistance —what to do ?,https://www.reddit.com/r/stocks/comments/kw27pt/msft_stuck_at_resistance_what_to_do/,2021-01-20 21:12,23,1,0.6
2qjfk,stocks,kw2cae,2021-01-12 22:24,Mysterious big announcement coming from Apple tomorrow,https://www.reddit.com/r/stocks/comments/kw2cae/mysterious_big_announcement_coming_from_apple/,2021-01-20 21:12,71,62,0.97
2qjfk,stocks,kw2o1v,2021-01-12 22:40,Apple held talks with EV startup Canoo ($GOEV) in 2020 - 14% up in after hours,https://www.reddit.com/r/stocks/comments/kw2o1v/apple_held_talks_with_ev_startup_canoo_goev_in/,2021-01-20 21:12,40,63,0.88
2qjfk,stocks,kw2xed,2021-01-12 22:54,About to lose all of my ENPH and I’m not sure what to do,https://www.reddit.com/r/stocks/comments/kw2xed/about_to_lose_all_of_my_enph_and_im_not_sure_what/,2021-01-20 21:12,28,4,0.84
2qjfk,stocks,kw3xke,2021-01-12 23:45,Affirm To IPO Tomorrow At $12.3 Billion Valuation - Buy Or Sell?,https://www.reddit.com/r/stocks/comments/kw3xke/affirm_to_ipo_tomorrow_at_123_billion_valuation/,2021-01-20 21:12,77,111,0.94
2qjfk,stocks,kw4kr7,2021-01-13 00:19,What stock communities are the worst ?,https://www.reddit.com/r/stocks/comments/kw4kr7/what_stock_communities_are_the_worst/,2021-01-20 21:12,38,5,0.86
2qjfk,stocks,kw654q,2021-01-13 01:46,Can Someone Explain The Tesla Stock?,https://www.reddit.com/r/stocks/comments/kw654q/can_someone_explain_the_tesla_stock/,2021-01-20 21:12,28,2,0.58
2qjfk,stocks,kw6poj,2021-01-13 02:18,"Account size, age, reasons and dreams",https://www.reddit.com/r/stocks/comments/kw6poj/account_size_age_reasons_and_dreams/,2021-01-20 21:12,27,7,0.75
2qjfk,stocks,kw7uzm,2021-01-13 03:24,When should you open a real brokerage account after starting with roobinhood?,https://www.reddit.com/r/stocks/comments/kw7uzm/when_should_you_open_a_real_brokerage_account/,2021-01-20 21:12,21,1,0.67
2qjfk,stocks,kw7vyw,2021-01-13 03:25,"Do you think Biden’s inauguration will spark riots, causing a dip?",https://www.reddit.com/r/stocks/comments/kw7vyw/do_you_think_bidens_inauguration_will_spark_riots/,2021-01-20 21:12,34,0,0.41
2qjfk,stocks,kw8m7x,2021-01-13 04:08,Why is GPRO soo low? Shouldn't this stock have a market cap of 5B+?,https://www.reddit.com/r/stocks/comments/kw8m7x/why_is_gpro_soo_low_shouldnt_this_stock_have_a/,2021-01-20 21:12,21,2,0.59
2qjfk,stocks,kw8o6i,2021-01-13 04:11,Do you think there will be a big arkk & arkg dip in 2021?,https://www.reddit.com/r/stocks/comments/kw8o6i/do_you_think_there_will_be_a_big_arkk_arkg_dip_in/,2021-01-20 21:12,27,3,0.67
2qjfk,stocks,kw8ttd,2021-01-13 04:20,Is ARKK only bullish because of the hype and money pumping in from investors?,https://www.reddit.com/r/stocks/comments/kw8ttd/is_arkk_only_bullish_because_of_the_hype_and/,2021-01-20 21:12,48,38,0.81
2qjfk,stocks,kwc14d,2021-01-13 08:00,"r/Stocks Daily Discussion Wednesday - Jan 13, 2021",https://www.reddit.com/r/stocks/comments/kwc14d/rstocks_daily_discussion_wednesday_jan_13_2021/,2021-01-20 21:12,717,39,0.9
2qjfk,stocks,kwdf7x,2021-01-13 09:55,JPMorgan names ‘extremely cheap’ stocks in a market with room to rise,https://www.reddit.com/r/stocks/comments/kwdf7x/jpmorgan_names_extremely_cheap_stocks_in_a_market/,2021-01-20 21:12,20,10,0.63
2qjfk,stocks,kwdkl7,2021-01-13 10:07,Any opinions on ICLN?,https://www.reddit.com/r/stocks/comments/kwdkl7/any_opinions_on_icln/,2021-01-20 21:12,26,9,0.64
2qjfk,stocks,kwf6yh,2021-01-13 12:09,"MSFT, APPL, GOOGL - worth holding all of them?",https://www.reddit.com/r/stocks/comments/kwf6yh/msft_appl_googl_worth_holding_all_of_them/,2021-01-20 21:12,106,39,0.82
2qjfk,stocks,kwfuzv,2021-01-13 12:54,Stock Market News for Today | PLUG Power & GM | TSLA vs AAPL| AFRM & other Stock Market News [01-13],https://www.reddit.com/r/stocks/comments/kwfuzv/stock_market_news_for_today_plug_power_gm_tsla_vs/,2021-01-20 21:12,51,141,0.96
2qjfk,stocks,kwgkt3,2021-01-13 13:38,"Invested in too many stocks(81 stocks!), need help trimming it down",https://www.reddit.com/r/stocks/comments/kwgkt3/invested_in_too_many_stocks81_stocks_need_help/,2021-01-20 21:12,20,1,0.55
2qjfk,stocks,kwgrp6,2021-01-13 13:49,What are your Biden stocks for the next few years?,https://www.reddit.com/r/stocks/comments/kwgrp6/what_are_your_biden_stocks_for_the_next_few_years/,2021-01-20 21:12,20,1,0.56
2qjfk,stocks,kwh4uh,2021-01-13 14:10,Prospects of another insurrection and it’s affects ?,https://www.reddit.com/r/stocks/comments/kwh4uh/prospects_of_another_insurrection_and_its_affects/,2021-01-20 21:12,22,0,0.5
2qjfk,stocks,kwh6f4,2021-01-13 14:13,"$INTC up 14% premarket | Intel CEO Bob Swan to step down in February, VMware CEO Pat Gelsinger to replace him,",https://www.reddit.com/r/stocks/comments/kwh6f4/intc_up_14_premarket_intel_ceo_bob_swan_to_step/,2021-01-20 21:12,216,851,0.97
2qjfk,stocks,kwhmtw,2021-01-13 14:37,FedEx down 15% last month after record earnings,https://www.reddit.com/r/stocks/comments/kwhmtw/fedex_down_15_last_month_after_record_earnings/,2021-01-20 21:12,23,28,0.9
2qjfk,stocks,kwhxww,2021-01-13 14:53,Plug power - do you trust it’s fuel cell technology?,https://www.reddit.com/r/stocks/comments/kwhxww/plug_power_do_you_trust_its_fuel_cell_technology/,2021-01-20 21:12,48,43,0.83
2qjfk,stocks,kwj4kw,2021-01-13 15:50,BlackBerry - anyone holding this one long?,https://www.reddit.com/r/stocks/comments/kwj4kw/blackberry_anyone_holding_this_one_long/,2021-01-20 21:12,30,51,0.94
2qjfk,stocks,kwj79s,2021-01-13 15:54,Recent AMD decline,https://www.reddit.com/r/stocks/comments/kwj79s/recent_amd_decline/,2021-01-20 21:12,20,2,0.67
2qjfk,stocks,kwj7jz,2021-01-13 15:54,GME short squeeze +40%,https://www.reddit.com/r/stocks/comments/kwj7jz/gme_short_squeeze_40/,2021-01-20 21:12,384,410,0.96
2qjfk,stocks,kwklxi,2021-01-13 17:00,Is it time to sell PLUG?,https://www.reddit.com/r/stocks/comments/kwklxi/is_it_time_to_sell_plug/,2021-01-20 21:12,28,1,0.55
2qjfk,stocks,kwkztn,2021-01-13 17:17,KTOS and its bright future,https://www.reddit.com/r/stocks/comments/kwkztn/ktos_and_its_bright_future/,2021-01-20 21:12,46,49,0.96
2qjfk,stocks,kwlk4y,2021-01-13 17:42,"Nvidia reveals cheaper chip for desktops, new gaming laptops that could avoid supply crunch",https://www.reddit.com/r/stocks/comments/kwlk4y/nvidia_reveals_cheaper_chip_for_desktops_new/,2021-01-20 21:12,24,97,0.96
2qjfk,stocks,kwln0u,2021-01-13 17:45,Civil War/Hillbilly Apocalypse Picks?,https://www.reddit.com/r/stocks/comments/kwln0u/civil_warhillbilly_apocalypse_picks/,2021-01-20 21:12,28,0,0.4
2qjfk,stocks,kwlu3r,2021-01-13 17:54,When will Roblox Go Public??,https://www.reddit.com/r/stocks/comments/kwlu3r/when_will_roblox_go_public/,2021-01-20 21:12,72,42,0.81
2qjfk,stocks,kwm8pt,2021-01-13 18:13,100% of my portfolio is VTSAX.... Should I buy single stocks (AAPL)?,https://www.reddit.com/r/stocks/comments/kwm8pt/100_of_my_portfolio_is_vtsax_should_i_buy_single/,2021-01-20 21:12,30,6,0.69
2qjfk,stocks,kwmci6,2021-01-13 18:18,Clean energy stock discussion,https://www.reddit.com/r/stocks/comments/kwmci6/clean_energy_stock_discussion/,2021-01-20 21:12,69,17,0.79
2qjfk,stocks,kwmilg,2021-01-13 18:26,"Battery Recycling is quickly growing market. AQMS, ABML",https://www.reddit.com/r/stocks/comments/kwmilg/battery_recycling_is_quickly_growing_market_aqms/,2021-01-20 21:12,22,26,0.84
2qjfk,stocks,kwmolz,2021-01-13 18:33,$AKBA DOD Funding News Drop and JP Morgan presentation today @ 2:50PM EST,https://www.reddit.com/r/stocks/comments/kwmolz/akba_dod_funding_news_drop_and_jp_morgan/,2021-01-20 21:12,80,272,0.96
2qjfk,stocks,kwn6ux,2021-01-13 18:57,Alibaba Now Also Entering EV Market,https://www.reddit.com/r/stocks/comments/kwn6ux/alibaba_now_also_entering_ev_market/,2021-01-20 21:12,114,151,0.95
2qjfk,stocks,kwpxbt,2021-01-13 21:06,These are the stocks Cathie Wood is buying and selling recently,https://www.reddit.com/r/stocks/comments/kwpxbt/these_are_the_stocks_cathie_wood_is_buying_and/,2021-01-20 21:12,108,272,0.95
2qjfk,stocks,kwpxmn,2021-01-13 21:07,GME Growth?,https://www.reddit.com/r/stocks/comments/kwpxmn/gme_growth/,2021-01-20 21:12,24,0,0.48
2qjfk,stocks,kwr7ef,2021-01-13 22:06,ARKX. ARK invest Space Exploration ETF. SEC Filiing below,https://www.reddit.com/r/stocks/comments/kwr7ef/arkx_ark_invest_space_exploration_etf_sec_filiing/,2021-01-20 21:12,3025,3893,0.93
2qjfk,stocks,kwrcya,2021-01-13 22:14,BP - a very simple case.,https://www.reddit.com/r/stocks/comments/kwrcya/bp_a_very_simple_case/,2021-01-20 21:12,20,21,0.85
2qjfk,stocks,kws61w,2021-01-13 22:54,How much cash do you guys have?,https://www.reddit.com/r/stocks/comments/kws61w/how_much_cash_do_you_guys_have/,2021-01-20 21:12,44,0,0.5
2qjfk,stocks,kwt8wx,2021-01-13 23:45,I have some questions for pros out there,https://www.reddit.com/r/stocks/comments/kwt8wx/i_have_some_questions_for_pros_out_there/,2021-01-20 21:12,21,4,0.7
2qjfk,stocks,kwupdp,2021-01-14 01:03,"I love this sub and it helped me alot. I want to give you something back, so here is my gift called Ehang ($EH).",https://www.reddit.com/r/stocks/comments/kwupdp/i_love_this_sub_and_it_helped_me_alot_i_want_to/,2021-01-20 21:12,46,17,0.73
2qjfk,stocks,kwuupj,2021-01-14 01:11,"Do you ever take out your Initial investment, leave profits in?",https://www.reddit.com/r/stocks/comments/kwuupj/do_you_ever_take_out_your_initial_investment/,2021-01-20 21:12,23,19,0.85
2qjfk,stocks,kwvam1,2021-01-14 01:36,"5,7 million return on GME. How do you even get out of a trade like this without crashing the stock before you sold it all?",https://www.reddit.com/r/stocks/comments/kwvam1/57_million_return_on_gme_how_do_you_even_get_out/,2021-01-20 21:12,56,42,0.93
2qjfk,stocks,kww5hm,2021-01-14 02:24,Arkx and possible holdings,https://www.reddit.com/r/stocks/comments/kww5hm/arkx_and_possible_holdings/,2021-01-20 21:12,20,9,0.81
2qjfk,stocks,kwwck3,2021-01-14 02:35,$POSH to IPO Tomorrow at $42. What are your thoughts on this one?,https://www.reddit.com/r/stocks/comments/kwwck3/posh_to_ipo_tomorrow_at_42_what_are_your_thoughts/,2021-01-20 21:12,23,26,0.97
2qjfk,stocks,kwwuu3,2021-01-14 03:04,Debating when to buy pltr,https://www.reddit.com/r/stocks/comments/kwwuu3/debating_when_to_buy_pltr/,2021-01-20 21:12,35,17,0.79
2qjfk,stocks,kwxh60,2021-01-14 03:39,What does everyone being an investor now mean for stock values?,https://www.reddit.com/r/stocks/comments/kwxh60/what_does_everyone_being_an_investor_now_mean_for/,2021-01-20 21:12,40,24,0.91
2qjfk,stocks,kwyeb4,2021-01-14 04:33,NIO vs PLTR allocation.,https://www.reddit.com/r/stocks/comments/kwyeb4/nio_vs_pltr_allocation/,2021-01-20 21:12,22,2,0.58
2qjfk,stocks,kwzlme,2021-01-14 05:51,Getting back into Stocks/ETF's,https://www.reddit.com/r/stocks/comments/kwzlme/getting_back_into_stocksetfs/,2021-01-20 21:12,23,0,0.33
2qjfk,stocks,kx09uv,2021-01-14 06:38,Is gold the next 🚀🚀🚀???,https://www.reddit.com/r/stocks/comments/kx09uv/is_gold_the_next/,2021-01-20 21:12,23,0,0.43
2qjfk,stocks,kx18v6,2021-01-14 07:52,ELI5 $GME 57% Gain 1/13/21,https://www.reddit.com/r/stocks/comments/kx18v6/eli5_gme_57_gain_11321/,2021-01-20 21:12,30,9,0.74
2qjfk,stocks,kx1c10,2021-01-14 08:00,"r/Stocks Daily Discussion & Options Trading Thursday - Jan 14, 2021",https://www.reddit.com/r/stocks/comments/kx1c10/rstocks_daily_discussion_options_trading_thursday/,2021-01-20 21:12,805,34,0.9
2qjfk,stocks,kx38a3,2021-01-14 10:35,FOOD gene editing stocks UPDATE!,https://www.reddit.com/r/stocks/comments/kx38a3/food_gene_editing_stocks_update/,2021-01-20 21:12,52,92,0.96
2qjfk,stocks,kx50lg,2021-01-14 12:49,Game stop “short squeeze”,https://www.reddit.com/r/stocks/comments/kx50lg/game_stop_short_squeeze/,2021-01-20 21:12,133,71,0.88
2qjfk,stocks,kx57p4,2021-01-14 13:02,"Stock Market News for Today | GME Squeeze | BABA, INTC, TGT, AFRM & other Stock Market News [01-14]",https://www.reddit.com/r/stocks/comments/kx57p4/stock_market_news_for_today_gme_squeeze_baba_intc/,2021-01-20 21:12,81,117,0.94
2qjfk,stocks,kx6mkw,2021-01-14 14:27,Tesla's Model Y wins 5-star safety rating from NHTSA,https://www.reddit.com/r/stocks/comments/kx6mkw/teslas_model_y_wins_5star_safety_rating_from_nhtsa/,2021-01-20 21:12,68,401,0.92
2qjfk,stocks,kx7moh,2021-01-14 15:20,"Plant based meat Very Good Food Company, American Ticker VRYYF",https://www.reddit.com/r/stocks/comments/kx7moh/plant_based_meat_very_good_food_company_american/,2021-01-20 21:12,22,32,0.79
2qjfk,stocks,kx8edi,2021-01-14 15:59,Did I invest too much in one lump sum?,https://www.reddit.com/r/stocks/comments/kx8edi/did_i_invest_too_much_in_one_lump_sum/,2021-01-20 21:12,72,22,0.81
2qjfk,stocks,kx8xfv,2021-01-14 16:25,Cannabis stocks worth it?,https://www.reddit.com/r/stocks/comments/kx8xfv/cannabis_stocks_worth_it/,2021-01-20 21:12,63,19,0.89
2qjfk,stocks,kxa439,2021-01-14 17:22,Would You Buy Into NIO At Current Share Price?,https://www.reddit.com/r/stocks/comments/kxa439/would_you_buy_into_nio_at_current_share_price/,2021-01-20 21:12,41,7,0.77
2qjfk,stocks,kxa9r4,2021-01-14 17:29,"After 8 months of trial and error, hundreds of hours of Youtube, losing money, almost giving up, I can finally say I made my first $100 trading stocks",https://www.reddit.com/r/stocks/comments/kxa9r4/after_8_months_of_trial_and_error_hundreds_of/,2021-01-20 21:12,1212,6668,0.84
2qjfk,stocks,kxasss,2021-01-14 17:55,Anyone selling PLUG at this point?,https://www.reddit.com/r/stocks/comments/kxasss/anyone_selling_plug_at_this_point/,2021-01-20 21:12,36,22,0.96
2qjfk,stocks,kxepm4,2021-01-14 21:02,Alibaba (BABA) is 🚀 on steroids!,https://www.reddit.com/r/stocks/comments/kxepm4/alibaba_baba_is_on_steroids/,2021-01-20 21:12,38,64,0.79
2qjfk,stocks,kxfquo,2021-01-14 21:54,Is AAL (American Airlines) an obvious buy right now?,https://www.reddit.com/r/stocks/comments/kxfquo/is_aal_american_airlines_an_obvious_buy_right_now/,2021-01-20 21:12,27,11,0.87
2qjfk,stocks,kxfz73,2021-01-14 22:05,Biden 1.9T Plan Unveiled - We will have to wait until February for any supposed Infrastructure Plan. This is strictly covid relief. Link to plan below.,https://www.reddit.com/r/stocks/comments/kxfz73/biden_19t_plan_unveiled_we_will_have_to_wait/,2021-01-20 21:12,70,45,0.93
2qjfk,stocks,kxg2ba,2021-01-14 22:09,New Biden Education Stimulus - Good Education Stocks To Buy?,https://www.reddit.com/r/stocks/comments/kxg2ba/new_biden_education_stimulus_good_education/,2021-01-20 21:12,24,15,0.9
2qjfk,stocks,kxgbcs,2021-01-14 22:21,Trump administration adds Comac and Xiaomi to China military blacklist. Stocks will delist in November.,https://www.reddit.com/r/stocks/comments/kxgbcs/trump_administration_adds_comac_and_xiaomi_to/,2021-01-20 21:12,23,11,0.87
2qjfk,stocks,kxgo35,2021-01-14 22:38,Lumen $LUMN is the next Michael Burry play if you missed $GME,https://www.reddit.com/r/stocks/comments/kxgo35/lumen_lumn_is_the_next_michael_burry_play_if_you/,2021-01-20 21:12,20,30,0.88
2qjfk,stocks,kxi8rf,2021-01-14 23:59,Anyone here buy and hold the most hyped stocks on Reddit from 3-5 years ago? How has that turned out?,https://www.reddit.com/r/stocks/comments/kxi8rf/anyone_here_buy_and_hold_the_most_hyped_stocks_on/,2021-01-20 21:12,26,10,0.74
2qjfk,stocks,kxijrw,2021-01-15 00:15,Could Nikola become a mini Tesla of the hydrogen world?,https://www.reddit.com/r/stocks/comments/kxijrw/could_nikola_become_a_mini_tesla_of_the_hydrogen/,2021-01-20 21:12,24,0,0.36
2qjfk,stocks,kxio78,2021-01-15 00:22,"Aphria (AHPA) was my first stock I ever bought, today it went huge and I’m so excited.",https://www.reddit.com/r/stocks/comments/kxio78/aphria_ahpa_was_my_first_stock_i_ever_bought/,2021-01-20 21:12,36,52,0.85
2qjfk,stocks,kxiwgs,2021-01-15 00:34,ARK investments just purchased 500k worth of Palantir stock (PLTR),https://www.reddit.com/r/stocks/comments/kxiwgs/ark_investments_just_purchased_500k_worth_of/,2021-01-20 21:12,282,971,0.96
2qjfk,stocks,kxj08o,2021-01-15 00:40,What are your top 3 stocks to watch for the next 3-5 years?,https://www.reddit.com/r/stocks/comments/kxj08o/what_are_your_top_3_stocks_to_watch_for_the_next/,2021-01-20 21:12,70,22,0.8
2qjfk,stocks,kxk5jw,2021-01-15 01:44,How do I restrain myself from not selling stocks that have gains?,https://www.reddit.com/r/stocks/comments/kxk5jw/how_do_i_restrain_myself_from_not_selling_stocks/,2021-01-20 21:12,43,11,0.8
2qjfk,stocks,kxkgds,2021-01-15 02:01,Stocks to buy pre-inauguration?,https://www.reddit.com/r/stocks/comments/kxkgds/stocks_to_buy_preinauguration/,2021-01-20 21:12,22,9,0.77
2qjfk,stocks,kxkkqo,2021-01-15 02:08,Which stocks would you buy if a market correction happens?,https://www.reddit.com/r/stocks/comments/kxkkqo/which_stocks_would_you_buy_if_a_market_correction/,2021-01-20 21:12,23,3,0.71
2qjfk,stocks,kxlh0f,2021-01-15 03:00,Any thoughts on WOOF?,https://www.reddit.com/r/stocks/comments/kxlh0f/any_thoughts_on_woof/,2021-01-20 21:12,24,12,0.89
2qjfk,stocks,kxlkni,2021-01-15 03:06,What everyone doesn't understand about Palantir (compared to Snowflake and Redshift) [NYSE:PLTR],https://www.reddit.com/r/stocks/comments/kxlkni/what_everyone_doesnt_understand_about_palantir/,2021-01-20 21:12,31,41,0.82
2qjfk,stocks,kxlvlo,2021-01-15 03:23,Do I have a good strategy?,https://www.reddit.com/r/stocks/comments/kxlvlo/do_i_have_a_good_strategy/,2021-01-20 21:12,27,17,0.95
2qjfk,stocks,kxm1pu,2021-01-15 03:33,ArkQ and ArkF don’t get any love,https://www.reddit.com/r/stocks/comments/kxm1pu/arkq_and_arkf_dont_get_any_love/,2021-01-20 21:12,21,16,1.0
2qjfk,stocks,kxnzny,2021-01-15 05:32,Realistic $GME predictions over the coming days/weeks?,https://www.reddit.com/r/stocks/comments/kxnzny/realistic_gme_predictions_over_the_coming/,2021-01-20 21:12,72,61,0.91
2qjfk,stocks,kxo8to,2021-01-15 05:49,Good time to buy right now? Or should I wait...,https://www.reddit.com/r/stocks/comments/kxo8to/good_time_to_buy_right_now_or_should_i_wait/,2021-01-20 21:12,28,2,1.0
2qjfk,stocks,kxq1a1,2021-01-15 08:00,"r/Stocks Daily Discussion & Fundamentals Friday Jan 15, 2021",https://www.reddit.com/r/stocks/comments/kxq1a1/rstocks_daily_discussion_fundamentals_friday_jan/,2021-01-20 21:12,1084,51,0.94
2qjfk,stocks,kxsvsd,2021-01-15 11:38,Re: Guy who made $100 after 8 months. Lots of ignorance in here,https://www.reddit.com/r/stocks/comments/kxsvsd/re_guy_who_made_100_after_8_months_lots_of/,2021-01-20 21:12,30,3,0.52
2qjfk,stocks,kxsxdj,2021-01-15 11:41,Alibaba (BABA) to continue its rally. It is 2% up premarket 🚀,https://www.reddit.com/r/stocks/comments/kxsxdj/alibaba_baba_to_continue_its_rally_it_is_2_up/,2021-01-20 21:12,26,46,0.74
2qjfk,stocks,kxteo3,2021-01-15 12:15,APHA and TLRY merger arbitrage opportunity?,https://www.reddit.com/r/stocks/comments/kxteo3/apha_and_tlry_merger_arbitrage_opportunity/,2021-01-20 21:12,23,64,0.92
2qjfk,stocks,kxuhwo,2021-01-15 13:27,Possible effects of riots/violence on inauguration day?,https://www.reddit.com/r/stocks/comments/kxuhwo/possible_effects_of_riotsviolence_on_inauguration/,2021-01-20 21:12,20,3,0.71
2qjfk,stocks,kxw3ej,2021-01-15 14:56,Is it time to sell AMD?,https://www.reddit.com/r/stocks/comments/kxw3ej/is_it_time_to_sell_amd/,2021-01-20 21:12,59,14,0.69
2qjfk,stocks,kxwhyj,2021-01-15 15:15,NIO day was a fiasco?,https://www.reddit.com/r/stocks/comments/kxwhyj/nio_day_was_a_fiasco/,2021-01-20 21:12,26,0,0.45
2qjfk,stocks,kxwq2t,2021-01-15 15:27,Continuing our investing journey from PLTR to DTIL,https://www.reddit.com/r/stocks/comments/kxwq2t/continuing_our_investing_journey_from_pltr_to_dtil/,2021-01-20 21:12,143,672,0.96
2qjfk,stocks,kxwrjd,2021-01-15 15:29,"Is something happening today for clean energy, EV, weed?",https://www.reddit.com/r/stocks/comments/kxwrjd/is_something_happening_today_for_clean_energy_ev/,2021-01-20 21:12,301,217,0.89
2qjfk,stocks,kxx25a,2021-01-15 15:44,How do you monitor your positions?,https://www.reddit.com/r/stocks/comments/kxx25a/how_do_you_monitor_your_positions/,2021-01-20 21:12,41,16,0.91
2qjfk,stocks,kxx8ro,2021-01-15 15:53,TLRY sell or hold?,https://www.reddit.com/r/stocks/comments/kxx8ro/tlry_sell_or_hold/,2021-01-20 21:12,25,7,0.77
2qjfk,stocks,kxxdmf,2021-01-15 16:00,Is $BB a long term stock or a pump and dump?,https://www.reddit.com/r/stocks/comments/kxxdmf/is_bb_a_long_term_stock_or_a_pump_and_dump/,2021-01-20 21:12,38,25,0.85
2qjfk,stocks,kxxiwa,2021-01-15 16:06,ICLN is on sale right now🚀🚀🚀,https://www.reddit.com/r/stocks/comments/kxxiwa/icln_is_on_sale_right_now/,2021-01-20 21:12,257,171,0.74
2qjfk,stocks,kxxp97,2021-01-15 16:15,Amazon Keeps Buying Pricey Jets After Promising a Drone Fleet,https://www.reddit.com/r/stocks/comments/kxxp97/amazon_keeps_buying_pricey_jets_after_promising_a/,2021-01-20 21:12,30,63,0.85
2qjfk,stocks,kxywwc,2021-01-15 17:13,Fiverr is worth a look,https://www.reddit.com/r/stocks/comments/kxywwc/fiverr_is_worth_a_look/,2021-01-20 21:12,27,44,0.88
2qjfk,stocks,kxze7a,2021-01-15 17:34,r/Stocks poll - Remove rocket emojis from post titles?,https://www.reddit.com/r/stocks/comments/kxze7a/rstocks_poll_remove_rocket_emojis_from_post_titles/,2021-01-20 21:12,146,121,0.83
2qjfk,stocks,kxzzib,2021-01-15 18:01,"Considering NIO, JD, BABA,and PDD",https://www.reddit.com/r/stocks/comments/kxzzib/considering_nio_jd_babaand_pdd/,2021-01-20 21:12,28,8,0.8
2qjfk,stocks,ky0s7a,2021-01-15 18:38,Berkshire Hathaway,https://www.reddit.com/r/stocks/comments/ky0s7a/berkshire_hathaway/,2021-01-20 21:12,35,7,0.71
2qjfk,stocks,ky0sew,2021-01-15 18:39,"Once APHA mergers into TLRY, shareholders will receive 0.8381 TLRY per APHA. Why do the stock prices not reflect this ratio?",https://www.reddit.com/r/stocks/comments/ky0sew/once_apha_mergers_into_tlry_shareholders_will/,2021-01-20 21:12,23,55,0.92
2qjfk,stocks,ky1g5h,2021-01-15 19:10,Question about index funds.,https://www.reddit.com/r/stocks/comments/ky1g5h/question_about_index_funds/,2021-01-20 21:12,26,8,0.84
2qjfk,stocks,ky2bra,2021-01-15 19:52,Young Investor,https://www.reddit.com/r/stocks/comments/ky2bra/young_investor/,2021-01-20 21:12,25,1,0.56
2qjfk,stocks,ky389l,2021-01-15 20:36,Anyone else down bad with nio?,https://www.reddit.com/r/stocks/comments/ky389l/anyone_else_down_bad_with_nio/,2021-01-20 21:12,119,31,0.64
2qjfk,stocks,ky3nxo,2021-01-15 20:56,"Amazon Stock Price Target Prediction & Analysis [DCF, Fundamental & Tehnical]",https://www.reddit.com/r/stocks/comments/ky3nxo/amazon_stock_price_target_prediction_analysis_dcf/,2021-01-20 21:12,123,379,0.94
2qjfk,stocks,ky4fvg,2021-01-15 21:33,$AMD - Reasons for the drop?,https://www.reddit.com/r/stocks/comments/ky4fvg/amd_reasons_for_the_drop/,2021-01-20 21:12,31,2,0.58
2qjfk,stocks,ky5kh6,2021-01-15 22:29,GME:When to sell?,https://www.reddit.com/r/stocks/comments/ky5kh6/gmewhen_to_sell/,2021-01-20 21:12,75,22,0.81
2qjfk,stocks,ky5wkh,2021-01-15 22:46,PLUG 🔌 will soar way beyond the current price point this year.,https://www.reddit.com/r/stocks/comments/ky5wkh/plug_will_soar_way_beyond_the_current_price_point/,2021-01-20 21:12,201,330,0.9
2qjfk,stocks,ky5z08,2021-01-15 22:49,Is PLTR set to run in 2021?,https://www.reddit.com/r/stocks/comments/ky5z08/is_pltr_set_to_run_in_2021/,2021-01-20 21:12,83,94,0.85
