Subreddit_ID,Subreddit_Name,Submission_ID,Submission_CreatedDate,Submission_Title,Submission_URL,Submission_LastFetched,Submission_NumComments,Submission_Score,Submission_UpvoteRatio
2th52,wallstreetbets,l0jpw3,2021-01-19 13:22,WBS's Market March for GME,https://v.redd.it/cgtffkrdiac61,2021-01-20 21:13,124,2129,0.98
2th52,wallstreetbets,l0jl2z,2021-01-19 13:13,Lisa Su Takes AMD to the Big Leagues,https://www.reddit.com/r/wallstreetbets/comments/l0jl2z/lisa_su_takes_amd_to_the_big_leagues/,2021-01-20 21:13,28,69,0.9
2th52,wallstreetbets,l0jw5j,2021-01-19 13:33,Hydrogen as part of the EU Climate Strat - PLUG moon,https://i.redd.it/gmbjtcwekac61.png,2021-01-20 21:13,55,74,0.91
2th52,wallstreetbets,l0jxgm,2021-01-19 13:35,Anyone a financial analyst?,https://www.reddit.com/r/wallstreetbets/comments/l0jxgm/anyone_a_financial_analyst/,2021-01-20 21:13,49,12,0.67
2th52,wallstreetbets,l0k6vs,2021-01-19 13:51,BB made Benzinga Pro's top 5 stocks to watch for today,https://i.redd.it/d2600rynnac61.jpg,2021-01-20 21:13,47,521,0.98
2th52,wallstreetbets,l0k7wq,2021-01-19 13:52,🚀🚀🚀 Get ready to go down in history boys!!! 🚀🚀🚀,https://i.redd.it/ms03itzynac61.jpg,2021-01-20 21:13,30,818,0.98
2th52,wallstreetbets,l0k8aw,2021-01-19 13:53,🚀$PLTR Premarket DD,https://www.reddit.com/r/wallstreetbets/comments/l0k8aw/pltr_premarket_dd/,2021-01-20 21:13,109,214,0.97
2th52,wallstreetbets,l0khnn,2021-01-19 14:07,$BB getting recognized thanks to WSB,https://i.redd.it/c7pag0boqac61.jpg,2021-01-20 21:13,138,1463,0.98
2th52,wallstreetbets,l0kmix,2021-01-19 14:15,🥜🚀Squeeze Myths & Price Jump Research💎🙌,https://www.reddit.com/r/wallstreetbets/comments/l0kmix/squeeze_myths_price_jump_research/,2021-01-20 21:13,59,176,0.94
2th52,wallstreetbets,l0kvul,2021-01-19 14:29,PLTR - update- Looks like palantir is about ready to pop. Failing to return to the bottom of the pennant and wicking off the top of the pennant the last couple trading sessions imply that buyers are attempting to break the supply line. I Think it might be about time to go up soon.,https://i.redd.it/te75z0biuac61.jpg,2021-01-20 21:13,44,145,0.87
2th52,wallstreetbets,l0kzai,2021-01-19 14:34,THE PHANTOM OF WSB (original lyrics and vocals),https://v.redd.it/3cpi38l2vac61,2021-01-20 21:13,95,1251,0.99
2th52,wallstreetbets,l0l1vo,2021-01-19 14:38,GME now at 200% special maintenance requirement on Schwab. Unreal!,https://i.redd.it/5yfim253wac61.jpg,2021-01-20 21:13,289,2101,0.99
2th52,wallstreetbets,l0l05x,2021-01-19 14:35,BB TO THE MOON!!!! 🚀🚀🚀🚀 💎💎👏🏻👏🏻,https://v.redd.it/ap6zatvmvac61,2021-01-20 21:13,575,3246,0.97
2th52,wallstreetbets,l0l0q1,2021-01-19 14:36,Live shot of $GME call holders,https://v.redd.it/raap296rvac61,2021-01-20 21:13,104,2782,0.98
2th52,wallstreetbets,l0l3lh,2021-01-19 14:40,BB DD🚀🚀🚀,https://www.reddit.com/r/wallstreetbets/comments/l0l3lh/bb_dd/,2021-01-20 21:13,142,654,0.97
2th52,wallstreetbets,l0l5xi,2021-01-19 14:44,CALLaway Part 4,https://www.reddit.com/r/wallstreetbets/comments/l0l5xi/callaway_part_4/,2021-01-20 21:13,125,543,0.96
2th52,wallstreetbets,l0l9b3,2021-01-19 14:49,"After being dissed by some cuckold boomer on my trade for $BB and getting over 420 updoots on my comment. I'm going full broke boi, degenerate, big dick swinging 🍆🚀",https://i.redd.it/mmq3btb1yac61.jpg,2021-01-20 21:13,68,327,0.92
2th52,wallstreetbets,l0l9w4,2021-01-19 14:49,Complete the sentence: I’m not ______ !,https://i.redd.it/71zfc3l6yac61.jpg,2021-01-20 21:13,167,894,0.98
2th52,wallstreetbets,l0laxy,2021-01-19 14:51,Attack on Cramer ft. Ryan Cohen & HorseCockBezos,https://v.redd.it/ekznu6y8yac61,2021-01-20 21:13,97,1627,0.99
2th52,wallstreetbets,l0lebx,2021-01-19 14:56,"Shorts have to be destroyed (by retards/autists), as if they are bugs on a windshield",https://v.redd.it/tut1ifiwyac61,2021-01-20 21:13,70,575,0.93
2th52,wallstreetbets,l0lg6r,2021-01-19 14:58,Shitron Attacking begins.,https://i.redd.it/n43f5b8szac61.jpg,2021-01-20 21:13,2749,22578,0.88
2th52,wallstreetbets,l0lhf6,2021-01-19 15:00,Europoor here WSB LOVE YOU,https://i.redd.it/m7ggeqn10bc61.jpg,2021-01-20 21:13,62,177,0.97
2th52,wallstreetbets,l0lijo,2021-01-19 15:01,Gme yolo,https://i.redd.it/4402bn1b0bc61.jpg,2021-01-20 21:13,78,124,0.93
2th52,wallstreetbets,l0lns6,2021-01-19 15:08,🚀🚀🚀🚀🚀🚀,https://i.redd.it/v1daau9k1bc61.jpg,2021-01-20 21:13,24,340,0.97
2th52,wallstreetbets,l0lo85,2021-01-19 15:09,$TSLA Prediction for End of 2021.,https://www.reddit.com/r/wallstreetbets/comments/l0lo85/tsla_prediction_for_end_of_2021/,2021-01-20 21:13,36,23,0.77
2th52,wallstreetbets,l0lrvi,2021-01-19 15:14,Citron Research Who?,https://i.redd.it/xfar63tl2bc61.jpg,2021-01-20 21:13,346,4379,0.99
2th52,wallstreetbets,l0lv51,2021-01-19 15:19,"I like meme stocks as much as any of you, but take a look at $GILD before it's too late.",https://i.redd.it/4w4htq8f3bc61.png,2021-01-20 21:13,61,25,0.71
2th52,wallstreetbets,l0m4kx,2021-01-19 15:32,I have a question - isn't what Citron is doing a legit example of Market Manipulation?,https://www.reddit.com/r/wallstreetbets/comments/l0m4kx/i_have_a_question_isnt_what_citron_is_doing_a/,2021-01-20 21:13,183,844,0.96
2th52,wallstreetbets,l0m5vt,2021-01-19 15:34,Thank you WSB $BB 🚀🚀🚀🚀,https://i.redd.it/9iiu42g26bc61.jpg,2021-01-20 21:13,124,780,0.97
2th52,wallstreetbets,l0m92m,2021-01-19 15:38,ULTIMATE SPWR Tendie Train Ride,https://www.reddit.com/r/wallstreetbets/comments/l0m92m/ultimate_spwr_tendie_train_ride/,2021-01-20 21:13,20,24,0.83
2th52,wallstreetbets,l0mayu,2021-01-19 15:41,Changing my life one rocket at a time! 🚀🚀🚀🚀,https://www.reddit.com/r/wallstreetbets/comments/l0mayu/changing_my_life_one_rocket_at_a_time/,2021-01-20 21:13,23,81,0.9
2th52,wallstreetbets,l0mc06,2021-01-19 15:42,Only 7000 GME shares available to borrow now,https://i.redd.it/dq6ajcxm7bc61.png,2021-01-20 21:13,1137,3607,0.98
2th52,wallstreetbets,l0mhdh,2021-01-19 15:50,Actual future ARKX holdings - from space exploration ARK mutual fund in Japan!,https://www.reddit.com/r/wallstreetbets/comments/l0mhdh/actual_future_arkx_holdings_from_space/,2021-01-20 21:13,36,58,0.92
2th52,wallstreetbets,l0ml9k,2021-01-19 15:55,$BB🚀🚀🚀 Cheers to the 💎✋ that held over the long weekend.,https://i.redd.it/u6z49u0z9bc61.png,2021-01-20 21:13,69,444,0.97
2th52,wallstreetbets,l0mkxr,2021-01-19 15:55,How to trade GME this week,https://v.redd.it/tdfhujzm9bc61,2021-01-20 21:13,81,2541,0.98
2th52,wallstreetbets,l0mrp6,2021-01-19 16:04,I hope I don’t regret,https://www.reddit.com/gallery/l0mrp6,2021-01-20 21:13,103,474,0.96
2th52,wallstreetbets,l0mxu6,2021-01-19 16:12,"bought the dip earlier at 37.07 i YOLO'd everything i have, i know i can only afford a small capital..yall think this can be steady around 40 by end of this week? cant lose it im a retard i need gains lol",https://i.redd.it/jz8zo0yycbc61.jpg,2021-01-20 21:13,69,83,0.91
2th52,wallstreetbets,l0mya0,2021-01-19 16:13,Just the beginning $BB 🚀🚀🚀🚀🚀🚀🚀🚀🚀🚀🚀🚀🚀🚀🚀🚀🚀🚀🪐🪐,https://i.redd.it/6hoq21z2dbc61.jpg,2021-01-20 21:13,102,609,0.96
2th52,wallstreetbets,l0mzio,2021-01-19 16:15,GME YOLO,https://www.reddit.com/r/wallstreetbets/comments/l0mzio/gme_yolo/,2021-01-20 21:13,83,620,0.97
2th52,wallstreetbets,l0n17l,2021-01-19 16:17,Threw everything I knew about stocks out the window. Officially an autist ready to 🚀🚀🚀,https://i.redd.it/uzinb45sdbc61.jpg,2021-01-20 21:13,56,322,0.96
2th52,wallstreetbets,l0n1mm,2021-01-19 16:17,GME calls. Holding until EXPIRY,https://www.reddit.com/gallery/l0n1mm,2021-01-20 21:13,50,86,0.86
2th52,wallstreetbets,l0n1oz,2021-01-19 16:18,Let's do this 🚀🚀🚀🚀🚀,https://i.redd.it/ukwki2nwdbc61.jpg,2021-01-20 21:13,34,205,0.97
2th52,wallstreetbets,l0n31j,2021-01-19 16:19,"ADDED ANOTHER 4,000 GME SHARES ($156,000)",https://i.redd.it/zvomtvpsdbc61.png,2021-01-20 21:13,384,4580,0.98
2th52,wallstreetbets,l0n435,2021-01-19 16:21,Hold my bully boys hold! 🚀🚀🚀🚀🚀,https://i.redd.it/1e050skhebc61.jpg,2021-01-20 21:13,29,167,0.96
2th52,wallstreetbets,l0nabp,2021-01-19 16:29,Tendies coming rite?,https://i.redd.it/9qau8gqzfbc61.jpg,2021-01-20 21:13,30,200,0.98
2th52,wallstreetbets,l0ncm6,2021-01-19 16:32,If this moons I’ll finally be able to afford my masters degree💎💎🙌🙌 let’s hold that line 😤😤🚀🚀,https://i.redd.it/rjfvh3eigbc61.jpg,2021-01-20 21:13,50,283,0.95
2th52,wallstreetbets,l0nhky,2021-01-19 16:39,GME Short Stock availability in IBKR is now 0,https://i.redd.it/neva241khbc61.jpg,2021-01-20 21:13,363,1797,0.99
2th52,wallstreetbets,l0nkoa,2021-01-19 16:42,In for the MOASS,https://i.redd.it/egwd9kp7ibc61.jpg,2021-01-20 21:13,285,7400,0.99
2th52,wallstreetbets,l0nlvs,2021-01-19 16:44,My wife said I could gamble my 2020 fun stock account gains on GME. Not selling for 🥜,https://i.redd.it/jtgmaf1mibc61.jpg,2021-01-20 21:13,31,164,0.95
2th52,wallstreetbets,l0nqum,2021-01-19 16:50,ALL ABOARD🚀🚀🚀,https://i.redd.it/fwx7q2prjbc61.jpg,2021-01-20 21:13,23,53,0.88
2th52,wallstreetbets,l0ntch,2021-01-19 16:54,This is why you guys need some 💎 🙌 you only loose when you sell.,https://i.redd.it/itz5hjpckbc61.jpg,2021-01-20 21:13,22,121,0.95
2th52,wallstreetbets,l0nxdn,2021-01-19 16:59,🚀🚀🚀Waiting for my wife's boyfriend to give me my weekly allowance so I can buy more $BB 🚀🚀🚀,https://i.redd.it/9f3xhkyblbc61.jpg,2021-01-20 21:13,22,130,0.93
2th52,wallstreetbets,l0nz47,2021-01-19 17:01,Citron's announcement of an announcement is absolute bearshit 💩🍋,https://www.reddit.com/r/wallstreetbets/comments/l0nz47/citrons_announcement_of_an_announcement_is/,2021-01-20 21:13,152,1168,0.98
2th52,wallstreetbets,l0nykr,2021-01-19 17:00,All my homies hate Citron Research. GME to the moon 🚀🚀🚀,https://v.redd.it/m25ufe63lbc61,2021-01-20 21:13,85,2155,0.98
2th52,wallstreetbets,l0o07e,2021-01-19 17:02,"#Palantir software is helping California’s largest investor-owned utility streamline #datamanagement across the company, enhancing electric system safety and grid reliability.",https://twitter.com/palantirtech/status/1351575265902796801?s=21,2021-01-20 21:13,21,100,0.94
2th52,wallstreetbets,l0o030,2021-01-19 17:02,Hooooooooooold 💎👏🏻 $GME 🚀🚀🚀,https://v.redd.it/fxm8f1kslbc61,2021-01-20 21:13,38,313,0.96
2th52,wallstreetbets,l0o3tx,2021-01-19 17:07,"GME broke its own ATH for mentions this weekend. Here's a visualization of the ""Tomorrow's Moves"" thread for today.",https://i.redd.it/p9xnbt1embc61.png,2021-01-20 21:13,68,727,0.99
2th52,wallstreetbets,l0o4ga,2021-01-19 17:08,Can I get a 'Fuck Citron!',https://i.redd.it/onj6k0ptmbc61.png,2021-01-20 21:13,56,620,0.98
2th52,wallstreetbets,l0odp0,2021-01-19 17:19,TSX:BB - WILL BE $15 TODAY!!! 🚀,https://i.redd.it/pmiry0mxobc61.jpg,2021-01-20 21:13,42,113,0.97
2th52,wallstreetbets,l0ofiu,2021-01-19 17:22,"Updated 1-19-2021 GME Gamma and OI Dynamics - Slightly Bullish, Very Volatile",https://www.reddit.com/r/wallstreetbets/comments/l0ofiu/updated_1192021_gme_gamma_and_oi_dynamics/,2021-01-20 21:13,185,130,0.69
2th52,wallstreetbets,l0okp4,2021-01-19 17:28,$BB 💎🤲 holding over the weekend is worth it 🚀🚀🚀,https://i.redd.it/1yw7qsliqbc61.jpg,2021-01-20 21:13,29,194,0.95
2th52,wallstreetbets,l0okrz,2021-01-19 17:28,I'm New to The GME Subreddit.. er... I mean WSB Subreddit,https://www.reddit.com/r/wallstreetbets/comments/l0okrz/im_new_to_the_gme_subreddit_er_i_mean_wsb/,2021-01-20 21:13,62,874,0.96
2th52,wallstreetbets,l0opur,2021-01-19 17:35,"THE NEXT TESLA, and the industry leader in Elon Musks projected hot sector",https://www.reddit.com/r/wallstreetbets/comments/l0opur/the_next_tesla_and_the_industry_leader_in_elon/,2021-01-20 21:13,44,55,0.85
2th52,wallstreetbets,l0oso3,2021-01-19 17:38,"$BB YOLO UPDATE: After the drop on Friday after buying 50 of $12C 3/19 exp, I double down and got 30 more calls before market close (20-3/19-$12C & 10-2023 exp -$15C)🚀🚀🚀🚀",https://i.redd.it/a82csil9sbc61.jpg,2021-01-20 21:13,22,110,0.95
2th52,wallstreetbets,l0otzf,2021-01-19 17:40,"Took every dollar I've ever made since graduating college (23M) and YOLO'd it all on a November 19th $42 Strike price. Please give me teddies. Hopefully my crush's boyfriend is impressed. Oh, and by the way, 🚀🚀🚀🚀🚀🚀🚀🚀🚀🚀🚀🚀🚀🚀🚀🚀🚀🚀🚀🚀🚀🚀🚀🚀🚀🚀🚀🚀🚀🚀🚀🚀🚀🚀🚀🚀",https://i.redd.it/v72lhli7sbc61.jpg,2021-01-20 21:13,58,281,0.95
2th52,wallstreetbets,l0oxxg,2021-01-19 17:45,When do I sell boys? BB🚀🚀,https://i.redd.it/5zr0mwthtbc61.jpg,2021-01-20 21:13,59,93,0.91
2th52,wallstreetbets,l0p2a4,2021-01-19 17:51,BB gains 🚀🚀🚀 lets go $60 EOY,https://i.redd.it/ns1jbociubc61.jpg,2021-01-20 21:13,37,313,0.97
2th52,wallstreetbets,l0p308,2021-01-19 17:52,"GME gain porn. i’ve only been trading for 4 months. thanks WSB!!!! fuck shitron, melvin and gay bears",https://i.redd.it/gf5pzt3oubc61.jpg,2021-01-20 21:13,28,271,0.95
2th52,wallstreetbets,l0p4jx,2021-01-19 17:54,"Its not much, but it's mine. I AM NOT FUCKING SELLING! GME TO THE MOON!",https://i.redd.it/pauzzczyubc61.png,2021-01-20 21:13,26,200,0.94
2th52,wallstreetbets,l0p523,2021-01-19 17:54,"All in BB $486K 40,000 shares. I’m doing my part 🚀🚀🚀",https://i.redd.it/j3x14kf5vbc61.jpg,2021-01-20 21:13,958,4178,0.97
2th52,wallstreetbets,l0p5lo,2021-01-19 17:55,The Absolute State of GME bulls from WSB right now.,https://i.redd.it/sx8yc1q8vbc61.png,2021-01-20 21:13,292,6665,0.98
2th52,wallstreetbets,l0p7mn,2021-01-19 17:58,Motley Foolios,https://i.redd.it/r0o7m9crvbc61.jpg,2021-01-20 21:13,73,187,0.95
2th52,wallstreetbets,l0p8qv,2021-01-19 17:59,GME short interest increased as per CapIQ,https://www.reddit.com/r/wallstreetbets/comments/l0p8qv/gme_short_interest_increased_as_per_capiq/,2021-01-20 21:13,36,229,0.96
2th52,wallstreetbets,l0p8xw,2021-01-19 17:59,I’m here to help 💎🤲🏽,https://www.reddit.com/gallery/l0p8xw,2021-01-20 21:13,20,188,0.96
2th52,wallstreetbets,l0phna,2021-01-19 18:10,FB -> Stupidly Undervalued. Position: $200k LEAPS [Not YOLO],https://www.reddit.com/r/wallstreetbets/comments/l0phna/fb_stupidly_undervalued_position_200k_leaps_not/,2021-01-20 21:13,62,15,0.57
2th52,wallstreetbets,l0psnw,2021-01-19 18:25,ARKX predicted holdings,https://www.reddit.com/r/wallstreetbets/comments/l0psnw/arkx_predicted_holdings/,2021-01-20 21:13,31,15,0.81
2th52,wallstreetbets,l0pthi,2021-01-19 18:26,"[Cramer] Again, a grave mistake this weekend: i was somehow linked to the shorts in GME. No NO NO, i want the longs to win. I want GME to win. But I don't want the longs to get too greedy.",https://twitter.com/jimcramer/status/1351595526765109249,2021-01-20 21:13,114,325,0.88
2th52,wallstreetbets,l0ptwk,2021-01-19 18:26,BB am I doing this right?! 🚀🚀🚀🚀🚀,https://i.redd.it/xxm2jxpw0cc61.png,2021-01-20 21:13,39,142,0.94
2th52,wallstreetbets,l0py9m,2021-01-19 18:32,News: GameStop Climbs as Investors Look Past Short-Seller Citron's $20 View,https://www.reddit.com/r/wallstreetbets/comments/l0py9m/news_gamestop_climbs_as_investors_look_past/,2021-01-20 21:13,45,293,0.98
2th52,wallstreetbets,l0q0br,2021-01-19 18:35,Well retards we finally did it,https://i.redd.it/knb3cwcc2cc61.jpg,2021-01-20 21:13,68,411,0.96
2th52,wallstreetbets,l0q3e8,2021-01-19 18:38,"Newly recruited Palentard Tendologies believer. First time yoloing, please don’t be gentle",https://i.redd.it/1lqhimhz2cc61.jpg,2021-01-20 21:13,23,78,0.95
2th52,wallstreetbets,l0q4tq,2021-01-19 18:40,Netflix Earnings after market close today,https://www.reddit.com/r/wallstreetbets/comments/l0q4tq/netflix_earnings_after_market_close_today/,2021-01-20 21:13,35,29,0.85
2th52,wallstreetbets,l0q7s2,2021-01-19 18:44,Activist investor Ryan Cohen scores 400% gain on GameStop stock in under 6 months LETS GOO,https://markets.businessinsider.com/news/stocks/activist-investor-chewy-cofounder-ryan-cohen-gamestop-stock-percent-gain-2021-1-1029980159,2021-01-20 21:13,98,2519,0.99
2th52,wallstreetbets,l0q9u0,2021-01-19 18:46,JOHN CENAAAAAA,https://i.redd.it/j6v6w7wf4cc61.jpg,2021-01-20 21:13,23,106,0.88
2th52,wallstreetbets,l0qcjw,2021-01-19 18:50,Suck these 🥜🥜 Citron,https://i.redd.it/ws7sgpk25cc61.jpg,2021-01-20 21:13,132,1417,0.98
2th52,wallstreetbets,l0qcun,2021-01-19 18:50,Should I hold it?,https://i.redd.it/fvxjt3l35cc61.png,2021-01-20 21:13,56,159,0.95
2th52,wallstreetbets,l0qd9v,2021-01-19 18:51,"For my GME brothers, hang on! 🚀🚀",https://i.redd.it/cfx3axk35cc61.gif,2021-01-20 21:13,69,1376,0.98
2th52,wallstreetbets,l0qioz,2021-01-19 18:58,"Sold Options, Bought Shares $BB $BlackberryBros",https://i.redd.it/ct2q6b3d6cc61.jpg,2021-01-20 21:13,58,365,0.97
2th52,wallstreetbets,l0qjjh,2021-01-19 18:59,Updated Shitron Tracker,https://www.reddit.com/r/wallstreetbets/comments/l0qjjh/updated_shitron_tracker/,2021-01-20 21:13,57,496,0.99
2th52,wallstreetbets,l0qo2t,2021-01-19 19:04,crud I typed it in wrong and ended up with GM instead of GME 🤦‍♂️,https://i.redd.it/riwe0mh17cc61.png,2021-01-20 21:13,408,8286,0.98
2th52,wallstreetbets,l0qogk,2021-01-19 19:05,$BB lifting off today was unreal,https://i.redd.it/n9m8jc6q7cc61.jpg,2021-01-20 21:13,64,232,0.97
2th52,wallstreetbets,l0quis,2021-01-19 19:13,BB and GME to the moon! 🚀 🚀 🚀 🚀,https://i.redd.it/6p1g2vy59cc61.jpg,2021-01-20 21:13,30,187,0.96
2th52,wallstreetbets,l0qvw0,2021-01-19 19:15,$MT STEEL GANG TODAY 🦾🤪🤌,https://v.redd.it/kobb3l5h9cc61,2021-01-20 21:13,45,68,0.89
2th52,wallstreetbets,l0qzza,2021-01-19 19:20,never ever tried one of their drinks ... are they any good? (since July 2020),https://i.redd.it/8vk0hybaacc61.png,2021-01-20 21:13,26,52,0.9
2th52,wallstreetbets,l0r1ky,2021-01-19 19:22,I love you BB 🚀🚀🚀 PT 100$ I'm not selling at all 🔝💥,https://i.redd.it/vwh3iwwvacc61.png,2021-01-20 21:13,35,139,0.92
2th52,wallstreetbets,l0r3zq,2021-01-19 19:25,"So back in September I was posed with either paying my rent and student loans or just full on YOLO it into a small cap penny called $GEVO. I did the responsible thing and locked in a 1,000 shares of this degen NASDAQ ticker. Happy to say it paid off and I hit a 10 bagger on this rope.",https://i.redd.it/7sgvp5i9bcc61.png,2021-01-20 21:13,47,122,0.95
2th52,wallstreetbets,l0r5dw,2021-01-19 19:27,I held through the $44 today and Im still holding. to put things in perspective I was almost at half of what i make in an year 💎,https://i.redd.it/9xglomqqbcc61.jpg,2021-01-20 21:13,75,384,0.97
2th52,wallstreetbets,l0rabc,2021-01-19 19:34,I betrayed Papa Elon for $BB. Pump it up!,https://i.redd.it/6mwrdzavccc61.jpg,2021-01-20 21:13,59,289,0.94
2th52,wallstreetbets,l0rbu0,2021-01-19 19:35,DD - TSMC is gonna moon soon,https://www.reddit.com/r/wallstreetbets/comments/l0rbu0/dd_tsmc_is_gonna_moon_soon/,2021-01-20 21:13,30,11,0.67
2th52,wallstreetbets,l0rekd,2021-01-19 19:39,"Went from bagholder to rocket ship. Say it with me: ""AND IM NOT FUCKING SELLING"" .. Fuck Shitron GME AND PLTR 🚀🚀🌕🌕",https://i.redd.it/iwn42wbudcc61.jpg,2021-01-20 21:13,64,579,0.97
2th52,wallstreetbets,l0rl8u,2021-01-19 19:48,When Shitron Capital tries to crash the GME Party,https://v.redd.it/ptb3ov3cfcc61,2021-01-20 21:13,51,1127,0.98
2th52,wallstreetbets,l0rqhi,2021-01-19 19:55,BB YOLO 🚀🚀🚀🚀🚀🚀 - let’s go!,https://i.redd.it/ooscpceqgcc61.jpg,2021-01-20 21:13,45,145,0.94
2th52,wallstreetbets,l0rqpk,2021-01-19 19:55,Bought 100 more today. That's 100 less shares in circulation. 💎👐🚀🚀🚀👩‍🚀🚀🚀🚀🌝,https://i.redd.it/7nli8z8qgcc61.jpg,2021-01-20 21:13,31,141,0.95
2th52,wallstreetbets,l0rqzd,2021-01-19 19:56,Finally part of the 100 shares club for $GME 🚀🚀🚀🚀🚀🥜🥜🥜🥜🥜,https://i.redd.it/yr9doesugcc61.jpg,2021-01-20 21:13,20,197,0.97
2th52,wallstreetbets,l0rtde,2021-01-19 19:59,"Buy High, Never Sell 💎🤚 800 GME Shares",https://i.redd.it/d0yq332fhcc61.jpg,2021-01-20 21:13,36,492,0.97
2th52,wallstreetbets,l0s3rh,2021-01-19 20:12,Difference between growth stock and rocket stock,https://i.redd.it/sh1c2pokjcc61.png,2021-01-20 21:13,43,252,0.96
2th52,wallstreetbets,l0s4m1,2021-01-19 20:13,Let's see who's getting financially ruined,https://i.redd.it/ywi60mpxicc61.png,2021-01-20 21:13,122,3208,0.99
2th52,wallstreetbets,l0s4v8,2021-01-19 20:13,If BABA hits 300 this week I’ll eat my hat,https://i.imgur.com/fdt2PLo.jpg,2021-01-20 21:13,23,28,0.8
2th52,wallstreetbets,l0s6nr,2021-01-19 20:16,Shoutout to You Gay Mods,https://www.reddit.com/r/wallstreetbets/comments/l0s6nr/shoutout_to_you_gay_mods/,2021-01-20 21:13,81,1342,0.97
2th52,wallstreetbets,l0s7cf,2021-01-19 20:17,"Your daily reminder that ""Chillman"" is NOT One of Us",https://i.redd.it/sadhe44jkcc61.png,2021-01-20 21:13,301,4408,0.98
2th52,wallstreetbets,l0s6wp,2021-01-19 20:16,The Bears on GME and BB Today.,https://v.redd.it/kbs2z6u6kcc61,2021-01-20 21:13,38,435,0.98
2th52,wallstreetbets,l0s8c1,2021-01-19 20:18,"Wsb soldier, never selling BB",https://i.redd.it/x5sdu3lskcc61.jpg,2021-01-20 21:13,24,156,0.93
2th52,wallstreetbets,l0s9ch,2021-01-19 20:19,$BB doing my part boys,https://i.redd.it/tqu0yjh1lcc61.jpg,2021-01-20 21:13,63,252,0.94
2th52,wallstreetbets,l0sgg2,2021-01-19 20:29,LET’S GO BB 🚀🚀,https://i.redd.it/u1prby3pmcc61.jpg,2021-01-20 21:13,98,616,0.95
2th52,wallstreetbets,l0sl9k,2021-01-19 20:35,The WSB bounty on Citrons head grows larger every day,https://i.redd.it/r8swg5ctncc61.jpg,2021-01-20 21:13,20,839,0.98
2th52,wallstreetbets,l0sovt,2021-01-19 20:40,Charge of the GME Stock Holders,https://v.redd.it/d058fwzvncc61,2021-01-20 21:13,77,1424,0.98
2th52,wallstreetbets,l0spxj,2021-01-19 20:41,BB YOLO Update🚀🚀 $15c Jan 2022,https://i.redd.it/5iqip8xoocc61.jpg,2021-01-20 21:13,32,181,0.93
2th52,wallstreetbets,l0ssqv,2021-01-19 20:45,"The ""5 reasons"" I think Citron will present tmrw, why they're half-truths and what they will try to do after",https://www.reddit.com/r/wallstreetbets/comments/l0ssqv/the_5_reasons_i_think_citron_will_present_tmrw/,2021-01-20 21:13,209,784,0.98
2th52,wallstreetbets,l0t097,2021-01-19 20:55,Congrats on making history fellow autist,https://i.redd.it/hfspjnsbrcc61.jpg,2021-01-20 21:13,47,320,0.97
2th52,wallstreetbets,l0t44g,2021-01-19 21:00,"What Are Your Moves Tomorrow, January 20, 2021",https://www.reddit.com/r/wallstreetbets/comments/l0t44g/what_are_your_moves_tomorrow_january_20_2021/,2021-01-20 21:13,24285,694,0.95
2th52,wallstreetbets,l0t4a7,2021-01-19 21:00,First 5 digit gain from BB,https://i.redd.it/t7w4pry9scc61.jpg,2021-01-20 21:13,28,235,0.96
2th52,wallstreetbets,l0t8f4,2021-01-19 21:05,🌈🐻 Buys 89k of GME Puts - Expires Friday,https://www.benzinga.com/markets/options/21/01/19220575/10-consumer-discretionary-stocks-showing-unusual-options-activity-in-todays-session,2021-01-20 21:13,34,55,0.9
2th52,wallstreetbets,l0t8ng,2021-01-19 21:05,GME YOLO update — Jan 19 2021,https://i.redd.it/y7v5vgx5tcc61.png,2021-01-20 21:13,1493,22948,0.91
2th52,wallstreetbets,l0t9hp,2021-01-19 21:06,128k in BB calls - free money,https://i.redd.it/sxnw6nhgtcc61.jpg,2021-01-20 21:13,52,264,0.96
2th52,wallstreetbets,l0tbqp,2021-01-19 21:09,Here is an old school boomer YOLO 👨🏽‍🦳🚀👨🏽‍🦳🚀,https://i.redd.it/3euh5nwytcc61.jpg,2021-01-20 21:13,68,37,0.84
2th52,wallstreetbets,l0tfbv,2021-01-19 21:14,GME: The Citron Attack,https://www.reddit.com/gallery/l0tfbv,2021-01-20 21:13,87,134,0.95
2th52,wallstreetbets,l0tfom,2021-01-19 21:15,2742% up on 1/22 $BB calls,https://i.redd.it/tr8usogoucc61.png,2021-01-20 21:13,60,188,0.94
2th52,wallstreetbets,l0then,2021-01-19 21:17,"Should I hold or should I sell now? If I hold there may be trouble, if I sell it may just double.",https://i.redd.it/5lnifjo3vcc61.jpg,2021-01-20 21:13,37,76,0.94
2th52,wallstreetbets,l0tpb9,2021-01-19 21:27,Love you retards ❤️❤️ BB Mar 2021 23 Calls🚀🚀🚀🚀🚀🚀🚀🚀🚀🚀🚀🚀,https://i.redd.it/guciu214xcc61.jpg,2021-01-20 21:13,25,85,0.9
2th52,wallstreetbets,l0tva2,2021-01-19 21:35,If we 💎 ✋ together lord Cohen will reward us on the 🌙🪐,https://i.redd.it/ldyejdvgycc61.jpg,2021-01-20 21:13,21,98,0.96
2th52,wallstreetbets,l0tvnc,2021-01-19 21:35,$GME $BB $PLTR Comparison - Jan 19th,https://i.redd.it/60fdln58ycc61.png,2021-01-20 21:13,38,102,0.98
2th52,wallstreetbets,l0twmk,2021-01-19 21:36,"$400k in GME, can’t stop won’t stop GameStop!!! Let’s go boys!",https://i.redd.it/ma4pg2msycc61.jpg,2021-01-20 21:13,128,2412,0.99
2th52,wallstreetbets,l0tya1,2021-01-19 21:38,BB YOLO update: JAN 1/19/21,https://i.redd.it/hhj3ta0vycc61.png,2021-01-20 21:13,34,130,0.94
2th52,wallstreetbets,l0tzbb,2021-01-19 21:40,I’m renewing my Netflix subscription tonight,https://i.redd.it/yeekydrezcc61.jpg,2021-01-20 21:13,20,44,0.9
2th52,wallstreetbets,l0u15y,2021-01-19 21:42,I am new here so I wanted to do my part and contribute by buying GME. This is the way.,https://i.redd.it/qpi19l6fzcc61.png,2021-01-20 21:13,21,52,0.77
2th52,wallstreetbets,l0u22n,2021-01-19 21:43,$BB to 🪐🚀🚀🚀🚀🚀🚀🚀,https://i.redd.it/ad5jexn10dc61.jpg,2021-01-20 21:13,29,158,0.95
2th52,wallstreetbets,l0u2k6,2021-01-19 21:44,the SEC fucking sucks,https://www.reddit.com/r/wallstreetbets/comments/l0u2k6/the_sec_fucking_sucks/,2021-01-20 21:13,71,302,0.96
2th52,wallstreetbets,l0u6lq,2021-01-19 21:49,Am I fucked? Someone give me bias encouragement please.,https://i.redd.it/n6nvcuz21dc61.jpg,2021-01-20 21:13,51,7,0.57
2th52,wallstreetbets,l0u6tl,2021-01-19 21:49,GME All In 🚀🚀🚀🚀🚀 Buy High Sell Never 💎🙌 Squeeze the 🌈🍋🐻,https://i.redd.it/igwtwum41dc61.jpg,2021-01-20 21:13,25,114,0.94
2th52,wallstreetbets,l0u8dw,2021-01-19 21:52,BB Best Buy is going to the moon!!,https://www.reddit.com/r/wallstreetbets/comments/l0u8dw/bb_best_buy_is_going_to_the_moon/,2021-01-20 21:13,23,28,0.63
