Subreddit_ID,Subreddit_Name,Submission_ID,Submission_CreatedDate,Submission_Title,Submission_URL,Submission_LastFetched,Submission_NumComments,Submission_Score,Submission_UpvoteRatio
2qhhq,investing,m4829g,2021-03-13 15:07,Bridgewater co-CIO Prince on inflation and passive investing,https://www.reddit.com/r/investing/comments/m4829g/bridgewater_cocio_prince_on_inflation_and_passive/,2021-03-29 19:27,81,81,0.81
2qhhq,investing,m497ai,2021-03-13 16:05,Hindenburg research's Short report on Lordstown,https://www.reddit.com/r/investing/comments/m497ai/hindenburg_researchs_short_report_on_lordstown/,2021-03-29 19:27,198,410,0.93
2qhhq,investing,m4buah,2021-03-13 18:13,Cricut alienates customers in pre-IPO cash grab,https://www.reddit.com/r/investing/comments/m4buah/cricut_alienates_customers_in_preipo_cash_grab/,2021-03-29 19:27,312,986,0.96
2qhhq,investing,m4dzyf,2021-03-13 19:58,Mohawk Group holdings (MWK) is a great buying opportunity,https://www.reddit.com/r/investing/comments/m4dzyf/mohawk_group_holdings_mwk_is_a_great_buying/,2021-03-29 19:27,85,45,0.72
2qhhq,investing,m4ghin,2021-03-13 21:57,"Long commodities, short bonds. Protection against inflation, and the house of cards that is the US bond market.",https://www.reddit.com/r/investing/comments/m4ghin/long_commodities_short_bonds_protection_against/,2021-03-29 19:27,351,302,0.83
2qhhq,investing,m4nhb2,2021-03-14 04:05,Butterfly Network (BFLY) DD is an awesome company to hold long term,https://www.reddit.com/r/investing/comments/m4nhb2/butterfly_network_bfly_dd_is_an_awesome_company/,2021-03-29 19:27,122,56,0.83
2qhhq,investing,m4ojn2,2021-03-14 05:09,"PSA: If You recently left Robinhood, double check your transferred cost-basis!",https://www.reddit.com/r/investing/comments/m4ojn2/psa_if_you_recently_left_robinhood_double_check/,2021-03-29 19:27,704,3144,0.97
2qhhq,investing,m4rpz1,2021-03-14 09:00,Daily Advice Thread - All basic help or advice questions must be posted here.,https://www.reddit.com/r/investing/comments/m4rpz1/daily_advice_thread_all_basic_help_or_advice/,2021-03-29 19:27,161,14,0.78
2qhhq,investing,m4rqiu,2021-03-14 09:01,"Daily General Discussion and spitballin thread - March 14, 2021",https://www.reddit.com/r/investing/comments/m4rqiu/daily_general_discussion_and_spitballin_thread/,2021-03-29 19:27,307,33,0.89
2qhhq,investing,m4vzjt,2021-03-14 14:25,Good Rx (GDRX) - is a GOOD investment,https://www.reddit.com/r/investing/comments/m4vzjt/good_rx_gdrx_is_a_good_investment/,2021-03-29 19:27,42,24,0.7
2qhhq,investing,m4y0mb,2021-03-14 16:12,Why I think Mohawk Group Holdings ($MWK) is a Great Long Term Play.,https://www.reddit.com/r/investing/comments/m4y0mb/why_i_think_mohawk_group_holdings_mwk_is_a_great/,2021-03-29 19:27,71,30,0.64
2qhhq,investing,m50ku0,2021-03-14 18:16,"Coursera Files to go public,",https://www.reddit.com/r/investing/comments/m50ku0/coursera_files_to_go_public/,2021-03-29 19:27,110,444,0.95
2qhhq,investing,m58453,2021-03-15 00:13,"The evidence is in on negative interest rate policies, and it has largely worked",https://www.reddit.com/r/investing/comments/m58453/the_evidence_is_in_on_negative_interest_rate/,2021-03-29 19:27,647,733,0.82
2qhhq,investing,m592rq,2021-03-15 01:05,Equity-Based Dollar-Cost Averaging: Methodically Buying Dips and Taking Profits,https://www.reddit.com/r/investing/comments/m592rq/equitybased_dollarcost_averaging_methodically/,2021-03-29 19:27,128,192,0.89
2qhhq,investing,m5czmg,2021-03-15 04:47,$SESN (Sesen Bio) D&D huge incoming catalysts with mayor impact on bladder cancer.,https://www.reddit.com/r/investing/comments/m5czmg/sesn_sesen_bio_dd_huge_incoming_catalysts_with/,2021-03-29 19:27,25,83,0.87
2qhhq,investing,m5gi9t,2021-03-15 09:00,Daily Advice Thread - All basic help or advice questions must be posted here.,https://www.reddit.com/r/investing/comments/m5gi9t/daily_advice_thread_all_basic_help_or_advice/,2021-03-29 19:27,260,17,0.74
2qhhq,investing,m5giuo,2021-03-15 09:01,"Daily General Discussion and spitballin thread - March 15, 2021",https://www.reddit.com/r/investing/comments/m5giuo/daily_general_discussion_and_spitballin_thread/,2021-03-29 19:27,342,26,0.82
2qhhq,investing,m5kkxa,2021-03-15 13:23,Ford ($F) - Ugly Duckling to Golden Goose,https://www.reddit.com/r/investing/comments/m5kkxa/ford_f_ugly_duckling_to_golden_goose/,2021-03-29 19:27,592,1915,0.94
2qhhq,investing,m5s8un,2021-03-15 19:07,$IGIC is a sleeper company that is DEEPLY undervalued,https://www.reddit.com/r/investing/comments/m5s8un/igic_is_a_sleeper_company_that_is_deeply/,2021-03-29 19:27,21,0,0.47
2qhhq,investing,m5zqnf,2021-03-16 03:16,Arguments in favour of more International Stock Exposure,https://www.reddit.com/r/investing/comments/m5zqnf/arguments_in_favour_of_more_international_stock/,2021-03-29 19:27,73,46,0.85
2qhhq,investing,m60b98,2021-03-16 03:48,I have to be missing something about the EV space,https://www.reddit.com/r/investing/comments/m60b98/i_have_to_be_missing_something_about_the_ev_space/,2021-03-29 19:27,621,654,0.91
2qhhq,investing,m64pxi,2021-03-16 09:00,Daily Advice Thread - All basic help or advice questions must be posted here.,https://www.reddit.com/r/investing/comments/m64pxi/daily_advice_thread_all_basic_help_or_advice/,2021-03-29 19:27,168,9,0.69
2qhhq,investing,m64qhe,2021-03-16 09:01,"Daily General Discussion and spitballin thread - March 16, 2021",https://www.reddit.com/r/investing/comments/m64qhe/daily_general_discussion_and_spitballin_thread/,2021-03-29 19:27,480,25,0.87
2qhhq,investing,m682y5,2021-03-16 12:36,Alibaba's browser has reportedly been deleted from Chinese app stores,https://www.reddit.com/r/investing/comments/m682y5/alibabas_browser_has_reportedly_been_deleted_from/,2021-03-29 19:27,224,1940,0.97
2qhhq,investing,m69ifj,2021-03-16 13:51,US Cannabis is my highest conviction investment for the next 3-5 years (DD and analysis),https://www.reddit.com/r/investing/comments/m69ifj/us_cannabis_is_my_highest_conviction_investment/,2021-03-29 19:27,167,296,0.9
2qhhq,investing,m6an8r,2021-03-16 14:44,$WMT - The Cutthroat Expansion of a Monopoly - Walmart Bull Thesis,https://www.reddit.com/r/investing/comments/m6an8r/wmt_the_cutthroat_expansion_of_a_monopoly_walmart/,2021-03-29 19:27,39,98,0.92
2qhhq,investing,m6kxvb,2021-03-16 22:15,"[DD] FTFT, a $400 million Chinese scam",https://www.reddit.com/r/investing/comments/m6kxvb/dd_ftft_a_400_million_chinese_scam/,2021-03-29 19:27,272,1810,0.96
2qhhq,investing,m6lakz,2021-03-16 22:32,Plug power - unravelling the jargon,https://www.reddit.com/r/investing/comments/m6lakz/plug_power_unravelling_the_jargon/,2021-03-29 19:27,66,66,0.9
2qhhq,investing,m6thic,2021-03-17 05:53,Ray Dalio: Why in the World Would You Own Bonds When…,https://www.reddit.com/r/investing/comments/m6thic/ray_dalio_why_in_the_world_would_you_own_bonds/,2021-03-29 19:27,180,96,0.91
2qhhq,investing,m6w42x,2021-03-17 09:00,Daily Advice Thread - All basic help or advice questions must be posted here.,https://www.reddit.com/r/investing/comments/m6w42x/daily_advice_thread_all_basic_help_or_advice/,2021-03-29 19:27,220,20,0.85
2qhhq,investing,m6w4oa,2021-03-17 09:01,"Daily General Discussion and spitballin thread - March 17, 2021",https://www.reddit.com/r/investing/comments/m6w4oa/daily_general_discussion_and_spitballin_thread/,2021-03-29 19:27,481,32,0.92
2qhhq,investing,m6w7uv,2021-03-17 09:06,People worried about the 10y yield going out of control should recognise some things.,https://www.reddit.com/r/investing/comments/m6w7uv/people_worried_about_the_10y_yield_going_out_of/,2021-03-29 19:27,240,321,0.94
2qhhq,investing,m6yvdo,2021-03-17 12:03,Fed Set To Reaffirm Dovish Stance With Powell Likely To Urge Patience,https://www.reddit.com/r/investing/comments/m6yvdo/fed_set_to_reaffirm_dovish_stance_with_powell/,2021-03-29 19:27,162,404,0.97
2qhhq,investing,m71yzd,2021-03-17 14:44,A month of tracking stock scrapers for success/failure rates,https://www.reddit.com/r/investing/comments/m71yzd/a_month_of_tracking_stock_scrapers_for/,2021-03-29 19:27,66,199,0.93
2qhhq,investing,m72q6s,2021-03-17 15:18,eBay due diligence and why I think the stock is undervalued in an expensive market,https://www.reddit.com/r/investing/comments/m72q6s/ebay_due_diligence_and_why_i_think_the_stock_is/,2021-03-29 19:27,360,570,0.92
2qhhq,investing,m75qs5,2021-03-17 17:31,Long on Nvidia - Alternative data points,https://www.reddit.com/r/investing/comments/m75qs5/long_on_nvidia_alternative_data_points/,2021-03-29 19:27,26,53,0.88
2qhhq,investing,m75rak,2021-03-17 17:32,DD Luna Innovations from here to Mars (literally) Ticker LUNA,https://www.reddit.com/r/investing/comments/m75rak/dd_luna_innovations_from_here_to_mars_literally/,2021-03-29 19:27,20,33,0.86
2qhhq,investing,m77ggf,2021-03-17 18:44,Morgan Stanley becomes the first big U.S. bank to offer its wealthy clients access to bitcoin funds,https://www.reddit.com/r/investing/comments/m77ggf/morgan_stanley_becomes_the_first_big_us_bank_to/,2021-03-29 19:27,651,2844,0.97
2qhhq,investing,m77upx,2021-03-17 19:02,"SEC Obtains Emergency Asset Freeze, Charges California Trader with Posting False Stock Tweets",https://www.reddit.com/r/investing/comments/m77upx/sec_obtains_emergency_asset_freeze_charges/,2021-03-29 19:27,54,116,0.97
2qhhq,investing,m7aw04,2021-03-17 21:15,Future market caps using current expectations is unsustainable. S&P500 total market cap alone would be worth $1.04 quadrillion in 50 years if grown at 7% yearly.,https://www.reddit.com/r/investing/comments/m7aw04/future_market_caps_using_current_expectations_is/,2021-03-29 19:27,100,56,0.73
2qhhq,investing,m7c1ig,2021-03-17 22:08,$TUSK Mammoth Energy Services - Why I'm super bullish,https://www.reddit.com/r/investing/comments/m7c1ig/tusk_mammoth_energy_services_why_im_super_bullish/,2021-03-29 19:27,21,39,0.85
2qhhq,investing,m7icf1,2021-03-18 03:45,"[DD] $FTFT, a $400 million Chinese scam pt. 2",https://www.reddit.com/r/investing/comments/m7icf1/dd_ftft_a_400_million_chinese_scam_pt_2/,2021-03-29 19:27,33,95,0.88
2qhhq,investing,m7mf56,2021-03-18 08:34,"If you were a Japanese citizen today, would you invest in the Nikkei?",https://www.reddit.com/r/investing/comments/m7mf56/if_you_were_a_japanese_citizen_today_would_you/,2021-03-29 19:27,52,32,0.87
2qhhq,investing,m7mqm4,2021-03-18 09:00,Daily Advice Thread - All basic help or advice questions must be posted here.,https://www.reddit.com/r/investing/comments/m7mqm4/daily_advice_thread_all_basic_help_or_advice/,2021-03-29 19:27,261,19,0.83
2qhhq,investing,m7mra8,2021-03-18 09:01,"Daily General Discussion and spitballin thread - March 18, 2021",https://www.reddit.com/r/investing/comments/m7mra8/daily_general_discussion_and_spitballin_thread/,2021-03-29 19:27,529,39,0.87
2qhhq,investing,m7ptq2,2021-03-18 12:34,"Jobless claims: Another 770,000 Americans filed new unemployment claims",https://www.reddit.com/r/investing/comments/m7ptq2/jobless_claims_another_770000_americans_filed_new/,2021-03-29 19:27,595,2019,0.97
2qhhq,investing,m7v063,2021-03-18 16:43,"Big Tech faces ‘way more’ than 10% downside, all-star investor Rich Bernstein warns",https://www.reddit.com/r/investing/comments/m7v063/big_tech_faces_way_more_than_10_downside_allstar/,2021-03-29 19:27,449,392,0.86
2qhhq,investing,m7zzhm,2021-03-18 20:32,The EMH is False - Specific Strong Evidence by deluks917,https://www.reddit.com/r/investing/comments/m7zzhm/the_emh_is_false_specific_strong_evidence_by/,2021-03-29 19:27,28,0,0.38
2qhhq,investing,m85fyo,2021-03-19 00:54,Investing in non-traded company,https://www.reddit.com/r/investing/comments/m85fyo/investing_in_nontraded_company/,2021-03-29 19:27,71,147,0.92
2qhhq,investing,m89ans,2021-03-19 04:35,Chewy Due Diligence - I am adding more!,https://www.reddit.com/r/investing/comments/m89ans/chewy_due_diligence_i_am_adding_more/,2021-03-29 19:27,112,148,0.89
2qhhq,investing,m89knw,2021-03-19 04:51,MP Materials posts massive earnings beat: $0.05 Expected vs $0.20 Actual,https://www.reddit.com/r/investing/comments/m89knw/mp_materials_posts_massive_earnings_beat_005/,2021-03-29 19:27,173,608,0.93
2qhhq,investing,m8d3os,2021-03-19 09:00,Daily Advice Thread - All basic help or advice questions must be posted here.,https://www.reddit.com/r/investing/comments/m8d3os/daily_advice_thread_all_basic_help_or_advice/,2021-03-29 19:27,301,37,0.87
2qhhq,investing,m8d47j,2021-03-19 09:01,"Daily General Discussion and spitballin thread - March 19, 2021",https://www.reddit.com/r/investing/comments/m8d47j/daily_general_discussion_and_spitballin_thread/,2021-03-29 19:27,373,39,0.91
2qhhq,investing,m8o362,2021-03-19 18:46,On Colombian Cannabis ( Clever Leaves $CLVR ),https://www.reddit.com/r/investing/comments/m8o362/on_colombian_cannabis_clever_leaves_clvr/,2021-03-29 19:27,120,366,0.9
2qhhq,investing,m8p7lq,2021-03-19 19:39,ESG investing removed from retirement accounts?,https://www.reddit.com/r/investing/comments/m8p7lq/esg_investing_removed_from_retirement_accounts/,2021-03-29 19:27,30,25,0.78
2qhhq,investing,m8ugyr,2021-03-19 23:45,GAW (Warhammer) & Cineworld Group DD,https://www.reddit.com/r/investing/comments/m8ugyr/gaw_warhammer_cineworld_group_dd/,2021-03-29 19:27,40,32,0.91
2qhhq,investing,m937cb,2021-03-20 09:00,Daily Advice Thread - All basic help or advice questions must be posted here.,https://www.reddit.com/r/investing/comments/m937cb/daily_advice_thread_all_basic_help_or_advice/,2021-03-29 19:27,149,16,0.81
2qhhq,investing,m937me,2021-03-20 09:00,"Inflationistas triggered by official CPI/PPI numbers not reflecting the inflation they see around them, are going to completely lose their minds when a few months from now, after every ""outing/entertainment"" venue is back to full capacity, the CPI/PPI still reflects as trending towards stagnancy.",https://www.reddit.com/r/investing/comments/m937me/inflationistas_triggered_by_official_cpippi/,2021-03-29 19:27,79,43,0.78
2qhhq,investing,m937xj,2021-03-20 09:01,"Daily General Discussion and spitballin thread - March 20, 2021",https://www.reddit.com/r/investing/comments/m937xj/daily_general_discussion_and_spitballin_thread/,2021-03-29 19:27,184,34,0.91
2qhhq,investing,m986zp,2021-03-20 14:32,"Negative yields come to India, as RBI tries to put a leash on short sellers",https://www.reddit.com/r/investing/comments/m986zp/negative_yields_come_to_india_as_rbi_tries_to_put/,2021-03-29 19:27,29,38,0.85
2qhhq,investing,m9adbw,2021-03-20 16:24,Understanding China's economy & the embedded risks: This video has a surprisingly balanced and good take describing a lot of the risks and drivers of the Chinese economy.,https://www.reddit.com/r/investing/comments/m9adbw/understanding_chinas_economy_the_embedded_risks/,2021-03-29 19:27,67,76,0.86
2qhhq,investing,m9ckpe,2021-03-20 18:08,ARK Released their new 2025 Tesla Price target.,https://www.reddit.com/r/investing/comments/m9ckpe/ark_released_their_new_2025_tesla_price_target/,2021-03-29 19:27,1073,1172,0.93
2qhhq,investing,m9dmdf,2021-03-20 18:57,Financial Market Pessimism,https://www.reddit.com/r/investing/comments/m9dmdf/financial_market_pessimism/,2021-03-29 19:27,185,80,0.78
2qhhq,investing,m9h2kx,2021-03-20 21:49,Comparing payment for order flow routing reports (606a) of different brokerages,https://www.reddit.com/r/investing/comments/m9h2kx/comparing_payment_for_order_flow_routing_reports/,2021-03-29 19:27,27,89,0.91
2qhhq,investing,m9soz4,2021-03-21 09:00,Daily Advice Thread - All basic help or advice questions must be posted here.,https://www.reddit.com/r/investing/comments/m9soz4/daily_advice_thread_all_basic_help_or_advice/,2021-03-29 19:27,188,44,0.87
2qhhq,investing,m9spks,2021-03-21 09:01,"Daily General Discussion and spitballin thread - March 21, 2021",https://www.reddit.com/r/investing/comments/m9spks/daily_general_discussion_and_spitballin_thread/,2021-03-29 19:27,240,45,0.86
2qhhq,investing,ma15h0,2021-03-21 17:11,Major railroad merger! Canadian Pacific is buying Kansas City Southern in a ~$25B deal - ~22% premium to Friday's close,https://www.reddit.com/r/investing/comments/ma15h0/major_railroad_merger_canadian_pacific_is_buying/,2021-03-29 19:27,227,1734,0.97
2qhhq,investing,ma29dn,2021-03-21 18:04,"Personal investor ""Valuation"" vs. Index funds",https://www.reddit.com/r/investing/comments/ma29dn/personal_investor_valuation_vs_index_funds/,2021-03-29 19:27,247,69,0.85
2qhhq,investing,ma9f0t,2021-03-21 23:43,$BNGO Bionano Genomics DD – The future of genomics is here. Why I am 100% bullish. HUGE Upside potential,https://www.reddit.com/r/investing/comments/ma9f0t/bngo_bionano_genomics_dd_the_future_of_genomics/,2021-03-29 19:27,143,226,0.75
2qhhq,investing,maixu3,2021-03-22 09:00,Daily Advice Thread - All basic help or advice questions must be posted here.,https://www.reddit.com/r/investing/comments/maixu3/daily_advice_thread_all_basic_help_or_advice/,2021-03-29 19:27,198,32,0.85
2qhhq,investing,maiydm,2021-03-22 09:01,"Daily General Discussion and spitballin thread - March 22, 2021",https://www.reddit.com/r/investing/comments/maiydm/daily_general_discussion_and_spitballin_thread/,2021-03-29 19:27,269,48,0.87
2qhhq,investing,maqmx6,2021-03-22 15:44,JP MORGAN May Soon Turn Away Deposits from Institutions,https://www.reddit.com/r/investing/comments/maqmx6/jp_morgan_may_soon_turn_away_deposits_from/,2021-03-29 19:27,176,1290,0.96
2qhhq,investing,matlli,2021-03-22 17:52,iShares Global Timber & Forestry ETF (WOOD) DD - Bullish Case For Continued Lumber Prices & 2021 Outlook,https://www.reddit.com/r/investing/comments/matlli/ishares_global_timber_forestry_etf_wood_dd/,2021-03-29 19:27,40,51,0.85
2qhhq,investing,mb37us,2021-03-23 01:24,"NIO, XPEV, and Li Auto Reportedly Planning Hong Kong Listing",https://www.reddit.com/r/investing/comments/mb37us/nio_xpev_and_li_auto_reportedly_planning_hong/,2021-03-29 19:27,22,82,0.91
2qhhq,investing,mb3kxg,2021-03-23 01:43,Interesting facts about brokerage insurance,https://www.reddit.com/r/investing/comments/mb3kxg/interesting_facts_about_brokerage_insurance/,2021-03-29 19:27,22,36,0.86
2qhhq,investing,mb7dzn,2021-03-23 05:18,"Some DD on Lockheed Martin LMT, or, how to play America, defense, space and the same time.",https://www.reddit.com/r/investing/comments/mb7dzn/some_dd_on_lockheed_martin_lmt_or_how_to_play/,2021-03-29 19:27,62,35,0.64
2qhhq,investing,mb8sjw,2021-03-23 06:57,ViacomCBS announces share offer worth 3 Billion dollar,https://www.reddit.com/r/investing/comments/mb8sjw/viacomcbs_announces_share_offer_worth_3_billion/,2021-03-29 19:27,51,90,0.92
2qhhq,investing,mbagp3,2021-03-23 09:00,Daily Advice Thread - All basic help or advice questions must be posted here.,https://www.reddit.com/r/investing/comments/mbagp3/daily_advice_thread_all_basic_help_or_advice/,2021-03-29 19:27,203,18,0.81
2qhhq,investing,mbah8s,2021-03-23 09:01,"Daily General Discussion and spitballin thread - March 23, 2021",https://www.reddit.com/r/investing/comments/mbah8s/daily_general_discussion_and_spitballin_thread/,2021-03-29 19:27,336,27,0.81
2qhhq,investing,mbfyx6,2021-03-23 14:30,CRSR DD - A Compelling Growth Story,https://www.reddit.com/r/investing/comments/mbfyx6/crsr_dd_a_compelling_growth_story/,2021-03-29 19:27,288,740,0.92
2qhhq,investing,mbj073,2021-03-23 16:48,DD - TKAT and OCG are scams should be worth nothing,https://www.reddit.com/r/investing/comments/mbj073/dd_tkat_and_ocg_are_scams_should_be_worth_nothing/,2021-03-29 19:27,32,25,0.76
2qhhq,investing,mbjmdg,2021-03-23 17:15,Microsoft ($MSFT) DD - Sitting on a gold mine,https://www.reddit.com/r/investing/comments/mbjmdg/microsoft_msft_dd_sitting_on_a_gold_mine/,2021-03-29 19:27,547,1767,0.95
2qhhq,investing,mblhn8,2021-03-23 18:38,"Boston Federal Reserve, MIT to release digital dollar prototypes as soon as July",https://www.reddit.com/r/investing/comments/mblhn8/boston_federal_reserve_mit_to_release_digital/,2021-03-29 19:27,153,153,0.93
2qhhq,investing,mbojkg,2021-03-23 20:53,Robinhood Is Said to Have Filed Confidentially for U.S. IPO,https://www.reddit.com/r/investing/comments/mbojkg/robinhood_is_said_to_have_filed_confidentially/,2021-03-29 19:27,184,204,0.89
2qhhq,investing,mbpykh,2021-03-23 21:58,Dip buyers: It's a good time to get into small caps,https://www.reddit.com/r/investing/comments/mbpykh/dip_buyers_its_a_good_time_to_get_into_small_caps/,2021-03-29 19:27,80,80,0.79
2qhhq,investing,mbshfw,2021-03-23 23:58,Intel is spending $20 billion to build two new chip plants in Arizona,https://www.reddit.com/r/investing/comments/mbshfw/intel_is_spending_20_billion_to_build_two_new/,2021-03-29 19:27,466,3293,0.98
2qhhq,investing,mbstc8,2021-03-24 00:15,$QD Qudian. Deep Value and Growth.,https://www.reddit.com/r/investing/comments/mbstc8/qd_qudian_deep_value_and_growth/,2021-03-29 19:27,27,5,0.56
2qhhq,investing,mbu9i0,2021-03-24 01:30,It appears the recent move in the US 10-year Treasury yield from 1.2% to 1.7% had very little to do with inflation expectations.,https://www.reddit.com/r/investing/comments/mbu9i0/it_appears_the_recent_move_in_the_us_10year/,2021-03-29 19:27,177,544,0.96
2qhhq,investing,mc095v,2021-03-24 07:48,Best stocks for the fourth industrial revolution,https://www.reddit.com/r/investing/comments/mc095v/best_stocks_for_the_fourth_industrial_revolution/,2021-03-29 19:27,194,483,0.91
2qhhq,investing,mc15v0,2021-03-24 09:00,Daily Advice Thread - All basic help or advice questions must be posted here.,https://www.reddit.com/r/investing/comments/mc15v0/daily_advice_thread_all_basic_help_or_advice/,2021-03-29 19:27,167,17,0.8
2qhhq,investing,mc16go,2021-03-24 09:01,"Daily General Discussion and spitballin thread - March 24, 2021",https://www.reddit.com/r/investing/comments/mc16go/daily_general_discussion_and_spitballin_thread/,2021-03-29 19:27,427,47,0.89
2qhhq,investing,mcfag2,2021-03-24 20:07,Preferred shares ETF in Canada a quick comparison,https://www.reddit.com/r/investing/comments/mcfag2/preferred_shares_etf_in_canada_a_quick_comparison/,2021-03-29 19:27,22,208,0.93
2qhhq,investing,mcpqqp,2021-03-25 04:19,"The SEC confirms it is investigating SoftBank for market manipulation. Softbank spent $17B worth of shares in the US tech market, with another $3.4B in bets to prop up their prices.",https://www.reddit.com/r/investing/comments/mcpqqp/the_sec_confirms_it_is_investigating_softbank_for/,2021-03-29 19:27,347,3344,0.99
2qhhq,investing,mcqwym,2021-03-25 05:31,"I love Jefferies - the company, the CEO, the stock (JEF)",https://www.reddit.com/r/investing/comments/mcqwym/i_love_jefferies_the_company_the_ceo_the_stock_jef/,2021-03-29 19:27,27,29,0.78
2qhhq,investing,mcrdwo,2021-03-25 06:02,S&P 500 vs MSCI world index,https://www.reddit.com/r/investing/comments/mcrdwo/sp_500_vs_msci_world_index/,2021-03-29 19:27,62,49,0.92
2qhhq,investing,mctu5w,2021-03-25 09:00,Daily Advice Thread - All basic help or advice questions must be posted here.,https://www.reddit.com/r/investing/comments/mctu5w/daily_advice_thread_all_basic_help_or_advice/,2021-03-29 19:27,238,21,0.93
2qhhq,investing,mctup9,2021-03-25 09:01,"Daily General Discussion and spitballin thread - March 25, 2021",https://www.reddit.com/r/investing/comments/mctup9/daily_general_discussion_and_spitballin_thread/,2021-03-29 19:27,511,29,0.84
2qhhq,investing,mcxfrj,2021-03-25 12:48,The End of Tesla's Dominance May Be Closer Than It Appears,https://www.reddit.com/r/investing/comments/mcxfrj/the_end_of_teslas_dominance_may_be_closer_than_it/,2021-03-29 19:27,534,254,0.76
2qhhq,investing,mcxxm8,2021-03-25 13:13,SEC filing points to Fidelity on creating a bitcoin ETF,https://www.reddit.com/r/investing/comments/mcxxm8/sec_filing_points_to_fidelity_on_creating_a/,2021-03-29 19:27,165,191,0.94
2qhhq,investing,md3d5a,2021-03-25 17:17,U.S. weekly jobless claims hit one-year low in boost to economic outlook,https://www.reddit.com/r/investing/comments/md3d5a/us_weekly_jobless_claims_hit_oneyear_low_in_boost/,2021-03-29 19:27,145,804,0.96
2qhhq,investing,md937s,2021-03-25 21:37,Fed says banks will have to wait until June 30 to start issuing buybacks and bigger dividends,https://www.reddit.com/r/investing/comments/md937s/fed_says_banks_will_have_to_wait_until_june_30_to/,2021-03-29 19:27,67,810,0.97
2qhhq,investing,mdkfqs,2021-03-26 09:00,Daily Advice Thread - All basic help or advice questions must be posted here.,https://www.reddit.com/r/investing/comments/mdkfqs/daily_advice_thread_all_basic_help_or_advice/,2021-03-29 19:27,164,24,0.88
2qhhq,investing,mdkgaz,2021-03-26 09:01,"Daily General Discussion and spitballin thread - March 26, 2021",https://www.reddit.com/r/investing/comments/mdkgaz/daily_general_discussion_and_spitballin_thread/,2021-03-29 19:27,468,36,0.87
2qhhq,investing,mdppti,2021-03-26 14:20,SoFi to give amateur investors early access to IPOs,https://www.reddit.com/r/investing/comments/mdppti/sofi_to_give_amateur_investors_early_access_to/,2021-03-29 19:27,262,1932,0.97
2qhhq,investing,mdxi4k,2021-03-26 20:20,VIAC oversold. Comparison inside.,https://www.reddit.com/r/investing/comments/mdxi4k/viac_oversold_comparison_inside/,2021-03-29 19:27,54,61,0.83
2qhhq,investing,me3qu9,2021-03-27 01:37,Extreme Diversification Portfolio,https://www.reddit.com/r/investing/comments/me3qu9/extreme_diversification_portfolio/,2021-03-29 19:27,157,64,0.79
2qhhq,investing,me7ymc,2021-03-27 06:02,"Ending China Stimulus / SEC Law Enacted Provide Unique Buying Opportunity For Chinese Companies (High Risk, High Reward)",https://www.reddit.com/r/investing/comments/me7ymc/ending_china_stimulus_sec_law_enacted_provide/,2021-03-29 19:27,392,494,0.88
2qhhq,investing,mea4sx,2021-03-27 09:00,Daily Advice Thread - All basic help or advice questions must be posted here.,https://www.reddit.com/r/investing/comments/mea4sx/daily_advice_thread_all_basic_help_or_advice/,2021-03-29 19:27,218,62,0.88
2qhhq,investing,mea5ci,2021-03-27 09:01,"Daily General Discussion and spitballin thread - March 27, 2021",https://www.reddit.com/r/investing/comments/mea5ci/daily_general_discussion_and_spitballin_thread/,2021-03-29 19:27,101,18,0.76
