Subreddit_ID,Subreddit_Name,Submission_ID,Submission_CreatedDate,Submission_Title,Submission_URL,Submission_LastFetched,Submission_NumComments,Submission_Score,Submission_UpvoteRatio
2qhhq,investing,mfike5,2021-03-29 05:33,"Failure of the fund to meet margin commitments, Credit Suisse and a number of other banks are in the process of exiting positions",https://www.reddit.com/r/investing/comments/mfike5/failure_of_the_fund_to_meet_margin_commitments/,2021-04-06 16:00,370,1511,0.98
2qhhq,investing,mfla6t,2021-03-29 09:00,Daily Advice Thread - All basic help or advice questions must be posted here.,https://www.reddit.com/r/investing/comments/mfla6t/daily_advice_thread_all_basic_help_or_advice/,2021-04-06 16:00,168,15,0.74
2qhhq,investing,mflatw,2021-03-29 09:01,"Daily General Discussion and spitballin thread - March 29, 2021",https://www.reddit.com/r/investing/comments/mflatw/daily_general_discussion_and_spitballin_thread/,2021-04-06 16:00,295,37,0.91
2qhhq,investing,mfq8df,2021-03-29 14:03,Activision Blizzard DD: Short Analysis,https://www.reddit.com/r/investing/comments/mfq8df/activision_blizzard_dd_short_analysis/,2021-04-06 16:00,96,9,0.55
2qhhq,investing,mfrova,2021-03-29 15:12,Ahchegos Capital Management,https://www.reddit.com/r/investing/comments/mfrova/ahchegos_capital_management/,2021-04-06 16:00,500,1033,0.95
2qhhq,investing,mfrvve,2021-03-29 15:21,ARKX top holdings by weight,https://www.reddit.com/r/investing/comments/mfrvve/arkx_top_holdings_by_weight/,2021-04-06 16:00,307,433,0.94
2qhhq,investing,mg6m07,2021-03-30 03:13,Negative numbers in financial statements.,https://www.reddit.com/r/investing/comments/mg6m07/negative_numbers_in_financial_statements/,2021-04-06 16:00,53,46,0.79
2qhhq,investing,mgbnbj,2021-03-30 09:00,Daily Advice Thread - All basic help or advice questions must be posted here.,https://www.reddit.com/r/investing/comments/mgbnbj/daily_advice_thread_all_basic_help_or_advice/,2021-04-06 16:00,206,21,0.89
2qhhq,investing,mgbntz,2021-03-30 09:01,"Daily General Discussion and spitballin thread - March 30, 2021",https://www.reddit.com/r/investing/comments/mgbntz/daily_general_discussion_and_spitballin_thread/,2021-04-06 16:00,326,26,0.9
2qhhq,investing,mgbwkw,2021-03-30 09:19,ARK Space Exploration ETF (ARKX) - Holdings Reveal,https://www.reddit.com/r/investing/comments/mgbwkw/ark_space_exploration_etf_arkx_holdings_reveal/,2021-04-06 16:00,188,112,0.9
2qhhq,investing,mgbyen,2021-03-30 09:22,Klarna - possible 2022 IPO,https://www.reddit.com/r/investing/comments/mgbyen/klarna_possible_2022_ipo/,2021-04-06 16:00,38,30,0.83
2qhhq,investing,mgcjkb,2021-03-30 10:05,"PayPal to allow Americans to pay with Bitcoin, Ethereum at millions of vendors",https://www.reddit.com/r/investing/comments/mgcjkb/paypal_to_allow_americans_to_pay_with_bitcoin/,2021-04-06 16:00,719,4565,0.97
2qhhq,investing,mguhq8,2021-03-31 00:58,Don't Confuse Archegos Collapse With Contagio - By Aaron Brown,https://www.reddit.com/r/investing/comments/mguhq8/dont_confuse_archegos_collapse_with_contagio_by/,2021-04-06 16:00,36,56,0.84
2qhhq,investing,mgwrdt,2021-03-31 03:05,"Might be a good time to short the Japanese stock market. It isn’t news yet, but another state of emergency looks likely in April",https://www.reddit.com/r/investing/comments/mgwrdt/might_be_a_good_time_to_short_the_japanese_stock/,2021-04-06 16:00,93,55,0.69
2qhhq,investing,mgwz1w,2021-03-31 03:18,FTC files suit against Illumina (ILMN) to block vertical integration with Grail,https://www.reddit.com/r/investing/comments/mgwz1w/ftc_files_suit_against_illumina_ilmn_to_block/,2021-04-06 16:00,25,48,0.89
2qhhq,investing,mh1yrw,2021-03-31 09:00,Daily Advice Thread - All basic help or advice questions must be posted here.,https://www.reddit.com/r/investing/comments/mh1yrw/daily_advice_thread_all_basic_help_or_advice/,2021-04-06 16:00,219,26,0.86
2qhhq,investing,mh1zc3,2021-03-31 09:01,"Daily General Discussion and spitballin thread - March 31, 2021",https://www.reddit.com/r/investing/comments/mh1zc3/daily_general_discussion_and_spitballin_thread/,2021-04-06 16:00,259,37,0.87
2qhhq,investing,mh4gbw,2021-03-31 11:54,My take on Gold's longterm outlook,https://www.reddit.com/r/investing/comments/mh4gbw/my_take_on_golds_longterm_outlook/,2021-04-06 16:00,118,28,0.62
2qhhq,investing,mh6l6f,2021-03-31 13:52,Goldman Sachs is close to offering bitcoin and other digital assets to its wealth management clients,https://www.reddit.com/r/investing/comments/mh6l6f/goldman_sachs_is_close_to_offering_bitcoin_and/,2021-04-06 16:00,519,1830,0.95
2qhhq,investing,mh8g4b,2021-03-31 15:22,"MKTY, the undiscovered biggest competitor of Riot and Mara",https://www.reddit.com/r/investing/comments/mh8g4b/mkty_the_undiscovered_biggest_competitor_of_riot/,2021-04-06 16:00,36,34,0.83
2qhhq,investing,mhe419,2021-03-31 19:48,Quantifying Beta Slippage (Why Leveraged ETFs are Not as Scary as You Might Think),https://www.reddit.com/r/investing/comments/mhe419/quantifying_beta_slippage_why_leveraged_etfs_are/,2021-04-06 16:00,69,67,0.86
2qhhq,investing,mhj59m,2021-04-01 00:03,"Microsoft wins U.S. Army contract for augmented-reality headsets, worth up to $21.9 billion over 10 years",https://www.reddit.com/r/investing/comments/mhj59m/microsoft_wins_us_army_contract_for/,2021-04-06 16:00,304,3910,0.98
2qhhq,investing,mhr8j1,2021-04-01 09:00,Daily Advice Thread - All basic help or advice questions must be posted here.,https://www.reddit.com/r/investing/comments/mhr8j1/daily_advice_thread_all_basic_help_or_advice/,2021-04-06 16:00,209,19,0.8
2qhhq,investing,mhr92m,2021-04-01 09:01,"Daily General Discussion and spitballin thread - April 01, 2021",https://www.reddit.com/r/investing/comments/mhr92m/daily_general_discussion_and_spitballin_thread/,2021-04-06 16:00,256,29,0.83
2qhhq,investing,mhvu4z,2021-04-01 13:56,Canadian Bitcoin ETFs available on Fidelity by enabling International Trading,https://www.reddit.com/r/investing/comments/mhvu4z/canadian_bitcoin_etfs_available_on_fidelity_by/,2021-04-06 16:00,32,84,0.84
2qhhq,investing,mhwqww,2021-04-01 14:40,BofA Global Research - Bitcoin's Dirty Little Secrets,https://www.reddit.com/r/investing/comments/mhwqww/bofa_global_research_bitcoins_dirty_little_secrets/,2021-04-06 16:00,621,194,0.83
2qhhq,investing,mhxvg1,2021-04-01 15:35,Investment in developing countries,https://www.reddit.com/r/investing/comments/mhxvg1/investment_in_developing_countries/,2021-04-06 16:00,72,37,0.82
2qhhq,investing,mhyhj4,2021-04-01 16:03,ChargePoint (CHPT) Due Diligence,https://www.reddit.com/r/investing/comments/mhyhj4/chargepoint_chpt_due_diligence/,2021-04-06 16:00,93,106,0.87
2qhhq,investing,mi2izd,2021-04-01 19:07,"”Tether's claims that its virtual currency was fully backed by U.S. dollars at all times was a lie,"" - NYAG",https://www.reddit.com/r/investing/comments/mi2izd/tethers_claims_that_its_virtual_currency_was/,2021-04-06 16:00,137,1823,0.92
2qhhq,investing,mig57o,2021-04-02 08:37,Investing w/ Climate Change on the Horizon,https://www.reddit.com/r/investing/comments/mig57o/investing_w_climate_change_on_the_horizon/,2021-04-06 16:00,239,67,0.72
2qhhq,investing,migerh,2021-04-02 09:00,Daily Advice Thread - All basic help or advice questions must be posted here.,https://www.reddit.com/r/investing/comments/migerh/daily_advice_thread_all_basic_help_or_advice/,2021-04-06 16:00,147,25,0.91
2qhhq,investing,migfcn,2021-04-02 09:01,"Daily General Discussion and spitballin thread - April 02, 2021",https://www.reddit.com/r/investing/comments/migfcn/daily_general_discussion_and_spitballin_thread/,2021-04-06 16:00,241,22,0.84
2qhhq,investing,mij0s2,2021-04-02 12:08,"ARKK Morningstar review: Unrestrained, Unaware, and Unconcerned",https://www.reddit.com/r/investing/comments/mij0s2/arkk_morningstar_review_unrestrained_unaware_and/,2021-04-06 16:00,167,80,0.77
2qhhq,investing,mijk9h,2021-04-02 12:42,I computed the weighted average upside for >100 ETFs. Here are the results.,https://www.reddit.com/r/investing/comments/mijk9h/i_computed_the_weighted_average_upside_for_100/,2021-04-06 16:00,46,98,0.93
2qhhq,investing,mijlje,2021-04-02 12:44,U.S. job growth accelerates in March; unemployment rate falls to 6.0%,https://www.reddit.com/r/investing/comments/mijlje/us_job_growth_accelerates_in_march_unemployment/,2021-04-06 16:00,677,2576,0.97
2qhhq,investing,mingyi,2021-04-02 16:10,Tesla deliveries in Q1 up from 88k (2020) to 184k,https://www.reddit.com/r/investing/comments/mingyi/tesla_deliveries_in_q1_up_from_88k_2020_to_184k/,2021-04-06 16:00,288,450,0.93
2qhhq,investing,mirtpv,2021-04-02 19:38,Coinbase direct listing set for April 14th,https://www.reddit.com/r/investing/comments/mirtpv/coinbase_direct_listing_set_for_april_14th/,2021-04-06 16:00,345,433,0.93
2qhhq,investing,mj1qwu,2021-04-03 04:57,Why are fossil fuel investors in the green for 2021? The clean energy trade seems overcrowded for now - JOHN DIZARD Opinion FTfm,https://www.reddit.com/r/investing/comments/mj1qwu/why_are_fossil_fuel_investors_in_the_green_for/,2021-04-06 16:00,29,24,0.82
2qhhq,investing,mj4vlw,2021-04-03 09:00,Daily Advice Thread - All basic help or advice questions must be posted here.,https://www.reddit.com/r/investing/comments/mj4vlw/daily_advice_thread_all_basic_help_or_advice/,2021-04-06 16:00,87,9,0.71
2qhhq,investing,mj4w7u,2021-04-03 09:01,"Daily General Discussion and spitballin thread - April 03, 2021",https://www.reddit.com/r/investing/comments/mj4w7u/daily_general_discussion_and_spitballin_thread/,2021-04-06 16:00,174,29,0.84
2qhhq,investing,mj8jqg,2021-04-03 13:30,Lumber Prices are Up 250% in the last 3 months,https://www.reddit.com/r/investing/comments/mj8jqg/lumber_prices_are_up_250_in_the_last_3_months/,2021-04-06 16:00,941,3025,0.97
2qhhq,investing,mjsnly,2021-04-04 09:00,Daily Advice Thread - All basic help or advice questions must be posted here.,https://www.reddit.com/r/investing/comments/mjsnly/daily_advice_thread_all_basic_help_or_advice/,2021-04-06 16:00,113,21,0.8
2qhhq,investing,mjso6b,2021-04-04 09:01,"Daily General Discussion and spitballin thread - April 04, 2021",https://www.reddit.com/r/investing/comments/mjso6b/daily_general_discussion_and_spitballin_thread/,2021-04-06 16:00,120,21,0.81
2qhhq,investing,mjvnrw,2021-04-04 12:50,Energy Transfer ($ET) DD from discord that I wrote.,https://www.reddit.com/r/investing/comments/mjvnrw/energy_transfer_et_dd_from_discord_that_i_wrote/,2021-04-06 16:00,40,72,0.81
2qhhq,investing,mjwo8q,2021-04-04 13:55,Waste Connections (WCN) and waste in general: Material beneficiaries of Biden's infrastructure policies,https://www.reddit.com/r/investing/comments/mjwo8q/waste_connections_wcn_and_waste_in_general/,2021-04-06 16:00,96,619,0.93
2qhhq,investing,mkga30,2021-04-05 09:00,Daily Advice Thread - All basic help or advice questions must be posted here.,https://www.reddit.com/r/investing/comments/mkga30/daily_advice_thread_all_basic_help_or_advice/,2021-04-06 16:00,167,48,0.84
2qhhq,investing,mkgamw,2021-04-05 09:01,"Daily General Discussion and spitballin thread - April 05, 2021",https://www.reddit.com/r/investing/comments/mkgamw/daily_general_discussion_and_spitballin_thread/,2021-04-06 16:00,322,105,0.9
2qhhq,investing,mkk8ws,2021-04-05 13:06,"If elevated valuations kept you out of the market, you might've missed out on some of the greatest market returns in history.",https://www.reddit.com/r/investing/comments/mkk8ws/if_elevated_valuations_kept_you_out_of_the_market/,2021-04-06 16:00,722,1530,0.94
2qhhq,investing,mkpudd,2021-04-05 17:20,Arcimoto ($FUV) valuation compared to other EV companies,https://www.reddit.com/r/investing/comments/mkpudd/arcimoto_fuv_valuation_compared_to_other_ev/,2021-04-06 16:00,25,12,0.76
2qhhq,investing,mky1ae,2021-04-05 23:35,"With AT&T signaling numerous times that its dividend is safe, investors can comfortably count on this nearly 7% yield.",https://www.reddit.com/r/investing/comments/mky1ae/with_att_signaling_numerous_times_that_its/,2021-04-06 16:00,181,430,0.87
2qhhq,investing,mkzjy4,2021-04-06 00:53,"Real estate is dangerous, change my mind.",https://www.reddit.com/r/investing/comments/mkzjy4/real_estate_is_dangerous_change_my_mind/,2021-04-06 16:00,135,112,0.75
2th52,wallstreetbets,mdxs3r,2021-03-26 20:33,DADDIES BACK!(Kind of) RKT 630k YOLO EOW update,https://www.reddit.com/gallery/mdxs3r,2021-04-06 16:01,38,128,0.8
2th52,wallstreetbets,mdy7vb,2021-03-26 20:54,"Not gonna lie, this one stung a little. Sold these covered calls 2 days before the rocket out of the $40s. Still hold more shares though so don’t count me out completely!",https://i.redd.it/ytem0voerfp61.jpg,2021-04-06 16:01,42,37,0.75
2th52,wallstreetbets,mdy9be,2021-03-26 20:56,Opportunity to gain about 10-15% on $MX (Bought Out),https://www.reddit.com/r/wallstreetbets/comments/mdy9be/opportunity_to_gain_about_1015_on_mx_bought_out/,2021-04-06 16:01,21,19,0.7
2th52,wallstreetbets,mdylm7,2021-03-26 21:12,I tried buying the dip multiple times today...,https://i.redd.it/hbznknidufp61.png,2021-04-06 16:01,55,465,0.94
2th52,wallstreetbets,mdyqtv,2021-03-26 21:20,UWMC $100k Start - 03/26/2021 Update,https://www.reddit.com/r/wallstreetbets/comments/mdyqtv/uwmc_100k_start_03262021_update/,2021-04-06 16:01,65,129,0.82
2th52,wallstreetbets,mdyt5s,2021-03-26 21:23,"Persistence on the yolo always pays off, especially when yo down and decide to quadruple down lol. PE is less than 6 and well fintechs trade at a 15-30 so I'm smelling $75 minimum tendies....",https://i.redd.it/olbe798iwfp61.jpg,2021-04-06 16:01,24,41,0.74
2th52,wallstreetbets,mdyvh8,2021-03-26 21:26,I still believe in a bullish bias for GME (Technical Analysis),https://www.reddit.com/r/wallstreetbets/comments/mdyvh8/i_still_believe_in_a_bullish_bias_for_gme/,2021-04-06 16:01,154,1560,0.94
2th52,wallstreetbets,mdz4xy,2021-03-26 21:39,$APHA & $TLRY Stockholders Be Sure to Vote for the Merger,https://i.redd.it/e1ia2aufzfp61.jpg,2021-04-06 16:01,85,879,0.94
2th52,wallstreetbets,mdz6oc,2021-03-26 21:41,Join /r/WallStreetBets' Third Annual Paper Trading Competition!,https://www.reddit.com/r/wallstreetbets/comments/mdz6oc/join_rwallstreetbets_third_annual_paper_trading/,2021-04-06 16:01,16412,6972,0.98
2th52,wallstreetbets,mdzq3q,2021-03-26 22:08,Here’s a little snack for my fellow 🦧 and your loss porn fetish... you take it and fantasize all you want. 😉,https://i.redd.it/bceua5li4gp61.jpg,2021-04-06 16:01,23,38,0.81
2th52,wallstreetbets,mdzu2a,2021-03-26 22:13,First post for this Retard Ape from Dallas joining the shit show...FU Hedgies,https://i.redd.it/yte10sz95gp61.jpg,2021-04-06 16:01,28,337,0.91
2th52,wallstreetbets,me09qm,2021-03-26 22:34,GME - I spent a long time on this pls be kind,https://v.redd.it/99yt2vs39gp61,2021-04-06 16:01,522,12238,0.93
2th52,wallstreetbets,me0jq0,2021-03-26 22:49,Any chances I break even?,https://i.redd.it/6mokl58ubgp61.jpg,2021-04-06 16:01,57,51,0.8
2th52,wallstreetbets,me13xm,2021-03-26 23:17,"DD: Part 2 I counted all the Wallstreetbets GME yolos, gains and loss porn",https://www.reddit.com/r/wallstreetbets/comments/me13xm/dd_part_2_i_counted_all_the_wallstreetbets_gme/,2021-04-06 16:01,130,214,0.94
2th52,wallstreetbets,me1iq4,2021-03-26 23:38,412k QQQJ YOLO - March 26th 2021 - If you guys are interested I can post the order history. You probably wont be able to read anything though,https://i.redd.it/nrumhxagkgp61.jpg,2021-04-06 16:01,50,45,0.86
2th52,wallstreetbets,me1olx,2021-03-26 23:47,Full Circle,https://www.reddit.com/gallery/me1olx,2021-04-06 16:01,52,165,0.92
2th52,wallstreetbets,me1tz4,2021-03-26 23:55,"VIAC YOLO Update - Shorty tried to crucify me, but I can play your game too shorty! BRING IT ON YOU SHORT CUCKS!!!",https://www.reddit.com/gallery/me1tz4,2021-04-06 16:01,44,21,0.66
2th52,wallstreetbets,me1xha,2021-03-27 00:00,Am I Doing This Right? Holding Till I Make 500k Or Go To 0! Update Part 3,https://i.redd.it/or126b9jogp61.jpg,2021-04-06 16:01,40,121,0.9
2th52,wallstreetbets,me2h9g,2021-03-27 00:28,YOLO,https://i.redd.it/gpts6j0ntgp61.jpg,2021-04-06 16:01,29,63,0.87
2th52,wallstreetbets,me2ste,2021-03-27 00:45,$FUBO Been fighting with this stock for a while. Tons and tons of average down. Took loss (because of margin calls) and got back again and again had to average down. Any suggestions of what to do would be appreciated 🤘🏻 (Current plan is to HODL),https://i.redd.it/41krs9bmwgp61.jpg,2021-04-06 16:01,50,35,0.8
2th52,wallstreetbets,me2t7x,2021-03-27 00:46,"It's not much, but it's honest work GSX Puts (yes finally something non GME)",https://www.reddit.com/gallery/me2t7x,2021-04-06 16:01,82,613,0.84
2th52,wallstreetbets,me2uz3,2021-03-27 00:49,Getting closer ... looking to pay off the mortgage from emergency account funds,https://i.redd.it/wrdeesg8xgp61.jpg,2021-04-06 16:01,261,3131,0.97
2th52,wallstreetbets,me36cp,2021-03-27 01:06,By popular demand- all 8 accounts. 100% GME. 💎🙌🚀,https://www.reddit.com/gallery/me36cp,2021-04-06 16:01,63,574,0.95
2th52,wallstreetbets,me3f3r,2021-03-27 01:19,ZeroG34R's Friday DD - ($MVIS),https://www.reddit.com/r/wallstreetbets/comments/me3f3r/zerog34rs_friday_dd_mvis/,2021-04-06 16:01,23,112,0.96
2th52,wallstreetbets,me3nco,2021-03-27 01:32,"Has any other DD(except DFV's) managed to forecast accurately down to the minute, $GME week to week price movement ? Gamma Squeeze Calculator update 🔭👨‍🚀🚀🌕☄️🌌",https://www.reddit.com/r/wallstreetbets/comments/me3nco/has_any_other_ddexcept_dfvs_managed_to_forecast/,2021-04-06 16:01,66,727,0.91
2th52,wallstreetbets,me3sif,2021-03-27 01:39,I decided to pay my folks back for all the money they've spent at Gamestop on me over the years! They're the real Apes.,https://www.reddit.com/r/wallstreetbets/comments/me3sif/i_decided_to_pay_my_folks_back_for_all_the_money/,2021-04-06 16:01,335,6943,0.95
2th52,wallstreetbets,me3v6b,2021-03-27 01:44,"Added $97,500 worth of bananas to the fight today - better late than never",https://i.redd.it/rw8r8l227hp61.jpg,2021-04-06 16:01,315,9015,0.97
2th52,wallstreetbets,me3xmb,2021-03-27 01:47,$BB 235k YOLO Update: March 26th 2021 - Earnings Week Next Week,https://i.redd.it/rzgxjz8h7hp61.png,2021-04-06 16:01,52,321,0.91
2th52,wallstreetbets,me3yzj,2021-03-27 01:50,"$GME Potential Pattern: Cup with Handle Analysis Part 2. Bullish handle breakout analysis – MACD, W%R, DMI based analysis. With other examples this time!",https://www.reddit.com/r/wallstreetbets/comments/me3yzj/gme_potential_pattern_cup_with_handle_analysis/,2021-04-06 16:01,195,1383,0.93
2th52,wallstreetbets,me481f,2021-03-27 02:03,key investing fundamental from CNBC,https://i.redd.it/dvq2nfmf9hp61.jpg,2021-04-06 16:01,241,5555,0.98
2th52,wallstreetbets,me5l7l,2021-03-27 03:22,"From $59k to $123k > Gains from $GME,$ AMC,$ NIO, $XPEV in 2021 YTD",https://www.reddit.com/r/wallstreetbets/comments/me5l7l/from_59k_to_123k_gains_from_gme_amc_nio_xpev_in/,2021-04-06 16:01,21,227,0.93
2th52,wallstreetbets,me66fl,2021-03-27 03:59,"Unzip Your Pants, Enjoy The Loss Porn",https://www.reddit.com/r/wallstreetbets/comments/me66fl/unzip_your_pants_enjoy_the_loss_porn/,2021-04-06 16:01,133,451,0.94
2th52,wallstreetbets,me67wj,2021-03-27 04:01,$BB $233K YOLO on 20K shares. Averaged UP! How much will I make on Wednesday morning? What about you?,https://i.redd.it/fwdbezmmvhp61.jpg,2021-04-06 16:01,269,910,0.9
2th52,wallstreetbets,me6l6i,2021-03-27 04:25,Who else here plays futures?,https://www.reddit.com/gallery/me6l6i,2021-04-06 16:01,41,34,0.74
2th52,wallstreetbets,me8lxq,2021-03-27 06:52,Most Anticipated Earnings Releases for the week beginning March 29,https://i.redd.it/9tc4q8m1qip61.png,2021-04-06 16:01,98,293,0.96
2th52,wallstreetbets,me96s8,2021-03-27 07:39,Take care of your neurons during stressful market times.,https://www.reddit.com/r/wallstreetbets/comments/me96s8/take_care_of_your_neurons_during_stressful_market/,2021-04-06 16:01,89,425,0.96
2th52,wallstreetbets,mear0m,2021-03-27 09:53,FORD $F UPDATE #3 🚀🚀🚀,https://www.reddit.com/gallery/mear0m,2021-04-06 16:01,46,30,0.75
2th52,wallstreetbets,meard1,2021-03-27 09:54,"As a student, yoloing all I have has never been more fun than on this wild ride and I will HODL for as long as I can!",https://i.redd.it/5a80p1rlmjp61.jpg,2021-04-06 16:01,178,1909,0.95
2th52,wallstreetbets,mec3k3,2021-03-27 11:37,Elevators go Up and Down (OTIS Puts play),https://www.reddit.com/r/wallstreetbets/comments/mec3k3/elevators_go_up_and_down_otis_puts_play/,2021-04-06 16:01,84,107,0.9
2th52,wallstreetbets,medswq,2021-03-27 13:28,Michael Jordan has NO proven connection to GameStop,https://www.reddit.com/r/wallstreetbets/comments/medswq/michael_jordan_has_no_proven_connection_to/,2021-04-06 16:01,246,1985,0.94
2th52,wallstreetbets,mee0c8,2021-03-27 13:41,Novaxaire or broke by April 16. I have put 85% of my money in novawax options and remaining 15% in moderna options which expire on April 16,https://i.redd.it/ba28txl0rkp61.jpg,2021-04-06 16:01,61,56,0.78
2th52,wallstreetbets,mee2j7,2021-03-27 13:44,GME AND PLTR YOLO. Let’s see this fly Monday and I’ll go all in on GME shares.,https://i.redd.it/v0l0gkomrkp61.jpg,2021-04-06 16:01,87,492,0.92
2th52,wallstreetbets,meerlu,2021-03-27 14:24,Forced YOLO 52K into Gamestop. I like the stock! 🦍 🚀🚀🚀,https://i.redd.it/rzfhtnhpykp61.jpg,2021-04-06 16:01,65,1031,0.94
2th52,wallstreetbets,mefniu,2021-03-27 15:12,"15k -> 130k YOLOd my whole account over the course of a day, added my savings account a week later and my transformation from boomer investor to retard ape was complete",https://i.redd.it/xgf4d9fy6lp61.jpg,2021-04-06 16:01,257,3176,0.9
2th52,wallstreetbets,megnpl,2021-03-27 16:03,Hedge Fund Rumored to have gotten blown up: Forced to Liquidate over 30 Billion in assets: Some stocks heavily discounted.,https://www.reddit.com/r/wallstreetbets/comments/megnpl/hedge_fund_rumored_to_have_gotten_blown_up_forced/,2021-04-06 16:01,1157,7853,0.97
2th52,wallstreetbets,meh2ud,2021-03-27 16:24,Most discussed stocks of the week and their sentiment! What are your moves for next week?,https://www.reddit.com/r/wallstreetbets/comments/meh2ud/most_discussed_stocks_of_the_week_and_their/,2021-04-06 16:01,44,179,0.94
2th52,wallstreetbets,meh8z1,2021-03-27 16:32,Tools used to navigate the market,https://www.reddit.com/r/wallstreetbets/comments/meh8z1/tools_used_to_navigate_the_market/,2021-04-06 16:01,66,125,0.93
2th52,wallstreetbets,mehxm6,2021-03-27 17:05,"Who needs life “savings” anyway amirite? Held it for 2 months, what’s another 25 to life",https://i.redd.it/f6ul9ycirlp61.jpg,2021-04-06 16:01,73,1842,0.96
2th52,wallstreetbets,mei102,2021-03-27 17:10,$BB - 3/26/2021 - Technical Analysis and Earnings,https://www.reddit.com/r/wallstreetbets/comments/mei102/bb_3262021_technical_analysis_and_earnings/,2021-04-06 16:01,110,353,0.92
2th52,wallstreetbets,meikve,2021-03-27 17:38,"Inspired by many others, I hit a few GameStop’s and got some Switch’s, games, etc to donate to my local Children’s Hospital. Thanks WSB, we like the stock!",https://i.redd.it/ksk24xqexlp61.jpg,2021-04-06 16:01,1802,108954,0.85
2th52,wallstreetbets,mej0qc,2021-03-27 18:01,Gamestop on first floor of building before reaching roof top for rocket launch,https://i.redd.it/rpffugjd1mp61.png,2021-04-06 16:01,97,1322,0.9
2th52,wallstreetbets,mej15u,2021-03-27 18:01,What are some of the biggest WSB fails in the sub's history?,https://www.reddit.com/r/wallstreetbets/comments/mej15u/what_are_some_of_the_biggest_wsb_fails_in_the/,2021-04-06 16:01,407,654,0.89
2th52,wallstreetbets,mejdcu,2021-03-27 18:19,"I Will Own GameStop - Update Mar 27, 2021 (In Honor of RC's Tweet)",https://i.redd.it/a03n3b664mp61.jpg,2021-04-06 16:01,150,2721,0.96
2th52,wallstreetbets,mejezz,2021-03-27 18:21,Understanding Mexican-American Trade: The USMCA and North America’s First Intercontinental Railroad. Kansas City Southern ($KSU) and Canadian Pacific ($CP) Merger DD.,https://www.reddit.com/r/wallstreetbets/comments/mejezz/understanding_mexicanamerican_trade_the_usmca_and/,2021-04-06 16:01,60,191,0.93
2th52,wallstreetbets,mejiv0,2021-03-27 18:27,Suez Newbie DD,https://www.reddit.com/r/wallstreetbets/comments/mejiv0/suez_newbie_dd/,2021-04-06 16:01,74,116,0.88
2th52,wallstreetbets,mejoqp,2021-03-27 18:35,UWMC 80% in between 2 accounts in for the long haul,https://www.reddit.com/gallery/mejoqp,2021-04-06 16:01,72,158,0.76
2th52,wallstreetbets,mek4lo,2021-03-27 18:58,Peruvian elections and why I'm shorting SCCO,https://www.reddit.com/r/wallstreetbets/comments/mek4lo/peruvian_elections_and_why_im_shorting_scco/,2021-04-06 16:01,41,84,0.84
2th52,wallstreetbets,mek9iw,2021-03-27 19:04,How to profit from the Suez Canal,https://www.reddit.com/r/wallstreetbets/comments/mek9iw/how_to_profit_from_the_suez_canal/,2021-04-06 16:01,210,632,0.92
2th52,wallstreetbets,meko2o,2021-03-27 19:24,AMD to the moon. Short Squeeze and record breaking sales YOY accompanied by arguably the best management on the NYSE.,https://i.redd.it/5e1uno87gmp61.jpg,2021-04-06 16:01,43,0,0.5
2th52,wallstreetbets,mel4fo,2021-03-27 19:47,You (options) vs the guy she tells you not to worry about (stonks). This non financial advice brought to you by a stockholding bonobo 🦧,https://i.redd.it/4060halakmp61.jpg,2021-04-06 16:01,69,436,0.93
2th52,wallstreetbets,meleb9,2021-03-27 20:00,Don’t you hate when you accidentally end with a $6.4M long SPY position during the weekend after your weekly 395C finish in the money?,https://www.reddit.com/gallery/meleb9,2021-04-06 16:01,211,737,0.94
2th52,wallstreetbets,melf8c,2021-03-27 20:02,$FSR Updated Price Target: $4.21,https://www.reddit.com/r/wallstreetbets/comments/melf8c/fsr_updated_price_target_421/,2021-04-06 16:01,57,70,0.75
2th52,wallstreetbets,mem5h3,2021-03-27 20:38,My DD on the the perfect storm for Americas largest steel manufacture....CLF,https://www.reddit.com/r/wallstreetbets/comments/mem5h3/my_dd_on_the_the_perfect_storm_for_americas/,2021-04-06 16:01,168,354,0.88
