Subreddit_ID,Subreddit_Name,Submission_ID,Submission_CreatedDate,Submission_Title,Submission_URL,Submission_LastFetched,Submission_NumComments,Submission_Score,Submission_UpvoteRatio
2qhhq,investing,kahey7,2020-12-10 15:37,"Airbnb was valued $18B in March, today at $150/sh it's nearly worth $90B",https://www.reddit.com/r/investing/comments/kahey7/airbnb_was_valued_18b_in_march_today_at_150sh_its/,2020-12-28 22:01,840,2781,0.98
2qhhq,investing,kahxhb,2020-12-10 16:04,How to spot emerging stocks and trends BEFORE they happen?,https://www.reddit.com/r/investing/comments/kahxhb/how_to_spot_emerging_stocks_and_trends_before/,2020-12-28 22:01,97,45,0.81
2qhhq,investing,kai0z5,2020-12-10 16:09,What is your investment strategy on MSFT? AAPL?,https://www.reddit.com/r/investing/comments/kai0z5/what_is_your_investment_strategy_on_msft_aapl/,2020-12-28 22:01,46,15,0.72
2qhhq,investing,kai7ik,2020-12-10 16:18,Anybody successfully receive ABNB ipo shares?,https://www.reddit.com/r/investing/comments/kai7ik/anybody_successfully_receive_abnb_ipo_shares/,2020-12-28 22:01,22,5,0.67
2qhhq,investing,kaka9h,2020-12-10 17:58,Snowflake (SNOW) heads up,https://www.reddit.com/r/investing/comments/kaka9h/snowflake_snow_heads_up/,2020-12-28 22:01,121,305,0.94
2qhhq,investing,kam0ot,2020-12-10 19:22,Understanding MMEDF and NASDAQ uplisting,https://www.reddit.com/r/investing/comments/kam0ot/understanding_mmedf_and_nasdaq_uplisting/,2020-12-28 22:01,20,40,0.88
2qhhq,investing,kamfpf,2020-12-10 19:42,MassMutual Joins the Bitcoin Club With $100 Million Purchase,https://www.reddit.com/r/investing/comments/kamfpf/massmutual_joins_the_bitcoin_club_with_100/,2020-12-28 22:01,126,66,0.84
2qhhq,investing,kamkjc,2020-12-10 19:48,The Market Hasn't Been This Overvalued since the Dot-com Bubble,https://www.reddit.com/r/investing/comments/kamkjc/the_market_hasnt_been_this_overvalued_since_the/,2020-12-28 22:01,121,67,0.75
2qhhq,investing,kan9hc,2020-12-10 20:21,Better IPO Experience Than Fidelity?,https://www.reddit.com/r/investing/comments/kan9hc/better_ipo_experience_than_fidelity/,2020-12-28 22:01,22,1,0.53
2qhhq,investing,kap98v,2020-12-10 22:27,What do you think about long-term investments in uranium and nuclear energy?,https://www.reddit.com/r/investing/comments/kap98v/what_do_you_think_about_longterm_investments_in/,2020-12-28 22:01,22,10,0.76
2qhhq,investing,kapj70,2020-12-10 22:45,Why is Costco's P/E so high?,https://www.reddit.com/r/investing/comments/kapj70/why_is_costcos_pe_so_high/,2020-12-28 22:01,26,28,0.84
2qhhq,investing,kaq0c1,2020-12-10 23:10,SPY 2021 Bear,https://www.reddit.com/r/investing/comments/kaq0c1/spy_2021_bear/,2020-12-28 22:01,23,5,0.67
2qhhq,investing,kasgur,2020-12-11 01:20,"Disney investor day highlights (tl;dr expects 230-260 mil subs in 2024, tons of new content, price hikes)",https://www.reddit.com/r/investing/comments/kasgur/disney_investor_day_highlights_tldr_expects/,2020-12-28 22:01,108,249,0.95
2qhhq,investing,kauf67,2020-12-11 03:10,GHIV SPAC,https://www.reddit.com/r/investing/comments/kauf67/ghiv_spac/,2020-12-28 22:01,29,42,0.9
2qhhq,investing,kautim,2020-12-11 03:34,Can hobby investors really beat the market long-term?,https://www.reddit.com/r/investing/comments/kautim/can_hobby_investors_really_beat_the_market/,2020-12-28 22:01,83,40,0.84
2qhhq,investing,kawnbx,2020-12-11 05:30,Investing in ARK vs manually investing in what stock ARK buys?,https://www.reddit.com/r/investing/comments/kawnbx/investing_in_ark_vs_manually_investing_in_what/,2020-12-28 22:01,61,41,0.82
2qhhq,investing,kb1lze,2020-12-11 12:11,Daily Advice Thread - All basic help or advice questions must be posted here.,https://www.reddit.com/r/investing/comments/kb1lze/daily_advice_thread_all_basic_help_or_advice/,2020-12-28 22:01,122,8,0.74
2qhhq,investing,kb2qcx,2020-12-11 13:26,Presentation of SLS: The Play,https://www.reddit.com/r/investing/comments/kb2qcx/presentation_of_sls_the_play/,2020-12-28 22:01,39,25,0.69
2qhhq,investing,kb3ueb,2020-12-11 14:32,How does the share price affect the company?,https://www.reddit.com/r/investing/comments/kb3ueb/how_does_the_share_price_affect_the_company/,2020-12-28 22:01,63,68,0.87
2qhhq,investing,kb4ln0,2020-12-11 15:14,The current IPO craze is starting to look a lot like 1999 - BNN,https://www.reddit.com/r/investing/comments/kb4ln0/the_current_ipo_craze_is_starting_to_look_a_lot/,2020-12-28 22:01,548,1580,0.96
2qhhq,investing,kb4ohg,2020-12-11 15:18,My Theory on What Just Happpend,https://www.reddit.com/r/investing/comments/kb4ohg/my_theory_on_what_just_happpend/,2020-12-28 22:01,27,0,0.25
2qhhq,investing,kb7j0w,2020-12-11 17:49,How to spot a bubble,https://www.reddit.com/r/investing/comments/kb7j0w/how_to_spot_a_bubble/,2020-12-28 22:01,110,50,0.66
2qhhq,investing,kb802a,2020-12-11 18:14,"Help me find an exchange that trades MMED.NE (OTCQB market)! (Not on Fidelity, RH, WeBull)",https://www.reddit.com/r/investing/comments/kb802a/help_me_find_an_exchange_that_trades_mmedne_otcqb/,2020-12-28 22:01,24,0,0.33
2qhhq,investing,kb8e77,2020-12-11 18:34,How important is a 401K plan as a new-grad?,https://www.reddit.com/r/investing/comments/kb8e77/how_important_is_a_401k_plan_as_a_newgrad/,2020-12-28 22:01,28,2,0.6
2qhhq,investing,kb8h3j,2020-12-11 18:38,Motley fool and nytimes writers can totally buy up a popular stock then write a positive article about them write?,https://www.reddit.com/r/investing/comments/kb8h3j/motley_fool_and_nytimes_writers_can_totally_buy/,2020-12-28 22:01,21,8,0.65
2qhhq,investing,kbboci,2020-12-11 21:24,Why Is ABNB Going Down If It's So Popular?,https://www.reddit.com/r/investing/comments/kbboci/why_is_abnb_going_down_if_its_so_popular/,2020-12-28 22:01,20,0,0.29
2qhhq,investing,kbennw,2020-12-12 00:09,When do you think the ideal time is to exit recovery stocks?,https://www.reddit.com/r/investing/comments/kbennw/when_do_you_think_the_ideal_time_is_to_exit/,2020-12-28 22:01,23,16,0.81
2qhhq,investing,kbg0vg,2020-12-12 01:33,MSFT v GOOG,https://www.reddit.com/r/investing/comments/kbg0vg/msft_v_goog/,2020-12-28 22:01,45,15,0.78
2qhhq,investing,kbgb2l,2020-12-12 01:52,Is now a bad time to invest in index funds and ETFs?,https://www.reddit.com/r/investing/comments/kbgb2l/is_now_a_bad_time_to_invest_in_index_funds_and/,2020-12-28 22:01,103,33,0.79
2qhhq,investing,kbgic7,2020-12-12 02:04,Toyota battery tech could be the key to transitioning to EV's and leave Tesla in the dust,https://www.reddit.com/r/investing/comments/kbgic7/toyota_battery_tech_could_be_the_key_to/,2020-12-28 22:01,227,161,0.81
2qhhq,investing,kbgtbu,2020-12-12 02:23,For all those who know we are in a bubble but think they can get out in time,https://www.reddit.com/r/investing/comments/kbgtbu/for_all_those_who_know_we_are_in_a_bubble_but/,2020-12-28 22:01,544,851,0.93
2qhhq,investing,kbijfo,2020-12-12 04:15,Frustrated by Jim Cramer - who I liked and respected - but see him flip-flopping too much on how to trade millennial stocks,https://www.reddit.com/r/investing/comments/kbijfo/frustrated_by_jim_cramer_who_i_liked_and/,2020-12-28 22:01,28,0,0.42
2qhhq,investing,kbkk7c,2020-12-12 06:49,Carvana and Wayfair prove consumers will overpay for convenience above all else,https://www.reddit.com/r/investing/comments/kbkk7c/carvana_and_wayfair_prove_consumers_will_overpay/,2020-12-28 22:01,144,207,0.85
2qhhq,investing,kbmqf3,2020-12-12 10:04,Anyone else shorting TSLA?,https://www.reddit.com/r/investing/comments/kbmqf3/anyone_else_shorting_tsla/,2020-12-28 22:01,182,51,0.69
2qhhq,investing,kbo3xm,2020-12-12 12:08,Daily Advice Thread - All basic help or advice questions must be posted here.,https://www.reddit.com/r/investing/comments/kbo3xm/daily_advice_thread_all_basic_help_or_advice/,2020-12-28 22:01,86,8,0.8
2qhhq,investing,kbopcx,2020-12-12 12:59,The big problem with this and other 'big' subreddits - Popular stocks and funds.,https://www.reddit.com/r/investing/comments/kbopcx/the_big_problem_with_this_and_other_big/,2020-12-28 22:01,543,865,0.81
2qhhq,investing,kbq627,2020-12-12 14:43,AT&T recovery missing so far?,https://www.reddit.com/r/investing/comments/kbq627/att_recovery_missing_so_far/,2020-12-28 22:01,75,79,0.89
2qhhq,investing,kbr46k,2020-12-12 15:41,Anyone Bullish on the Travel Industry for 2021 moving forward?,https://www.reddit.com/r/investing/comments/kbr46k/anyone_bullish_on_the_travel_industry_for_2021/,2020-12-28 22:01,216,229,0.9
2qhhq,investing,kbt80o,2020-12-12 17:42,Observation: The 10-year US Treasury Yield,https://www.reddit.com/r/investing/comments/kbt80o/observation_the_10year_us_treasury_yield/,2020-12-28 22:01,25,13,0.72
2qhhq,investing,kbw9oz,2020-12-12 20:28,Categorizing the cloud market,https://www.reddit.com/r/investing/comments/kbw9oz/categorizing_the_cloud_market/,2020-12-28 22:01,25,18,0.78
2qhhq,investing,kbwwd2,2020-12-12 21:02,Green energy boom: what level of federal support is priced into those stocks?,https://www.reddit.com/r/investing/comments/kbwwd2/green_energy_boom_what_level_of_federal_support/,2020-12-28 22:01,60,45,0.85
2qhhq,investing,kbwywx,2020-12-12 21:06,Corsair Gaming (CRSR) - Due Diligence (DD) - Semi-Long Post.,https://www.reddit.com/r/investing/comments/kbwywx/corsair_gaming_crsr_due_diligence_dd_semilong_post/,2020-12-28 22:01,102,432,0.96
2qhhq,investing,kbxc74,2020-12-12 21:25,Future Predictions: Visa $V Mastercard $MA & Crypto,https://www.reddit.com/r/investing/comments/kbxc74/future_predictions_visa_v_mastercard_ma_crypto/,2020-12-28 22:01,34,2,0.58
2qhhq,investing,kbxnmu,2020-12-12 21:43,Fourteen percent increase in M1 money supply in the last two weeks. Is this cause for alarm?,https://www.reddit.com/r/investing/comments/kbxnmu/fourteen_percent_increase_in_m1_money_supply_in/,2020-12-28 22:01,310,591,0.95
2qhhq,investing,kbyoau,2020-12-12 22:40,Redwood Materials Vs ABML,https://www.reddit.com/r/investing/comments/kbyoau/redwood_materials_vs_abml/,2020-12-28 22:01,20,26,0.81
2qhhq,investing,kc2esd,2020-12-13 02:29,Dividends Will Have Their Day Again,https://www.reddit.com/r/investing/comments/kc2esd/dividends_will_have_their_day_again/,2020-12-28 22:01,107,114,0.86
2qhhq,investing,kc5nke,2020-12-13 06:15,Peloton is one of six companies set to be added to soaring Nasdaq 100 index in annual shake up,https://www.reddit.com/r/investing/comments/kc5nke/peloton_is_one_of_six_companies_set_to_be_added/,2020-12-28 22:01,566,944,0.95
2qhhq,investing,kc6dm8,2020-12-13 07:16,$NET and its rise,https://www.reddit.com/r/investing/comments/kc6dm8/net_and_its_rise/,2020-12-28 22:01,22,10,0.66
2qhhq,investing,kc9la5,2020-12-13 12:10,Daily Advice Thread - All basic help or advice questions must be posted here.,https://www.reddit.com/r/investing/comments/kc9la5/daily_advice_thread_all_basic_help_or_advice/,2020-12-28 22:01,108,15,0.76
2qhhq,investing,kc9r3w,2020-12-13 12:24,What’s your favorite ETF that’s pays dividends monthly?,https://www.reddit.com/r/investing/comments/kc9r3w/whats_your_favorite_etf_thats_pays_dividends/,2020-12-28 22:01,211,281,0.91
2qhhq,investing,kca0fa,2020-12-13 12:44,Oil Tanker Stock,https://www.reddit.com/r/investing/comments/kca0fa/oil_tanker_stock/,2020-12-28 22:01,21,13,0.71
2qhhq,investing,kca6ad,2020-12-13 12:57,iRobot - A great company undervalued by 43%.,https://www.reddit.com/r/investing/comments/kca6ad/irobot_a_great_company_undervalued_by_43/,2020-12-28 22:01,42,29,0.74
2qhhq,investing,kcdzl8,2020-12-13 16:56,Is growth stocks really so risky?,https://www.reddit.com/r/investing/comments/kcdzl8/is_growth_stocks_really_so_risky/,2020-12-28 22:01,26,1,0.53
2qhhq,investing,kce2yj,2020-12-13 17:00,"Long DISNEY for the next 2 weeks! BUY ALL DIPS, Great Risk/Reward",https://www.reddit.com/r/investing/comments/kce2yj/long_disney_for_the_next_2_weeks_buy_all_dips/,2020-12-28 22:01,22,0,0.31
2qhhq,investing,kce9e7,2020-12-13 17:10,Why don’t the wealthy ($50 million+) just use the simple 3 fund portfolio (VTI/VXUS/BND)?,https://www.reddit.com/r/investing/comments/kce9e7/why_dont_the_wealthy_50_million_just_use_the/,2020-12-28 22:01,478,1166,0.93
2qhhq,investing,kcgkvr,2020-12-13 19:11,Hotel REITs for long term holding,https://www.reddit.com/r/investing/comments/kcgkvr/hotel_reits_for_long_term_holding/,2020-12-28 22:01,40,30,0.85
2qhhq,investing,kciq27,2020-12-13 21:02,"What is the catalyst for the next market crash, and what industries to invest in to counter it?",https://www.reddit.com/r/investing/comments/kciq27/what_is_the_catalyst_for_the_next_market_crash/,2020-12-28 22:01,37,8,0.63
2qhhq,investing,kckaam,2020-12-13 22:25,The CRISPR data dump continues,https://www.reddit.com/r/investing/comments/kckaam/the_crispr_data_dump_continues/,2020-12-28 22:01,47,148,0.92
2qhhq,investing,kcm4fv,2020-12-14 00:04,Why I Think Lemonade (LMND) is a Great Long Term Stock (Looking for Constructive Criticism),https://www.reddit.com/r/investing/comments/kcm4fv/why_i_think_lemonade_lmnd_is_a_great_long_term/,2020-12-28 22:01,89,21,0.76
2qhhq,investing,kcnz9w,2020-12-14 01:51,Warren Buffett's Fear vs. Greed advice,https://www.reddit.com/r/investing/comments/kcnz9w/warren_buffetts_fear_vs_greed_advice/,2020-12-28 22:01,115,134,0.89
2qhhq,investing,kcpxxe,2020-12-14 03:50,"As we approach tax season, make sure you understand tax-loss harvesting",https://www.reddit.com/r/investing/comments/kcpxxe/as_we_approach_tax_season_make_sure_you/,2020-12-28 22:01,34,56,0.88
2qhhq,investing,kcsh5v,2020-12-14 06:41,How likely is the delisting of Chinese stocks,https://www.reddit.com/r/investing/comments/kcsh5v/how_likely_is_the_delisting_of_chinese_stocks/,2020-12-28 22:01,24,17,0.76
2qhhq,investing,kcwkat,2020-12-14 12:15,Daily Advice Thread - All basic help or advice questions must be posted here.,https://www.reddit.com/r/investing/comments/kcwkat/daily_advice_thread_all_basic_help_or_advice/,2020-12-28 22:01,189,49,0.91
2qhhq,investing,kcx45a,2020-12-14 12:55,How realistic is a yearly return rate of 10% in the stock market?,https://www.reddit.com/r/investing/comments/kcx45a/how_realistic_is_a_yearly_return_rate_of_10_in/,2020-12-28 22:01,303,92,0.72
2qhhq,investing,kcxl36,2020-12-14 13:26,2021 Bull vs. Bear Case,https://www.reddit.com/r/investing/comments/kcxl36/2021_bull_vs_bear_case/,2020-12-28 22:01,80,54,0.84
2qhhq,investing,kcxzok,2020-12-14 13:52,"People saying ""The Market is Overvalued"" now: Can you please elaborate?",https://www.reddit.com/r/investing/comments/kcxzok/people_saying_the_market_is_overvalued_now_can/,2020-12-28 22:01,23,1,0.53
2qhhq,investing,kcyb2f,2020-12-14 14:10,Domino's Pizza Analysis (NYSE: DPZ),https://www.reddit.com/r/investing/comments/kcyb2f/dominos_pizza_analysis_nyse_dpz/,2020-12-28 22:01,61,158,0.92
2qhhq,investing,kd1m9c,2020-12-14 17:06,"With Moderna and Pfizer vaccines being distributed and countries competing over supplies, why do their stocks seem to be not doing much?",https://www.reddit.com/r/investing/comments/kd1m9c/with_moderna_and_pfizer_vaccines_being/,2020-12-28 22:01,443,1176,0.92
2qhhq,investing,kd1tg6,2020-12-14 17:16,[Bloomberg] Amazon’s Zoox Unveils Robotaxi for Future Ride-Hailing Service. Vehicle seats four and can run for 16 hours before recharging. CEO says Zoox may eventually build package delivery vehicles,https://www.reddit.com/r/investing/comments/kd1tg6/bloomberg_amazons_zoox_unveils_robotaxi_for/,2020-12-28 22:01,47,90,0.91
2qhhq,investing,kd20vu,2020-12-14 17:27,BNTX and PFE making losses while the vaccines are being rolled out?,https://www.reddit.com/r/investing/comments/kd20vu/bntx_and_pfe_making_losses_while_the_vaccines_are/,2020-12-28 22:01,36,6,0.59
2qhhq,investing,kd226p,2020-12-14 17:29,How Diversified Is Too Diversified (And how small is too small)?,https://www.reddit.com/r/investing/comments/kd226p/how_diversified_is_too_diversified_and_how_small/,2020-12-28 22:01,22,2,0.57
2qhhq,investing,kd3vts,2020-12-14 18:58,Kraft is a good investment both long and short term.,https://www.reddit.com/r/investing/comments/kd3vts/kraft_is_a_good_investment_both_long_and_short/,2020-12-28 22:01,23,0,0.5
2qhhq,investing,kdberh,2020-12-15 01:15,Should I sell Citibank (C) stock that was bought at $160 (now $110)?,https://www.reddit.com/r/investing/comments/kdberh/should_i_sell_citibank_c_stock_that_was_bought_at/,2020-12-28 22:01,23,0,0.33
2qhhq,investing,kdbioj,2020-12-15 01:21,Advice on REIT ETFs,https://www.reddit.com/r/investing/comments/kdbioj/advice_on_reit_etfs/,2020-12-28 22:01,40,38,0.85
2qhhq,investing,kdbszr,2020-12-15 01:36,Suggest me gold mining stocks?,https://www.reddit.com/r/investing/comments/kdbszr/suggest_me_gold_mining_stocks/,2020-12-28 22:01,27,0,0.5
2qhhq,investing,kdegdp,2020-12-15 04:10,Buy the dip or just buy - strategies for building a position over time,https://www.reddit.com/r/investing/comments/kdegdp/buy_the_dip_or_just_buy_strategies_for_building_a/,2020-12-28 22:01,105,97,0.89
2qhhq,investing,kdelzs,2020-12-15 04:20,Virgin Galactic had to abort their recent test flight. On the positive side their fail safe systems worked flawlessly.,https://www.reddit.com/r/investing/comments/kdelzs/virgin_galactic_had_to_abort_their_recent_test/,2020-12-28 22:01,146,878,0.97
2qhhq,investing,kdfplm,2020-12-15 05:33,"Robinhood to Discontinue Trading in REITs, CEFs, and MLPs",https://www.reddit.com/r/investing/comments/kdfplm/robinhood_to_discontinue_trading_in_reits_cefs/,2020-12-28 22:01,34,10,0.58
2qhhq,investing,kdgdiq,2020-12-15 06:21,JP Morgan taking a page out of Goldman's book,https://www.reddit.com/r/investing/comments/kdgdiq/jp_morgan_taking_a_page_out_of_goldmans_book/,2020-12-28 22:01,25,34,0.81
2qhhq,investing,kdhj8x,2020-12-15 07:54,"ROI at 1% per day on5k ,too good to be true?",https://www.reddit.com/r/investing/comments/kdhj8x/roi_at_1_per_day_on5k_too_good_to_be_true/,2020-12-28 22:01,21,0,0.36
2qhhq,investing,kdhyzs,2020-12-15 08:30,Thoughts on individual stock buying vs etf?,https://www.reddit.com/r/investing/comments/kdhyzs/thoughts_on_individual_stock_buying_vs_etf/,2020-12-28 22:01,28,0,0.5
2qhhq,investing,kdk5pz,2020-12-15 11:35,BABA,https://www.reddit.com/r/investing/comments/kdk5pz/baba/,2020-12-28 22:01,60,46,0.92
2qhhq,investing,kdkfzy,2020-12-15 11:57,Trading in EU stock; obtaining IRS forms,https://www.reddit.com/r/investing/comments/kdkfzy/trading_in_eu_stock_obtaining_irs_forms/,2020-12-28 22:01,37,20,0.79
2qhhq,investing,kdklnh,2020-12-15 12:09,Daily Advice Thread - All basic help or advice questions must be posted here.,https://www.reddit.com/r/investing/comments/kdklnh/daily_advice_thread_all_basic_help_or_advice/,2020-12-28 22:01,134,17,0.9
2qhhq,investing,kdm9xg,2020-12-15 14:03,SpaceX in Talks for New Funds and $92 Billion Valuation [Bloomberg],https://www.reddit.com/r/investing/comments/kdm9xg/spacex_in_talks_for_new_funds_and_92_billion/,2020-12-28 22:01,439,1407,0.96
2qhhq,investing,kdnl09,2020-12-15 15:19,RobinHood no longer supporting REITs?,https://www.reddit.com/r/investing/comments/kdnl09/robinhood_no_longer_supporting_reits/,2020-12-28 22:01,58,28,0.8
2qhhq,investing,kdo3bu,2020-12-15 15:47,Short Term Profit Taking Considerations,https://www.reddit.com/r/investing/comments/kdo3bu/short_term_profit_taking_considerations/,2020-12-28 22:01,24,40,0.88
2qhhq,investing,kdqrpq,2020-12-15 18:03,Gold miners not acting proportional to gold prices in an unsustainable trend for months now. There is potential for a correction in the miners.,https://www.reddit.com/r/investing/comments/kdqrpq/gold_miners_not_acting_proportional_to_gold/,2020-12-28 22:01,20,22,0.75
2qhhq,investing,kdr8y6,2020-12-15 18:26,Why I cut my position in $TSLA and bought Kellogg’s,https://www.reddit.com/r/investing/comments/kdr8y6/why_i_cut_my_position_in_tsla_and_bought_kelloggs/,2020-12-28 22:01,25,0,0.28
2qhhq,investing,kds3xm,2020-12-15 19:07,"Now that you can trade Water Futures, I'm betting on the Appharvest IPO to boom.",https://www.reddit.com/r/investing/comments/kds3xm/now_that_you_can_trade_water_futures_im_betting/,2020-12-28 22:01,59,107,0.9
2qhhq,investing,kdsof0,2020-12-15 19:36,ARK discussion,https://www.reddit.com/r/investing/comments/kdsof0/ark_discussion/,2020-12-28 22:01,50,79,0.87
2qhhq,investing,kdtppk,2020-12-15 20:26,Concern Over Falling US Dollar Value,https://www.reddit.com/r/investing/comments/kdtppk/concern_over_falling_us_dollar_value/,2020-12-28 22:01,131,81,0.87
2qhhq,investing,kdvm6s,2020-12-15 22:02,Aphria and Tilray are merging. MJ stocks ripping after hours.,https://www.reddit.com/r/investing/comments/kdvm6s/aphria_and_tilray_are_merging_mj_stocks_ripping/,2020-12-28 22:01,96,250,0.92
2qhhq,investing,kdwlc7,2020-12-15 22:55,Avepoint - A Huge Growth Opportunity in 2021,https://www.reddit.com/r/investing/comments/kdwlc7/avepoint_a_huge_growth_opportunity_in_2021/,2020-12-28 22:01,32,23,0.73
2qhhq,investing,kdwq4w,2020-12-15 23:02,"I think I'll have to give up trading, too many losses.",https://www.reddit.com/r/investing/comments/kdwq4w/i_think_ill_have_to_give_up_trading_too_many/,2020-12-28 22:01,234,121,0.79
2qhhq,investing,kdwui3,2020-12-15 23:08,Buy Intel for Mobileye,https://www.reddit.com/r/investing/comments/kdwui3/buy_intel_for_mobileye/,2020-12-28 22:01,38,10,0.69
2qhhq,investing,kdwxnz,2020-12-15 23:13,Best Oil play for 1-3 yrs?,https://www.reddit.com/r/investing/comments/kdwxnz/best_oil_play_for_13_yrs/,2020-12-28 22:01,46,8,0.64
2qhhq,investing,ke0u8n,2020-12-16 02:58,"Here's my list of ""contrarian"" investment ideas. What are yours?",https://www.reddit.com/r/investing/comments/ke0u8n/heres_my_list_of_contrarian_investment_ideas_what/,2020-12-28 22:01,30,2,0.57
2qhhq,investing,ke57y3,2020-12-16 08:08,How to do proper due dilligence research?,https://www.reddit.com/r/investing/comments/ke57y3/how_to_do_proper_due_dilligence_research/,2020-12-28 22:01,365,1110,0.96
2qhhq,investing,ke6vof,2020-12-16 10:32,Thoughts on bitwise's Bitcoin index fund??,https://www.reddit.com/r/investing/comments/ke6vof/thoughts_on_bitwises_bitcoin_index_fund/,2020-12-28 22:01,31,12,0.69
2qhhq,investing,ke730w,2020-12-16 10:50,What are your thoughts on Passive Investing now that Tesla is 8th largest cap?,https://www.reddit.com/r/investing/comments/ke730w/what_are_your_thoughts_on_passive_investing_now/,2020-12-28 22:01,20,0,0.42
2qhhq,investing,ke82ig,2020-12-16 12:10,Daily Advice Thread - All basic help or advice questions must be posted here.,https://www.reddit.com/r/investing/comments/ke82ig/daily_advice_thread_all_basic_help_or_advice/,2020-12-28 22:01,118,8,0.75
2qhhq,investing,ke85t9,2020-12-16 12:17,Massachusetts Regulators to File Complaint Against Robinhood,https://www.reddit.com/r/investing/comments/ke85t9/massachusetts_regulators_to_file_complaint/,2020-12-28 22:01,100,182,0.95
2qhhq,investing,ke9hmn,2020-12-16 13:49,British fund firm Ruffer piles $675 million into bitcoin in 'defensive move' -memo,https://www.reddit.com/r/investing/comments/ke9hmn/british_fund_firm_ruffer_piles_675_million_into/,2020-12-28 22:01,478,571,0.93
2qhhq,investing,keag69,2020-12-16 14:44,Norwegian Air filing for bankruptcy. WHat does it mean?,https://www.reddit.com/r/investing/comments/keag69/norwegian_air_filing_for_bankruptcy_what_does_it/,2020-12-28 22:01,66,69,0.93
2qhhq,investing,keclnt,2020-12-16 16:40,The Dangers of Passive Investing [Seeking Alpha],https://www.reddit.com/r/investing/comments/keclnt/the_dangers_of_passive_investing_seeking_alpha/,2020-12-28 22:01,55,20,0.68
2qhhq,investing,keela5,2020-12-16 18:20,Hollow-core fiber optic cables or: another reminder that individual investors shouldn't try to compete with institutional investors,https://www.reddit.com/r/investing/comments/keela5/hollowcore_fiber_optic_cables_or_another_reminder/,2020-12-28 22:01,63,59,0.78
2qhhq,investing,keg8s6,2020-12-16 19:41,"""Fed commits to keep buying bonds until the economy gets back to full employment.""",https://www.reddit.com/r/investing/comments/keg8s6/fed_commits_to_keep_buying_bonds_until_the/,2020-12-28 22:01,754,1684,0.98
2qhhq,investing,keh9jj,2020-12-16 20:31,Facebook vs. Apple,https://www.reddit.com/r/investing/comments/keh9jj/facebook_vs_apple/,2020-12-28 22:01,33,3,0.71
2qhhq,investing,kehqv0,2020-12-16 20:55,"The next decade, will we see similar growth?",https://www.reddit.com/r/investing/comments/kehqv0/the_next_decade_will_we_see_similar_growth/,2020-12-28 22:01,20,5,0.63
2qhhq,investing,kekyd2,2020-12-16 23:34,Cinemark is extremely undervalued,https://www.reddit.com/r/investing/comments/kekyd2/cinemark_is_extremely_undervalued/,2020-12-28 22:01,33,0,0.36
2qhhq,investing,kel5mo,2020-12-16 23:44,What caused stock prices to rise in february 2020 right before the crash in march?,https://www.reddit.com/r/investing/comments/kel5mo/what_caused_stock_prices_to_rise_in_february_2020/,2020-12-28 22:01,41,45,0.81
2qhhq,investing,keok5w,2020-12-17 02:47,Why does Warren continue to hold so much Apple?,https://www.reddit.com/r/investing/comments/keok5w/why_does_warren_continue_to_hold_so_much_apple/,2020-12-28 22:01,136,86,0.82
2qhhq,investing,kepvka,2020-12-17 04:03,Hedging the USD,https://www.reddit.com/r/investing/comments/kepvka/hedging_the_usd/,2020-12-28 22:01,24,24,0.89
2qhhq,investing,ketgkb,2020-12-17 08:15,Best investment return from each decade 80’s to present,https://www.reddit.com/r/investing/comments/ketgkb/best_investment_return_from_each_decade_80s_to/,2020-12-28 22:01,274,150,0.91
2qhhq,investing,keu1o9,2020-12-17 09:05,Place to park cash December 2020,https://www.reddit.com/r/investing/comments/keu1o9/place_to_park_cash_december_2020/,2020-12-28 22:01,20,0,0.22
2qhhq,investing,keve0a,2020-12-17 10:56,Is it a good to talk to a VC/Angel who has already invested heavily on my competitor,https://www.reddit.com/r/investing/comments/keve0a/is_it_a_good_to_talk_to_a_vcangel_who_has_already/,2020-12-28 22:01,30,9,0.63
2qhhq,investing,kewafv,2020-12-17 12:08,Daily Advice Thread - All basic help or advice questions must be posted here.,https://www.reddit.com/r/investing/comments/kewafv/daily_advice_thread_all_basic_help_or_advice/,2020-12-28 22:01,112,8,0.72
