Subreddit_ID,Subreddit_Name,Submission_ID,Submission_CreatedDate,Submission_Title,Submission_URL,Submission_LastFetched,Submission_NumComments,Submission_Score,Submission_UpvoteRatio
2th52,wallstreetbets,meerlu,2021-03-27 14:24,Forced YOLO 52K into Gamestop. I like the stock! 🦍 🚀🚀🚀,https://i.redd.it/rzfhtnhpykp61.jpg,2021-03-29 19:27,65,1024,0.94
2th52,wallstreetbets,mefniu,2021-03-27 15:12,"15k -> 130k YOLOd my whole account over the course of a day, added my savings account a week later and my transformation from boomer investor to retard ape was complete",https://i.redd.it/xgf4d9fy6lp61.jpg,2021-03-29 19:27,257,3124,0.9
2th52,wallstreetbets,meg2q6,2021-03-27 15:34,Anyone looking at making any plays around the stuck ship in the Suez Canal?,https://www.reddit.com/r/wallstreetbets/comments/meg2q6/anyone_looking_at_making_any_plays_around_the/,2021-03-29 19:27,257,300,0.96
2th52,wallstreetbets,megnpl,2021-03-27 16:03,Hedge Fund Rumored to have gotten blown up: Forced to Liquidate over 30 Billion in assets: Some stocks heavily discounted.,https://www.reddit.com/r/wallstreetbets/comments/megnpl/hedge_fund_rumored_to_have_gotten_blown_up_forced/,2021-03-29 19:27,1159,7778,0.97
2th52,wallstreetbets,meh2ud,2021-03-27 16:24,Most discussed stocks of the week and their sentiment! What are your moves for next week?,https://www.reddit.com/r/wallstreetbets/comments/meh2ud/most_discussed_stocks_of_the_week_and_their/,2021-03-29 19:27,43,174,0.94
2th52,wallstreetbets,meh8z1,2021-03-27 16:32,Tools used to navigate the market,https://www.reddit.com/r/wallstreetbets/comments/meh8z1/tools_used_to_navigate_the_market/,2021-03-29 19:27,68,118,0.92
2th52,wallstreetbets,mehxm6,2021-03-27 17:05,"Who needs life “savings” anyway amirite? Held it for 2 months, what’s another 25 to life",https://i.redd.it/f6ul9ycirlp61.jpg,2021-03-29 19:27,74,1803,0.96
2th52,wallstreetbets,mei102,2021-03-27 17:10,$BB - 3/26/2021 - Technical Analysis and Earnings,https://www.reddit.com/r/wallstreetbets/comments/mei102/bb_3262021_technical_analysis_and_earnings/,2021-03-29 19:27,105,314,0.91
2th52,wallstreetbets,meikve,2021-03-27 17:38,"Inspired by many others, I hit a few GameStop’s and got some Switch’s, games, etc to donate to my local Children’s Hospital. Thanks WSB, we like the stock!",https://i.redd.it/ksk24xqexlp61.jpg,2021-03-29 19:27,1801,108030,0.84
2th52,wallstreetbets,mej0qc,2021-03-27 18:01,Gamestop on first floor of building before reaching roof top for rocket launch,https://i.redd.it/rpffugjd1mp61.png,2021-03-29 19:27,96,1287,0.9
2th52,wallstreetbets,mej15u,2021-03-27 18:01,What are some of the biggest WSB fails in the sub's history?,https://www.reddit.com/r/wallstreetbets/comments/mej15u/what_are_some_of_the_biggest_wsb_fails_in_the/,2021-03-29 19:27,404,632,0.89
2th52,wallstreetbets,mejdcu,2021-03-27 18:19,"I Will Own GameStop - Update Mar 27, 2021 (In Honor of RC's Tweet)",https://i.redd.it/a03n3b664mp61.jpg,2021-03-29 19:27,147,2669,0.95
2th52,wallstreetbets,mejezz,2021-03-27 18:21,Understanding Mexican-American Trade: The USMCA and North America’s First Intercontinental Railroad. Kansas City Southern ($KSU) and Canadian Pacific ($CP) Merger DD.,https://www.reddit.com/r/wallstreetbets/comments/mejezz/understanding_mexicanamerican_trade_the_usmca_and/,2021-03-29 19:27,58,175,0.92
2th52,wallstreetbets,mejiv0,2021-03-27 18:27,Suez Newbie DD,https://www.reddit.com/r/wallstreetbets/comments/mejiv0/suez_newbie_dd/,2021-03-29 19:27,73,113,0.88
2th52,wallstreetbets,mejoqp,2021-03-27 18:35,UWMC 80% in between 2 accounts in for the long haul,https://www.reddit.com/gallery/mejoqp,2021-03-29 19:27,66,134,0.74
2th52,wallstreetbets,mek4lo,2021-03-27 18:58,Peruvian elections and why I'm shorting SCCO,https://www.reddit.com/r/wallstreetbets/comments/mek4lo/peruvian_elections_and_why_im_shorting_scco/,2021-03-29 19:27,39,73,0.83
2th52,wallstreetbets,mek9iw,2021-03-27 19:04,How to profit from the Suez Canal,https://www.reddit.com/r/wallstreetbets/comments/mek9iw/how_to_profit_from_the_suez_canal/,2021-03-29 19:27,211,620,0.92
2th52,wallstreetbets,meko2o,2021-03-27 19:24,AMD to the moon. Short Squeeze and record breaking sales YOY accompanied by arguably the best management on the NYSE.,https://i.redd.it/5e1uno87gmp61.jpg,2021-03-29 19:27,42,0,0.47
2th52,wallstreetbets,mel4fo,2021-03-27 19:47,You (options) vs the guy she tells you not to worry about (stonks). This non financial advice brought to you by a stockholding bonobo 🦧,https://i.redd.it/4060halakmp61.jpg,2021-03-29 19:27,67,427,0.93
2th52,wallstreetbets,meleb9,2021-03-27 20:00,Don’t you hate when you accidentally end with a $6.4M long SPY position during the weekend after your weekly 395C finish in the money?,https://www.reddit.com/gallery/meleb9,2021-03-29 19:27,208,713,0.95
2th52,wallstreetbets,melf8c,2021-03-27 20:02,$FSR Updated Price Target: $4.21,https://www.reddit.com/r/wallstreetbets/comments/melf8c/fsr_updated_price_target_421/,2021-03-29 19:27,54,59,0.73
2th52,wallstreetbets,mem5h3,2021-03-27 20:38,My DD on the the perfect storm for Americas largest steel manufacture....CLF,https://www.reddit.com/r/wallstreetbets/comments/mem5h3/my_dd_on_the_the_perfect_storm_for_americas/,2021-03-29 19:27,120,319,0.87
2th52,wallstreetbets,memakv,2021-03-27 20:45,100 percent GME portfolio. Lost 6k trying to swing trade. Got mad and trippled down. Sold 30k of apple to go all in on GME,https://i.redd.it/larok1oqump61.jpg,2021-03-29 19:27,389,3212,0.95
2th52,wallstreetbets,memh0k,2021-03-27 20:54,OUCH,https://www.reddit.com/gallery/memh0k,2021-03-29 19:27,304,2315,0.98
2th52,wallstreetbets,menq26,2021-03-27 21:59,UWMC my avg cost high or it’s good??,https://i.redd.it/jvosdc7x7np61.jpg,2021-03-29 19:27,82,120,0.75
2th52,wallstreetbets,menys3,2021-03-27 22:11,All I know is buy no matter what! And at this rate I probably buy a few shares on the moon and ride those shares back to earth. I just like the stock!,https://i.redd.it/zz1k9093anp61.jpg,2021-03-29 19:27,22,274,0.91
2th52,wallstreetbets,meo55y,2021-03-27 22:21,Every time you dip I buy more. I like the stock 🦍 🦧,https://i.redd.it/2jcehglrbnp61.jpg,2021-03-29 19:27,271,2277,0.94
2th52,wallstreetbets,mepq05,2021-03-27 23:44,"This took forever to make, I hope you guys like it. ALL THE WAY TO THE MOON!",https://v.redd.it/q3fup05bqnp61,2021-03-29 19:27,436,26660,0.94
2th52,wallstreetbets,meq6n3,2021-03-28 00:09,"Something weird just went down in the stock market, and Wall Street is speculating it's the result of a fund liquidation",https://www.businessinsider.com/stock-market-wall-street-speculating-hedge-fund-liquidation-archegos-2021-3?utm_source=copy-link&utm_medium=referral&utm_content=topbar,2021-03-29 19:27,469,2451,0.98
2th52,wallstreetbets,meqd8y,2021-03-28 00:19,"Theta Gang hu$tler reporting for duty. GameStop is my entire portfolio, short of a tiny bit of Sundial Growers. I’m selling cash secured puts to all the doubters. Started with $70k now $93.5k. $GME to the moon!",https://i.redd.it/c1in39uvwnp61.jpg,2021-03-29 19:27,181,666,0.91
2th52,wallstreetbets,meqh64,2021-03-28 00:25,So this is me playing around with the weeklies..... It was all good about a week ago haha in the course of a month I went from 8k to about 50k and now $2.18. I’m hurt... can someone make me laugh?? Please..,https://www.reddit.com/gallery/meqh64,2021-03-29 19:27,199,399,0.9
2th52,wallstreetbets,mer0gl,2021-03-28 00:55,Tiger Cub Archegos Liquidation and Friday’s market action in some of the stocks affected,https://www.reddit.com/r/wallstreetbets/comments/mer0gl/tiger_cub_archegos_liquidation_and_fridays_market/,2021-03-29 19:27,81,371,0.96
2th52,wallstreetbets,mer3er,2021-03-28 01:00,"Move over UWMC, PFSI is the most undervalued large mortgage company",https://www.reddit.com/r/wallstreetbets/comments/mer3er/move_over_uwmc_pfsi_is_the_most_undervalued_large/,2021-03-29 19:27,27,0,0.34
2th52,wallstreetbets,metsxq,2021-03-28 03:44,[$BB] The size of real-world driving datasets that Blackberry IVY has access to will be so much bigger than Tesla's,https://www.reddit.com/r/wallstreetbets/comments/metsxq/bb_the_size_of_realworld_driving_datasets_that/,2021-03-29 19:27,189,1122,0.89
2th52,wallstreetbets,mev9tk,2021-03-28 05:27,Hey apes fellow Fubidiot here ✋💎🤚🤲💎 $100?,https://i.redd.it/f73y3c3tfpp61.jpg,2021-03-29 19:27,37,99,0.81
2th52,wallstreetbets,mf0msr,2021-03-28 12:34,GameStop gear going to the new home at the Children’s hospital of Atlanta Monday. POWER TO THE PLAYERS !,https://i.redd.it/4v4vipu0krp61.jpg,2021-03-29 19:27,2156,134411,0.86
2th52,wallstreetbets,mf2b1g,2021-03-28 14:54,Biden's Infrastructure Plan and BLNK moon potential?,https://www.reddit.com/r/wallstreetbets/comments/mf2b1g/bidens_infrastructure_plan_and_blnk_moon_potential/,2021-03-29 19:27,43,23,0.64
2th52,wallstreetbets,mf2t5a,2021-03-28 15:19,Blackberry QNX + IVY might be the next Android + Google Mobile Services,https://www.reddit.com/r/wallstreetbets/comments/mf2t5a/blackberry_qnx_ivy_might_be_the_next_android/,2021-03-29 19:27,139,923,0.89
2th52,wallstreetbets,mf30uw,2021-03-28 15:30,Battle of the Fallen Giants: ViacomCBS vs DISCOVERY COMMUNICATIONS INC. (A shallow comparison of them both.),https://www.reddit.com/r/wallstreetbets/comments/mf30uw/battle_of_the_fallen_giants_viacomcbs_vs/,2021-03-29 19:27,64,173,0.9
2th52,wallstreetbets,mf3mog,2021-03-28 16:00,Why Cannabis Legalization is BEARISH for some MSOs and BULLISH AF for LPs like $APHA/$TLRY 🚀🚀🚀,https://www.reddit.com/r/wallstreetbets/comments/mf3mog/why_cannabis_legalization_is_bearish_for_some/,2021-03-29 19:27,132,202,0.82
2th52,wallstreetbets,mf4qpj,2021-03-28 16:54,Watch out for April,https://i.redd.it/p15rheugusp61.jpg,2021-03-29 19:27,933,15748,0.96
2th52,wallstreetbets,mf5c1e,2021-03-28 17:22,$Root why I like this stock.,https://www.reddit.com/r/wallstreetbets/comments/mf5c1e/root_why_i_like_this_stock/,2021-03-29 19:27,103,95,0.7
2th52,wallstreetbets,mf5m2b,2021-03-28 17:35,Goldman & MS Block Trades: What Really Happened Friday?,https://i.redd.it/szbfxzym1tp61.jpg,2021-03-29 19:27,73,401,0.97
2th52,wallstreetbets,mf6351,2021-03-28 17:58,Citadel Warns of Inflation... FT.com,https://i.redd.it/o05aaeaq5tp61.png,2021-03-29 19:27,492,2101,0.97
2th52,wallstreetbets,mf66rc,2021-03-28 18:03,ASO - What Do You Think?,https://www.reddit.com/r/wallstreetbets/comments/mf66rc/aso_what_do_you_think/,2021-03-29 19:27,38,52,0.71
2th52,wallstreetbets,mf6jig,2021-03-28 18:19,"Cathie Wood's ARK purchased more than 1 million shares of Opendoor the past two days, pay attention you fucks",https://www.reddit.com/r/wallstreetbets/comments/mf6jig/cathie_woods_ark_purchased_more_than_1_million/,2021-03-29 19:27,519,1837,0.92
2th52,wallstreetbets,mf6rfl,2021-03-28 18:30,Generoustreetbets,https://v.redd.it/jdzhm0h9btp61,2021-03-29 19:27,357,34243,0.91
2th52,wallstreetbets,mf70pv,2021-03-28 18:43,Pitney Bowes may be the beneficiary of USPS's new 10-Year Plan,https://www.reddit.com/r/wallstreetbets/comments/mf70pv/pitney_bowes_may_be_the_beneficiary_of_uspss_new/,2021-03-29 19:27,25,42,0.79
2th52,wallstreetbets,mf7a2k,2021-03-28 18:55,$GOEV - The Bull Case of Canoo Inc. AKA $GOEV AKA they-better-fucking-deliver-on-earnings-or-i-am-out-a-bunch-of-fucking-money (#11 Weekend Schitzo Edition),https://www.reddit.com/r/wallstreetbets/comments/mf7a2k/goev_the_bull_case_of_canoo_inc_aka_goev_aka/,2021-03-29 19:27,115,359,0.86
2th52,wallstreetbets,mf7lzf,2021-03-28 19:11,"Cathie Wood Preps Space ETF as Ark’s First New Fund in Two Years, could be out this week.",https://www.bloomberg.com/news/articles/2021-03-25/cathie-wood-preps-space-etf-as-ark-s-first-new-fund-in-two-years,2021-03-29 19:27,213,839,0.93
2th52,wallstreetbets,mf8mct,2021-03-28 20:00,"What Are Your Moves Tomorrow, March 29, 2021",https://www.reddit.com/r/wallstreetbets/comments/mf8mct/what_are_your_moves_tomorrow_march_29_2021/,2021-03-29 19:27,16309,994,0.95
2th52,wallstreetbets,mf8qv7,2021-03-28 20:05,Let’s Talk About “Market Makers”,https://www.reddit.com/r/wallstreetbets/comments/mf8qv7/lets_talk_about_market_makers/,2021-03-29 19:27,66,505,0.95
2th52,wallstreetbets,mf99a6,2021-03-28 20:31,AMC YOLO Update 3/28 10k shares,https://i.redd.it/dkrrs0o1xtp61.jpg,2021-03-29 19:27,184,997,0.89
2th52,wallstreetbets,mfam81,2021-03-28 21:38,Good for AMC CNK IMAX and rest of exhibitors - This weekend's box office was one of the most robust of the pandemic to date.,https://www.reddit.com/r/wallstreetbets/comments/mfam81/good_for_amc_cnk_imax_and_rest_of_exhibitors_this/,2021-03-29 19:27,72,535,0.9
2th52,wallstreetbets,mfb6la,2021-03-28 22:06,BB YOLO: Big week coming with earnings,https://i.redd.it/ate842czdup61.png,2021-03-29 19:27,205,1077,0.91
2th52,wallstreetbets,mfc86c,2021-03-28 23:01,[$AMRS] 🚀 🌕 THE ULTIMATE DD 🚀 🌕 DEEP LONG-TERM VALUE WITH MASSIVE NEAR-TERM CATALYSTS,https://www.reddit.com/r/wallstreetbets/comments/mfc86c/amrs_the_ultimate_dd_deep_longterm_value_with/,2021-03-29 19:27,287,767,0.87
2th52,wallstreetbets,mfcqgj,2021-03-28 23:29,"$PLTR yolo update, bought a few deep otm monthlies will buy a couple more FDs next week.",https://i.redd.it/zwhsri1tsup61.png,2021-03-29 19:27,86,272,0.84
2th52,wallstreetbets,mfcz79,2021-03-28 23:43,Suez Newbie DD #2,https://www.reddit.com/r/wallstreetbets/comments/mfcz79/suez_newbie_dd_2/,2021-03-29 19:27,132,358,0.9
2th52,wallstreetbets,mfd6c8,2021-03-28 23:54,GME YOLO - 3/26 - Still thinking whether to aim for 999 or 1k shares this week,https://i.redd.it/g1zrd2jdxup61.png,2021-03-29 19:27,89,2040,0.96
2th52,wallstreetbets,mfdem4,2021-03-29 00:07,Loss porn: The meme stock effect,https://i.redd.it/ub6ilubozup61.jpg,2021-03-29 19:27,260,1387,0.93
2th52,wallstreetbets,mfdqil,2021-03-29 00:26,The calm before the storm. GME to $250+ this week. Calling it now,https://i.redd.it/trcr6vm23vp61.jpg,2021-03-29 19:27,432,3405,0.92
2th52,wallstreetbets,mfdrbw,2021-03-29 00:27,Nomura flags potential significant loss at U.S. unit - approximately $2 billion,https://finance.yahoo.com/news/nomura-flags-potential-significant-loss-001850199.html,2021-03-29 19:27,63,382,0.95
2th52,wallstreetbets,mfegvv,2021-03-29 01:09,AMC YOLO - Tired of trading. Me only buy now.,https://www.reddit.com/gallery/mfegvv,2021-03-29 19:27,821,11152,0.94
2th52,wallstreetbets,mfgmzb,2021-03-29 03:21,"Giant Vessel in Suez Canal, Is Now Afloat!",https://www.bloomberg.com/news/articles/2021-03-28/progress-made-in-moving-ship-more-vessels-diverted-suez-update,2021-03-29 19:27,101,445,0.96
2th52,wallstreetbets,mfh0ws,2021-03-29 03:46,ARK Amending Its Prospectus Language,https://www.reddit.com/r/wallstreetbets/comments/mfh0ws/ark_amending_its_prospectus_language/,2021-03-29 19:27,24,58,0.89
2th52,wallstreetbets,mfh22q,2021-03-29 03:48,"Hey Etsy, how low can you go?",https://i.redd.it/sqdo0zi43wp61.jpg,2021-03-29 19:27,52,159,0.91
2th52,wallstreetbets,mfi0dt,2021-03-29 04:52,"Bill Hwang's firm just went tits up, prime brokers like Goldman Sachs, Morgan Stanley, Credit Suisse, and Nomura still have $22-30 Billion of his books to liquidate",https://www.reddit.com/r/wallstreetbets/comments/mfi0dt/bill_hwangs_firm_just_went_tits_up_prime_brokers/,2021-03-29 19:27,287,1334,0.99
2th52,wallstreetbets,mfi5s2,2021-03-29 05:03,MRE may be an absolute bargain stock,https://www.reddit.com/r/wallstreetbets/comments/mfi5s2/mre_may_be_an_absolute_bargain_stock/,2021-03-29 19:27,20,48,0.77
2th52,wallstreetbets,mfihc0,2021-03-29 05:27,another leveraged hedgefund going to GUH,https://i.redd.it/3l7bi9apkwp61.jpg,2021-03-29 19:27,94,646,0.99
2th52,wallstreetbets,mfihd1,2021-03-29 05:27,So it begins..,https://i.redd.it/5mvid7ppkwp61.jpg,2021-03-29 19:27,451,3420,0.99
2th52,wallstreetbets,mfjkf8,2021-03-29 06:48,"Bill Hwang, Biggest 15B lost porn from a single investor + Billions from MM",https://www.reddit.com/r/wallstreetbets/comments/mfjkf8/bill_hwang_biggest_15b_lost_porn_from_a_single/,2021-03-29 19:27,28,184,0.97
37mcm,Stock_Picks,ewhe4l,2020-01-31 02:40,"AMD is a top pick, and here’s why",https://www.reddit.com/r/Stock_Picks/comments/ewhe4l/amd_is_a_top_pick_and_heres_why/,2021-03-29 19:28,50,7,0.74
37mcm,Stock_Picks,ewln5d,2020-01-31 08:58,WWE might be a smart buy in the coming weeks.,https://www.reddit.com/r/Stock_Picks/comments/ewln5d/wwe_might_be_a_smart_buy_in_the_coming_weeks/,2021-03-29 19:28,26,32,0.86
37mcm,Stock_Picks,ewzvp6,2020-02-01 03:10,Not Exxon or Chevron,https://youtu.be/fBAPJg_FAfI,2021-03-29 19:28,22,46,0.96
37mcm,Stock_Picks,eyqdc3,2020-02-04 13:54,Looking for advice in very short term investment,https://www.reddit.com/r/Stock_Picks/comments/eyqdc3/looking_for_advice_in_very_short_term_investment/,2021-03-29 19:28,31,12,0.85
37mcm,Stock_Picks,eyvapd,2020-02-04 19:16,I want to learn how to invest as a teen,https://www.reddit.com/r/Stock_Picks/comments/eyvapd/i_want_to_learn_how_to_invest_as_a_teen/,2021-03-29 19:28,24,23,0.88
37mcm,Stock_Picks,f5q9ri,2020-02-18 11:16,Investing With Small Amounts of Money,https://www.reddit.com/r/Stock_Picks/comments/f5q9ri/investing_with_small_amounts_of_money/,2021-03-29 19:28,27,33,0.96
37mcm,Stock_Picks,f6djuh,2020-02-19 16:56,How to sell stock that was given to me as a child.,https://www.reddit.com/r/Stock_Picks/comments/f6djuh/how_to_sell_stock_that_was_given_to_me_as_a_child/,2021-03-29 19:28,26,29,0.97
37mcm,Stock_Picks,fa13go,2020-02-26 21:57,Any tips for new investor during the corona outbreak?,https://www.reddit.com/r/Stock_Picks/comments/fa13go/any_tips_for_new_investor_during_the_corona/,2021-03-29 19:28,43,23,0.87
37mcm,Stock_Picks,fadkli,2020-02-27 15:18,Coronavirus stock list if you dare,https://www.reddit.com/r/Stock_Picks/comments/fadkli/coronavirus_stock_list_if_you_dare/,2021-03-29 19:28,26,41,0.97
37mcm,Stock_Picks,faodl6,2020-02-28 03:30,"Would it be best for a new person to the stock market to buy when the economy is at its lowest, Such as 2009?",https://www.reddit.com/r/Stock_Picks/comments/faodl6/would_it_be_best_for_a_new_person_to_the_stock/,2021-03-29 19:28,41,33,0.89
37mcm,Stock_Picks,fbbsyh,2020-02-29 12:23,"Updated Coronavirus stock list,feel free to add to it.",https://www.reddit.com/r/Stock_Picks/comments/fbbsyh/updated_coronavirus_stock_listfeel_free_to_add_to/,2021-03-29 19:28,54,81,0.98
37mcm,Stock_Picks,fbz5ab,2020-03-01 19:27,Disney has dropped majorly due to coronavirus. Time to invest or will they not be able to bounce back to $140?,https://www.reddit.com/r/Stock_Picks/comments/fbz5ab/disney_has_dropped_majorly_due_to_coronavirus/,2021-03-29 19:28,40,46,0.94
37mcm,Stock_Picks,fcckwu,2020-03-02 14:10,Is this a good time to invest in Tesla?,https://www.reddit.com/r/Stock_Picks/comments/fcckwu/is_this_a_good_time_to_invest_in_tesla/,2021-03-29 19:28,22,4,0.7
37mcm,Stock_Picks,ffyqrt,2020-03-09 17:57,Coronavirus! Best stocks to buy?,https://www.reddit.com/r/Stock_Picks/comments/ffyqrt/coronavirus_best_stocks_to_buy/,2021-03-29 19:28,109,49,0.9
37mcm,Stock_Picks,fh5it0,2020-03-11 22:17,20k to throw in one stock and won’t cash out for 30 years,https://www.reddit.com/r/Stock_Picks/comments/fh5it0/20k_to_throw_in_one_stock_and_wont_cash_out_for/,2021-03-29 19:28,24,8,0.9
37mcm,Stock_Picks,fi3xfk,2020-03-13 18:06,S&P500 or NASDAQ?,https://www.reddit.com/r/Stock_Picks/comments/fi3xfk/sp500_or_nasdaq/,2021-03-29 19:28,25,19,0.88
37mcm,Stock_Picks,fkqaiy,2020-03-18 14:23,Possible baby boom,https://www.reddit.com/r/Stock_Picks/comments/fkqaiy/possible_baby_boom/,2021-03-29 19:28,41,45,0.85
37mcm,Stock_Picks,fkrwhb,2020-03-18 16:03,"To sell my investments at a loss now, and buy back in a few weeks when there is a trend reversal, or to HODL",https://www.reddit.com/r/Stock_Picks/comments/fkrwhb/to_sell_my_investments_at_a_loss_now_and_buy_back/,2021-03-29 19:28,35,13,0.88
37mcm,Stock_Picks,flw0bx,2020-03-20 14:34,First time investor advice? Best time to start?,https://www.reddit.com/r/Stock_Picks/comments/flw0bx/first_time_investor_advice_best_time_to_start/,2021-03-29 19:28,35,28,0.84
37mcm,Stock_Picks,fm93kj,2020-03-21 04:07,If I can exit $200 Positive should I?,https://www.reddit.com/r/Stock_Picks/comments/fm93kj/if_i_can_exit_200_positive_should_i/,2021-03-29 19:28,20,29,0.81
37mcm,Stock_Picks,fm9h43,2020-03-21 04:38,Taking a 5K loan,https://www.reddit.com/r/Stock_Picks/comments/fm9h43/taking_a_5k_loan/,2021-03-29 19:28,21,0,0.5
37mcm,Stock_Picks,fm9m6j,2020-03-21 04:50,If the corona situation is fixed within the next 2-3 months,https://www.reddit.com/r/Stock_Picks/comments/fm9m6j/if_the_corona_situation_is_fixed_within_the_next/,2021-03-29 19:28,29,13,0.82
37mcm,Stock_Picks,fn6pqf,2020-03-22 20:36,Stock Picks COVID-19,https://www.reddit.com/r/Stock_Picks/comments/fn6pqf/stock_picks_covid19/,2021-03-29 19:28,45,41,0.84
37mcm,Stock_Picks,fo2gjk,2020-03-24 09:50,Investing in the current market,https://www.reddit.com/r/Stock_Picks/comments/fo2gjk/investing_in_the_current_market/,2021-03-29 19:28,28,17,0.83
37mcm,Stock_Picks,fo70b4,2020-03-24 15:30,Market Bottom?,https://www.reddit.com/r/Stock_Picks/comments/fo70b4/market_bottom/,2021-03-29 19:28,96,23,0.79
37mcm,Stock_Picks,fobsvi,2020-03-24 19:51,What happens to prices immediately post bailout,https://www.reddit.com/r/Stock_Picks/comments/fobsvi/what_happens_to_prices_immediately_post_bailout/,2021-03-29 19:28,26,15,0.95
37mcm,Stock_Picks,foicqy,2020-03-25 02:19,Looking to build a portfolio after this is over....,https://www.reddit.com/r/Stock_Picks/comments/foicqy/looking_to_build_a_portfolio_after_this_is_over/,2021-03-29 19:28,27,20,0.92
37mcm,Stock_Picks,fos5ma,2020-03-25 15:25,Most risky/rewarding stocks right now.,https://www.reddit.com/r/Stock_Picks/comments/fos5ma/most_riskyrewarding_stocks_right_now/,2021-03-29 19:28,36,12,0.85
37mcm,Stock_Picks,foss6l,2020-03-25 16:02,"Considering selling TSLA and AMD, then buying GOOGL.",https://www.reddit.com/r/Stock_Picks/comments/foss6l/considering_selling_tsla_and_amd_then_buying_googl/,2021-03-29 19:28,22,23,0.84
37mcm,Stock_Picks,fpgbgz,2020-03-26 18:03,Deadcat or solid bottom. GO.,https://www.reddit.com/r/Stock_Picks/comments/fpgbgz/deadcat_or_solid_bottom_go/,2021-03-29 19:28,41,36,0.83
37mcm,Stock_Picks,fqm9td,2020-03-28 15:30,New trader mistake or did I make the right move?,https://www.reddit.com/r/Stock_Picks/comments/fqm9td/new_trader_mistake_or_did_i_make_the_right_move/,2021-03-29 19:28,63,38,0.88
37mcm,Stock_Picks,frcpug,2020-03-29 20:31,NCLH vs. RCL?,https://www.reddit.com/r/Stock_Picks/comments/frcpug/nclh_vs_rcl/,2021-03-29 19:28,21,6,0.72
37mcm,Stock_Picks,frgdni,2020-03-30 00:08,What will Monday bring?,https://www.reddit.com/r/Stock_Picks/comments/frgdni/what_will_monday_bring/,2021-03-29 19:28,37,18,0.78
37mcm,Stock_Picks,fsf6h9,2020-03-31 15:43,Why is the market rallying over bad news?,https://www.reddit.com/r/Stock_Picks/comments/fsf6h9/why_is_the_market_rallying_over_bad_news/,2021-03-29 19:28,45,41,0.9
37mcm,Stock_Picks,ftdand,2020-04-02 01:35,5G tech stocks,https://www.reddit.com/r/Stock_Picks/comments/ftdand/5g_tech_stocks/,2021-03-29 19:28,37,19,0.93
37mcm,Stock_Picks,ftvb27,2020-04-02 21:47,Better to dump 5k into an index or through individual stocks?,https://www.reddit.com/r/Stock_Picks/comments/ftvb27/better_to_dump_5k_into_an_index_or_through/,2021-03-29 19:28,31,8,0.75
37mcm,Stock_Picks,ftvc51,2020-04-02 21:49,Post-Covid Winners/Losers,https://www.reddit.com/r/Stock_Picks/comments/ftvc51/postcovid_winnerslosers/,2021-03-29 19:28,34,37,0.95
37mcm,Stock_Picks,fuecet,2020-04-03 19:06,Coronavirus profiteering,https://www.reddit.com/r/Stock_Picks/comments/fuecet/coronavirus_profiteering/,2021-03-29 19:28,79,53,0.92
37mcm,Stock_Picks,fuhw56,2020-04-03 22:23,Thoughts on JNUG- new to investing,https://www.reddit.com/r/Stock_Picks/comments/fuhw56/thoughts_on_jnug_new_to_investing/,2021-03-29 19:28,31,8,0.76
37mcm,Stock_Picks,futezy,2020-04-04 13:07,Have we hit the lowest low?,https://www.reddit.com/r/Stock_Picks/comments/futezy/have_we_hit_the_lowest_low/,2021-03-29 19:28,21,8,0.78
37mcm,Stock_Picks,fv0kva,2020-04-04 20:20,Stock picks good or bad?,https://www.reddit.com/r/Stock_Picks/comments/fv0kva/stock_picks_good_or_bad/,2021-03-29 19:28,49,34,0.95
37mcm,Stock_Picks,fwaubf,2020-04-07 00:53,"Brand New to Stocks, Looking to make some $ short term",https://www.reddit.com/r/Stock_Picks/comments/fwaubf/brand_new_to_stocks_looking_to_make_some_short/,2021-03-29 19:28,29,7,0.78
37mcm,Stock_Picks,fy48xn,2020-04-10 00:33,WTF is actually going on,https://www.reddit.com/r/Stock_Picks/comments/fy48xn/wtf_is_actually_going_on/,2021-03-29 19:28,107,74,0.9
37mcm,Stock_Picks,fy8u6r,2020-04-10 05:01,Jdst stock killin me slowly,https://www.reddit.com/r/Stock_Picks/comments/fy8u6r/jdst_stock_killin_me_slowly/,2021-03-29 19:28,39,8,0.91
37mcm,Stock_Picks,fz9lx0,2020-04-11 17:00,Seeking advice on my portfolio during pandemic,https://www.reddit.com/r/Stock_Picks/comments/fz9lx0/seeking_advice_on_my_portfolio_during_pandemic/,2021-03-29 19:28,37,31,0.95
37mcm,Stock_Picks,g00fbj,2020-04-12 17:03,Carnival and Caribbean Cruise Line still paying dividends?,https://www.reddit.com/r/Stock_Picks/comments/g00fbj/carnival_and_caribbean_cruise_line_still_paying/,2021-03-29 19:28,29,46,0.87
37mcm,Stock_Picks,g0sg9m,2020-04-13 21:49,Jdst,https://www.reddit.com/r/Stock_Picks/comments/g0sg9m/jdst/,2021-03-29 19:28,34,7,0.9
37mcm,Stock_Picks,g1eibm,2020-04-14 21:40,Pandemic Picks...,https://www.reddit.com/r/Stock_Picks/comments/g1eibm/pandemic_picks/,2021-03-29 19:28,22,7,0.82
37mcm,Stock_Picks,g2qyxn,2020-04-17 00:05,help a new trader gain the confidence to pick a damn stock already,https://www.reddit.com/r/Stock_Picks/comments/g2qyxn/help_a_new_trader_gain_the_confidence_to_pick_a/,2021-03-29 19:28,37,22,0.79
37mcm,Stock_Picks,g3rmk4,2020-04-18 17:45,LK. The Best or Worst decision of your life,https://www.reddit.com/r/Stock_Picks/comments/g3rmk4/lk_the_best_or_worst_decision_of_your_life/,2021-03-29 19:28,36,36,0.93
