Subreddit_ID,Subreddit_Name,Submission_ID,Submission_CreatedDate,Submission_Title,Submission_URL,Submission_LastFetched,Submission_NumComments,Submission_Score,Submission_UpvoteRatio
2th52,wallstreetbets,mko3le,2021-04-05 16:03,"Took a few flyers on $30, $35, and $40 ASO calls on Thursday. Woke up to some nice gains today! Not bad for 24 hrs of trading gains.",https://i.redd.it/v96cel8kodr61.jpg,2021-04-06 16:01,56,305,0.88
2th52,wallstreetbets,mko4sh,2021-04-05 16:04,"$ASO: I know this is a casino and I know how much you degenerates like to gamble so I wanted to share what I came across. Broke through the ascending channel, rising OBV, increased volume (but still low), and short interest is 39.41%! Looks like $RKT at the beginning of March! Not Financial Advice!!",https://i.redd.it/6jq4hgilodr61.png,2021-04-06 16:01,108,241,0.85
2th52,wallstreetbets,mkobv4,2021-04-05 16:13,YOLOing on TSLA,https://i.redd.it/tdxlb4icqdr61.jpg,2021-04-06 16:01,63,190,0.9
2th52,wallstreetbets,mkokfi,2021-04-05 16:23,$3200 to $20k GOOG Gainz,https://www.reddit.com/gallery/mkokfi,2021-04-06 16:01,41,205,0.91
2th52,wallstreetbets,mkolbs,2021-04-05 16:24,Cheddar comes from udders 🐄🚀🌙,https://www.reddit.com/gallery/mkolbs,2021-04-06 16:01,43,52,0.82
2th52,wallstreetbets,mkosdx,2021-04-05 16:33,"Took Tepper’s call and hit the Emini Jackpot ($38,460). $1,000,000 cost basis on a $100,000 margin account.",https://i.redd.it/mhmt1hvztdr61.jpg,2021-04-06 16:01,22,28,0.83
2th52,wallstreetbets,mkpdr9,2021-04-05 17:00,I built a tool for us to track US Representatives Stock Trades,https://www.reddit.com/r/wallstreetbets/comments/mkpdr9/i_built_a_tool_for_us_to_track_us_representatives/,2021-04-06 16:01,520,50497,0.94
2th52,wallstreetbets,mkpdvv,2021-04-05 17:00,Follow the breadcrumbs of AMRN buyout,https://www.reddit.com/r/wallstreetbets/comments/mkpdvv/follow_the_breadcrumbs_of_amrn_buyout/,2021-04-06 16:01,32,44,0.85
2th52,wallstreetbets,mkpi4u,2021-04-05 17:05,GME Options Traded - 04/05/2021,https://www.reddit.com/r/wallstreetbets/comments/mkpi4u/gme_options_traded_04052021/,2021-04-06 16:01,20,124,0.86
2th52,wallstreetbets,mkpj14,2021-04-05 17:06,"Pray for me, this was my life savings 😂 21 years old was too dumb to risk money I couldn't afford to lose. Still have til next Friday but I've lost all faith. Also says ""No buyers for these contracts"" RIP",https://i.redd.it/jwhqfxgtzdr61.jpg,2021-04-06 16:01,127,175,0.83
2th52,wallstreetbets,mkpwfs,2021-04-05 17:23,Bought in gold (AUY) Yamana gold. Still believe inflation is gonna drive the stock price up.,https://i.redd.it/njyfv41s2er61.jpg,2021-04-06 16:01,51,39,0.73
2th52,wallstreetbets,mkrjxh,2021-04-05 18:36,Bullish on Office Furniture,https://www.reddit.com/r/wallstreetbets/comments/mkrjxh/bullish_on_office_furniture/,2021-04-06 16:01,20,5,0.56
2th52,wallstreetbets,mkry20,2021-04-05 18:53,TLRY YOLO Who else is ready for 4/20?,https://i.redd.it/wo45rkvzier61.jpg,2021-04-06 16:01,34,186,0.9
2th52,wallstreetbets,mks1ir,2021-04-05 18:58,We outed some mods! (you can't unsee this),https://v.redd.it/8nymzp2pjer61,2021-04-06 16:01,28,170,0.87
2th52,wallstreetbets,mksmhy,2021-04-05 19:23,"$MTCH is pushing users to travel, but not in the way you'd think",https://www.reddit.com/r/wallstreetbets/comments/mksmhy/mtch_is_pushing_users_to_travel_but_not_in_the/,2021-04-06 16:01,22,4,0.56
2th52,wallstreetbets,mksxsr,2021-04-05 19:37,BB yolo update 4/5/2021,https://i.redd.it/jmnaaurtqer61.jpg,2021-04-06 16:01,102,606,0.93
2th52,wallstreetbets,mkt7qi,2021-04-05 19:50,The Bull-Case for Lordstown Motors Corporation (RIDE) – Never Bet Against America,https://www.reddit.com/r/wallstreetbets/comments/mkt7qi/the_bullcase_for_lordstown_motors_corporation/,2021-04-06 16:01,322,322,0.83
2th52,wallstreetbets,mktg0s,2021-04-05 20:00,"What Are Your Moves Tomorrow, April 06, 2021",https://www.reddit.com/r/wallstreetbets/comments/mktg0s/what_are_your_moves_tomorrow_april_06_2021/,2021-04-06 16:01,10663,579,0.95
2th52,wallstreetbets,mktlmm,2021-04-05 20:06,VIAC YOLO Update - Loaded up on more LEAPS,https://i.redd.it/1tklbpirver61.png,2021-04-06 16:01,42,60,0.84
2th52,wallstreetbets,mktnmp,2021-04-05 20:09,Options are for Apes too (just not GME),https://www.reddit.com/r/wallstreetbets/comments/mktnmp/options_are_for_apes_too_just_not_gme/,2021-04-06 16:01,22,26,0.67
2th52,wallstreetbets,mktvom,2021-04-05 20:19,26k-> 99k in a day . Mainly thanks to $SPY yolo 😀,https://i.redd.it/djxmdqc9yer61.jpg,2021-04-06 16:01,569,9830,0.97
2th52,wallstreetbets,mku470,2021-04-05 20:30,"Bullish on $NCLH. I’m not crazy, but some ppl can’t wait to cruise again 🚢",https://i.redd.it/s6hiub660fr61.jpg,2021-04-06 16:01,31,73,0.83
2th52,wallstreetbets,mku683,2021-04-05 20:32,Vroom vroom get on me rocket! 🚀🚀🚀,https://i.redd.it/1tpjqqrm0fr61.jpg,2021-04-06 16:01,36,234,0.89
2th52,wallstreetbets,mku6fa,2021-04-05 20:33,ASO Simple DD,https://www.reddit.com/r/wallstreetbets/comments/mku6fa/aso_simple_dd/,2021-04-06 16:01,62,177,0.83
2th52,wallstreetbets,mkv95z,2021-04-05 21:21,GME Weeklies YOLO 😅 Guys please give me some confirmation bias - feeling pretty 🌈🌈,https://i.redd.it/wwovf5ye9fr61.jpg,2021-04-06 16:01,294,652,0.87
2th52,wallstreetbets,mkwiqp,2021-04-05 22:20,Apes win again! Let's Go!,https://www.marketwatch.com/story/gamestop-the-incredible-unshortable-stock-11617659694?siteid=yhoof2&mod=mw_RHF,2021-04-06 16:01,234,1282,0.96
2th52,wallstreetbets,mkxi0w,2021-04-05 23:08,$GOEV - Bullish theory - USPS Truck Contract,https://www.reddit.com/r/wallstreetbets/comments/mkxi0w/goev_bullish_theory_usps_truck_contract/,2021-04-06 16:01,59,29,0.65
2th52,wallstreetbets,mkxprj,2021-04-05 23:19,XLNX Arbitrage Merger with AMD on April 7th,https://www.reddit.com/r/wallstreetbets/comments/mkxprj/xlnx_arbitrage_merger_with_amd_on_april_7th/,2021-04-06 16:01,31,37,0.8
2th52,wallstreetbets,mkyg7x,2021-04-05 23:56,YOLE -ED $18k - all today profit from Tesla calls ($13k) plus $5k into new Tesla calls 10x$690c 4/9.,https://www.reddit.com/gallery/mkyg7x,2021-04-06 16:01,25,64,0.89
2th52,wallstreetbets,ml02xg,2021-04-06 01:20,YOLO Update 4/5: threw my entire account into $ASO calls,https://i.redd.it/bp66tjwxfgr61.jpg,2021-04-06 16:01,99,258,0.9
2th52,wallstreetbets,ml06oe,2021-04-06 01:25,4D Autist Chess. Hoping to buy a house with my RKT tendies. Made $20k in a mini squeeze and back for more 🚀🚀🚀,https://www.reddit.com/gallery/ml06oe,2021-04-06 16:01,64,75,0.79
2th52,wallstreetbets,ml0bsy,2021-04-06 01:33,I have come to the realization that a stock with this amount of volatility that Game stop has does not give a FLYING F*CK (smooth brains - the star represents a U) about Technical Analysis!,https://www.reddit.com/r/wallstreetbets/comments/ml0bsy/i_have_come_to_the_realization_that_a_stock_with/,2021-04-06 16:01,268,1737,0.93
2th52,wallstreetbets,ml1a1z,2021-04-06 02:23,BB.....So you’re sayin there’s a chance! i guess i’ll just keep adding and hoping. i’ve never made such a big bet on any one stock. it’s either gone be a great April or #rope😂,https://i.redd.it/uif6buj6rgr61.jpg,2021-04-06 16:01,29,82,0.88
2th52,wallstreetbets,ml1ejz,2021-04-06 02:30,I think I’m the only person I know to lose money on J&J. It hurts too much I might have to close them out 🧻🤲,https://i.redd.it/h7ce8cfesgr61.jpg,2021-04-06 16:01,39,27,0.76
2th52,wallstreetbets,ml239q,2021-04-06 03:08,Update: Credit Suisse Sells $2.3 Billion of Stocks Tied to Archegos,https://www.bloomberg.com/news/articles/2021-04-05/credit-suisse-said-to-offer-viacomcbs-vipshop-farfetch-blocks,2021-04-06 16:01,61,385,0.98
2th52,wallstreetbets,ml3b3s,2021-04-06 04:16,WSB discussion today,https://v.redd.it/ag3q5hi6bhr61,2021-04-06 16:01,27,129,0.99
37mcm,Stock_Picks,f5q9ri,2020-02-18 11:16,Investing With Small Amounts of Money,https://www.reddit.com/r/Stock_Picks/comments/f5q9ri/investing_with_small_amounts_of_money/,2021-04-06 16:01,27,32,0.91
37mcm,Stock_Picks,f6djuh,2020-02-19 16:56,How to sell stock that was given to me as a child.,https://www.reddit.com/r/Stock_Picks/comments/f6djuh/how_to_sell_stock_that_was_given_to_me_as_a_child/,2021-04-06 16:01,26,29,0.97
37mcm,Stock_Picks,fa13go,2020-02-26 21:57,Any tips for new investor during the corona outbreak?,https://www.reddit.com/r/Stock_Picks/comments/fa13go/any_tips_for_new_investor_during_the_corona/,2021-04-06 16:01,43,22,0.83
37mcm,Stock_Picks,fadkli,2020-02-27 15:18,Coronavirus stock list if you dare,https://www.reddit.com/r/Stock_Picks/comments/fadkli/coronavirus_stock_list_if_you_dare/,2021-04-06 16:01,26,40,0.95
37mcm,Stock_Picks,faodl6,2020-02-28 03:30,"Would it be best for a new person to the stock market to buy when the economy is at its lowest, Such as 2009?",https://www.reddit.com/r/Stock_Picks/comments/faodl6/would_it_be_best_for_a_new_person_to_the_stock/,2021-04-06 16:01,41,33,0.88
37mcm,Stock_Picks,fbbsyh,2020-02-29 12:23,"Updated Coronavirus stock list,feel free to add to it.",https://www.reddit.com/r/Stock_Picks/comments/fbbsyh/updated_coronavirus_stock_listfeel_free_to_add_to/,2021-04-06 16:01,54,83,0.98
37mcm,Stock_Picks,fbz5ab,2020-03-01 19:27,Disney has dropped majorly due to coronavirus. Time to invest or will they not be able to bounce back to $140?,https://www.reddit.com/r/Stock_Picks/comments/fbz5ab/disney_has_dropped_majorly_due_to_coronavirus/,2021-04-06 16:01,40,53,0.98
37mcm,Stock_Picks,fcckwu,2020-03-02 14:10,Is this a good time to invest in Tesla?,https://www.reddit.com/r/Stock_Picks/comments/fcckwu/is_this_a_good_time_to_invest_in_tesla/,2021-04-06 16:01,22,4,0.7
37mcm,Stock_Picks,ffyqrt,2020-03-09 17:57,Coronavirus! Best stocks to buy?,https://www.reddit.com/r/Stock_Picks/comments/ffyqrt/coronavirus_best_stocks_to_buy/,2021-04-06 16:01,109,52,0.9
37mcm,Stock_Picks,fh5it0,2020-03-11 22:17,20k to throw in one stock and won’t cash out for 30 years,https://www.reddit.com/r/Stock_Picks/comments/fh5it0/20k_to_throw_in_one_stock_and_wont_cash_out_for/,2021-04-06 16:01,24,7,0.89
37mcm,Stock_Picks,fi3xfk,2020-03-13 18:06,S&P500 or NASDAQ?,https://www.reddit.com/r/Stock_Picks/comments/fi3xfk/sp500_or_nasdaq/,2021-04-06 16:01,25,19,0.84
37mcm,Stock_Picks,fkqaiy,2020-03-18 14:23,Possible baby boom,https://www.reddit.com/r/Stock_Picks/comments/fkqaiy/possible_baby_boom/,2021-04-06 16:01,41,45,0.84
37mcm,Stock_Picks,fkrwhb,2020-03-18 16:03,"To sell my investments at a loss now, and buy back in a few weeks when there is a trend reversal, or to HODL",https://www.reddit.com/r/Stock_Picks/comments/fkrwhb/to_sell_my_investments_at_a_loss_now_and_buy_back/,2021-04-06 16:01,35,13,0.88
37mcm,Stock_Picks,flw0bx,2020-03-20 14:34,First time investor advice? Best time to start?,https://www.reddit.com/r/Stock_Picks/comments/flw0bx/first_time_investor_advice_best_time_to_start/,2021-04-06 16:01,35,29,0.84
37mcm,Stock_Picks,fm93kj,2020-03-21 04:07,If I can exit $200 Positive should I?,https://www.reddit.com/r/Stock_Picks/comments/fm93kj/if_i_can_exit_200_positive_should_i/,2021-04-06 16:01,20,35,0.86
37mcm,Stock_Picks,fm9h43,2020-03-21 04:38,Taking a 5K loan,https://www.reddit.com/r/Stock_Picks/comments/fm9h43/taking_a_5k_loan/,2021-04-06 16:01,21,0,0.5
37mcm,Stock_Picks,fm9m6j,2020-03-21 04:50,If the corona situation is fixed within the next 2-3 months,https://www.reddit.com/r/Stock_Picks/comments/fm9m6j/if_the_corona_situation_is_fixed_within_the_next/,2021-04-06 16:01,29,13,0.82
37mcm,Stock_Picks,fn6pqf,2020-03-22 20:36,Stock Picks COVID-19,https://www.reddit.com/r/Stock_Picks/comments/fn6pqf/stock_picks_covid19/,2021-04-06 16:01,45,42,0.84
37mcm,Stock_Picks,fo2gjk,2020-03-24 09:50,Investing in the current market,https://www.reddit.com/r/Stock_Picks/comments/fo2gjk/investing_in_the_current_market/,2021-04-06 16:01,28,17,0.81
37mcm,Stock_Picks,fo70b4,2020-03-24 15:30,Market Bottom?,https://www.reddit.com/r/Stock_Picks/comments/fo70b4/market_bottom/,2021-04-06 16:01,96,22,0.77
37mcm,Stock_Picks,fobsvi,2020-03-24 19:51,What happens to prices immediately post bailout,https://www.reddit.com/r/Stock_Picks/comments/fobsvi/what_happens_to_prices_immediately_post_bailout/,2021-04-06 16:01,26,15,0.95
37mcm,Stock_Picks,foicqy,2020-03-25 02:19,Looking to build a portfolio after this is over....,https://www.reddit.com/r/Stock_Picks/comments/foicqy/looking_to_build_a_portfolio_after_this_is_over/,2021-04-06 16:01,27,18,0.86
37mcm,Stock_Picks,fos5ma,2020-03-25 15:25,Most risky/rewarding stocks right now.,https://www.reddit.com/r/Stock_Picks/comments/fos5ma/most_riskyrewarding_stocks_right_now/,2021-04-06 16:01,36,11,0.81
37mcm,Stock_Picks,foss6l,2020-03-25 16:02,"Considering selling TSLA and AMD, then buying GOOGL.",https://www.reddit.com/r/Stock_Picks/comments/foss6l/considering_selling_tsla_and_amd_then_buying_googl/,2021-04-06 16:01,22,25,0.84
37mcm,Stock_Picks,fpgbgz,2020-03-26 18:03,Deadcat or solid bottom. GO.,https://www.reddit.com/r/Stock_Picks/comments/fpgbgz/deadcat_or_solid_bottom_go/,2021-04-06 16:01,41,38,0.83
37mcm,Stock_Picks,fqm9td,2020-03-28 15:30,New trader mistake or did I make the right move?,https://www.reddit.com/r/Stock_Picks/comments/fqm9td/new_trader_mistake_or_did_i_make_the_right_move/,2021-04-06 16:01,63,36,0.86
37mcm,Stock_Picks,frcpug,2020-03-29 20:31,NCLH vs. RCL?,https://www.reddit.com/r/Stock_Picks/comments/frcpug/nclh_vs_rcl/,2021-04-06 16:01,21,8,0.83
37mcm,Stock_Picks,frgdni,2020-03-30 00:08,What will Monday bring?,https://www.reddit.com/r/Stock_Picks/comments/frgdni/what_will_monday_bring/,2021-04-06 16:01,37,19,0.79
37mcm,Stock_Picks,fsf6h9,2020-03-31 15:43,Why is the market rallying over bad news?,https://www.reddit.com/r/Stock_Picks/comments/fsf6h9/why_is_the_market_rallying_over_bad_news/,2021-04-06 16:01,45,45,0.94
37mcm,Stock_Picks,ftdand,2020-04-02 01:35,5G tech stocks,https://www.reddit.com/r/Stock_Picks/comments/ftdand/5g_tech_stocks/,2021-04-06 16:01,37,19,0.93
37mcm,Stock_Picks,ftvb27,2020-04-02 21:47,Better to dump 5k into an index or through individual stocks?,https://www.reddit.com/r/Stock_Picks/comments/ftvb27/better_to_dump_5k_into_an_index_or_through/,2021-04-06 16:01,31,6,0.67
37mcm,Stock_Picks,ftvc51,2020-04-02 21:49,Post-Covid Winners/Losers,https://www.reddit.com/r/Stock_Picks/comments/ftvc51/postcovid_winnerslosers/,2021-04-06 16:01,34,32,0.9
37mcm,Stock_Picks,fuecet,2020-04-03 19:06,Coronavirus profiteering,https://www.reddit.com/r/Stock_Picks/comments/fuecet/coronavirus_profiteering/,2021-04-06 16:01,79,47,0.9
37mcm,Stock_Picks,fuhw56,2020-04-03 22:23,Thoughts on JNUG- new to investing,https://www.reddit.com/r/Stock_Picks/comments/fuhw56/thoughts_on_jnug_new_to_investing/,2021-04-06 16:01,31,10,0.82
37mcm,Stock_Picks,futezy,2020-04-04 13:07,Have we hit the lowest low?,https://www.reddit.com/r/Stock_Picks/comments/futezy/have_we_hit_the_lowest_low/,2021-04-06 16:01,21,7,0.74
37mcm,Stock_Picks,fv0kva,2020-04-04 20:20,Stock picks good or bad?,https://www.reddit.com/r/Stock_Picks/comments/fv0kva/stock_picks_good_or_bad/,2021-04-06 16:01,49,34,0.96
37mcm,Stock_Picks,fwaubf,2020-04-07 00:53,"Brand New to Stocks, Looking to make some $ short term",https://www.reddit.com/r/Stock_Picks/comments/fwaubf/brand_new_to_stocks_looking_to_make_some_short/,2021-04-06 16:01,29,6,0.81
37mcm,Stock_Picks,fy48xn,2020-04-10 00:33,WTF is actually going on,https://www.reddit.com/r/Stock_Picks/comments/fy48xn/wtf_is_actually_going_on/,2021-04-06 16:01,107,73,0.9
37mcm,Stock_Picks,fy8u6r,2020-04-10 05:01,Jdst stock killin me slowly,https://www.reddit.com/r/Stock_Picks/comments/fy8u6r/jdst_stock_killin_me_slowly/,2021-04-06 16:01,39,9,1.0
37mcm,Stock_Picks,fz9lx0,2020-04-11 17:00,Seeking advice on my portfolio during pandemic,https://www.reddit.com/r/Stock_Picks/comments/fz9lx0/seeking_advice_on_my_portfolio_during_pandemic/,2021-04-06 16:01,37,32,0.95
37mcm,Stock_Picks,g00fbj,2020-04-12 17:03,Carnival and Caribbean Cruise Line still paying dividends?,https://www.reddit.com/r/Stock_Picks/comments/g00fbj/carnival_and_caribbean_cruise_line_still_paying/,2021-04-06 16:01,29,43,0.86
37mcm,Stock_Picks,g0sg9m,2020-04-13 21:49,Jdst,https://www.reddit.com/r/Stock_Picks/comments/g0sg9m/jdst/,2021-04-06 16:01,34,4,0.76
37mcm,Stock_Picks,g1eibm,2020-04-14 21:40,Pandemic Picks...,https://www.reddit.com/r/Stock_Picks/comments/g1eibm/pandemic_picks/,2021-04-06 16:01,22,6,0.81
37mcm,Stock_Picks,g2qyxn,2020-04-17 00:05,help a new trader gain the confidence to pick a damn stock already,https://www.reddit.com/r/Stock_Picks/comments/g2qyxn/help_a_new_trader_gain_the_confidence_to_pick_a/,2021-04-06 16:01,37,24,0.81
37mcm,Stock_Picks,g3rmk4,2020-04-18 17:45,LK. The Best or Worst decision of your life,https://www.reddit.com/r/Stock_Picks/comments/g3rmk4/lk_the_best_or_worst_decision_of_your_life/,2021-04-06 16:01,36,38,0.95
37mcm,Stock_Picks,g5kzde,2020-04-21 18:44,Calling all super savvy stockholders!!,https://www.reddit.com/r/Stock_Picks/comments/g5kzde/calling_all_super_savvy_stockholders/,2021-04-06 16:01,46,28,0.79
37mcm,Stock_Picks,g7cycm,2020-04-24 17:48,I need a explanation,https://www.reddit.com/r/Stock_Picks/comments/g7cycm/i_need_a_explanation/,2021-04-06 16:01,34,19,0.82
37mcm,Stock_Picks,g84frs,2020-04-26 00:14,Should I sell my portfolio at -$5k right now compared to when it was down -$20k at it's lowest in March and mitigate my losses before the market goes down again (assuming that happens)?,/r/investing/comments/g84etg/should_i_sell_my_portfolio_at_5k_right_now/,2021-04-06 16:01,22,38,0.86
37mcm,Stock_Picks,gak3mj,2020-04-29 23:14,Any predictions on how the market will go tomorrow?,https://www.reddit.com/r/Stock_Picks/comments/gak3mj/any_predictions_on_how_the_market_will_go_tomorrow/,2021-04-06 16:01,20,18,0.91
37mcm,Stock_Picks,gb2bri,2020-04-30 19:23,Restaraunt stocks or their resources?,https://www.reddit.com/r/Stock_Picks/comments/gb2bri/restaraunt_stocks_or_their_resources/,2021-04-06 16:01,25,20,0.96
37mcm,Stock_Picks,gcgk5h,2020-05-02 23:49,Buffett Dumps Airline Stock,https://www.marketwatch.com/discover?url=https%3A%2F%2Fwww.marketwatch.com%2Famp%2Fstory%2Fguid%2Fd70d7202-8cc4-11ea-b500-29c0c34a0e28&link=sfmw_tw#https://www.marketwatch.com/amp/story/guid/d70d7202-8cc4-11ea-b500-29c0c34a0e28?mod=dist_amp_social,2021-04-06 16:01,41,68,0.94
37mcm,Stock_Picks,gg7ikb,2020-05-09 03:01,Stocks to shoot up after earnings report?,https://www.reddit.com/r/Stock_Picks/comments/gg7ikb/stocks_to_shoot_up_after_earnings_report/,2021-04-06 16:01,24,29,0.92
37mcm,Stock_Picks,ghz6bu,2020-05-11 23:31,Favorite stocks to swing that have been relatively consistent?,https://www.reddit.com/r/Stock_Picks/comments/ghz6bu/favorite_stocks_to_swing_that_have_been/,2021-04-06 16:01,23,20,0.93
37mcm,Stock_Picks,gignwn,2020-05-12 18:06,Safest airline for long term investing?,https://www.reddit.com/r/Stock_Picks/comments/gignwn/safest_airline_for_long_term_investing/,2021-04-06 16:01,26,5,0.71
37mcm,Stock_Picks,gjz6pg,2020-05-15 00:52,Diversification,https://www.reddit.com/r/Stock_Picks/comments/gjz6pg/diversification/,2021-04-06 16:01,21,5,0.86
37mcm,Stock_Picks,gmc5tp,2020-05-18 22:47,My Short Stock Picks.,https://www.reddit.com/r/Stock_Picks/comments/gmc5tp/my_short_stock_picks/,2021-04-06 16:01,25,17,0.88
37mcm,Stock_Picks,goavmo,2020-05-22 02:33,Peloton vs. Tesla,https://www.reddit.com/r/Stock_Picks/comments/goavmo/peloton_vs_tesla/,2021-04-06 16:01,30,29,0.85
37mcm,Stock_Picks,gpilpi,2020-05-24 03:30,Montely fool?,https://www.reddit.com/r/Stock_Picks/comments/gpilpi/montely_fool/,2021-04-06 16:01,40,5,0.57
37mcm,Stock_Picks,gvfnrh,2020-06-02 20:57,Vegas Reopen,https://www.reddit.com/r/Stock_Picks/comments/gvfnrh/vegas_reopen/,2021-04-06 16:01,33,29,0.94
37mcm,Stock_Picks,gwajqj,2020-06-04 04:53,Looking for learning resources,https://www.reddit.com/r/Stock_Picks/comments/gwajqj/looking_for_learning_resources/,2021-04-06 16:01,20,26,0.84
37mcm,Stock_Picks,gzjtig,2020-06-09 09:33,"What a bubble! Warren Buffett's favorite stock-market indicator hits record high, signaling a crash could be coming. It is now at 1.8, hollymolly.",https://fred.stlouisfed.org/graph/?g=qLC,2021-04-06 16:01,22,61,0.91
37mcm,Stock_Picks,gzqw1r,2020-06-09 16:48,Robinhood traders cash in on the market comeback that billionaire investors missed,https://www.cnbc.com/2020/06/09/robinhood-traders-cash-in-on-the-market-comeback-that-billionaire-investors-missed.html,2021-04-06 16:01,20,52,0.95
37mcm,Stock_Picks,h170fz,2020-06-11 20:12,"First Time Investing, Did I get off to a good start?",https://www.reddit.com/r/Stock_Picks/comments/h170fz/first_time_investing_did_i_get_off_to_a_good_start/,2021-04-06 16:01,30,18,0.75
37mcm,Stock_Picks,h7x06x,2020-06-13 00:41,Palantir close to registering for stock market debut: sources,https://www.reuters.com/article/us-palantir-ipo-exclusive/palantir-close-to-registering-for-stock-market-debut-sources-idUSKBN23I3GB,2021-04-06 16:01,21,36,0.9
37mcm,Stock_Picks,hasaru,2020-06-17 14:33,How to Short a Stock (Question),https://www.reddit.com/r/Stock_Picks/comments/hasaru/how_to_short_a_stock_question/,2021-04-06 16:01,22,15,0.8
37mcm,Stock_Picks,hb9ofk,2020-06-18 07:01,I have IDEX share 100,https://www.reddit.com/r/Stock_Picks/comments/hb9ofk/i_have_idex_share_100/,2021-04-06 16:01,27,22,0.88
37mcm,Stock_Picks,hcrxxz,2020-06-20 19:12,Amateur investor and need advice / guidance on picking stocks,https://www.reddit.com/r/Stock_Picks/comments/hcrxxz/amateur_investor_and_need_advice_guidance_on/,2021-04-06 16:01,26,13,0.84
37mcm,Stock_Picks,hiznfy,2020-07-01 00:18,Help a noob out,https://www.reddit.com/r/Stock_Picks/comments/hiznfy/help_a_noob_out/,2021-04-06 16:01,54,24,0.91
37mcm,Stock_Picks,httlrs,2020-07-19 03:08,HEAVY DD FOR: ● VXRT ○ $20 is Imminent • 👊🤑📈📉📈💰,https://www.reddit.com/r/Stock_Picks/comments/httlrs/heavy_dd_for_vxrt_20_is_imminent/,2021-04-06 16:01,22,35,0.79
37mcm,Stock_Picks,hu6sop,2020-07-19 19:48,daily stock pick thread? goal to make 5-10%.,https://www.reddit.com/r/Stock_Picks/comments/hu6sop/daily_stock_pick_thread_goal_to_make_510/,2021-04-06 16:01,95,36,0.79
37mcm,Stock_Picks,i4683k,2020-08-05 14:22,$TRU Possible Covid-19 game changer for the United States and the world?(On August 6th 3 pm),https://www.reddit.com/r/Stock_Picks/comments/i4683k/tru_possible_covid19_game_changer_for_the_united/,2021-04-06 16:01,44,19,0.83
37mcm,Stock_Picks,i6441r,2020-08-08 18:29,"Stimulus Package Thoughts, Politics",https://www.reddit.com/r/Stock_Picks/comments/i6441r/stimulus_package_thoughts_politics/,2021-04-06 16:01,88,33,0.8
37mcm,Stock_Picks,iwjuwt,2020-09-20 19:00,QLGN - QUALIGEN therapeutics - EUA's approval for their covid-19 test kit is due at anytime now. Double soon.,https://www.reddit.com/r/Stock_Picks/comments/iwjuwt/qlgn_qualigen_therapeutics_euas_approval_for/,2021-04-06 16:01,34,42,0.91
37mcm,Stock_Picks,ixuppo,2020-09-22 19:44,Tesla competitor Nikola's stock craters after founder Trevor Milton resigns chairmanship,https://finance.yahoo.com/news/nikola-stock-price-drops-chairman-trevor-milton-resignation-112228730.html,2021-04-06 16:01,23,55,0.96
37mcm,Stock_Picks,jbxhh0,2020-10-15 22:12,Advice needed,https://www.reddit.com/r/Stock_Picks/comments/jbxhh0/advice_needed/,2021-04-06 16:01,21,11,0.87
37mcm,Stock_Picks,jo3ey6,2020-11-04 19:41,Looking for suggestions for a 1000 dollar high risk high reward us stock market portfolio for a research experiment,https://www.reddit.com/r/Stock_Picks/comments/jo3ey6/looking_for_suggestions_for_a_1000_dollar_high/,2021-04-06 16:01,36,30,0.87
37mcm,Stock_Picks,jvl7rh,2020-11-17 02:57,Soros bought 18 Million shares of Palantir,https://www.reddit.com/r/Stock_Picks/comments/jvl7rh/soros_bought_18_million_shares_of_palantir/,2021-04-06 16:01,55,55,0.97
37mcm,Stock_Picks,k69r9k,2020-12-04 00:11,GMDA due diligence from recent fireside chats,https://www.reddit.com/r/Stock_Picks/comments/k69r9k/gmda_due_diligence_from_recent_fireside_chats/,2021-04-06 16:01,24,20,0.88
37mcm,Stock_Picks,k8k84m,2020-12-07 16:49,Best way to short the market? HDGE keeps dropping!,https://www.reddit.com/r/Stock_Picks/comments/k8k84m/best_way_to_short_the_market_hdge_keeps_dropping/,2021-04-06 16:01,20,11,0.74
37mcm,Stock_Picks,kcfyck,2020-12-13 18:39,CD Projekt large drop,https://www.reddit.com/r/Stock_Picks/comments/kcfyck/cd_projekt_large_drop/,2021-04-06 16:01,39,35,0.93
37mcm,Stock_Picks,kf993a,2020-12-17 23:42,Cybersecurity stocks?,https://www.reddit.com/r/Stock_Picks/comments/kf993a/cybersecurity_stocks/,2021-04-06 16:01,52,48,0.96
37mcm,Stock_Picks,knoyen,2020-12-31 12:11,Great buy,https://www.reddit.com/r/Stock_Picks/comments/knoyen/great_buy/,2021-04-06 16:01,25,7,0.6
37mcm,Stock_Picks,kqifqq,2021-01-04 21:28,Weed Stocks Questions,https://www.reddit.com/r/Stock_Picks/comments/kqifqq/weed_stocks_questions/,2021-04-06 16:01,51,17,0.95
37mcm,Stock_Picks,l2w8m7,2021-01-22 20:26,"If the US cancels student loans, what would you invest in? What would you get out of?",https://www.reddit.com/r/Stock_Picks/comments/l2w8m7/if_the_us_cancels_student_loans_what_would_you/,2021-04-06 16:01,44,24,0.75
37mcm,Stock_Picks,l3pg98,2021-01-24 01:27,My Current Watchlist and Price Targets.,https://www.reddit.com/r/Stock_Picks/comments/l3pg98/my_current_watchlist_and_price_targets/,2021-04-06 16:01,32,52,0.96
37mcm,Stock_Picks,l4blx6,2021-01-25 00:26,Why Adobe Inc. (ADBE) is absolutely undervalued,https://www.reddit.com/r/Stock_Picks/comments/l4blx6/why_adobe_inc_adbe_is_absolutely_undervalued/,2021-04-06 16:01,21,54,0.94
37mcm,Stock_Picks,l4sqda,2021-01-25 17:31,Is it possible for AMC to be the next GameStop?,https://www.marketwatch.com/story/amc-shares-soar-36-premarket-on-news-of-new-917-million-debt-and-equity-financing-2021-01-25,2021-04-06 16:01,43,58,0.88
37mcm,Stock_Picks,l4v0ry,2021-01-25 19:12,Just found that AMC is number 3 on short list...GameStop is number 1.,https://www.highshortinterest.com/,2021-04-06 16:01,44,18,0.84
