Subreddit_ID,Subreddit_Name,Submission_ID,Submission_CreatedDate,Submission_Title,Submission_URL,Submission_LastFetched,Submission_NumComments,Submission_Score,Submission_UpvoteRatio
2qhhq,investing,kdhyzs,2020-12-15 08:30,Thoughts on individual stock buying vs etf?,https://www.reddit.com/r/investing/comments/kdhyzs/thoughts_on_individual_stock_buying_vs_etf/,2020-12-25 20:52,28,1,0.56
2qhhq,investing,kdk5pz,2020-12-15 11:35,BABA,https://www.reddit.com/r/investing/comments/kdk5pz/baba/,2020-12-25 20:52,60,40,0.9
2qhhq,investing,kdkfzy,2020-12-15 11:57,Trading in EU stock; obtaining IRS forms,https://www.reddit.com/r/investing/comments/kdkfzy/trading_in_eu_stock_obtaining_irs_forms/,2020-12-25 20:52,37,21,0.81
2qhhq,investing,kdklnh,2020-12-15 12:09,Daily Advice Thread - All basic help or advice questions must be posted here.,https://www.reddit.com/r/investing/comments/kdklnh/daily_advice_thread_all_basic_help_or_advice/,2020-12-25 20:52,134,16,0.9
2qhhq,investing,kdm9xg,2020-12-15 14:03,SpaceX in Talks for New Funds and $92 Billion Valuation [Bloomberg],https://www.reddit.com/r/investing/comments/kdm9xg/spacex_in_talks_for_new_funds_and_92_billion/,2020-12-25 20:52,440,1406,0.96
2qhhq,investing,kdnl09,2020-12-15 15:19,RobinHood no longer supporting REITs?,https://www.reddit.com/r/investing/comments/kdnl09/robinhood_no_longer_supporting_reits/,2020-12-25 20:52,58,25,0.78
2qhhq,investing,kdo3bu,2020-12-15 15:47,Short Term Profit Taking Considerations,https://www.reddit.com/r/investing/comments/kdo3bu/short_term_profit_taking_considerations/,2020-12-25 20:52,24,35,0.84
2qhhq,investing,kdqrpq,2020-12-15 18:03,Gold miners not acting proportional to gold prices in an unsustainable trend for months now. There is potential for a correction in the miners.,https://www.reddit.com/r/investing/comments/kdqrpq/gold_miners_not_acting_proportional_to_gold/,2020-12-25 20:52,20,20,0.72
2qhhq,investing,kdr8y6,2020-12-15 18:26,Why I cut my position in $TSLA and bought Kellogg’s,https://www.reddit.com/r/investing/comments/kdr8y6/why_i_cut_my_position_in_tsla_and_bought_kelloggs/,2020-12-25 20:52,25,0,0.24
2qhhq,investing,kds3xm,2020-12-15 19:07,"Now that you can trade Water Futures, I'm betting on the Appharvest IPO to boom.",https://www.reddit.com/r/investing/comments/kds3xm/now_that_you_can_trade_water_futures_im_betting/,2020-12-25 20:52,59,107,0.9
2qhhq,investing,kdsof0,2020-12-15 19:36,ARK discussion,https://www.reddit.com/r/investing/comments/kdsof0/ark_discussion/,2020-12-25 20:52,50,84,0.88
2qhhq,investing,kdtppk,2020-12-15 20:26,Concern Over Falling US Dollar Value,https://www.reddit.com/r/investing/comments/kdtppk/concern_over_falling_us_dollar_value/,2020-12-25 20:52,131,79,0.87
2qhhq,investing,kdvm6s,2020-12-15 22:02,Aphria and Tilray are merging. MJ stocks ripping after hours.,https://www.reddit.com/r/investing/comments/kdvm6s/aphria_and_tilray_are_merging_mj_stocks_ripping/,2020-12-25 20:51,96,250,0.92
2qhhq,investing,kdwlc7,2020-12-15 22:55,Avepoint - A Huge Growth Opportunity in 2021,https://www.reddit.com/r/investing/comments/kdwlc7/avepoint_a_huge_growth_opportunity_in_2021/,2020-12-25 20:51,32,22,0.72
2qhhq,investing,kdwq4w,2020-12-15 23:02,"I think I'll have to give up trading, too many losses.",https://www.reddit.com/r/investing/comments/kdwq4w/i_think_ill_have_to_give_up_trading_too_many/,2020-12-25 20:51,234,122,0.79
2qhhq,investing,kdwui3,2020-12-15 23:08,Buy Intel for Mobileye,https://www.reddit.com/r/investing/comments/kdwui3/buy_intel_for_mobileye/,2020-12-25 20:51,38,6,0.62
2qhhq,investing,kdwxnz,2020-12-15 23:13,Best Oil play for 1-3 yrs?,https://www.reddit.com/r/investing/comments/kdwxnz/best_oil_play_for_13_yrs/,2020-12-25 20:51,47,7,0.63
2qhhq,investing,ke0u8n,2020-12-16 02:58,"Here's my list of ""contrarian"" investment ideas. What are yours?",https://www.reddit.com/r/investing/comments/ke0u8n/heres_my_list_of_contrarian_investment_ideas_what/,2020-12-25 20:51,30,1,0.53
2qhhq,investing,ke5460,2020-12-16 07:59,Personal rate of return target?,https://www.reddit.com/r/investing/comments/ke5460/personal_rate_of_return_target/,2020-12-25 20:51,24,0,0.22
2qhhq,investing,ke57y3,2020-12-16 08:08,How to do proper due dilligence research?,https://www.reddit.com/r/investing/comments/ke57y3/how_to_do_proper_due_dilligence_research/,2020-12-25 20:51,363,1108,0.96
2qhhq,investing,ke6vof,2020-12-16 10:32,Thoughts on bitwise's Bitcoin index fund??,https://www.reddit.com/r/investing/comments/ke6vof/thoughts_on_bitwises_bitcoin_index_fund/,2020-12-25 20:51,31,11,0.68
2qhhq,investing,ke730w,2020-12-16 10:50,What are your thoughts on Passive Investing now that Tesla is 8th largest cap?,https://www.reddit.com/r/investing/comments/ke730w/what_are_your_thoughts_on_passive_investing_now/,2020-12-25 20:51,20,0,0.45
2qhhq,investing,ke82ig,2020-12-16 12:10,Daily Advice Thread - All basic help or advice questions must be posted here.,https://www.reddit.com/r/investing/comments/ke82ig/daily_advice_thread_all_basic_help_or_advice/,2020-12-25 20:51,118,7,0.77
2qhhq,investing,ke85t9,2020-12-16 12:17,Massachusetts Regulators to File Complaint Against Robinhood,https://www.reddit.com/r/investing/comments/ke85t9/massachusetts_regulators_to_file_complaint/,2020-12-25 20:51,100,181,0.95
2qhhq,investing,ke9hmn,2020-12-16 13:49,British fund firm Ruffer piles $675 million into bitcoin in 'defensive move' -memo,https://www.reddit.com/r/investing/comments/ke9hmn/british_fund_firm_ruffer_piles_675_million_into/,2020-12-25 20:51,478,568,0.93
2qhhq,investing,keag69,2020-12-16 14:44,Norwegian Air filing for bankruptcy. WHat does it mean?,https://www.reddit.com/r/investing/comments/keag69/norwegian_air_filing_for_bankruptcy_what_does_it/,2020-12-25 20:51,66,68,0.92
2qhhq,investing,keclnt,2020-12-16 16:40,The Dangers of Passive Investing [Seeking Alpha],https://www.reddit.com/r/investing/comments/keclnt/the_dangers_of_passive_investing_seeking_alpha/,2020-12-25 20:51,55,19,0.67
2qhhq,investing,keela5,2020-12-16 18:20,Hollow-core fiber optic cables or: another reminder that individual investors shouldn't try to compete with institutional investors,https://www.reddit.com/r/investing/comments/keela5/hollowcore_fiber_optic_cables_or_another_reminder/,2020-12-25 20:51,65,57,0.77
2qhhq,investing,keg8s6,2020-12-16 19:41,"""Fed commits to keep buying bonds until the economy gets back to full employment.""",https://www.reddit.com/r/investing/comments/keg8s6/fed_commits_to_keep_buying_bonds_until_the/,2020-12-25 20:51,757,1680,0.98
2qhhq,investing,keh9jj,2020-12-16 20:31,Facebook vs. Apple,https://www.reddit.com/r/investing/comments/keh9jj/facebook_vs_apple/,2020-12-25 20:51,33,1,0.57
2qhhq,investing,kehqv0,2020-12-16 20:55,"The next decade, will we see similar growth?",https://www.reddit.com/r/investing/comments/kehqv0/the_next_decade_will_we_see_similar_growth/,2020-12-25 20:51,20,4,0.6
2qhhq,investing,kekyd2,2020-12-16 23:34,Cinemark is extremely undervalued,https://www.reddit.com/r/investing/comments/kekyd2/cinemark_is_extremely_undervalued/,2020-12-25 20:51,33,0,0.36
2qhhq,investing,kel5mo,2020-12-16 23:44,What caused stock prices to rise in february 2020 right before the crash in march?,https://www.reddit.com/r/investing/comments/kel5mo/what_caused_stock_prices_to_rise_in_february_2020/,2020-12-25 20:51,41,42,0.79
2qhhq,investing,kelqe0,2020-12-17 00:15,A way to get exposure to the cryptocurrency market without actually buying crypto directly - invest in the exchanges.,https://www.reddit.com/r/investing/comments/kelqe0/a_way_to_get_exposure_to_the_cryptocurrency/,2020-12-25 20:51,29,0,0.5
2qhhq,investing,keok5w,2020-12-17 02:47,Why does Warren continue to hold so much Apple?,https://www.reddit.com/r/investing/comments/keok5w/why_does_warren_continue_to_hold_so_much_apple/,2020-12-25 20:51,136,90,0.83
2qhhq,investing,kepvka,2020-12-17 04:03,Hedging the USD,https://www.reddit.com/r/investing/comments/kepvka/hedging_the_usd/,2020-12-25 20:51,24,25,0.91
2qhhq,investing,keq57x,2020-12-17 04:19,Is it illegal if I start buying and selling stocks with the wrong legal name on my Robinhood account?,https://www.reddit.com/r/investing/comments/keq57x/is_it_illegal_if_i_start_buying_and_selling/,2020-12-25 20:51,32,0,0.5
2qhhq,investing,ketgkb,2020-12-17 08:15,Best investment return from each decade 80’s to present,https://www.reddit.com/r/investing/comments/ketgkb/best_investment_return_from_each_decade_80s_to/,2020-12-25 20:51,275,146,0.91
2qhhq,investing,keu1o9,2020-12-17 09:05,Place to park cash December 2020,https://www.reddit.com/r/investing/comments/keu1o9/place_to_park_cash_december_2020/,2020-12-25 20:51,20,0,0.33
2qhhq,investing,keve0a,2020-12-17 10:56,Is it a good to talk to a VC/Angel who has already invested heavily on my competitor,https://www.reddit.com/r/investing/comments/keve0a/is_it_a_good_to_talk_to_a_vcangel_who_has_already/,2020-12-25 20:51,30,9,0.65
2qhhq,investing,kewafv,2020-12-17 12:08,Daily Advice Thread - All basic help or advice questions must be posted here.,https://www.reddit.com/r/investing/comments/kewafv/daily_advice_thread_all_basic_help_or_advice/,2020-12-25 20:51,112,6,0.67
2qhhq,investing,kewgw6,2020-12-17 12:21,Why do bond funds go down?,https://www.reddit.com/r/investing/comments/kewgw6/why_do_bond_funds_go_down/,2020-12-25 20:51,41,8,0.75
2qhhq,investing,key37w,2020-12-17 14:08,SEC charges Robinhood $65m,https://www.reddit.com/r/investing/comments/key37w/sec_charges_robinhood_65m/,2020-12-25 20:51,340,1460,0.97
2qhhq,investing,keyo2s,2020-12-17 14:43,Conflicted on Palantir. Anyone holding long term?,https://www.reddit.com/r/investing/comments/keyo2s/conflicted_on_palantir_anyone_holding_long_term/,2020-12-25 20:51,75,22,0.7
2qhhq,investing,kezm7j,2020-12-17 15:36,Impending bubble? Why not always set a stop loss at your buy in price?,https://www.reddit.com/r/investing/comments/kezm7j/impending_bubble_why_not_always_set_a_stop_loss/,2020-12-25 20:51,33,26,0.8
2qhhq,investing,kf0ptv,2020-12-17 16:33,"I don't want to ask the crypto subs because I wan unbiased answers. For those of you holding BTC and other cryptos as investments, what are you doing with them right now??",https://www.reddit.com/r/investing/comments/kf0ptv/i_dont_want_to_ask_the_crypto_subs_because_i_wan/,2020-12-25 20:51,186,42,0.81
2qhhq,investing,kf2221,2020-12-17 17:39,Is Bitcoin a tulip?,https://www.reddit.com/r/investing/comments/kf2221/is_bitcoin_a_tulip/,2020-12-25 20:51,225,6,0.54
2qhhq,investing,kf329r,2020-12-17 18:28,"Came across Jim Cramer's YT videos, ""Mad Money"", recently. Holy Crap! Young investors, hope you aren't drawing inspiration from his videos.",https://www.reddit.com/r/investing/comments/kf329r/came_across_jim_cramers_yt_videos_mad_money/,2020-12-25 20:51,38,0,0.41
2qhhq,investing,kf409t,2020-12-17 19:14,Crypto exchange Coinbase is officially going public,https://www.reddit.com/r/investing/comments/kf409t/crypto_exchange_coinbase_is_officially_going/,2020-12-25 20:51,269,844,0.96
2qhhq,investing,kf6ufv,2020-12-17 21:35,Why is Tesla worth so much? / Confused european,https://www.reddit.com/r/investing/comments/kf6ufv/why_is_tesla_worth_so_much_confused_european/,2020-12-25 20:51,125,18,0.68
2qhhq,investing,kf6vsb,2020-12-17 21:37,what do you think of PLTR - Palantir. It's a bubble or not?,https://www.reddit.com/r/investing/comments/kf6vsb/what_do_you_think_of_pltr_palantir_its_a_bubble/,2020-12-25 20:51,20,0,0.48
2qhhq,investing,kf7i8y,2020-12-17 22:09,"Is it possible that Tesla could achieve wild success as a company, its stock price still go down?",https://www.reddit.com/r/investing/comments/kf7i8y/is_it_possible_that_tesla_could_achieve_wild/,2020-12-25 20:51,26,8,0.7
2qhhq,investing,kfahqd,2020-12-18 00:51,Opinions on $WISH ?,https://www.reddit.com/r/investing/comments/kfahqd/opinions_on_wish/,2020-12-25 20:51,24,5,0.61
2qhhq,investing,kfc5ts,2020-12-18 02:31,"This stock market is getting frothy, Never apologize for taking profits",https://www.reddit.com/r/investing/comments/kfc5ts/this_stock_market_is_getting_frothy_never/,2020-12-25 20:51,323,471,0.82
2qhhq,investing,kfdslp,2020-12-18 04:10,Big oil and clean energy,https://www.reddit.com/r/investing/comments/kfdslp/big_oil_and_clean_energy/,2020-12-25 20:51,34,13,0.85
2qhhq,investing,kfem5l,2020-12-18 05:01,"Assuming 2021 will be a very bullish year, what is a very aggressive way to play it (without spending >5 hours weekly)?",https://www.reddit.com/r/investing/comments/kfem5l/assuming_2021_will_be_a_very_bullish_year_what_is/,2020-12-25 20:51,24,0,0.42
2qhhq,investing,kffduv,2020-12-18 05:54,Cyber security companies will benefit from Biden presidency,https://www.reddit.com/r/investing/comments/kffduv/cyber_security_companies_will_benefit_from_biden/,2020-12-25 20:51,61,54,0.83
2qhhq,investing,kffz8a,2020-12-18 06:38,Beware: Motley Fool Stock Advisor seems to be a pump scheme,https://www.reddit.com/r/investing/comments/kffz8a/beware_motley_fool_stock_advisor_seems_to_be_a/,2020-12-25 20:51,662,2197,0.9
2qhhq,investing,kfgln5,2020-12-18 07:28,CD Projekt S.A. (OTGLY),https://www.reddit.com/r/investing/comments/kfgln5/cd_projekt_sa_otgly/,2020-12-25 20:51,25,14,0.82
2qhhq,investing,kfhz45,2020-12-18 09:25,Which stock are you now stuck with hoping for a recover?,https://www.reddit.com/r/investing/comments/kfhz45/which_stock_are_you_now_stuck_with_hoping_for_a/,2020-12-25 20:51,49,0,0.47
2qhhq,investing,kfienp,2020-12-18 10:00,"Is it possible to participate in IPOs of US companies without having $500k+ assets? If yes, which brokerage firms are recommended?",https://www.reddit.com/r/investing/comments/kfienp/is_it_possible_to_participate_in_ipos_of_us/,2020-12-25 20:51,30,42,0.84
2qhhq,investing,kfjmce,2020-12-18 11:42,What are some good names in cyber security?,https://www.reddit.com/r/investing/comments/kfjmce/what_are_some_good_names_in_cyber_security/,2020-12-25 20:51,23,8,0.75
2qhhq,investing,kfjzer,2020-12-18 12:10,Daily Advice Thread - All basic help or advice questions must be posted here.,https://www.reddit.com/r/investing/comments/kfjzer/daily_advice_thread_all_basic_help_or_advice/,2020-12-25 20:51,170,11,0.87
2qhhq,investing,kfkmx8,2020-12-18 12:56,What ETFs aren’t overvalued right now?,https://www.reddit.com/r/investing/comments/kfkmx8/what_etfs_arent_overvalued_right_now/,2020-12-25 20:51,68,12,0.67
2qhhq,investing,kfltn1,2020-12-18 14:12,Citadel Trading Chief Says Tesla Is Risk to Other S&P 500 Stocks,https://www.reddit.com/r/investing/comments/kfltn1/citadel_trading_chief_says_tesla_is_risk_to_other/,2020-12-25 20:51,63,91,0.93
2qhhq,investing,kfnpr7,2020-12-18 15:57,$TSLA - Who is buying Tesla at these prices ?,https://www.reddit.com/r/investing/comments/kfnpr7/tsla_who_is_buying_tesla_at_these_prices/,2020-12-25 20:51,68,20,0.72
2qhhq,investing,kfoaex,2020-12-18 16:27,What sort of sectors are on your radar for the coming decade?,https://www.reddit.com/r/investing/comments/kfoaex/what_sort_of_sectors_are_on_your_radar_for_the/,2020-12-25 20:51,132,33,0.81
2qhhq,investing,kfpc62,2020-12-18 17:20,FAATMAN is collectively up $3.1 trillion in market cap. this year.,https://www.reddit.com/r/investing/comments/kfpc62/faatman_is_collectively_up_31_trillion_in_market/,2020-12-25 20:51,73,197,0.93
2qhhq,investing,kfr5b5,2020-12-18 18:52,How does compound interest work in relation to stock prices?,https://www.reddit.com/r/investing/comments/kfr5b5/how_does_compound_interest_work_in_relation_to/,2020-12-25 20:51,52,6,0.72
2qhhq,investing,kfuc0v,2020-12-18 21:42,5 IPOs to watch for in 2021,https://www.reddit.com/r/investing/comments/kfuc0v/5_ipos_to_watch_for_in_2021/,2020-12-25 20:51,222,544,0.96
2qhhq,investing,kfufwc,2020-12-18 21:47,"Cathie Wood sees control fight ENDING, lifting cloud over Ark",https://www.reddit.com/r/investing/comments/kfufwc/cathie_wood_sees_control_fight_ending_lifting/,2020-12-25 20:51,241,842,0.95
2qhhq,investing,kfuyg0,2020-12-18 22:14,Fed allows banks to resume share buybacks,https://www.reddit.com/r/investing/comments/kfuyg0/fed_allows_banks_to_resume_share_buybacks/,2020-12-25 20:51,232,710,0.96
2qhhq,investing,kfvcqb,2020-12-18 22:34,Help -- Does The Series 65 Exam automatically make you an accredited investor?,https://www.reddit.com/r/investing/comments/kfvcqb/help_does_the_series_65_exam_automatically_make/,2020-12-25 20:51,24,6,0.65
2qhhq,investing,kfxmbz,2020-12-19 00:41,Why the hate for China?,https://www.reddit.com/r/investing/comments/kfxmbz/why_the_hate_for_china/,2020-12-25 20:51,23,0,0.39
2qhhq,investing,kfxwr7,2020-12-19 00:58,BFT: Juicy looking Acquisition,https://www.reddit.com/r/investing/comments/kfxwr7/bft_juicy_looking_acquisition/,2020-12-25 20:51,23,24,0.77
2qhhq,investing,kfy4vo,2020-12-19 01:11,Tesla Shares Hit Record After Last-Minute Surge Ahead of S&P 500 Debut,https://www.reddit.com/r/investing/comments/kfy4vo/tesla_shares_hit_record_after_lastminute_surge/,2020-12-25 20:51,285,736,0.97
2qhhq,investing,kfy9bo,2020-12-19 01:18,Cd Projekt Red stock facing a massive drop after CP2077. A good time to buy?,https://www.reddit.com/r/investing/comments/kfy9bo/cd_projekt_red_stock_facing_a_massive_drop_after/,2020-12-25 20:51,112,54,0.85
2qhhq,investing,kfyney,2020-12-19 01:42,Why are EVs so highly valued?,https://www.reddit.com/r/investing/comments/kfyney/why_are_evs_so_highly_valued/,2020-12-25 20:51,21,3,0.59
2qhhq,investing,kfynn7,2020-12-19 01:43,When do successful investors begin to withdraw their profits from the stock market?,https://www.reddit.com/r/investing/comments/kfynn7/when_do_successful_investors_begin_to_withdraw/,2020-12-25 20:51,42,30,0.81
2qhhq,investing,kfyqzn,2020-12-19 01:48,My dad actually subscribed to Motley Fool ~2 years ago. And has a 62% return so far.,https://www.reddit.com/r/investing/comments/kfyqzn/my_dad_actually_subscribed_to_motley_fool_2_years/,2020-12-25 20:51,39,6,0.56
2qhhq,investing,kg0gic,2020-12-19 03:39,What are your Japanese value stock picks?,https://www.reddit.com/r/investing/comments/kg0gic/what_are_your_japanese_value_stock_picks/,2020-12-25 20:51,25,23,0.79
2qhhq,investing,kg6oco,2020-12-19 12:08,Daily Advice Thread - All basic help or advice questions must be posted here.,https://www.reddit.com/r/investing/comments/kg6oco/daily_advice_thread_all_basic_help_or_advice/,2020-12-25 20:51,77,9,0.72
2qhhq,investing,kg89w8,2020-12-19 14:08,"With how much the world has changed the past 30 years, is it possible traditional investing philosophies have evolved into “not the best strategy?”",https://www.reddit.com/r/investing/comments/kg89w8/with_how_much_the_world_has_changed_the_past_30/,2020-12-25 20:51,598,1276,0.93
2qhhq,investing,kg8il0,2020-12-19 14:22,Thoughts on Day Trading?,https://www.reddit.com/r/investing/comments/kg8il0/thoughts_on_day_trading/,2020-12-25 20:51,23,0,0.36
2qhhq,investing,kgc2re,2020-12-19 17:32,100 Years of IPO Data,https://www.reddit.com/r/investing/comments/kgc2re/100_years_of_ipo_data/,2020-12-25 20:51,44,224,0.96
2qhhq,investing,kge1i5,2020-12-19 19:08,ethical investing?,https://www.reddit.com/r/investing/comments/kge1i5/ethical_investing/,2020-12-25 20:51,40,21,0.73
2qhhq,investing,kgenlg,2020-12-19 19:39,"Does anyone own SpaceX stock, or know someone who does? I’d be interested to know how they did it.",https://www.reddit.com/r/investing/comments/kgenlg/does_anyone_own_spacex_stock_or_know_someone_who/,2020-12-25 20:51,30,0,0.31
2qhhq,investing,kgfm3j,2020-12-19 20:28,Which stocks are you glad you didn’t buy because they proceeded to tank?,https://www.reddit.com/r/investing/comments/kgfm3j/which_stocks_are_you_glad_you_didnt_buy_because/,2020-12-25 20:51,143,96,0.87
2qhhq,investing,kggmmd,2020-12-19 21:24,ARK funds track record,https://www.reddit.com/r/investing/comments/kggmmd/ark_funds_track_record/,2020-12-25 20:51,49,28,0.77
2qhhq,investing,kggxr1,2020-12-19 21:41,Can we have a difficult discussion about Tesla?,https://www.reddit.com/r/investing/comments/kggxr1/can_we_have_a_difficult_discussion_about_tesla/,2020-12-25 20:51,484,174,0.76
2qhhq,investing,kgklmx,2020-12-20 01:16,Investing in SPACEX,https://www.reddit.com/r/investing/comments/kgklmx/investing_in_spacex/,2020-12-25 20:51,67,13,0.65
2qhhq,investing,kgl965,2020-12-20 01:58,Is index investing out of control?,https://www.reddit.com/r/investing/comments/kgl965/is_index_investing_out_of_control/,2020-12-25 20:51,37,1,0.51
2qhhq,investing,kgo2sp,2020-12-20 05:05,"J. PowellL is now less helpful than yesterday as Lawmakers reach compromise over GOP proposal to rein in Fed’s powers, clearing path for a stimulus package deal.",https://www.reddit.com/r/investing/comments/kgo2sp/j_powelll_is_now_less_helpful_than_yesterday_as/,2020-12-25 20:51,157,704,0.95
2qhhq,investing,kgpmfs,2020-12-20 07:03,"""Invest at all time high"" says JPMorgan in their new report",https://www.reddit.com/r/investing/comments/kgpmfs/invest_at_all_time_high_says_jpmorgan_in_their/,2020-12-25 20:51,187,671,0.95
2qhhq,investing,kgq7vx,2020-12-20 07:54,Blacklisting of China's DJI in US threatens to scramble drone industry,https://www.reddit.com/r/investing/comments/kgq7vx/blacklisting_of_chinas_dji_in_us_threatens_to/,2020-12-25 20:51,25,11,0.73
2qhhq,investing,kgqv20,2020-12-20 08:52,What would have to happen for the market to stop growing?,https://www.reddit.com/r/investing/comments/kgqv20/what_would_have_to_happen_for_the_market_to_stop/,2020-12-25 20:51,71,42,0.88
2qhhq,investing,kgs73n,2020-12-20 10:56,Trading US options in EU,https://www.reddit.com/r/investing/comments/kgs73n/trading_us_options_in_eu/,2020-12-25 20:51,20,10,0.78
2qhhq,investing,kgsb8t,2020-12-20 11:05,Why is Pfizer stock down?,https://www.reddit.com/r/investing/comments/kgsb8t/why_is_pfizer_stock_down/,2020-12-25 20:51,22,0,0.36
2qhhq,investing,kgsddp,2020-12-20 11:11,Thoughts about Vanguard FTSE All-World UCITS ETF? (VWRL),https://www.reddit.com/r/investing/comments/kgsddp/thoughts_about_vanguard_ftse_allworld_ucits_etf/,2020-12-25 20:51,21,9,0.77
2qhhq,investing,kgst8m,2020-12-20 11:52,Black swans 2021,https://www.reddit.com/r/investing/comments/kgst8m/black_swans_2021/,2020-12-25 20:51,42,0,0.39
2qhhq,investing,kgt0vz,2020-12-20 12:10,Daily Advice Thread - All basic help or advice questions must be posted here.,https://www.reddit.com/r/investing/comments/kgt0vz/daily_advice_thread_all_basic_help_or_advice/,2020-12-25 20:51,89,6,0.67
2qhhq,investing,kgtby6,2020-12-20 12:37,Shopify,https://www.reddit.com/r/investing/comments/kgtby6/shopify/,2020-12-25 20:51,32,22,0.74
2qhhq,investing,kgvk7b,2020-12-20 15:10,How do we protect ourselves against the obvious bubble we’re in that will inevitably pop?,https://www.reddit.com/r/investing/comments/kgvk7b/how_do_we_protect_ourselves_against_the_obvious/,2020-12-25 20:51,338,142,0.74
2qhhq,investing,kgw827,2020-12-20 15:49,SolarWinds is going to crash further on Monday - 6th day in a row,https://www.reddit.com/r/investing/comments/kgw827/solarwinds_is_going_to_crash_further_on_monday/,2020-12-25 20:51,113,150,0.94
2qhhq,investing,kgwd8p,2020-12-20 15:57,The 2020 bear market was the shortest in modern history.,https://www.reddit.com/r/investing/comments/kgwd8p/the_2020_bear_market_was_the_shortest_in_modern/,2020-12-25 20:51,477,1376,0.97
2qhhq,investing,kgxjw8,2020-12-20 17:00,Opendoor (OPEN) will be listed on NASDAQ tomorrow (12/21),https://www.reddit.com/r/investing/comments/kgxjw8/opendoor_open_will_be_listed_on_nasdaq_tomorrow/,2020-12-25 20:51,21,27,0.79
2qhhq,investing,kgytas,2020-12-20 18:06,What are your rules for investing?,https://www.reddit.com/r/investing/comments/kgytas/what_are_your_rules_for_investing/,2020-12-25 20:51,33,0,0.5
2qhhq,investing,kh0y1e,2020-12-20 19:54,Why fraud is such a good business in the US,https://www.reddit.com/r/investing/comments/kh0y1e/why_fraud_is_such_a_good_business_in_the_us/,2020-12-25 20:51,46,219,0.89
2qhhq,investing,kh3qkc,2020-12-20 22:21,"The Last 5 Years Have Been Great, But....",https://www.reddit.com/r/investing/comments/kh3qkc/the_last_5_years_have_been_great_but/,2020-12-25 20:51,43,37,0.82
2qhhq,investing,kh4fza,2020-12-20 23:00,"Congress agrees to $900 billion coronavirus stimulus deal, McConnell says",https://www.reddit.com/r/investing/comments/kh4fza/congress_agrees_to_900_billion_coronavirus/,2020-12-25 20:51,405,1390,0.96
2qhhq,investing,kh55go,2020-12-20 23:40,Does anyone else create a shopping list and go shopping weekly for sales?,https://www.reddit.com/r/investing/comments/kh55go/does_anyone_else_create_a_shopping_list_and_go/,2020-12-25 20:51,33,17,0.68
2qhhq,investing,kh5c6m,2020-12-20 23:51,Which stocks for CRISPR?,https://www.reddit.com/r/investing/comments/kh5c6m/which_stocks_for_crispr/,2020-12-25 20:51,39,31,0.84
2qhhq,investing,khdlef,2020-12-21 08:55,melt up,https://www.reddit.com/r/investing/comments/khdlef/melt_up/,2020-12-25 20:51,51,19,0.77
2qhhq,investing,khg7sn,2020-12-21 12:10,Comparing YHOO AND TSLA,https://www.reddit.com/r/investing/comments/khg7sn/comparing_yhoo_and_tsla/,2020-12-25 20:51,65,16,0.69
2qhhq,investing,khg9zo,2020-12-21 12:15,Daily Advice Thread - All basic help or advice questions must be posted here.,https://www.reddit.com/r/investing/comments/khg9zo/daily_advice_thread_all_basic_help_or_advice/,2020-12-25 20:51,126,8,0.72
2qhhq,investing,khhk8c,2020-12-21 13:38,US futures slump as new Covid-19 variant spoils the stimulus party,https://www.reddit.com/r/investing/comments/khhk8c/us_futures_slump_as_new_covid19_variant_spoils/,2020-12-25 20:51,74,103,0.95
2qhhq,investing,khhusv,2020-12-21 13:55,buying CD Project Red Stocks,https://www.reddit.com/r/investing/comments/khhusv/buying_cd_project_red_stocks/,2020-12-25 20:51,30,0,0.42
2qhhq,investing,khi2jl,2020-12-21 14:07,Shopify Analysis (NYSE: SHOP),https://www.reddit.com/r/investing/comments/khi2jl/shopify_analysis_nyse_shop/,2020-12-25 20:51,22,25,0.76
