Subreddit_ID,Subreddit_Name,Submission_ID,Submission_CreatedDate,Submission_Title,Submission_URL,Submission_LastFetched,Submission_NumComments,Submission_Score,Submission_UpvoteRatio
2qhhq,investing,lgicp9,2021-02-10 01:06,Debate between Husband and Wife on Investment strategy and philosophy.,https://www.reddit.com/r/investing/comments/lgicp9/debate_between_husband_and_wife_on_investment/,2021-04-06 16:01,41,0,0.5
2qhhq,investing,lgidy7,2021-02-10 01:08,Bumble set for IPO at $38-$40; projected to start trading Thursday,https://www.reddit.com/r/investing/comments/lgidy7/bumble_set_for_ipo_at_3840_projected_to_start/,2021-04-06 16:01,106,44,0.73
2qhhq,investing,lgl1r4,2021-02-10 03:38,Selling Puts to Generate Yield in this Bubbly Market. Talk me out of it!,https://www.reddit.com/r/investing/comments/lgl1r4/selling_puts_to_generate_yield_in_this_bubbly/,2021-04-06 16:01,62,35,0.89
2qhhq,investing,lglskh,2021-02-10 04:22,Collection of Finviz screeners,https://www.reddit.com/r/investing/comments/lglskh/collection_of_finviz_screeners/,2021-04-06 16:01,219,2964,0.99
2qhhq,investing,lgme6f,2021-02-10 05:01,"Out of all the ""bubbles"" that are forming right now, which ones would you buy the most if it popped> (EV, marijuana, fintech, crypto, etc...)",https://www.reddit.com/r/investing/comments/lgme6f/out_of_all_the_bubbles_that_are_forming_right_now/,2021-04-06 16:01,401,206,0.91
2qhhq,investing,lgmr8x,2021-02-10 05:23,Corsair Gaming Reports Fourth Quarter and Full Year 2020 Financial Results,https://www.reddit.com/r/investing/comments/lgmr8x/corsair_gaming_reports_fourth_quarter_and_full/,2021-04-06 16:01,26,60,0.89
2qhhq,investing,lgqjga,2021-02-10 10:00,Why I believe $OPRA is overseen by investors,https://www.reddit.com/r/investing/comments/lgqjga/why_i_believe_opra_is_overseen_by_investors/,2021-04-06 16:01,32,21,0.67
2qhhq,investing,lgu4bx,2021-02-10 13:56,"Nasdaq, NYSE Sue SEC over planned overhaul of public data feeds",https://www.reddit.com/r/investing/comments/lgu4bx/nasdaq_nyse_sue_sec_over_planned_overhaul_of/,2021-04-06 16:01,326,4189,0.99
2qhhq,investing,lgv4u5,2021-02-10 14:47,AMZN emerging businesses potential vs retail/AWS,https://www.reddit.com/r/investing/comments/lgv4u5/amzn_emerging_businesses_potential_vs_retailaws/,2021-04-06 16:01,27,27,0.88
2qhhq,investing,lgwl98,2021-02-10 15:54,DD research advice for newcomers,https://www.reddit.com/r/investing/comments/lgwl98/dd_research_advice_for_newcomers/,2021-04-06 16:01,36,110,0.95
2qhhq,investing,lgy36z,2021-02-10 17:01,How Do You Prepare to Buy a Dip,https://www.reddit.com/r/investing/comments/lgy36z/how_do_you_prepare_to_buy_a_dip/,2021-04-06 16:01,82,46,0.88
2qhhq,investing,lgysbz,2021-02-10 17:30,Random Facts for the Automated VTI Investor (including the best day of week to invest),https://www.reddit.com/r/investing/comments/lgysbz/random_facts_for_the_automated_vti_investor/,2021-04-06 16:01,27,88,0.94
2qhhq,investing,lh1xy6,2021-02-10 19:45,Don't File Your Taxes Early Under Some Circumstances,https://www.reddit.com/r/investing/comments/lh1xy6/dont_file_your_taxes_early_under_some/,2021-04-06 16:01,27,79,0.91
2qhhq,investing,lh294i,2021-02-10 19:57,"Fed Chairman Powell: ""Real"" unemployment rate is at 10%, rates will remain low",https://www.reddit.com/r/investing/comments/lh294i/fed_chairman_powell_real_unemployment_rate_is_at/,2021-04-06 16:01,77,176,0.96
2qhhq,investing,lh2by7,2021-02-10 20:00,I am no longer picking stocks. It's ETFs for me.,https://www.reddit.com/r/investing/comments/lh2by7/i_am_no_longer_picking_stocks_its_etfs_for_me/,2021-04-06 16:01,1425,4740,0.96
2qhhq,investing,lh3n7m,2021-02-10 20:56,$TLRY and $APHA Merger Arbitrage,https://www.reddit.com/r/investing/comments/lh3n7m/tlry_and_apha_merger_arbitrage/,2021-04-06 16:01,241,232,0.92
2qhhq,investing,lh4322,2021-02-10 21:14,Robinhood is screwing me over,https://www.reddit.com/r/investing/comments/lh4322/robinhood_is_screwing_me_over/,2021-04-06 16:01,24,33,0.8
2qhhq,investing,lh4k7m,2021-02-10 21:35,"Shaq, Lebron James, & former TikTok CEOs SPAC announce $3B merger with Beachbody",https://www.reddit.com/r/investing/comments/lh4k7m/shaq_lebron_james_former_tiktok_ceos_spac/,2021-04-06 16:01,73,76,0.83
2qhhq,investing,lh57q2,2021-02-10 22:03,"Discussion on ""averaging down"" being a myth",https://www.reddit.com/r/investing/comments/lh57q2/discussion_on_averaging_down_being_a_myth/,2021-04-06 16:01,80,0,0.47
2qhhq,investing,lh60za,2021-02-10 22:40,Mastercard to open up network to select cryptocurrencies,https://www.reddit.com/r/investing/comments/lh60za/mastercard_to_open_up_network_to_select/,2021-04-06 16:01,100,96,0.94
2qhhq,investing,lh7rol,2021-02-11 00:00,Seeking insight regarding Merger Arbitrage,https://www.reddit.com/r/investing/comments/lh7rol/seeking_insight_regarding_merger_arbitrage/,2021-04-06 16:01,28,7,0.82
2qhhq,investing,lh7vqw,2021-02-11 00:06,Retired but still would like to grow my portfolio,https://www.reddit.com/r/investing/comments/lh7vqw/retired_but_still_would_like_to_grow_my_portfolio/,2021-04-06 16:01,25,16,0.85
2qhhq,investing,lh8khl,2021-02-11 00:40,Rebalancing advice for long term holds,https://www.reddit.com/r/investing/comments/lh8khl/rebalancing_advice_for_long_term_holds/,2021-04-06 16:01,21,10,0.79
2qhhq,investing,lh9vp2,2021-02-11 01:47,A Look at the FDA Approval Process and How it Affects Your Investments,https://www.reddit.com/r/investing/comments/lh9vp2/a_look_at_the_fda_approval_process_and_how_it/,2021-04-06 16:01,85,218,0.96
2qhhq,investing,lh9xgy,2021-02-11 01:49,Oil companies and EV charging infrastructure,https://www.reddit.com/r/investing/comments/lh9xgy/oil_companies_and_ev_charging_infrastructure/,2021-04-06 16:01,51,60,0.88
2qhhq,investing,lhb37y,2021-02-11 02:48,American Battery Metals: The long game,https://www.reddit.com/r/investing/comments/lhb37y/american_battery_metals_the_long_game/,2021-04-06 16:01,26,26,0.87
2qhhq,investing,lhdjf1,2021-02-11 05:09,A rough Analysis on Toyota Motors,https://www.reddit.com/r/investing/comments/lhdjf1/a_rough_analysis_on_toyota_motors/,2021-04-06 16:01,183,119,0.87
2qhhq,investing,lhdkm0,2021-02-11 05:11,"""When a stock really pops I take my original investment out and just let the rest ride"" - The House Money Effect is the most prevalent fallacy in investing today",https://www.reddit.com/r/investing/comments/lhdkm0/when_a_stock_really_pops_i_take_my_original/,2021-04-06 16:01,45,55,0.85
2qhhq,investing,lhekgj,2021-02-11 06:18,Are we in times of placeholders companies,https://www.reddit.com/r/investing/comments/lhekgj/are_we_in_times_of_placeholders_companies/,2021-04-06 16:01,24,15,0.74
2qhhq,investing,lhgki8,2021-02-11 08:47,Critique my Portfolio Please,https://www.reddit.com/r/investing/comments/lhgki8/critique_my_portfolio_please/,2021-04-06 16:01,23,22,0.85
2qhhq,investing,lhkjqr,2021-02-11 13:22,"""The worst stocks are doing the best""",https://www.reddit.com/r/investing/comments/lhkjqr/the_worst_stocks_are_doing_the_best/,2021-04-06 16:01,664,1120,0.95
2qhhq,investing,lhkn3b,2021-02-11 13:28,If you missed the electric vehicle train...,https://www.reddit.com/r/investing/comments/lhkn3b/if_you_missed_the_electric_vehicle_train/,2021-04-06 16:01,22,4,0.54
2qhhq,investing,lhmlq9,2021-02-11 15:08,"BNY Mellon to offer bitcoin services, a validation of crypto from a key bank in the financial system",https://www.reddit.com/r/investing/comments/lhmlq9/bny_mellon_to_offer_bitcoin_services_a_validation/,2021-04-06 16:01,173,166,0.92
2qhhq,investing,lhmnd5,2021-02-11 15:10,Tesla long term prospects,https://www.reddit.com/r/investing/comments/lhmnd5/tesla_long_term_prospects/,2021-04-06 16:01,27,0,0.44
2qhhq,investing,lhnkdv,2021-02-11 15:53,New advice on call options for profit,https://www.reddit.com/r/investing/comments/lhnkdv/new_advice_on_call_options_for_profit/,2021-04-06 16:01,36,16,0.69
2qhhq,investing,lhru27,2021-02-11 19:01,Potential American firms that can produce semiconductor chips desperately needed to produce EV's,https://www.reddit.com/r/investing/comments/lhru27/potential_american_firms_that_can_produce/,2021-04-06 16:01,65,51,0.86
2qhhq,investing,lhs6o9,2021-02-11 19:16,The intrinsic value of gold,https://www.reddit.com/r/investing/comments/lhs6o9/the_intrinsic_value_of_gold/,2021-04-06 16:01,74,17,0.8
2qhhq,investing,lhtodm,2021-02-11 20:19,"Historically it's way better to invest at market close than at market open, most gains occur overnight",https://www.reddit.com/r/investing/comments/lhtodm/historically_its_way_better_to_invest_at_market/,2021-04-06 16:01,716,9148,0.98
2qhhq,investing,lhuxzu,2021-02-11 21:13,"Playboy is going public, and CEO says potential ‘is endless’",https://www.reddit.com/r/investing/comments/lhuxzu/playboy_is_going_public_and_ceo_says_potential_is/,2021-04-06 16:01,80,70,0.86
2qhhq,investing,lhw2jd,2021-02-11 22:03,Investing Amidst Inflation/Hyperinflation,https://www.reddit.com/r/investing/comments/lhw2jd/investing_amidst_inflationhyperinflation/,2021-04-06 16:01,46,8,0.67
2qhhq,investing,lhwg4r,2021-02-11 22:20,Surge by Disney+ to nearly 95 million subscriptions leads to surprise profit,https://www.reddit.com/r/investing/comments/lhwg4r/surge_by_disney_to_nearly_95_million/,2021-04-06 16:01,178,245,0.96
2qhhq,investing,lhxf4e,2021-02-11 23:04,"NAT DD, Why I'm Invested long term",https://www.reddit.com/r/investing/comments/lhxf4e/nat_dd_why_im_invested_long_term/,2021-04-06 16:01,56,42,0.86
2qhhq,investing,lhxqip,2021-02-11 23:19,Why i’m uncertain about Bitcoin,https://www.reddit.com/r/investing/comments/lhxqip/why_im_uncertain_about_bitcoin/,2021-04-06 16:01,148,10,0.59
2qhhq,investing,lhzl35,2021-02-12 00:49,First North American Publicly traded Bitcoin ETF Approved by Canadian Securities Regulator,https://www.reddit.com/r/investing/comments/lhzl35/first_north_american_publicly_traded_bitcoin_etf/,2021-04-06 16:01,63,75,0.89
2qhhq,investing,li1ltv,2021-02-12 02:34,Huge volume and Price increase. No news.,https://www.reddit.com/r/investing/comments/li1ltv/huge_volume_and_price_increase_no_news/,2021-04-06 16:01,30,8,0.75
2qhhq,investing,li23oe,2021-02-12 03:02,Still Bullish on BP short term and here's why:,https://www.reddit.com/r/investing/comments/li23oe/still_bullish_on_bp_short_term_and_heres_why/,2021-04-06 16:01,25,23,0.78
2qhhq,investing,li2hfz,2021-02-12 03:23,APXT - The Dark Horse SPAC,https://www.reddit.com/r/investing/comments/li2hfz/apxt_the_dark_horse_spac/,2021-04-06 16:01,41,85,0.9
2qhhq,investing,li4uaz,2021-02-12 05:48,Castor Maritime ($CTRM) to buy two LR2 tankers for $27MM. Market Cap jumps $250MM.,https://www.reddit.com/r/investing/comments/li4uaz/castor_maritime_ctrm_to_buy_two_lr2_tankers_for/,2021-04-06 16:01,77,221,0.94
2qhhq,investing,li6vyf,2021-02-12 08:23,Forgotten lessons of 2008 that are even more relevant today,https://www.reddit.com/r/investing/comments/li6vyf/forgotten_lessons_of_2008_that_are_even_more/,2021-04-06 16:01,724,2294,0.96
2qhhq,investing,liaaaq,2021-02-12 12:42,ASYS for the semiconductor shortage.,https://www.reddit.com/r/investing/comments/liaaaq/asys_for_the_semiconductor_shortage/,2021-04-06 16:01,30,50,0.9
2qhhq,investing,liauyb,2021-02-12 13:18,Good sources for bubble discussions,https://www.reddit.com/r/investing/comments/liauyb/good_sources_for_bubble_discussions/,2021-04-06 16:01,88,60,0.9
2qhhq,investing,lieh0u,2021-02-12 16:24,TODAY is the DAY! Today we will find out if Warren Bought Tesla during Q3 & Q4,https://www.reddit.com/r/investing/comments/lieh0u/today_is_the_day_today_we_will_find_out_if_warren/,2021-04-06 16:01,160,27,0.57
2qhhq,investing,lielfh,2021-02-12 16:29,($ACIC) Archer Aviation lands $1B order from United Airlines and a SPAC deal.,https://www.reddit.com/r/investing/comments/lielfh/acic_archer_aviation_lands_1b_order_from_united/,2021-04-06 16:01,21,4,0.64
2qhhq,investing,ligun1,2021-02-12 18:08,The incentive to short TSLA is just massive at this point,https://www.reddit.com/r/investing/comments/ligun1/the_incentive_to_short_tsla_is_just_massive_at/,2021-04-06 16:01,127,30,0.72
2qhhq,investing,lih0yd,2021-02-12 18:16,"Theta decay, options and value step-downs day over day.",https://www.reddit.com/r/investing/comments/lih0yd/theta_decay_options_and_value_stepdowns_day_over/,2021-04-06 16:01,37,12,0.77
2qhhq,investing,lih6ee,2021-02-12 18:23,Full Diligence Post on Palantir (PLTR) - Earnings Next Monday (2/16) & Lockup Expiration (2/19),https://www.reddit.com/r/investing/comments/lih6ee/full_diligence_post_on_palantir_pltr_earnings/,2021-04-06 16:01,508,3270,0.98
2qhhq,investing,lihv5p,2021-02-12 18:53,$ITRM and pharma investing,https://www.reddit.com/r/investing/comments/lihv5p/itrm_and_pharma_investing/,2021-04-06 16:01,31,52,0.91
2qhhq,investing,liilvv,2021-02-12 19:25,Preparing to fight a bear (market) someday,https://www.reddit.com/r/investing/comments/liilvv/preparing_to_fight_a_bear_market_someday/,2021-04-06 16:01,85,62,0.85
2qhhq,investing,liizuh,2021-02-12 19:43,I don't understand the point of futures markets for imperishable goods. Please enlighten me.,https://www.reddit.com/r/investing/comments/liizuh/i_dont_understand_the_point_of_futures_markets/,2021-04-06 16:01,20,25,0.81
2qhhq,investing,lijnmn,2021-02-12 20:14,BUMBLE (BMBL) - I WISH I COULD BUY 100 SHARES,https://www.reddit.com/r/investing/comments/lijnmn/bumble_bmbl_i_wish_i_could_buy_100_shares/,2021-04-06 16:01,118,0,0.42
2qhhq,investing,ling8b,2021-02-12 23:14,"Why Cathie Wood might be right, and why TSLA is actually STILL fairly or even undervalued at these levels.",https://www.reddit.com/r/investing/comments/ling8b/why_cathie_wood_might_be_right_and_why_tsla_is/,2021-04-06 16:01,491,308,0.71
2qhhq,investing,lioulz,2021-02-13 00:24,ARK vs Berkshire Hathaway,https://www.reddit.com/r/investing/comments/lioulz/ark_vs_berkshire_hathaway/,2021-04-06 16:01,43,6,0.56
2qhhq,investing,lirj93,2021-02-13 02:50,Small town Kentucky gets a big business,https://www.reddit.com/r/investing/comments/lirj93/small_town_kentucky_gets_a_big_business/,2021-04-06 16:01,24,53,0.87
2qhhq,investing,lirn5w,2021-02-13 02:57,Novavax will fall as quickly as it rose,https://www.reddit.com/r/investing/comments/lirn5w/novavax_will_fall_as_quickly_as_it_rose/,2021-04-06 16:01,36,36,0.78
2qhhq,investing,lisd7l,2021-02-13 03:41,Plays For The Possible Approach of a New Commodity Supercycle,https://www.reddit.com/r/investing/comments/lisd7l/plays_for_the_possible_approach_of_a_new/,2021-04-06 16:01,75,40,0.89
2qhhq,investing,liuccj,2021-02-13 05:42,The next high growth blue chip stock: Paypal,https://www.reddit.com/r/investing/comments/liuccj/the_next_high_growth_blue_chip_stock_paypal/,2021-04-06 16:01,123,120,0.77
2qhhq,investing,liwt82,2021-02-13 08:39,The next growing market is AAV (autonomous aerial vehicle),https://www.reddit.com/r/investing/comments/liwt82/the_next_growing_market_is_aav_autonomous_aerial/,2021-04-06 16:01,37,7,0.58
2qhhq,investing,lix6f8,2021-02-13 09:09,"UiPath goes public soon, let's talk",https://www.reddit.com/r/investing/comments/lix6f8/uipath_goes_public_soon_lets_talk/,2021-04-06 16:01,44,39,0.85
2qhhq,investing,lixso8,2021-02-13 10:00,Daily Advice Thread - All basic help or advice questions must be posted here.,https://www.reddit.com/r/investing/comments/lixso8/daily_advice_thread_all_basic_help_or_advice/,2021-04-06 16:01,480,24,0.87
2qhhq,investing,lj02x8,2021-02-13 12:56,Best high risk / high potential ETFs 2021,https://www.reddit.com/r/investing/comments/lj02x8/best_high_risk_high_potential_etfs_2021/,2021-04-06 16:01,219,129,0.89
2qhhq,investing,lj0e4u,2021-02-13 13:17,The real economics of investing,https://www.reddit.com/r/investing/comments/lj0e4u/the_real_economics_of_investing/,2021-04-06 16:01,25,0,0.35
2qhhq,investing,lj0qo6,2021-02-13 13:41,I'm thinking about getting some $HEXO shares,https://www.reddit.com/r/investing/comments/lj0qo6/im_thinking_about_getting_some_hexo_shares/,2021-04-06 16:01,48,51,0.92
2qhhq,investing,lj3l0m,2021-02-13 16:23,"Broad market update on tech stocks, semiconductors, and metals",https://www.reddit.com/r/investing/comments/lj3l0m/broad_market_update_on_tech_stocks_semiconductors/,2021-04-06 16:01,20,0,0.47
2qhhq,investing,lj3uqn,2021-02-13 16:37,"DD: Beware of RIOT, only hearing bad things.",https://www.reddit.com/r/investing/comments/lj3uqn/dd_beware_of_riot_only_hearing_bad_things/,2021-04-06 16:01,160,126,0.9
2qhhq,investing,lj4312,2021-02-13 16:49,Some valuations are absurd - I am going 10% short,https://www.reddit.com/r/investing/comments/lj4312/some_valuations_are_absurd_i_am_going_10_short/,2021-04-06 16:01,300,162,0.85
2qhhq,investing,lj43oi,2021-02-13 16:50,Where to look in the event of a market crash/bubble.,https://www.reddit.com/r/investing/comments/lj43oi/where_to_look_in_the_event_of_a_market_crashbubble/,2021-04-06 16:01,104,31,0.78
2qhhq,investing,lj4w42,2021-02-13 17:29,Michael Burry appears to shift focus to clean energy via Nuclear Energy.,https://www.reddit.com/r/investing/comments/lj4w42/michael_burry_appears_to_shift_focus_to_clean/,2021-04-06 16:01,1180,3709,0.97
2qhhq,investing,lj6kqw,2021-02-13 18:53,Akamai Technologies Bullish Thesis,https://www.reddit.com/r/investing/comments/lj6kqw/akamai_technologies_bullish_thesis/,2021-04-06 16:01,22,23,0.78
2qhhq,investing,lj8jek,2021-02-13 20:30,Using leveraged ETF's for a less volatile higher return portfolio,https://www.reddit.com/r/investing/comments/lj8jek/using_leveraged_etfs_for_a_less_volatile_higher/,2021-04-06 16:01,45,31,0.83
2qhhq,investing,lj8lc7,2021-02-13 20:32,Semiconductor shortage for automakers GM + VW + others,https://www.reddit.com/r/investing/comments/lj8lc7/semiconductor_shortage_for_automakers_gm_vw_others/,2021-04-06 16:01,78,34,0.82
2qhhq,investing,lj9454,2021-02-13 20:58,Future of retail investing w/ETFs & Index Funds,https://www.reddit.com/r/investing/comments/lj9454/future_of_retail_investing_wetfs_index_funds/,2021-04-06 16:01,82,48,0.86
2qhhq,investing,ljbhnr,2021-02-13 22:57,Long term industry recommendation algorithm results from past year,https://www.reddit.com/r/investing/comments/ljbhnr/long_term_industry_recommendation_algorithm/,2021-04-06 16:01,20,35,0.83
2qhhq,investing,ljclbp,2021-02-13 23:56,"Found some articles dated back to the dot-com bust, and they are eerily similar",https://www.reddit.com/r/investing/comments/ljclbp/found_some_articles_dated_back_to_the_dotcom_bust/,2021-04-06 16:01,376,170,0.85
2qhhq,investing,ljcscp,2021-02-14 00:06,"FED Stress test, BofA calls market top, says major correction is incoming",https://www.reddit.com/r/investing/comments/ljcscp/fed_stress_test_bofa_calls_market_top_says_major/,2021-04-06 16:01,201,47,0.75
2qhhq,investing,ljlr27,2021-02-14 10:00,Daily Advice Thread - All basic help or advice questions must be posted here.,https://www.reddit.com/r/investing/comments/ljlr27/daily_advice_thread_all_basic_help_or_advice/,2021-04-06 16:01,352,39,0.87
2qhhq,investing,ljo7cp,2021-02-14 13:16,GameStop Big Picture: Final Thoughts,https://www.reddit.com/r/investing/comments/ljo7cp/gamestop_big_picture_final_thoughts/,2021-04-06 16:01,53,120,0.91
2qhhq,investing,ljpowg,2021-02-14 14:50,Analysing Institutional Investor Transactions,https://www.reddit.com/r/investing/comments/ljpowg/analysing_institutional_investor_transactions/,2021-04-06 16:01,139,906,0.96
2qhhq,investing,ljto14,2021-02-14 18:08,Marine Shipping stocks are on a roll!,https://www.reddit.com/r/investing/comments/ljto14/marine_shipping_stocks_are_on_a_roll/,2021-04-06 16:01,139,99,0.87
2qhhq,investing,ljuncu,2021-02-14 18:55,Raytheon Technologies: Let's discuss,https://www.reddit.com/r/investing/comments/ljuncu/raytheon_technologies_lets_discuss/,2021-04-06 16:01,50,3,0.52
2qhhq,investing,ljuvx3,2021-02-14 19:06,BTCC ETF launch & possibilities,https://www.reddit.com/r/investing/comments/ljuvx3/btcc_etf_launch_possibilities/,2021-04-06 16:01,271,248,0.92
2qhhq,investing,ljw4l4,2021-02-14 20:05,Why aren't banks/investors afraid of offering mortgage rates that are near or below the rate of inflation?,https://www.reddit.com/r/investing/comments/ljw4l4/why_arent_banksinvestors_afraid_of_offering/,2021-04-06 16:01,68,34,0.87
2qhhq,investing,lk688l,2021-02-15 05:02,Is now the time to jump ship? 50% of NYSE/NASDAQ equities posted a TTM EPS <0,https://www.reddit.com/r/investing/comments/lk688l/is_now_the_time_to_jump_ship_50_of_nysenasdaq/,2021-04-06 16:01,943,1672,0.82
2qhhq,investing,lk6tki,2021-02-15 05:40,Weighting asset allocations based on future withdrawal tax rates,https://www.reddit.com/r/investing/comments/lk6tki/weighting_asset_allocations_based_on_future/,2021-04-06 16:01,22,13,0.71
2qhhq,investing,lkakug,2021-02-15 10:00,Daily Advice Thread - All basic help or advice questions must be posted here.,https://www.reddit.com/r/investing/comments/lkakug/daily_advice_thread_all_basic_help_or_advice/,2021-04-06 16:01,565,39,0.87
2qhhq,investing,lkaodv,2021-02-15 10:06,"Theory Crafted a New Portfolio Allocation, Thoughts Welcome!",https://www.reddit.com/r/investing/comments/lkaodv/theory_crafted_a_new_portfolio_allocation/,2021-04-06 16:01,25,0,0.46
2qhhq,investing,lkldt4,2021-02-15 19:45,Huge DD on Electric Last Mile Solutions. Only Class 1 EV in the US,https://www.reddit.com/r/investing/comments/lkldt4/huge_dd_on_electric_last_mile_solutions_only/,2021-04-06 16:01,47,22,0.58
2qhhq,investing,lkm91d,2021-02-15 20:24,Why You Should be Suspicious of ROE,https://www.reddit.com/r/investing/comments/lkm91d/why_you_should_be_suspicious_of_roe/,2021-04-06 16:01,102,1156,0.96
2qhhq,investing,lkne0z,2021-02-15 21:16,A more complete look at crashes/bubbles,https://www.reddit.com/r/investing/comments/lkne0z/a_more_complete_look_at_crashesbubbles/,2021-04-06 16:01,291,340,0.9
2qhhq,investing,lkosfu,2021-02-15 22:21,Canadian funds move forward with Bitcoin ETFs after regulatory jockeying- update,https://www.reddit.com/r/investing/comments/lkosfu/canadian_funds_move_forward_with_bitcoin_etfs/,2021-04-06 16:01,57,101,0.86
2qhhq,investing,lkq58h,2021-02-15 23:27,"Investing in ""Innovation""",https://www.reddit.com/r/investing/comments/lkq58h/investing_in_innovation/,2021-04-06 16:01,42,12,0.71
2qhhq,investing,lkq9ok,2021-02-15 23:33,Natural Gas Next Day Deliveries - $3/mmbtu to $600/mmbtu,https://www.reddit.com/r/investing/comments/lkq9ok/natural_gas_next_day_deliveries_3mmbtu_to_600mmbtu/,2021-04-06 16:01,53,108,0.94
2qhhq,investing,lktgg1,2021-02-16 02:22,SPCE DD - Test Flight Delay,https://www.reddit.com/r/investing/comments/lktgg1/spce_dd_test_flight_delay/,2021-04-06 16:01,64,79,0.84
2qhhq,investing,lku7ah,2021-02-16 03:02,"Hey all, here is some DD on $TXMD",https://www.reddit.com/r/investing/comments/lku7ah/hey_all_here_is_some_dd_on_txmd/,2021-04-06 16:01,24,94,0.96
2qhhq,investing,lkudmd,2021-02-16 03:11,"2x and 3x ETFs Nasdaq S and P 500, Real Estate Big Potential Gains",https://www.reddit.com/r/investing/comments/lkudmd/2x_and_3x_etfs_nasdaq_s_and_p_500_real_estate_big/,2021-04-06 16:01,43,14,0.71
2qhhq,investing,ll0qce,2021-02-16 10:00,Daily Advice Thread - All basic help or advice questions must be posted here.,https://www.reddit.com/r/investing/comments/ll0qce/daily_advice_thread_all_basic_help_or_advice/,2021-04-06 16:01,594,20,0.86
2qhhq,investing,ll3ltu,2021-02-16 13:18,ARK vs. Fidelity Disruptors,https://www.reddit.com/r/investing/comments/ll3ltu/ark_vs_fidelity_disruptors/,2021-04-06 16:01,141,198,0.93
2qhhq,investing,ll55tq,2021-02-16 14:40,Altria Stock (And other Tobacco Stocks) - Cheaper Way to Get Shared on Weed Stocks $CRON $MO,https://www.reddit.com/r/investing/comments/ll55tq/altria_stock_and_other_tobacco_stocks_cheaper_way/,2021-04-06 16:01,45,33,0.77
2qhhq,investing,ll5ng9,2021-02-16 15:04,Palantir stock drops after earnings.,https://www.reddit.com/r/investing/comments/ll5ng9/palantir_stock_drops_after_earnings/,2021-04-06 16:01,822,2074,0.97
2qhhq,investing,ll5xeb,2021-02-16 15:16,Bullish on Netflix because of Awards season,https://www.reddit.com/r/investing/comments/ll5xeb/bullish_on_netflix_because_of_awards_season/,2021-04-06 16:01,20,0,0.28
2qhhq,investing,ll6h23,2021-02-16 15:43,Watching the 10-Year Like a Hawk,https://www.reddit.com/r/investing/comments/ll6h23/watching_the_10year_like_a_hawk/,2021-04-06 16:01,219,218,0.92
2qhhq,investing,ll74gh,2021-02-16 16:11,Loop Energy Inc. (TSX: LPEN) IPO DD - The leading hydrogen fuel cell provider: here’s all you need to know,https://www.reddit.com/r/investing/comments/ll74gh/loop_energy_inc_tsx_lpen_ipo_dd_the_leading/,2021-04-06 16:01,71,99,0.97
2qhhq,investing,ll7lpj,2021-02-16 16:33,Long Term Premiums vs. Current Trends (ARK and others),https://www.reddit.com/r/investing/comments/ll7lpj/long_term_premiums_vs_current_trends_ark_and/,2021-04-06 16:01,49,33,0.89
2qhhq,investing,ll7uum,2021-02-16 16:44,COVID underinvestment causing structural deficit in Natural Gas,https://www.reddit.com/r/investing/comments/ll7uum/covid_underinvestment_causing_structural_deficit/,2021-04-06 16:01,27,30,0.85
2qhhq,investing,llamrw,2021-02-16 18:48,$MILE DD: MetroMile JUST went public - here is why I'm investing in this InsureTech DISRUPTOR the market is sleeping on,https://www.reddit.com/r/investing/comments/llamrw/mile_dd_metromile_just_went_public_here_is_why_im/,2021-04-06 16:01,63,108,0.91
2qhhq,investing,llaqfl,2021-02-16 18:53,$RYCEY Potential to be a 5x stock,https://www.reddit.com/r/investing/comments/llaqfl/rycey_potential_to_be_a_5x_stock/,2021-04-06 16:01,98,50,0.63
2qhhq,investing,llbtj5,2021-02-16 19:42,$STMP DD - Stamps.com's Real Business Is ShipStation & ShipEngine,https://www.reddit.com/r/investing/comments/llbtj5/stmp_dd_stampscoms_real_business_is_shipstation/,2021-04-06 16:01,20,34,0.87
2qhhq,investing,llcwg7,2021-02-16 20:32,Canadian Funds Move Forward with Bitcoin ETF's,https://www.reddit.com/r/investing/comments/llcwg7/canadian_funds_move_forward_with_bitcoin_etfs/,2021-04-06 16:01,57,58,0.86
