Subreddit_ID,Subreddit_Name,Submission_ID,Submission_CreatedDate,Submission_Title,Submission_URL,Submission_LastFetched,Submission_NumComments,Submission_Score,Submission_UpvoteRatio
2qhhq,investing,jj8yx7,2020-10-27 20:17,Cryptocurrency vs precious metals,https://www.reddit.com/r/investing/comments/jj8yx7/cryptocurrency_vs_precious_metals/,2020-11-24 21:03,65,19,0.76
2qhhq,investing,jja0j8,2020-10-27 21:09,Facebook new game streaming won't be available on iPhone. Can't be good for AAPL.,https://www.reddit.com/r/investing/comments/jja0j8/facebook_new_game_streaming_wont_be_available_on/,2020-11-24 21:03,32,0,0.5
2qhhq,investing,jja4eo,2020-10-27 21:15,Microsoft beats on sales and earnings as Azure growth outpaces expectations,https://www.reddit.com/r/investing/comments/jja4eo/microsoft_beats_on_sales_and_earnings_as_azure/,2020-11-24 21:03,126,1493,0.98
2qhhq,investing,jjadun,2020-10-27 21:29,Almost every stock I've ever sold has gone up significantly and it's haunting me constantly,https://www.reddit.com/r/investing/comments/jjadun/almost_every_stock_ive_ever_sold_has_gone_up/,2020-11-24 21:03,67,14,0.68
2qhhq,investing,jjj3xu,2020-10-28 07:02,[SlashGear] Waymo and Daimler Trucks are partnering to build and sell self-driving freight trucks in the US over the coming years,https://www.reddit.com/r/investing/comments/jjj3xu/slashgear_waymo_and_daimler_trucks_are_partnering/,2020-11-24 21:03,38,66,0.9
2qhhq,investing,jjmkcy,2020-10-28 12:11,Daily Advice Thread - All basic help or advice questions must be posted here.,https://www.reddit.com/r/investing/comments/jjmkcy/daily_advice_thread_all_basic_help_or_advice/,2020-11-24 21:03,155,14,0.75
2qhhq,investing,jjmvsz,2020-10-28 12:34,Granite shares short Rolls royce (3SRR),https://www.reddit.com/r/investing/comments/jjmvsz/granite_shares_short_rolls_royce_3srr/,2020-11-24 21:03,42,57,0.79
2qhhq,investing,jjo879,2020-10-28 13:58,How to do Fundamental Analysis for the current market?,https://www.reddit.com/r/investing/comments/jjo879/how_to_do_fundamental_analysis_for_the_current/,2020-11-24 21:03,23,8,0.66
2qhhq,investing,jjpec2,2020-10-28 15:03,Precious metals and mining investing?,https://www.reddit.com/r/investing/comments/jjpec2/precious_metals_and_mining_investing/,2020-11-24 21:03,37,25,0.72
2qhhq,investing,jjrcvu,2020-10-28 16:46,AMD Stock?,https://www.reddit.com/r/investing/comments/jjrcvu/amd_stock/,2020-11-24 21:03,121,19,0.65
2qhhq,investing,jjtah8,2020-10-28 18:24,"What are your ""unknown"" stocks you bought because you are convinced by the product and the company?",https://www.reddit.com/r/investing/comments/jjtah8/what_are_your_unknown_stocks_you_bought_because/,2020-11-24 21:03,56,23,0.85
2qhhq,investing,jjtob2,2020-10-28 18:43,Boeing Cutting More Jobs in Response to Pandemic,https://www.reddit.com/r/investing/comments/jjtob2/boeing_cutting_more_jobs_in_response_to_pandemic/,2020-11-24 21:03,283,1424,0.98
2qhhq,investing,jjuf16,2020-10-28 19:22,Consumer Reports: Tesla Autopilot 'a distant second' to GM's Super Cruise in hands-free test,https://www.reddit.com/r/investing/comments/jjuf16/consumer_reports_tesla_autopilot_a_distant_second/,2020-11-24 21:03,145,150,0.86
2qhhq,investing,jjvjh0,2020-10-28 20:20,Discussion on the massive 3.5% drop in the markets today,https://www.reddit.com/r/investing/comments/jjvjh0/discussion_on_the_massive_35_drop_in_the_markets/,2020-11-24 21:03,321,234,0.86
2qhhq,investing,jjwioj,2020-10-28 21:12,"Pinterest +23% after global jump in users, revenues in Q3",https://www.reddit.com/r/investing/comments/jjwioj/pinterest_23_after_global_jump_in_users_revenues/,2020-11-24 21:03,30,62,0.88
2qhhq,investing,jjxyrc,2020-10-28 22:29,is it time to buy into the dip?,https://www.reddit.com/r/investing/comments/jjxyrc/is_it_time_to_buy_into_the_dip/,2020-11-24 21:03,66,21,0.73
2qhhq,investing,jjyxa4,2020-10-28 23:27,Visa beats earnings and revenues by 1.94% for Q3,https://www.reddit.com/r/investing/comments/jjyxa4/visa_beats_earnings_and_revenues_by_194_for_q3/,2020-11-24 21:03,32,26,0.83
2qhhq,investing,jk0g8m,2020-10-29 00:57,How do you guys valuate and pick stocks in 2020?,https://www.reddit.com/r/investing/comments/jk0g8m/how_do_you_guys_valuate_and_pick_stocks_in_2020/,2020-11-24 21:03,20,7,0.77
2qhhq,investing,jk3mes,2020-10-29 04:28,Not keeping an emergency fund is better than keeping an emergency fund in even really bad case scenarios?,https://www.reddit.com/r/investing/comments/jk3mes/not_keeping_an_emergency_fund_is_better_than/,2020-11-24 21:03,68,73,0.84
2qhhq,investing,jk8twc,2020-10-29 12:09,Daily Advice Thread - All basic help or advice questions must be posted here.,https://www.reddit.com/r/investing/comments/jk8twc/daily_advice_thread_all_basic_help_or_advice/,2020-11-24 21:03,112,11,0.84
2qhhq,investing,jk8yrc,2020-10-29 12:19,"Time to increase exposure to Consumer Cyclicals/Discretionary, given that we appear to be close to start of economic growth period?",https://www.reddit.com/r/investing/comments/jk8yrc/time_to_increase_exposure_to_consumer/,2020-11-24 21:03,20,7,0.69
2qhhq,investing,jk8z9m,2020-10-29 12:20,Royal Caribbean Cruises Revenues down 101% YoY,https://www.reddit.com/r/investing/comments/jk8z9m/royal_caribbean_cruises_revenues_down_101_yoy/,2020-11-24 21:03,108,308,0.96
2qhhq,investing,jk9797,2020-10-29 12:36,GDP data for third quarter in: 33.1% increase,https://www.reddit.com/r/investing/comments/jk9797/gdp_data_for_third_quarter_in_331_increase/,2020-11-24 21:03,229,641,0.95
2qhhq,investing,jkbc8q,2020-10-29 14:45,"If the US Stock Exchange were to crash, how would that affect Emerging Market stocks, or would they be affected? Go down with the rest of the index?",https://www.reddit.com/r/investing/comments/jkbc8q/if_the_us_stock_exchange_were_to_crash_how_would/,2020-11-24 21:03,20,0,0.5
2qhhq,investing,jkd2ck,2020-10-29 16:17,Nokia misses Q3 earnings. Stock at -20%. Buy opportunity?,https://www.reddit.com/r/investing/comments/jkd2ck/nokia_misses_q3_earnings_stock_at_20_buy/,2020-11-24 21:03,30,37,0.83
2qhhq,investing,jkdqeo,2020-10-29 16:52,Nokia shares immobile even though they score several 5G contracts?,https://www.reddit.com/r/investing/comments/jkdqeo/nokia_shares_immobile_even_though_they_score/,2020-11-24 21:03,24,12,0.81
2qhhq,investing,jkgf0a,2020-10-29 19:06,How do billionaires sell a lot of stock without crashing the price?,https://www.reddit.com/r/investing/comments/jkgf0a/how_do_billionaires_sell_a_lot_of_stock_without/,2020-11-24 21:03,73,132,0.92
2qhhq,investing,jkhs1v,2020-10-29 20:16,"Amazon beats, Earnings: $12.37 vs $7.41 expected, Revenue: $96.15b vs $92.7b expected",https://www.reddit.com/r/investing/comments/jkhs1v/amazon_beats_earnings_1237_vs_741_expected/,2020-11-24 21:03,284,1588,0.97
2qhhq,investing,jkit0b,2020-10-29 21:08,What do you guys think about buying franchises? Are they a good move?,https://www.reddit.com/r/investing/comments/jkit0b/what_do_you_guys_think_about_buying_franchises/,2020-11-24 21:03,39,14,0.7
2qhhq,investing,jkivpl,2020-10-29 21:12,Twitter down 13%,https://www.reddit.com/r/investing/comments/jkivpl/twitter_down_13/,2020-11-24 21:03,36,32,0.83
2qhhq,investing,jkiwon,2020-10-29 21:13,Netflix hiking his $13/mo plan to $14/mo,https://www.reddit.com/r/investing/comments/jkiwon/netflix_hiking_his_13mo_plan_to_14mo/,2020-11-24 21:03,26,5,0.63
2qhhq,investing,jkixr8,2020-10-29 21:15,Alphabet up 8% after ER,https://www.reddit.com/r/investing/comments/jkixr8/alphabet_up_8_after_er/,2020-11-24 21:03,32,94,0.91
2qhhq,investing,jkiync,2020-10-29 21:16,Apple down 4% after ER,https://www.reddit.com/r/investing/comments/jkiync/apple_down_4_after_er/,2020-11-24 21:03,90,54,0.86
2qhhq,investing,jkj7jr,2020-10-29 21:28,"Amazon reports sales growth of 37%, topping estimates. Is there any end to this mammoth growth ? The company already valued at $1.61 Trillion and still growing as it's a start-up, fucking Insane.",https://www.reddit.com/r/investing/comments/jkj7jr/amazon_reports_sales_growth_of_37_topping/,2020-11-24 21:03,75,114,0.82
2qhhq,investing,jkr0w4,2020-10-30 05:28,[FSLY] Ark Investment continues to buy in Fastly shares. What Am I missing here?,https://www.reddit.com/r/investing/comments/jkr0w4/fsly_ark_investment_continues_to_buy_in_fastly/,2020-11-24 21:03,87,31,0.77
2qhhq,investing,jkrv3t,2020-10-30 06:42,Favorite non-tech stock,https://www.reddit.com/r/investing/comments/jkrv3t/favorite_nontech_stock/,2020-11-24 21:03,88,22,0.91
2qhhq,investing,jks8rq,2020-10-30 07:18,The board of directors as the enemy,https://www.reddit.com/r/investing/comments/jks8rq/the_board_of_directors_as_the_enemy/,2020-11-24 21:03,37,0,0.5
2qhhq,investing,jkswoz,2020-10-30 08:22,ELI5: How are stocks valued with fundamentals?,https://www.reddit.com/r/investing/comments/jkswoz/eli5_how_are_stocks_valued_with_fundamentals/,2020-11-24 21:03,40,53,0.85
2qhhq,investing,jkuoi0,2020-10-30 11:01,How will Lemonade grow? LMND,https://www.reddit.com/r/investing/comments/jkuoi0/how_will_lemonade_grow_lmnd/,2020-11-24 21:03,90,76,0.86
2qhhq,investing,jkvlfo,2020-10-30 12:12,Daily Advice Thread - All basic help or advice questions must be posted here.,https://www.reddit.com/r/investing/comments/jkvlfo/daily_advice_thread_all_basic_help_or_advice/,2020-11-24 21:03,155,9,0.75
2qhhq,investing,jkwnd2,2020-10-30 13:22,Earnings Reports: The oil giants,https://www.reddit.com/r/investing/comments/jkwnd2/earnings_reports_the_oil_giants/,2020-11-24 21:03,58,31,0.81
2qhhq,investing,jkxp6t,2020-10-30 14:24,"ABBV - beat earnings, improved guidance, increased dividend 10%, zero discussion",https://www.reddit.com/r/investing/comments/jkxp6t/abbv_beat_earnings_improved_guidance_increased/,2020-11-24 21:03,70,392,0.94
2qhhq,investing,jkxxnq,2020-10-30 14:37,"According to the Bureau of Economic Analysis, current‑dollar GDP increased 38.0 percent, or $1.64 trillion, in the third quarter to a level of $21.16 trillion. In the second quarter, GDP decreased 32.8 percent, or $2.04 trillion",https://www.reddit.com/r/investing/comments/jkxxnq/according_to_the_bureau_of_economic_analysis/,2020-11-24 21:03,87,432,0.94
2qhhq,investing,jl0vbc,2020-10-30 17:12,INDF ETF - new way to invest in India - thoughts?,https://www.reddit.com/r/investing/comments/jl0vbc/indf_etf_new_way_to_invest_in_india_thoughts/,2020-11-24 21:03,28,9,0.7
2qhhq,investing,jl4l5a,2020-10-30 20:29,Stocks just wrapped up their worst week since March,https://www.reddit.com/r/investing/comments/jl4l5a/stocks_just_wrapped_up_their_worst_week_since/,2020-11-24 21:03,491,1424,0.98
2qhhq,investing,jlcvxd,2020-10-31 05:17,Which emerging market country to invest for the decade?,https://www.reddit.com/r/investing/comments/jlcvxd/which_emerging_market_country_to_invest_for_the/,2020-11-24 21:03,121,18,0.79
2qhhq,investing,jldofi,2020-10-31 06:28,Does the price of selling call options indicate how optimistic speculators are about the stock?,https://www.reddit.com/r/investing/comments/jldofi/does_the_price_of_selling_call_options_indicate/,2020-11-24 21:03,20,12,0.85
2qhhq,investing,jlf4g8,2020-10-31 08:53,"What are examples of ""cannot-fail"" stocks that ended up crashing and staying down?",https://www.reddit.com/r/investing/comments/jlf4g8/what_are_examples_of_cannotfail_stocks_that_ended/,2020-11-24 21:03,484,421,0.97
2qhhq,investing,jlfgnj,2020-10-31 09:28,Seriously worried about oil,https://www.reddit.com/r/investing/comments/jlfgnj/seriously_worried_about_oil/,2020-11-24 21:03,100,10,0.66
2qhhq,investing,jlgav9,2020-10-31 10:43,What we found after analyzing Hollysys Automation for more than 6 months,https://www.reddit.com/r/investing/comments/jlgav9/what_we_found_after_analyzing_hollysys_automation/,2020-11-24 21:03,20,56,0.83
2qhhq,investing,jlhaxt,2020-10-31 12:09,Daily Advice Thread - All basic help or advice questions must be posted here.,https://www.reddit.com/r/investing/comments/jlhaxt/daily_advice_thread_all_basic_help_or_advice/,2020-11-24 21:03,58,7,0.75
2qhhq,investing,jlkb10,2020-10-31 15:30,The case for why ARKK ETFs are NOT an exceptional investment.,https://www.reddit.com/r/investing/comments/jlkb10/the_case_for_why_arkk_etfs_are_not_an_exceptional/,2020-11-24 21:03,221,69,0.6
2qhhq,investing,jlkkup,2020-10-31 15:46,Bloomberg article anticipates the US stock market could be headed for a lost decade,https://www.reddit.com/r/investing/comments/jlkkup/bloomberg_article_anticipates_the_us_stock_market/,2020-11-24 21:03,538,1204,0.88
2qhhq,investing,jlmcl0,2020-10-31 17:26,What are some ways to earn income (passive or active) on shares of stock you already own?,https://www.reddit.com/r/investing/comments/jlmcl0/what_are_some_ways_to_earn_income_passive_or/,2020-11-24 21:03,36,12,0.75
2qhhq,investing,jln4th,2020-10-31 18:11,Do REIT indexes make sense in a post-COVID world?,https://www.reddit.com/r/investing/comments/jln4th/do_reit_indexes_make_sense_in_a_postcovid_world/,2020-11-24 21:03,31,27,0.84
2qhhq,investing,jlo8o7,2020-10-31 19:14,Quarantine orders in England. How long before we get the same orders? March Dip v2.0 incoming?,https://www.reddit.com/r/investing/comments/jlo8o7/quarantine_orders_in_england_how_long_before_we/,2020-11-24 21:03,104,56,0.81
2qhhq,investing,jltqox,2020-11-01 00:58,How can I invest into “remote work”,https://www.reddit.com/r/investing/comments/jltqox/how_can_i_invest_into_remote_work/,2020-11-24 21:03,47,3,0.57
2qhhq,investing,jly39l,2020-11-01 06:45,Unpopular opinion time: people under 30 should not invest in vtsax,https://www.reddit.com/r/investing/comments/jly39l/unpopular_opinion_time_people_under_30_should_not/,2020-11-24 21:03,29,0,0.24
2qhhq,investing,jly44k,2020-11-01 06:47,3M (NYSE: MMM) - A Dividend King - A quick look at a noteworthy portfolio inclusion.,https://www.reddit.com/r/investing/comments/jly44k/3m_nyse_mmm_a_dividend_king_a_quick_look_at_a/,2020-11-24 21:03,110,472,0.93
2qhhq,investing,jm1ab1,2020-11-01 12:14,Daily Advice Thread - All basic help or advice questions must be posted here.,https://www.reddit.com/r/investing/comments/jm1ab1/daily_advice_thread_all_basic_help_or_advice/,2020-11-24 21:03,93,10,0.76
2qhhq,investing,jm43du,2020-11-01 15:30,Dunkin' Brands to go private,https://www.reddit.com/r/investing/comments/jm43du/dunkin_brands_to_go_private/,2020-11-24 21:03,157,814,0.97
2qhhq,investing,jm4csb,2020-11-01 15:46,Hydrogen Wars’ Pit Europe v. China for $700 Billion Business - Bloomberg article,https://www.reddit.com/r/investing/comments/jm4csb/hydrogen_wars_pit_europe_v_china_for_700_billion/,2020-11-24 21:03,84,118,0.86
2qhhq,investing,jm56ip,2020-11-01 16:34,Is SQ being punished because of Dorsey and Twitter?,https://www.reddit.com/r/investing/comments/jm56ip/is_sq_being_punished_because_of_dorsey_and_twitter/,2020-11-24 21:03,56,47,0.78
2qhhq,investing,jm5wwf,2020-11-01 17:16,Dump your rail stock,https://www.reddit.com/r/investing/comments/jm5wwf/dump_your_rail_stock/,2020-11-24 21:03,20,0,0.18
2qhhq,investing,jm6th4,2020-11-01 18:06,"Anyone else tired of hearing about how ""overvalued"" the stock market is?",https://www.reddit.com/r/investing/comments/jm6th4/anyone_else_tired_of_hearing_about_how_overvalued/,2020-11-24 21:03,210,125,0.75
2qhhq,investing,jma0m3,2020-11-01 21:03,What is this Great Reset proposed by WEF and what does it mean for us?,https://www.reddit.com/r/investing/comments/jma0m3/what_is_this_great_reset_proposed_by_wef_and_what/,2020-11-24 21:03,21,0,0.5
2qhhq,investing,jmac76,2020-11-01 21:21,why is everyone so against active investing and stock picking?,https://www.reddit.com/r/investing/comments/jmac76/why_is_everyone_so_against_active_investing_and/,2020-11-24 21:03,152,28,0.67
2qhhq,investing,jmd2g9,2020-11-02 00:03,Beyond doom and gloom: A nuanced discussion of multifamily rentals / REITs in very high cost of living cities (VCOL),https://www.reddit.com/r/investing/comments/jmd2g9/beyond_doom_and_gloom_a_nuanced_discussion_of/,2020-11-24 21:03,45,69,0.88
2qhhq,investing,jmfsrd,2020-11-02 03:01,Massive Wells Fargo layoff coming as soon as this Tuesday,https://www.reddit.com/r/investing/comments/jmfsrd/massive_wells_fargo_layoff_coming_as_soon_as_this/,2020-11-24 21:03,149,1995,0.98
2qhhq,investing,jmmdpb,2020-11-02 12:17,Daily Advice Thread - All basic help or advice questions must be posted here.,https://www.reddit.com/r/investing/comments/jmmdpb/daily_advice_thread_all_basic_help_or_advice/,2020-11-24 21:03,68,11,0.78
2qhhq,investing,jmoscm,2020-11-02 14:52,What do you expect to see from NIO?,https://www.reddit.com/r/investing/comments/jmoscm/what_do_you_expect_to_see_from_nio/,2020-11-24 21:03,89,51,0.82
2qhhq,investing,jmp2ba,2020-11-02 15:06,Altria (MO) - 3Q20 Earnings Analysis,https://www.reddit.com/r/investing/comments/jmp2ba/altria_mo_3q20_earnings_analysis/,2020-11-24 21:03,25,26,0.79
2qhhq,investing,jmpiyl,2020-11-02 15:31,Ray Dalio: Yuan Will be a Reserve Currency Faster Than Expected,https://www.reddit.com/r/investing/comments/jmpiyl/ray_dalio_yuan_will_be_a_reserve_currency_faster/,2020-11-24 21:03,256,638,0.84
2qhhq,investing,jmqius,2020-11-02 16:20,"One low-risk, low reward option & one high-risk, high reward option.",https://www.reddit.com/r/investing/comments/jmqius/one_lowrisk_low_reward_option_one_highrisk_high/,2020-11-24 21:03,22,7,0.67
2qhhq,investing,jmr4v0,2020-11-02 16:51,I'm looking for a good semiconductors' ETF,https://www.reddit.com/r/investing/comments/jmr4v0/im_looking_for_a_good_semiconductors_etf/,2020-11-24 21:03,37,12,0.73
2qhhq,investing,jms2ig,2020-11-02 17:36,"If the market, on average, already prices in all available public information, why are indices such as the S&P500 usually expected to grow?",https://www.reddit.com/r/investing/comments/jms2ig/if_the_market_on_average_already_prices_in_all/,2020-11-24 21:03,99,234,0.88
2qhhq,investing,jmszto,2020-11-02 18:21,Bitcoin Is Back Trading Near Three-Year Highs,https://www.reddit.com/r/investing/comments/jmszto/bitcoin_is_back_trading_near_threeyear_highs/,2020-11-24 21:03,615,746,0.89
2qhhq,investing,jmtiny,2020-11-02 18:45,"Never in stock market history there were so many people investing, how will it affect stock market in long run?",https://www.reddit.com/r/investing/comments/jmtiny/never_in_stock_market_history_there_were_so_many/,2020-11-24 21:03,33,1,0.52
2qhhq,investing,jmwr9p,2020-11-02 21:33,"Are there any companies or ETFs whose stock should have been performing very well, but has been flat for a while now?",https://www.reddit.com/r/investing/comments/jmwr9p/are_there_any_companies_or_etfs_whose_stock/,2020-11-24 21:03,36,15,0.69
2qhhq,investing,jmxg1u,2020-11-02 22:08,Virgin Galactic still plans to go to space this fall !,https://www.reddit.com/r/investing/comments/jmxg1u/virgin_galactic_still_plans_to_go_to_space_this/,2020-11-24 21:03,37,23,0.72
2qhhq,investing,jmxr01,2020-11-02 22:24,"Cloudflare ($NET) releasing earnings on 11/5, thoughts?",https://www.reddit.com/r/investing/comments/jmxr01/cloudflare_net_releasing_earnings_on_115_thoughts/,2020-11-24 21:03,36,50,0.86
2qhhq,investing,jmy2im,2020-11-02 22:40,Some tips on buying when the market falls,https://www.reddit.com/r/investing/comments/jmy2im/some_tips_on_buying_when_the_market_falls/,2020-11-24 21:03,422,1010,0.89
2qhhq,investing,jmz7f9,2020-11-02 23:43,How did investing work in the past?,https://www.reddit.com/r/investing/comments/jmz7f9/how_did_investing_work_in_the_past/,2020-11-24 21:03,29,0,0.5
2qhhq,investing,jn17dq,2020-11-03 01:38,"PayPal plans to extend its cryptocurrency initiatives to include Venmo, more merchants, and central banks.",https://www.reddit.com/r/investing/comments/jn17dq/paypal_plans_to_extend_its_cryptocurrency/,2020-11-24 21:03,91,236,0.92
2qhhq,investing,jn2eic,2020-11-03 02:51,Any one know why is Europe stock market did not drop much with all Covid shut down? Is it prices in for US stock market with recent drops?,https://www.reddit.com/r/investing/comments/jn2eic/any_one_know_why_is_europe_stock_market_did_not/,2020-11-24 21:03,41,32,0.88
2qhhq,investing,jn96cb,2020-11-03 12:10,Daily Advice Thread - All basic help or advice questions must be posted here.,https://www.reddit.com/r/investing/comments/jn96cb/daily_advice_thread_all_basic_help_or_advice/,2020-11-24 21:03,102,7,0.74
2qhhq,investing,jna9v3,2020-11-03 13:30,"Shanghai’s market operator halts world’s largest IPO by pulling Ant Group’s listing, citing changes in regulatory environment",https://www.reddit.com/r/investing/comments/jna9v3/shanghais_market_operator_halts_worlds_largest/,2020-11-24 21:03,131,548,0.97
2qhhq,investing,jnadi7,2020-11-03 13:37,Ant Financial IPO Suspended,https://www.reddit.com/r/investing/comments/jnadi7/ant_financial_ipo_suspended/,2020-11-24 21:03,31,80,0.89
2qhhq,investing,jnc4nv,2020-11-03 15:22,Is Citigroup severely undervalued?,https://www.reddit.com/r/investing/comments/jnc4nv/is_citigroup_severely_undervalued/,2020-11-24 21:03,25,19,0.75
2qhhq,investing,jndsg6,2020-11-03 16:48,Thoughts on $SOLO?,https://www.reddit.com/r/investing/comments/jndsg6/thoughts_on_solo/,2020-11-24 21:03,34,6,0.8
2qhhq,investing,jne1sx,2020-11-03 17:01,Ali baba stock falls sharply today,https://www.reddit.com/r/investing/comments/jne1sx/ali_baba_stock_falls_sharply_today/,2020-11-24 21:03,40,34,0.84
2qhhq,investing,jnexf3,2020-11-03 17:45,Stop stressing about which party is better for the stock market: The data shows it doesn’t matter much,https://www.reddit.com/r/investing/comments/jnexf3/stop_stressing_about_which_party_is_better_for/,2020-11-24 21:03,232,2839,0.93
2qhhq,investing,jnqamj,2020-11-04 04:39,"Opinions on investing in NIO & other Chinese companies' stocks, morally speaking?",https://www.reddit.com/r/investing/comments/jnqamj/opinions_on_investing_in_nio_other_chinese/,2020-11-24 21:03,43,0,0.38
2qhhq,investing,jnvmku,2020-11-04 12:11,Daily Advice Thread - All basic help or advice questions must be posted here.,https://www.reddit.com/r/investing/comments/jnvmku/daily_advice_thread_all_basic_help_or_advice/,2020-11-24 21:03,99,7,0.78
2qhhq,investing,jnwi51,2020-11-04 13:16,Pepsico vs Ko,https://www.reddit.com/r/investing/comments/jnwi51/pepsico_vs_ko/,2020-11-24 21:03,38,4,0.58
2qhhq,investing,jnx0mw,2020-11-04 13:50,Investing in Cannabis Stock,https://www.reddit.com/r/investing/comments/jnx0mw/investing_in_cannabis_stock/,2020-11-24 21:03,218,402,0.89
2qhhq,investing,jo0l1g,2020-11-04 17:14,Are there any analysts that you trust and have had a a relatively good track record?,https://www.reddit.com/r/investing/comments/jo0l1g/are_there_any_analysts_that_you_trust_and_have/,2020-11-24 21:03,31,3,0.6
2qhhq,investing,jo1djx,2020-11-04 17:55,"Will Tesla reach the same market cap as Microsoft, Apple, Amazon, and Google one day?",https://www.reddit.com/r/investing/comments/jo1djx/will_tesla_reach_the_same_market_cap_as_microsoft/,2020-11-24 21:03,70,0,0.44
2qhhq,investing,jo1mm9,2020-11-04 18:08,Uber + Lyft up big after Prop 22 passes in CA,https://www.reddit.com/r/investing/comments/jo1mm9/uber_lyft_up_big_after_prop_22_passes_in_ca/,2020-11-24 21:03,108,630,0.93
2qhhq,investing,jo2753,2020-11-04 18:38,It's time to roll out options on smaller lots of shares.,https://www.reddit.com/r/investing/comments/jo2753/its_time_to_roll_out_options_on_smaller_lots_of/,2020-11-24 21:03,26,0,0.15
2qhhq,investing,jo296p,2020-11-04 18:41,What are some of your worst trades?,https://www.reddit.com/r/investing/comments/jo296p/what_are_some_of_your_worst_trades/,2020-11-24 21:03,99,13,0.7
2qhhq,investing,jo4fwf,2020-11-04 20:36,$RKT earnings coming up,https://www.reddit.com/r/investing/comments/jo4fwf/rkt_earnings_coming_up/,2020-11-24 21:03,35,35,0.81
2qhhq,investing,jo5xcg,2020-11-04 21:57,Mercado Libre beats earnings expectations,https://www.reddit.com/r/investing/comments/jo5xcg/mercado_libre_beats_earnings_expectations/,2020-11-24 21:03,29,31,0.78
2qhhq,investing,jo635v,2020-11-04 22:06,Why have US and UK stock markets reacted so differently to the Coronavirus pandemic?,https://www.reddit.com/r/investing/comments/jo635v/why_have_us_and_uk_stock_markets_reacted_so/,2020-11-24 21:03,60,64,0.82
2qhhq,investing,jobl4x,2020-11-05 03:39,Is there a US law that prevent an individual or company form purchasing all the available float of a shorted stock then asking a godly sum of money more for shorter to buy it back?,https://www.reddit.com/r/investing/comments/jobl4x/is_there_a_us_law_that_prevent_an_individual_or/,2020-11-24 21:03,36,80,0.85
2qhhq,investing,johoyq,2020-11-05 12:09,Daily Advice Thread - All basic help or advice questions must be posted here.,https://www.reddit.com/r/investing/comments/johoyq/daily_advice_thread_all_basic_help_or_advice/,2020-11-24 21:03,126,6,0.75
2qhhq,investing,joj76m,2020-11-05 13:59,"Another 751,000 Americans filed new unemployment claims last week",https://www.reddit.com/r/investing/comments/joj76m/another_751000_americans_filed_new_unemployment/,2020-11-24 21:03,175,1580,0.96
2qhhq,investing,jojg6v,2020-11-05 14:14,A wild three days for clean energy,https://www.reddit.com/r/investing/comments/jojg6v/a_wild_three_days_for_clean_energy/,2020-11-24 21:03,45,87,0.9
2qhhq,investing,jonbp3,2020-11-05 17:49,"Bitcoin surges past $15,000, hitting its highest level since January 2018",https://www.reddit.com/r/investing/comments/jonbp3/bitcoin_surges_past_15000_hitting_its_highest/,2020-11-24 21:03,399,478,0.93
2qhhq,investing,jop0q0,2020-11-05 19:16,How do people discover new businesses to invest in for the long term?,https://www.reddit.com/r/investing/comments/jop0q0/how_do_people_discover_new_businesses_to_invest/,2020-11-24 21:03,24,1,0.57
2qhhq,investing,jopuku,2020-11-05 20:00,Is non-diversification really a bad thing?,https://www.reddit.com/r/investing/comments/jopuku/is_nondiversification_really_a_bad_thing/,2020-11-24 21:03,22,0,0.41
