Subreddit_ID,Subreddit_Name,Submission_ID,Submission_CreatedDate,Submission_Title,Submission_URL,Submission_LastFetched,Submission_NumComments,Submission_Score,Submission_UpvoteRatio
2qjfk,stocks,kfcsxy,2020-12-18 03:10,How do you get over having sold early and missing out on massive future profits?,https://www.reddit.com/r/stocks/comments/kfcsxy/how_do_you_get_over_having_sold_early_and_missing/,2020-12-28 22:00,33,0,0.5
2qjfk,stocks,kfh2ly,2020-12-18 08:07,"r/Stocks Daily Discussion & Fundamentals Friday Dec 18, 2020",https://www.reddit.com/r/stocks/comments/kfh2ly/rstocks_daily_discussion_fundamentals_friday_dec/,2020-12-28 22:00,633,32,0.91
2qjfk,stocks,kfhhq2,2020-12-18 08:44,How to play TSLA today,https://www.reddit.com/r/stocks/comments/kfhhq2/how_to_play_tsla_today/,2020-12-28 22:00,64,21,0.75
2qjfk,stocks,kfigxl,2020-12-18 10:05,Am I too late for apple?,https://www.reddit.com/r/stocks/comments/kfigxl/am_i_too_late_for_apple/,2020-12-28 22:00,20,7,0.78
2qjfk,stocks,kfj95r,2020-12-18 11:12,Norwegian air is FFFFLLLYYING CRAZY!!,https://www.reddit.com/r/stocks/comments/kfj95r/norwegian_air_is_fffflllyying_crazy/,2020-12-28 22:00,27,0,0.28
2qjfk,stocks,kfk2fe,2020-12-18 12:17,Cyberpunk:2077 Dropped From Playstation Online Store and Refunds Delivered,https://www.reddit.com/r/stocks/comments/kfk2fe/cyberpunk2077_dropped_from_playstation_online/,2020-12-28 22:00,120,169,0.93
2qjfk,stocks,kfk9qw,2020-12-18 12:30,Growth Stocks,https://www.reddit.com/r/stocks/comments/kfk9qw/growth_stocks/,2020-12-28 22:00,171,70,0.87
2qjfk,stocks,kfkq04,2020-12-18 13:01,I do not have any ETFs In my portfolio. What good ETFs do you recommend?,https://www.reddit.com/r/stocks/comments/kfkq04/i_do_not_have_any_etfs_in_my_portfolio_what_good/,2020-12-28 22:00,93,25,0.88
2qjfk,stocks,kfm1yi,2020-12-18 14:26,What are your biggest disappointing performers?,https://www.reddit.com/r/stocks/comments/kfm1yi/what_are_your_biggest_disappointing_performers/,2020-12-28 22:00,23,0,0.5
2qjfk,stocks,kfm9fh,2020-12-18 14:38,Hold on to Tesla for dear life,https://www.reddit.com/r/stocks/comments/kfm9fh/hold_on_to_tesla_for_dear_life/,2020-12-28 22:00,32,0,0.38
2qjfk,stocks,kfmlvf,2020-12-18 14:58,FUBOTV Stock - signs of an irrational bull market #FUBOTV #FUBO,https://www.reddit.com/r/stocks/comments/kfmlvf/fubotv_stock_signs_of_an_irrational_bull_market/,2020-12-28 22:00,28,3,0.71
2qjfk,stocks,kfnd3d,2020-12-18 15:39,Cathie Wood to Retain Control Over ARK,https://www.reddit.com/r/stocks/comments/kfnd3d/cathie_wood_to_retain_control_over_ark/,2020-12-28 22:00,194,1289,0.97
2qjfk,stocks,kfoe3x,2020-12-18 16:32,"Is now a good time to put money in ETFs like VOO or VTI? I am 32, I have $20k in a 401k, $6500 in a Roth IRA and $60k in a regular savings account (stupid I know). Want to save for down payment for house.",https://www.reddit.com/r/stocks/comments/kfoe3x/is_now_a_good_time_to_put_money_in_etfs_like_voo/,2020-12-28 22:00,22,24,0.91
2qjfk,stocks,kfog6s,2020-12-18 16:35,What’s your 4 can’t miss stocks for 20yr timeline?,https://www.reddit.com/r/stocks/comments/kfog6s/whats_your_4_cant_miss_stocks_for_20yr_timeline/,2020-12-28 22:00,155,91,0.9
2qjfk,stocks,kfoiug,2020-12-18 16:39,Anyone having issues with e*Trade and their NWARF stock?,https://www.reddit.com/r/stocks/comments/kfoiug/anyone_having_issues_with_etrade_and_their_nwarf/,2020-12-28 22:00,24,6,0.72
2qjfk,stocks,kfp4lh,2020-12-18 17:10,One of the worst feeling about stocks,https://www.reddit.com/r/stocks/comments/kfp4lh/one_of_the_worst_feeling_about_stocks/,2020-12-28 22:00,250,695,0.95
2qjfk,stocks,kfprkf,2020-12-18 17:42,What are everyone’s thoughts on Chewy? Hit $100 today!,https://www.reddit.com/r/stocks/comments/kfprkf/what_are_everyones_thoughts_on_chewy_hit_100_today/,2020-12-28 22:00,25,4,0.76
2qjfk,stocks,kfq891,2020-12-18 18:05,"Started trading this year. No job, took $6,000 of my college loan refund, made $35,000 profit and possibly more. Not sure what to do with the tax situation. Help?",https://www.reddit.com/r/stocks/comments/kfq891/started_trading_this_year_no_job_took_6000_of_my/,2020-12-28 22:00,96,56,0.81
2qjfk,stocks,kfqf16,2020-12-18 18:15,How much of your portfolio is in shares vs options?,https://www.reddit.com/r/stocks/comments/kfqf16/how_much_of_your_portfolio_is_in_shares_vs_options/,2020-12-28 22:00,31,2,1.0
2qjfk,stocks,kfqf3e,2020-12-18 18:15,Is NIO a good investment?,https://www.reddit.com/r/stocks/comments/kfqf3e/is_nio_a_good_investment/,2020-12-28 22:00,167,8,0.65
2qjfk,stocks,kfrjo1,2020-12-18 19:12,Should I give up and just give all my money to ARKW?,https://www.reddit.com/r/stocks/comments/kfrjo1/should_i_give_up_and_just_give_all_my_money_to/,2020-12-28 22:00,52,32,0.89
2qjfk,stocks,kfrt6z,2020-12-18 19:27,"I said it: no idea how the stock market works. Tesla sold 400,000 cars up 700%, Pfizer has the globe literally as a customer but they are only up by 12%",https://www.reddit.com/r/stocks/comments/kfrt6z/i_said_it_no_idea_how_the_stock_market_works/,2020-12-28 22:00,668,2904,0.93
2qjfk,stocks,kfrty9,2020-12-18 19:28,People asking why $MT and $VALE are the next 🚀🚀🚀🚀 This is why.,https://www.reddit.com/r/stocks/comments/kfrty9/people_asking_why_mt_and_vale_are_the_next_this/,2020-12-28 22:00,24,8,0.67
2qjfk,stocks,kfs3uv,2020-12-18 19:42,AMPIO (AMPE),https://www.reddit.com/r/stocks/comments/kfs3uv/ampio_ampe/,2020-12-28 22:00,29,19,0.89
2qjfk,stocks,kfstkq,2020-12-18 20:20,Oil tanker stocks for 2021 big news?,https://www.reddit.com/r/stocks/comments/kfstkq/oil_tanker_stocks_for_2021_big_news/,2020-12-28 22:00,23,5,0.86
2qjfk,stocks,kft0c1,2020-12-18 20:30,Please help me understand how Tesla is included in S&P.,https://www.reddit.com/r/stocks/comments/kft0c1/please_help_me_understand_how_tesla_is_included/,2020-12-28 22:00,68,5,0.59
2qjfk,stocks,kfu0ka,2020-12-18 21:24,Steady growth stocks under 100$?,https://www.reddit.com/r/stocks/comments/kfu0ka/steady_growth_stocks_under_100/,2020-12-28 22:00,25,1,0.6
2qjfk,stocks,kfu116,2020-12-18 21:25,Gravity defying market? Why? How?,https://www.reddit.com/r/stocks/comments/kfu116/gravity_defying_market_why_how/,2020-12-28 22:00,28,1,0.67
2qjfk,stocks,kfu7o0,2020-12-18 21:35,Intel falls on report Microsoft plans to design own chips for PCs and servers,https://www.reddit.com/r/stocks/comments/kfu7o0/intel_falls_on_report_microsoft_plans_to_design/,2020-12-28 22:00,112,235,0.97
2qjfk,stocks,kfud7d,2020-12-18 21:43,Best Canadian Weed ETFs?,https://www.reddit.com/r/stocks/comments/kfud7d/best_canadian_weed_etfs/,2020-12-28 22:00,21,1,0.67
2qjfk,stocks,kfv334,2020-12-18 22:21,"With the latest government hack news, and SolarWinds software Orion being the culprit, is this a huge opportunity for PLTR?",https://www.reddit.com/r/stocks/comments/kfv334/with_the_latest_government_hack_news_and/,2020-12-28 22:00,27,32,0.8
2qjfk,stocks,kfvewz,2020-12-18 22:37,What are your top stock picks for 2021?,https://www.reddit.com/r/stocks/comments/kfvewz/what_are_your_top_stock_picks_for_2021/,2020-12-28 22:00,24,14,0.82
2qjfk,stocks,kfvgx6,2020-12-18 22:40,Long Term stocks,https://www.reddit.com/r/stocks/comments/kfvgx6/long_term_stocks/,2020-12-28 22:00,25,4,0.71
2qjfk,stocks,kfvmt2,2020-12-18 22:48,"PLTR downgraded by Credit Suisse, what do you think?",https://www.reddit.com/r/stocks/comments/kfvmt2/pltr_downgraded_by_credit_suisse_what_do_you_think/,2020-12-28 22:00,99,35,0.84
2qjfk,stocks,kfvw8z,2020-12-18 23:02,Is there a way to see individual performances within a mutual fund?,https://www.reddit.com/r/stocks/comments/kfvw8z/is_there_a_way_to_see_individual_performances/,2020-12-28 22:00,22,6,0.76
2qjfk,stocks,kfy9im,2020-12-19 01:19,Fidelity Disruptive Funds - ARK for Boomers,https://www.reddit.com/r/stocks/comments/kfy9im/fidelity_disruptive_funds_ark_for_boomers/,2020-12-28 22:00,32,34,0.91
2qjfk,stocks,kg1j5w,2020-12-19 04:52,Expected Tesla share's price,https://www.reddit.com/r/stocks/comments/kg1j5w/expected_tesla_shares_price/,2020-12-28 22:00,33,2,0.63
2qjfk,stocks,kg1liy,2020-12-19 04:57,Cyber security stocks,https://www.reddit.com/r/stocks/comments/kg1liy/cyber_security_stocks/,2020-12-28 22:00,61,34,0.89
2qjfk,stocks,kg1zmg,2020-12-19 05:25,If I had $800 a month to invest for 5 years,https://www.reddit.com/r/stocks/comments/kg1zmg/if_i_had_800_a_month_to_invest_for_5_years/,2020-12-28 22:00,21,13,0.82
2qjfk,stocks,kg3okz,2020-12-19 07:44,What sectors will you be investing in in 2021?,https://www.reddit.com/r/stocks/comments/kg3okz/what_sectors_will_you_be_investing_in_in_2021/,2020-12-28 22:00,169,56,0.89
2qjfk,stocks,kg5x44,2020-12-19 11:03,Cathie Wood thinks that the Genomics sector can outperform Tesla going forward,https://www.reddit.com/r/stocks/comments/kg5x44/cathie_wood_thinks_that_the_genomics_sector_can/,2020-12-28 22:00,403,1278,0.97
2qjfk,stocks,kg6jpu,2020-12-19 11:58,CD Project Red stocks nowadays,https://www.reddit.com/r/stocks/comments/kg6jpu/cd_project_red_stocks_nowadays/,2020-12-28 22:00,21,6,0.8
2qjfk,stocks,kg8hu0,2020-12-19 14:21,Looking for great podcasts regarding stocks & companies worth tracking,https://www.reddit.com/r/stocks/comments/kg8hu0/looking_for_great_podcasts_regarding_stocks/,2020-12-28 22:00,33,54,0.95
2qjfk,stocks,kg9c5m,2020-12-19 15:09,Elon Musk Has Made Millionaires Out of His Most Loyal Fans,https://www.reddit.com/r/stocks/comments/kg9c5m/elon_musk_has_made_millionaires_out_of_his_most/,2020-12-28 22:00,281,1497,0.92
2qjfk,stocks,kgaen8,2020-12-19 16:06,Graduation gift of 10k Exxon stock,https://www.reddit.com/r/stocks/comments/kgaen8/graduation_gift_of_10k_exxon_stock/,2020-12-28 22:00,198,92,0.9
2qjfk,stocks,kgayy3,2020-12-19 16:34,What is a good place to learn about the stock market?,https://www.reddit.com/r/stocks/comments/kgayy3/what_is_a_good_place_to_learn_about_the_stock/,2020-12-28 22:00,49,27,0.81
2qjfk,stocks,kgcmsn,2020-12-19 17:58,"I'm going to take a big position in Nintendo next week, is there a bear case?",https://www.reddit.com/r/stocks/comments/kgcmsn/im_going_to_take_a_big_position_in_nintendo_next/,2020-12-28 22:00,27,6,0.8
2qjfk,stocks,kgd1xh,2020-12-19 18:21,Which acronym will replace the „FAANG“ in the next decade?,https://www.reddit.com/r/stocks/comments/kgd1xh/which_acronym_will_replace_the_faang_in_the_next/,2020-12-28 22:00,79,12,0.64
2qjfk,stocks,kgd8ia,2020-12-19 18:29,Promising ETF’s with great growth potential,https://www.reddit.com/r/stocks/comments/kgd8ia/promising_etfs_with_great_growth_potential/,2020-12-28 22:00,70,49,0.95
2qjfk,stocks,kgdpoe,2020-12-19 18:50,What’re the downsides to covered calls?,https://www.reddit.com/r/stocks/comments/kgdpoe/whatre_the_downsides_to_covered_calls/,2020-12-28 22:00,23,4,0.65
2qjfk,stocks,kgdy6m,2020-12-19 19:03,Can someone sell me on future fundamentals that SQ is a buy?,https://www.reddit.com/r/stocks/comments/kgdy6m/can_someone_sell_me_on_future_fundamentals_that/,2020-12-28 22:00,24,17,0.8
2qjfk,stocks,kge67s,2020-12-19 19:14,Lab-grown meat companies?,https://www.reddit.com/r/stocks/comments/kge67s/labgrown_meat_companies/,2020-12-28 22:00,55,7,0.77
2qjfk,stocks,kgf8t3,2020-12-19 20:08,Good long term dividend stocks that I can get into?,https://www.reddit.com/r/stocks/comments/kgf8t3/good_long_term_dividend_stocks_that_i_can_get_into/,2020-12-28 22:00,21,7,0.9
2qjfk,stocks,kggusg,2020-12-19 21:37,"Beside Warren Buffett, are other big investors also in cash in these times?",https://www.reddit.com/r/stocks/comments/kggusg/beside_warren_buffett_are_other_big_investors/,2020-12-28 22:00,101,68,0.89
2qjfk,stocks,kghmy0,2020-12-19 22:21,What are you guys buying LEAPS on?,https://www.reddit.com/r/stocks/comments/kghmy0/what_are_you_guys_buying_leaps_on/,2020-12-28 22:00,34,5,0.86
2qjfk,stocks,kgk768,2020-12-20 00:52,Trump signs bills that could delist Chinese Stocks,https://www.reddit.com/r/stocks/comments/kgk768/trump_signs_bills_that_could_delist_chinese_stocks/,2020-12-28 22:00,196,1334,0.96
2qjfk,stocks,kgkz2q,2020-12-20 01:40,Solar energy to the moon? $TAN,https://www.reddit.com/r/stocks/comments/kgkz2q/solar_energy_to_the_moon_tan/,2020-12-28 22:00,76,33,0.82
2qjfk,stocks,kgmfxx,2020-12-20 03:12,Profits,https://www.reddit.com/r/stocks/comments/kgmfxx/profits/,2020-12-28 22:00,26,3,0.72
2qjfk,stocks,kgmtv3,2020-12-20 03:38,Infinite potential in Biotech exploding stock ~ AMPE [DD],https://www.reddit.com/r/stocks/comments/kgmtv3/infinite_potential_in_biotech_exploding_stock/,2020-12-28 22:00,27,16,0.83
2qjfk,stocks,kgmtzz,2020-12-20 03:38,Housing crash soon? DRV,https://www.reddit.com/r/stocks/comments/kgmtzz/housing_crash_soon_drv/,2020-12-28 22:00,48,4,0.59
2qjfk,stocks,kgqcn9,2020-12-20 08:05,How to learn about stocks if I’m completely clueless?,https://www.reddit.com/r/stocks/comments/kgqcn9/how_to_learn_about_stocks_if_im_completely/,2020-12-28 22:00,27,7,0.67
2qjfk,stocks,kgr3q8,2020-12-20 09:14,Your most promising stocks for the next decade?,https://www.reddit.com/r/stocks/comments/kgr3q8/your_most_promising_stocks_for_the_next_decade/,2020-12-28 22:00,203,39,0.72
2qjfk,stocks,kgrf9e,2020-12-20 09:43,Why I bought blackberry after hours last trading session,https://www.reddit.com/r/stocks/comments/kgrf9e/why_i_bought_blackberry_after_hours_last_trading/,2020-12-28 22:00,26,22,0.78
2qjfk,stocks,kgtepb,2020-12-20 12:44,"Trump Signs the Bill, That Could Lead To Delisting Of Chinese Stocks - Opportunity in NIO, BABA, XPeng, etc?",https://www.reddit.com/r/stocks/comments/kgtepb/trump_signs_the_bill_that_could_lead_to_delisting/,2020-12-28 22:00,61,77,0.83
2qjfk,stocks,kgtfu1,2020-12-20 12:46,oil prices in 2008,https://www.reddit.com/r/stocks/comments/kgtfu1/oil_prices_in_2008/,2020-12-28 22:00,24,6,0.88
2qjfk,stocks,kgtgh6,2020-12-20 12:48,Predict the best performing stock of 2021 and receive a reward.,https://www.reddit.com/r/stocks/comments/kgtgh6/predict_the_best_performing_stock_of_2021_and/,2020-12-28 22:00,2153,1550,0.96
2qjfk,stocks,kguyq8,2020-12-20 14:34,Thoughts on FireEye (FEYE)? They found the SolarWinds Vulnerability first.,https://www.reddit.com/r/stocks/comments/kguyq8/thoughts_on_fireeye_feye_they_found_the/,2020-12-28 22:00,26,12,0.89
2qjfk,stocks,kgvqk5,2020-12-20 15:20,Is Short Term Trading Profitable?,https://www.reddit.com/r/stocks/comments/kgvqk5/is_short_term_trading_profitable/,2020-12-28 22:00,23,0,0.38
2qjfk,stocks,kgwf3j,2020-12-20 16:00,Stock picks for 2021,https://www.reddit.com/r/stocks/comments/kgwf3j/stock_picks_for_2021/,2020-12-28 22:00,234,166,0.95
2qjfk,stocks,kgwp0p,2020-12-20 16:14,PTON investors: How many people do you see using Peloton in the long-term,https://www.reddit.com/r/stocks/comments/kgwp0p/pton_investors_how_many_people_do_you_see_using/,2020-12-28 22:00,27,13,0.82
2qjfk,stocks,kgwx7l,2020-12-20 16:27,Putting all the eggs in one basket,https://www.reddit.com/r/stocks/comments/kgwx7l/putting_all_the_eggs_in_one_basket/,2020-12-28 22:00,66,4,0.64
2qjfk,stocks,kgxx85,2020-12-20 17:19,Don't fall prey to the latest Wall Street fabrication!!!,https://www.reddit.com/r/stocks/comments/kgxx85/dont_fall_prey_to_the_latest_wall_street/,2020-12-28 22:00,55,59,0.86
2qjfk,stocks,kgyd3y,2020-12-20 17:42,2021 stocks to invest in ?,https://www.reddit.com/r/stocks/comments/kgyd3y/2021_stocks_to_invest_in/,2020-12-28 22:00,117,37,0.82
2qjfk,stocks,kh09dk,2020-12-20 19:20,Has TSLA already been bought by S&P 500 trackers during friday after hours?,https://www.reddit.com/r/stocks/comments/kh09dk/has_tsla_already_been_bought_by_sp_500_trackers/,2020-12-28 22:00,43,26,0.84
2qjfk,stocks,kh10kf,2020-12-20 19:57,Should I buy PTLR$???????,https://www.reddit.com/r/stocks/comments/kh10kf/should_i_buy_ptlr/,2020-12-28 22:00,44,9,0.58
2qjfk,stocks,kh225v,2020-12-20 20:51,Stocks involved with lab-grown meat?,https://www.reddit.com/r/stocks/comments/kh225v/stocks_involved_with_labgrown_meat/,2020-12-28 22:00,29,21,0.83
2qjfk,stocks,kh2huh,2020-12-20 21:14,What was the craziest single day price action you saw this year?,https://www.reddit.com/r/stocks/comments/kh2huh/what_was_the_craziest_single_day_price_action_you/,2020-12-28 22:00,37,3,0.64
2qjfk,stocks,kh2jre,2020-12-20 21:17,Ford will never make it as an electric car manufacturer?,https://www.reddit.com/r/stocks/comments/kh2jre/ford_will_never_make_it_as_an_electric_car/,2020-12-28 22:00,69,4,0.61
2qjfk,stocks,kh2v8x,2020-12-20 21:34,UK Mutation | More Lethal For Young and Old People | Evidence Based | Puts Until the Financial Crisis,https://www.reddit.com/r/stocks/comments/kh2v8x/uk_mutation_more_lethal_for_young_and_old_people/,2020-12-28 22:00,25,0,0.44
2qjfk,stocks,kh4giq,2020-12-20 23:00,"Congress agrees to $900 billion coronavirus stimulus deal, McConnell says",https://www.reddit.com/r/stocks/comments/kh4giq/congress_agrees_to_900_billion_coronavirus/,2020-12-28 22:00,766,2459,0.95
2qjfk,stocks,kh5it0,2020-12-21 00:01,I had some good luck with PLUG thanks to you guys. Looking for any other recommendations you may have.,https://www.reddit.com/r/stocks/comments/kh5it0/i_had_some_good_luck_with_plug_thanks_to_you_guys/,2020-12-28 22:00,66,34,0.84
2qjfk,stocks,kh5xve,2020-12-21 00:24,Bad idea to put 36% on income into stocks right now?,https://www.reddit.com/r/stocks/comments/kh5xve/bad_idea_to_put_36_on_income_into_stocks_right_now/,2020-12-28 22:00,41,3,0.59
2qjfk,stocks,kh61n8,2020-12-21 00:30,Advice Please I’m torn 😅,https://www.reddit.com/r/stocks/comments/kh61n8/advice_please_im_torn/,2020-12-28 22:00,32,0,0.25
2qjfk,stocks,kh6a9g,2020-12-21 00:44,Aerojet Rocketdyne to be Acquired by Lockheed Martin for $56/Share in cash,https://www.reddit.com/r/stocks/comments/kh6a9g/aerojet_rocketdyne_to_be_acquired_by_lockheed/,2020-12-28 22:00,24,2,0.75
2qjfk,stocks,kh6l2j,2020-12-21 01:01,Idk if this is the right place to ask so mods delete if not allowed or something lol,https://www.reddit.com/r/stocks/comments/kh6l2j/idk_if_this_is_the_right_place_to_ask_so_mods/,2020-12-28 22:00,20,0,0.5
2qjfk,stocks,kh6vxg,2020-12-21 01:19,Favorite long term boomer stocks?,https://www.reddit.com/r/stocks/comments/kh6vxg/favorite_long_term_boomer_stocks/,2020-12-28 22:00,42,3,0.8
2qjfk,stocks,kh7pmw,2020-12-21 02:08,How can I properly educate myself about the stock market?,https://www.reddit.com/r/stocks/comments/kh7pmw/how_can_i_properly_educate_myself_about_the_stock/,2020-12-28 22:00,22,5,0.69
2qjfk,stocks,kh7xas,2020-12-21 02:19,VOO vs ARKK?,https://www.reddit.com/r/stocks/comments/kh7xas/voo_vs_arkk/,2020-12-28 22:00,31,18,0.82
2qjfk,stocks,khbs1v,2020-12-21 06:28,Advice,https://www.reddit.com/r/stocks/comments/khbs1v/advice/,2020-12-28 22:00,21,7,0.89
2qjfk,stocks,khd166,2020-12-21 08:08,"r/Stocks Daily Discussion Monday - Dec 21, 2020",https://www.reddit.com/r/stocks/comments/khd166/rstocks_daily_discussion_monday_dec_21_2020/,2020-12-28 22:00,590,27,0.87
2qjfk,stocks,khd5gf,2020-12-21 08:18,What to invest in to guarantee i wont lose money?,https://www.reddit.com/r/stocks/comments/khd5gf/what_to_invest_in_to_guarantee_i_wont_lose_money/,2020-12-28 22:00,26,0,0.22
2qjfk,stocks,khdoae,2020-12-21 09:01,"What are your ""guaranteed growth"" stock buys for the future?",https://www.reddit.com/r/stocks/comments/khdoae/what_are_your_guaranteed_growth_stock_buys_for/,2020-12-28 22:00,52,19,0.83
2qjfk,stocks,khe65v,2020-12-21 09:42,Tesla To Account For 1.69% Of S&P 500 In Its Debut Today,https://www.reddit.com/r/stocks/comments/khe65v/tesla_to_account_for_169_of_sp_500_in_its_debut/,2020-12-28 22:00,21,75,0.95
2qjfk,stocks,khede1,2020-12-21 09:58,What should I use to trade stocks? UK,https://www.reddit.com/r/stocks/comments/khede1/what_should_i_use_to_trade_stocks_uk/,2020-12-28 22:00,28,6,0.8
2qjfk,stocks,khekam,2020-12-21 10:12,"Hypothetical scenario: 2nd/3rd waves, lockdowns and a March 2020 encore",https://www.reddit.com/r/stocks/comments/khekam/hypothetical_scenario_2nd3rd_waves_lockdowns_and/,2020-12-28 22:00,25,2,0.63
2qjfk,stocks,khhbre,2020-12-21 13:24,Moderna going to the moon or nose diving today?,https://www.reddit.com/r/stocks/comments/khhbre/moderna_going_to_the_moon_or_nose_diving_today/,2020-12-28 22:00,21,16,0.79
2qjfk,stocks,khhi86,2020-12-21 13:35,AMPE Update🧪,https://www.reddit.com/r/stocks/comments/khhi86/ampe_update/,2020-12-28 22:00,36,23,0.88
2qjfk,stocks,khhlsp,2020-12-21 13:41,"Dow futures drop 500 points, pressured by worries over a new viral Covid strain in the U.K.",https://www.reddit.com/r/stocks/comments/khhlsp/dow_futures_drop_500_points_pressured_by_worries/,2020-12-28 22:00,195,829,0.95
2qjfk,stocks,khibl4,2020-12-21 14:22,Best means of tracking entire portfolio across multiple brokerage services,https://www.reddit.com/r/stocks/comments/khibl4/best_means_of_tracking_entire_portfolio_across/,2020-12-28 22:00,24,12,0.93
2qjfk,stocks,khijn1,2020-12-21 14:34,What is happening in euro.,https://www.reddit.com/r/stocks/comments/khijn1/what_is_happening_in_euro/,2020-12-28 22:00,28,0,0.43
2qjfk,stocks,khj6lz,2020-12-21 15:10,Why are Investors richer than Traders?,https://www.reddit.com/r/stocks/comments/khj6lz/why_are_investors_richer_than_traders/,2020-12-28 22:00,68,55,0.85
2qjfk,stocks,khj70s,2020-12-21 15:10,"Vaccine rolling out & stimulus passed, yet there’s still a big sea of red today... what gives?",https://www.reddit.com/r/stocks/comments/khj70s/vaccine_rolling_out_stimulus_passed_yet_theres/,2020-12-28 22:00,205,126,0.82
2qjfk,stocks,khji5h,2020-12-21 15:27,Stock price going up but losing money?,https://www.reddit.com/r/stocks/comments/khji5h/stock_price_going_up_but_losing_money/,2020-12-28 22:00,21,8,0.66
2qjfk,stocks,khjiwm,2020-12-21 15:28,Christmas gift,https://www.reddit.com/r/stocks/comments/khjiwm/christmas_gift/,2020-12-28 22:00,49,66,0.89
2qjfk,stocks,khjr12,2020-12-21 15:40,$MSFT gets price target upgraded from $229 to $272 by Citi.,https://www.reddit.com/r/stocks/comments/khjr12/msft_gets_price_target_upgraded_from_229_to_272/,2020-12-28 22:00,151,503,0.97
2qjfk,stocks,khjs3f,2020-12-21 15:41,Would now be a good time to buy since we’re in the red?,https://www.reddit.com/r/stocks/comments/khjs3f/would_now_be_a_good_time_to_buy_since_were_in_the/,2020-12-28 22:00,33,2,0.63
2qjfk,stocks,khkbu5,2020-12-21 16:10,I don't understand the ARK funds alignment.,https://www.reddit.com/r/stocks/comments/khkbu5/i_dont_understand_the_ark_funds_alignment/,2020-12-28 22:00,21,11,0.73
2qjfk,stocks,khl522,2020-12-21 16:53,"When researching a stock, how and what do you do?",https://www.reddit.com/r/stocks/comments/khl522/when_researching_a_stock_how_and_what_do_you_do/,2020-12-28 22:00,51,50,0.95
2qjfk,stocks,khlbts,2020-12-21 17:02,Bull Run,https://www.reddit.com/r/stocks/comments/khlbts/bull_run/,2020-12-28 22:00,55,2,0.6
2qjfk,stocks,khmhc6,2020-12-21 18:02,ARK vs Kensho ETFs,https://www.reddit.com/r/stocks/comments/khmhc6/ark_vs_kensho_etfs/,2020-12-28 22:00,45,79,0.95
2qjfk,stocks,khmzt1,2020-12-21 18:27,Should I sell Citibank (C) stock that was bought at $110 (now $61)?,https://www.reddit.com/r/stocks/comments/khmzt1/should_i_sell_citibank_c_stock_that_was_bought_at/,2020-12-28 22:00,56,13,0.81
2qjfk,stocks,khns5o,2020-12-21 19:05,CYBERSECURITY stocks?,https://www.reddit.com/r/stocks/comments/khns5o/cybersecurity_stocks/,2020-12-28 22:00,34,12,0.85
2qjfk,stocks,khpgec,2020-12-21 20:27,Anyone else feeling like betting against S&P 500?,https://www.reddit.com/r/stocks/comments/khpgec/anyone_else_feeling_like_betting_against_sp_500/,2020-12-28 22:00,22,0,0.42
2qjfk,stocks,khq7zg,2020-12-21 21:05,BREAKING: Apple targeting 2024 for car production and eyes “next level battery technology”,https://www.reddit.com/r/stocks/comments/khq7zg/breaking_apple_targeting_2024_for_car_production/,2020-12-28 22:00,610,4098,0.93
2qjfk,stocks,khqe73,2020-12-21 21:14,Corsair: Bearish or Bullish?,https://www.reddit.com/r/stocks/comments/khqe73/corsair_bearish_or_bullish/,2020-12-28 22:00,41,27,0.87
2qjfk,stocks,khqvse,2020-12-21 21:38,QS exploded in price to almost $100/share today. Will that price hold or call?,https://www.reddit.com/r/stocks/comments/khqvse/qs_exploded_in_price_to_almost_100share_today/,2020-12-28 22:00,41,18,0.87
2qjfk,stocks,khqwq4,2020-12-21 21:39,"Apple is the new TSLA, confirmed.",https://www.reddit.com/r/stocks/comments/khqwq4/apple_is_the_new_tsla_confirmed/,2020-12-28 22:00,95,95,0.81
2qjfk,stocks,khr214,2020-12-21 21:47,Interesting positive for JMIA believers,https://www.reddit.com/r/stocks/comments/khr214/interesting_positive_for_jmia_believers/,2020-12-28 22:00,35,9,0.85
2qjfk,stocks,khrnjd,2020-12-21 22:15,Apple would make an iCar by 2024? Apple would best buy Nissan (and maybe ABB) to accomplish that,https://www.reddit.com/r/stocks/comments/khrnjd/apple_would_make_an_icar_by_2024_apple_would_best/,2020-12-28 22:00,27,7,0.63
2qjfk,stocks,khrnpa,2020-12-21 22:16,How to build your long time portfolio?,https://www.reddit.com/r/stocks/comments/khrnpa/how_to_build_your_long_time_portfolio/,2020-12-28 22:00,33,6,0.67
2qjfk,stocks,khsiy5,2020-12-21 23:02,Want to invest in ARK etfs. Just go for it now or wait it out a bit?,https://www.reddit.com/r/stocks/comments/khsiy5/want_to_invest_in_ark_etfs_just_go_for_it_now_or/,2020-12-28 22:00,67,29,0.76
2qjfk,stocks,khteag,2020-12-21 23:51,Palantir- Tiberius announcement of a century!!!,https://www.reddit.com/r/stocks/comments/khteag/palantir_tiberius_announcement_of_a_century/,2020-12-28 22:00,42,127,0.89
2qjfk,stocks,khu5bd,2020-12-22 00:33,Anyone here use CharlesSchwab to invest?,https://www.reddit.com/r/stocks/comments/khu5bd/anyone_here_use_charlesschwab_to_invest/,2020-12-28 22:00,28,13,0.9
2qjfk,stocks,khu6at,2020-12-22 00:35,"Anyone that bought QS the past few weeks, what was your rationale?",https://www.reddit.com/r/stocks/comments/khu6at/anyone_that_bought_qs_the_past_few_weeks_what_was/,2020-12-28 22:00,20,9,0.81
