Subreddit_ID,Subreddit_Name,Submission_ID,Submission_CreatedDate,Submission_Title,Submission_URL,Submission_LastFetched,Submission_NumComments,Submission_Score,Submission_UpvoteRatio
2th52,wallstreetbets,jio02w,2020-10-26 21:41,GME Short Float Update - 10/26,https://www.reddit.com/r/wallstreetbets/comments/jio02w/gme_short_float_update_1026/,2020-10-30 23:46,59,103,0.95
2th52,wallstreetbets,jiohg5,2020-10-26 22:07,Are you feeling it now Mr. Krabs,https://i.redd.it/74tto4epiiv51.jpg,2020-10-30 23:46,75,696,0.98
2th52,wallstreetbets,jiolww,2020-10-26 22:13,5 Ways to Beat The Market (100% Guaranteed),https://www.reddit.com/r/wallstreetbets/comments/jiolww/5_ways_to_beat_the_market_100_guaranteed/,2020-10-30 23:46,26,45,0.83
2th52,wallstreetbets,jiombi,2020-10-26 22:14,GME - Meme Stock or Stock Meme?,https://www.reddit.com/r/wallstreetbets/comments/jiombi/gme_meme_stock_or_stock_meme/,2020-10-30 23:46,77,62,0.9
2th52,wallstreetbets,jip0ug,2020-10-26 22:36,My advice to my son.,https://i.redd.it/5fayle8yniv51.jpg,2020-10-30 23:46,35,96,0.84
2th52,wallstreetbets,jip1n6,2020-10-26 22:37,Yolo’d my whole account on ups to hit $175 by Friday ......will be living in a dumpster if it don’t happen !!!! Buy $ups or see me holding a sign will do anything for stink money,https://www.reddit.com/r/wallstreetbets/comments/jip1n6/yolod_my_whole_account_on_ups_to_hit_175_by/,2020-10-30 23:46,56,30,0.8
2th52,wallstreetbets,jiprod,2020-10-26 23:19,10/26 Earnings Thread RIP,https://www.reddit.com/r/wallstreetbets/comments/jiprod/1026_earnings_thread_rip/,2020-10-30 23:46,21,39,0.9
2th52,wallstreetbets,jiqh5n,2020-10-27 00:00,WSBVoteBot Log for Oct 27 2020,https://www.reddit.com/r/wallstreetbets/comments/jiqh5n/wsbvotebot_log_for_oct_27_2020/,2020-10-30 23:46,27,1,1.0
2th52,wallstreetbets,jiqqiv,2020-10-27 00:15,How to get my 34k losses back????,https://www.reddit.com/gallery/jiqqiv,2020-10-30 23:46,40,15,0.8
2th52,wallstreetbets,jir7mq,2020-10-27 00:43,What does it mean when this pattern forms in futures,https://i.redd.it/svvhsvcnajv51.png,2020-10-30 23:46,34,51,0.91
2th52,wallstreetbets,jira6v,2020-10-27 00:48,"""buy land. god ain’t making any more of it .""",https://www.reddit.com/r/wallstreetbets/comments/jira6v/buy_land_god_aint_making_any_more_of_it/,2020-10-30 23:46,22,17,0.74
2th52,wallstreetbets,jirdqz,2020-10-27 00:53,The perfect silhouette of Trump on the Turkish Lira-Dollar exchange rate chart.,https://i.redd.it/1l1o6w5gcjv51.jpg,2020-10-30 23:46,153,3452,0.97
2th52,wallstreetbets,jirf63,2020-10-27 00:56,How rich/fucked is AMD going to make me?,https://ibb.co/rpGCcc7,2020-10-30 23:46,33,15,0.77
2th52,wallstreetbets,jirgnr,2020-10-27 00:58,Who is this? Anyone notice this is the official sell off/ bear market poster child? Same photos used in March were used today,https://www.reddit.com/gallery/jirgnr,2020-10-30 23:46,30,82,0.95
2th52,wallstreetbets,jirqlg,2020-10-27 01:15,If you don’t buy NOK your brain is slow,https://www.reddit.com/r/wallstreetbets/comments/jirqlg/if_you_dont_buy_nok_your_brain_is_slow/,2020-10-30 23:46,37,13,0.67
2th52,wallstreetbets,jiruol,2020-10-27 01:22,Permabulls today,https://v.redd.it/ovudu0zhhjv51,2020-10-30 23:46,106,2474,0.98
2th52,wallstreetbets,jis76u,2020-10-27 01:44,Thoughts? UPS Calls for ER all in baby 🚀,https://i.redd.it/ybn1rjneljv51.jpg,2020-10-30 23:46,101,9,0.66
2th52,wallstreetbets,jisi4e,2020-10-27 02:03,Sony’s PlayStation 5 is about to be in stores AND the holidays are right around the corner....,https://www.reddit.com/r/wallstreetbets/comments/jisi4e/sonys_playstation_5_is_about_to_be_in_stores_and/,2020-10-30 23:46,25,7,0.69
2th52,wallstreetbets,jiso9w,2020-10-27 02:14,🚀🚀🚀,https://i.redd.it/fycifz7sqjv51.jpg,2020-10-30 23:46,40,380,0.95
2th52,wallstreetbets,jispa9,2020-10-27 02:16,Chegg does give Professors all your Information! Look at all these professors plotting to fuck students up and Chegg is part of it!! Lets burn this bitch to the ground. Position: balls deep in Nov 20 $60 Put @.40,https://i.redd.it/8935myd4rjv51.jpg,2020-10-30 23:46,30,20,0.76
2th52,wallstreetbets,jiszcz,2020-10-27 02:33,So are these guys just giving up on 2020 Christmas or what? Something tells me they are going to surprise out of nowhere. I’m a retard.,https://i.redd.it/hc1qu18bujv51.jpg,2020-10-30 23:46,26,4,0.6
2th52,wallstreetbets,jitc3i,2020-10-27 02:57,Gotta give this one to the gay ass bears 🐻🏳️‍🌈🧩🌈,https://www.reddit.com/r/wallstreetbets/comments/jitc3i/gotta_give_this_one_to_the_gay_ass_bears/,2020-10-30 23:46,34,41,0.85
2th52,wallstreetbets,jitm25,2020-10-27 03:15,"If you aren’t buying from GME, it won’t go up...",https://www.reddit.com/r/wallstreetbets/comments/jitm25/if_you_arent_buying_from_gme_it_wont_go_up/,2020-10-30 23:46,32,56,0.86
2th52,wallstreetbets,jitwtj,2020-10-27 03:35,How does WSB feel about airlines,https://www.reddit.com/r/wallstreetbets/comments/jitwtj/how_does_wsb_feel_about_airlines/,2020-10-30 23:46,42,7,0.71
2th52,wallstreetbets,jiu2y1,2020-10-27 03:48,CHGG literally will go tits up. Students are arbitraging plagiarism? This is a bubble the size of a mile and you’d be wise to buy puts for end of November.,https://i.redd.it/000k9ozj7kv51.jpg,2020-10-30 23:46,70,100,0.92
2th52,wallstreetbets,jiugpj,2020-10-27 04:16,final yolo - godspeed retards,https://i.redd.it/oy8cwnmickv51.jpg,2020-10-30 23:46,38,22,0.9
2th52,wallstreetbets,jiulki,2020-10-27 04:26,Why don't all rich people just agree to just keep buying?,https://www.reddit.com/r/wallstreetbets/comments/jiulki/why_dont_all_rich_people_just_agree_to_just_keep/,2020-10-30 23:46,61,30,0.79
2th52,wallstreetbets,jiuxud,2020-10-27 04:52,Fastly is a super buy here. See chart that shows support around 72-75,https://i.redd.it/g60vefs1jkv51.png,2020-10-30 23:46,21,17,0.81
2th52,wallstreetbets,jiv14e,2020-10-27 05:00,MAXR literally to the moon,https://www.reddit.com/r/wallstreetbets/comments/jiv14e/maxr_literally_to_the_moon/,2020-10-30 23:46,57,51,0.87
2th52,wallstreetbets,jivgsd,2020-10-27 05:35,Sold Naked AMD Puts- Ready for tomorrow,https://i.redd.it/tgxoa07oqkv51.jpg,2020-10-30 23:46,88,44,0.9
2th52,wallstreetbets,jiwqdo,2020-10-27 07:31,"Mitch McConnell just adjourned the Senate until November 9, ending the prospect of additional coronavirus relief until after the election = Free tendies with SPY puts",https://www.businessinsider.com/senate-adjourns-until-after-election-without-covid-19-bill-2020-10,2020-10-30 23:46,50,79,0.89
2th52,wallstreetbets,jix5dw,2020-10-27 08:10,Big sell signal! The richest man in nevada Sheldon Adelson and biggest gop donor knows something we dont.,https://i.redd.it/koz62ndwhlv51.png,2020-10-30 23:46,59,64,0.86
2th52,wallstreetbets,jiy3ry,2020-10-27 09:41,I was an investor until last week I finally became an autist.,https://i.redd.it/tuvnwk3nylv51.jpg,2020-10-30 23:46,557,15056,0.94
2th52,wallstreetbets,jiye6h,2020-10-27 10:08,"Ladies and gents, I finally present you the results of THE GREAT WSB CENSUS!",https://www.reddit.com/r/wallstreetbets/comments/jiye6h/ladies_and_gents_i_finally_present_you_the/,2020-10-30 23:46,82,213,0.95
2th52,wallstreetbets,jiyfu2,2020-10-27 10:12,"Daily Discussion Thread for October 27, 2020",https://www.reddit.com/r/wallstreetbets/comments/jiyfu2/daily_discussion_thread_for_october_27_2020/,2020-10-30 23:46,14785,238,0.93
2th52,wallstreetbets,jiyuny,2020-10-27 10:48,AMD!! What happened!,https://i.redd.it/wl7shy9iamv51.png,2020-10-30 23:46,38,21,0.8
2th52,wallstreetbets,jiyyhj,2020-10-27 10:57,AMD to buy Xilinx for 35B.,https://www.reddit.com/r/wallstreetbets/comments/jiyyhj/amd_to_buy_xilinx_for_35b/,2020-10-30 23:46,27,29,0.89
2th52,wallstreetbets,jiyzm8,2020-10-27 10:59,AMD going through with all stonk Xilinix acquisition,https://www.marketwatch.com/story/amd-to-acquire-xilinx-in-all-stock-deal-valued-at-35-billion-2020-10-27,2020-10-30 23:46,58,36,0.85
2th52,wallstreetbets,jizagr,2020-10-27 11:22,Bought AMD calls few weeks back. They fell. Bought the dip. They‘re also falling,https://i.imgur.com/93fFrkB.jpg,2020-10-30 23:46,150,323,0.95
2th52,wallstreetbets,jizow1,2020-10-27 11:54,"If it stays here (near $341 resistance), there’s a high possibility of a drop.",https://www.reddit.com/gallery/jizow1,2020-10-30 23:46,31,14,0.69
2th52,wallstreetbets,jj007o,2020-10-27 12:16,"The Great Bond Short Squeeze of 2020, or The Day WSB Beat the Hedge Funds (TLT DD)",https://www.reddit.com/r/wallstreetbets/comments/jj007o/the_great_bond_short_squeeze_of_2020_or_the_day/,2020-10-30 23:46,189,362,0.95
2th52,wallstreetbets,jj023g,2020-10-27 12:20,Two straight hours of panicking,https://i.redd.it/j5ugfa9rqmv51.jpg,2020-10-30 23:46,222,1365,0.96
2th52,wallstreetbets,jj0vku,2020-10-27 13:14,Funding Secured: AMD buys Xilinx,https://imgur.com/aZ4DHTU.jpg,2020-10-30 23:46,36,110,0.93
2th52,wallstreetbets,jj183u,2020-10-27 13:35,Coming out 🌈🐻,https://i.redd.it/6vfcjbac4nv51.jpg,2020-10-30 23:46,24,629,0.92
2th52,wallstreetbets,jj1tnw,2020-10-27 14:10,Hit tendie town 3 times. Never pulled out. Now I just have regret and will have to live on ramen till next semester.,https://i.redd.it/vb06u8pmanv51.jpg,2020-10-30 23:46,30,60,0.94
2th52,wallstreetbets,jj22vw,2020-10-27 14:25,GME price fall discussion,https://www.reddit.com/r/wallstreetbets/comments/jj22vw/gme_price_fall_discussion/,2020-10-30 23:46,102,91,0.92
2th52,wallstreetbets,jj231v,2020-10-27 14:25,Thank you RobinHood for this cute good morning text ❤️,https://i.redd.it/17g987p9dnv51.jpg,2020-10-30 23:46,38,771,0.97
2th52,wallstreetbets,jj2fcx,2020-10-27 14:44,Buying options in a nutshell,https://v.redd.it/c7e8keucgnv51,2020-10-30 23:46,61,2061,0.99
2th52,wallstreetbets,jj33j6,2020-10-27 15:20,Gme really was the opportunity of a lifetime,https://i.redd.it/le5if7u2nnv51.jpg,2020-10-30 23:46,101,186,0.94
2th52,wallstreetbets,jj3awc,2020-10-27 15:31,HOG,https://www.reddit.com/r/wallstreetbets/comments/jj3awc/hog/,2020-10-30 23:46,27,19,0.85
2th52,wallstreetbets,jj3o2s,2020-10-27 15:50,"Twitter, A Bird in a Bloodbath",https://www.reddit.com/r/wallstreetbets/comments/jj3o2s/twitter_a_bird_in_a_bloodbath/,2020-10-30 23:46,45,19,0.8
2th52,wallstreetbets,jj49y6,2020-10-27 16:21,"""The best historic day of the year for the stock market is tomorrow.""",https://i.redd.it/di32eaiuxnv51.png,2020-10-30 23:46,122,479,0.97
2th52,wallstreetbets,jj4bx0,2020-10-27 16:24,Which one of you fat cat tards just bet $1.65 million on OTM calls expiring this friday?,https://imgur.com/PouD7ia,2020-10-30 23:46,32,51,0.9
2th52,wallstreetbets,jj4h76,2020-10-27 16:31,"Ok, which one of you was it?",https://i.redd.it/4rqc7kwqznv51.jpg,2020-10-30 23:46,63,980,0.98
2th52,wallstreetbets,jj4sa5,2020-10-27 16:47,Market Manipulation 101: Why Stocks May Tank On Good Earnings,https://www.reddit.com/r/wallstreetbets/comments/jj4sa5/market_manipulation_101_why_stocks_may_tank_on/,2020-10-30 23:46,27,58,0.91
2th52,wallstreetbets,jj4u0a,2020-10-27 16:50,"Cyberpunk 2077 release on Nov 19, 2020. CD Projekt ($OTGLY)",https://www.reddit.com/r/wallstreetbets/comments/jj4u0a/cyberpunk_2077_release_on_nov_19_2020_cd_projekt/,2020-10-30 23:46,31,26,0.83
2th52,wallstreetbets,jj591z,2020-10-27 17:11,GME Information,https://www.reddit.com/r/wallstreetbets/comments/jj591z/gme_information/,2020-10-30 23:46,229,231,0.94
2th52,wallstreetbets,jj5knq,2020-10-27 17:28,I made it! 6 figures!,https://i.redd.it/n551mv1u9ov51.jpg,2020-10-30 23:46,924,12539,0.95
2th52,wallstreetbets,jj5neu,2020-10-27 17:31,UPS Earnings Beat?,https://www.reddit.com/r/wallstreetbets/comments/jj5neu/ups_earnings_beat/,2020-10-30 23:46,64,11,0.78
2th52,wallstreetbets,jj5tvf,2020-10-27 17:41,Washed up PRPL king - 2m position going to earnings.,https://i.redd.it/y7k1p5l5cov51.jpg,2020-10-30 23:46,31,59,0.89
2th52,wallstreetbets,jj5w8b,2020-10-27 17:44,A Monster gaming/trading/simulation PC just built. $CRSR stock has made me 25x that amount in two weeks. Corsair is my Tesla <3,https://www.reddit.com/gallery/jj5w8b,2020-10-30 23:46,152,716,0.92
2th52,wallstreetbets,jj60fz,2020-10-27 17:50,Why I’m Shorting $TSLA (don’t spam report 🤣),https://www.reddit.com/r/wallstreetbets/comments/jj60fz/why_im_shorting_tsla_dont_spam_report/,2020-10-30 23:46,46,15,0.63
2th52,wallstreetbets,jj6r0i,2020-10-27 18:27,How long AMD gotta stay diluted after this purchase?,https://www.reddit.com/r/wallstreetbets/comments/jj6r0i/how_long_amd_gotta_stay_diluted_after_this/,2020-10-30 23:46,25,10,0.73
2th52,wallstreetbets,jj6tf5,2020-10-27 18:30,HOLD THE LINE,https://i.redd.it/1momrxh1lov51.jpg,2020-10-30 23:46,27,49,0.84
2th52,wallstreetbets,jj6umz,2020-10-27 18:32,SCORPIO TANKERS TO THE MOON! CEO IS ONE OF US!,https://www.reddit.com/r/wallstreetbets/comments/jj6umz/scorpio_tankers_to_the_moon_ceo_is_one_of_us/,2020-10-30 23:46,39,20,0.81
2th52,wallstreetbets,jj70tk,2020-10-27 18:41,"Rare COVID kitty seen in AMD's weekly chart. I'm no Anal.Tech., but I'm pretty sure it means only pussies sell the day before GPU launch.",https://i.redd.it/ovd69g37mov51.png,2020-10-30 23:46,30,228,0.91
2th52,wallstreetbets,jj73v5,2020-10-27 18:45,Hold The Line On GME,https://www.reddit.com/r/wallstreetbets/comments/jj73v5/hold_the_line_on_gme/,2020-10-30 23:46,107,140,0.88
2th52,wallstreetbets,jj745a,2020-10-27 18:45,Election selloff is inevitable. People should expect to lose between 30 and 70% of value over the next few weeks. Change my mind.,https://www.reddit.com/r/wallstreetbets/comments/jj745a/election_selloff_is_inevitable_people_should/,2020-10-30 23:46,47,0,0.38
2th52,wallstreetbets,jj74s6,2020-10-27 18:46,Mercedes be like,https://i.redd.it/y20rhfftnov51.jpg,2020-10-30 23:46,28,272,0.95
2th52,wallstreetbets,jj7a0j,2020-10-27 18:53,Money to be made on Rocket (RKT),https://www.reddit.com/r/wallstreetbets/comments/jj7a0j/money_to_be_made_on_rocket_rkt/,2020-10-30 23:46,45,25,0.81
2th52,wallstreetbets,jj7ko9,2020-10-27 19:08,50k in one year,https://www.reddit.com/r/wallstreetbets/comments/jj7ko9/50k_in_one_year/,2020-10-30 23:46,24,80,0.88
2th52,wallstreetbets,jj7pkd,2020-10-27 19:14,I’ve wasted so much time and money on this shit show. BeCoMe FINANCIALLY FrEe,https://i.redd.it/idg12s9vsov51.jpg,2020-10-30 23:46,36,105,0.93
2th52,wallstreetbets,jj8apo,2020-10-27 19:43,Last chance for early bird pricing! $PLTR 🚀🚀🚀,https://www.reddit.com/r/wallstreetbets/comments/jj8apo/last_chance_for_early_bird_pricing_pltr/,2020-10-30 23:46,124,71,0.85
2th52,wallstreetbets,jj8fne,2020-10-27 19:50,When people ask me what $PLTR does,https://i.redd.it/wjjqfuh5zov51.png,2020-10-30 23:46,129,757,0.98
2th52,wallstreetbets,jj8h0o,2020-10-27 19:52,Tomorrow it will print 🤡,https://i.redd.it/8jxwh3xnzov51.jpg,2020-10-30 23:46,115,1152,0.98
2th52,wallstreetbets,jj8ovk,2020-10-27 20:03,Can someone explain to me why even though ups was flattish at the end of the day my calls lost 20% in like 1 minute ?,https://i.redd.it/nhmremjm1pv51.jpg,2020-10-30 23:46,31,4,0.62
2th52,wallstreetbets,jj8qq0,2020-10-27 20:06,"What Are Your Moves Tomorrow, October 28, 2020",https://www.reddit.com/r/wallstreetbets/comments/jj8qq0/what_are_your_moves_tomorrow_october_28_2020/,2020-10-30 23:46,14570,208,0.87
2th52,wallstreetbets,jj8xvp,2020-10-27 20:16,"Started trading Aug 28th, won big with the Nvidea GPU announcement, then Sept 2nd came. Managed to claw my way back even yoloing Tesla calls. Then paper handed when Trump tweeted no stimulus. Yolo’d SPY calls and GME calls yesterday. I’m officially retarded, bye bye house money",https://i.redd.it/yc963nku3pv51.jpg,2020-10-30 23:46,28,38,0.82
2th52,wallstreetbets,jj8ypd,2020-10-27 20:17,Microsoft Earnings - Beat,https://www.cnbc.com/2020/10/27/microsoft-msft-earnings-q1-2021.html,2020-10-30 23:46,36,39,0.9
2th52,wallstreetbets,jj90wm,2020-10-27 20:20,AMD Update: 50 Spreads $83.5/84 (Feelsbadman),https://www.reddit.com/r/wallstreetbets/comments/jj90wm/amd_update_50_spreads_83584_feelsbadman/,2020-10-30 23:46,23,11,0.75
2th52,wallstreetbets,jj9j5e,2020-10-27 20:45,How much have you lost?,https://v.redd.it/ozkvyfb49pv51,2020-10-30 23:46,20,112,0.93
2th52,wallstreetbets,jj9v4r,2020-10-27 21:02,When you are too retarded to remember the name of the sub,https://i.redd.it/yyte32i3cpv51.jpg,2020-10-30 23:46,39,1564,0.97
2th52,wallstreetbets,jjadz6,2020-10-27 21:29,Lol the SEC has a Robinhood referral link on their filings page. No other brokerage even gets a link to their home page,https://v.redd.it/y0awhhupgpv51,2020-10-30 23:46,21,229,0.96
2th52,wallstreetbets,jjb1yz,2020-10-27 22:04,Dodged that bullet,https://i.redd.it/8kvcfg13npv51.jpg,2020-10-30 23:46,32,569,0.97
2th52,wallstreetbets,jjb7rg,2020-10-27 22:12,"Bulls: ""bears are stupid because they try to time the top. Don't fight the trend morons."" Also bulls:",https://i.redd.it/9af2nlwhopv51.png,2020-10-30 23:46,101,1467,0.98
2th52,wallstreetbets,jjb8jk,2020-10-27 22:13,There's goes my dating life..,https://v.redd.it/6fu0pjlpopv51,2020-10-30 23:46,644,2912,0.97
2th52,wallstreetbets,jjbaix,2020-10-27 22:16,$PLTR CALLS BABY! #YOLO 4 LIFE! 🔥🔥🔥 ALL IN,https://v.redd.it/scun6yiappv51,2020-10-30 23:46,46,429,0.98
2th52,wallstreetbets,jjbnr2,2020-10-27 22:36,Novavax (NVAX) HUGE News,https://www.reddit.com/r/wallstreetbets/comments/jjbnr2/novavax_nvax_huge_news/,2020-10-30 23:46,36,24,0.83
2th52,wallstreetbets,jjc4ca,2020-10-27 23:01,Loss porn kinda well boys i started with 50 and ended with zero hopefully I’ve made you fellow retards happy.,https://i.redd.it/t0r75z0axpv51.jpg,2020-10-30 23:46,36,2,0.53
2th52,wallstreetbets,jjcej7,2020-10-27 23:17,Goodbye WSB,https://www.reddit.com/r/wallstreetbets/comments/jjcej7/goodbye_wsb/,2020-10-30 23:46,89,518,0.92
2th52,wallstreetbets,jjch4z,2020-10-27 23:21,HOG Shareholders Confused After Putting The “F” Back in FD.,https://i.redd.it/3b4xnexu0qv51.jpg,2020-10-30 23:46,40,184,0.98
2th52,wallstreetbets,jjclfx,2020-10-27 23:28,PRPL gang- PRPLW are being redeemed - Cashless basis,https://www.reddit.com/r/wallstreetbets/comments/jjclfx/prpl_gang_prplw_are_being_redeemed_cashless_basis/,2020-10-30 23:46,35,74,0.92
2th52,wallstreetbets,jjcpcs,2020-10-27 23:33,Nio Growth Stock $40 Per Share by 2021,https://i.redd.it/8lkmy0543qv51.jpg,2020-10-30 23:46,35,113,0.93
2th52,wallstreetbets,jjct1g,2020-10-27 23:40,"Hello, I am just checking if my fellow autist are ok with $MSFT which they beat earnings but went to shit....... Anyone? I just want $FB AND $AAPL to go up the moon.",https://www.reddit.com/r/wallstreetbets/comments/jjct1g/hello_i_am_just_checking_if_my_fellow_autist_are/,2020-10-30 23:46,35,10,0.79
2th52,wallstreetbets,jjctxg,2020-10-27 23:41,GME Squeeze and the Demise of Melvin Capital,https://streamable.com/jon3hc,2020-10-30 23:46,127,208,0.96
2th52,wallstreetbets,jjcv0s,2020-10-27 23:43,"Hi, my name is u/segfaultsarecool and I'm addicted to AMD shares and getting hurt by Lisa Su",https://i.redd.it/9jpyj7cr4qv51.jpg,2020-10-30 23:46,27,2,0.55
2th52,wallstreetbets,jjcvmb,2020-10-27 23:44,VXX Calls 6 Days Before Election Is Free Money,https://www.reddit.com/r/wallstreetbets/comments/jjcvmb/vxx_calls_6_days_before_election_is_free_money/,2020-10-30 23:46,28,14,0.7
2th52,wallstreetbets,jjcwjb,2020-10-27 23:45,UPS ALL IN - This is going to age well 🚀,https://i.redd.it/txtzlz375qv51.jpg,2020-10-30 23:46,266,58,0.87
2th52,wallstreetbets,jjd6ny,2020-10-28 00:01,WSBVoteBot Log for Oct 28 2020,https://www.reddit.com/r/wallstreetbets/comments/jjd6ny/wsbvotebot_log_for_oct_28_2020/,2020-10-30 23:46,32,5,0.78
2th52,wallstreetbets,jjdcm0,2020-10-28 00:11,Negative to 500% within 8 months of trading,https://v.redd.it/v3dtkijn9qv51,2020-10-30 23:46,26,76,0.92
2th52,wallstreetbets,jjdslo,2020-10-28 00:38,Peaked at $115k. I've always been weak at pulling out. Lost it on $HYLN,https://i.redd.it/1eu2f2qjeqv51.png,2020-10-30 23:46,52,139,0.96
2th52,wallstreetbets,jjf0vb,2020-10-28 01:53,Wild times boys.. wild times,https://v.redd.it/jodt27xwrqv51,2020-10-30 23:46,20,0,0.48
2th52,wallstreetbets,jjf80c,2020-10-28 02:06,When your friend asks why you went all in on AMD.,https://i.redd.it/xss9zwu8uqv51.jpg,2020-10-30 23:46,88,704,0.98
2th52,wallstreetbets,jjfg3k,2020-10-28 02:20,109 calls on RKT... expiring 11/6,https://www.reddit.com/r/wallstreetbets/comments/jjfg3k/109_calls_on_rkt_expiring_116/,2020-10-30 23:46,23,8,0.75
2th52,wallstreetbets,jjfjov,2020-10-28 02:26,Buying Calls immediately,https://i.redd.it/4k6cs3qwxqv51.jpg,2020-10-30 23:46,30,146,0.92
2th52,wallstreetbets,jjfk3w,2020-10-28 02:27,GME Nov. 20 PT $6 if you’re LUCKY,https://www.reddit.com/r/wallstreetbets/comments/jjfk3w/gme_nov_20_pt_6_if_youre_lucky/,2020-10-30 23:46,45,0,0.29
2th52,wallstreetbets,jjfmf0,2020-10-28 02:31,why are people saying that there's no chance of stimulus now,https://www.reddit.com/r/wallstreetbets/comments/jjfmf0/why_are_people_saying_that_theres_no_chance_of/,2020-10-30 23:46,37,0,0.35
2th52,wallstreetbets,jjfq0d,2020-10-28 02:37,NOKIA GANG,https://www.reddit.com/r/wallstreetbets/comments/jjfq0d/nokia_gang/,2020-10-30 23:46,22,35,0.95
2th52,wallstreetbets,jjfr66,2020-10-28 02:40,Recovered from 100k Corona Drop,https://i.redd.it/sfttp7ab0rv51.jpg,2020-10-30 23:46,31,219,0.94
2th52,wallstreetbets,jjfr95,2020-10-28 02:40,Guess who’s losing money tomorrow WOOO,https://i.imgur.com/a5ep1ZP.jpg,2020-10-30 23:46,452,16036,0.93
2th52,wallstreetbets,jjftd0,2020-10-28 02:44,"If Joe Biden does win and there is all this talk of him moving over 100% to clean and renewable energy such as solar and wind, I also believe this is the move it will either be US or China who will take the lead on this initiative what are some stocks that will boom",https://www.reddit.com/r/wallstreetbets/comments/jjftd0/if_joe_biden_does_win_and_there_is_all_this_talk/,2020-10-30 23:46,53,8,0.65
2th52,wallstreetbets,jjfuuz,2020-10-28 02:46,trading phliysophy,https://www.reddit.com/r/wallstreetbets/comments/jjfuuz/trading_phliysophy/,2020-10-30 23:46,24,0,0.38
2th52,wallstreetbets,jjg963,2020-10-28 03:13,GME YOLO ya bastids!!!! Destroyed my 15 years worth of carefully constructed investments & snowballed into this today for your amusement,https://i.redd.it/7p0728p86rv51.png,2020-10-30 23:46,119,215,0.92
2th52,wallstreetbets,jjgihi,2020-10-28 03:31,When you #YOLO on $SNAP and roll it into $FSLR (PineappleStocks),https://i.redd.it/719hvj4f9rv51.jpg,2020-10-30 23:46,22,32,0.8
2th52,wallstreetbets,jjgr32,2020-10-28 03:47,Comment in the daily thread inspired me,https://i.imgur.com/XNqS3AW.jpg,2020-10-30 23:46,37,1077,0.97
2th52,wallstreetbets,jjgy0k,2020-10-28 04:01,Morgan Stanley predicts Palantir will surge 31%,https://markets.businessinsider.com/news/stocks/palantir-stock-price-target-lifted-rapid-growth-potential-tech-analyst-2020-10-1029727818,2020-10-30 23:46,20,34,0.92
2th52,wallstreetbets,jjhfbd,2020-10-28 04:36,No More TSLA After Stimulus For Me,https://www.reddit.com/r/wallstreetbets/comments/jjhfbd/no_more_tsla_after_stimulus_for_me/,2020-10-30 23:46,36,5,0.55
2th52,wallstreetbets,jjhl4a,2020-10-28 04:49,ARK is our generations version of small cap crisis recovery stocks,https://www.reddit.com/r/wallstreetbets/comments/jjhl4a/ark_is_our_generations_version_of_small_cap/,2020-10-30 23:46,22,24,0.9
2th52,wallstreetbets,jjhsr3,2020-10-28 05:06,Just don’t lose hope...,https://v.redd.it/5xrl3f6cqrv51,2020-10-30 23:46,46,448,0.97
2th52,wallstreetbets,jjicnw,2020-10-28 05:53,Why was the creator of wallstreetbets removed as a mod?,https://www.reddit.com/r/wallstreetbets/comments/jjicnw/why_was_the_creator_of_wallstreetbets_removed_as/,2020-10-30 23:46,35,17,0.83
2th52,wallstreetbets,jjkrs4,2020-10-28 09:43,$SPY Forecast for rest of week,https://www.reddit.com/r/wallstreetbets/comments/jjkrs4/spy_forecast_for_rest_of_week/,2020-10-30 23:46,42,77,0.78
2th52,wallstreetbets,jjkuf7,2020-10-28 09:50,"Well they've been fucking us in the ass for this long, might as well announce it",https://imgur.com/ksHyNMs,2020-10-30 23:46,24,298,0.97
2th52,wallstreetbets,jjl2qm,2020-10-28 10:11,"Daily Discussion Thread for October 28, 2020",https://www.reddit.com/r/wallstreetbets/comments/jjl2qm/daily_discussion_thread_for_october_28_2020/,2020-10-30 23:46,22711,269,0.92
2th52,wallstreetbets,jjmcsl,2020-10-28 11:56,$TLT 166c 12/4,https://www.reddit.com/r/wallstreetbets/comments/jjmcsl/tlt_166c_124/,2020-10-30 23:46,26,15,0.79
2th52,wallstreetbets,jjmzkm,2020-10-28 12:41,Years of trading academy wasted,https://i.redd.it/5zyzl3clztv51.jpg,2020-10-30 23:46,605,16674,0.95
2th52,wallstreetbets,jjnred,2020-10-28 13:30,Official UPS Loss Porn Thread - Everyone Welcome!,https://www.reddit.com/r/wallstreetbets/comments/jjnred/official_ups_loss_porn_thread_everyone_welcome/,2020-10-30 23:46,190,274,0.95
2th52,wallstreetbets,jjnxp2,2020-10-28 13:41,Please clap,https://i.redd.it/5qohgbgaauv51.jpg,2020-10-30 23:46,121,1442,0.97
2th52,wallstreetbets,jjny5m,2020-10-28 13:42,Gain Porn to offset some of the Loss porn around here,https://www.reddit.com/r/wallstreetbets/comments/jjny5m/gain_porn_to_offset_some_of_the_loss_porn_around/,2020-10-30 23:46,28,102,0.96
2th52,wallstreetbets,jjo39t,2020-10-28 13:50,Polar bear is coming,https://i.redd.it/uojihy71auv51.jpg,2020-10-30 23:46,20,265,0.94
2th52,wallstreetbets,jjo3h6,2020-10-28 13:50,Down $50k on a ups earning yolo,https://i.redd.it/0f5q7i5ybuv51.jpg,2020-10-30 23:46,139,544,0.97
2th52,wallstreetbets,jjodt7,2020-10-28 14:07,Money isn’t real,https://www.reddit.com/r/wallstreetbets/comments/jjodt7/money_isnt_real/,2020-10-30 23:46,129,577,0.94
2th52,wallstreetbets,jjohhn,2020-10-28 14:13,$RKT Calls Going into Nov. 10th Earnings,https://www.reddit.com/r/wallstreetbets/comments/jjohhn/rkt_calls_going_into_nov_10th_earnings/,2020-10-30 23:46,20,45,0.93
2th52,wallstreetbets,jjohqi,2020-10-28 14:13,"Gamestop share price, and Playstation console cycles.",https://www.reddit.com/r/wallstreetbets/comments/jjohqi/gamestop_share_price_and_playstation_console/,2020-10-30 23:46,26,53,0.9
