Subreddit_ID,Subreddit_Name,Submission_ID,Submission_CreatedDate,Submission_Title,Submission_URL,Submission_LastFetched,Submission_NumComments,Submission_Score,Submission_UpvoteRatio
2qhhq,investing,jc8olb,2020-10-16 12:12,Daily Advice Thread - All basic help or advice questions must be posted here.,https://www.reddit.com/r/investing/comments/jc8olb/daily_advice_thread_all_basic_help_or_advice/,2020-10-30 23:45,62,16,0.75
2qhhq,investing,jc99wu,2020-10-16 12:54,European Brokers to trade US Options,https://www.reddit.com/r/investing/comments/jc99wu/european_brokers_to_trade_us_options/,2020-10-30 23:45,98,291,0.93
2qhhq,investing,jccqdx,2020-10-16 16:12,Can we get an academic Finance sub?,https://www.reddit.com/r/investing/comments/jccqdx/can_we_get_an_academic_finance_sub/,2020-10-30 23:45,67,130,0.8
2qhhq,investing,jcfz4u,2020-10-16 19:00,Nikola -15% on CEO's 'go it alone' comments,https://www.reddit.com/r/investing/comments/jcfz4u/nikola_15_on_ceos_go_it_alone_comments/,2020-10-30 23:45,42,107,0.93
2qhhq,investing,jcgv0o,2020-10-16 19:47,What is the truth behind the statement that very few people are able to beat the market?,https://www.reddit.com/r/investing/comments/jcgv0o/what_is_the_truth_behind_the_statement_that_very/,2020-10-30 23:45,172,206,0.89
2qhhq,investing,jch0jc,2020-10-16 19:56,Is there interest for DD focused sub?,https://www.reddit.com/r/investing/comments/jch0jc/is_there_interest_for_dd_focused_sub/,2020-10-30 23:45,144,843,0.94
2qhhq,investing,jcju75,2020-10-16 22:39,how will second covid wave affect the way you invest?,https://www.reddit.com/r/investing/comments/jcju75/how_will_second_covid_wave_affect_the_way_you/,2020-10-30 23:45,40,0,0.4
2qhhq,investing,jcknt8,2020-10-16 23:30,When is the stock market too high?,https://www.reddit.com/r/investing/comments/jcknt8/when_is_the_stock_market_too_high/,2020-10-30 23:45,43,4,0.61
2qhhq,investing,jcph3u,2020-10-17 05:18,S&P without tech 15 year performance,https://www.reddit.com/r/investing/comments/jcph3u/sp_without_tech_15_year_performance/,2020-10-30 23:45,66,101,0.96
2qhhq,investing,jcqp0s,2020-10-17 07:09,Why are people saying value investing is dead?,https://www.reddit.com/r/investing/comments/jcqp0s/why_are_people_saying_value_investing_is_dead/,2020-10-30 23:45,30,4,0.67
2qhhq,investing,jctvvl,2020-10-17 11:58,Value stocks in this environment,https://www.reddit.com/r/investing/comments/jctvvl/value_stocks_in_this_environment/,2020-10-30 23:45,46,8,0.67
2qhhq,investing,jcu1bj,2020-10-17 12:10,Daily Advice Thread - All basic help or advice questions must be posted here.,https://www.reddit.com/r/investing/comments/jcu1bj/daily_advice_thread_all_basic_help_or_advice/,2020-10-30 23:45,63,8,0.8
2qhhq,investing,jcvhon,2020-10-17 13:53,Good time to buy REITS,https://www.reddit.com/r/investing/comments/jcvhon/good_time_to_buy_reits/,2020-10-30 23:45,35,13,0.7
2qhhq,investing,jcvyel,2020-10-17 14:22,Tech’s Influence Over Markets Eclipses Dot-Com Bubble Peak,https://www.reddit.com/r/investing/comments/jcvyel/techs_influence_over_markets_eclipses_dotcom/,2020-10-30 23:45,303,919,0.89
2qhhq,investing,jcvzei,2020-10-17 14:23,"Bloomberg, Barron's, or Financial Times?",https://www.reddit.com/r/investing/comments/jcvzei/bloomberg_barrons_or_financial_times/,2020-10-30 23:45,27,31,0.84
2qhhq,investing,jcwuxf,2020-10-17 15:13,Zoom has grown +700% in the last 1 Year and +130% in the last 3 months . What other companies have shown similar growth?,https://www.reddit.com/r/investing/comments/jcwuxf/zoom_has_grown_700_in_the_last_1_year_and_130_in/,2020-10-30 23:45,109,63,0.82
2qhhq,investing,jcy3uj,2020-10-17 16:23,What is going on with msft?,https://www.reddit.com/r/investing/comments/jcy3uj/what_is_going_on_with_msft/,2020-10-30 23:45,30,0,0.33
2qhhq,investing,jd4nak,2020-10-17 22:33,Is Nio extremely overvalued?,https://www.reddit.com/r/investing/comments/jd4nak/is_nio_extremely_overvalued/,2020-10-30 23:45,100,40,0.7
2qhhq,investing,jd6tnt,2020-10-18 00:51,Why are analysts so influential?,https://www.reddit.com/r/investing/comments/jd6tnt/why_are_analysts_so_influential/,2020-10-30 23:45,30,13,0.71
2qhhq,investing,jd8xym,2020-10-18 03:15,What company would you like to see PSTH take public?,https://www.reddit.com/r/investing/comments/jd8xym/what_company_would_you_like_to_see_psth_take/,2020-10-30 23:45,40,25,0.8
2qhhq,investing,jd9zqv,2020-10-18 04:33,"Simple question, why hold a stock?",https://www.reddit.com/r/investing/comments/jd9zqv/simple_question_why_hold_a_stock/,2020-10-30 23:45,39,0,0.25
2qhhq,investing,jdckbm,2020-10-18 08:15,"Whats the point of broadly diversified portfolie, when there are ETFs?",https://www.reddit.com/r/investing/comments/jdckbm/whats_the_point_of_broadly_diversified_portfolie/,2020-10-30 23:45,285,620,0.92
2qhhq,investing,jdfae5,2020-10-18 12:12,Daily Advice Thread - All basic help or advice questions must be posted here.,https://www.reddit.com/r/investing/comments/jdfae5/daily_advice_thread_all_basic_help_or_advice/,2020-10-30 23:45,74,4,0.7
2qhhq,investing,jdgw9r,2020-10-18 14:06,Recommandations - next book to read,https://www.reddit.com/r/investing/comments/jdgw9r/recommandations_next_book_to_read/,2020-10-30 23:45,26,7,0.67
2qhhq,investing,jdhfz4,2020-10-18 14:42,"Why haven't commercial REITs or other real estate commercial real estate investments collapsed , after months of pandemic closures?",https://www.reddit.com/r/investing/comments/jdhfz4/why_havent_commercial_reits_or_other_real_estate/,2020-10-30 23:45,23,14,0.77
2qhhq,investing,jdhn0f,2020-10-18 14:54,Space investing?,https://www.reddit.com/r/investing/comments/jdhn0f/space_investing/,2020-10-30 23:45,69,61,0.78
2qhhq,investing,jdihc0,2020-10-18 15:44,DONT BUY PTON ... yet.,https://www.reddit.com/r/investing/comments/jdihc0/dont_buy_pton_yet/,2020-10-30 23:45,41,0,0.46
2qhhq,investing,jdki51,2020-10-18 17:37,"What does the community think about ARK ETFs? I am talking about ARKK, ARKW, ARKG, ARKQ and ARKF?",https://www.reddit.com/r/investing/comments/jdki51/what_does_the_community_think_about_ark_etfs_i_am/,2020-10-30 23:45,54,0,0.47
2qhhq,investing,jdlm9e,2020-10-18 18:38,Where do you look for news on stocks before they take off like Tesla and nio and Netflix,https://www.reddit.com/r/investing/comments/jdlm9e/where_do_you_look_for_news_on_stocks_before_they/,2020-10-30 23:45,42,5,0.59
2qhhq,investing,jdn0p4,2020-10-18 19:54,Elections and investing: What are you doing to prepare?,https://www.reddit.com/r/investing/comments/jdn0p4/elections_and_investing_what_are_you_doing_to/,2020-10-30 23:45,185,104,0.85
2qhhq,investing,jdofg3,2020-10-18 21:11,Post-Corona stocks to pick up,https://www.reddit.com/r/investing/comments/jdofg3/postcorona_stocks_to_pick_up/,2020-10-30 23:45,39,2,0.56
2qhhq,investing,jdopak,2020-10-18 21:27,Under what bull scenario will VOO outperform SPXL?,https://www.reddit.com/r/investing/comments/jdopak/under_what_bull_scenario_will_voo_outperform_spxl/,2020-10-30 23:45,40,18,0.76
2qhhq,investing,jdp2b2,2020-10-18 21:47,Good Return on Whisky Investment?,https://www.reddit.com/r/investing/comments/jdp2b2/good_return_on_whisky_investment/,2020-10-30 23:45,27,43,0.78
2qhhq,investing,jdpz0x,2020-10-18 22:40,I still struggle to get my head around this: AAPL worth more than the value of the top 100 UK companies (FTSE100) combined,https://www.reddit.com/r/investing/comments/jdpz0x/i_still_struggle_to_get_my_head_around_this_aapl/,2020-10-30 23:45,755,2070,0.96
2qhhq,investing,jdqe3i,2020-10-18 23:05,Is the decline of the post modern megacity/metropolis going to potentially open opportunities for the suburban markets?,https://www.reddit.com/r/investing/comments/jdqe3i/is_the_decline_of_the_post_modern/,2020-10-30 23:45,32,0,0.44
2qhhq,investing,jdrhqu,2020-10-19 00:15,Investing In Clean Energy Index Funds,https://www.reddit.com/r/investing/comments/jdrhqu/investing_in_clean_energy_index_funds/,2020-10-30 23:45,23,28,0.84
2qhhq,investing,je0jly,2020-10-19 12:17,Daily Advice Thread - All basic help or advice questions must be posted here.,https://www.reddit.com/r/investing/comments/je0jly/daily_advice_thread_all_basic_help_or_advice/,2020-10-30 23:45,108,16,0.79
2qhhq,investing,je2636,2020-10-19 14:01,Powell: Fed open to private sector collaboration in possible digital dollar,https://www.reddit.com/r/investing/comments/je2636/powell_fed_open_to_private_sector_collaboration/,2020-10-30 23:45,325,964,0.96
2qhhq,investing,je41ws,2020-10-19 15:44,How are actively managed ETF's considered ETF's?,https://www.reddit.com/r/investing/comments/je41ws/how_are_actively_managed_etfs_considered_etfs/,2020-10-30 23:45,21,19,0.66
2qhhq,investing,je4r65,2020-10-19 16:19,TSA Checkpoint Travel Numbers and Airline Stocks,https://www.reddit.com/r/investing/comments/je4r65/tsa_checkpoint_travel_numbers_and_airline_stocks/,2020-10-30 23:45,32,126,0.92
2qhhq,investing,je5yi1,2020-10-19 17:19,Millennials Driving Equities?,https://www.reddit.com/r/investing/comments/je5yi1/millennials_driving_equities/,2020-10-30 23:45,70,20,0.75
2qhhq,investing,je79dh,2020-10-19 18:21,"Despite Covid 2nd wave, Global Petroleum Demand in September 2020 was only down ~5% from the 2019 average. Calls for Peak Oil Demand are Premature?",https://www.reddit.com/r/investing/comments/je79dh/despite_covid_2nd_wave_global_petroleum_demand_in/,2020-10-30 23:45,56,58,0.84
2qhhq,investing,je7eu2,2020-10-19 18:28,Which cannabis stock is most positioned for success if weed becomes legalized in the US?,https://www.reddit.com/r/investing/comments/je7eu2/which_cannabis_stock_is_most_positioned_for/,2020-10-30 23:45,33,4,0.61
2qhhq,investing,je9zz5,2020-10-19 20:27,"Long term, are ETFs the future, and are mutual funds over?",https://www.reddit.com/r/investing/comments/je9zz5/long_term_are_etfs_the_future_and_are_mutual/,2020-10-30 23:45,50,49,0.8
2qhhq,investing,jeatqg,2020-10-19 21:06,Good timing to short inflated tech stocks?,https://www.reddit.com/r/investing/comments/jeatqg/good_timing_to_short_inflated_tech_stocks/,2020-10-30 23:45,33,0,0.5
2qhhq,investing,jebaye,2020-10-19 21:30,Overlapping ETF holdings. How to calculate total exposure to each stock?,https://www.reddit.com/r/investing/comments/jebaye/overlapping_etf_holdings_how_to_calculate_total/,2020-10-30 23:45,29,58,0.85
2qhhq,investing,jehryh,2020-10-20 03:37,Intel sells SSD bus. and NAND fab.,https://www.reddit.com/r/investing/comments/jehryh/intel_sells_ssd_bus_and_nand_fab/,2020-10-30 23:45,99,173,0.93
2qhhq,investing,jeo7re,2020-10-20 12:10,Daily Advice Thread - All basic help or advice questions must be posted here.,https://www.reddit.com/r/investing/comments/jeo7re/daily_advice_thread_all_basic_help_or_advice/,2020-10-30 23:45,87,11,0.87
2qhhq,investing,jeoqo3,2020-10-20 12:44,The US government plans to file antitrust charges against Google today,https://www.reddit.com/r/investing/comments/jeoqo3/the_us_government_plans_to_file_antitrust_charges/,2020-10-30 23:45,559,2119,0.98
2qhhq,investing,jetzjg,2020-10-20 17:16,Microsoft partners with SpaceX to connect Azure cloud to Starlink satellite internet,https://www.reddit.com/r/investing/comments/jetzjg/microsoft_partners_with_spacex_to_connect_azure/,2020-10-30 23:45,60,269,0.96
2qhhq,investing,jevybq,2020-10-20 18:49,Will Zoom decline after COVID?,https://www.reddit.com/r/investing/comments/jevybq/will_zoom_decline_after_covid/,2020-10-30 23:45,77,39,0.87
2qhhq,investing,jew880,2020-10-20 19:03,"Holding ~5% cash in my portfolio for a “rainy day” (eg, market correction). Arguments pro or con?",https://www.reddit.com/r/investing/comments/jew880/holding_5_cash_in_my_portfolio_for_a_rainy_day_eg/,2020-10-30 23:45,32,1,0.54
2qhhq,investing,jewivh,2020-10-20 19:18,"My compilation of 16 stocks with strong fundamentals and reasonable valuations: AMGN, ATVI, CHE, FSS, HWKN, ICE, JBHT, KMB, MANT, MRK, SNE, SNY, STE, UNH, VZ and WERN",https://www.reddit.com/r/investing/comments/jewivh/my_compilation_of_16_stocks_with_strong/,2020-10-30 23:45,34,110,0.86
2qhhq,investing,jewpbb,2020-10-20 19:27,How had NKLA not yet crashed? Lawsuit filed against by shareholders! Thoughts?,https://www.reddit.com/r/investing/comments/jewpbb/how_had_nkla_not_yet_crashed_lawsuit_filed/,2020-10-30 23:45,36,43,0.91
2qhhq,investing,jexvg7,2020-10-20 20:26,SNAP soars 16%+ after hours pushing it to market cap bigger than Twitter,https://www.reddit.com/r/investing/comments/jexvg7/snap_soars_16_after_hours_pushing_it_to_market/,2020-10-30 23:45,51,203,0.93
2qhhq,investing,jeyd2l,2020-10-20 20:52,"Netflix misses earnings (1.74 vs 2.14) and subscribers (2.2 vs 3.57) , beats on rev (6.44 vs 6.38)",https://www.reddit.com/r/investing/comments/jeyd2l/netflix_misses_earnings_174_vs_214_and/,2020-10-30 23:45,124,297,0.96
2qhhq,investing,jf46c0,2020-10-21 02:15,What to Expect from Tesla's Earnings tomorrow? Is it well poised for another Beat?,https://www.reddit.com/r/investing/comments/jf46c0/what_to_expect_from_teslas_earnings_tomorrow_is/,2020-10-30 23:45,53,42,0.89
2qhhq,investing,jf569h,2020-10-21 03:18,Is EA- Electronic Arts undervalued?,https://www.reddit.com/r/investing/comments/jf569h/is_ea_electronic_arts_undervalued/,2020-10-30 23:45,66,29,0.76
2qhhq,investing,jf91lu,2020-10-21 08:30,Junior Gold Mines... what do I need to know?,https://www.reddit.com/r/investing/comments/jf91lu/junior_gold_mines_what_do_i_need_to_know/,2020-10-30 23:45,32,0,0.43
2qhhq,investing,jfaosy,2020-10-21 11:00,Investing and inflection points,https://www.reddit.com/r/investing/comments/jfaosy/investing_and_inflection_points/,2020-10-30 23:45,21,9,0.69
2qhhq,investing,jfbm7x,2020-10-21 12:12,Daily Advice Thread - All basic help or advice questions must be posted here.,https://www.reddit.com/r/investing/comments/jfbm7x/daily_advice_thread_all_basic_help_or_advice/,2020-10-30 23:45,141,11,0.78
2qhhq,investing,jfc81k,2020-10-21 12:53,"PayPal to allow cryptocurrency buying, selling and shopping on its network",https://www.reddit.com/r/investing/comments/jfc81k/paypal_to_allow_cryptocurrency_buying_selling_and/,2020-10-30 23:45,715,2484,0.97
2qhhq,investing,jfdsai,2020-10-21 14:24,What are everyone's thoughts on the new QQQ ETFs?,https://www.reddit.com/r/investing/comments/jfdsai/what_are_everyones_thoughts_on_the_new_qqq_etfs/,2020-10-30 23:45,39,57,0.87
2qhhq,investing,jfg8m7,2020-10-21 16:30,Nokia (NYSE: NOK) - Internet for for Space - Huawei's European Replacement - A prime value investment?,https://www.reddit.com/r/investing/comments/jfg8m7/nokia_nyse_nok_internet_for_for_space_huaweis/,2020-10-30 23:45,21,41,0.85
2qhhq,investing,jfjbbk,2020-10-21 19:04,"What is the ""real-world value"" of stocks?",https://www.reddit.com/r/investing/comments/jfjbbk/what_is_the_realworld_value_of_stocks/,2020-10-30 23:45,45,11,0.69
2qhhq,investing,jfjdi5,2020-10-21 19:07,What sectors do you prefer to invest in?,https://www.reddit.com/r/investing/comments/jfjdi5/what_sectors_do_you_prefer_to_invest_in/,2020-10-30 23:45,31,7,0.69
2qhhq,investing,jfks8m,2020-10-21 20:18,Tesla crushes Q3 Earnings with record profits,https://www.reddit.com/r/investing/comments/jfks8m/tesla_crushes_q3_earnings_with_record_profits/,2020-10-30 23:45,276,520,0.92
2qhhq,investing,jfkux1,2020-10-21 20:22,What is the best defense sector company to invest in?,https://www.reddit.com/r/investing/comments/jfkux1/what_is_the_best_defense_sector_company_to_invest/,2020-10-30 23:45,73,15,0.68
2qhhq,investing,jfmcit,2020-10-21 21:41,Thoughts on the market in the months ahead,https://www.reddit.com/r/investing/comments/jfmcit/thoughts_on_the_market_in_the_months_ahead/,2020-10-30 23:45,37,15,0.73
2qhhq,investing,jfmkrm,2020-10-21 21:53,MSFT as a part of your stocks,https://www.reddit.com/r/investing/comments/jfmkrm/msft_as_a_part_of_your_stocks/,2020-10-30 23:45,30,42,0.77
2qhhq,investing,jfnzmo,2020-10-21 23:13,"Exxon Mobil to lay off employees citing tough markets, reorganization",https://www.reddit.com/r/investing/comments/jfnzmo/exxon_mobil_to_lay_off_employees_citing_tough/,2020-10-30 23:45,106,250,0.97
2qhhq,investing,jfp87q,2020-10-22 00:28,Square toast,https://www.reddit.com/r/investing/comments/jfp87q/square_toast/,2020-10-30 23:45,25,0,0.38
2qhhq,investing,jfqdz3,2020-10-22 01:39,Microsoft Azure partnering with spaceX,https://www.reddit.com/r/investing/comments/jfqdz3/microsoft_azure_partnering_with_spacex/,2020-10-30 23:45,28,50,0.83
2qhhq,investing,jfye7g,2020-10-22 12:09,Daily Advice Thread - All basic help or advice questions must be posted here.,https://www.reddit.com/r/investing/comments/jfye7g/daily_advice_thread_all_basic_help_or_advice/,2020-10-30 23:45,109,18,0.8
2qhhq,investing,jfza83,2020-10-22 13:08,Investing in Solar,https://www.reddit.com/r/investing/comments/jfza83/investing_in_solar/,2020-10-30 23:45,46,16,0.68
2qhhq,investing,jfzfyd,2020-10-22 13:17,New US jobless claims drop to lowest level since March - Financial Times,https://www.reddit.com/r/investing/comments/jfzfyd/new_us_jobless_claims_drop_to_lowest_level_since/,2020-10-30 23:45,145,868,0.95
2qhhq,investing,jg0zt0,2020-10-22 14:47,McAfee files for an estimated $2 billion IPO,https://www.reddit.com/r/investing/comments/jg0zt0/mcafee_files_for_an_estimated_2_billion_ipo/,2020-10-30 23:45,43,40,0.86
2qhhq,investing,jg3fuc,2020-10-22 16:52,Can we talk about Amazon?,https://www.reddit.com/r/investing/comments/jg3fuc/can_we_talk_about_amazon/,2020-10-30 23:45,71,21,0.75
2qhhq,investing,jg3h2x,2020-10-22 16:53,Anyone else us margin accounts to increase leverage/gains for investments?,https://www.reddit.com/r/investing/comments/jg3h2x/anyone_else_us_margin_accounts_to_increase/,2020-10-30 23:45,39,6,0.75
2qhhq,investing,jg49fb,2020-10-22 17:32,What do you guys think about Suncor Energy ($SU)?,https://www.reddit.com/r/investing/comments/jg49fb/what_do_you_guys_think_about_suncor_energy_su/,2020-10-30 23:45,26,17,0.79
2qhhq,investing,jg6wl0,2020-10-22 19:41,Morgan Stanley expects SpaceX will be a $100 billion company thanks to Starlink and Starship,https://www.reddit.com/r/investing/comments/jg6wl0/morgan_stanley_expects_spacex_will_be_a_100/,2020-10-30 23:45,216,578,0.96
2qhhq,investing,jg8emr,2020-10-22 20:55,Tesla bull cases,https://www.reddit.com/r/investing/comments/jg8emr/tesla_bull_cases/,2020-10-30 23:45,24,0,0.48
2qhhq,investing,jg8jst,2020-10-22 21:02,Intel stock plunges 10% after data-center sales drop more than expected,https://www.reddit.com/r/investing/comments/jg8jst/intel_stock_plunges_10_after_datacenter_sales/,2020-10-30 23:45,439,1424,0.98
2qhhq,investing,jg9vjg,2020-10-22 22:10,"CRISPR: The four public companies EDIT, NTLA, CRSP and BEAM",https://www.reddit.com/r/investing/comments/jg9vjg/crispr_the_four_public_companies_edit_ntla_crsp/,2020-10-30 23:45,31,64,0.88
2qhhq,investing,jgfo6o,2020-10-23 03:59,Is TLT a good long term(lifetime) investment and can someone explain it like I'm 5?,https://www.reddit.com/r/investing/comments/jgfo6o/is_tlt_a_good_long_termlifetime_investment_and/,2020-10-30 23:45,31,7,0.71
2qhhq,investing,jgjrjv,2020-10-23 09:19,Germany‘s reputation as business and investment location among US companies keeps rising,https://www.reddit.com/r/investing/comments/jgjrjv/germanys_reputation_as_business_and_investment/,2020-10-30 23:45,53,23,0.7
2qhhq,investing,jgk4ng,2020-10-23 09:50,Future Of Oil:The Possibilities Of The Inverese Of Public Perception,https://www.reddit.com/r/investing/comments/jgk4ng/future_of_oilthe_possibilities_of_the_inverese_of/,2020-10-30 23:45,49,4,0.58
2qhhq,investing,jgkp92,2020-10-23 10:39,"'PayPal in Talks to Buy Crypto Firms Including BitGo', Paypal Seem to be going deeper on Crypto than first thought.",https://www.reddit.com/r/investing/comments/jgkp92/paypal_in_talks_to_buy_crypto_firms_including/,2020-10-30 23:45,295,1161,0.96
2qhhq,investing,jglx8c,2020-10-23 12:12,Daily Advice Thread - All basic help or advice questions must be posted here.,https://www.reddit.com/r/investing/comments/jglx8c/daily_advice_thread_all_basic_help_or_advice/,2020-10-30 23:45,89,7,0.74
2qhhq,investing,jgsvdw,2020-10-23 18:31,Are there any studies of the performance of investors who bought and held stocks for 10+ years vs the market?,https://www.reddit.com/r/investing/comments/jgsvdw/are_there_any_studies_of_the_performance_of/,2020-10-30 23:45,34,30,0.82
2qhhq,investing,jgu4e0,2020-10-23 19:36,SNAP price alert,https://www.reddit.com/r/investing/comments/jgu4e0/snap_price_alert/,2020-10-30 23:45,22,0,0.31
2qhhq,investing,jgws4q,2020-10-23 21:59,"SNAP is the next big ""social media"" stock - here's why",https://www.reddit.com/r/investing/comments/jgws4q/snap_is_the_next_big_social_media_stock_heres_why/,2020-10-30 23:45,35,0,0.39
2qhhq,investing,jgx0g9,2020-10-23 22:11,What are some similarities/differences in how you first started investing vs now?,https://www.reddit.com/r/investing/comments/jgx0g9/what_are_some_similaritiesdifferences_in_how_you/,2020-10-30 23:45,89,20,0.82
2qhhq,investing,jgxm6l,2020-10-23 22:45,Opinions on Municipal Bonds?,https://www.reddit.com/r/investing/comments/jgxm6l/opinions_on_municipal_bonds/,2020-10-30 23:45,31,23,0.81
2qhhq,investing,jgz0cy,2020-10-24 00:10,Clean Energy ETFs - ICLN vs. QCLN vs. PBW - Investing for future growth - An in-depth comparison.,https://www.reddit.com/r/investing/comments/jgz0cy/clean_energy_etfs_icln_vs_qcln_vs_pbw_investing/,2020-10-30 23:45,83,764,0.95
2qhhq,investing,jh13e4,2020-10-24 02:29,Why do stocks fall after good earnings?,https://www.reddit.com/r/investing/comments/jh13e4/why_do_stocks_fall_after_good_earnings/,2020-10-30 23:45,23,0,0.5
2qhhq,investing,jh452a,2020-10-24 06:23,"What is the best platform to invest into this thing, bitcoin?",https://www.reddit.com/r/investing/comments/jh452a/what_is_the_best_platform_to_invest_into_this/,2020-10-30 23:45,50,4,0.56
2qhhq,investing,jh4bap,2020-10-24 06:38,Best and most affordable ways to invest into Gold?,https://www.reddit.com/r/investing/comments/jh4bap/best_and_most_affordable_ways_to_invest_into_gold/,2020-10-30 23:45,25,5,0.62
2qhhq,investing,jh7v4y,2020-10-24 12:10,Daily Advice Thread - All basic help or advice questions must be posted here.,https://www.reddit.com/r/investing/comments/jh7v4y/daily_advice_thread_all_basic_help_or_advice/,2020-10-30 23:45,58,11,0.84
2qhhq,investing,jh8d2z,2020-10-24 12:49,"Fed Cements Dollar Dominance, Fueling Record Overseas Borrowing",https://www.reddit.com/r/investing/comments/jh8d2z/fed_cements_dollar_dominance_fueling_record/,2020-10-30 23:45,51,48,0.83
2qhhq,investing,jh9wj2,2020-10-24 14:32,"I’ve read and heard all the reasons why INTC should be sold. However, for the sake of contrarianism, can I hear arguments to why people should consider buying INTC at this level? INTC $48 with a PE ratio 9.",https://www.reddit.com/r/investing/comments/jh9wj2/ive_read_and_heard_all_the_reasons_why_intc/,2020-10-30 23:45,303,544,0.94
2qhhq,investing,jhafsz,2020-10-24 15:05,Does Buffett advice still hold true???,https://www.reddit.com/r/investing/comments/jhafsz/does_buffett_advice_still_hold_true/,2020-10-30 23:45,25,7,0.62
2qhhq,investing,jhcoi4,2020-10-24 17:16,How to invest into into energy storage?,https://www.reddit.com/r/investing/comments/jhcoi4/how_to_invest_into_into_energy_storage/,2020-10-30 23:45,29,1,0.57
2qhhq,investing,jheltn,2020-10-24 19:05,Any thoughts on Intel (INTC),https://www.reddit.com/r/investing/comments/jheltn/any_thoughts_on_intel_intc/,2020-10-30 23:45,30,2,0.55
2qhhq,investing,jhfei4,2020-10-24 19:50,AAPL: Should I be worried about the Google antitrust lawsuit's focus on their $8B payment for default search placement on the iPhone?,https://www.reddit.com/r/investing/comments/jhfei4/aapl_should_i_be_worried_about_the_google/,2020-10-30 23:45,47,36,0.89
2qhhq,investing,jhixp6,2020-10-24 23:17,100% VTI in your Twenties?,https://www.reddit.com/r/investing/comments/jhixp6/100_vti_in_your_twenties/,2020-10-30 23:45,89,45,0.89
2qhhq,investing,jhjcjl,2020-10-24 23:43,"I see a market opportunity, but I am unsure how to act on it/ capitalize",https://www.reddit.com/r/investing/comments/jhjcjl/i_see_a_market_opportunity_but_i_am_unsure_how_to/,2020-10-30 23:45,38,2,0.54
2qhhq,investing,jhl6va,2020-10-25 01:47,Solar vs Wind. Is it time to jump into wind or will solar continue to dominate?,https://www.reddit.com/r/investing/comments/jhl6va/solar_vs_wind_is_it_time_to_jump_into_wind_or/,2020-10-30 23:45,74,71,0.91
2qhhq,investing,jhofgz,2020-10-25 05:53,"Aside from companies like Tesla, Square, Amazon and Microsoft what other companies do you think are currently the most innovative today?",https://www.reddit.com/r/investing/comments/jhofgz/aside_from_companies_like_tesla_square_amazon_and/,2020-10-30 23:45,584,944,0.93
2qhhq,investing,jhp224,2020-10-25 06:50,Any real reason to diversify outside VOO?,https://www.reddit.com/r/investing/comments/jhp224/any_real_reason_to_diversify_outside_voo/,2020-10-30 23:45,28,0,0.5
2qhhq,investing,jhs3jx,2020-10-25 11:48,US FED Debt Buries Past $7 Trillion...,https://www.reddit.com/r/investing/comments/jhs3jx/us_fed_debt_buries_past_7_trillion/,2020-10-30 23:45,71,0,0.47
2qhhq,investing,jhsbta,2020-10-25 12:08,Gun stocks in near future?,https://www.reddit.com/r/investing/comments/jhsbta/gun_stocks_in_near_future/,2020-10-30 23:45,35,0,0.47
2qhhq,investing,jhsd4p,2020-10-25 12:11,Daily Advice Thread - All basic help or advice questions must be posted here.,https://www.reddit.com/r/investing/comments/jhsd4p/daily_advice_thread_all_basic_help_or_advice/,2020-10-30 23:45,66,8,0.68
2qhhq,investing,jhsuds,2020-10-25 12:51,Are residential REIT returns similar to personal property investing?,https://www.reddit.com/r/investing/comments/jhsuds/are_residential_reit_returns_similar_to_personal/,2020-10-30 23:45,86,36,0.78
2qhhq,investing,jhvbxu,2020-10-25 15:37,Where would you suggest I invest if I believe that electric cars will be the norm of the future?,https://www.reddit.com/r/investing/comments/jhvbxu/where_would_you_suggest_i_invest_if_i_believe/,2020-10-30 23:45,46,7,0.62
