Subreddit_ID,Subreddit_Name,Submission_ID,Submission_CreatedDate,Submission_Title,Submission_URL,Submission_LastFetched,Submission_NumComments,Submission_Score,Submission_UpvoteRatio
2qjfk,stocks,jbrqt6,2020-10-15 17:10,At what point are you planning to buy more DKNG?,https://www.reddit.com/r/stocks/comments/jbrqt6/at_what_point_are_you_planning_to_buy_more_dkng/,2020-10-30 23:45,50,22,0.87
2qjfk,stocks,jbs73f,2020-10-15 17:33,Tattooed Chef (TTCF) IPO,https://www.reddit.com/r/stocks/comments/jbs73f/tattooed_chef_ttcf_ipo/,2020-10-30 23:45,25,18,0.83
2qjfk,stocks,jbsmzv,2020-10-15 17:55,PTON (Peloton) Market Capital,https://www.reddit.com/r/stocks/comments/jbsmzv/pton_peloton_market_capital/,2020-10-30 23:45,32,6,0.76
2qjfk,stocks,jbuji7,2020-10-15 19:33,Tesla Gigafactory Berlin water shut off for not paying water bill.,https://www.reddit.com/r/stocks/comments/jbuji7/tesla_gigafactory_berlin_water_shut_off_for_not/,2020-10-30 23:45,73,198,0.91
2qjfk,stocks,jbvpw9,2020-10-15 20:34,What are your guys thought son $ARKF?,https://www.reddit.com/r/stocks/comments/jbvpw9/what_are_your_guys_thought_son_arkf/,2020-10-30 23:45,30,40,0.91
2qjfk,stocks,jbvw1q,2020-10-15 20:43,Thoughts on $NIU - Chinese Electric Scooter manufacturer?,https://www.reddit.com/r/stocks/comments/jbvw1q/thoughts_on_niu_chinese_electric_scooter/,2020-10-30 23:45,26,13,0.75
2qjfk,stocks,jbw3lp,2020-10-15 20:54,Thoughts on BABA?,https://www.reddit.com/r/stocks/comments/jbw3lp/thoughts_on_baba/,2020-10-30 23:45,34,28,0.85
2qjfk,stocks,jbwdh4,2020-10-15 21:09,Roughly 1k a month what would you do?,https://www.reddit.com/r/stocks/comments/jbwdh4/roughly_1k_a_month_what_would_you_do/,2020-10-30 23:45,81,31,0.81
2qjfk,stocks,jbwnpo,2020-10-15 21:25,"Akamai, Fastly, Net...who will be the cloud winner? long term and short term",https://www.reddit.com/r/stocks/comments/jbwnpo/akamai_fastly_netwho_will_be_the_cloud_winner/,2020-10-30 23:45,33,26,0.9
2qjfk,stocks,jbwreg,2020-10-15 21:31,"Curious as to what stocks you're currently under in, but doubling down",https://www.reddit.com/r/stocks/comments/jbwreg/curious_as_to_what_stocks_youre_currently_under/,2020-10-30 23:45,26,3,0.8
2qjfk,stocks,jbx0fr,2020-10-15 21:45,"Here is a Market Recap for today Thurs, Oct 15, 2020. Please enjoy!",https://www.reddit.com/r/stocks/comments/jbx0fr/here_is_a_market_recap_for_today_thurs_oct_15/,2020-10-30 23:45,42,477,0.97
2qjfk,stocks,jbxlv5,2020-10-15 22:19,Best stocks under $50?,https://www.reddit.com/r/stocks/comments/jbxlv5/best_stocks_under_50/,2020-10-30 23:45,48,12,0.78
2qjfk,stocks,jbzafr,2020-10-16 00:02,Wait for Apple and amazon to drop or buy now?,https://www.reddit.com/r/stocks/comments/jbzafr/wait_for_apple_and_amazon_to_drop_or_buy_now/,2020-10-30 23:45,23,7,0.66
2qjfk,stocks,jbzcw8,2020-10-16 00:06,How many stocks do you usually get? I know this depends on each persons ability to invest that amount,https://www.reddit.com/r/stocks/comments/jbzcw8/how_many_stocks_do_you_usually_get_i_know_this/,2020-10-30 23:45,22,5,0.65
2qjfk,stocks,jc1a08,2020-10-16 02:15,"thinking of selling APPL and buying NIO, does it makes sense?",https://www.reddit.com/r/stocks/comments/jc1a08/thinking_of_selling_appl_and_buying_nio_does_it/,2020-10-30 23:45,30,7,0.69
2qjfk,stocks,jc3efi,2020-10-16 04:38,Stocks like CCL (COVID destroyed) like gold?,https://www.reddit.com/r/stocks/comments/jc3efi/stocks_like_ccl_covid_destroyed_like_gold/,2020-10-30 23:45,54,20,0.82
2qjfk,stocks,jc4489,2020-10-16 05:33,What you guys think about NIO?,https://www.reddit.com/r/stocks/comments/jc4489/what_you_guys_think_about_nio/,2020-10-30 23:45,119,53,0.83
2qjfk,stocks,jc5fln,2020-10-16 07:22,What's your potential tenbagger?,https://www.reddit.com/r/stocks/comments/jc5fln/whats_your_potential_tenbagger/,2020-10-30 23:45,73,31,0.86
2qjfk,stocks,jc5xjv,2020-10-16 08:06,"r/Stocks Daily Discussion & Fundamentals Friday Oct 16, 2020",https://www.reddit.com/r/stocks/comments/jc5xjv/rstocks_daily_discussion_fundamentals_friday_oct/,2020-10-30 23:45,333,19,0.89
2qjfk,stocks,jc6mbv,2020-10-16 09:10,HEADS UP: Eargo ($EAR) launches their IPO today.,https://www.reddit.com/r/stocks/comments/jc6mbv/heads_up_eargo_ear_launches_their_ipo_today/,2020-10-30 23:45,40,19,0.85
2qjfk,stocks,jc8o9i,2020-10-16 12:11,"Remdesivir 'has little or no effect' on survival, says WHO",https://www.reddit.com/r/stocks/comments/jc8o9i/remdesivir_has_little_or_no_effect_on_survival/,2020-10-30 23:45,184,1240,0.92
2qjfk,stocks,jc8oa8,2020-10-16 12:11,"Chinese electric-car bellwether marque Nio narrows gap with Tesla, in sign domestic rivals are gaining ground on US giant",https://www.reddit.com/r/stocks/comments/jc8oa8/chinese_electriccar_bellwether_marque_nio_narrows/,2020-10-30 23:45,151,310,0.93
2qjfk,stocks,jccs2j,2020-10-16 16:14,"GameStop to profit for every digital sale from ""their"" Xbox consoles",https://www.reddit.com/r/stocks/comments/jccs2j/gamestop_to_profit_for_every_digital_sale_from/,2020-10-30 23:45,24,28,0.86
2qjfk,stocks,jce2ei,2020-10-16 17:22,The reason for Fastly reduced usage.,https://www.reddit.com/r/stocks/comments/jce2ei/the_reason_for_fastly_reduced_usage/,2020-10-30 23:45,24,15,0.94
2qjfk,stocks,jce2lo,2020-10-16 17:22,ZOOM TO THE DOOM. Why long $ZM has become a pandemic of the investing world.,https://www.reddit.com/r/stocks/comments/jce2lo/zoom_to_the_doom_why_long_zm_has_become_a/,2020-10-30 23:45,36,50,0.87
2qjfk,stocks,jce3kr,2020-10-16 17:24,"If you had $10,000 to invest which clean energy ETF would you invest in and why?",https://www.reddit.com/r/stocks/comments/jce3kr/if_you_had_10000_to_invest_which_clean_energy_etf/,2020-10-30 23:45,34,20,0.86
2qjfk,stocks,jcekpt,2020-10-16 17:49,What’s your biggest regret stock trading?,https://www.reddit.com/r/stocks/comments/jcekpt/whats_your_biggest_regret_stock_trading/,2020-10-30 23:45,590,252,0.95
2qjfk,stocks,jceq7f,2020-10-16 17:57,"Buy Nio Stock, Analysts Keep Saying. Why One Calls It 'a Long Term Winner.'",https://www.reddit.com/r/stocks/comments/jceq7f/buy_nio_stock_analysts_keep_saying_why_one_calls/,2020-10-30 23:45,30,26,0.83
2qjfk,stocks,jcevkz,2020-10-16 18:05,Cheap stocks that are a good buy for the long term,https://www.reddit.com/r/stocks/comments/jcevkz/cheap_stocks_that_are_a_good_buy_for_the_long_term/,2020-10-30 23:45,29,4,0.62
2qjfk,stocks,jcgq7n,2020-10-16 19:40,Peix earnings Nov 5. What are your thoughts?,https://www.reddit.com/r/stocks/comments/jcgq7n/peix_earnings_nov_5_what_are_your_thoughts/,2020-10-30 23:45,20,10,0.87
2qjfk,stocks,jcgukf,2020-10-16 19:46,What is the truth behind the statement that very few people are able to beat the market?,https://www.reddit.com/r/stocks/comments/jcgukf/what_is_the_truth_behind_the_statement_that_very/,2020-10-30 23:45,36,32,0.77
2qjfk,stocks,jcif6r,2020-10-16 21:19,I own a bit under 150 shares of Cineworld. Is that a good idea??,https://www.reddit.com/r/stocks/comments/jcif6r/i_own_a_bit_under_150_shares_of_cineworld_is_that/,2020-10-30 23:45,25,0,0.5
2qjfk,stocks,jcjg9x,2020-10-16 22:15,"30 y/o, just starting, looking for advice",https://www.reddit.com/r/stocks/comments/jcjg9x/30_yo_just_starting_looking_for_advice/,2020-10-30 23:45,37,12,0.73
2qjfk,stocks,jck2wk,2020-10-16 22:54,Amazon’s Prime Day sales jumped 36%—signaling a blockbuster holiday for e-commerce,https://www.reddit.com/r/stocks/comments/jck2wk/amazons_prime_day_sales_jumped_36signaling_a/,2020-10-30 23:45,41,42,0.84
2qjfk,stocks,jcly1l,2020-10-17 00:55,How does this subreddit feel about day trading?,https://www.reddit.com/r/stocks/comments/jcly1l/how_does_this_subreddit_feel_about_day_trading/,2020-10-30 23:45,37,1,0.67
2qjfk,stocks,jcm118,2020-10-17 01:00,Ark Cathie wood bought Douyu/huya 3 days in a row,https://www.reddit.com/r/stocks/comments/jcm118/ark_cathie_wood_bought_douyuhuya_3_days_in_a_row/,2020-10-30 23:45,69,25,0.86
2qjfk,stocks,jcmvep,2020-10-17 01:59,"AT&T (NYSE: T) - An excellent opportunity for Dividend Investors, or those looking to start.",https://www.reddit.com/r/stocks/comments/jcmvep/att_nyse_t_an_excellent_opportunity_for_dividend/,2020-10-30 23:45,249,605,0.89
2qjfk,stocks,jco5up,2020-10-17 03:35,Investing in self vs 401k,https://www.reddit.com/r/stocks/comments/jco5up/investing_in_self_vs_401k/,2020-10-30 23:45,23,0,0.44
2qjfk,stocks,jco6s9,2020-10-17 03:36,What’s y’all price prediction for HYLN next week?,https://www.reddit.com/r/stocks/comments/jco6s9/whats_yall_price_prediction_for_hyln_next_week/,2020-10-30 23:45,23,3,0.62
2qjfk,stocks,jcoyfl,2020-10-17 04:36,"If you can only pick 5 out of 12 stocks to invest long term, which 5 would you pick?",https://www.reddit.com/r/stocks/comments/jcoyfl/if_you_can_only_pick_5_out_of_12_stocks_to_invest/,2020-10-30 23:45,27,0,0.5
2qjfk,stocks,jcr1h7,2020-10-17 07:42,5 Year etf investment,https://www.reddit.com/r/stocks/comments/jcr1h7/5_year_etf_investment/,2020-10-30 23:45,21,22,0.85
2qjfk,stocks,jcsfwh,2020-10-17 09:54,"Cloudflare ""One more thing"" event! Buckle up boys!",https://www.reddit.com/r/stocks/comments/jcsfwh/cloudflare_one_more_thing_event_buckle_up_boys/,2020-10-30 23:45,40,179,0.96
2qjfk,stocks,jctd53,2020-10-17 11:14,AMD and future growth,https://www.reddit.com/r/stocks/comments/jctd53/amd_and_future_growth/,2020-10-30 23:45,275,390,0.96
2qjfk,stocks,jcujt8,2020-10-17 12:49,Too stupid to invest now?,https://www.reddit.com/r/stocks/comments/jcujt8/too_stupid_to_invest_now/,2020-10-30 23:45,130,19,0.72
2qjfk,stocks,jcv9ae,2020-10-17 13:38,"Bagholding AAPL, need advice",https://www.reddit.com/r/stocks/comments/jcv9ae/bagholding_aapl_need_advice/,2020-10-30 23:45,24,0,0.15
2qjfk,stocks,jcwwjg,2020-10-17 15:16,Hertz,https://www.reddit.com/r/stocks/comments/jcwwjg/hertz/,2020-10-30 23:45,48,16,0.68
2qjfk,stocks,jcxenh,2020-10-17 15:44,AMC Entertainment (NYSE: AMC) vs. Cinemark (NYSE: CNK) - An upside comparison and the future for traditional Movie Theaters,https://www.reddit.com/r/stocks/comments/jcxenh/amc_entertainment_nyse_amc_vs_cinemark_nyse_cnk/,2020-10-30 23:45,67,117,0.91
2qjfk,stocks,jcxiin,2020-10-17 15:50,I am trying to understand options trading. And I was wondering if buying a put and selling a call isn't a very safe strategy?,https://www.reddit.com/r/stocks/comments/jcxiin/i_am_trying_to_understand_options_trading_and_i/,2020-10-30 23:45,56,108,0.86
2qjfk,stocks,jczh3d,2020-10-17 17:37,All ETF Portfolio,https://www.reddit.com/r/stocks/comments/jczh3d/all_etf_portfolio/,2020-10-30 23:45,26,33,0.84
2qjfk,stocks,jd1ajf,2020-10-17 19:18,iPhone price wars are back as carriers compete for 5G customers,https://www.reddit.com/r/stocks/comments/jd1ajf/iphone_price_wars_are_back_as_carriers_compete/,2020-10-30 23:45,205,1194,0.98
2qjfk,stocks,jd3m9n,2020-10-17 21:31,Intel vs NVDA?,https://www.reddit.com/r/stocks/comments/jd3m9n/intel_vs_nvda/,2020-10-30 23:45,29,9,0.81
2qjfk,stocks,jd4orf,2020-10-17 22:36,"Ultimate pump for the hottest stocks. EVs, solar, hydrogen, charging stations, batteries, etc......",https://www.reddit.com/r/stocks/comments/jd4orf/ultimate_pump_for_the_hottest_stocks_evs_solar/,2020-10-30 23:45,31,18,0.75
2qjfk,stocks,jd5jm7,2020-10-17 23:28,"Got 10k on hand, suggestions to hold or buy some other stocks?",https://www.reddit.com/r/stocks/comments/jd5jm7/got_10k_on_hand_suggestions_to_hold_or_buy_some/,2020-10-30 23:45,31,2,0.6
2qjfk,stocks,jd8kgt,2020-10-18 02:49,Airbnb IPO,https://www.reddit.com/r/stocks/comments/jd8kgt/airbnb_ipo/,2020-10-30 23:45,30,12,0.77
2qjfk,stocks,jd916n,2020-10-18 03:22,"I bought $53,000 of NIO at $21.83.",https://www.reddit.com/r/stocks/comments/jd916n/i_bought_53000_of_nio_at_2183/,2020-10-30 23:45,227,116,0.8
2qjfk,stocks,jddjqd,2020-10-18 09:42,Shorting Hertz?,https://www.reddit.com/r/stocks/comments/jddjqd/shorting_hertz/,2020-10-30 23:45,47,11,0.76
2qjfk,stocks,jddx84,2020-10-18 10:16,"AMZN, MSFT and GOOG",https://www.reddit.com/r/stocks/comments/jddx84/amzn_msft_and_goog/,2020-10-30 23:45,75,35,0.76
2qjfk,stocks,jded08,2020-10-18 10:54,ICLN vs IQQH,https://www.reddit.com/r/stocks/comments/jded08/icln_vs_iqqh/,2020-10-30 23:45,46,41,0.87
2qjfk,stocks,jdf4gn,2020-10-18 11:59,I have 40k saved that I want to invest in stocks but not sure the best way to do so.,https://www.reddit.com/r/stocks/comments/jdf4gn/i_have_40k_saved_that_i_want_to_invest_in_stocks/,2020-10-30 23:45,43,2,0.56
2qjfk,stocks,jdgsku,2020-10-18 13:59,Diversify into non-tech,https://www.reddit.com/r/stocks/comments/jdgsku/diversify_into_nontech/,2020-10-30 23:45,21,6,0.72
2qjfk,stocks,jdgt4b,2020-10-18 14:00,"The US Presidential Election, what to expect?",https://www.reddit.com/r/stocks/comments/jdgt4b/the_us_presidential_election_what_to_expect/,2020-10-30 23:45,25,0,0.33
2qjfk,stocks,jdhopu,2020-10-18 14:57,Albertsons Companies (ACI) upcoming Q2 earnings - Revised take on their expected performance and potential for long term growth.,https://www.reddit.com/r/stocks/comments/jdhopu/albertsons_companies_aci_upcoming_q2_earnings/,2020-10-30 23:45,46,59,0.85
2qjfk,stocks,jdhvex,2020-10-18 15:08,effect of decriminalization of cannabis on a federal level on cannabis businesses?,https://www.reddit.com/r/stocks/comments/jdhvex/effect_of_decriminalization_of_cannabis_on_a/,2020-10-30 23:45,24,5,0.78
2qjfk,stocks,jdjm8n,2020-10-18 16:48,"Blink Charging (NASDAQ: BLNK) - EV Charging - The Future ""Gas Station"" - Building alongside the EV Hype.",https://www.reddit.com/r/stocks/comments/jdjm8n/blink_charging_nasdaq_blnk_ev_charging_the_future/,2020-10-30 23:45,28,37,0.81
2qjfk,stocks,jdkdu8,2020-10-18 17:31,Any thoughts on these oil/gas companies?,https://www.reddit.com/r/stocks/comments/jdkdu8/any_thoughts_on_these_oilgas_companies/,2020-10-30 23:45,45,2,0.67
2qjfk,stocks,jdkegb,2020-10-18 17:32,Gamestop (GME) thoughts,https://www.reddit.com/r/stocks/comments/jdkegb/gamestop_gme_thoughts/,2020-10-30 23:45,33,14,0.86
2qjfk,stocks,jdkyl5,2020-10-18 18:02,Peloton (PTON),https://www.reddit.com/r/stocks/comments/jdkyl5/peloton_pton/,2020-10-30 23:45,54,26,0.73
2qjfk,stocks,jdmxne,2020-10-18 19:49,Way Out of the Workforce,https://www.reddit.com/r/stocks/comments/jdmxne/way_out_of_the_workforce/,2020-10-30 23:45,33,0,0.5
2qjfk,stocks,jdnq8r,2020-10-18 20:33,Tell me your secrets to not checking your portfolio 15 times a day🙏,https://www.reddit.com/r/stocks/comments/jdnq8r/tell_me_your_secrets_to_not_checking_your/,2020-10-30 23:45,170,209,0.92
2qjfk,stocks,jdnsv1,2020-10-18 20:37,"What are you picks for the future of A.I, computers, technology?",https://www.reddit.com/r/stocks/comments/jdnsv1/what_are_you_picks_for_the_future_of_ai_computers/,2020-10-30 23:45,25,18,0.91
2qjfk,stocks,jdo2vo,2020-10-18 20:53,To anyone who has been investing for more than 30 years...,https://www.reddit.com/r/stocks/comments/jdo2vo/to_anyone_who_has_been_investing_for_more_than_30/,2020-10-30 23:45,63,91,0.91
2qjfk,stocks,jdpqib,2020-10-18 22:26,what companies are you investing in ?,https://www.reddit.com/r/stocks/comments/jdpqib/what_companies_are_you_investing_in/,2020-10-30 23:45,25,1,0.57
2qjfk,stocks,jdq559,2020-10-18 22:50,Double bottom TSLA stock?,https://www.reddit.com/r/stocks/comments/jdq559/double_bottom_tsla_stock/,2020-10-30 23:45,62,7,0.67
2qjfk,stocks,jdrihy,2020-10-19 00:16,Investing In Clean Energy Index Funds,https://www.reddit.com/r/stocks/comments/jdrihy/investing_in_clean_energy_index_funds/,2020-10-30 23:45,45,151,0.96
2qjfk,stocks,jdseux,2020-10-19 01:16,TSLA or NIO this week?,https://www.reddit.com/r/stocks/comments/jdseux/tsla_or_nio_this_week/,2020-10-30 23:45,43,30,0.84
2qjfk,stocks,jdu3w4,2020-10-19 03:13,China says its economy grew 4.9% in the third quarter - Great news for Tsla and Nio,https://www.reddit.com/r/stocks/comments/jdu3w4/china_says_its_economy_grew_49_in_the_third/,2020-10-30 23:45,109,26,0.7
2qjfk,stocks,jdu85d,2020-10-19 03:21,Growth stocks or High Div?,https://www.reddit.com/r/stocks/comments/jdu85d/growth_stocks_or_high_div/,2020-10-30 23:45,21,10,0.79
2qjfk,stocks,jdvrp8,2020-10-19 05:19,Is it mostly luck based?,https://www.reddit.com/r/stocks/comments/jdvrp8/is_it_mostly_luck_based/,2020-10-30 23:45,38,10,0.7
2qjfk,stocks,jdwjm6,2020-10-19 06:24,Pelosi/Democrats set a 48hr deadline for corona stimulus... then what?,https://www.reddit.com/r/stocks/comments/jdwjm6/pelosidemocrats_set_a_48hr_deadline_for_corona/,2020-10-30 23:45,28,9,0.85
2qjfk,stocks,jdxptq,2020-10-19 08:08,"r/Stocks Daily Discussion Monday - Oct 19, 2020",https://www.reddit.com/r/stocks/comments/jdxptq/rstocks_daily_discussion_monday_oct_19_2020/,2020-10-30 23:45,266,19,0.81
2qjfk,stocks,jdza20,2020-10-19 10:36,What stocks will do well depending on who is elected to the White House?,https://www.reddit.com/r/stocks/comments/jdza20/what_stocks_will_do_well_depending_on_who_is/,2020-10-30 23:45,25,11,0.69
2qjfk,stocks,je09wl,2020-10-19 11:58,"Apple’s first-day pre-orders for iPhone 12 surpassed the iPhone 11, top analyst says",https://www.reddit.com/r/stocks/comments/je09wl/apples_firstday_preorders_for_iphone_12_surpassed/,2020-10-30 23:45,203,1482,0.96
2qjfk,stocks,je0tug,2020-10-19 12:36,"CVS to hire 15,000 workers as it pushes for pharmacy techs to be allowed to administer vaccines",https://www.reddit.com/r/stocks/comments/je0tug/cvs_to_hire_15000_workers_as_it_pushes_for/,2020-10-30 23:45,60,106,0.94
2qjfk,stocks,je4qvn,2020-10-19 16:18,Southwest or Delta long term?,https://www.reddit.com/r/stocks/comments/je4qvn/southwest_or_delta_long_term/,2020-10-30 23:45,21,0,0.5
2qjfk,stocks,je5fui,2020-10-19 16:53,Why shouldn't i buy Visa right now?,https://www.reddit.com/r/stocks/comments/je5fui/why_shouldnt_i_buy_visa_right_now/,2020-10-30 23:45,39,23,0.87
2qjfk,stocks,je6bar,2020-10-19 17:36,"""GameStop is offering in select areas a Same-Day Delivery service, allowing customers to have their purchases delivered to their door""",https://www.reddit.com/r/stocks/comments/je6bar/gamestop_is_offering_in_select_areas_a_sameday/,2020-10-30 23:45,35,45,0.85
2qjfk,stocks,je6d1a,2020-10-19 17:39,Go ahead. Pitch your best ETF.,https://www.reddit.com/r/stocks/comments/je6d1a/go_ahead_pitch_your_best_etf/,2020-10-30 23:45,61,21,0.78
2qjfk,stocks,je9lpe,2020-10-19 20:08,"Here is a Market Recap for today Mon, Oct 19, 2020. Please enjoy!",https://www.reddit.com/r/stocks/comments/je9lpe/here_is_a_market_recap_for_today_mon_oct_19_2020/,2020-10-30 23:45,78,1008,0.98
2qjfk,stocks,je9n2l,2020-10-19 20:10,HYLN? Why is it trading so low?,https://www.reddit.com/r/stocks/comments/je9n2l/hyln_why_is_it_trading_so_low/,2020-10-30 23:45,22,1,0.67
2qjfk,stocks,je9oob,2020-10-19 20:12,"The ""buy the dip"" conspiracy.",https://www.reddit.com/r/stocks/comments/je9oob/the_buy_the_dip_conspiracy/,2020-10-30 23:45,82,150,0.85
2qjfk,stocks,jeaeqo,2020-10-19 20:46,"It's OK to sell too, you know.",https://www.reddit.com/r/stocks/comments/jeaeqo/its_ok_to_sell_too_you_know/,2020-10-30 23:45,37,56,0.87
2qjfk,stocks,jeaktz,2020-10-19 20:54,I knew it was coming,https://www.reddit.com/r/stocks/comments/jeaktz/i_knew_it_was_coming/,2020-10-30 23:45,95,60,0.91
2qjfk,stocks,jeb67h,2020-10-19 21:24,MSFT severely underpriced?,https://www.reddit.com/r/stocks/comments/jeb67h/msft_severely_underpriced/,2020-10-30 23:45,55,44,0.78
2qjfk,stocks,jebdrn,2020-10-19 21:34,Invested all my life savings ($143k~) in NIO,https://www.reddit.com/r/stocks/comments/jebdrn/invested_all_my_life_savings_143k_in_nio/,2020-10-30 23:45,25,0,0.3
2qjfk,stocks,jedqat,2020-10-19 23:37,Selling majority of my stocks,https://www.reddit.com/r/stocks/comments/jedqat/selling_majority_of_my_stocks/,2020-10-30 23:45,166,386,0.93
2qjfk,stocks,jeeykj,2020-10-20 00:46,Does anyone else just trade for fun?,https://www.reddit.com/r/stocks/comments/jeeykj/does_anyone_else_just_trade_for_fun/,2020-10-30 23:45,99,161,0.9
2qjfk,stocks,jehhug,2020-10-20 03:20,V or SQ?,https://www.reddit.com/r/stocks/comments/jehhug/v_or_sq/,2020-10-30 23:45,27,13,0.93
2qjfk,stocks,jekc5l,2020-10-20 06:54,Logitech EPS up 300% 10/19,https://www.reddit.com/r/stocks/comments/jekc5l/logitech_eps_up_300_1019/,2020-10-30 23:45,26,3,0.8
2qjfk,stocks,jel6lv,2020-10-20 08:06,"r/Stocks Daily Discussion & Technicals Tuesday - Oct 20, 2020",https://www.reddit.com/r/stocks/comments/jel6lv/rstocks_daily_discussion_technicals_tuesday_oct/,2020-10-30 23:45,262,6,0.67
2qjfk,stocks,jelh4w,2020-10-20 08:32,"Positions up 250% to 400% - Is there a point at which you ""should"" sell?",https://www.reddit.com/r/stocks/comments/jelh4w/positions_up_250_to_400_is_there_a_point_at_which/,2020-10-30 23:45,60,8,0.69
2qjfk,stocks,jembw3,2020-10-20 09:46,What are the odds of a Corona 2.0 market crash?,https://www.reddit.com/r/stocks/comments/jembw3/what_are_the_odds_of_a_corona_20_market_crash/,2020-10-30 23:45,28,1,0.67
2qjfk,stocks,jemnw1,2020-10-20 10:15,Microsoft to work with Elon Musk's SpaceX in cloud computing for space customers.,https://www.reddit.com/r/stocks/comments/jemnw1/microsoft_to_work_with_elon_musks_spacex_in_cloud/,2020-10-30 23:45,144,2253,0.98
2qjfk,stocks,jep5zf,2020-10-20 13:10,GM to unveil the Hummer EV during the World Series - (10/20/20),https://www.reddit.com/r/stocks/comments/jep5zf/gm_to_unveil_the_hummer_ev_during_the_world/,2020-10-30 23:45,23,5,0.78
2qjfk,stocks,jeq0j5,2020-10-20 13:59,Is HYLN a good buy right now?,https://www.reddit.com/r/stocks/comments/jeq0j5/is_hyln_a_good_buy_right_now/,2020-10-30 23:45,36,9,0.77
2qjfk,stocks,jeqm2e,2020-10-20 14:30,How much should I be investing,https://www.reddit.com/r/stocks/comments/jeqm2e/how_much_should_i_be_investing/,2020-10-30 23:45,26,1,0.6
2qjfk,stocks,jeqzk6,2020-10-20 14:49,HYLIION Red day after Red Day,https://www.reddit.com/r/stocks/comments/jeqzk6/hyliion_red_day_after_red_day/,2020-10-30 23:45,166,70,0.93
2qjfk,stocks,jerc1a,2020-10-20 15:06,"$RKT is going to CRUSH earnings, and the best part is that it’s not priced into its current share price.",https://www.reddit.com/r/stocks/comments/jerc1a/rkt_is_going_to_crush_earnings_and_the_best_part/,2020-10-30 23:45,54,26,0.73
2qjfk,stocks,jes9to,2020-10-20 15:53,How do you know about stocks before they jump ?,https://www.reddit.com/r/stocks/comments/jes9to/how_do_you_know_about_stocks_before_they_jump/,2020-10-30 23:45,29,2,0.58
2qjfk,stocks,jetkeu,2020-10-20 16:56,"Apple Seeing Strong iPhone 12 Pro Orders in All Markets, Analyst Says",https://www.reddit.com/r/stocks/comments/jetkeu/apple_seeing_strong_iphone_12_pro_orders_in_all/,2020-10-30 23:45,33,65,0.9
2qjfk,stocks,jevb34,2020-10-20 18:20,Buy Tesla now or wait,https://www.reddit.com/r/stocks/comments/jevb34/buy_tesla_now_or_wait/,2020-10-30 23:45,23,6,0.75
2qjfk,stocks,jew9b9,2020-10-20 19:05,Dangers of options trading,https://www.reddit.com/r/stocks/comments/jew9b9/dangers_of_options_trading/,2020-10-30 23:45,27,7,0.69
2qjfk,stocks,jewsbx,2020-10-20 19:31,Do you consider yourself a value investor?,https://www.reddit.com/r/stocks/comments/jewsbx/do_you_consider_yourself_a_value_investor/,2020-10-30 23:45,29,15,0.94
2qjfk,stocks,jewy78,2020-10-20 19:39,Sell ZS,https://www.reddit.com/r/stocks/comments/jewy78/sell_zs/,2020-10-30 23:45,23,12,0.88
2qjfk,stocks,jexj3w,2020-10-20 20:09,"Here is a Market Recap for today Tues, Oct 20, 2020. Please enjoy!",https://www.reddit.com/r/stocks/comments/jexj3w/here_is_a_market_recap_for_today_tues_oct_20_2020/,2020-10-30 23:45,23,185,0.96
2qjfk,stocks,jexmdr,2020-10-20 20:13,Netflix misses on subscriber additions and EPS,https://www.reddit.com/r/stocks/comments/jexmdr/netflix_misses_on_subscriber_additions_and_eps/,2020-10-30 23:45,43,33,0.88
2qjfk,stocks,jey7n9,2020-10-20 20:44,Hyliion News Recap (10/13 through 10/20),https://www.reddit.com/r/stocks/comments/jey7n9/hyliion_news_recap_1013_through_1020/,2020-10-30 23:45,43,45,0.86
2qjfk,stocks,jeytai,2020-10-20 21:15,SNAP STOCK UP 15% on Earnings Beat,https://www.reddit.com/r/stocks/comments/jeytai/snap_stock_up_15_on_earnings_beat/,2020-10-30 23:45,65,61,0.93
2qjfk,stocks,jf2kxb,2020-10-21 00:41,Interesting in Virgin Galactic? Here are some reasons to jump in.,https://www.reddit.com/r/stocks/comments/jf2kxb/interesting_in_virgin_galactic_here_are_some/,2020-10-30 23:45,31,15,0.67
2qjfk,stocks,jf5rip,2020-10-21 04:00,"My Career Class is doing a stocks project, so I thought it would be nice to post it here",https://www.reddit.com/r/stocks/comments/jf5rip/my_career_class_is_doing_a_stocks_project_so_i/,2020-10-30 23:45,25,8,0.66
2qjfk,stocks,jf62ke,2020-10-21 04:22,"JPMorgan Chase takes on Square and PayPal with smartphone card reader, faster deposits for merchants",https://www.reddit.com/r/stocks/comments/jf62ke/jpmorgan_chase_takes_on_square_and_paypal_with/,2020-10-30 23:45,147,1083,0.97
2qjfk,stocks,jf8s5w,2020-10-21 08:06,"r/Stocks Daily Discussion Wednesday - Oct 21, 2020",https://www.reddit.com/r/stocks/comments/jf8s5w/rstocks_daily_discussion_wednesday_oct_21_2020/,2020-10-30 23:45,288,9,0.77
2qjfk,stocks,jfcz0d,2020-10-21 13:39,What do you think about NKLA?,https://www.reddit.com/r/stocks/comments/jfcz0d/what_do_you_think_about_nkla/,2020-10-30 23:45,21,0,0.36
2qjfk,stocks,jfdut8,2020-10-21 14:28,What's happening with Sunrun?,https://www.reddit.com/r/stocks/comments/jfdut8/whats_happening_with_sunrun/,2020-10-30 23:45,24,7,0.66
2qjfk,stocks,jfeogi,2020-10-21 15:10,5g stocks?,https://www.reddit.com/r/stocks/comments/jfeogi/5g_stocks/,2020-10-30 23:45,59,36,0.8
2qjfk,stocks,jffia1,2020-10-21 15:53,McAfee IPO this week -buy?,https://www.reddit.com/r/stocks/comments/jffia1/mcafee_ipo_this_week_buy/,2020-10-30 23:45,23,6,0.87
2qjfk,stocks,jfg1s3,2020-10-21 16:21,What the heck is going on with [w]ork[h]orse?,https://www.reddit.com/r/stocks/comments/jfg1s3/what_the_heck_is_going_on_with_workhorse/,2020-10-30 23:45,24,8,0.7
2qjfk,stocks,jfh4mr,2020-10-21 17:15,Professor is saying stock price growth is a good indicator of company performance,https://www.reddit.com/r/stocks/comments/jfh4mr/professor_is_saying_stock_price_growth_is_a_good/,2020-10-30 23:45,52,28,0.81
