Subreddit_ID,Subreddit_Name,Submission_ID,Submission_CreatedDate,Submission_Title,Submission_URL,Submission_LastFetched,Submission_NumComments,Submission_Score,Submission_UpvoteRatio
2qjfk,stocks,jjp02i,2020-10-28 14:42,Why are stocks dropping? Did Wall Street not expect COVID cases to rise anymore? Was this not expected?,https://www.reddit.com/r/stocks/comments/jjp02i/why_are_stocks_dropping_did_wall_street_not/,2020-10-30 23:45,117,38,0.73
2qjfk,stocks,jjp16n,2020-10-28 14:44,"Apple is quietly building a search rival to Google ahead of the DOJ's landmark antitrust case, according to a report",https://www.reddit.com/r/stocks/comments/jjp16n/apple_is_quietly_building_a_search_rival_to/,2020-10-30 23:45,79,176,0.95
2qjfk,stocks,jjp75d,2020-10-28 14:53,Don’t Panic!,https://www.reddit.com/r/stocks/comments/jjp75d/dont_panic/,2020-10-30 23:45,151,65,0.73
2qjfk,stocks,jjpgu6,2020-10-28 15:07,This sub is a hilarious read on red days,https://www.reddit.com/r/stocks/comments/jjpgu6/this_sub_is_a_hilarious_read_on_red_days/,2020-10-30 23:45,446,2320,0.96
2qjfk,stocks,jjpr58,2020-10-28 15:22,Is NIO gonna be affected by a US crash?,https://www.reddit.com/r/stocks/comments/jjpr58/is_nio_gonna_be_affected_by_a_us_crash/,2020-10-30 23:45,28,9,0.72
2qjfk,stocks,jjpyjx,2020-10-28 15:33,American Airlines,https://www.reddit.com/r/stocks/comments/jjpyjx/american_airlines/,2020-10-30 23:45,30,1,0.67
2qjfk,stocks,jjr430,2020-10-28 16:33,You guys remember RTX?,https://www.reddit.com/r/stocks/comments/jjr430/you_guys_remember_rtx/,2020-10-30 23:45,52,0,0.5
2qjfk,stocks,jjre56,2020-10-28 16:48,Trading Disney stocks,https://www.reddit.com/r/stocks/comments/jjre56/trading_disney_stocks/,2020-10-30 23:45,20,4,0.75
2qjfk,stocks,jjrmr7,2020-10-28 17:00,First Wave dip vs Second Wave dip,https://www.reddit.com/r/stocks/comments/jjrmr7/first_wave_dip_vs_second_wave_dip/,2020-10-30 23:45,64,16,0.78
2qjfk,stocks,jjs9rx,2020-10-28 17:32,How does one get rich on stocks?,https://www.reddit.com/r/stocks/comments/jjs9rx/how_does_one_get_rich_on_stocks/,2020-10-30 23:45,45,0,0.5
2qjfk,stocks,jjtj6d,2020-10-28 18:36,How do people lose money on basic stocks?,https://www.reddit.com/r/stocks/comments/jjtj6d/how_do_people_lose_money_on_basic_stocks/,2020-10-30 23:45,23,0,0.27
2qjfk,stocks,jjwki2,2020-10-28 21:15,What's on your watch list incase we have another crash? Here is mine.,https://www.reddit.com/r/stocks/comments/jjwki2/whats_on_your_watch_list_incase_we_have_another/,2020-10-30 23:45,80,55,0.81
2qjfk,stocks,jjx0p7,2020-10-28 21:39,Gaming stocks,https://www.reddit.com/r/stocks/comments/jjx0p7/gaming_stocks/,2020-10-30 23:45,48,17,0.83
2qjfk,stocks,jjyjrb,2020-10-28 23:12,Any one invested in both NET and FSLY?,https://www.reddit.com/r/stocks/comments/jjyjrb/any_one_invested_in_both_net_and_fsly/,2020-10-30 23:45,36,15,0.82
2qjfk,stocks,jk0lug,2020-10-29 01:07,"Pinterest’s pandemic surge continues, stock jumps more than 25% toward fresh record highs",https://www.reddit.com/r/stocks/comments/jk0lug/pinterests_pandemic_surge_continues_stock_jumps/,2020-10-30 23:45,29,61,0.96
2qjfk,stocks,jk0xuv,2020-10-29 01:27,Mark Zuckerberg just gave Facebook employees all of Thanksgiving week off,https://www.reddit.com/r/stocks/comments/jk0xuv/mark_zuckerberg_just_gave_facebook_employees_all/,2020-10-30 23:45,48,109,0.84
2qjfk,stocks,jk1epy,2020-10-29 01:57,What would be the best play if the market were to crash?,https://www.reddit.com/r/stocks/comments/jk1epy/what_would_be_the_best_play_if_the_market_were_to/,2020-10-30 23:45,39,16,0.77
2qjfk,stocks,jk4qyr,2020-10-29 06:01,How has TQQQ performed better than QQQ if leveraged ETFs don't work long term?,https://www.reddit.com/r/stocks/comments/jk4qyr/how_has_tqqq_performed_better_than_qqq_if/,2020-10-30 23:45,31,27,0.86
2qjfk,stocks,jk622q,2020-10-29 08:06,"r/Stocks Daily Discussion & Options Trading Thursday - Oct 29, 2020",https://www.reddit.com/r/stocks/comments/jk622q/rstocks_daily_discussion_options_trading_thursday/,2020-10-30 23:45,381,11,0.79
2qjfk,stocks,jk6nf1,2020-10-29 09:04,FSLY conference call discussion,https://www.reddit.com/r/stocks/comments/jk6nf1/fsly_conference_call_discussion/,2020-10-30 23:45,22,28,0.9
2qjfk,stocks,jk7idu,2020-10-29 10:23,Google is evidence of this markets greed,https://www.reddit.com/r/stocks/comments/jk7idu/google_is_evidence_of_this_markets_greed/,2020-10-30 23:45,36,10,0.64
2qjfk,stocks,jk7xvy,2020-10-29 11:00,Cramer says oil is uninvestable - not quite,https://www.reddit.com/r/stocks/comments/jk7xvy/cramer_says_oil_is_uninvestable_not_quite/,2020-10-30 23:45,22,1,0.6
2qjfk,stocks,jk9tbv,2020-10-29 13:15,"Pinterest ‘more than delivered the goods’ in its blowout quarter, stock soars",https://www.reddit.com/r/stocks/comments/jk9tbv/pinterest_more_than_delivered_the_goods_in_its/,2020-10-30 23:45,77,266,0.96
2qjfk,stocks,jkabet,2020-10-29 13:46,Felt like gambling. Threw a quick $100 at HTZ this morning. Let's see what happens.,https://www.reddit.com/r/stocks/comments/jkabet/felt_like_gambling_threw_a_quick_100_at_htz_this/,2020-10-30 23:45,22,0,0.4
2qjfk,stocks,jkawoi,2020-10-29 14:21,ANT IPO's Shanghai shares oversubscribed by 872% (approx. $2.83 trillion),https://www.reddit.com/r/stocks/comments/jkawoi/ant_ipos_shanghai_shares_oversubscribed_by_872/,2020-10-30 23:45,28,17,0.73
2qjfk,stocks,jkaya8,2020-10-29 14:24,What are your predictions and strategies on the effects a Biden win would have on clean energy and oil stocks?,https://www.reddit.com/r/stocks/comments/jkaya8/what_are_your_predictions_and_strategies_on_the/,2020-10-30 23:45,58,14,0.78
2qjfk,stocks,jkayqd,2020-10-29 14:24,"Morgan Stanley says 'NIO is a strong EV leader in the making', raises price target by 61%",https://www.reddit.com/r/stocks/comments/jkayqd/morgan_stanley_says_nio_is_a_strong_ev_leader_in/,2020-10-30 23:45,379,1171,0.96
2qjfk,stocks,jkcdhc,2020-10-29 15:41,What Are You Buying?,https://www.reddit.com/r/stocks/comments/jkcdhc/what_are_you_buying/,2020-10-30 23:45,61,8,0.8
2qjfk,stocks,jkd2xy,2020-10-29 16:18,NIO?!?,https://www.reddit.com/r/stocks/comments/jkd2xy/nio/,2020-10-30 23:45,198,112,0.9
2qjfk,stocks,jkf2do,2020-10-29 17:59,Hyliion is crushing me,https://www.reddit.com/r/stocks/comments/jkf2do/hyliion_is_crushing_me/,2020-10-30 23:45,70,12,0.69
2qjfk,stocks,jkga3p,2020-10-29 19:00,Best investing podcasts of 2020,https://www.reddit.com/r/stocks/comments/jkga3p/best_investing_podcasts_of_2020/,2020-10-30 23:45,25,37,0.91
2qjfk,stocks,jkge1o,2020-10-29 19:05,"Wife finally interested in investing! Have a few ideas, looking for others",https://www.reddit.com/r/stocks/comments/jkge1o/wife_finally_interested_in_investing_have_a_few/,2020-10-30 23:45,21,4,0.7
2qjfk,stocks,jkh63v,2020-10-29 19:45,For the Bears - Are you generally pessimistic in your every day life?,https://www.reddit.com/r/stocks/comments/jkh63v/for_the_bears_are_you_generally_pessimistic_in/,2020-10-30 23:45,32,13,0.68
2qjfk,stocks,jkhn18,2020-10-29 20:09,"Alphabet revenue up 14%, crushing expectations",https://www.reddit.com/r/stocks/comments/jkhn18/alphabet_revenue_up_14_crushing_expectations/,2020-10-30 23:45,49,191,0.95
2qjfk,stocks,jkhuzx,2020-10-29 20:21,Sitting back and looking at HYLN around $20 and doing some DD,https://www.reddit.com/r/stocks/comments/jkhuzx/sitting_back_and_looking_at_hyln_around_20_and/,2020-10-30 23:45,42,32,0.92
2qjfk,stocks,jkio6d,2020-10-29 21:01,AAPL price drops 5% as it beats earnings,https://www.reddit.com/r/stocks/comments/jkio6d/aapl_price_drops_5_as_it_beats_earnings/,2020-10-30 23:45,213,641,0.96
2qjfk,stocks,jkipn2,2020-10-29 21:04,Big selloff right before earning call?,https://www.reddit.com/r/stocks/comments/jkipn2/big_selloff_right_before_earning_call/,2020-10-30 23:45,24,7,0.89
2qjfk,stocks,jkl0tt,2020-10-29 23:06,Corsair,https://www.reddit.com/r/stocks/comments/jkl0tt/corsair/,2020-10-30 23:45,40,29,0.88
2qjfk,stocks,jkl1uj,2020-10-29 23:07,Good earning reports and sell off,https://www.reddit.com/r/stocks/comments/jkl1uj/good_earning_reports_and_sell_off/,2020-10-30 23:45,22,3,0.71
2qjfk,stocks,jklnvn,2020-10-29 23:42,Anyone else been buying up BABA in anticipation of the ANT ipo?,https://www.reddit.com/r/stocks/comments/jklnvn/anyone_else_been_buying_up_baba_in_anticipation/,2020-10-30 23:45,48,89,0.94
2qjfk,stocks,jkpn4q,2020-10-30 03:44,Election results: What stocks should go up/ down with a Biden victory?,https://www.reddit.com/r/stocks/comments/jkpn4q/election_results_what_stocks_should_go_up_down/,2020-10-30 23:45,35,8,0.68
2qjfk,stocks,jkrdj9,2020-10-30 05:59,Just asked Fastly sales rep on their website on how different Fastly is compared to Akamai or Clouflare.,https://www.reddit.com/r/stocks/comments/jkrdj9/just_asked_fastly_sales_rep_on_their_website_on/,2020-10-30 23:45,20,19,0.83
2qjfk,stocks,jksqyk,2020-10-30 08:07,"r/Stocks Daily Discussion & Fundamentals Friday Oct 30, 2020",https://www.reddit.com/r/stocks/comments/jksqyk/rstocks_daily_discussion_fundamentals_friday_oct/,2020-10-30 23:45,20,5,1.0
2qhhq,investing,j235ft,2020-09-29 16:53,JPMorgan Chase to pay record $920 million to resolve U.S. investigations into trading practices,https://www.reddit.com/r/investing/comments/j235ft/jpmorgan_chase_to_pay_record_920_million_to/,2020-10-30 23:46,270,2848,0.99
2qhhq,investing,j24hv3,2020-09-29 17:56,Nikola shares slide after second sexual abuse allegation raises questions about GM deal,https://www.reddit.com/r/investing/comments/j24hv3/nikola_shares_slide_after_second_sexual_abuse/,2020-10-30 23:46,82,111,0.94
2qhhq,investing,j25hgn,2020-09-29 18:45,Hydrogen stocks,https://www.reddit.com/r/investing/comments/j25hgn/hydrogen_stocks/,2020-10-30 23:46,45,1,0.55
2qhhq,investing,j2a0fk,2020-09-29 22:44,Renewables are a Race to the Bottom... Why invest in a business with such small margins?,https://www.reddit.com/r/investing/comments/j2a0fk/renewables_are_a_race_to_the_bottom_why_invest_in/,2020-10-30 23:46,40,4,0.54
2qhhq,investing,j2egs5,2020-09-30 03:25,Top EV stocks to buy in right now,https://www.reddit.com/r/investing/comments/j2egs5/top_ev_stocks_to_buy_in_right_now/,2020-10-30 23:46,72,15,0.65
2qhhq,investing,j2gg3u,2020-09-30 05:47,What’s the chances of AAPL reaching above 140+,https://www.reddit.com/r/investing/comments/j2gg3u/whats_the_chances_of_aapl_reaching_above_140/,2020-10-30 23:46,89,3,0.52
2qhhq,investing,j2hmbw,2020-09-30 07:27,Why buy 3M?,https://www.reddit.com/r/investing/comments/j2hmbw/why_buy_3m/,2020-10-30 23:46,48,49,0.83
2qhhq,investing,j2ihyd,2020-09-30 08:45,Legacy Automakers into EV,https://www.reddit.com/r/investing/comments/j2ihyd/legacy_automakers_into_ev/,2020-10-30 23:46,44,8,0.65
2qhhq,investing,j2jq38,2020-09-30 10:36,Thematic Investing ideas related to powerful new long-term trends,https://www.reddit.com/r/investing/comments/j2jq38/thematic_investing_ideas_related_to_powerful_new/,2020-10-30 23:46,28,39,0.78
2qhhq,investing,j2kbob,2020-09-30 11:24,Disney price target,https://www.reddit.com/r/investing/comments/j2kbob/disney_price_target/,2020-10-30 23:46,40,13,0.69
2qhhq,investing,j2kxlc,2020-09-30 12:12,Daily Advice Thread - All basic help or advice questions must be posted here.,https://www.reddit.com/r/investing/comments/j2kxlc/daily_advice_thread_all_basic_help_or_advice/,2020-10-30 23:46,125,15,0.77
2qhhq,investing,j2n649,2020-09-30 14:29,Torn between ETFS. XLE and ICLN,https://www.reddit.com/r/investing/comments/j2n649/torn_between_etfs_xle_and_icln/,2020-10-30 23:46,20,9,0.75
2qhhq,investing,j2o8kw,2020-09-30 15:26,Palantir Discussion Thread,https://www.reddit.com/r/investing/comments/j2o8kw/palantir_discussion_thread/,2020-10-30 23:46,173,196,0.9
2qhhq,investing,j2oike,2020-09-30 15:41,"$TSLA - Jefferies gets ""battery expert"" to analyze technical claims at Battery Day",https://www.reddit.com/r/investing/comments/j2oike/tsla_jefferies_gets_battery_expert_to_analyze/,2020-10-30 23:46,166,599,0.93
2qhhq,investing,j2waa5,2020-09-30 22:31,Monopolies and Peter Lynch on Beating the Market,https://www.reddit.com/r/investing/comments/j2waa5/monopolies_and_peter_lynch_on_beating_the_market/,2020-10-30 23:46,54,14,0.67
2qhhq,investing,j2znnp,2020-10-01 02:02,"13F cloning, A Good Strategy?",https://www.reddit.com/r/investing/comments/j2znnp/13f_cloning_a_good_strategy/,2020-10-30 23:46,30,10,0.67
2qhhq,investing,j308fa,2020-10-01 02:40,I don’t understand this market,https://www.reddit.com/r/investing/comments/j308fa/i_dont_understand_this_market/,2020-10-30 23:46,49,0,0.41
2qhhq,investing,j312e9,2020-10-01 03:36,Why do you think Invitae is Cathy Wood’s second highest conviction pick?,https://www.reddit.com/r/investing/comments/j312e9/why_do_you_think_invitae_is_cathy_woods_second/,2020-10-30 23:46,90,72,0.83
2qhhq,investing,j32az6,2020-10-01 05:07,Explain to me how the tech bubble is similar (or different?) to the housing bubble,https://www.reddit.com/r/investing/comments/j32az6/explain_to_me_how_the_tech_bubble_is_similar_or/,2020-10-30 23:46,85,48,0.76
2qhhq,investing,j37d58,2020-10-01 12:12,Daily Advice Thread - All basic help or advice questions must be posted here.,https://www.reddit.com/r/investing/comments/j37d58/daily_advice_thread_all_basic_help_or_advice/,2020-10-30 23:46,81,14,0.76
2qhhq,investing,j37p3x,2020-10-01 12:34,"Options trading seems to make everyone else money but me, how to improve?",https://www.reddit.com/r/investing/comments/j37p3x/options_trading_seems_to_make_everyone_else_money/,2020-10-30 23:46,22,0,0.37
2qhhq,investing,j37qh4,2020-10-01 12:37,"Initial Jobless Claims for the week ending on September 26: 837,000",https://www.reddit.com/r/investing/comments/j37qh4/initial_jobless_claims_for_the_week_ending_on/,2020-10-30 23:46,244,510,0.96
2qhhq,investing,j38nzz,2020-10-01 13:34,$SPAK: SPAC ETF Debut Today,https://www.reddit.com/r/investing/comments/j38nzz/spak_spac_etf_debut_today/,2020-10-30 23:46,22,5,0.64
2qhhq,investing,j3973i,2020-10-01 14:06,Long term investors: Do we give Ford a chance? New CEO Farley takes the reigns today.,https://www.reddit.com/r/investing/comments/j3973i/long_term_investors_do_we_give_ford_a_chance_new/,2020-10-30 23:46,195,73,0.88
2qhhq,investing,j3bhkb,2020-10-01 16:07,DKNG,https://www.reddit.com/r/investing/comments/j3bhkb/dkng/,2020-10-30 23:46,46,26,0.82
2qhhq,investing,j3g4yn,2020-10-01 20:04,Good Leveraged QQQ ETF-s?,https://www.reddit.com/r/investing/comments/j3g4yn/good_leveraged_qqq_etfs/,2020-10-30 23:46,56,0,0.42
2qhhq,investing,j3h61p,2020-10-01 20:58,Nikola targets critical YouTube accounts in copyright crackdown,https://www.reddit.com/r/investing/comments/j3h61p/nikola_targets_critical_youtube_accounts_in/,2020-10-30 23:46,162,1324,0.97
2qhhq,investing,j3jxke,2020-10-01 23:39,Bonds Vs. High-Yield Savings Account?,https://www.reddit.com/r/investing/comments/j3jxke/bonds_vs_highyield_savings_account/,2020-10-30 23:46,32,22,0.83
2qhhq,investing,j3k8ac,2020-10-01 23:59,Do stocks' prices reflect any intrinsic value anymore?,https://www.reddit.com/r/investing/comments/j3k8ac/do_stocks_prices_reflect_any_intrinsic_value/,2020-10-30 23:46,45,0,0.5
2qhhq,investing,j3ogis,2020-10-02 04:59,what is the end game for this pandemic and economy?,https://www.reddit.com/r/investing/comments/j3ogis/what_is_the_end_game_for_this_pandemic_and_economy/,2020-10-30 23:46,77,31,0.77
2qhhq,investing,j3omb8,2020-10-02 05:10,President of the USA Tests Positive For COVID-19,https://www.reddit.com/r/investing/comments/j3omb8/president_of_the_usa_tests_positive_for_covid19/,2020-10-30 23:46,583,2271,0.94
2qhhq,investing,j3stpk,2020-10-02 11:30,"Electric truck player HYLN ""IPO"" and DD",https://www.reddit.com/r/investing/comments/j3stpk/electric_truck_player_hyln_ipo_and_dd/,2020-10-30 23:46,21,66,0.81
2qhhq,investing,j3tc4u,2020-10-02 12:12,Daily Advice Thread - All basic help or advice questions must be posted here.,https://www.reddit.com/r/investing/comments/j3tc4u/daily_advice_thread_all_basic_help_or_advice/,2020-10-30 23:46,170,12,0.85
2qhhq,investing,j3tu77,2020-10-02 12:49,Nio Reports 154.3% Increase In Q3 Deliveries,https://www.reddit.com/r/investing/comments/j3tu77/nio_reports_1543_increase_in_q3_deliveries/,2020-10-30 23:46,71,141,0.89
2qhhq,investing,j3tvme,2020-10-02 12:51,"Tesla delivered 139,300 vehicles in Q3",https://www.reddit.com/r/investing/comments/j3tvme/tesla_delivered_139300_vehicles_in_q3/,2020-10-30 23:46,153,250,0.91
2qhhq,investing,j3ui4v,2020-10-02 13:31,Where do you see the bottom for oil majors?,https://www.reddit.com/r/investing/comments/j3ui4v/where_do_you_see_the_bottom_for_oil_majors/,2020-10-30 23:46,30,10,0.79
2qhhq,investing,j44t07,2020-10-02 22:54,"Daniel Schreiber of Lemonade seems to have the same level of sharpness as Steve Jobs, Satya Nadella, Bezos and Musk.",https://www.reddit.com/r/investing/comments/j44t07/daniel_schreiber_of_lemonade_seems_to_have_the/,2020-10-30 23:46,60,0,0.5
2qhhq,investing,j45frv,2020-10-02 23:35,Revolutionary investing strategy,https://www.reddit.com/r/investing/comments/j45frv/revolutionary_investing_strategy/,2020-10-30 23:46,38,1,0.52
2qhhq,investing,j47etd,2020-10-03 01:51,35k to 1Million Challenge,https://www.reddit.com/r/investing/comments/j47etd/35k_to_1million_challenge/,2020-10-30 23:46,47,0,0.26
2qhhq,investing,j48a5z,2020-10-03 02:54,Why so much hate on “Robinhood traders”/amateur investors?,https://www.reddit.com/r/investing/comments/j48a5z/why_so_much_hate_on_robinhood_tradersamateur/,2020-10-30 23:46,413,617,0.89
2qhhq,investing,j48esk,2020-10-03 03:04,ETF Leverage - Anything higher than 3x?,https://www.reddit.com/r/investing/comments/j48esk/etf_leverage_anything_higher_than_3x/,2020-10-30 23:46,27,0,0.38
2qhhq,investing,j48prn,2020-10-03 03:27,Who else is looking into uncovered puts? Selling a naked put on Questrade,https://www.reddit.com/r/investing/comments/j48prn/who_else_is_looking_into_uncovered_puts_selling_a/,2020-10-30 23:46,30,0,0.5
2qhhq,investing,j4bq81,2020-10-03 07:34,What are some strategies people use to stay on top of stock performance?,https://www.reddit.com/r/investing/comments/j4bq81/what_are_some_strategies_people_use_to_stay_on/,2020-10-30 23:46,25,0,0.5
2qhhq,investing,j4fkmf,2020-10-03 14:05,Airbnb seeks to raise roughly $3 billion in IPO,https://www.reddit.com/r/investing/comments/j4fkmf/airbnb_seeks_to_raise_roughly_3_billion_in_ipo/,2020-10-30 23:46,441,1335,0.96
2qhhq,investing,j4jjvk,2020-10-03 17:55,Tesla has monopoly like valuations when it is a car company.,https://www.reddit.com/r/investing/comments/j4jjvk/tesla_has_monopoly_like_valuations_when_it_is_a/,2020-10-30 23:46,150,15,0.57
2qhhq,investing,j4l3uu,2020-10-03 19:25,Favorite websites for stock market news/analysis?,https://www.reddit.com/r/investing/comments/j4l3uu/favorite_websites_for_stock_market_newsanalysis/,2020-10-30 23:46,44,112,0.93
2qhhq,investing,j4mhxf,2020-10-03 20:49,Talk me out of (or into keeping) BOND FUNDS,https://www.reddit.com/r/investing/comments/j4mhxf/talk_me_out_of_or_into_keeping_bond_funds/,2020-10-30 23:46,24,13,0.68
2qhhq,investing,j4ngic,2020-10-03 21:48,During next downturn rebalancing some QQQ for TQQQ,https://www.reddit.com/r/investing/comments/j4ngic/during_next_downturn_rebalancing_some_qqq_for_tqqq/,2020-10-30 23:46,20,0,0.38
2qhhq,investing,j4o0qi,2020-10-03 22:23,Growth stocks,https://www.reddit.com/r/investing/comments/j4o0qi/growth_stocks/,2020-10-30 23:46,20,9,0.77
2qhhq,investing,j4o8dr,2020-10-03 22:37,I buy when prices are are low and sell when they gain a little bit. Is this the wrong way to invest?,https://www.reddit.com/r/investing/comments/j4o8dr/i_buy_when_prices_are_are_low_and_sell_when_they/,2020-10-30 23:45,23,0,0.38
2qhhq,investing,j4osoe,2020-10-03 23:14,What's the catch with fidelity mutual funds?,https://www.reddit.com/r/investing/comments/j4osoe/whats_the_catch_with_fidelity_mutual_funds/,2020-10-30 23:45,50,33,0.76
2qhhq,investing,j4q840,2020-10-04 00:53,What is your biggest loss?,https://www.reddit.com/r/investing/comments/j4q840/what_is_your_biggest_loss/,2020-10-30 23:45,116,40,0.77
2qhhq,investing,j4rn03,2020-10-04 02:36,"If you're new to investing, don't trust the ""gurus.""",https://www.reddit.com/r/investing/comments/j4rn03/if_youre_new_to_investing_dont_trust_the_gurus/,2020-10-30 23:45,242,1591,0.96
2qhhq,investing,j4s1a5,2020-10-04 03:07,Lithium Investments,https://www.reddit.com/r/investing/comments/j4s1a5/lithium_investments/,2020-10-30 23:45,20,5,0.67
2qhhq,investing,j4wvvy,2020-10-04 10:33,5% Dividend stock or 5% coupon bond?,https://www.reddit.com/r/investing/comments/j4wvvy/5_dividend_stock_or_5_coupon_bond/,2020-10-30 23:45,28,5,0.59
2qhhq,investing,j4xytz,2020-10-04 12:12,Daily Advice Thread - All basic help or advice questions must be posted here.,https://www.reddit.com/r/investing/comments/j4xytz/daily_advice_thread_all_basic_help_or_advice/,2020-10-30 23:45,92,9,0.69
2qhhq,investing,j5388v,2020-10-04 17:55,Any tool to check combined holdings of several ETFs?,https://www.reddit.com/r/investing/comments/j5388v/any_tool_to_check_combined_holdings_of_several/,2020-10-30 23:45,21,70,0.87
2qhhq,investing,j553ii,2020-10-04 19:40,UPS DD inside...,https://www.reddit.com/r/investing/comments/j553ii/ups_dd_inside/,2020-10-30 23:45,57,425,0.91
2qhhq,investing,j554xh,2020-10-04 19:42,$NFLX - RBC provides an inside look at Netflix's corporate culture,https://www.reddit.com/r/investing/comments/j554xh/nflx_rbc_provides_an_inside_look_at_netflixs/,2020-10-30 23:45,61,237,0.9
2qhhq,investing,j56cqk,2020-10-04 20:51,How I’ve made 7k through trading as an 18 year old.,https://www.reddit.com/r/investing/comments/j56cqk/how_ive_made_7k_through_trading_as_an_18_year_old/,2020-10-30 23:45,23,0,0.1
2qhhq,investing,j5badg,2020-10-05 02:11,Discussion: Is the venerable John Bogle’s bond allocation philosophy misguided for retirement investing?,https://www.reddit.com/r/investing/comments/j5badg/discussion_is_the_venerable_john_bogles_bond/,2020-10-30 23:45,41,4,0.64
2qhhq,investing,j5fmeu,2020-10-05 08:15,Global Clean Energy Funds,https://www.reddit.com/r/investing/comments/j5fmeu/global_clean_energy_funds/,2020-10-30 23:45,29,6,0.69
2qhhq,investing,j5g01o,2020-10-05 08:54,Caterpillar to acquire Weir Oil & Gas for $405M,https://www.reddit.com/r/investing/comments/j5g01o/caterpillar_to_acquire_weir_oil_gas_for_405m/,2020-10-30 23:45,50,597,0.96
2qhhq,investing,j5ic9w,2020-10-05 12:17,Daily Advice Thread - All basic help or advice questions must be posted here.,https://www.reddit.com/r/investing/comments/j5ic9w/daily_advice_thread_all_basic_help_or_advice/,2020-10-30 23:45,187,22,0.76
2qhhq,investing,j5jdia,2020-10-05 13:27,Long on oil Companies and what you can learn from my mistakes,https://www.reddit.com/r/investing/comments/j5jdia/long_on_oil_companies_and_what_you_can_learn_from/,2020-10-30 23:45,45,7,0.61
2qhhq,investing,j5lcuj,2020-10-05 15:23,Barclays says the end of the city is an urban myth,https://www.reddit.com/r/investing/comments/j5lcuj/barclays_says_the_end_of_the_city_is_an_urban_myth/,2020-10-30 23:45,279,851,0.94
2qhhq,investing,j5phst,2020-10-05 18:59,"New-ish to stocks, what are your thoughts on the Nintendo stock?",https://www.reddit.com/r/investing/comments/j5phst/newish_to_stocks_what_are_your_thoughts_on_the/,2020-10-30 23:45,30,0,0.44
2qhhq,investing,j5qay0,2020-10-05 19:41,Honest opinion on NIO?,https://www.reddit.com/r/investing/comments/j5qay0/honest_opinion_on_nio/,2020-10-30 23:45,113,69,0.79
2qhhq,investing,j5t15r,2020-10-05 22:08,Opinions on the upcoming AirBnB IPO,https://www.reddit.com/r/investing/comments/j5t15r/opinions_on_the_upcoming_airbnb_ipo/,2020-10-30 23:45,27,8,0.66
2qhhq,investing,j5u2jn,2020-10-05 23:09,Why isn’t the market down? Unemployment hasn’t been higher in the past decade and many people aren’t receiving unemployment benefits,https://www.reddit.com/r/investing/comments/j5u2jn/why_isnt_the_market_down_unemployment_hasnt_been/,2020-10-30 23:45,46,0,0.43
2qhhq,investing,j5u826,2020-10-05 23:20,Kevin Rudd on China after the US election,https://www.reddit.com/r/investing/comments/j5u826/kevin_rudd_on_china_after_the_us_election/,2020-10-30 23:45,80,63,0.81
2qhhq,investing,j5ua8t,2020-10-05 23:24,Why I believe Lemonade (LMND) has a clear path towards a 10X+ valuation.,https://www.reddit.com/r/investing/comments/j5ua8t/why_i_believe_lemonade_lmnd_has_a_clear_path/,2020-10-30 23:45,25,0,0.49
2qhhq,investing,j5zsdu,2020-10-06 05:53,What are the sources to learn about trading/stock investing?,https://www.reddit.com/r/investing/comments/j5zsdu/what_are_the_sources_to_learn_about_tradingstock/,2020-10-30 23:45,38,43,0.78
2qhhq,investing,j63w8c,2020-10-06 12:10,Daily Advice Thread - All basic help or advice questions must be posted here.,https://www.reddit.com/r/investing/comments/j63w8c/daily_advice_thread_all_basic_help_or_advice/,2020-10-30 23:45,161,15,0.79
2qhhq,investing,j64lql,2020-10-06 13:00,Motley Fool is such BS.,https://www.reddit.com/r/investing/comments/j64lql/motley_fool_is_such_bs/,2020-10-30 23:45,492,1586,0.9
2qhhq,investing,j64tfe,2020-10-06 13:14,Chamath Palihapitiya to take Clover Health public in another SPAC deal worth $3.7 billion,https://www.reddit.com/r/investing/comments/j64tfe/chamath_palihapitiya_to_take_clover_health_public/,2020-10-30 23:45,20,13,0.72
2qhhq,investing,j663t3,2020-10-06 14:33,Slack: What does the future hold?,https://www.reddit.com/r/investing/comments/j663t3/slack_what_does_the_future_hold/,2020-10-30 23:45,33,36,0.81
2qhhq,investing,j687n2,2020-10-06 16:28,Selling Puts for Income?,https://www.reddit.com/r/investing/comments/j687n2/selling_puts_for_income/,2020-10-30 23:45,25,12,0.75
2qhhq,investing,j69pi3,2020-10-06 17:45,AMD vs NVIDIA,https://www.reddit.com/r/investing/comments/j69pi3/amd_vs_nvidia/,2020-10-30 23:45,23,4,0.64
2qhhq,investing,j6d25v,2020-10-06 20:36,"US trade deficit up to $67.1 billion in August, 14-year high",https://www.reddit.com/r/investing/comments/j6d25v/us_trade_deficit_up_to_671_billion_in_august/,2020-10-30 23:45,28,143,0.93
